name,main_category,address,address_ward,address_street,address_city,address_postal_code,address_state,address_country_code,link,coordinates
Natunnagar Jaame Masjid,Mosque,"Natunnagar Jaame Masjid, Natun Nagar Ln, Sarkarpool, Natun Nagar, Benepukur, Maheshtala, West Bengal 700088","Sarkarpool, Natun Nagar, Benepukur",Natun Nagar Ln,Maheshtala,700088,West Bengal,IN,https://www.google.com/maps/place/Natunnagar+Jaame+Masjid/data=!4m7!3m6!1s0x3a027987894b3b19:0xce5dda96002bd8d8!8m2!3d22.5158626!4d88.2931633!16s%2Fg%2F11c4sbxnnp!19sChIJGTtLiYd5AjoR2NgrAJbaXc4?authuser=0&hl=en&rclk=1,"22.5158626,88.29316329999999"
Pachur Mondal Para Ahle- Hadees Jame Masjid,Mosque,"G7QC+33F Pachur Mondal Para Ahle- Hadees Jame Masjid, Panchur Mondal Para, Panchur Mauza, Metiabruz, Maheshtala, West Bengal 700018","Thanderpara Basti, Metiabruz","G7QC+33F, Panchur Mondal Para, Panchur Mauza",Maheshtala,700018,West Bengal,IN,https://www.google.com/maps/place/Pachur+Mondal+Para+Ahle-+Hadees+Jame+Masjid/data=!4m7!3m6!1s0x3a02796b5e7137a7:0xff3fe27524830c63!8m2!3d22.5376896!4d88.2701831!16s%2Fg%2F11b_22x8bg!19sChIJpzdxXmt5AjoRYwyDJHXiP_8?authuser=0&hl=en&rclk=1,"22.5376896,88.2701831"
Markaj Masjid msjd Chandannagar Khan para,Mosque,"Markaj Masjid msjd Chandannagar Khan para, Chandan Nagar, Kolkata, Maheshtala, West Bengal 700140",Chandan Nagar,,"Kolkata, Maheshtala",700140,West Bengal,IN,https://www.google.com/maps/place/Markaj+Masjid+%D9%85%D8%B3%D8%AC%D8%AF+Chandannagar+Khan+para%E2%80%AD/data=!4m7!3m6!1s0x3a027c0f503fd2a9:0x174f30b653d0df70!8m2!3d22.5023675!4d88.240659!16s%2Fg%2F1v1sjms8!19sChIJqdI_UA98AjoRcN_QU7YwTxc?authuser=0&hl=en&rclk=1,"22.5023675,88.240659"
Chalkipara Jumma Masjid (MASJID E AYESHA),Mosque,"Chalkipara Jumma Masjid (MASJID E AYESHA), Subid Ali Rd, Chalkipara, Chatta Kalikapur, Maheshtala, West Bengal 700140","Chalkipara, Chatta Kalikapur",Subid Ali Rd,Maheshtala,700140,West Bengal,IN,https://www.google.com/maps/place/Chalkipara+Jumma+Masjid+%28MASJID+E+AYESHA%29/data=!4m7!3m6!1s0x3a027c73a0801ba3:0xef1e8817f390572c!8m2!3d22.497101!4d88.2442464!16s%2Fg%2F11c0ps860x!19sChIJoxuAoHN8AjoRLFeQ8xeIHu8?authuser=0&hl=en&rclk=1,"22.497101,88.2442464"
Panchur Boro Masjid,Mosque,"G7M8+HP6 Panchur Boro Masjid, Madha, Bidhangarh Ghoshpara, Panchur Mauza, Maheshtala, West Bengal 700066","Bidhangarh Ghoshpara, Panchur Mauza","G7M8+HP6, Madha",Maheshtala,700066,West Bengal,IN,https://www.google.com/maps/place/Panchur+Boro+Masjid/data=!4m7!3m6!1s0x3a02796a38352245:0x4f84cc0dbac21465!8m2!3d22.5344079!4d88.267307!16s%2Fg%2F11b7hj8qph!19sChIJRSI1OGp5AjoRZRTCug3MhE8?authuser=0&hl=en&rclk=1,"22.534407899999998,88.267307"
Mali Para Jame Masjid msjd,Mosque,"G7M7+H7H Mali Para Jame Masjid msjd, Malipara Rd, Bidhangarh Ghoshpara, Panchur Mauza, Maheshtala, West Bengal 700018","Bidhangarh Ghoshpara, Panchur Mauza","G7M7+H7H, Malipara Rd",Maheshtala,700018,West Bengal,IN,https://www.google.com/maps/place/Mali+Para+Jame+Masjid+%D9%85%D8%B3%D8%AC%D8%AF%E2%80%AD/data=!4m7!3m6!1s0x3a0279419d5fd84f:0xe690e9ee62bb523f!8m2!3d22.5339286!4d88.2632294!16s%2Fg%2F1q6j4tpt3!19sChIJT9hfnUF5AjoRP1K7Yu7pkOY?authuser=0&hl=en&rclk=1,"22.5339286,88.2632294"
Masjid-i-Ayesha,Mosque,"G7FF+PHQ Masjid-i-Ayesha, Kata Potti, Makalhati Mauza, Kolkata, Maheshtala, West Bengal 700066","Kata Potti, Makalhati Mauza",G7FF+PHQ,"Kolkata, Maheshtala",700066,West Bengal,IN,https://www.google.com/maps/place/Masjid-i-Ayesha/data=!4m7!3m6!1s0x3a0279651fb543a7:0x71e7be9d89dd6da2!8m2!3d22.5243375!4d88.2739844!16s%2Fg%2F1ygbb7ppj!19sChIJp0O1H2V5AjoRom3diZ2-53E?authuser=0&hl=en&rclk=1,"22.524337499999998,88.27398439999999"
Chakmir Jumma Masjid,Mosque,"G757+8WQ Chakmir Jumma Masjid, Gauripur, Maheshtala, West Bengal 700142",Gauripur,G757+8WQ,Maheshtala,700142,West Bengal,IN,https://www.google.com/maps/place/Chakmir+Jumma+Masjid/data=!4m7!3m6!1s0x3a027be745a9105d:0x8a72b348b3f7d237!8m2!3d22.5083337!4d88.2648552!16s%2Fg%2F1q6jdkm6g!19sChIJXRCpRed7AjoRN9L3s0izcoo?authuser=0&hl=en&rclk=1,"22.508333699999998,88.2648552"
Kankhuli Lal Masjid,Mosque,"Kankhuli Lal Masjid, Kankhuly Rd, Sardar Para, Kankhuli, Santoshpur, Maheshtala, West Bengal 700066","Sardar Para, Kankhuli, Santoshpur",Kankhuly Rd,Maheshtala,700066,West Bengal,IN,https://www.google.com/maps/place/Kankhuli+Lal+Masjid/data=!4m7!3m6!1s0x3a0279e96e5121bb:0xbb8c9c830ac3abb4!8m2!3d22.526756!4d88.2598193!16s%2Fg%2F11nmj535rx!19sChIJuyFRbul5AjoRtKvDCoOcjLs?authuser=0&hl=en&rclk=1,"22.526756,88.25981929999999"
Peerdanga Dargah Masjid,Mosque,"Peerdanga Dargah Masjid, G7G7+QJC, Peerdanga, Metiabruz Kankhuli Rd, Santoshpur Rd, Sardar Para, Panchur Mauza, Kolkata, West Bengal 700066","Sardar Para, Akra, Panchur Mauza","G7G7+QJC, Peerdanga, Metiabruz Kankhuli Rd, Santoshpur Rd","Kolkata, Maheshtala",700066,West Bengal,IN,https://www.google.com/maps/place/Peerdanga+Dargah+Masjid/data=!4m7!3m6!1s0x3a02795d34722d41:0x37a9c33a8ff1600!8m2!3d22.5269275!4d88.2640032!16s%2Fg%2F11bwpyknp7!19sChIJQS1yNF15AjoRABb_qDOcegM?authuser=0&hl=en&rclk=1,"22.5269275,88.26400319999999"
Santoshpur Mollapara Bada Masjid,Mosque,"G799+FM6 Santoshpur Mollapara Bada Masjid, Thandar Para Rd, Thandarpara, Sanpa, Santoshpur, Kolkata, Maheshtala, West Bengal 700140","Thandarpara, Sanpa, Santoshpur","G799+FM6, Thandar Para Rd","Kolkata, Maheshtala",700140,West Bengal,IN,https://www.google.com/maps/place/Santoshpur+Mollapara+Bada+Masjid/data=!4m7!3m6!1s0x3a027961428c8367:0x544290ff5dd725fa!8m2!3d22.5198243!4d88.2696761!16s%2Fg%2F1yg93q4fn!19sChIJZ4OMQmF5AjoR-iXXXf-QQlQ?authuser=0&hl=en&rclk=1,"22.5198243,88.2696761"
AL. Aksha Masjid,Mosque,"AL. Aksha Masjid, Alexa masjid, Akra Station Rd, Jagannathgarh, Kolkata, Maheshtala, West Bengal 700140",Jagannathgarh,"Alexa masjid, Akra Station Rd","Kolkata, Maheshtala",700140,West Bengal,IN,https://www.google.com/maps/place/AL.+Aksha+Masjid/data=!4m7!3m6!1s0x3a0279542621dccb:0x2f345a711562d966!8m2!3d22.514314!4d88.2481363!16s%2Fg%2F11c5rmycsp!19sChIJy9whJlR5AjoRZtliFXFaNC8?authuser=0&hl=en&rclk=1,"22.514314,88.2481363"
Panchur Laskar Para Jame Masjid,Mosque,"Panchur Laskar Para Jame Masjid, Panchur, Laskar Para, Bidhangarh, Metiabruz, Maheshtala, West Bengal 700066","Laskar Para, Bidhangarh, Metiabruz",Panchur,Maheshtala,700066,West Bengal,IN,https://www.google.com/maps/place/Panchur+Laskar+Para+Jame+Masjid/data=!4m7!3m6!1s0x3a027941fa61faa9:0x4942cc554793f309!8m2!3d22.5336366!4d88.2648971!16s%2Fg%2F11b6hyfs33!19sChIJqfph-kF5AjoRCfOTR1XMQkk?authuser=0&hl=en&rclk=1,"22.533636599999998,88.2648971"
Akra Phatak Jama Masjid,Mosque,"G7P4+8J5 Akra Phatak Jama Masjid, Rabindra Nagar Rd, Rabindra Nagar, Panchur Mauza, Maheshtala, West Bengal 700018","Rabindra Nagar, Panchur Mauza","G7P4+8J5, Rabindra Nagar Rd",Maheshtala,700018,West Bengal,IN,https://www.google.com/maps/place/Akra+Phatak+Jama+Masjid/data=!4m7!3m6!1s0x3a0279463259af81:0x351f88c19c611e43!8m2!3d22.5357522!4d88.2566026!16s%2Fg%2F11cjpdr68b!19sChIJga9ZMkZ5AjoRQx5hnMGIHzU?authuser=0&hl=en&rclk=1,"22.535752199999997,88.2566026"
"Masjidul Aksha,South Chatta molla para",Mosque,"F6FV+84Q Masjidul Aksha,South Chatta molla para, Dakhin Chatta Kalikapukur, Maheshtala, West Bengal 700141",Dakhin Chatta Kalikapukur,F6FV+84Q,Maheshtala,700141,West Bengal,IN,"https://www.google.com/maps/place/Masjidul+Aksha,South+Chatta+molla+para/data=!4m7!3m6!1s0x3a027c79333bae81:0x89458ddddf7527f4!8m2!3d22.4733285!4d88.2428745!16s%2Fg%2F11f04nrwzn!19sChIJga47M3l8AjoR9Cd1392NRYk?authuser=0&hl=en&rclk=1","22.473328499999997,88.2428745"
Amlitala jama masjid,Mosque,"G7G4+58W Amlitala jama masjid, Sardar Para, Akra Dutta Bagan, Santoshpur, Maheshtala, West Bengal 700066","Sardar Para, Akra Dutta Bagan, Santoshpur",G7G4+58W,Maheshtala,700066,West Bengal,IN,https://www.google.com/maps/place/Amlitala+jama+masjid/data=!4m7!3m6!1s0x3a02795075599843:0x728b8f257f40cfc9!8m2!3d22.5254862!4d88.2558379!16s%2Fg%2F11c5_gk1_r!19sChIJQ5hZdVB5AjoRyc9AfyWPi3I?authuser=0&hl=en&rclk=1,"22.5254862,88.2558379"
Panch Para Makka Masjid,Mosque,"G7X9+QVR Panch Para Makka Masjid, Panch Para Rd, Metiabruz, Kolkata, West Bengal 700018",Metiabruz,"G7X9+QVR, Panch Para Rd",Kolkata,700018,West Bengal,IN,https://www.google.com/maps/place/Panch+Para+Makka+Masjid/data=!4m7!3m6!1s0x3a02791738dce0db:0x9250b680b95e5a2a!8m2!3d22.5494928!4d88.2696446!16s%2Fg%2F11bcf1nh0w!19sChIJ2-DcOBd5AjoRKlpeuYC2UJI?authuser=0&hl=en&rclk=1,"22.5494928,88.26964459999999"
Masjid E Umar,Mosque,"G66M+7QQ Masjid E Umar, Tentulkuli Road, Atapara, Uludanga, Nangi, Maheshtala, West Bengal 700140","Nangi, Santoshpur","G66M+7QQ, Tentulkuli Road, Atapara, Uludanga",Maheshtala,700140,West Bengal,IN,https://www.google.com/maps/place/Masjid+E+Umar/data=!4m7!3m6!1s0x3a027c1cf26e848d:0xa9bc8cd2d677e90d!8m2!3d22.510709!4d88.2344922!16s%2Fg%2F11dx94q4my!19sChIJjYRu8hx8AjoRDel31tKMvKk?authuser=0&hl=en&rclk=1,"22.510709,88.23449219999999"
Nishchintapu msjid,Mosque,"Nishchintapu msjid, Das Para, Santoshpur, Maheshtala, West Bengal 700140","Das Para, Santoshpur",,Maheshtala,700140,West Bengal,IN,https://www.google.com/maps/place/Nishchintapu+%E0%A6%AE%E0%A6%B8%E0%A6%9C%E0%A6%BF%E0%A6%A6/data=!4m7!3m6!1s0x3a027c1c9d42c951:0xa196457b923914ab!8m2!3d22.5089758!4d88.2346264!16s%2Fg%2F11c6lt_hdq!19sChIJUclCnRx8AjoRqxQ5kntFlqE?authuser=0&hl=en&rclk=1,"22.508975799999998,88.2346264"
Akra Masjid Mess,Mosque,"Akra Masjid Mess, 26/5, Akra Puratan Bazar, Jagannathgarh, Santoshpur, Maheshtala, West Bengal 700140","Akra Puratan Bazar, Jagannathgarh, Santoshpur",26/5,Maheshtala,700140,West Bengal,IN,https://www.google.com/maps/place/Akra+Masjid+Mess/data=!4m7!3m6!1s0x3a027953138de95b:0x1310b1030e8463c3!8m2!3d22.5227769!4d88.2477307!16s%2Fg%2F11bw_749_z!19sChIJW-mNE1N5AjoRw2OEDgOxEBM?authuser=0&hl=en&rclk=1,"22.5227769,88.24773069999999"
Akra Magura Doctor Para Mosque,Mosque,"G67W+7FW Akra Magura Doctor Para Mosque, Jagannathnagar, Akra, Maheshtala, Bengal 700140","Akra, Santoshpur","G67W+7FW, Jagannathnagar",Maheshtala,Bengal 700140,West Bengal,IN,https://www.google.com/maps/place/Akra+Magura+Doctor+Para+Mosque/data=!4m7!3m6!1s0x3a027bff8a154e63:0x48fc64f35a463071!8m2!3d22.5132408!4d88.2461914!16s%2Fg%2F11ddxv5qy_!19sChIJY04Viv97AjoRcTBGWvNk_Eg?authuser=0&hl=en&rclk=1,"22.5132408,88.2461914"
Dighir Paar jama Masjid,Mosque,"Dighir Paar jama Masjid, South Lucky, Itkhola, Kankhuli, Santoshpur, Maheshtala, West Bengal 700066","Itkhola, Kankhuli, Santoshpur",South Lucky,Maheshtala,700066,West Bengal,IN,https://www.google.com/maps/place/Dighir+Paar+jama+Masjid/data=!4m7!3m6!1s0x3a02795a2b6449b1:0xe0866a3127c8a693!8m2!3d22.5214078!4d88.2581119!16s%2Fg%2F11dzts344c!19sChIJsUlkK1p5AjoRk6bIJzFqhuA?authuser=0&hl=en&rclk=1,"22.5214078,88.2581119"
MAKALHATI SK PARA GREEN MASJID added by Sadat Alam,Mosque,"G7QG+W78 MAKALHATI SK PARA GREEN MASJID added by Sadat Alam, Slaughter House Basti, Garden Reach, Maheshtala, West Bengal 700082","Slaughter House Basti, Garden Reach",G7QG+W78,Maheshtala,700082,West Bengal,IN,https://www.google.com/maps/place/MAKALHATI+SK+PARA+GREEN+MASJID+added+by+Sadat+Alam/data=!4m7!3m6!1s0x3a0279129a56ebb5:0xd7e0644411c81f33!8m2!3d22.5412132!4d88.2748442!16s%2Fg%2F11dxddbwwj!19sChIJtetWmhJ5AjoRMx_IEURk4Nc?authuser=0&hl=en&rclk=1,"22.541213199999998,88.27484419999999"
Masjid -e-noor msjd,Mosque,"F6PG+7W3 Masjid -e-noor msjd, Chingripota, Maheshtala, West Bengal 700141",Chingripota,F6PG+7W3,Maheshtala,700141,West Bengal,IN,https://www.google.com/maps/place/Masjid+-e-noor+%D9%85%D8%B3%D8%AC%D8%AF%E2%80%AD/data=!4m7!3m6!1s0x3a027c6a1ac3ee8d:0xed75151cfbcf034!8m2!3d22.48564!4d88.2273123!16s%2Fg%2F11c3k9rxg1!19sChIJje7DGmp8AjoRNPC8z1FR1w4?authuser=0&hl=en&rclk=1,"22.48564,88.2273123"
Khan Para Masjid msjd,Mosque,"Khan Para Masjid msjd, 700140, Jagannathgarh, Maheshtala, West Bengal",Jagannathgarh,700140,Maheshtala,,West Bengal,IN,https://www.google.com/maps/place/Khan+Para+Masjid+%D9%85%D8%B3%D8%AC%D8%AF%E2%80%AD/data=!4m7!3m6!1s0x3a0279561a32f837:0x4829375b12fb1eb1!8m2!3d22.5156421!4d88.2518528!16s%2Fg%2F11dfjswdvc!19sChIJN_gyGlZ5AjoRsR77Els3KUg?authuser=0&hl=en&rclk=1,"22.515642099999997,88.2518528"
Jaita Puraton Masjid,Mosque,"G7F4+P78 Jaita Puraton Masjid, Rd Number I, Sardar Para, Jagannath Nagar, Santoshpur, Bhubaneswar, Maheshtala, West Bengal 751010","Sardar Para, Jagannath Nagar, Santoshpur","G7F4+P78, Rd Number I","Bhubaneswar, Maheshtala",751010,West Bengal,IN,https://www.google.com/maps/place/Jaita+Puraton+Masjid/data=!4m7!3m6!1s0x3a0279507f0e8413:0xf7e1b348e9c4dbc!8m2!3d22.5242791!4d88.2557058!16s%2Fg%2F11c5j700s4!19sChIJE4QOf1B5AjoRvE2cjjQbfg8?authuser=0&hl=en&rclk=1,"22.524279099999998,88.2557058"
Bhangipara Masjid,Mosque,"Bhangipara Masjid, B-318, Ramdas Hati, bhangipara, Maheshtala, West Bengal 700082","Ramdas Hati, bhangipara",B-318,Maheshtala,,West Bengal,IN,https://www.google.com/maps/place/Bhangipara+Masjid/data=!4m7!3m6!1s0x3a0279742ecfb71b:0x17a7a9892bcf1a9f!8m2!3d22.5336125!4d88.282175!16s%2Fg%2F11bw7k2smc!19sChIJG7fPLnR5AjoRnxrPK4mppxc?authuser=0&hl=en&rclk=1,"22.5336125,88.282175"
Mehmanpur Baro Masjid,Mosque,"F6WP+WG4 Mehmanpur Baro Masjid, Memanpur Hospital road,Middey para, Meman Pur,PO.Vivekanandapally, Maheshtala, West Bengal 700139",Balarampur,"F6WP+WG4, Memanpur Hospital road,Middey para, Meman Pur,PO.Vivekanandapally",Maheshtala,700139,West Bengal,IN,https://www.google.com/maps/place/Mehmanpur+Baro+Masjid/data=!4m7!3m6!1s0x3a027df12d0f686f:0xb5f1d0f64a77924f!8m2!3d22.4972513!4d88.2363202!16s%2Fg%2F11f61wgb7p!19sChIJb2gPLfF9AjoRT5J3SvbQ8bU?authuser=0&hl=en&rclk=1,"22.4972513,88.2363202"
Memanpur Masjid-e- Khadija,Mosque,"G62M+3Q9 Memanpur Masjid-e- Khadija, Balarampur, Maheshtala, West Bengal 700140",Balarampur,G62M+3Q9,Maheshtala,700140,West Bengal,IN,https://www.google.com/maps/place/Memanpur+Masjid-e-+Khadija/data=!4m7!3m6!1s0x3a027c10528ad68d:0xaf41e3169e1c937a!8m2!3d22.5001645!4d88.2344815!16s%2Fg%2F11dxg1l11z!19sChIJjdaKUhB8AjoRepMcnhbjQa8?authuser=0&hl=en&rclk=1,"22.5001645,88.2344815"
Akra Krishnanagar Boro Masjid,Mosque,"G68Q+XVC Akra Krishnanagar Boro Masjid, Akra, Krishnanagar, Maheshtala, West Bengal 700140","Akra, Krishnanagar",G68Q+XVC,Maheshtala,700140,West Bengal,IN,https://www.google.com/maps/place/Akra+Krishnanagar+Boro+Masjid/data=!4m7!3m6!1s0x3a027ea9a46a94a3:0x3233c61a187a4b4!8m2!3d22.5174498!4d88.239637!16s%2Fg%2F11f546ymm9!19sChIJo5RqpKl-AjoRtKSHoWE8IwM?authuser=0&hl=en&rclk=1,"22.517449799999998,88.239637"
Mohammadia Jame Masjid,Mosque,"G7GG+7C4 Mohammadia Jame Masjid, South Padirhati, Makalhati Mauza, Maheshtala, West Bengal 700066","South Padirhati, Makalhati Mauza",G7GG+7C4,Maheshtala,700066,West Bengal,IN,https://www.google.com/maps/place/Mohammadia+Jame+Masjid/data=!4m7!3m6!1s0x3a02797ac710358b:0xdb732e49f1342c3b!8m2!3d22.5256321!4d88.2760878!16s%2Fg%2F11g9ghpvxn!19sChIJizUQx3p5AjoROyw08Ukuc9s?authuser=0&hl=en&rclk=1,"22.5256321,88.2760878"
Masjid E Quba,Mosque,"G63P+QGC Masjid E Quba, Molla Para Road, Chandan Nagar, Maheshtala, West Bengal 700140",Chandan Nagar,"G63P+QGC, Molla Para Road",Maheshtala,700140,West Bengal,IN,https://www.google.com/maps/place/Masjid+E+Quba/data=!4m7!3m6!1s0x3a027d37dc0e3bed:0x1a40ce505140b9f0!8m2!3d22.504432!4d88.2362621!16s%2Fg%2F11h2294f1s!19sChIJ7TsO3Dd9AjoR8LlAUVDOQBo?authuser=0&hl=en&rclk=1,"22.504431999999998,88.23626209999999"
Raipur Puratan jame Masjid,Mosque,"F7R2+3M5 Raipur Puratan jame Masjid, Maheshtala, West Bengal 700141",,F7R2+3M5,Maheshtala,700141,West Bengal,IN,https://www.google.com/maps/place/Raipur+Puratan+jame+Masjid/data=!4m7!3m6!1s0x3a027b8cbb7e9ebf:0x38b806ef28c4d4e9!8m2!3d22.4901458!4d88.2517254!16s%2Fg%2F11fxqvz4k8!19sChIJv55-u4x7AjoR6dTEKO8GuDg?authuser=0&hl=en&rclk=1,"22.4901458,88.2517254"
Masjid E Usman msjd,Mosque,"Masjid E Usman msjd, 700140, Uludanga, Maheshtala, West Bengal","Uludanga, Santoshpur",700140,Maheshtala,,West Bengal,IN,https://www.google.com/maps/place/Masjid+E+Usman+%D9%85%D8%B3%D8%AC%D8%AF%E2%80%AD/data=!4m7!3m6!1s0x3a027c03f1c9c3bb:0x90929e66f15376c9!8m2!3d22.5096467!4d88.2404652!16s%2Fg%2F11g691d87_!19sChIJu8PJ8QN8AjoRyXZT8WaekpA?authuser=0&hl=en&rclk=1,"22.509646699999998,88.2404652"
MASJID -E- ABU JAR msjd,Mosque,"F6RP+2HV MASJID -E- ABU JAR msjd, Chakkrisnanagar, Kolkata, Chalkipara, Maheshtala, West Bengal 700141",Chalkipara,"F6RP+2HV, Chakkrisnanagar, Kolkata",Maheshtala,700141,West Bengal,IN,https://www.google.com/maps/place/MASJID+-E-+ABU+JAR+%D9%85%D8%B3%D8%AC%D8%AF%E2%80%AD/data=!4m7!3m6!1s0x3a027c6d58500535:0x4ce542b5b4f807cb!8m2!3d22.4901127!4d88.2364156!16s%2Fg%2F11f126wwkx!19sChIJNQVQWG18AjoRywf4tLVC5Uw?authuser=0&hl=en&rclk=1,"22.490112699999997,88.2364156"
Kazirdanga Jame masjid,Mosque,"G7PJ+FV4 Kazirdanga Jame masjid, Makalhati Mauza, Maheshtala, West Bengal 700024",Makalhati Mauza,G7PJ+FV4,Maheshtala,700024,West Bengal,IN,https://www.google.com/maps/place/Kazirdanga+Jame+masjid/data=!4m7!3m6!1s0x3a027950eeefe2f5:0x2856fe5d5049269f!8m2!3d22.53616!4d88.2823158!16s%2Fg%2F11c453d_30!19sChIJ9eLv7lB5AjoRnyZJUF3-Vig?authuser=0&hl=en&rclk=1,"22.53616,88.28231579999999"
Paharpur Jame Masjid msjd,Mosque,"G7FM+86Q Paharpur Jame Masjid msjd, Calcutta Metropolitan Rd, Rampur, Santoshpur, Maheshtala, West Bengal 700088","Rampur, Santoshpur","G7FM+86Q, Calcutta Metropolitan Rd",Maheshtala,700088,West Bengal,IN,https://www.google.com/maps/place/Paharpur+Jame+Masjid+%D9%85%D8%B3%D8%AC%D8%AF%E2%80%AD/data=!4m7!3m6!1s0x3a027978faa18f55:0x67d3f26b1f9e1a2!8m2!3d22.5233409!4d88.2831167!16s%2Fg%2F1tfh31v0!19sChIJVY-h-nh5AjoRouH5sSY_fQY?authuser=0&hl=en&rclk=1,"22.523340899999997,88.2831167"
Santoshpur Bazarpara Masjid,Mosque,"Santoshpur Bazarpara Masjid, G79G+H66, Santoshpur Station Rd, APJ Abdul Kalam Rd, Rampur, Santoshpur, Maheshtala, West Bengal 700142","Rampur, Santoshpur","G79G+H66, Santoshpur Station Rd, APJ Abdul Kalam Rd",Maheshtala,700142,West Bengal,IN,https://www.google.com/maps/place/Santoshpur+Bazarpara+Masjid/data=!4m7!3m6!1s0x3a027962906b6d67:0x83b10b5a17e4fa54!8m2!3d22.5222235!4d88.2728103!16s%2Fg%2F11hcjzg9ll!19sChIJZ21rkGJ5AjoRVPrkF1oLsYM?authuser=0&hl=en&rclk=1,"22.5222235,88.27281029999999"
Jamadarpara Jumma Masjid,Mosque,"F6HF+PFF Jamadarpara Jumma Masjid, Gumar Gala, Maheshtala, West Bengal 700137",Gumar Gala,F6HF+PFF,Maheshtala,700137,West Bengal,IN,https://www.google.com/maps/place/Jamadarpara+Jumma+Masjid/data=!4m7!3m6!1s0x3a027c432d8fb6c7:0x31543429824300ae!8m2!3d22.4793098!4d88.2236579!16s%2Fg%2F11g021_vfk!19sChIJx7aPLUN8AjoRrgBDgik0VDE?authuser=0&hl=en&rclk=1,"22.4793098,88.22365789999999"
Boga Nowapara Masjid E Muhammad (New Jame Masjid),Mosque,"Boga Nowapara Masjid E Muhammad (New Jame Masjid), 79/381/12, Jagannathgarh, Noapara, Maheshtala, West Bengal 700140","Jagannathgarh, Noapara",79/381/12,Maheshtala,700140,West Bengal,IN,https://www.google.com/maps/place/Boga+Nowapara+Masjid+E+Muhammad+%28New+Jame+Masjid%29/data=!4m7!3m6!1s0x3a027bfe7520fb75:0xc018438083399f8b!8m2!3d22.5134209!4d88.250785!16s%2Fg%2F11dxb0krx2!19sChIJdfsgdf57AjoRi585g4BDGMA?authuser=0&hl=en&rclk=1,"22.5134209,88.250785"
Hussainia Masjid msjd,Mosque,"G69W+3V2 Hussainia Masjid msjd, Akra Station Road,Gaptala, Maheshtala, 700140","Jagannathgarh, Santoshpur","G69W+3V2, Akra Station Road,Gaptala",Maheshtala,700140,West Bengal,IN,https://www.google.com/maps/place/Hussainia+Masjid+%D9%85%D8%B3%D8%AC%D8%AF%E2%80%AD/data=!4m7!3m6!1s0x3a02795523d628c9:0x6e97eed06aeb7ad1!8m2!3d22.517646!4d88.2471562!16s%2Fg%2F11g5zym9dr!19sChIJySjWI1V5AjoR0XrratDul24?authuser=0&hl=en&rclk=1,"22.517646,88.24715619999999"
Masjid-E-Taqwa,Mosque,"Masjid-E-Taqwa, Badamtala Rd, Chunripara, Seba Gram, Ichapur, Maheshtala, West Bengal 700142","Chunripara, Seba Gram, Ichapur",Badamtala Rd,Maheshtala,700142,West Bengal,IN,https://www.google.com/maps/place/Masjid-E-Taqwa/data=!4m7!3m6!1s0x3a027bf5c90de3d1:0xa822fc24a93d4e91!8m2!3d22.495433!4d88.2480481!16s%2Fg%2F11cmszfj5k!19sChIJ0eMNyfV7AjoRkU49qST8Iqg?authuser=0&hl=en&rclk=1,"22.495433,88.24804809999999"
LAL MASJID,Mosque,"LAL MASJID, 700140, Jagannath Nagar, Maheshtala, West Bengal 700141",Jagannath Nagar,700140,Maheshtala,700141,West Bengal,IN,https://www.google.com/maps/place/LAL+MASJID/data=!4m7!3m6!1s0x3a027bfd6fb632bd:0x154f5878008e4d48!8m2!3d22.5149443!4d88.2572129!16s%2Fg%2F11fx91fln5!19sChIJvTK2b_17AjoRSE2OAHhYTxU?authuser=0&hl=en&rclk=1,"22.5149443,88.2572129"
Masjid-E-Baitul Fazl,Mosque,"Masjid-E-Baitul Fazl, P.O, Sardar Para, Jagannath Nagar, Thana, Maheshtala, West Bengal 700140","Sardar Para, Jagannath Nagar, Thana",P.O,Maheshtala,700140,West Bengal,IN,https://www.google.com/maps/place/Masjid-E-Baitul+Fazl/data=!4m7!3m6!1s0x3a027950ba3215b3:0x36d744440db74b0d!8m2!3d22.5219821!4d88.2549539!16s%2Fg%2F11c2yflbqq!19sChIJsxUyulB5AjoRDUu3DURE1zY?authuser=0&hl=en&rclk=1,"22.5219821,88.25495389999999"
Mirpara masjid,Mosque,"G7H5+3JJ Mirpara masjid, Kankhuli, Santoshpur, Maheshtala, Kolkata, West Bengal 700066","Kankhuli, Santoshpur",G7H5+3JJ,"Maheshtala, Kolkata",700066,West Bengal,IN,https://www.google.com/maps/place/Mirpara+masjid/data=!4m7!3m6!1s0x3a027944cf6eddd7:0xf02380af3c189756!8m2!3d22.5277125!4d88.2590156!16s%2Fg%2F11gcmp_27k!19sChIJ191uz0R5AjoRVpcYPK-AI_A?authuser=0&hl=en&rclk=1,"22.5277125,88.2590156"
Alampur New Masjid,Mosque,"G7JP+845 Alampur New Masjid, Alampur Ramdashati Po - Garden Reach, Ps, Rabindra Nagar, Maheshtala, 700024","Ramdas Hati, Rabindra Nagar","G7JP+845, Alampur Ramdashati Po - Garden Reach, Ps",Maheshtala,700024,West Bengal,IN,https://www.google.com/maps/place/Alampur+New+Masjid/data=!4m7!3m6!1s0x3a027957897dee6d:0x84096ca56c4892ad!8m2!3d22.5307609!4d88.2853701!16s%2Fg%2F11rhz5qgdy!19sChIJbe59iVd5AjoRrZJIbKVsCYQ?authuser=0&hl=en&rclk=1,"22.5307609,88.2853701"
Noor Masjid,Mosque,"Noor Masjid, New, Aynal Para Rd, Sanpa, Santoshpur, Maheshtala, Kolkata, West Bengal 700142","Sanpa, Santoshpur","New, Aynal Para Rd","Maheshtala, Kolkata",700142,West Bengal,IN,https://www.google.com/maps/place/Noor+Masjid/data=!4m7!3m6!1s0x3a02795e76e933f9:0xa2f30518b81e912d!8m2!3d22.5219384!4d88.2666104!16s%2Fg%2F11c1ql58f_!19sChIJ-TPpdl55AjoRLZEeuBgF86I?authuser=0&hl=en&rclk=1,"22.5219384,88.26661039999999"
Uttor Jalkhura baro Masjid,Mosque,"G65R+3RF Uttor Jalkhura baro Masjid, Dakghar, Jalkhura, Halderpara, Maheshtala, West Bengal 700141",Darji Para,"G65R+3RF, Dakghar, Jalkhura, Halderpara, Maheshtala",Maheshtala,700141,West Bengal,IN,https://www.google.com/maps/place/Uttor+Jalkhura+baro+Masjid/data=!4m7!3m6!1s0x3a027c06bdd6ba23:0xc28450fc1fc4b70f!8m2!3d22.5076825!4d88.2420597!16s%2Fg%2F11dxd3mcsn!19sChIJI7rWvQZ8AjoRD7fEH_xQhMI?authuser=0&hl=en&rclk=1,"22.507682499999998,88.2420597"
Nungi Chalk Chandul Jame Masjid,Double glazing installer,"Nungi Chalk Chandul Jame Masjid, Nangi, Batanagar, Maheshtala, West Bengal 700140","Nangi, Batanagar",,Maheshtala,700140,West Bengal,IN,https://www.google.com/maps/place/Nungi+Chalk+Chandul+Jame+Masjid/data=!4m7!3m6!1s0x3a027d5744d9c5cd:0x49c49737a1d9b686!8m2!3d22.5098459!4d88.21024!16s%2Fg%2F11gj19g3yk!19sChIJzcXZRFd9AjoRhrbZoTeXxEk?authuser=0&hl=en&rclk=1,"22.5098459,88.21024"
Khanpara Masjid,Mosque,"F6MR+J66 Khanpara Masjid, Chalkipara, Maheshtala, West Bengal 700141",Chalkipara,F6MR+J66,Maheshtala,700141,West Bengal,IN,https://www.google.com/maps/place/Khanpara+Masjid/data=!4m7!3m6!1s0x3a027c714678a64b:0xd1b2e9b3e49a0ad3!8m2!3d22.4840415!4d88.2405115!16s%2Fg%2F11c6013v89!19sChIJS6Z4RnF8AjoR0wqa5LPpstE?authuser=0&hl=en&rclk=1,"22.4840415,88.2405115"
Chatta Ahle Sunnat Karbala Jumma Masjid,Mosque,"F6MV+5GF Chatta Ahle Sunnat Karbala Jumma Masjid, Karbala Ln, Chata Kalikapur, Maheshtala, West Bengal 700140",Chata Kalikapur,"F6MV+5GF, Karbala Ln",Maheshtala,700140,West Bengal,IN,https://www.google.com/maps/place/Chatta+Ahle+Sunnat+Karbala+Jumma+Masjid/data=!4m7!3m6!1s0x3a027c76576385c9:0x38f31d46e594d74b!8m2!3d22.4829488!4d88.2438074!16s%2Fg%2F11fxc11p03!19sChIJyYVjV3Z8AjoRS9eU5UYd8zg?authuser=0&hl=en&rclk=1,"22.4829488,88.2438074"
RAHAMANIA MASJID msjd,Mosque,"RAHAMANIA MASJID msjd, 700140, Jagannathgarh, Maheshtala, West Bengal",Jagannathgarh,700140,Maheshtala,,West Bengal,IN,https://www.google.com/maps/place/RAHAMANIA+MASJID+%D9%85%D8%B3%D8%AC%D8%AF%E2%80%AD/data=!4m7!3m6!1s0x3a027bff778b0f2b:0x50eda11b87a6afd8!8m2!3d22.511935!4d88.2467392!16s%2Fg%2F11fxwbf3_1!19sChIJKw-Ld_97AjoR2K-mhxuh7VA?authuser=0&hl=en&rclk=1,"22.511934999999998,88.2467392"
Masjid e Sumaiyya,Mosque,"G66Q+959 Masjid e Sumaiyya, Sekh Para Road Sekh Para Road, Akra, KRISHNA NAGAR, Maheshtala, West Bengal 700140","Akra, KRISHNA NAGAR","G66Q+959, Sekh Para Road Sekh Para Road",Maheshtala,700140,West Bengal,IN,https://www.google.com/maps/place/Masjid+e+Sumaiyya/data=!4m7!3m6!1s0x3a027c0311affcef:0x12c6389c4d6835b4!8m2!3d22.5109209!4d88.2379822!16s%2Fg%2F11g690ct5y!19sChIJ7_yvEQN8AjoRtDVoTZw4xhI?authuser=0&hl=en&rclk=1,"22.5109209,88.23798219999999"
Bagmari Jame Masjid,Mosque,"G63W+CJ8 Bagmari Jame Masjid, Banerjee Hat, Maheshtala, West Bengal 700140",Banerjee Hat,G63W+CJ8,Maheshtala,,West Bengal,IN,https://www.google.com/maps/place/Bagmari+Jame+Masjid/data=!4m7!3m6!1s0x3a027b82d94f35bd:0x2cd2db270b65f31b!8m2!3d22.5035333!4d88.2465631!16s%2Fg%2F11f9_ddk__!19sChIJvTVP2YJ7AjoRG_NlCyfb0iw?authuser=0&hl=en&rclk=1,"22.503533299999997,88.2465631"
Bata Mosque msjd,Mosque,"Bata Mosque msjd, 9/12, Bata Nagar Officers Quarters, Pal para, Batanagar, Maheshtala, West Bengal 700140","Bata Nagar Officers Quarters, Pal para, Batanagar",9/12,Maheshtala,700140,West Bengal,IN,https://www.google.com/maps/place/Bata+Mosque+%D9%85%D8%B3%D8%AC%D8%AF%E2%80%AD/data=!4m7!3m6!1s0x3a027c27eeedb5af:0x5e66aebc738b0c3b!8m2!3d22.5137736!4d88.2176735!16s%2Fg%2F11cknp80k6!19sChIJr7Xt7id8AjoROwyLc7yuZl4?authuser=0&hl=en&rclk=1,"22.5137736,88.21767349999999"
