name,main_category,address,address_ward,address_street,address_city,address_postal_code,address_state,address_country_code,link,coordinates
Noori Masjid,Mosque,"G63V+Q6C Noori Masjid, Darji Para, Chandan Nagar, Maheshtala, West Bengal 700140","Darji Para, Chandan Nagar",G63V+Q6C,Maheshtala,700140,West Bengal,IN,https://www.google.com/maps/place/Noori+Masjid/data=!4m7!3m6!1s0x3a027d4d41f3efab:0xac47985a4ef321f6!8m2!3d22.5046897!4d88.243364!16s%2Fg%2F11st8fg113!19sChIJq-_zQU19AjoR9iHzTlqYR6w?authuser=0&hl=en&rclk=1,"22.5046897,88.243364"
Shyampur masjid a SAAD,Mosque,"F6R2+FCV Shyampur masjid a SAAD, Shyampur, Budge Budge, Maheshtala, West Bengal 700137","Shyampur, Budge Budge",F6R2+FCV,Maheshtala,700137,West Bengal,IN,https://www.google.com/maps/place/Shyampur+masjid+a+SAAD/data=!4m7!3m6!1s0x3a027d02dbf94d99:0xa11333308cabf08!8m2!3d22.4912489!4d88.2010535!16s%2Fg%2F11q2tbw6v5!19sChIJmU352wJ9AjoRCL_KCDMzEQo?authuser=0&hl=en&rclk=1,"22.4912489,88.2010535"
Kankhuli purbo para banshtala Jame masjid,Mosque,"G7F8+G8C Kankhuli purbo para banshtala Jame masjid, Sardar Para, Kankhuli, puro para, Kolkata, Maheshtala, West Bengal 700140","Sardar Para, Kankhuli, puro para",G7F8+G8C,"Kolkata, Maheshtala",700140,West Bengal,IN,https://www.google.com/maps/place/Kankhuli+purbo+para+banshtala+Jame+masjid/data=!4m7!3m6!1s0x3a027939d437cb61:0x816612ccd3ebab49!8m2!3d22.5235859!4d88.2662757!16s%2Fg%2F11pv6bbl9y!19sChIJYcs31Dl5AjoRSavr08wSZoE?authuser=0&hl=en&rclk=1,"22.5235859,88.2662757"
Khan Para Jama Masjid,Mosque,"G762+Q9X Khan Para Jama Masjid, Uttar, Khan Para, Shyampur, ps, Maheshtala, West Bengal 700140","Khan Para, Shyampur, ps","G762+Q9X, Uttar",Maheshtala,,West Bengal,IN,https://www.google.com/maps/place/Khan+Para+Jama+Masjid/data=!4m7!3m6!1s0x3a027b4e294638cd:0x35ff0543cf8b2ad9!8m2!3d22.5119773!4d88.2509816!16s%2Fg%2F11gr2p4lft!19sChIJzThGKU57AjoR2SqLz0MF_zU?authuser=0&hl=en&rclk=1,"22.511977299999998,88.2509816"
Masjid,Mosque,"Masjid, 268, Behala Flying Club Rd, Parnasree Extension, Kolkata, Maheshtala, West Bengal 700060",Parnasree Extension,"268, Behala Flying Club Rd","Kolkata, Maheshtala",700060,West Bengal,IN,https://www.google.com/maps/place/Masjid/data=!4m7!3m6!1s0x3a027b511b7aedfb:0x135937931e8ab1c9!8m2!3d22.5080781!4d88.2987503!16s%2Fg%2F11svzsqlpd!19sChIJ--16G1F7AjoRybGKHpM3WRM?authuser=0&hl=en&rclk=1,"22.5080781,88.2987503"
Mohammadi Basti masjid,Mosque,"G7MG+GXM Mohammadi Basti masjid, Makalhati Mauza, Kolkata, Maheshtala, West Bengal 700082",Makalhati Mauza,G7MG+GXM,"Kolkata, Maheshtala",700082,West Bengal,IN,https://www.google.com/maps/place/Mohammadi+Basti+masjid/data=!4m7!3m6!1s0x3a0279c903f91fe3:0xe1dfc1ef7de6b51c!8m2!3d22.5334542!4d88.2769814!16s%2Fg%2F11jzv7ltt8!19sChIJ4x_5A8l5AjoRHLXmfe_B3-E?authuser=0&hl=en&rclk=1,"22.533454199999998,88.2769814"
Nangi Dharmatala Masjid,Mosque,"G649+G7P Nangi Dharmatala Masjid, Nangi, Budge Budge, Maheshtala, West Bengal 700140","Nangi, Budge Budge",G649+G7P,Maheshtala,700140,West Bengal,IN,https://www.google.com/maps/place/Nangi+Dharmatala+Masjid/data=!4m7!3m6!1s0x3a027d4275fdc1a1:0x8537cbe2ad9c6f71!8m2!3d22.5063284!4d88.2181991!16s%2Fg%2F11pf2jd8hw!19sChIJocH9dUJ9AjoRcW-creLLN4U?authuser=0&hl=en&rclk=1,"22.506328399999997,88.21819909999999"
Alampur 16 anna Jame masjid,Mosque,"Alampur 16 anna Jame masjid, 16 anna Jame masjid, Ramdas Hati, Garden Reach, Alampur, Maheshtala, West Bengal 700082","Ramdas Hati, Garden Reach",16 anna Jame masjid,"Alampur, Maheshtala",,West Bengal,IN,https://www.google.com/maps/place/Alampur+16+anna+Jame+masjid/data=!4m7!3m6!1s0x3a0279ef500eba87:0xe7b17ed0e940e10!8m2!3d22.5330539!4d88.2881024!16s%2Fg%2F11jzmqx3hk!19sChIJh7oOUO95AjoREA6UDu0Xew4?authuser=0&hl=en&rclk=1,"22.5330539,88.2881024"
Brajala lal jame Masjid,Mosque,"Brajala lal jame Masjid, 205, Lal Masjid Rd, Barajala, Halder Para Basti, Garden Reach, Maheshtala, West Bengal 700066","Barajala, Halder Para Basti, Garden Reach","205, Lal Masjid Rd",Maheshtala,700066,West Bengal,IN,https://www.google.com/maps/place/Brajala+lal+jame+Masjid/data=!4m7!3m6!1s0x3a0279e6e9d65979:0x5d30a54bed0e229f!8m2!3d22.5374583!4d88.2726195!16s%2Fg%2F11vfbb4lmr!19sChIJeVnW6eZ5AjoRnyIO7UulMF0?authuser=0&hl=en&rclk=1,"22.537458299999997,88.27261949999999"
Kamardanga Jame Masjid,Mosque,"G7MH+VHJ Kamardanga Jame Masjid, Kamardanga Rd, Makalhati Mauza, Kolkata, Maheshtala, West Bengal 700082",Makalhati Mauza,"G7MH+VHJ, Kamardanga Rd","Kolkata, Maheshtala",700082,West Bengal,IN,https://www.google.com/maps/place/Kamardanga+Jame+Masjid/data=!4m7!3m6!1s0x3a0279c1152243c3:0xd276fa51dcf7dcdb!8m2!3d22.5347242!4d88.2788885!16s%2Fg%2F11tmyctxg9!19sChIJw0MiFcF5AjoR29z33FH6dtI?authuser=0&hl=en&rclk=1,"22.5347242,88.2788885"
Jaita Puraton Masjid,Mosque,"Jaita Puraton Masjid, Jaita, Mollapara Rd, Sardar Para, Thandarpara, Jagannath Nagar, Santoshpur, Kolkata, Maheshtala, West Bengal 700140","Sardar Para, Thandarpara, Jagannath Nagar, Santoshpur","Jaita, Mollapara Rd","Kolkata, Maheshtala",700140,West Bengal,IN,https://www.google.com/maps/place/Jaita+Puraton+Masjid/data=!4m7!3m6!1s0x3a02799e573543e7:0xc6d789bf1f9b0804!8m2!3d22.5206653!4d88.2690269!16s%2Fg%2F11l1n7dgdw!19sChIJ50M1V555AjoRBAibH7-J18Y?authuser=0&hl=en&rclk=1,"22.520665299999997,88.2690269"
