name,main_category,address,address_ward,address_street,address_city,address_postal_code,address_state,address_country_code,link,coordinates
Masjid Al Quba,Mosque,"Masjid Al Quba, 8, near Bank of India, Sector 35D, Sector 34C, Kutak Bandhan, Kharghar, Navi Mumbai, Maharashtra 410210","Sector 35D, Sector 34C, Kutak Bandhan, Kharghar","8, near Bank of India",Navi Mumbai,410210,Maharashtra,IN,https://www.google.com/maps/place/Masjid+Al+Quba/data=!4m7!3m6!1s0x3be7c153a1aff88d:0xd96d64aa8edf3bab!8m2!3d19.0714001!4d73.0783661!16s%2Fg%2F11rty68sd5!19sChIJjfivoVPB5zsRqzvfjqpkbdk?authuser=0&hl=en&rclk=1,"19.071400099999998,73.0783661"
Sunni masjid,Mosque,"339W+FG6 Sunni masjid, Sector 20, Taloja Panchanand, Taloja Phase 2, Taloja, Navi Mumbai, Maharashtra 410208","Sector 20, Taloja Panchanand, Taloja Phase 2, Taloja",339W+FG6,Navi Mumbai,410208,Maharashtra,IN,https://www.google.com/maps/place/Sunni+masjid/data=!4m7!3m6!1s0x3be7ebefc5b70743:0x6b58128feb65d2b6!8m2!3d19.0686647!4d73.096276!16s%2Fg%2F11s3rdz939!19sChIJQwe3xe_r5zsRttJl648SWGs?authuser=0&hl=en&rclk=1,"19.0686647,73.096276"
Mosque,Mosque,"Mosque, 351, Mahatma Gandhi Rd, Old Panvel, Panvel, Navi Mumbai, Maharashtra 410206","Old Panvel, Panvel","351, Mahatma Gandhi Rd",Navi Mumbai,410206,Maharashtra,IN,https://www.google.com/maps/place/Mosque/data=!4m7!3m6!1s0x3be7e81469684d17:0x89ced6c40be0b14e!8m2!3d18.9869707!4d73.1075707!16s%2Fg%2F11dyz4lxyg!19sChIJF01oaRTo5zsRTrHgC8TWzok?authuser=0&hl=en&rclk=1,"18.9869707,73.1075707"
Jama masjid kharghar sector 35,Mosque,"339J+HW6 Jama masjid kharghar sector 35, Sector 34C, Parsi, Kharghar, Navi Mumbai, Maharashtra 410210","Sector 34C, Parsi, Kharghar",339J+HW6,Navi Mumbai,410210,Maharashtra,IN,https://www.google.com/maps/place/Jama+masjid+kharghar+sector+35/data=!4m7!3m6!1s0x3be7c141cf6452f5:0x5e65cb8ab9443cad!8m2!3d19.0689203!4d73.0822735!16s%2Fg%2F11j00y8xk_!19sChIJ9VJkz0HB5zsRrTxEuYrLZV4?authuser=0&hl=en&rclk=1,"19.0689203,73.0822735"
Masjid-E-Umar,Mosque,"Masjid-E-Umar, Shop No. 2 Plot No C101, Sector 39, Mumbra, Panvel Rd, Taloja, Navi Mumbai, Maharashtra 410208","Taloje Panchanand, Sector 40, Taloja","Shop No. 2 Plot No C101, Sector 39, Mumbra, Panvel Rd",Navi Mumbai,410208,Maharashtra,IN,https://www.google.com/maps/place/Masjid-E-Umar/data=!4m7!3m6!1s0x3be7eb4f79e5f50b:0x53d0b2a76e173069!8m2!3d19.0731769!4d73.0888685!16s%2Fg%2F11r2r440n0!19sChIJC_XleU_r5zsRaTAXbqey0FM?authuser=0&hl=en&rclk=1,"19.0731769,73.0888685"
Sunni Masjid,Mosque,"435J+M2Q Sunni Masjid, Dhansar, Navi Mumbai, Maharashtra 410210",Dhansar,435J+M2Q,Navi Mumbai,410210,Maharashtra,IN,https://www.google.com/maps/place/Sunni+Masjid/data=!4m7!3m6!1s0x3be7c1dd059d05d5:0xeff102aee7f1e0ba!8m2!3d19.109219!4d73.0800971!16s%2Fg%2F11l1cg1ps6!19sChIJ1QWdBd3B5zsRuuDx564C8e8?authuser=0&hl=en&rclk=1,"19.109219,73.0800971"
Ahle Hadees Masjid,Mosque,"4336+R78 Ahle Hadees Masjid, Kiravli Village, Navi Mumbai, Adivali, Maharashtra 410210",Kiravli Village,4336+R78,"Navi Mumbai, Adivali",410210,Maharashtra,IN,https://www.google.com/maps/place/Ahle+Hadees+Masjid/data=!4m7!3m6!1s0x3be7c1bab3c75c9b:0x77b0d549323b49e0!8m2!3d19.1051236!4d73.0613314!16s%2Fg%2F11shw81g7c!19sChIJm1zHs7rB5zsR4Ek7MknVsHc?authuser=0&hl=en&rclk=1,"19.1051236,73.0613314"
Masjid a Rehmaniya,Mosque,"22M8+RJ2 Masjid a Rehmaniya, Nerul East, Sector 20, Nerul, Navi Mumbai, Maharashtra 400706","Nerul East, Sector 20, Nerul",22M8+RJ2,Navi Mumbai,400706,Maharashtra,IN,https://www.google.com/maps/place/Masjid+a+Rehmaniya/data=!4m7!3m6!1s0x3be7c3e282ba9105:0xd62c7652858b7e8e!8m2!3d19.034507!4d73.0165074!16s%2Fg%2F11rv2w_xjn!19sChIJBZG6guLD5zsRjn6LhVJ2LNY?authuser=0&hl=en&rclk=1,"19.034506999999998,73.0165074"
Masjid,Mosque,"Masjid, 43, Sector 6, Sanpada, Navi Mumbai, Maharashtra 400705","Sector 6, Sanpada",43,Navi Mumbai,400705,Maharashtra,IN,https://www.google.com/maps/place/Masjid/data=!4m7!3m6!1s0x3be7c17ef5185919:0x6d2593d174ff9c86!8m2!3d19.0606633!4d73.0146549!16s%2Fg%2F11l2_nmq2d!19sChIJGVkY9X7B5zsRhpz_dNGTJW0?authuser=0&hl=en&rclk=1,"19.060663299999998,73.0146549"
Masjid o madarsa DAR E ARQAM,Mosque,"32GH+C82 Masjid o madarsa DAR E ARQAM, Indira Nagar, MIDC Industrial Area, Turbhe, Navi Mumbai, Maharashtra 400705","Indira Nagar, MIDC Industrial Area, Turbhe",32GH+C82,Navi Mumbai,400705,Maharashtra,IN,https://www.google.com/maps/place/Masjid+o+madarsa+DAR+E+ARQAM/data=!4m7!3m6!1s0x3be7c10182e4155b:0x3490285b9c3e79bb!8m2!3d19.0759795!4d73.0283043!16s%2Fg%2F11jyk7w77c!19sChIJWxXkggHB5zsRu3k-nFsokDQ?authuser=0&hl=en&rclk=1,"19.0759795,73.0283043"
Janta Market Masjid,Mosque,"Janta Market Masjid, 12, Janta Market Rd, Sector 23, Turbhe, Navi Mumbai, Maharashtra 400703","Sector 23, Turbhe","12, Janta Market Rd",Navi Mumbai,400703,Maharashtra,IN,https://www.google.com/maps/place/Janta+Market+Masjid/data=!4m7!3m6!1s0x3be7c15e59339d8b:0xb3682ed1b27361c2!8m2!3d19.070328!4d73.01763!16s%2Fg%2F11twh6649c!19sChIJi50zWV7B5zsRwmFzstEuaLM?authuser=0&hl=en&rclk=1,"19.070328,73.01763"
Bait Ul Rahman Masjid,Mosque,"Plot No, Bait Ul Rahman Masjid, Sai Shraddha, 312, Morning Walkers Association Marg, Nerul East, Sector 21, Nerul, Navi Mumbai, Maharashtra 400706","Nerul East, Sector 21, Nerul","Plot No, Sai Shraddha, 312, Morning Walkers Association Marg",Navi Mumbai,400706,Maharashtra,IN,https://www.google.com/maps/place/Bait+Ul+Rahman+Masjid/data=!4m7!3m6!1s0x3be7c334ff2145c5:0xc60afc2cca18df10!8m2!3d19.0270299!4d73.0198843!16s%2Fg%2F11fmd6x291!19sChIJxUUh_zTD5zsREN8Yyiz8CsY?authuser=0&hl=en&rclk=1,"19.0270299,73.0198843"
