name,main_category,address,address_ward,address_street,address_city,address_postal_code,address_state,address_country_code,link,coordinates
Sunni Takka Masjid,Mosque,"X4J9+M5W Sunni Takka Masjid, Takka Colony, Panvel, Navi Mumbai, Maharashtra 410206","Takka Colony, Panvel",X4J9+M5W,Navi Mumbai,410206,Maharashtra,IN,https://www.google.com/maps/place/Sunni+Takka+Masjid/data=!4m7!3m6!1s0x3be7e86e04da4623:0x6c2a7ee6f0271d93!8m2!3d18.9817399!4d73.1179404!16s%2Fg%2F12hpk13kv!19sChIJI0baBG7o5zsRkx0n8OZ-Kmw?authuser=0&hl=en&rclk=1,"18.9817399,73.1179404"
Islamic Peace Foundation (Ahle Hadees),Mosque,"Islamic Peace Foundation (Ahle Hadees), 51, Sector 18, Kopar Khairane, Navi Mumbai, Maharashtra 400709","Sector 18, Kopar Khairane",51,Navi Mumbai,400709,Maharashtra,IN,https://www.google.com/maps/place/Islamic+Peace+Foundation+%28Ahle+Hadees%29/data=!4m7!3m6!1s0x3be7c0da0a0d8bb3:0xde6eefc5dc8130ed!8m2!3d19.1034041!4d73.0027078!16s%2Fg%2F11cn6jdrb7!19sChIJs4sNCtrA5zsR7TCB3MXvbt4?authuser=0&hl=en&rclk=1,"19.1034041,73.0027078"
Ayesha Masjid,Mosque,"Ayesha Masjid, 410206, Old Panvel, Panvel, Navi Mumbai, Maharashtra 410206","Kacchi Mohalla, Old Panvel, Panvel",410206,Navi Mumbai,410206,Maharashtra,IN,https://www.google.com/maps/place/Ayesha+Masjid/data=!4m7!3m6!1s0x3be7e8167018e213:0x19b19534e7b0fc7d!8m2!3d18.9893963!4d73.1047209!16s%2Fg%2F11cs3bh2yc!19sChIJE-IYcBbo5zsRffyw5zSVsRk?authuser=0&hl=en&rclk=1,"18.9893963,73.1047209"
Hari masjid,Mosque,"Hari masjid, SEC# 30 Owe, Khargar Navi Mumbai SEC# 30 Owe, Khargar, Shahid Sukhdev Singh Marg, Owe Village, Sector 35E, Kharghar, Navi Mumbai, Maharashtra 410210","Owe Village, Sector 35E, Kharghar","SEC# 30 Owe, Khargar Navi Mumbai SEC# 30 Owe, Khargar, Shahid Sukhdev Singh Marg",Navi Mumbai,410210,Maharashtra,IN,https://www.google.com/maps/place/Hari+masjid/data=!4m7!3m6!1s0x3be7c1f1802632e7:0xbe48558c07e6b5f7!8m2!3d19.0658971!4d73.0702343!16s%2Fg%2F11c1mrmbt8!19sChIJ5zImgPHB5zsR97XmB4xVSL4?authuser=0&hl=en&rclk=1,"19.0658971,73.0702343"
Madina masjid,Mosque,"4263+P8W Madina masjid, Savoli, Sector 1, Ghansoli, Navi Mumbai, Maharashtra 400701","Savoli, Sector 1, Ghansoli",4263+P8W,Navi Mumbai,,Maharashtra,IN,https://www.google.com/maps/place/Madina+masjid/data=!4m7!3m6!1s0x3be7c11a2d7bdb85:0x414d491c1d905bb2!8m2!3d19.1118725!4d73.003332!16s%2Fg%2F11kptqz5c4!19sChIJhdt7LRrB5zsRsluQHRxJTUE?authuser=0&hl=en&rclk=1,"19.1118725,73.003332"
Lakda Bakhar Masjid/Madrasa,Mosque,"Lakda Bakhar Masjid/Madrasa, 2055, Paushibai R Madhvi Marg, Sector 1, Airoli, Navi Mumbai, Maharashtra 400708","Sector 1, Airoli","2055, Paushibai R Madhvi Marg",Navi Mumbai,400708,Maharashtra,IN,https://www.google.com/maps/place/Lakda+Bakhar+Masjid%2FMadrasa/data=!4m7!3m6!1s0x3be7bf4a069b2ae7:0x348800a839363aac!8m2!3d19.1651667!4d72.9987302!16s%2Fg%2F11c1ph62nj!19sChIJ5yqbBkq_5zsRrDo2OagAiDQ?authuser=0&hl=en&rclk=1,"19.1651667,72.9987302"
Madni Masjid Taloja,Mosque,"339Q+723 Madni Masjid Taloja, Taloja Panchanand, Sector 40, Taloja, Navi Mumbai, Maharashtra 410208","Taloja Panchanand, Sector 40, Taloja",339Q+723,Navi Mumbai,410208,Maharashtra,IN,https://www.google.com/maps/place/Madni+Masjid+Taloja/data=!4m7!3m6!1s0x3be7c1fd7ce37bc3:0xce32c11a5ab36062!8m2!3d19.0681368!4d73.0875433!16s%2Fg%2F11cmshp29f!19sChIJw3vjfP3B5zsRYmCzWhrBMs4?authuser=0&hl=en&rclk=1,"19.068136799999998,73.0875433"
Masjid Wa Madrasa Darussalam,Mosque,"32CC+26M Masjid Wa Madrasa Darussalam, Haribaba Sadhu Gaikwad Marg, Turbhe MIDC, Turbhe, Navi Mumbai, Maharashtra 400705","Turbhe MIDC, Turbhe","32CC+26M, Haribaba Sadhu Gaikwad Marg",Navi Mumbai,400705,Maharashtra,IN,https://www.google.com/maps/place/Masjid+Wa+Madrasa+Darussalam/data=!4m7!3m6!1s0x3be7c16bd774a517:0x868b569df3e1a049!8m2!3d19.0700798!4d73.0205413!16s%2Fg%2F11ddt38r94!19sChIJF6V012vB5zsRSaDh851Wi4Y?authuser=0&hl=en&rclk=1,"19.0700798,73.02054129999999"
Faizan E Basheban Masjid,Mosque,"15, Belapur, Faizan E Basheban Masjid, A2-13, Raintree Marg, Sector 2, CBD Belapur, Navi Mumbai, Maharashtra 400614","Sector 2, CBD Belapur","15, Belapur, A2-13, Raintree Marg",Navi Mumbai,400614,Maharashtra,IN,https://www.google.com/maps/place/Faizan+E+Basheban+Masjid/data=!4m7!3m6!1s0x3be7c3b4d32c03d9:0xd0f660eeb049e0b1!8m2!3d19.0281294!4d73.04049!16s%2Fg%2F11b7yrlxpn!19sChIJ2QMs07TD5zsRseBJsO5g9tA?authuser=0&hl=en&rclk=1,"19.028129399999997,73.04048999999999"
MASJID E GARIB NAWAZ,Mosque,"X4R9+8RX MASJID E GARIB NAWAZ, Forest Colony, Panvel, Navi Mumbai, Maharashtra 410206","Forest Colony, Panvel",X4R9+8RX,Navi Mumbai,410206,Maharashtra,IN,https://www.google.com/maps/place/MASJID+E+GARIB+NAWAZ/data=!4m7!3m6!1s0x3be7e9563ee10685:0x47976f89c0cdffe1!8m2!3d18.9908658!4d73.1196007!16s%2Fg%2F11gtzp_nf6!19sChIJhQbhPlbp5zsR4f_NwIlvl0c?authuser=0&hl=en&rclk=1,"18.990865799999998,73.11960069999999"
Maryam Masjid,Mosque,"Maryam Masjid, Suraj Nagar, bhoir compound, Thakur Pada Rd, Kiravli Village, Navi Mumbai, Adivali, Maharashtra 410210",Kiravli Village,"Suraj Nagar, bhoir compound, Thakur Pada Rd","Navi Mumbai, Adivali",410210,Maharashtra,IN,https://www.google.com/maps/place/Maryam+Masjid/data=!4m7!3m6!1s0x3be7c04ca492172d:0xe40d07f5dd2185a2!8m2!3d19.1031417!4d73.0576742!16s%2Fg%2F11f3rtnylf!19sChIJLReSpEzA5zsRooUh3fUHDeQ?authuser=0&hl=en&rclk=1,"19.1031417,73.0576742"
Masjid E-Bilal,Mosque,"32H9+VX3 Masjid E-Bilal, Turbhe Station (E, Thane - Belapur Rd, Shiv Shakti Nagar, Turbhe Store, Turbhe, Navi Mumbai, Maharashtra 400705","Shiv Shakti Nagar, Turbhe Store, Turbhe MIDC, Turbhe","32H9+VX3, Turbhe Station (E, Thane - Belapur Rd",Navi Mumbai,400705,Maharashtra,IN,https://www.google.com/maps/place/Masjid+E-Bilal/data=!4m7!3m6!1s0x3be7c1144b1d110b:0x17dbed84126c89ab!8m2!3d19.0796415!4d73.019919!16s%2Fg%2F11c1qsj__j!19sChIJCxEdSxTB5zsRq4lsEoTt2xc?authuser=0&hl=en&rclk=1,"19.079641499999997,73.019919"
Mahape Masjid,Mosque,"Mahape Masjid, A-580, Cross No 18 Road, MIDC Industrial Area, Mahape, Navi Mumbai, Maharashtra 400701","MIDC Industrial Area, Mahape","A-580, Cross No 18 Road",Navi Mumbai,400701,Maharashtra,IN,https://www.google.com/maps/place/Mahape+Masjid/data=!4m7!3m6!1s0x3be7c0ee2ecac943:0x1dc6c7034c7ec33b!8m2!3d19.1142038!4d73.0283189!16s%2Fg%2F11d_yvccwp!19sChIJQ8nKLu7A5zsRO8N-TAPHxh0?authuser=0&hl=en&rclk=1,"19.1142038,73.0283189"
Islamiya Masjid Taloja,Mosque,"339Q+R7V Islamiya Masjid Taloja, Mannan colony, Taloja Panchanand, Sector 40, Taloja, Navi Mumbai, Maharashtra 410208","Mannan colony, Taloja Panchanand, Sector 40, Taloja",339Q+R7V,Navi Mumbai,410208,Maharashtra,IN,https://www.google.com/maps/place/Islamiya+Masjid+Taloja/data=!4m7!3m6!1s0x3be7ea07f0a55c05:0xdbd3ebe226997f5b!8m2!3d19.0696211!4d73.08818!16s%2Fg%2F11cjpwf_dl!19sChIJBVyl8Afq5zsRW3-ZJuLr09s?authuser=0&hl=en&rclk=1,"19.0696211,73.08818"
Masjid-E-Ayesha Taloja,Mosque,"Plot No - 162, Masjid-E-Ayesha Taloja, Ground floor, Aakar residency, Sector 2, Taloja Phase 1 Rd, Petali, Taloja, Navi Mumbai, Maharashtra 410208","Petali, Taloja Panchanand, Taloja","Plot No - 162, Ground floor, Aakar residency, Sector 2, Taloja Phase 1 Rd",Navi Mumbai,410208,Maharashtra,IN,https://www.google.com/maps/place/Masjid-E-Ayesha+Taloja/data=!4m7!3m6!1s0x3be7eb02d0bf6ee3:0x15b7c20dcff4ce23!8m2!3d19.0801115!4d73.0913614!16s%2Fg%2F11fl5mb0nk!19sChIJ426_0ALr5zsRI870zw3CtxU?authuser=0&hl=en&rclk=1,"19.080111499999997,73.0913614"
"Madinah Masjid, Sector 21",Mosque,"Madinah Masjid, Sector 21, A2-297, Sector 21, Turbhe, Navi Mumbai, Maharashtra 400703","Sector 21, Turbhe",A2-297,Navi Mumbai,400703,Maharashtra,IN,"https://www.google.com/maps/place/Madinah+Masjid,+Sector+21/data=!4m7!3m6!1s0x3be7c1d83d743f07:0xb64ac52519dc1be6!8m2!3d19.0718066!4d73.0141601!16s%2Fg%2F11j2w7f04_!19sChIJBz90PdjB5zsR5hvcGSXFSrY?authuser=0&hl=en&rclk=1","19.0718066,73.0141601"
Sunni Masjid,Mosque,"X4J8+V48 Sunni Masjid, MCCH Society, Panvel, Navi Mumbai, Maharashtra 410206","MCCH Society, Panvel",X4J8+V48,Navi Mumbai,410206,Maharashtra,IN,https://www.google.com/maps/place/Sunni+Masjid/data=!4m7!3m6!1s0x3be7e86d96ecb883:0xfc8a96fa60547e63!8m2!3d18.9821731!4d73.115332!16s%2Fg%2F11b5yvhvtf!19sChIJg7jslm3o5zsRY35UYPqWivw?authuser=0&hl=en&rclk=1,"18.9821731,73.115332"
Noorani Masjid Taloja,Mosque,"Noorani Masjid Taloja, Taloja Panchanand, Sector 40, Taloja, Navi Mumbai, Maharashtra 410208","Taloja Panchanand, Sector 40, Taloja",,Navi Mumbai,410208,Maharashtra,IN,https://www.google.com/maps/place/Noorani+Masjid+Taloja/data=!4m7!3m6!1s0x3be7ea07cf9b20a5:0x1c654a07caaa8502!8m2!3d19.0697858!4d73.0900129!16s%2Fg%2F11c1g668wp!19sChIJpSCbzwfq5zsRAoWqygdKZRw?authuser=0&hl=en&rclk=1,"19.0697858,73.09001289999999"
Masjid APMC VASHI MARKET,Mosque,"32G5+WR7 Masjid APMC VASHI MARKET, APMC Market, Sector 19, Vashi, Navi Mumbai, Maharashtra 400703","APMC Market, Sector 19, Vashi",32G5+WR7,Navi Mumbai,400703,Maharashtra,IN,https://www.google.com/maps/place/Masjid+APMC+VASHI+MARKET/data=!4m7!3m6!1s0x3be7c138ea0d6965:0x37adda8f22638567!8m2!3d19.0772823!4d73.0095326!16s%2Fg%2F11f4m5dl8x!19sChIJZWkN6jjB5zsRZ4VjIo_arTc?authuser=0&hl=en&rclk=1,"19.0772823,73.0095326"
Noori Masjid & Madrasa Nooriya,Mosque,"Noori Masjid & Madrasa Nooriya, 13-3, Turbhe Belapur Rd, MIDC Industrial Area, Sanpada, Navi Mumbai, Maharashtra 400706","MIDC Industrial Area, Sanpada","13-3, Turbhe Belapur Rd",Navi Mumbai,400706,Maharashtra,IN,https://www.google.com/maps/place/Noori+Masjid+%26+Madrasa+Nooriya/data=!4m7!3m6!1s0x3be7c17062d93091:0x8455a579a1827ae4!8m2!3d19.0659158!4d73.0317158!16s%2Fg%2F11c5_yk74y!19sChIJkTDZYnDB5zsR5HqCoXmlVYQ?authuser=0&hl=en&rclk=1,"19.0659158,73.0317158"
Masjid,Mosque,"35J3+C5Q Masjid, Taloja, Navi Mumbai, Maharashtra 410208",Taloja,35J3+C5Q,Navi Mumbai,410208,Maharashtra,IN,https://www.google.com/maps/place/Masjid/data=!4m7!3m6!1s0x3be7ebc3f47213a1:0x7077d122136e92b4!8m2!3d19.0810832!4d73.1529945!16s%2Fg%2F1q5hrg600!19sChIJoRNy9MPr5zsRtJJuEyLRd3A?authuser=0&hl=en&rclk=1,"19.0810832,73.15299449999999"
Vadghar Jama Masjid,Mosque,"X4M3+MVF Vadghar Jama Masjid, Vadghar, Panvel, Navi Mumbai, Maharashtra 410206","Vadghar, Panvel",X4M3+MVF,Navi Mumbai,410206,Maharashtra,IN,https://www.google.com/maps/place/Vadghar+Jama+Masjid/data=!4m7!3m6!1s0x3be7e811114dd695:0x172eabc99394dd76!8m2!3d18.9841982!4d73.1046805!16s%2Fg%2F11f3wxpfgv!19sChIJldZNERHo5zsRdt2Uk8mrLhc?authuser=0&hl=en&rclk=1,"18.984198199999998,73.1046805"
Garib Nawaz Masjid,Mosque,"Garib Nawaz Masjid, 1353, KKR Rd, Turbhe Store, Turbhe MIDC, Turbhe, Navi Mumbai, Maharashtra 400705","Turbhe Store, Turbhe MIDC, Turbhe","1353, KKR Rd",Navi Mumbai,400705,Maharashtra,IN,https://www.google.com/maps/place/Garib+Nawaz+Masjid/data=!4m7!3m6!1s0x3be7c10bbcaec543:0x7922794d7d912524!8m2!3d19.0765852!4d73.0206396!16s%2Fg%2F11gy9k_83n!19sChIJQ8WuvAvB5zsRJCWRfU15Ink?authuser=0&hl=en&rclk=1,"19.0765852,73.0206396"
Masjid-e-Munawwarah,Mosque,"Masjid-e-Munawwarah, 181, Thane - Belapur Rd, Turbhe Store, MIDC Industrial Area, Turbhe, Navi Mumbai, Maharashtra 400703","Turbhe Store, MIDC Industrial Area, Turbhe","181, Thane - Belapur Rd",Navi Mumbai,400703,Maharashtra,IN,https://www.google.com/maps/place/Masjid-e-Munawwarah/data=!4m7!3m6!1s0x3be7c115128145c9:0x67f0b1e1ab78fe8c!8m2!3d19.0775681!4d73.0185549!16s%2Fg%2F11c2cly5lp!19sChIJyUWBEhXB5zsRjP54q-Gx8Gc?authuser=0&hl=en&rclk=1,"19.0775681,73.0185549"
Yunus Masjid Taloja,Mosque,"33CQ+M7G Yunus Masjid Taloja, Taloja Panchanand, Sector 40, Taloja, Navi Mumbai, Maharashtra 410208","Taloja Panchanand, Sector 40, Taloja",33CQ+M7G,Navi Mumbai,410208,Maharashtra,IN,https://www.google.com/maps/place/Yunus+Masjid+Taloja/data=!4m7!3m6!1s0x3be7ea08193b9da7:0xd8981bba08fa4a7f!8m2!3d19.0716802!4d73.0882078!16s%2Fg%2F11b_3cj6hk!19sChIJp507GQjq5zsRf0r6CLobmNg?authuser=0&hl=en&rclk=1,"19.0716802,73.08820779999999"
Jama Masjid Taloja (R.A.F. Camp),Mosque,"Jama Masjid Taloja (R.A.F. Camp), 410208, Sector 38, Taloja, Navi Mumbai, Maharashtra 410208","Sector 38, Taloja",410208,Navi Mumbai,410208,Maharashtra,IN,https://www.google.com/maps/place/Jama+Masjid+Taloja+%28R.A.F.+Camp%29/data=!4m7!3m6!1s0x3be7c1e1e523af71:0x601e2e7b18131d9a!8m2!3d19.0769921!4d73.0871422!16s%2Fg%2F11cpghky8y!19sChIJca8j5eHB5zsRmh0TGHsuHmA?authuser=0&hl=en&rclk=1,"19.0769921,73.0871422"
Masjid-e-Taqwa,Mosque,"Masjid-e-Taqwa, WING-B2, Kamaladevi Birajdar Marg, Vighnahar Co-Operative Housing Society, Sector 21, Nerul, Navi Mumbai, Maharashtra 400706","Vighnahar Co-Operative Housing Society, Sector 21, Nerul","WING-B2, Kamaladevi Birajdar Marg",Navi Mumbai,400706,Maharashtra,IN,https://www.google.com/maps/place/Masjid-e-Taqwa/data=!4m7!3m6!1s0x3be7c3d04b53b7db:0xf44acd0a7960fd1f!8m2!3d19.0333999!4d73.0209795!16s%2Fg%2F11ghnqrzd_!19sChIJ27dTS9DD5zsRH_1geQrNSvQ?authuser=0&hl=en&rclk=1,"19.0333999,73.0209795"
Quresh Masjid,Mosque,"32FC+6HW Quresh Masjid, Turbhe MIDC, Turbhe, Navi Mumbai, Maharashtra 400705","Turbhe MIDC, Turbhe",32FC+6HW,Navi Mumbai,400705,Maharashtra,IN,https://www.google.com/maps/place/Quresh+Masjid/data=!4m7!3m6!1s0x3be7c16b74f34e2b:0xa312e89638d03dee!8m2!3d19.0731011!4d73.0214645!16s%2Fg%2F11dzvty0q6!19sChIJK07zdGvB5zsR7j3QOJboEqM?authuser=0&hl=en&rclk=1,"19.0731011,73.0214645"
Sunni Muhammadiya Masjid,Mosque,"Sunni Muhammadiya Masjid, Palaspe Phata, Panvel, Navi Mumbai, Maharashtra 410221","Palaspe Phata, Panvel",,Navi Mumbai,410221,Maharashtra,IN,https://www.google.com/maps/place/Sunni+Muhammadiya+Masjid/data=!4m7!3m6!1s0x3be7e90aa14cd521:0x9930cc61557d235d!8m2!3d18.9721615!4d73.1294121!16s%2Fg%2F11n7jmhcm1!19sChIJIdVMoQrp5zsRXSN9VWHMMJk?authuser=0&hl=en&rclk=1,"18.9721615,73.1294121"
Masjid-E-Tabligh,Mosque,"Masjid-E-Tabligh, 736, Nerul East, Sector 20, Nerul, Navi Mumbai, Maharashtra 400706","Nerul East, Sector 20, Nerul",736,Navi Mumbai,400706,Maharashtra,IN,https://www.google.com/maps/place/Masjid-E-Tabligh/data=!4m7!3m6!1s0x3be7c3133ee77b33:0x7caa63e7eb65452e!8m2!3d19.034689!4d73.0165162!16s%2Fg%2F11gmgkqvh1!19sChIJM3vnPhPD5zsRLkVl6-djqnw?authuser=0&hl=en&rclk=1,"19.034689,73.0165162"
Darululoom Farooqia Masjid,Mosque,"Darululoom Farooqia Masjid, 219-A, Palm Beach Rd, Kopri Village, Kopripada, Sector 28, Vashi, Navi Mumbai, Maharashtra 400703","Kopri Village, Kopripada, Sector 28, Vashi","219-A, Palm Beach Rd",Navi Mumbai,400703,Maharashtra,IN,https://www.google.com/maps/place/Darululoom+Farooqia+Masjid/data=!4m7!3m6!1s0x3be7c123f2eff97b:0xcb7eec62ec8f22f9!8m2!3d19.0907235!4d73.0116105!16s%2Fg%2F11c2ps9dxx!19sChIJe_nv8iPB5zsR-SKP7GLsfss?authuser=0&hl=en&rclk=1,"19.0907235,73.0116105"
Masjid-e-suffah,Mosque,"24M2+4FM Masjid-e-suffah, Sector 11, Kalamboli, Panvel, Navi Mumbai, Maharashtra 410218","Sector 11, Kalamboli, Panvel",24M2+4FM,Navi Mumbai,410218,Maharashtra,IN,https://www.google.com/maps/place/Masjid-e-suffah/data=!4m7!3m6!1s0x3be7e9c36b20afcd:0xb978f7a9949485d8!8m2!3d19.0328499!4d73.1011657!16s%2Fg%2F11bttcr5m6!19sChIJza8ga8Pp5zsR2IWUlKn3eLk?authuser=0&hl=en&rclk=1,"19.0328499,73.1011657"
S.W.E.F. Trust Madrasa & Masjid,Mosque,"22FF+5WV S.W.E.F. Trust Madrasa & Masjid, Sector 27, Nerul, Navi Mumbai, Maharashtra 400706","Sector 27, Nerul",22FF+5WV,Navi Mumbai,400706,Maharashtra,IN,https://www.google.com/maps/place/S.W.E.F.+Trust+Madrasa+%26+Masjid/data=!4m7!3m6!1s0x3be7c3bbc71da90d:0xda3d28c895e90486!8m2!3d19.0229937!4d73.0247882!16s%2Fg%2F11hcjyrw37!19sChIJDakdx7vD5zsRhgTplcgoPdo?authuser=0&hl=en&rclk=1,"19.0229937,73.0247882"
Sunni Jama Masjid,Mosque,"35Q2+FR8 Sunni Jama Masjid, Wavanje, Taloja, Navi Mumbai, Maharashtra 410208","Wavanje, Taloja",35Q2+FR8,Navi Mumbai,410208,Maharashtra,IN,https://www.google.com/maps/place/Sunni+Jama+Masjid/data=!4m7!3m6!1s0x3be7ebb8af0d6f37:0x959f5c25338062be!8m2!3d19.088656!4d73.1520685!16s%2Fg%2F11f40s1t50!19sChIJN28Nr7jr5zsRvmKAMyVcn5U?authuser=0&hl=en&rclk=1,"19.088656,73.1520685"
Mohammadiya Masjid,Mosque,"Mohammadiya Masjid, A2-25, Sector 20, Turbhe, Navi Mumbai, Maharashtra 400703","Sector 20, Turbhe",A2-25,Navi Mumbai,400703,Maharashtra,IN,https://www.google.com/maps/place/Mohammadiya+Masjid/data=!4m7!3m6!1s0x3be7c13e52b7b8e7:0x919e0b629e96594f!8m2!3d19.0779718!4d73.0146137!16s%2Fg%2F11gdzv8460!19sChIJ57i3Uj7B5zsRT1mWnmILnpE?authuser=0&hl=en&rclk=1,"19.0779718,73.0146137"
Masjid e Madarsa Taiba Talimul Quran (Sunni Masjid),Mosque,"Masjid e Madarsa Taiba Talimul Quran (Sunni Masjid), A1-63/1, Vashi-Turbhe Rd, Sector 21, Turbhe, Navi Mumbai, Maharashtra 400703","Sector 21, Turbhe","A1-63/1, Vashi-Turbhe Rd",Navi Mumbai,400703,Maharashtra,IN,https://www.google.com/maps/place/Masjid+e+Madarsa+Taiba+Talimul+Quran+%28Sunni+Masjid%29/data=!4m7!3m6!1s0x3be7c1d2508f2303:0x57636fe41a9e8284!8m2!3d19.0729408!4d73.0110731!16s%2Fg%2F11fj8htdn4!19sChIJAyOPUNLB5zsRhIKeGuRvY1c?authuser=0&hl=en&rclk=1,"19.072940799999998,73.01107309999999"
Belapur Masjid,Mosque,"22MV+4JG Belapur Masjid, Sambhaji Nagar, Sector 8B, CBD Belapur, Navi Mumbai, Maharashtra 400614","Sambhaji Nagar, Sector 8B, CBD Belapur",22MV+4JG,Navi Mumbai,400614,Maharashtra,IN,https://www.google.com/maps/place/Belapur+Masjid/data=!4m7!3m6!1s0x3be7c3a7f331f679:0x7e4404b36dcb1006!8m2!3d19.0328203!4d73.0440647!16s%2Fg%2F11s_z1z1z9!19sChIJefYx86fD5zsRBhDLbbMERH4?authuser=0&hl=en&rclk=1,"19.0328203,73.04406469999999"
Masjid E Umar,Mosque,"Masjid E Umar, Shop no 4 Plot no 736 Sect 20 Nerul ( W, Nerul East, Sector 20, Nerul, Navi Mumbai, Maharashtra 400706","Nerul East, Sector 20, Nerul",Shop no 4 Plot no 736 Sect 20 Nerul ( W,Navi Mumbai,400706,Maharashtra,IN,https://www.google.com/maps/place/Masjid+E+Umar/data=!4m7!3m6!1s0x3be7c3675118a00b:0xa684118f1f1e2876!8m2!3d19.0459317!4d73.0141035!16s%2Fg%2F11sy3h3cmx!19sChIJC6AYUWfD5zsRdigeH48RhKY?authuser=0&hl=en&rclk=1,"19.0459317,73.01410349999999"
Sunni Ahmedi Masjid,Mosque,"4348+Q96 Sunni Ahmedi Masjid, Kiravli Village, Navi Mumbai, Maharashtra 410210",Kiravli Village,4348+Q96,Navi Mumbai,410210,Maharashtra,IN,https://www.google.com/maps/place/Sunni+Ahmedi+Masjid/data=!4m7!3m6!1s0x3be7c035bebe8fa7:0x9297a534195bc124!8m2!3d19.1069203!4d73.065883!16s%2Fg%2F11g6jql_fm!19sChIJp4--vjXA5zsRJMFbGTSll5I?authuser=0&hl=en&rclk=1,"19.1069203,73.065883"
Jama masjid old panvel,Mosque,"X4P4+8J8 Jama masjid old panvel, Old Panvel, Panvel, Navi Mumbai, Maharashtra 410206","Old Panvel, Panvel",X4P4+8J8,Navi Mumbai,410206,Maharashtra,IN,https://www.google.com/maps/place/Jama+masjid+old+panvel/data=!4m7!3m6!1s0x3be7e9f6bb604ae3:0x5c0779c03546943a!8m2!3d18.9857811!4d73.1065629!16s%2Fg%2F11tds67dfv!19sChIJ40pgu_bp5zsROpRGNcB5B1w?authuser=0&hl=en&rclk=1,"18.9857811,73.1065629"
Mosque,Mosque,"239Q+FJG Mosque, Sector 12, Kamothe, Panvel, Navi Mumbai, Maharashtra 410209","Sector 12, Kamothe, Panvel",239Q+FJG,Navi Mumbai,410209,Maharashtra,IN,https://www.google.com/maps/place/Mosque/data=!4m7!3m6!1s0x3be7e949e1dc8e8f:0xa2345bbd2986cfb!8m2!3d19.0186881!4d73.0890852!16s%2Fg%2F11gxg0schk!19sChIJj47c4Unp5zsR-2yY0rtFIwo?authuser=0&hl=en&rclk=1,"19.0186881,73.0890852"
Qabrastan Masjid,Mosque,"32R8+M5J Qabrastan Masjid, Sector 26, Vashi, Navi Mumbai, Maharashtra 400703","Sector 26, Vashi",32R8+M5J,Navi Mumbai,400703,Maharashtra,IN,https://www.google.com/maps/place/Qabrastan+Masjid/data=!4m7!3m6!1s0x3be7c12222c53557:0x3fb03f838dab568b!8m2!3d19.0917029!4d73.0153951!16s%2Fg%2F11c5_h6sks!19sChIJVzXFIiLB5zsRi1arjYM_sD8?authuser=0&hl=en&rclk=1,"19.091702899999998,73.01539509999999"
Masjid wa madrasa subaai JAMA'AT-E-GHURABA Ahle Hadees,Mosque,"Masjid wa madrasa subaai JAMA'AT-E-GHURABA Ahle Hadees, 180, Nerul East, Sector 21, Nerul, Navi Mumbai, Maharashtra 400706","Nerul East, Sector 21, Nerul",180,Navi Mumbai,400706,Maharashtra,IN,https://www.google.com/maps/place/Masjid+wa+madrasa+subaai+JAMA%27AT-E-GHURABA+Ahle+Hadees/data=!4m7!3m6!1s0x3be7c3bc9c993487:0x16a94171e63c6aec!8m2!3d19.0291332!4d73.0211113!16s%2Fg%2F11h7_nk3xj!19sChIJhzSZnLzD5zsR7Go85nFBqRY?authuser=0&hl=en&rclk=1,"19.0291332,73.0211113"
Sunni masjid lndira nagar,Mosque,"Sunni masjid lndira nagar, C - 432, T.T.C,Industrial Area, MIDC Turbhe, Opp.Lubrizol Gate No-3 & BASF, Navi Mumbai, Maharashtra 400705","Indira Nagar, MIDC Industrial Area, Turbhe","C - 432, T.T.C,Industrial Area, MIDC Turbhe, Opp.Lubrizol Gate No-3 & BASF",Navi Mumbai,400705,Maharashtra,IN,https://www.google.com/maps/place/Sunni+masjid+lndira+nagar/data=!4m7!3m6!1s0x3be7c15fc4598f89:0xe659bbfac33f313f!8m2!3d19.0756158!4d73.0281951!16s%2Fg%2F11fj9lmn_g!19sChIJiY9ZxF_B5zsRPzE_w_q7WeY?authuser=0&hl=en&rclk=1,"19.075615799999998,73.02819509999999"
Masjid,Mosque,"3277+PRW Masjid, Sector 5, Sanpada, Navi Mumbai, Maharashtra 400705","Sector 5, Sanpada",3277+PRW,Navi Mumbai,400705,Maharashtra,IN,https://www.google.com/maps/place/Masjid/data=!4m7!3m6!1s0x3be7c1a180f469f9:0x4c6745f47a98ac!8m2!3d19.0643712!4d73.0145892!16s%2Fg%2F11s2ym8f18!19sChIJ-Wn0gKHB5zsRrJh69EVnTAA?authuser=0&hl=en&rclk=1,"19.0643712,73.0145892"
Masjid Safai,Mosque,"X4CJ+MJH Masjid Safai, Peth, Kolkhe Village, Panvel, Navi Mumbai, Maharashtra 410221","Peth, Kolkhe Village, Panvel",X4CJ+MJH,Navi Mumbai,410221,Maharashtra,IN,https://www.google.com/maps/place/Masjid+Safai/data=!4m7!3m6!1s0x3be7e9aae69f910f:0xfd8a64fb298fb784!8m2!3d18.9716906!4d73.1316136!16s%2Fg%2F11gl16j_xp!19sChIJD5Gf5qrp5zsRhLePKftkiv0?authuser=0&hl=en&rclk=1,"18.9716906,73.1316136"
Sunni masjid,Mosque,"Sunni masjid, 144/5, TTC Industrial Area, MIDC Industrial Area, Kopar Khairane, Navi Mumbai, Maharashtra 400709","TTC Industrial Area, MIDC Industrial Area, Kopar Khairane",144/5,Navi Mumbai,400709,Maharashtra,IN,https://www.google.com/maps/place/Sunni+masjid/data=!4m7!3m6!1s0x3be7c180d4cc6c11:0x241b6b3c757d57dd!8m2!3d19.0942051!4d73.0224103!16s%2Fg%2F11ll4yjkjq!19sChIJEWzM1IDB5zsR3Vd9dTxrGyQ?authuser=0&hl=en&rclk=1,"19.0942051,73.02241029999999"
Jamma Masjid Nhava,Mosque,"XX77+MXC Jamma Masjid Nhava, Nhava Rd, Nhava, Navi Mumbai, Maharashtra 410206",Nhava,"XX77+MXC, Nhava Rd",Navi Mumbai,410206,Maharashtra,IN,https://www.google.com/maps/place/Jamma+Masjid+Nhava/data=!4m7!3m6!1s0x3be7c5e97fae164f:0x74c9c25bce02112a!8m2!3d18.9641966!4d72.9648983!16s%2Fg%2F11gx_zw00m!19sChIJTxauf-nF5zsRKhECzlvCyXQ?authuser=0&hl=en&rclk=1,"18.964196599999998,72.9648983"
Crescent West masjid,Mosque,"Crescent West masjid, WING -A, Sector 35D, Kutak Bandhan, Kharghar, Navi Mumbai, Maharashtra 410210","Sector 35D, Kutak Bandhan, Kharghar",WING -A,Navi Mumbai,410210,Maharashtra,IN,https://www.google.com/maps/place/Crescent+West+masjid/data=!4m7!3m6!1s0x3be7c1fe3e2b8471:0xe5c36c2cc39beccb!8m2!3d19.0716301!4d73.0781811!16s%2Fg%2F11frkxtnt5!19sChIJcYQrPv7B5zsRy-ybwyxsw-U?authuser=0&hl=en&rclk=1,"19.0716301,73.0781811"
Seawoods grand central mosque (masjid),Mosque,"1st Floor, Seawoods grand central mosque (masjid), Nexus Mall, behind Wildcraft, Nerul East, Sector 28, Seawoods, Navi Mumbai, Maharashtra 400706","Nerul East, Sector 28, Seawoods","1st Floor, Nexus Mall, behind Wildcraft",Navi Mumbai,400706,Maharashtra,IN,https://www.google.com/maps/place/Seawoods+grand+central+mosque+%28masjid%29/data=!4m7!3m6!1s0x3be7c321532ec88f:0x566b28dfe9aacba!8m2!3d19.0215873!4d73.0183585!16s%2Fg%2F11v3tzyfbt!19sChIJj8guUyHD5zsRuqya_o2yZgU?authuser=0&hl=en&rclk=1,"19.0215873,73.01835849999999"
Deobandi Masjid,Mosque,"Deobandi Masjid, A-184, Gyan Vikas Road, Shree Ganesh Panchami Society, Sector 23, Kopar Khairane, Navi Mumbai, Maharashtra 400709","Shree Ganesh Panchami Society, Sector 23, Kopar Khairane","A-184, Gyan Vikas Road",Navi Mumbai,400709,Maharashtra,IN,https://www.google.com/maps/place/Deobandi+Masjid/data=!4m7!3m6!1s0x3be7c0d5f01af43b:0xea986b36bbafd66d!8m2!3d19.0972127!4d72.9984065!16s%2Fg%2F11g72dz_f1!19sChIJO_Qa8NXA5zsRbdavuzZrmOo?authuser=0&hl=en&rclk=1,"19.0972127,72.9984065"
Sunni Almadina Masjid,Mosque,"Sunni Almadina Masjid, H/731-32, APMC FRUIT MARKET, Vashi, Navi Mumbai, Maharashtra 400703","APMC Fruits and Vegetable Market, Sector 19, Vashi","H/731-32, APMC FRUIT MARKET",Navi Mumbai,400703,Maharashtra,IN,https://www.google.com/maps/place/Sunni+Almadina+Masjid/data=!4m7!3m6!1s0x3be7c13f539004bb:0x55250ef7fbb972e3!8m2!3d19.0748732!4d73.0132508!16s%2Fg%2F11rtstyp9s!19sChIJuwSQUz_B5zsR43K5-_cOJVU?authuser=0&hl=en&rclk=1,"19.0748732,73.0132508"
Noor Madrasa & Masjid,Mosque,"Noor Madrasa & Masjid, kohinoor palace H.No.1441 Wavanje, Taloja, Tal, Panvel, Navi Mumbai, Maharashtra 410208",Panvel,"kohinoor palace H.No.1441 Wavanje, Taloja, Tal",Navi Mumbai,410208,Maharashtra,IN,https://www.google.com/maps/place/Noor+Madrasa+%26+Masjid/data=!4m7!3m6!1s0x3be7ebcb83e259e1:0x98ccaa86d5b791dc!8m2!3d19.0834746!4d73.1529999!16s%2Fg%2F11fnj20p7s!19sChIJ4Vnig8vr5zsR3JG31YaqzJg?authuser=0&hl=en&rclk=1,"19.0834746,73.1529999"
"Raza Masjid, Mirza House, rzaa msjid, mirjaa haauus",Mosque,"22M8+QH3 Raza Masjid, Mirza House, rzaa msjid, mirjaa haauus, Nerul East, Sector 20, Nerul, Navi Mumbai, Maharashtra 400706","Nerul East, Sector 20, Nerul",22M8+QH3,Navi Mumbai,400706,Maharashtra,IN,"https://www.google.com/maps/place/Raza+Masjid,+Mirza+House,+%E0%A4%B0%E0%A5%9B%E0%A4%BE+%E0%A4%AE%E0%A4%B8%E0%A5%8D%E0%A4%9C%E0%A4%BF%E0%A4%A6,+%E0%A4%AE%E0%A4%BF%E0%A4%B0%E0%A5%8D%E0%A4%9C%E0%A4%BE+%E0%A4%B9%E0%A4%BE%E0%A4%8A%E0%A4%B8/data=!4m7!3m6!1s0x3be7c3b86bc6df6b:0x5960035351036ee6!8m2!3d19.0343755!4d73.0164371!16s%2Fg%2F11f9vk_tdm!19sChIJa9_Ga7jD5zsR5m4DUVMDYFk?authuser=0&hl=en&rclk=1","19.0343755,73.01643709999999"
Masjid Ahle Hadees Rabale (near it box gali),Mosque,"42W3+W3C Masjid Ahle Hadees Rabale (near it box gali), Parulekar Wadi, Airoli, Navi Mumbai, Maharashtra 400701",Airoli,"42W3+W3C, Parulekar Wadi",Navi Mumbai,400701,Maharashtra,IN,https://www.google.com/maps/place/Masjid+Ahle+Hadees+Rabale+%28near+it+box+gali%29/data=!4m7!3m6!1s0x3be7bfe8346edbf7:0x4ad9c21d681413f!8m2!3d19.1473176!4d73.0026372!16s%2Fg%2F11j23skj9d!19sChIJ99tuNOi_5zsRP0GB1iGcrQQ?authuser=0&hl=en&rclk=1,"19.147317599999997,73.0026372"
