name,main_category,address,address_ward,address_street,address_city,address_postal_code,address_state,address_country_code,link,coordinates
Mustafa Masjid Ahle Sunnat Wal Jamat mSTfy msjd,Mosque,"J8CH+RX6 Mustafa Masjid Ahle Sunnat Wal Jamat mSTfy msjd, Mulla Colony, Rajbir Colony, Gharoli Extension, Gharoli, Delhi, 96","Mulla Colony, Rajbir Colony, Gharoli Extension, Gharoli",J8CH+RX6,Delhi,96,Delhi,IN,https://www.google.com/maps/place/Mustafa+Masjid+Ahle+Sunnat+Wal+Jamat+%D9%85%D8%B5%D8%B7%D9%81%DB%8C+%D9%85%D8%B3%D8%AC%D8%AF%E2%80%AD/data=!4m7!3m6!1s0x390ce577af585fed:0xaf67853a70c52ff9!8m2!3d28.6220404!4d77.329894!16s%2Fg%2F11h_9xcl8q!19sChIJ7V9Yr3flDDkR-S_FcDqFZ68?authuser=0&hl=en&rclk=1,"28.6220404,77.329894"
Shahabate Rasool Masjid,Mosque,"Q78F+QJG Shahabate Rasool Masjid, Loni, Azad Vihar, Khora Colony, Sector 62A, Noida, Uttar Pradesh","Azad Vihar, Khora Colony, Sector 62A","Q78F+QJG, Loni","Noida, Ghaziabad",,Uttar Pradesh,IN,https://www.google.com/maps/place/Shahabate+Rasool+Masjid/data=!4m7!3m6!1s0x390cff27f74f9b03:0xd609160ed60edb1c!8m2!3d28.7669479!4d77.2740907!16s%2Fg%2F11f1jwz7lz!19sChIJA5tP9yf_DDkRHNsO1g4WCdY?authuser=0&hl=en&rclk=1,"28.766947899999998,77.2740907"
Gul masjid amar colony,Mosque,"P74V+4XC Gul masjid amar colony, Amar Colony, Block E, East Gokalpur, Gokalpur, New Delhi, Delhi, 110094","Amar Colony, Block E, East Gokalpur, Gokalpur",P74V+4XC,"New Delhi, Delhi",,Delhi,IN,https://www.google.com/maps/place/Gul+masjid+amar+colony/data=!4m7!3m6!1s0x390cfbb86bbad231:0x24d6f3af876a427f!8m2!3d28.7053162!4d77.2948898!16s%2Fg%2F11fpkvp_3r!19sChIJMdK6a7j7DDkRf0Jqh6_z1iQ?authuser=0&hl=en&rclk=1,"28.7053162,77.29488979999999"
Munawra masjid,Mosque,"M7P4+6M2 Munawra masjid, Masjid Road, Third Pushta, Usmanpur, Nayagaon Village, Shahdara, Delhi, 110053","Third Pushta, Nayagaon, Nayagaon Village, Shahdara","M7P4+6M2, Masjid Road, Third Pushta, Usmanpur",Delhi,110053,Delhi,IN,https://www.google.com/maps/place/Munawra+masjid/data=!4m7!3m6!1s0x390cfd030e33f563:0x5dc12b36744f9a85!8m2!3d28.6855176!4d77.2566372!16s%2Fg%2F11hzwz2ypj!19sChIJY_UzDgP9DDkRhZpPdDYrwV0?authuser=0&hl=en&rclk=1,"28.685517599999997,77.2566372"
Masjid Fatima,Mosque,"Q739+23Q Masjid Fatima, Sarad, Pink City, Ghaziabad, Uttar Pradesh 201102","Sarad city, Pink City","Q739+23Q, Sarad",Ghaziabad,201102,Uttar Pradesh,IN,https://www.google.com/maps/place/Masjid+Fatima/data=!4m7!3m6!1s0x390cfec314c1399f:0x7eb2bc611374b8b0!8m2!3d28.7525994!4d77.2677429!16s%2Fg%2F11fzf4xs6j!19sChIJnznBFMP-DDkRsLh0E2G8sn4?authuser=0&hl=en&rclk=1,"28.752599399999998,77.2677429"
Masjid,Mosque,"Masjid, C-78/6, Ghazipur Dairy Farm, Ghazipur, New Delhi, Delhi, 110091","Ghazipur Dairy Farm, Ghazipur",C-78/6,"New Delhi, Delhi",110091,Delhi,IN,https://www.google.com/maps/place/Masjid/data=!4m7!3m6!1s0x390ce59d2385649b:0xb67be5c3e3ed3d8!8m2!3d28.621932!4d77.3237081!16s%2Fg%2F11r6dvzgp5!19sChIJm2SFI53lDDkR2NM-Ply-Zws?authuser=0&hl=en&rclk=1,"28.621931999999997,77.32370809999999"
Mosque msjd,Mosque,"Mosque msjd, 3696, Mori Gate, New Delhi, Delhi 110006",Mori Gate,3696,"New Delhi, Delhi",110006,Delhi,IN,https://www.google.com/maps/place/Mosque+%D9%85%D8%B3%D8%AC%D8%AF%E2%80%AD/data=!4m7!3m6!1s0x390cfd0c79fa6f11:0x326ac233054d2efa!8m2!3d28.6635017!4d77.2212005!16s%2Fg%2F12lkq2186!19sChIJEW_6eQz9DDkR-i5NBTPCajI?authuser=0&hl=en&rclk=1,"28.663501699999998,77.2212005"
Masjid Sanauji,Mosque,"Masjid Sanauji, Shop No. 1630, Lal Kuan, Lalkuan Bazar Rd, Baradari, Chandni Chowk, New Delhi, Delhi 110006","Bazar Sirkiwalan, Baradari, Chandni Chowk","Shop No. 1630, Lal Kuan, Lalkuan Bazar Rd","New Delhi, Delhi",110006,Delhi,IN,https://www.google.com/maps/place/Masjid+Sanauji/data=!4m7!3m6!1s0x390cfd13fe3ea72d:0x27ea23bc5f650202!8m2!3d28.6529317!4d77.2232485!16s%2Fg%2F12hplq4pp!19sChIJLac-_hP9DDkRAgJlX7wj6ic?authuser=0&hl=en&rclk=1,"28.6529317,77.2232485"
Ilyaas Masjid,Mosque,"V84W+FFH Ilyaas Masjid, Kabra Nagar, Laxmi Nagar, Gadia Vihar, Aurangabad, Maharashtra 431005","Kabra Nagar, Laxmi Nagar, Gadia Vihar",V84W+FFH,Aurangabad,431005,Maharashtra,IN,https://www.google.com/maps/place/Ilyaas+Masjid/data=!4m7!3m6!1s0x3bdba3affebe0a6d:0x9827dd1abf44a902!8m2!3d19.8561819!4d75.3462444!16s%2Fg%2F11gy0j3ngz!19sChIJbQq-_q-j2zsRAqlEvxrdJ5g?authuser=0&hl=en&rclk=1,"19.8561819,75.3462444"
Gosiya Masjid msjd Gwthyh,Mosque,"Gosiya Masjid msjd Gwthyh, Dmrc Staff Quarters Shastri Park Gosiya Masjid, Metro Vihar, Shastri Park, Shahdara, New Delhi, Delhi, 110053","Metro Vihar, Shastri Park, Shahdara",Dmrc Staff Quarters Shastri Park Gosiya Masjid,"New Delhi, Delhi",110053,Delhi,IN,https://www.google.com/maps/place/Gosiya+Masjid+%D9%85%D8%B3%D8%AC%D8%AF+%D8%BA%D9%88%D8%AB%DB%8C%D9%87%E2%80%AD/data=!4m7!3m6!1s0x390cfcf78954d34b:0xbcdda649271d1b79!8m2!3d28.6707658!4d77.2523782!16s%2Fg%2F1tlmlq9w!19sChIJS9NUiff8DDkReRsdJ0mm3bw?authuser=0&hl=en&rclk=1,"28.670765799999998,77.2523782"
Anarwali Masjid msjd nr wly,Mosque,"Anarwali Masjid msjd nr wly, hno.230/ mandavali, 3, Mandawali Main Road, Fazalpur, Railway Colony, Mandawali, Delhi, 110092","Railway Colony, Mandawali","hno.230/ mandavali, 3, Mandawali Main Road, Fazalpur, Railway Colony, Mandawali",Delhi,110092,Delhi,IN,https://www.google.com/maps/place/Anarwali+Masjid+%D9%85%D8%B3%D8%AC%D8%AF+%D8%A7%D9%86%D8%A7%D8%B1+%D9%88%D8%A7%D9%84%DB%8C%E2%80%AD/data=!4m7!3m6!1s0x390ce4aceaaaaaab:0xf35cfc3b5a9a894a!8m2!3d28.6291881!4d77.2936695!16s%2Fg%2F11cmfdyfyg!19sChIJq6qq6qzkDDkRSomaWjv8XPM?authuser=0&hl=en&rclk=1,"28.6291881,77.2936695"
Madina Masjid,Mosque,"Q767+3R8 Madina Masjid, Rajdhani Enclave, Rampark Loni, Ghaziabad, Uttar Pradesh 201102",Rampark Loni,"Q767+3R8, Rajdhani Enclave",Ghaziabad,,Uttar Pradesh,IN,https://www.google.com/maps/place/Madina+Masjid/data=!4m7!3m6!1s0x390cfede0c1fb349:0x86fa6effac8e45b0!8m2!3d28.7601516!4d77.2645886!16s%2Fg%2F11hd6wmb4c!19sChIJSbMfDN7-DDkRsEWOrP9u-oY?authuser=0&hl=en&rclk=1,"28.7601516,77.2645886"
Hassan Masjid,Mosque,"V84R+4PR Hassan Masjid, Shambhu Nagar, Gadia Vihar, Aurangabad, Maharashtra 431005","Shambhu Nagar, Gadia Vihar",V84R+4PR,Aurangabad,431005,Maharashtra,IN,https://www.google.com/maps/place/Hassan+Masjid/data=!4m7!3m6!1s0x3bdba27f4f212d07:0x4bf0107c4186041b!8m2!3d19.8553727!4d75.3417592!16s%2Fg%2F11dylt2kyd!19sChIJBy0hT3-i2zsRGwSGQXwQ8Es?authuser=0&hl=en&rclk=1,"19.8553727,75.3417592"
Mosque msjd,Mosque,"J76X+W9R Mosque msjd, New, Kotla Village, Mayur Vihar, New Delhi, Delhi 110091","Kotla Village, Mayur Vihar","J76X+W9R, New","New Delhi, Delhi",110091,Delhi,IN,https://www.google.com/maps/place/Mosque+%D9%85%D8%B3%D8%AC%D8%AF%E2%80%AD/data=!4m7!3m6!1s0x390ce4bcc9c6272b:0x172c875eb9dd78e2!8m2!3d28.612373!4d77.2984052!16s%2Fg%2F11c3182y_w!19sChIJKyfGybzkDDkR4njduV6HLBc?authuser=0&hl=en&rclk=1,"28.612372999999998,77.29840519999999"
JAMA MASJID,Mosque,"JAMA MASJID, 1114, Budh Vihar, Bahrampur, Nai Basti Dundahera, Ghaziabad, Uttar Pradesh 201009","Budh Vihar, Bahrampur, Nai Basti Dundahera",1114,Ghaziabad,201009,Uttar Pradesh,IN,https://www.google.com/maps/place/JAMA+MASJID/data=!4m7!3m6!1s0x390cef1af0aee835:0xe4b54dbb9e432dd0!8m2!3d28.635442!4d77.4021531!16s%2Fg%2F11q_kx64q_!19sChIJNeiu8BrvDDkR0C1DnrtNteQ?authuser=0&hl=en&rclk=1,"28.635441999999998,77.40215309999999"
Masjid Hussainiya,Mosque,"J6XM+GHP Masjid Hussainiya, Matia Mahal Rd, Kalan Mehal, Old Delhi, Delhi, 110006","Kalan Mehal, Old Delhi","J6XM+GHP, Matia Mahal Rd",Delhi,110006,Delhi,IN,https://www.google.com/maps/place/Masjid+Hussainiya/data=!4m7!3m6!1s0x390cfd18ba6b0bd5:0xced4d691b8d1a3fb!8m2!3d28.6488459!4d77.2339534!16s%2Fg%2F11gc9g4rkv!19sChIJ1Qtruhj9DDkR-6PRuJHW1M4?authuser=0&hl=en&rclk=1,"28.648845899999998,77.23395339999999"
Masjid,Mosque,"H77Q+868 Masjid, Okhla Village, Okhla, New Delhi, Delhi 110025","Okhla Village, Okhla",H77Q+868,New Delhi,110025,Delhi,IN,https://www.google.com/maps/place/Masjid/data=!4m7!3m6!1s0x390ce47512f7aa2b:0x544337a9b9e5d7a2!8m2!3d28.5632814!4d77.2880932!16s%2Fg%2F11gbtpj5td!19sChIJK6r3EnXkDDkRotfluak3Q1Q?authuser=0&hl=en&rclk=1,"28.563281399999997,77.28809319999999"
Ishaq Masjid,Mosque,"Ishaq Masjid, Ishaq Masjid Wali Gali, Block C, Sarai Kale Khan, New Delhi, Delhi 110013","Block C, Sarai Kale Khan",Ishaq Masjid Wali Gali,New Delhi,110013,Delhi,IN,https://www.google.com/maps/place/Ishaq+Masjid/data=!4m7!3m6!1s0x390ce376f8a80f59:0x43d242dbd3376818!8m2!3d28.5849571!4d77.2565889!16s%2Fg%2F11q2tx_6x1!19sChIJWQ-o-HbjDDkRGGg309tC0kM?authuser=0&hl=en&rclk=1,"28.5849571,77.2565889"
Kanija masjid,Mosque,"Kanija masjid, C-162, Street Number 9/3, Shiv Mandir Marg, Maujpur, Delhi, 110053","Maujpur, Shahdara","C-162, Street Number 9/3, Shiv Mandir Marg",Delhi,110053,Delhi,IN,https://www.google.com/maps/place/Kanija+masjid/data=!4m7!3m6!1s0x390cfd0122c7a6a3:0xaa6de10f0dcff6c5!8m2!3d28.6873469!4d77.2707536!16s%2Fg%2F11fp3201_c!19sChIJo6bHIgH9DDkRxfbPDQ_hbao?authuser=0&hl=en&rclk=1,"28.687346899999998,77.27075359999999"
Masjid,Mosque,"V9J6+6FW Masjid, Gulmohar Colony, Sahyadri Nagar, N 5, Cidco, Aurangabad, Maharashtra 431003","Gulmohar Colony, Sahyadri Nagar, N 5, Cidco",V9J6+6FW,Aurangabad,431003,Maharashtra,IN,https://www.google.com/maps/place/Masjid/data=!4m7!3m6!1s0x3bdba328d36d723f:0xf8e086dc7ede31b6!8m2!3d19.8806185!4d75.3612119!16s%2Fg%2F11h2dj30fn!19sChIJP3Jt0yij2zsRtjHeftyG4Pg?authuser=0&hl=en&rclk=1,"19.8806185,75.3612119"
Meena masjid the Salar Jung estate,Mosque,"V8MW+46M Meena masjid the Salar Jung estate, Sanjay Nagar, Mondha, Aurangabad, Maharashtra 431003","Sanjay Nagar, Mondha",V8MW+46M,Aurangabad,431003,Maharashtra,IN,https://www.google.com/maps/place/Meena+masjid+the+Salar+Jung+estate/data=!4m7!3m6!1s0x3bdba29f6a1cfc67:0xe8fa075e9583ed56!8m2!3d19.8828318!4d75.3455355!16s%2Fg%2F11d_wtjpb0!19sChIJZ_wcap-i2zsRVu2DlV4H-ug?authuser=0&hl=en&rclk=1,"19.882831799999998,75.3455355"
Ijaba Masjid,Mosque,"Ijaba Masjid, 1489/16, Block D, Chand Vihar, New Mustafabad, Delhi, 110094","Block D, Chand Vihar, New Mustafabad",1489/16,Delhi,110094,Delhi,IN,https://www.google.com/maps/place/Ijaba+Masjid/data=!4m7!3m6!1s0x390cfd4112cff819:0x124578cf76e8540b!8m2!3d28.7086594!4d77.2713446!16s%2Fg%2F11j08711wr!19sChIJGfjPEkH9DDkRC1Tods94RRI?authuser=0&hl=en&rclk=1,"28.7086594,77.27134459999999"
Mr.SAHEEM MALIK,Mosque,"Mr.SAHEEM MALIK, Gali no. 3 - Tirpal Factory Mustafabad, near Ayisha masjid, 25 Futa Rd, near by Aisha Masjid, chowk, Delhi 110094","Shakti Vihar, Old Mustafabad, chowk","Gali no. 3 - Tirpal Factory Mustafabad, near Ayisha masjid, 25 Futa Rd, near by Aisha Masjid",Delhi,110094,Delhi,IN,https://www.google.com/maps/place/Mr.SAHEEM+MALIK/data=!4m7!3m6!1s0x390cfd9a44cd4997:0xffdc8860c53e3f2b!8m2!3d28.7159667!4d77.272238!16s%2Fg%2F11h3cwgc8y!19sChIJl0nNRJr9DDkRKz8-xWCI3P8?authuser=0&hl=en&rclk=1,"28.7159667,77.272238"
Jama Madjid,Mosque,"Jama Madjid, khuwaja park Illaichipur, Trans Delhi Signature City, Ghaziabad, Uttar Pradesh 201102",Trans Delhi Signature City,khuwaja park Illaichipur,Ghaziabad,201102,Uttar Pradesh,IN,https://www.google.com/maps/place/Jama+Madjid/data=!4m7!3m6!1s0x390cffd519959253:0x75d57b5584aaf66f!8m2!3d28.764901!4d77.256208!16s%2Fg%2F11g2_3w7fd!19sChIJU5KVGdX_DDkRb_aqhFV71XU?authuser=0&hl=en&rclk=1,"28.764901,77.256208"
Masjid,Mosque,"Q7JJ+7WC Masjid, Pavi Sadakpur, Uttar Pradesh 201102",,Q7JJ+7WC,Pavi Sadakpur,201102,Uttar Pradesh,IN,https://www.google.com/maps/place/Masjid/data=!4m7!3m6!1s0x390cff3247b3c4d7:0xf1b7407f946dd8cc!8m2!3d28.7806806!4d77.2822504!16s%2Fg%2F11ggz8tfhy!19sChIJ18SzRzL_DDkRzNhtlH9At_E?authuser=0&hl=en&rclk=1,"28.7806806,77.2822504"
Masjid,Mosque,"Q6MJ+5H5 Masjid, Badarpur, Madanpur Khadar, New Delhi, 110084",Madanpur Khadar,"Q6MJ+5H5, Badarpur","New Delhi, Delhi",110084,Delhi,IN,https://www.google.com/maps/place/Masjid/data=!4m7!3m6!1s0x390cffb780460377:0x9fe224e9c653e965!8m2!3d28.7828891!4d77.2314704!16s%2Fg%2F11qn790lvq!19sChIJdwNGgLf_DDkRZelTxukk4p8?authuser=0&hl=en&rclk=1,"28.7828891,77.23147039999999"
Noori Masjid,Mosque,"Noori Masjid, S286, Block S, Brahampuri, Shahdara, Delhi, 110053","Block S, Brahampuri, Shahdara",S286,Delhi,110053,Delhi,IN,https://www.google.com/maps/place/Noori+Masjid/data=!4m7!3m6!1s0x390cfd49000e16b7:0x7fdd492a359ff0ad!8m2!3d28.68057!4d77.2665461!16s%2Fg%2F11rc9rdr_1!19sChIJtxYOAEn9DDkRrfCfNSpJ3X8?authuser=0&hl=en&rclk=1,"28.68057,77.2665461"
Nurani Masjid,Mosque,"Q6CX+8QH Nurani Masjid, Haqiqatpur, Uttar Pradesh 201102",,Q6CX+8QH,Haqiqatpur,201102,Uttar Pradesh,IN,https://www.google.com/maps/place/Nurani+Masjid/data=!4m7!3m6!1s0x390cff06d1a26571:0x2a7700db518ef62a!8m2!3d28.7708199!4d77.2494795!16s%2Fg%2F11q8vqwpg_!19sChIJcWWi0Qb_DDkRKvaOUdsAdyo?authuser=0&hl=en&rclk=1,"28.7708199,77.24947949999999"
Albar Masjid,Mosque,"V84R+Q8R Albar Masjid, Albar colony Podar international school, Gadiya Vihar Road, Shambhu Nagar, Behind, Aurangabad, Maharashtra 431005","Shambhu Nagar, Mayurban Colony, Behind","V84R+Q8R, Albar colony Podar international school, Gadiya Vihar Road",Aurangabad,431005,Maharashtra,IN,https://www.google.com/maps/place/Albar+Masjid/data=!4m7!3m6!1s0x3bdb9932132a17ad:0x5d3d467c3f8c773a!8m2!3d19.8569784!4d75.3407639!16s%2Fg%2F11gmspx240!19sChIJrRcqEzKZ2zsROneMP3xGPV0?authuser=0&hl=en&rclk=1,"19.8569784,75.3407639"
Ramzani Masjid,Mosque,"Ramzani Masjid, C-12, Sut Girni Rd, Deshmukh Nagar, Laxmi Nagar, Gadia Vihar, Aurangabad, Maharashtra 431005","Deshmukh Nagar, Laxmi Nagar, Gadia Vihar","C-12, Sut Girni Rd",Aurangabad,431005,Maharashtra,IN,https://www.google.com/maps/place/Ramzani+Masjid/data=!4m7!3m6!1s0x3bdba27c194b1ea7:0x4a763e0eb45ff9b3!8m2!3d19.8562071!4d75.3474194!16s%2Fg%2F11dd_prc1y!19sChIJpx5LGXyi2zsRs_lftA4-dko?authuser=0&hl=en&rclk=1,"19.8562071,75.34741939999999"
madina masjid,Mosque,"madina masjid, DM-2/163, Ambika Nagar, HPCL Housing Colony, N 2, Cidco, Aurangabad, Maharashtra 431003","Ambika Nagar, HPCL Housing Colony, N 2, Cidco",DM-2/163,Aurangabad,431003,Maharashtra,IN,https://www.google.com/maps/place/madina+masjid/data=!4m7!3m6!1s0x3bdba3e59bd2a867:0xeed4f09fea700815!8m2!3d19.8694759!4d75.3762063!16s%2Fg%2F11n76d74p4!19sChIJZ6jSm-Wj2zsRFQhw6p_w1O4?authuser=0&hl=en&rclk=1,"19.869475899999998,75.37620629999999"
Masjid,Mosque,"P9HF+33Q Masjid, Farukh Nagar, Uttar Pradesh 201003",,P9HF+33Q,Farukh Nagar,201003,Uttar Pradesh,IN,https://www.google.com/maps/place/Masjid/data=!4m7!3m6!1s0x390cfa018875b495:0xeea7b0caec7e470d!8m2!3d28.7277145!4d77.3727433!16s%2Fg%2F11f0krqvls!19sChIJlbR1iAH6DDkRDUd-7Mqwp-4?authuser=0&hl=en&rclk=1,"28.727714499999998,77.3727433"
Masjid,Mosque,"Masjid, 242, Masjid Jheel Pio, Near ITO metro GateNo.3, Bahadur Shah Zafar Marg, Balmiki Basti, Vikram Nagar, Delhi, 110002","Bahadur Shah Zafar Marg, Balmiki Basti, Vikram Nagar","242, Masjid Jheel Pio, Near ITO metro GateNo.3, Bahadur Shah Zafar Marg",Delhi,110002,Delhi,IN,https://www.google.com/maps/place/Masjid/data=!4m7!3m6!1s0x390cfd441769149d:0xa1929f1b4f5921d6!8m2!3d28.6298914!4d77.2415098!16s%2Fg%2F11s2n38r9b!19sChIJnRRpF0T9DDkR1iFZTxufkqE?authuser=0&hl=en&rclk=1,"28.629891399999998,77.2415098"
Masjid,Mosque,"J7WG+44R Masjid, Shastri Nagar, Geeta Colony, New Delhi, Delhi, 110031","Shastri Nagar, Geeta Colony",J7WG+44R,"New Delhi, Delhi",110031,Delhi,IN,https://www.google.com/maps/place/Masjid/data=!4m7!3m6!1s0x390cfdd602d3790d:0x318c83bff04345b3!8m2!3d28.6453628!4d77.2752524!16s%2Fg%2F11h_7ms07y!19sChIJDXnTAtb9DDkRs0VD8L-DjDE?authuser=0&hl=en&rclk=1,"28.645362799999997,77.2752524"
AbuBakr masjid Ahle Hadees,Mosque,"AbuBakr masjid Ahle Hadees, G-395, Block B, Old Mustafabad, New Mustafabad, New Delhi, Delhi, 110053","Block B, Old Mustafabad, New Mustafabad",G-395,"New Delhi, Delhi",110053,Delhi,IN,https://www.google.com/maps/place/AbuBakr+masjid+Ahle+Hadees/data=!4m7!3m6!1s0x390cfd722267a05d:0x32d00ac5a268d7e2!8m2!3d28.7140512!4d77.2717494!16s%2Fg%2F11rl99pg0l!19sChIJXaBnInL9DDkR4tdoosUK0DI?authuser=0&hl=en&rclk=1,"28.7140512,77.27174939999999"
msjid,Mosque,"msjid, 249, Swami Amardev Marg, Bara Bazar, Maharam Mohalla, Shahdara, Delhi, 110032","Bara Bazar, Maharam Mohalla, Shahdara","249, Swami Amardev Marg",Delhi,110032,Delhi,IN,https://www.google.com/maps/place/%E0%A4%AE%E0%A4%B8%E0%A5%8D%E0%A4%9C%E0%A4%BF%E0%A4%A6/data=!4m7!3m6!1s0x390cfb490b84c709:0x30ecad58f89bafaa!8m2!3d28.6687399!4d77.2917355!16s%2Fg%2F11n03hfp8k!19sChIJCceEC0n7DDkRqq-b-Fit7DA?authuser=0&hl=en&rclk=1,"28.6687399,77.2917355"
Jama masjid kardam puri,Mosque,"Jama masjid kardam puri, 155/4C, near Jama Masjid, Kardam Puri Extension, Harijan Basti, Shahdara, New Delhi, Delhi 110053","Kardam Puri Extension, Harijan Basti, Shahdara","155/4C, near Jama Masjid","New Delhi, Delhi",110053,Delhi,IN,https://www.google.com/maps/place/Jama+masjid+kardam+puri/data=!4m7!3m6!1s0x390cfb594ce3f893:0xbb1f66ee76c32b0b!8m2!3d28.6952607!4d77.2885833!16s%2Fg%2F11szczyrrh!19sChIJk_jjTFn7DDkRCyvDdu5mH7s?authuser=0&hl=en&rclk=1,"28.6952607,77.2885833"
Ghausiya Masjid,Mosque,"M7WQ+X5M Ghausiya Masjid, New, Kardam Puri Extension, Delhi","Kardam Puri Extension, Kardam Puri, Shahdara","M7WQ+X5M, New",Delhi,,Delhi,IN,https://www.google.com/maps/place/Ghausiya+Masjid/data=!4m7!3m6!1s0x390cfb24c7dc3f8b:0x7940cd0e405956a3!8m2!3d28.6974538!4d77.2879242!16s%2Fg%2F11h3g56qsq!19sChIJiz_cxyT7DDkRo1ZZQA7NQHk?authuser=0&hl=en&rclk=1,"28.697453799999998,77.28792419999999"
Masjid,Mosque,"Masjid, 42C, Central Auto Market, Block B, Sector 16, Noida, Uttar Pradesh 201301","Central Auto Market, Block B, Sector 16",42C,Noida,201301,Uttar Pradesh,IN,https://www.google.com/maps/place/Masjid/data=!4m7!3m6!1s0x390ce45b6e8b8d05:0x1c6debc04866e60!8m2!3d28.577362!4d77.31624!16s%2Fg%2F11c6rj0f0y!19sChIJBY2LblvkDDkRYG6GBLzexgE?authuser=0&hl=en&rclk=1,"28.577361999999997,77.31624"
Masjid,Mosque,"Masjid, 2508, Fasil Rd, Gali Sakko Wali, Shah Ganj, Chandni Chowk, New Delhi, Delhi, 110006","Gali Sakko Wali, Shah Ganj, Chandni Chowk","2508, Fasil Rd","New Delhi, Delhi",110006,Delhi,IN,https://www.google.com/maps/place/Masjid/data=!4m7!3m6!1s0x390cfd15c9a8a4b1:0xf975aada141da03e!8m2!3d28.6491552!4d77.2220471!16s%2Fg%2F1hm4gjxkd!19sChIJsaSoyRX9DDkRPqAdFNqqdfk?authuser=0&hl=en&rclk=1,"28.6491552,77.2220471"
MOHAMMADI MASJID,Mosque,"Q7G7+6MV MOHAMMADI MASJID, Trans Delhi Signature City, Ghaziabad, Uttar Pradesh 201102",Trans Delhi Signature City,Q7G7+6MV,Ghaziabad,201102,Uttar Pradesh,IN,https://www.google.com/maps/place/MOHAMMADI+MASJID/data=!4m7!3m6!1s0x390cff50262b6d3b:0x5ddfdcdebf74cb86!8m2!3d28.7756125!4d77.2641719!16s%2Fg%2F11k40jwrcb!19sChIJO20rJlD_DDkRhst0v97c310?authuser=0&hl=en&rclk=1,"28.775612499999998,77.2641719"
Prozone Masjid,Mosque,"Plot No.21-A, Prozone Masjid, opp. Prozone Mall, Sambhaji Nagar, N 1, Cidco, Aurangabad, Maharashtra 431006","Sambhaji Nagar, N 1, Cidco","Plot No.21-A, opp. Prozone Mall",Aurangabad,431006,Maharashtra,IN,https://www.google.com/maps/place/Prozone+Masjid/data=!4m7!3m6!1s0x3bdba3863ee120b9:0x7f8dd046e1aee19c!8m2!3d19.8764035!4d75.3705652!16s%2Fg%2F11t9kmrf63!19sChIJuSDhPoaj2zsRnOGu4UbQjX8?authuser=0&hl=en&rclk=1,"19.8764035,75.3705652"
Masjid-e-Salarjung,Mosque,"V8HC+WHQ Masjid-e-Salarjung, Reya Marg, Samarth Nagar, Aurangabad, Maharashtra 431001",Samarth Nagar,"V8HC+WHQ, Reya Marg",Aurangabad,431001,Maharashtra,IN,https://www.google.com/maps/place/Masjid-e-Salarjung/data=!4m7!3m6!1s0x3bdb99a3edcea91b:0xe01e3821f6f7d9ab!8m2!3d19.8798488!4d75.3214784!16s%2Fg%2F11s5xn2bw6!19sChIJG6nO7aOZ2zsRq9n39iE4HuA?authuser=0&hl=en&rclk=1,"19.879848799999998,75.32147839999999"
Masjid Abdul Karim,Mosque,"V8JX+6MQ Masjid Abdul Karim, Baijipura, Indira Nagar, Mondha, Aurangabad, Maharashtra 431003","Baijipura, Indira Nagar, Mondha",V8JX+6MQ,Aurangabad,431003,Maharashtra,IN,https://www.google.com/maps/place/Masjid+Abdul+Karim/data=!4m7!3m6!1s0x3bdba33181947769:0x61b1e97a1f16d8ed!8m2!3d19.8805768!4d75.3492349!16s%2Fg%2F11vd3l4l7l!19sChIJaXeUgTGj2zsR7dgWH3rpsWE?authuser=0&hl=en&rclk=1,"19.8805768,75.3492349"
Masjid/prayer room,Mosque,"H76F+7H6 Masjid/prayer room, Fortis Escorts Hospital Sukhdev metro station, Delhi",New Friends Colony,"H76F+7H6, Fortis Escorts Hospital Sukhdev metro station","Delhi, New Delhi",,Delhi,IN,https://www.google.com/maps/place/Masjid%2Fprayer+room/data=!4m7!3m6!1s0x390ce3c02d7da811:0x388ca404d02fd2b3!8m2!3d28.5606583!4d77.2739036!16s%2Fg%2F11rj_njv5d!19sChIJEah9LcDjDDkRs9Iv0ASkjDg?authuser=0&hl=en&rclk=1,"28.5606583,77.2739036"
Munwara Masjid,Mosque,"Munwara Masjid, E-130, Gali No.6, Third Pusta Main Rd, Jagjeet Nagar, Delhi, 110053","Third Pushta, Nayagaon, Jagjeet Nagar, Shahdara","E-130, Gali No.6, Third Pusta Main Rd",Delhi,110053,Delhi,IN,https://www.google.com/maps/place/Munwara+Masjid/data=!4m7!3m6!1s0x390cfc44ec3cee7b:0x6817d8194e44c0a7!8m2!3d28.6861966!4d77.2559837!16s%2Fg%2F12hq6qdwg!19sChIJe-487ET8DDkRp8BEThnYF2g?authuser=0&hl=en&rclk=1,"28.6861966,77.2559837"
Masjid,Mosque,"Masjid, Generator section LNH, Maulana Azad Medical College Campus, LNJP Colony, New Delhi, Delhi, 110002","Maulana Azad Medical College Campus, LNJP Colony",Generator section LNH,"New Delhi, Delhi",110002,Delhi,IN,https://www.google.com/maps/place/Masjid/data=!4m7!3m6!1s0x390cfda80d3a142f:0x7e63ba6e21dc1e97!8m2!3d28.6378466!4d77.2379581!16s%2Fg%2F11ss881009!19sChIJLxQ6Daj9DDkRlx7cIW66Y34?authuser=0&hl=en&rclk=1,"28.6378466,77.2379581"
Masjid,Mosque,"M65J+GV7 Masjid, Chhippy Wada, Chandni Chowk, Delhi, 110006","Chhippy Wada, Chandni Chowk",M65J+GV7,Delhi,110006,Delhi,IN,https://www.google.com/maps/place/Masjid/data=!4m7!3m6!1s0x390cfd04823e663b:0x88920d6fe0b74a65!8m2!3d28.6587916!4d77.2321828!16s%2Fg%2F11n0gg69p2!19sChIJO2Y-ggT9DDkRZUq34G8Nkog?authuser=0&hl=en&rclk=1,"28.658791599999997,77.23218279999999"
Umar Masjid,Mosque,"V8XV+7WP Umar Masjid, Shatabdi Nagar, N 10, Cidco, Aurangabad, Maharashtra 431003","Shatabdi Nagar, N 10, Cidco",V8XV+7WP,Aurangabad,431003,Maharashtra,IN,https://www.google.com/maps/place/Umar+Masjid/data=!4m7!3m6!1s0x3bdba367e83400f1:0x768348c04146d603!8m2!3d19.8982037!4d75.3448424!16s%2Fg%2F11fd4zdvvy!19sChIJ8QA06Gej2zsRA9ZGQcBIg3Y?authuser=0&hl=en&rclk=1,"19.8982037,75.34484239999999"
Masjid,Mosque,"Masjid, Gali No 19, Gali Number 1, Mustafabad Extn, New Mustafabad, Delhi, 110094","E2 Block, Mustafabad Extn, New Mustafabad","Gali No 19, Gali Number 1",Delhi,110094,Delhi,IN,https://www.google.com/maps/place/Masjid/data=!4m7!3m6!1s0x390cfc1b020b0e91:0xb48a3c3233e41cbd!8m2!3d28.711773!4d77.272563!16s%2Fg%2F12hpqnhjr!19sChIJkQ4LAhv8DDkRvRzkMzI8irQ?authuser=0&hl=en&rclk=1,"28.711772999999997,77.27256299999999"
Masjid,Mosque,"Masjid, C-536, Part 2, Pusta Number 2, Sonia Vihar, New Delhi, Delhi, 110090","Part 2, Pusta Number 2, Sonia Vihar",C-536,"New Delhi, Delhi",110090,Delhi,IN,https://www.google.com/maps/place/Masjid/data=!4m7!3m6!1s0x390cff7caf8b299d:0x134ae92c2f21b4cd!8m2!3d28.721128!4d77.2466876!16s%2Fg%2F11rgg3n_52!19sChIJnSmLr3z_DDkRzbQhLyzpShM?authuser=0&hl=en&rclk=1,"28.721128,77.2466876"
Masjid,Mosque,"Masjid, 8/2, Budh Bazar, Block L 1, Devli, Sangam Vihar, New Delhi, Delhi 110062","Budh Bazar, Block L 1, Devli, Sangam Vihar",8/2,New Delhi,110062,Delhi,IN,https://www.google.com/maps/place/Masjid/data=!4m7!3m6!1s0x390ce1dde82b3bc3:0x4d3537cacd38aec4!8m2!3d28.4940769!4d77.2261653!16s%2Fg%2F11rk33_10p!19sChIJwzsr6N3hDDkRxK44zco3NU0?authuser=0&hl=en&rclk=1,"28.4940769,77.22616529999999"
Nurul Huda Mosque,Mosque,"V8WQ+VV3 Nurul Huda Mosque, Sambhaji Nagar, Chatrapathi Nagar, St Colony, Collector Office Campus, Aurangabad, Maharashtra 431003","Sambhaji Nagar, Chatrapathi Nagar, Saint Colony, Collector Office Campus",V8WQ+VV3,Aurangabad,,Maharashtra,IN,https://www.google.com/maps/place/Nurul+Huda+Mosque/data=!4m7!3m6!1s0x3bdb99998204cd33:0xdbfe6ecde6cbc157!8m2!3d19.8971405!4d75.3396668!16s%2Fg%2F11h3jg__35!19sChIJM80EgpmZ2zsRV8HL5s1u_ts?authuser=0&hl=en&rclk=1,"19.8971405,75.3396668"
Kadar Masjid,Mosque,"V8JV+838 Kadar Masjid, Galli Number 1A, Purv, Sanjay Nagar, Mondha, Aurangabad, Maharashtra 431003","Purv, Sanjay Nagar, Mondha","V8JV+838, Galli Number 1A",Aurangabad,431003,Maharashtra,IN,https://www.google.com/maps/place/Kadar+Masjid/data=!4m7!3m6!1s0x3bdba3ae00be1665:0xe2c5e0a6e6780bee!8m2!3d19.8807912!4d75.3427063!16s%2Fg%2F11s51kmknm!19sChIJZRa-AK6j2zsR7gt45qbgxeI?authuser=0&hl=en&rclk=1,"19.880791199999997,75.3427063"
Masjid,Mosque,"Masjid, 94L, Adarsh Mohalla, Block P, Mayur Vihar, Delhi, 110091","Adarsh Mohalla, Block P, Mayur Vihar",94L,Delhi,110091,Delhi,IN,https://www.google.com/maps/place/Masjid/data=!4m7!3m6!1s0x390ce594aaf9a4ed:0x7705b6bd1214d779!8m2!3d28.6097585!4d77.2915521!16s%2Fg%2F11vdfgxvzr!19sChIJ7aT5qpTlDDkRedcUEr22BXc?authuser=0&hl=en&rclk=1,"28.609758499999998,77.29155209999999"
Maqqi masjid,Mosque,"Maqqi masjid, khushal park, Chand Market, Main Road, Loni, Ghaziabad, Uttar Pradesh 201102",Loni,"khushal park, Chand Market, Main Road",Ghaziabad,201102,Uttar Pradesh,IN,https://www.google.com/maps/place/Maqqi+masjid/data=!4m7!3m6!1s0x390cff5e0ec94889:0x5f11a2cfa7f2d1f6!8m2!3d28.7591698!4d77.2711527!16s%2Fg%2F11q57z_dlr!19sChIJiUjJDl7_DDkR9tHyp8-iEV8?authuser=0&hl=en&rclk=1,"28.7591698,77.2711527"
Masjid sunni,Mosque,"P7CX+G4M Masjid sunni, Unnamed Road, Behta Hajipur, Ghaziabad, Uttar Pradesh 201102",Behta Hajipur,"P7CX+G4M, Unnamed Road",Ghaziabad,201102,Uttar Pradesh,IN,https://www.google.com/maps/place/Masjid+sunni/data=!4m7!3m6!1s0x390cfbb6924f4903:0xa36061fd4ef104ee!8m2!3d28.7213123!4d77.2977873!16s%2Fg%2F11tc6kljzs!19sChIJA0lPkrb7DDkR7gTxTv1hYKM?authuser=0&hl=en&rclk=1,"28.721312299999997,77.2977873"
Masjid,Mosque,"M794+RG5 Masjid, Block A, Shastri Park, Shahdara, Delhi, 110053","Block A, Shastri Park, Shahdara",M794+RG5,Delhi,,Delhi,IN,https://www.google.com/maps/place/Masjid/data=!4m7!3m6!1s0x390cfd74b6378221:0x2da5c9212f831088!8m2!3d28.6695164!4d77.2563643!16s%2Fg%2F11tb42z9g0!19sChIJIYI3tnT9DDkRiBCDLyHJpS0?authuser=0&hl=en&rclk=1,"28.6695164,77.2563643"
