name,main_category,address,address_ward,address_street,address_city,address_postal_code,address_state,address_country_code,link,coordinates
Masjid Jami Negeri Kawa,Mosque,"34GV+W62 Masjid Jami Negeri Kawa, Jl. Ustadz Khidhir Al-Mulkiy, Negeri Kawa, Kec. Seram Bar., Kabupaten Seram Bagian Barat, Maluku, Indonesia","Negeri Kawa, Seram Barat","34GV+W62, Jl. Ustadz Khidhir Al-Mulkiy",West Seram,,Maluku,ID,https://www.google.com/maps/place/Masjid+Jami+Negeri+Kawa/data=!4m7!3m6!1s0x2d6e82cde78d87d9:0x5a0e08ec59fddcda!8m2!3d-2.9227361!4d128.1430088!16s%2Fg%2F11d_1vbkkv!19sChIJ2YeN582Cbi0R2tz9WewIDlo?authuser=0&hl=en&rclk=1,"-2.9227361,128.1430088"
Masjid Babburrahman Dusun Saju,Mosque,"JGXC+8W6 Masjid Babburrahman Dusun Saju, Jl. Trans Seram, Tehoru, Central Maluku Regency, Maluku, Indonesia",Tehoru,"JGXC+8W6, Jl. Trans Seram",Central Maluku Regency,,Maluku,ID,https://www.google.com/maps/place/Masjid+Babburrahman+Dusun+Saju/data=!4m7!3m6!1s0x2d6a599439b9e9e9:0x81300a4e8db9f9cb!8m2!3d-3.3517179!4d129.5222684!16s%2Fg%2F11pxwytk52!19sChIJ6em5OZRZai0Ry_m5jU4KMIE?authuser=0&hl=en&rclk=1,"-3.3517178999999997,129.5222684"
Masjid Jami,Mosque,"RV89+GGP Masjid Jami, Waesala, Kec. Huamual Belakang, Kabupaten Seram Bagian Barat, Maluku, Indonesia","Waesala, Huamual Belakang",RV89+GGP,West Seram,,Maluku,ID,https://www.google.com/maps/place/Masjid+Jami/data=!4m7!3m6!1s0x2d6dc9a0eed42ae9:0x1a2bca1fbd6333ad!8m2!3d-3.1836671!4d127.8688253!16s%2Fg%2F11dft3j2h_!19sChIJ6SrU7qDJbS0RrTNjvR_KKxo?authuser=0&hl=en&rclk=1,"-3.1836670999999996,127.8688253"
Masjid Shamsul Qamar @ Suraj wali Masjid,Mosque,"Masjid Shamsul Qamar @ Suraj wali Masjid, 318, Dariba Kalan Rd, Kucha Alam, Chandni Chowk, New Delhi, Delhi, 110006","Kucha Alam, Chandni Chowk","318, Dariba Kalan Rd","New Delhi, Delhi",110006,Delhi,IN,https://www.google.com/maps/place/Masjid+Shamsul+Qamar+@+Suraj+wali+Masjid/data=!4m7!3m6!1s0x390cfd1be6cf6f7b:0x43ed1fadfe18a46c!8m2!3d28.6540031!4d77.233588!16s%2Fg%2F11fzwh0881!19sChIJe2_P5hv9DDkRbKQY_q0f7UM?authuser=0&hl=en&rclk=1,"28.654003099999997,77.233588"
Masjid Saguwa Wali (Choti Masjid),Mosque,"Masjid Saguwa Wali (Choti Masjid), 1614, Old Dariya Ganj, Daryaganj, New Delhi, Delhi, 110002","Old Dariya Ganj, Daryaganj",1614,"New Delhi, Delhi",110002,Delhi,IN,https://www.google.com/maps/place/Masjid+Saguwa+Wali+%28Choti+Masjid%29/data=!4m7!3m6!1s0x390cfde70c37cfe3:0xcd9ebd43305f88c8!8m2!3d28.6470267!4d77.2382029!16s%2Fg%2F11f7qykm_q!19sChIJ4883DOf9DDkRyIhfMEO9ns0?authuser=0&hl=en&rclk=1,"28.647026699999998,77.23820289999999"
Masjid,Mosque,"Masjid, Molarband, Badarpur, New Delhi, Delhi 110044","Molarband, Badarpur",,New Delhi,110044,Delhi,IN,https://www.google.com/maps/place/Masjid/data=!4m7!3m6!1s0x390ce75604c9317b:0x95388f2bb1f0f9b2!8m2!3d28.5063324!4d77.3130947!16s%2Fg%2F11rkpbdy5r!19sChIJezHJBFbnDDkRsvnwsSuPOJU?authuser=0&hl=en&rclk=1,"28.506332399999998,77.3130947"
Masjid-i-Mujaab (salfi Masjid),Mosque,"7C3W+C34 Masjid-i-Mujaab (salfi Masjid), near Railway track, Peth Seer, 193201",,"7C3W+C34, near Railway track",Peth Seer,,,IN,https://www.google.com/maps/place/Masjid-i-Mujaab+%28salfi+Masjid%29/data=!4m7!3m6!1s0x38e109a4b56898ff:0xce48d1186bda5a8d!8m2!3d34.2535164!4d74.4452004!16s%2Fg%2F11sy_7cd7h!19sChIJ_5hotaQJ4TgRjVraaxjRSM4?authuser=0&hl=en&rclk=1,"34.253516399999995,74.44520039999999"
"Masjid Nurul Insan, Samboru Rumata",Mosque,"297G+2CM Masjid Nurul Insan, Samboru Rumata, Samboru, Kec. Pulau Gorom, Kabupaten Seram Bagian Timur, Maluku, Indonesia","Samboru, Pulau Gorom",297G+2CM,East Seram,,Maluku,ID,"https://www.google.com/maps/place/Masjid+Nurul+Insan,+Samboru+Rumata/data=!4m7!3m6!1s0x2d38b12a81973469:0xbb21d5d97ee8cf85!8m2!3d-3.9874246!4d131.3760362!16s%2Fg%2F11g1nm4lg7!19sChIJaTSXgSqxOC0Rhc_oftnVIbs?authuser=0&hl=en&rclk=1","-3.9874245999999998,131.3760362"
Masjid Darussalam,Mosque,"8RQJ+55X Masjid Darussalam, Kiandarat, Kian Darat, Kabupaten Seram Bagian Timur, Maluku, Indonesia","Kiandarat, Kian Darat",8RQJ+55X,East Seram,,Maluku,ID,https://www.google.com/maps/place/Masjid+Darussalam/data=!4m7!3m6!1s0x2d4091a3bb58f727:0x8a21f48d22be2e2b!8m2!3d-3.6620136!4d130.830495!16s%2Fg%2F11g8p2bn2l!19sChIJJ_dYu6ORQC0RKy6-Io30IYo?authuser=0&hl=en&rclk=1,"-3.6620136,130.83049499999998"
Somnabhar Masjid,Mosque,"6WCQ+X5Q Somnabhar Masjid, Somnabhar, Uttar Pradesh 227408",,6WCQ+X5Q,Somnabhar,,Uttar Pradesh,IN,https://www.google.com/maps/place/Somnabhar+Masjid/data=!4m7!3m6!1s0x399a61875529c679:0x11bf726bb2604942!8m2!3d26.2224631!4d81.9379791!16s%2Fg%2F11hdqjnx2d!19sChIJecYpVYdhmjkRQklgsmtyvxE?authuser=0&hl=en&rclk=1,"26.2224631,81.93797909999999"
Sufi Sarmad Masjid,Mosque,"M62M+9VV Sufi Sarmad Masjid, Meena Bazaar, Jama Masjid, Chandni Chowk, New Delhi, Delhi, 110006","Meena Bazaar, Jama Masjid, Chandni Chowk",M62M+9VV,"New Delhi, Delhi",110006,Delhi,IN,https://www.google.com/maps/place/Sufi+Sarmad+Masjid/data=!4m7!3m6!1s0x390cfd41357cf49b:0xda7c94c6b059c8ec!8m2!3d28.6509791!4d77.2346736!16s%2Fg%2F11qsszk22b!19sChIJm_R8NUH9DDkR7MhZsMaUfNo?authuser=0&hl=en&rclk=1,"28.650979099999997,77.2346736"
nazra Jama Masjid,Mosque,"M644+2QH nazra Jama Masjid, Sarai Khalil, Sadar Bazaar, Delhi, 847102","Sarai Khalil, Sadar Bazaar",M644+2QH,Delhi,847102,Delhi,IN,https://www.google.com/maps/place/nazra+Jama+Masjid/data=!4m7!3m6!1s0x390cfd87a2b947df:0xc5eef572a3787906!8m2!3d28.6550711!4d77.2069937!16s%2Fg%2F11h03dscpw!19sChIJ30e5oof9DDkRBnl4o3L17sU?authuser=0&hl=en&rclk=1,"28.655071099999997,77.2069937"
Masjid,Mosque,"H4Q9+GQ2 Masjid, Sadar Bazaar, Delhi Cantonment, New Delhi, Delhi 110010","Sadar Bazaar, Delhi Cantonment",H4Q9+GQ2,New Delhi,110010,Delhi,IN,https://www.google.com/maps/place/Masjid/data=!4m7!3m6!1s0x390d1de7a344966b:0x439561fcffba0204!8m2!3d28.5887553!4d77.1193923!16s%2Fg%2F11vlmpcmn5!19sChIJa5ZEo-cdDTkRBAK6__xhlUM?authuser=0&hl=en&rclk=1,"28.5887553,77.1193923"
Musalla Masjid,Mosque,"Musalla Masjid, A84, Gali Number 19, Block B, Bharat Vihar, Madhu Vihar, New Delhi, Delhi, 110059","Block B, Bharat Vihar, Madhu Vihar","A84, Gali Number 19","New Delhi, Delhi",110059,Delhi,IN,https://www.google.com/maps/place/Musalla+Masjid/data=!4m7!3m6!1s0x390d1b5228eab2b5:0x4c225624c80dfd40!8m2!3d28.6062216!4d77.0614438!16s%2Fg%2F11t6nng3_f!19sChIJtbLqKFIbDTkRQP0NyCRWIkw?authuser=0&hl=en&rclk=1,"28.606221599999998,77.06144379999999"
Masjid Islamuddin,Place of worship,"M6G3+629 Masjid Islamuddin, Basti Harphool Singh, Subzi Mandi, Delhi, 110007","Basti Harphool Singh, Subzi Mandi",M6G3+629,Delhi,110007,Delhi,IN,https://www.google.com/maps/place/Masjid+Islamuddin/data=!4m7!3m6!1s0x390cfd845b000001:0x90d83cb23e84b555!8m2!3d28.6755426!4d77.202595!16s%2Fg%2F11clhqsfc5!19sChIJAQAAW4T9DDkRVbWEPrI82JA?authuser=0&hl=en&rclk=1,"28.6755426,77.202595"
Masjid,Mosque,"Masjid, 8/2, Budh Bazar, Block L 1, Devli, Sangam Vihar, New Delhi, Delhi 110062","Budh Bazar, Block L 1, Devli, Sangam Vihar",8/2,New Delhi,110062,Delhi,IN,https://www.google.com/maps/place/Masjid/data=!4m7!3m6!1s0x390ce1dde82b3bc3:0x4d3537cacd38aec4!8m2!3d28.4940769!4d77.2261653!16s%2Fg%2F11rk33_10p!19sChIJwzsr6N3hDDkRxK44zco3NU0?authuser=0&hl=en&rclk=1,"28.4940769,77.22616529999999"
Masjid-e-Aqsa,Mosque,"5W6V+HGM Masjid-e-Aqsa, Nanuka, Haryana 122015",,5W6V+HGM,Nanuka,122015,Haryana,IN,https://www.google.com/maps/place/Masjid-e-Aqsa/data=!4m7!3m6!1s0x390d31e65512ccc9:0x9bb45c3973141159!8m2!3d28.1614439!4d76.9438944!16s%2Fg%2F11sw59r2kj!19sChIJycwSVeYxDTkRWREUczlctJs?authuser=0&hl=en&rclk=1,"28.1614439,76.94389439999999"
Sarsand Masjid (Sarsand Masque),Mosque,"388P+WF9 Sarsand Masjid (Sarsand Masque), Mahmadpur Dhatigarah, Uttar Pradesh 241201",,388P+WF9,Mahmadpur Dhatigarah,241201,Uttar Pradesh,IN,https://www.google.com/maps/place/Sarsand+Masjid+%28Sarsand+Masque%29/data=!4m7!3m6!1s0x399e9167bcc7ed51:0x261ceba9a4e884ac!8m2!3d27.0672787!4d80.3362412!16s%2Fg%2F11rdd2nk83!19sChIJUe3HvGeRnjkRrITopKnrHCY?authuser=0&hl=en&rclk=1,"27.0672787,80.3362412"
JAMIA MASJID SEMPORA,Mosque,"PX79+585 JAMIA MASJID SEMPORA, Sampora Derapora, Chaki Hanjan, 192232",,PX79+585,"Sampora Derapora, Chaki Hanjan",,,IN,https://www.google.com/maps/place/JAMIA+MASJID+SEMPORA/data=!4m7!3m6!1s0x38e2032fff8d65cb:0x4197912ff238c709!8m2!3d33.7128779!4d74.9683639!16s%2Fg%2F11q4djjbmt!19sChIJy2WN_y8D4jgRCcc48i-Rl0E?authuser=0&hl=en&rclk=1,"33.712877899999995,74.9683639"
Masjid Talang Seram,Mosque,"4QMC+F48 Masjid Talang Seram, desa, Sungai Sibur, Kec. Sungai Menang, Kabupaten Ogan Komering Ilir, Sumatera Selatan 30681, Indonesia","Sibur River, Sungai Menang","4QMC+F48, desa",Ogan Komering Ilir Regency,30681,South Sumatra,ID,https://www.google.com/maps/place/Masjid+Talang+Seram/data=!4m7!3m6!1s0x2e3e8ba5908c734d:0x94ac72eaf453a0e0!8m2!3d-3.8663366!4d105.7703282!16s%2Fg%2F11hdxxv15h!19sChIJTXOMkKWLPi4R4KBT9OpyrJQ?authuser=0&hl=en&rclk=1,"-3.8663366,105.7703282"
Masjid Raya Desa Selor,Mosque,"8FQ3+R7C Masjid Raya Desa Selor, Selor, Kilmury, Kec. Seram Tim., Kabupaten Seram Bagian Timur, Maluku, Indonesia","Kilmury, Seram Timur",8FQ3+R7C Selor,East Seram,,Maluku,ID,https://www.google.com/maps/place/Masjid+Raya+Desa+Selor/data=!4m7!3m6!1s0x2d40699456c07ccb:0xeb1f71720ece541b!8m2!3d-3.6604285!4d130.4531312!16s%2Fg%2F11mw04fbw2!19sChIJy3zAVpRpQC0RG1TODnJxH-s?authuser=0&hl=en&rclk=1,"-3.6604284999999996,130.4531312"
Masjid Nurul Iman,Mosque,"5PFX+63P Masjid Nurul Iman, Urung, Kec. Seram Tim., Kabupaten Seram Bagian Timur, Maluku, Indonesia","Urung, Seram Timur",5PFX+63P,East Seram,,Maluku,ID,https://www.google.com/maps/place/Masjid+Nurul+Iman/data=!4m7!3m6!1s0x2d408265be621637:0x4e772165788d5910!8m2!3d-3.8269111!4d130.7477091!16s%2Fg%2F11dftgylj2!19sChIJNxZivmWCQC0REFmNeGUhd04?authuser=0&hl=en&rclk=1,"-3.8269111,130.74770909999998"
Masjid maqaam,Mosque,"7FM6+6VF Masjid maqaam, Bagi Islam colony, Peth Seer",,"7FM6+6VF, Bagi Islam colony","Peth Seer, Sopore",,,IN,https://www.google.com/maps/place/Masjid+maqaam/data=!4m7!3m6!1s0x38e1097b1609facf:0x123202d56a9084bd!8m2!3d34.2830737!4d74.4621684!16s%2Fg%2F11py338wxq!19sChIJz_oJFnsJ4TgRvYSQatUCMhI?authuser=0&hl=en&rclk=1,"34.283073699999996,74.4621684"
MASJID AT-TAQWA,Mosque,"7RXC+3GF MASJID AT-TAQWA, Kian Laut, Kec. Seram Tim., Kabupaten Seram Bagian Timur, Maluku, Indonesia","Kian Laut, Seram Timur",7RXC+3GF,East Seram,,Maluku,ID,https://www.google.com/maps/place/MASJID+AT-TAQWA/data=!4m7!3m6!1s0x2d409164b11bf9ef:0x7cedc096b1dc398!8m2!3d-3.7023219!4d130.8213062!16s%2Fg%2F11rsg7vrzq!19sChIJ7_kbsWSRQC0RmMMdawnczgc?authuser=0&hl=en&rclk=1,"-3.7023219,130.82130619999998"
maszid,Mosque,"maszid, Bhagawan, Bhagwa Bazar Patti, Madhya Pradesh 471313",,,"Bhagawan, Bhagwa Bazar Patti",,Madhya Pradesh,IN,https://www.google.com/maps/place/maszid/data=!4m7!3m6!1s0x39786321f8c10605:0x33ee038a3f1ef8d8!8m2!3d24.5664595!4d79.1778553!16s%2Fg%2F11r8qwtfh!19sChIJBQbB-CFjeDkR2PgeP4oD7jM?authuser=0&hl=en&rclk=1,"24.5664595,79.17785529999999"
Masjid Nurul Yaqin,Mosque,"7R4H+V76 Masjid Nurul Yaqin, Kian Laut, Kec. Seram Tim., Kabupaten Seram Bagian Timur, Maluku, Indonesia","Kian Laut, Seram Timur",7R4H+V76,East Seram,,Maluku,ID,https://www.google.com/maps/place/Masjid+Nurul+Yaqin/data=!4m7!3m6!1s0x2d409b04bbc0f7c7:0x9e9509c6c01bc188!8m2!3d-3.7428309!4d130.8281417!16s%2Fg%2F11g8p31jqb!19sChIJx_fAuwSbQC0RiMEbwMYJlZ4?authuser=0&hl=en&rclk=1,"-3.7428309,130.8281417"
Masjid Al Mutmainnah,Mosque,"Q7PJ+XCC Masjid Al Mutmainnah, Jl. Trans Seram, Kamal, Kec. Kairatu Bar., Kabupaten Seram Bagian Barat, Maluku, Indonesia","Kamal, Kairatu Barat","Q7PJ+XCC, Jl. Trans Seram",West Seram,,Maluku,ID,https://www.google.com/maps/place/Masjid+Al+Mutmainnah/data=!4m7!3m6!1s0x2d6c41e71727155d:0x71430f3f4bd308dd!8m2!3d-3.2125624!4d128.2810262!16s%2Fg%2F11hkj59jph!19sChIJXRUnF-dBbC0R3QjTSz8PQ3E?authuser=0&hl=en&rclk=1,"-3.2125624,128.28102619999999"
Masjid,Mosque,"9CC3+4WP Masjid, San Kari, 185151",,9CC3+4WP,San Kari,,,IN,https://www.google.com/maps/place/Masjid/data=!4m7!3m6!1s0x391e2fb68fe31edd:0x128d121acfed66a!8m2!3d33.370343!4d74.4048237!16s%2Fg%2F11sgj3tp_7!19sChIJ3R7jj7YvHjkRatb-rCHRKAE?authuser=0&hl=en&rclk=1,"33.370343,74.4048237"
Al-Hakim Mosque,Mosque,"5PGH+HC6 Al-Hakim Mosque, Urung, Seram Timur, East Seram, Maluku, Indonesia","Urung, Seram Timur",5PGH+HC6,East Seram,,Maluku,ID,https://www.google.com/maps/place/Al-Hakim+Mosque/data=!4m7!3m6!1s0x2d408217cb541cfd:0xb758c97c3e838f9f!8m2!3d-3.8235921!4d130.7285107!16s%2Fg%2F11d_28bmwq!19sChIJ_RxUyxeCQC0Rn4-DPnzJWLc?authuser=0&hl=en&rclk=1,"-3.8235921,130.7285107"
Masjid As-Salam,Mosque,"WF6J+25F Masjid As-Salam, Jalan BARU KPU, Bula, Kec. Bula, Kabupaten Seram Bagian Timur, Maluku, Indonesia",Bula,"WF6J+25F, Jalan BARU KPU",East Seram,,Maluku,ID,https://www.google.com/maps/place/Masjid+As-Salam/data=!4m7!3m6!1s0x2d4199ee0c3b7a93:0xbcca6bc0db2df8b6!8m2!3d-3.089936!4d130.4804112!16s%2Fg%2F11fht4k1_d!19sChIJk3o7DO6ZQS0Rtvgt28Bryrw?authuser=0&hl=en&rclk=1,"-3.089936,130.4804112"
Masjid Raya Kilmury,Mosque,"7FWM+64X Masjid Raya Kilmury, Kilmury, Seram Timur, East Seram, Maluku, Indonesia","Kilmury, Seram Timur",7FWM+64X,East Seram,,Maluku,ID,https://www.google.com/maps/place/Masjid+Raya+Kilmury/data=!4m7!3m6!1s0x2d40656f70bc6cb3:0xa3cc8803c7afd47!8m2!3d-3.7043873!4d130.4828724!16s%2Fg%2F11f11pk1q8!19sChIJs2y8cG9lQC0RR_16PIDIPAo?authuser=0&hl=en&rclk=1,"-3.7043873,130.4828724"
Masjid,Mosque,"Shop No: 5035, Masjid, Netaji Subhash Marg, Daryaganj, New Delhi, Delhi, 110002",Daryaganj,"Shop No: 5035, Netaji Subhash Marg","New Delhi, Delhi",110002,Delhi,IN,https://www.google.com/maps/place/Masjid/data=!4m7!3m6!1s0x390cfdf175041b95:0x8ef57a2bc9f92c1c!8m2!3d28.6480954!4d77.2403964!16s%2Fg%2F11s664lvxh!19sChIJlRsEdfH9DDkRHCz5ySt69Y4?authuser=0&hl=en&rclk=1,"28.6480954,77.2403964"
Masjid Mohammadiya,Mosque,"M675+4VF Masjid Mohammadiya, Bahadurgarh Rd, Hathi Khana, Sadar Bazaar, New Delhi, Delhi, 110006","Hathi Khana, Sadar Bazaar","M675+4VF, Bahadurgarh Rd","New Delhi, Delhi",110006,Delhi,IN,https://www.google.com/maps/place/Masjid+Mohammadiya/data=!4m7!3m6!1s0x390cfd1e19b763d7:0xf26449d51a7a5a53!8m2!3d28.6628007!4d77.2096573!16s%2Fg%2F11tfwp5hs4!19sChIJ12O3GR79DDkRU1p6GtVJZPI?authuser=0&hl=en&rclk=1,"28.6628007,77.2096573"
Jamete islami Markaz Masjid,Mosque,"H73W+G6F Jamete islami Markaz Masjid, Abul Fazal Enclave Part 2, Jamia Nagar, Okhla, New Delhi, Delhi 110025","Abul Fazal Enclave Part 2, Jamia Nagar, Okhla",H73W+G6F,New Delhi,110025,Delhi,IN,https://www.google.com/maps/place/Jamete+islami+Markaz+Masjid/data=!4m7!3m6!1s0x390ce584b6f10bd5:0xdadc52adbd2e5235!8m2!3d28.5538228!4d77.2955576!16s%2Fg%2F11t061tn1_!19sChIJ1QvxtoTlDDkRNVIuva1S3No?authuser=0&hl=en&rclk=1,"28.5538228,77.2955576"
Masjid,Mosque,"Masjid, 20, Masjid Rd, Pervesh Nagar, Mubarakpur Dabas, New Delhi, Delhi, 110081","Pervesh Nagar, Mubarakpur Dabas","20, Masjid Rd","New Delhi, Delhi",110081,Delhi,IN,https://www.google.com/maps/place/Masjid/data=!4m7!3m6!1s0x390d075632dea237:0xe707b406c4cff64!8m2!3d28.7098866!4d77.0310854!16s%2Fg%2F11kq2cq2_1!19sChIJN6LeMlYHDTkRZP9MbEB7cA4?authuser=0&hl=en&rclk=1,"28.709886599999997,77.0310854"
Masjid,Mosque,"J2WM+MXF Masjid, Sunni Masjid Rd, Deep Enclave, Hastsal, Delhi, 110059","Deep Enclave, Hastsal","J2WM+MXF, Sunni Masjid Rd",Delhi,110059,Delhi,IN,https://www.google.com/maps/place/Masjid/data=!4m7!3m6!1s0x390d05267bb46283:0xaef6f06f366d7113!8m2!3d28.6466834!4d77.0349292!16s%2Fg%2F11vl8tpxw1!19sChIJg2K0eyYFDTkRE3FtNm_w9q4?authuser=0&hl=en&rclk=1,"28.646683399999997,77.0349292"
Masjid,Mosque,"W4X5+C3X Masjid, Bazidpur, Haryana 122508",,W4X5+C3X,Bazidpur,,Haryana,IN,https://www.google.com/maps/place/Masjid/data=!4m7!3m6!1s0x3972d78636d1a3c5:0xee4f8d1680829d38!8m2!3d27.9486005!4d77.1077437!16s%2Fg%2F11k02z3y7b!19sChIJxaPRNobXcjkROJ2CgBaNT-4?authuser=0&hl=en&rclk=1,"27.948600499999998,77.1077437"
Saqlaini jama masjid,Mosque,"G3XH+HF2 Saqlaini jama masjid, Shahadra, Uttar Pradesh 243701",,G3XH+HF2,Shahadra,,Uttar Pradesh,IN,https://www.google.com/maps/place/Saqlaini+jama+masjid/data=!4m7!3m6!1s0x390abf4b18f6a0e3:0x9ba1c32ec9f7e5cc!8m2!3d28.5488984!4d79.0786281!16s%2Fg%2F11snv9yytk!19sChIJ46D2GEu_CjkRzOX3yS7DoZs?authuser=0&hl=en&rclk=1,"28.5488984,79.0786281"
Masjid,Mosque,"F6CG+2C2 Masjid, Kallar majri, Punjab 147202",,F6CG+2C2,Kallar majri,,Punjab,IN,https://www.google.com/maps/place/Masjid/data=!4m7!3m6!1s0x39103d9a22f4c13d:0xa49980f91076f1d4!8m2!3d30.4700042!4d76.2260126!16s%2Fg%2F11s1wcw5rw!19sChIJPcH0Ipo9EDkR1PF2EPmAmaQ?authuser=0&hl=en&rclk=1,"30.470004199999998,76.22601259999999"
Masjid As-Syukuriyah,Mosque,"24R8+WH8 Masjid As-Syukuriyah, Negeri Kawa, Kec. Seram Bar., Kabupaten Seram Bagian Barat, Maluku, Indonesia","Negeri Kawa, Seram Barat",24R8+WH8,West Seram,,Maluku,ID,https://www.google.com/maps/place/Masjid+As-Syukuriyah/data=!4m7!3m6!1s0x2d6c29ac23fbcf95:0xe8c934081eeeb69d!8m2!3d-2.9577141!4d128.1164581!16s%2Fg%2F11kb9v8y2n!19sChIJlc_7I6wpbC0RnbbuHgg0yeg?authuser=0&hl=en&rclk=1,"-2.9577141,128.1164581"
Masjid,Mosque,"4XC3+6WW Masjid, Kilwaru, Kec. Seram Tim., Kabupaten Seram Bagian Timur, Maluku, Indonesia","Kilwaru, Seram Timur",4XC3+6WW,East Seram,,Maluku,ID,https://www.google.com/maps/place/Masjid/data=!4m7!3m6!1s0x2d3f6181e1202661:0x80ed347337bd1cfe!8m2!3d-3.8793812!4d130.9548349!16s%2Fg%2F11hsxshqzw!19sChIJYSYg4YFhPy0R_hy9N3M07YA?authuser=0&hl=en&rclk=1,"-3.8793811999999996,130.95483489999998"
Masjid,Mosque,"4W8P+M9 Masjid, Kilwaru, Kec. Seram Tim., Kabupaten Seram Bagian Timur, Maluku, Indonesia","Kilwaru, Seram Timur",4W8P+M9,East Seram,,Maluku,ID,https://www.google.com/maps/place/Masjid/data=!4m7!3m6!1s0x2d3f619b8424a957:0x14e1a474712536d2!8m2!3d-3.8833474!4d130.9359501!16s%2Fg%2F11t6nhvnd9!19sChIJV6kkhJthPy0R0jYlcXSk4RQ?authuser=0&hl=en&rclk=1,"-3.8833474,130.93595009999999"
Masjid Nurul Iman,Mosque,"7R3H+C8G Masjid Nurul Iman, Kian Laut, Kec. Seram Tim., Kabupaten Seram Bagian Timur, Maluku, Indonesia","Kian Laut, Seram Timur",7R3H+C8G,East Seram,,Maluku,ID,https://www.google.com/maps/place/Masjid+Nurul+Iman/data=!4m7!3m6!1s0x2d409b0ff3b42a35:0xcef763a564dc80f!8m2!3d-3.7464351!4d130.8283208!16s%2Fg%2F11dftgq425!19sChIJNSq08w-bQC0RD8hNVjp27ww?authuser=0&hl=en&rclk=1,"-3.7464351,130.8283208"
Masjid,Mosque,"4W8G+VF Masjid, Kilwaru, Kec. Seram Tim., Kabupaten Seram Bagian Timur, Maluku, Indonesia","Kilwaru, Seram Timur",4W8G+VF,East Seram,,Maluku,ID,https://www.google.com/maps/place/Masjid/data=!4m7!3m6!1s0x2d3f61753408572b:0x6bb7ac988f23d51e!8m2!3d-3.8827838!4d130.9262254!16s%2Fg%2F11t524f9st!19sChIJK1cINHVhPy0RHtUjj5ist2s?authuser=0&hl=en&rclk=1,"-3.8827838,130.9262254"
Masjid Jami,Mosque,"W4M7+7M8 Masjid Jami, Piru, Kec. Seram Bar., Kabupaten Seram Bagian Barat, Maluku, Indonesia","Piru, Seram Barat",W4M7+7M8,West Seram,,Maluku,ID,https://www.google.com/maps/place/Masjid+Jami/data=!4m7!3m6!1s0x2d6c2fcfdbc64395:0x6c1b7316d0d0a583!8m2!3d-3.0668368!4d128.1142164!16s%2Fg%2F11g8nn_qtw!19sChIJlUPG288vbC0Rg6XQ0BZzG2w?authuser=0&hl=en&rclk=1,"-3.0668368,128.1142164"
Masjid Al Sekeyali,Mosque,"237P+RJW Masjid Al Sekeyali, Negeri Kawa, Kec. Seram Bar., Kabupaten Seram Bagian Barat, Maluku, Indonesia","Negeri Kawa, Seram Barat",237P+RJW,West Seram,,Maluku,ID,https://www.google.com/maps/place/Masjid+Al+Sekeyali/data=!4m7!3m6!1s0x2d6c299813cf1753:0x751707fb9ac116df!8m2!3d-2.9853661!4d128.0865729!16s%2Fg%2F11jyzj87rb!19sChIJUxfPE5gpbC0R3xbBmvsHF3U?authuser=0&hl=en&rclk=1,"-2.9853661,128.0865729"
Masjid Ar-Rahman Waraswaras,Mosque,"FV23+J2M Masjid Ar-Rahman Waraswaras, Seram Island, Waras-Waras, Maluku, Indonesia",Waras-Waras,FV23+J2M Seram Island,,,Maluku,ID,https://www.google.com/maps/place/Masjid+Ar-Rahman+Waraswaras/data=!4m7!3m6!1s0x2d40ed83cae41783:0x15032969ca28e2b!8m2!3d-3.548424!4d130.8525367!16s%2Fg%2F11j1dc48t7!19sChIJgxfkyoPtQC0RK46inJYyUAE?authuser=0&hl=en&rclk=1,"-3.548424,130.8525367"
Masjid Al Akbar,Mosque,"7RGG+QW7 Masjid Al Akbar, Kian Laut, Kec. Seram Tim., Kabupaten Seram Bagian Timur, Maluku, Indonesia","Kian Laut, Seram Timur",7RGG+QW7,East Seram,,Maluku,ID,https://www.google.com/maps/place/Masjid+Al+Akbar/data=!4m7!3m6!1s0x2d409af2a7841a6d:0xa0ba598960aacc71!8m2!3d-3.7230852!4d130.8273042!16s%2Fg%2F11dftgw173!19sChIJbRqEp_KaQC0RccyqYIlZuqA?authuser=0&hl=en&rclk=1,"-3.7230852,130.8273042"
Masjid Babul Jannah 1,Mosque,"7FXH+Q7H Masjid Babul Jannah 1, Kilmury, Kec. Seram Tim., Kabupaten Seram Bagian Timur, Maluku, Indonesia","Kilmury, Seram Timur",7FXH+Q7H,East Seram,,Maluku,ID,https://www.google.com/maps/place/Masjid+Babul+Jannah+1/data=!4m7!3m6!1s0x2d4065c82fbd22d5:0xa552cd051bed6f90!8m2!3d-3.7005684!4d130.4782385!16s%2Fg%2F11rxxz31q6!19sChIJ1SK9L8hlQC0RkG_tGwXNUqU?authuser=0&hl=en&rclk=1,"-3.7005684,130.4782385"
Masjid Nurul Yaqin,Mosque,"8R3F+739 Masjid Nurul Yaqin, Kian Laut, Kec. Seram Tim., Kabupaten Seram Bagian Timur, Maluku, Indonesia","Kian Laut, Seram Timur",8R3F+739,East Seram,,Maluku,ID,https://www.google.com/maps/place/Masjid+Nurul+Yaqin/data=!4m7!3m6!1s0x2d40906e85c9bbe9:0xde5756dd4d2d63ce!8m2!3d-3.6968345!4d130.8227227!16s%2Fg%2F11dfth1fq3!19sChIJ6bvJhW6QQC0RzmMtTd1WV94?authuser=0&hl=en&rclk=1,"-3.6968345,130.82272269999999"
Masjid,Mosque,"W877+MFP Masjid, Amarsekaru, Kec. Pulau Gorom, Kabupaten Seram Bagian Timur, Maluku, Indonesia","Amarsekaru, Pulau Gorom",W877+MFP,East Seram,,Maluku,ID,https://www.google.com/maps/place/Masjid/data=!4m7!3m6!1s0x2d38cb6bc687495d:0x42a22def453d2e4a!8m2!3d-4.085781!4d131.3137111!16s%2Fg%2F11kl1360yj!19sChIJXUmHxmvLOC0RSi49Re8tokI?authuser=0&hl=en&rclk=1,"-4.085781,131.3137111"
Masjid Al-Irsad,Mosque,"W4MC+WJF Masjid Al-Irsad, Etty, Kec. Seram Bar., Kabupaten Seram Bagian Barat, Maluku, Indonesia","Etty, Seram Barat",W4MC+WJF,West Seram,,Maluku,ID,https://www.google.com/maps/place/Masjid+Al-Irsad/data=!4m7!3m6!1s0x2d6c2fbb0232cf6d:0x623facc7b03f36!8m2!3d-3.0651815!4d128.1215501!16s%2Fg%2F11s2lb6nkh!19sChIJbc8yArsvbC0RNj-wx6w_YgA?authuser=0&hl=en&rclk=1,"-3.0651815,128.1215501"
Masjid Usmab,Mosque,"Q4M5+6P7 Masjid Usmab, Degwar maldyana",,"Q4M5+6P7, Degwar maldyana",,,,IN,https://www.google.com/maps/place/Masjid+Usmab/data=!4m7!3m6!1s0x38e0379b0df64a9b:0x8e4106cde14ff588!8m2!3d33.7830361!4d74.1092861!16s%2Fg%2F11s_xvf6_c!19sChIJm0r2DZs34DgRiPVP4c0GQY4?authuser=0&hl=en&rclk=1,"33.7830361,74.10928609999999"
Masjid Al-Ikhlas,Mosque,"7RGG+RW8 Masjid Al-Ikhlas, Kian Laut, Kec. Seram Tim., Kabupaten Seram Bagian Timur, Maluku, Indonesia","Kian Laut, Seram Timur",7RGG+RW8,East Seram,,Maluku,ID,https://www.google.com/maps/place/Masjid+Al-Ikhlas/data=!4m7!3m6!1s0x2d409b5679025085:0x91f34cd9525991a5!8m2!3d-3.722951!4d130.8273159!16s%2Fg%2F11fw9s5bnj!19sChIJhVACeVabQC0RpZFZUtlM85E?authuser=0&hl=en&rclk=1,"-3.7229509999999997,130.8273159"
Masjid Nurul Jihad,Mosque,"5Q3H+2H6 Masjid Nurul Jihad, Unnamed Road, Urung, Kec. Seram Tim., Kabupaten Seram Bagian Timur, Maluku, Indonesia","Urung, Seram Timur","5Q3H+2H6, Unnamed Road",East Seram,,Maluku,ID,https://www.google.com/maps/place/Masjid+Nurul+Jihad/data=!4m7!3m6!1s0x2d3f7d729576c169:0xc663275d16bb034f!8m2!3d-3.8474535!4d130.778889!16s%2Fg%2F11jg8rhc0m!19sChIJacF2lXJ9Py0RTwO7Fl0nY8Y?authuser=0&hl=en&rclk=1,"-3.8474535,130.778889"
Masjid Jakarta Baru,Mosque,"P385+W5F Masjid Jakarta Baru, Jakarta Baru, Lokki, Kec. Huamual Belakang, Kabupaten Seram Bagian Barat, Maluku, Indonesia","Lokki, Huamual Belakang","P385+W5F, Jakarta Baru",West Seram,,Maluku,ID,https://www.google.com/maps/place/Masjid+Jakarta+Baru/data=!4m7!3m6!1s0x2d6c4d4baf36a037:0xd7b24c8be499e3c0!8m2!3d-3.2826862!4d128.057918!16s%2Fg%2F11rrs2939r!19sChIJN6A2r0tNbC0RwOOZ5ItMstc?authuser=0&hl=en&rclk=1,"-3.2826861999999997,128.057918"
Masjid Nurul Hijrah Waralohi,Mosque,"J93W+VF7 Masjid Nurul Hijrah Waralohi, Jl. Trans Seram, Desa Waralohi, Kec. Kairatu Bar, Kabupaten Seram Bagian Barat, Maluku, Indonesia","Desa Waralohi, Kec. Kairatu Bar","J93W+VF7, Jl. Trans Seram",West Seram,,Maluku,ID,https://www.google.com/maps/place/Masjid+Nurul+Hijrah+Waralohi/data=!4m7!3m6!1s0x2d6c61264e83634f:0x9d2c8a7c63f2ebfa!8m2!3d-3.3953499!4d128.3961681!16s%2Fg%2F11q2rzp6pp!19sChIJT2ODTiZhbC0R-uvyY3yKLJ0?authuser=0&hl=en&rclk=1,"-3.3953499,128.39616809999998"
Masjid,Mosque,"W5RR+847 Masjid, Dusun Wael, Piru, Kec. Seram Bar., Kabupaten Seram Bagian Barat, Maluku, Indonesia","Dusun Wael, Piru, Seram Barat",W5RR+847,West Seram,,Maluku,ID,https://www.google.com/maps/place/Masjid/data=!4m7!3m6!1s0x2d6c25f1bae6e633:0x613a960af5fe561f!8m2!3d-3.059218!4d128.1903079!16s%2Fg%2F11l1yypqgk!19sChIJM-bmuvElbC0RH1b-9QqWOmE?authuser=0&hl=en&rclk=1,"-3.059218,128.1903079"
Masjid Kabupaten Piru,Mosque,"W6C5+G75 Masjid Kabupaten Piru, Jl. Pangeran Limboro, Neniari, Kec. Seram Bar., Kabupaten Seram Bagian Barat, Maluku, Indonesia","Neniari, Seram Barat","W6C5+G75, Jl. Pangeran Limboro",West Seram,,Maluku,ID,https://www.google.com/maps/place/Masjid+Kabupaten+Piru/data=!4m7!3m6!1s0x2d6c3b3b5107f7d1:0x4142621c1f64fd35!8m2!3d-3.0787441!4d128.2082237!16s%2Fg%2F11gmyggvd5!19sChIJ0fcHUTs7bC0RNf1kHxxiQkE?authuser=0&hl=en&rclk=1,"-3.0787440999999998,128.2082237"
Masjid Raya Sepa,Mosque,"9HGV+2JF Masjid Raya Sepa, Kilmury, Kec. Seram Tim., Kabupaten Seram Bagian Timur, Maluku, Indonesia","Kilmury, Seram Timur",9HGV+2JF,East Seram,,Maluku,ID,https://www.google.com/maps/place/Masjid+Raya+Sepa/data=!4m7!3m6!1s0x2d406140058e5a7d:0x5f04e4452f523f79!8m2!3d-3.6249497!4d130.5940565!16s%2Fg%2F11j8lk830b!19sChIJfVqOBUBhQC0ReT9SL0XkBF8?authuser=0&hl=en&rclk=1,"-3.6249496999999997,130.5940565"
"Masjid An-Nur, Kilfura",Mosque,"4W46+CHC Masjid An-Nur, Kilfura, Kilfura, Kec. Seram Tim., Kabupaten Seram Bagian Timur, Maluku, Indonesia","Kellu, Seram Timur","4W46+CHC, Kilfura",East Seram,,Maluku,ID,"https://www.google.com/maps/place/Masjid+An-Nur,+Kilfura/data=!4m7!3m6!1s0x2d3f670f06b16c97:0x5be96e4aaa5e84b2!8m2!3d-3.892879!4d130.9106572!16s%2Fg%2F11t6nh_qp_!19sChIJl2yxBg9nPy0RsoReqkpu6Vs?authuser=0&hl=en&rclk=1","-3.8928789999999998,130.9106572"
