name,main_category,address,address_ward,address_street,address_city,address_postal_code,address_state,address_country_code,link,coordinates
Haji Rojdaar Wali Masjid,Mosque,"Haji Rojdaar Wali Masjid, 110074, Kharak, Sat Bari, New Delhi, Delhi 110074","Kharak, Sat Bari",110074,New Delhi,110074,Delhi,IN,https://www.google.com/maps/place/Haji+Rojdaar+Wali+Masjid/data=!4m7!3m6!1s0x390ce024a51f068f:0x1d8c2d91ee022fdd!8m2!3d28.4679055!4d77.2051939!16s%2Fg%2F11c5_hph3y!19sChIJjwYfpSTgDDkR3S8C7pEtjB0?authuser=0&hl=en&rclk=1,"28.467905499999997,77.2051939"
Ijaba Masjid,Mosque,"Ijaba Masjid, 1489/16, Block D, Chand Vihar, New Mustafabad, Delhi, 110094","Block D, Chand Vihar, New Mustafabad",1489/16,Delhi,110094,Delhi,IN,https://www.google.com/maps/place/Ijaba+Masjid/data=!4m7!3m6!1s0x390cfd4112cff819:0x124578cf76e8540b!8m2!3d28.7086594!4d77.2713446!16s%2Fg%2F11j08711wr!19sChIJGfjPEkH9DDkRC1Tods94RRI?authuser=0&hl=en&rclk=1,"28.7086594,77.27134459999999"
Mr.SAHEEM MALIK,Mosque,"Mr.SAHEEM MALIK, Gali no. 3 - Tirpal Factory Mustafabad, near Ayisha masjid, 25 Futa Rd, near by Aisha Masjid, chowk, Delhi 110094","Shakti Vihar, Old Mustafabad, chowk","Gali no. 3 - Tirpal Factory Mustafabad, near Ayisha masjid, 25 Futa Rd, near by Aisha Masjid",Delhi,110094,Delhi,IN,https://www.google.com/maps/place/Mr.SAHEEM+MALIK/data=!4m7!3m6!1s0x390cfd9a44cd4997:0xffdc8860c53e3f2b!8m2!3d28.7159667!4d77.272238!16s%2Fg%2F11h3cwgc8y!19sChIJl0nNRJr9DDkRKz8-xWCI3P8?authuser=0&hl=en&rclk=1,"28.7159667,77.272238"
Masjid,Mosque,"Q6MJ+5H5 Masjid, Badarpur, Madanpur Khadar, New Delhi, 110084",Madanpur Khadar,"Q6MJ+5H5, Badarpur","New Delhi, Delhi",110084,Delhi,IN,https://www.google.com/maps/place/Masjid/data=!4m7!3m6!1s0x390cffb780460377:0x9fe224e9c653e965!8m2!3d28.7828891!4d77.2314704!16s%2Fg%2F11qn790lvq!19sChIJdwNGgLf_DDkRZelTxukk4p8?authuser=0&hl=en&rclk=1,"28.7828891,77.23147039999999"
Masjid,Mosque,"Q7JJ+7WC Masjid, Pavi Sadakpur, Uttar Pradesh 201102",,Q7JJ+7WC,Pavi Sadakpur,201102,Uttar Pradesh,IN,https://www.google.com/maps/place/Masjid/data=!4m7!3m6!1s0x390cff3247b3c4d7:0xf1b7407f946dd8cc!8m2!3d28.7806806!4d77.2822504!16s%2Fg%2F11ggz8tfhy!19sChIJ18SzRzL_DDkRzNhtlH9At_E?authuser=0&hl=en&rclk=1,"28.7806806,77.2822504"
Muqaddis Masjid,Mosque,"Muqaddis Masjid, Kashmiri Gate, Firozabad, Uttar Pradesh 283203",Kashmiri Gate,,Firozabad,,Uttar Pradesh,IN,https://www.google.com/maps/place/Muqaddis+Masjid/data=!4m7!3m6!1s0x39744698eaf3b47d:0x48f07a946e7ade8!8m2!3d27.1526199!4d78.4094882!16s%2Fg%2F1v46yrwl!19sChIJfbTz6phGdDkR6K3nRqkHjwQ?authuser=0&hl=en&rclk=1,"27.152619899999998,78.4094882"
"Al masjid Rizhwan, west Street, al msjiturrilllvaannn jummaa plllli, meerrku teru.",Mosque,"Al masjid Rizhwan, west Street, al msjiturrilllvaannn jummaa plllli, meerrku teru., West Street, Mandapam, Tamil Nadu 623518",,West Street,Mandapam,623518,Tamil Nadu,IN,"https://www.google.com/maps/place/Al+masjid+Rizhwan,+west+Street,+%E0%AE%85%E0%AE%B2%E0%AF%8D+%E0%AE%AE%E0%AE%B8%E0%AF%8D%E0%AE%9C%E0%AE%BF%E0%AE%A4%E0%AF%81%E0%AE%B0%E0%AF%8D%E0%AE%B0%E0%AE%BF%E0%AE%B4%E0%AF%8D%E0%AE%B5%E0%AE%BE%E0%AE%A9%E0%AF%8D+%E0%AE%9C%E0%AF%81%E0%AE%AE%E0%AF%8D%E0%AE%AE%E0%AE%BE+%E0%AE%AA%E0%AE%B3%E0%AF%8D%E0%AE%B3%E0%AE%BF,+%E0%AE%AE%E0%AF%87%E0%AE%B1%E0%AF%8D%E0%AE%95%E0%AF%81+%E0%AE%A4%E0%AF%86%E0%AE%B0%E0%AF%81./data=!4m7!3m6!1s0x3b01ef1ebd2b2d3b:0xd87b6d499634470d!8m2!3d9.2868719!4d79.1515748!16s%2Fg%2F11j7vb9j_j!19sChIJOy0rvR7vATsRDUc0lklte9g?authuser=0&hl=en&rclk=1","9.2868719,79.15157479999999"
Masjid,Mosque,"Masjid, 242, Masjid Jheel Pio, Near ITO metro GateNo.3, Bahadur Shah Zafar Marg, Balmiki Basti, Vikram Nagar, Delhi, 110002","Bahadur Shah Zafar Marg, Balmiki Basti, Vikram Nagar","242, Masjid Jheel Pio, Near ITO metro GateNo.3, Bahadur Shah Zafar Marg",Delhi,110002,Delhi,IN,https://www.google.com/maps/place/Masjid/data=!4m7!3m6!1s0x390cfd441769149d:0xa1929f1b4f5921d6!8m2!3d28.6298914!4d77.2415098!16s%2Fg%2F11s2n38r9b!19sChIJnRRpF0T9DDkR1iFZTxufkqE?authuser=0&hl=en&rclk=1,"28.629891399999998,77.2415098"
Old Mugal Masjid,Mosque,"J6X9+P3V Old Mugal Masjid, Qutab Rd, Ram Nagar Market, Aram Nagar, Paharganj, New Delhi, Delhi, 110055","Ram Nagar Market, Aram Nagar, Paharganj","J6X9+P3V, Qutab Rd","New Delhi, Delhi",110055,Delhi,IN,https://www.google.com/maps/place/Old+Mugal+Masjid/data=!4m7!3m6!1s0x390cfd152b1b0125:0x49e032c4a3927074!8m2!3d28.6493546!4d77.2176682!16s%2Fg%2F11ggw008kv!19sChIJJQEbKxX9DDkRdHCSo8Qy4Ek?authuser=0&hl=en&rclk=1,"28.6493546,77.21766819999999"
Masjid,Mosque,"Masjid, 191/1, JJ Colony, New Krishna Park, Vikaspuri, New Delhi, Delhi, 110018","JJ Colony, New Krishna Park, Vikaspuri",191/1,"New Delhi, Delhi",110018,Delhi,IN,https://www.google.com/maps/place/Masjid/data=!4m7!3m6!1s0x390d0523e13f6ebf:0xcf430f5986189794!8m2!3d28.6318645!4d77.0776203!16s%2Fg%2F11kq3krq6c!19sChIJv24_4SMFDTkRlJcYhlkPQ88?authuser=0&hl=en&rclk=1,"28.6318645,77.07762029999999"
Masjid,Mosque,"Masjid, 2508, Fasil Rd, Gali Sakko Wali, Shah Ganj, Chandni Chowk, New Delhi, Delhi, 110006","Gali Sakko Wali, Shah Ganj, Chandni Chowk","2508, Fasil Rd","New Delhi, Delhi",110006,Delhi,IN,https://www.google.com/maps/place/Masjid/data=!4m7!3m6!1s0x390cfd15c9a8a4b1:0xf975aada141da03e!8m2!3d28.6491552!4d77.2220471!16s%2Fg%2F1hm4gjxkd!19sChIJsaSoyRX9DDkRPqAdFNqqdfk?authuser=0&hl=en&rclk=1,"28.6491552,77.2220471"
Masjid Haji Fakhruddin,Mosque,"M675+W9G Masjid Haji Fakhruddin, Nawabganj, Tis Hazari, New Delhi, Delhi, 110006","Nawabganj, Tis Hazari",M675+W9G,"New Delhi, Delhi",110006,Delhi,IN,https://www.google.com/maps/place/Masjid+Haji+Fakhruddin/data=!4m7!3m6!1s0x390cfd3828bdce11:0x33cd8ff3b7a4fedb!8m2!3d28.6648087!4d77.20846!16s%2Fg%2F11fmz5xjh3!19sChIJEc69KDj9DDkR2_6kt_OPzTM?authuser=0&hl=en&rclk=1,"28.6648087,77.20846"
Muhammadi masjid muhmmdii msjid,Mosque,"Muhammadi masjid muhmmdii msjid, MUHAMMADI MASJID 241/4, Kardampuri Extn, Jyoti Nagar, Shahdara, New Delhi, Delhi 110094","Kardampuri Extn, Jyoti Nagar, Shahdara",MUHAMMADI MASJID 241/4,"New Delhi, Delhi",110094,Delhi,IN,https://www.google.com/maps/place/Muhammadi+masjid+%E0%A4%AE%E0%A5%81%E0%A4%B9%E0%A4%AE%E0%A5%8D%E0%A4%AE%E0%A4%A6%E0%A5%80+%E0%A4%AE%E0%A4%B8%E0%A5%8D%E0%A4%9C%E0%A4%BF%E0%A4%A6/data=!4m7!3m6!1s0x390cfdf7222776fb:0xa1de0aebd8e51a62!8m2!3d28.69431!4d77.284627!16s%2Fg%2F11r_kfh4wd!19sChIJ-3YnIvf9DDkRYhrl2OsK3qE?authuser=0&hl=en&rclk=1,"28.694309999999998,77.284627"
Masjid,Mosque,"P9HF+33Q Masjid, Farukh Nagar, Uttar Pradesh 201003",,P9HF+33Q,Farukh Nagar,201003,Uttar Pradesh,IN,https://www.google.com/maps/place/Masjid/data=!4m7!3m6!1s0x390cfa018875b495:0xeea7b0caec7e470d!8m2!3d28.7277145!4d77.3727433!16s%2Fg%2F11f0krqvls!19sChIJlbR1iAH6DDkRDUd-7Mqwp-4?authuser=0&hl=en&rclk=1,"28.727714499999998,77.3727433"
Masjid e mohammdiya,Mosque,"QG3V+XJ3 Masjid e mohammdiya, Unnamed Road, Baharawali, Uttar Pradesh 281401",,"QG3V+XJ3, Unnamed Road",Baharawali,281401,Uttar Pradesh,IN,https://www.google.com/maps/place/Masjid+e+mohammdiya/data=!4m7!3m6!1s0x39733fa8c8da7bb1:0x7778c080049102ea!8m2!3d27.7548751!4d77.5440508!16s%2Fg%2F11q2sxdqrp!19sChIJsXvayKg_czkR6gKRBIDAeHc?authuser=0&hl=en&rclk=1,"27.7548751,77.5440508"
Masjid Thaquwa Hanafi Sunnath Jamaath Jumma Palli Vaasal,Mosque,"7XQ6+FRM Masjid Thaquwa Hanafi Sunnath Jamaath Jumma Palli Vaasal, Mettupalayam Rd, Jadayampalayam, Jadayampalayam Pudur, Tamil Nadu 641302",,"7XQ6+FRM, Mettupalayam Rd","Jadayampalayam, Jadayampalayam Pudur",641302,Tamil Nadu,IN,https://www.google.com/maps/place/Masjid+Thaquwa+Hanafi+Sunnath+Jamaath+Jumma+Palli+Vaasal/data=!4m7!3m6!1s0x3ba8eefd053eee95:0x5f695198ce45b5bf!8m2!3d11.288701!4d76.9620405!16s%2Fg%2F11h9yksqsk!19sChIJle4-Bf3uqDsRv7VFzphRaV8?authuser=0&hl=en&rclk=1,"11.288701,76.9620405"
Makkah Masjidh,Mosque,"QMGH+G9Q Makkah Masjidh, Moulavi Abdul Rahman St, Nagar, Kilpattampakkam, Nellikuppam, Tamil Nadu 607105","Nagar, Kilpattampakkam","QMGH+G9Q, Moulavi Abdul Rahman St",Nellikuppam,607105,Tamil Nadu,IN,https://www.google.com/maps/place/Makkah+Masjidh/data=!4m7!3m6!1s0x3a54a3e878cdf3d1:0xb16423110d0859be!8m2!3d11.7763297!4d79.6784864!16s%2Fg%2F11hzpgqqlw!19sChIJ0fPNeOijVDoRvlkIDREjZLE?authuser=0&hl=en&rclk=1,"11.7763297,79.6784864"
Masjid,Mosque,"Masjid, Molarband, Badarpur, New Delhi, Delhi 110044","Molarband, Badarpur",,New Delhi,110044,Delhi,IN,https://www.google.com/maps/place/Masjid/data=!4m7!3m6!1s0x390ce75604c9317b:0x95388f2bb1f0f9b2!8m2!3d28.5063324!4d77.3130947!16s%2Fg%2F11rkpbdy5r!19sChIJezHJBFbnDDkRsvnwsSuPOJU?authuser=0&hl=en&rclk=1,"28.506332399999998,77.3130947"
"Bari Masjid , Maidaan",Mosque,"J6RQ+H25 Bari Masjid , Maidaan, Fasil Road, Chatta lal Miya, Chandni Mahal, Old Delhi, New Delhi, Delhi, 110006","Chatta lal Miya, Chandni Mahal, Old Delhi","J6RQ+H25, Fasil Road","New Delhi, Delhi",110006,Delhi,IN,"https://www.google.com/maps/place/Bari+Masjid+,+Maidaan/data=!4m7!3m6!1s0x390cfd9b8a07d3f3:0xa7f4c46e15f391f1!8m2!3d28.6413922!4d77.2376057!16s%2Fg%2F11gmc20syl!19sChIJ89MHipv9DDkR8ZHzFW7E9Kc?authuser=0&hl=en&rclk=1","28.6413922,77.2376057"
Masjid,Mosque,"M65J+GV7 Masjid, Chhippy Wada, Chandni Chowk, Delhi, 110006","Chhippy Wada, Chandni Chowk",M65J+GV7,Delhi,110006,Delhi,IN,https://www.google.com/maps/place/Masjid/data=!4m7!3m6!1s0x390cfd04823e663b:0x88920d6fe0b74a65!8m2!3d28.6587916!4d77.2321828!16s%2Fg%2F11n0gg69p2!19sChIJO2Y-ggT9DDkRZUq34G8Nkog?authuser=0&hl=en&rclk=1,"28.658791599999997,77.23218279999999"
Eidgah Masjid,Mosque,"MC89+4P3 Eidgah Masjid, Gali No. 1, near Meena masjid, Islam Nagar, Madhopura, Ghaziabad, Uttar Pradesh 201009","Islam Nagar, Madhopura","MC89+4P3, Gali No. 1, near Meena masjid",Ghaziabad,,Uttar Pradesh,IN,https://www.google.com/maps/place/Eidgah+Masjid/data=!4m7!3m6!1s0x390cf120a22cee4f:0x658a3d7cfb08da96!8m2!3d28.665259!4d77.4192871!16s%2Fg%2F11td5pdnql!19sChIJT-4soiDxDDkRltoI-3w9imU?authuser=0&hl=en&rclk=1,"28.665259,77.41928709999999"
Masjid Amania,Mosque,"Masjid Amania, Main, Maujpur Rd, Shahdara, Delhi, 110053",Shahdara,"Main, Maujpur Rd",Delhi,110053,Delhi,IN,https://www.google.com/maps/place/Masjid+Amania/data=!4m7!3m6!1s0x390cfd4212229ecb:0x56b4673279cdc3f1!8m2!3d28.6855897!4d77.2762341!16s%2Fg%2F11s0s2pf6g!19sChIJy54iEkL9DDkR8cPNeTJntFY?authuser=0&hl=en&rclk=1,"28.685589699999998,77.2762341"
Munwara Masjid,Mosque,"Munwara Masjid, E-130, Gali No.6, Third Pusta Main Rd, Jagjeet Nagar, Delhi, 110053","Third Pushta, Nayagaon, Jagjeet Nagar, Shahdara","E-130, Gali No.6, Third Pusta Main Rd",Delhi,110053,Delhi,IN,https://www.google.com/maps/place/Munwara+Masjid/data=!4m7!3m6!1s0x390cfc44ec3cee7b:0x6817d8194e44c0a7!8m2!3d28.6861966!4d77.2559837!16s%2Fg%2F12hq6qdwg!19sChIJe-487ET8DDkRp8BEThnYF2g?authuser=0&hl=en&rclk=1,"28.6861966,77.2559837"
Palikha Bhawan masjid,Mosque,"H5CM+CR Palikha Bhawan masjid, Block B, Sector 13, Rama Krishna Puram, New Delhi, Delhi 110023","Block B, Sector 13, Rama Krishna Puram",H5CM+CR,New Delhi,,Delhi,IN,https://www.google.com/maps/place/Palikha+Bhawan+masjid/data=!4m7!3m6!1s0x390d1d225eb0fc93:0xd02146e38fc68bbc!8m2!3d28.5711007!4d77.1846199!16s%2Fg%2F11tjs4v4h2!19sChIJk_ywXiIdDTkRvIvGj-NGIdA?authuser=0&hl=en&rclk=1,"28.5711007,77.1846199"
Masjid Mohammadi,Mosque,"P75C+2J5 Masjid Mohammadi, Gali Number19, Block C, Rajiv Gandhi Nagar, New Mustafabad, Delhi, 110094","Block C, Rajiv Gandhi Nagar, New Mustafabad","P75C+2J5, Gali Number19",Delhi,110094,Delhi,IN,https://www.google.com/maps/place/Masjid+Mohammadi/data=!4m7!3m6!1s0x390cfc108ce5b78f:0xd09109d84f6143aa!8m2!3d28.7075115!4d77.2716065!16s%2Fg%2F12hqhqhsy!19sChIJj7fljBD8DDkRqkNhT9gJkdA?authuser=0&hl=en&rclk=1,"28.7075115,77.27160649999999"
Mahond Masjid,Mosque,"VP6M+25G Mahond Masjid, Nagaliya, Rajasthan 301405",,VP6M+25G,Nagaliya,301405,Rajasthan,IN,https://www.google.com/maps/place/Mahond+Masjid/data=!4m7!3m6!1s0x3972b15c8545c399:0x5da255ab4632c6b7!8m2!3d27.8600744!4d76.7329383!16s%2Fg%2F11ny1yfpnb!19sChIJmcNFhVyxcjkRt8YyRqtVol0?authuser=0&hl=en&rclk=1,"27.8600744,76.7329383"
Masjid,Mosque,"Masjid, 8/2, Budh Bazar, Block L 1, Devli, Sangam Vihar, New Delhi, Delhi 110062","Budh Bazar, Block L 1, Devli, Sangam Vihar",8/2,New Delhi,110062,Delhi,IN,https://www.google.com/maps/place/Masjid/data=!4m7!3m6!1s0x390ce1dde82b3bc3:0x4d3537cacd38aec4!8m2!3d28.4940769!4d77.2261653!16s%2Fg%2F11rk33_10p!19sChIJwzsr6N3hDDkRxK44zco3NU0?authuser=0&hl=en&rclk=1,"28.4940769,77.22616529999999"
Masjid,Mosque,"H4Q9+GQ2 Masjid, Sadar Bazaar, Delhi Cantonment, New Delhi, Delhi 110010","Sadar Bazaar, Delhi Cantonment",H4Q9+GQ2,New Delhi,110010,Delhi,IN,https://www.google.com/maps/place/Masjid/data=!4m7!3m6!1s0x390d1de7a344966b:0x439561fcffba0204!8m2!3d28.5887553!4d77.1193923!16s%2Fg%2F11vlmpcmn5!19sChIJa5ZEo-cdDTkRBAK6__xhlUM?authuser=0&hl=en&rclk=1,"28.5887553,77.1193923"
Masjid msjid,Mosque,"Masjid msjid, A 95, Chanchal Park, Laxmi Park, Ranhola Extesion, Delhi, 110041","Chanchal Park, Laxmi Park, Ranhola Extesion",A 95,Delhi,110041,Delhi,IN,https://www.google.com/maps/place/Masjid+%E0%A4%AE%E0%A4%B8%E0%A5%8D%E0%A4%9C%E0%A4%BF%E0%A4%A6/data=!4m7!3m6!1s0x390d0570d033b0bb:0x480768d95ae5b61d!8m2!3d28.6495218!4d77.0230135!16s%2Fg%2F11rf4j7m64!19sChIJu7Az0HAFDTkRHbblWtloB0g?authuser=0&hl=en&rclk=1,"28.6495218,77.02301349999999"
Masjid Kaddan Wali,Mosque,"Masjid Kaddan Wali, 3800,, Charkhiwalan Gali, Khush Dil, Chandni Chowk, New Delhi, Delhi 110006","Khush Dil, Chandni Chowk","3800,, Charkhiwalan Gali","New Delhi, Delhi",110006,Delhi,IN,https://www.google.com/maps/place/Masjid+Kaddan+Wali/data=!4m7!3m6!1s0x390cfd19d610452b:0xf81efc1a357adee8!8m2!3d28.6506731!4d77.2290561!16s%2Fg%2F12hkbxr_7!19sChIJK0UQ1hn9DDkR6N56NRr8Hvg?authuser=0&hl=en&rclk=1,"28.6506731,77.2290561"
Masjid,Mosque,"Masjid, Gali No 19, Gali Number 1, Mustafabad Extn, New Mustafabad, Delhi, 110094","E2 Block, Mustafabad Extn, New Mustafabad","Gali No 19, Gali Number 1",Delhi,110094,Delhi,IN,https://www.google.com/maps/place/Masjid/data=!4m7!3m6!1s0x390cfc1b020b0e91:0xb48a3c3233e41cbd!8m2!3d28.711773!4d77.272563!16s%2Fg%2F12hpqnhjr!19sChIJkQ4LAhv8DDkRvRzkMzI8irQ?authuser=0&hl=en&rclk=1,"28.711772999999997,77.27256299999999"
Mk Digital camera,Camera store,"shop No. 9, Mk Digital camera, chaudhary, 4, Kucha Seth Rd, Vakil Pura, Chandni Chowk, Delhi, 110006","Vakil Pura, Chandni Chowk","shop No. 9, chaudhary, 4, Kucha Seth Rd",Delhi,110006,Delhi,IN,https://www.google.com/maps/place/Mk+Digital+camera/data=!4m7!3m6!1s0x390cfdf39c2bd261:0x35fc7e65149587c3!8m2!3d28.6524837!4d77.2318301!16s%2Fg%2F11l1d3jb1f!19sChIJYdIrnPP9DDkRw4eVFGV-_DU?authuser=0&hl=en&rclk=1,"28.652483699999998,77.2318301"
Bilal Masjid,Mosque,"WWCH+JH2 Bilal Masjid, Bhamia Kalan, Ludhiana, Punjab 141015",Bhamia Kalan,WWCH+JH2,Ludhiana,141015,Punjab,IN,https://www.google.com/maps/place/Bilal+Masjid/data=!4m7!3m6!1s0x391a9d37c3f28b21:0x500e916db3d0069b!8m2!3d30.9215077!4d75.9289025!16s%2Fg%2F11plt1d9h6!19sChIJIYvywzedGjkRmwbQs22RDlA?authuser=0&hl=en&rclk=1,"30.9215077,75.92890249999999"
"msjd nwb qdsyh, khrbl shh mrdN Masjid Nawab Qudsiya, Karbala Shahe Mardan",Mosque,"msjd nwb qdsyh, khrbl shh mrdN Masjid Nawab Qudsiya, Karbala Shahe Mardan, F2/117, Karbala Rd, Block F2, BK Dutt Colony, New Delhi, Delhi 110003","Block F2, BK Dutt Colony","F2/117, Karbala Rd",New Delhi,110003,Delhi,IN,"https://www.google.com/maps/place/%D9%85%D8%B3%D8%AC%D8%AF+%D9%86%D9%88%D8%A7%D8%A8+%D9%82%D8%AF%D8%B3%DB%8C%DB%81%D8%8C+%DA%A9%D8%B1%D8%A8%D9%84%D8%A7+%D8%B4%D8%A7%DB%81+%D9%85%D8%B1%D8%AF%D8%A7%DA%BA+Masjid+Nawab+Qudsiya,+Karbala+Shahe+Mardan%E2%80%AD/data=!4m7!3m6!1s0x390ce3775866908b:0xa9f32bec4f8f9ee7!8m2!3d28.5833488!4d77.2161524!16s%2Fg%2F11tt5wfkmg!19sChIJi5BmWHfjDDkR556PT-wr86k?authuser=0&hl=en&rclk=1","28.5833488,77.2161524"
Masjid,Mosque,"Shop No: 5035, Masjid, Netaji Subhash Marg, Daryaganj, New Delhi, Delhi, 110002",Daryaganj,"Shop No: 5035, Netaji Subhash Marg","New Delhi, Delhi",110002,Delhi,IN,https://www.google.com/maps/place/Masjid/data=!4m7!3m6!1s0x390cfdf175041b95:0x8ef57a2bc9f92c1c!8m2!3d28.6480954!4d77.2403964!16s%2Fg%2F11s664lvxh!19sChIJlRsEdfH9DDkRHCz5ySt69Y4?authuser=0&hl=en&rclk=1,"28.6480954,77.2403964"
Masjid Mohammadiya,Mosque,"M675+4VF Masjid Mohammadiya, Bahadurgarh Rd, Hathi Khana, Sadar Bazaar, New Delhi, Delhi, 110006","Hathi Khana, Sadar Bazaar","M675+4VF, Bahadurgarh Rd","New Delhi, Delhi",110006,Delhi,IN,https://www.google.com/maps/place/Masjid+Mohammadiya/data=!4m7!3m6!1s0x390cfd1e19b763d7:0xf26449d51a7a5a53!8m2!3d28.6628007!4d77.2096573!16s%2Fg%2F11tfwp5hs4!19sChIJ12O3GR79DDkRU1p6GtVJZPI?authuser=0&hl=en&rclk=1,"28.6628007,77.2096573"
Masjid,Mosque,"Masjid, L385, Block L, JJ Colony No 3, Nangloi, New Delhi, Delhi, 110041","Block L, JJ Colony No 3, Nangloi",L385,"New Delhi, Delhi",110041,Delhi,IN,https://www.google.com/maps/place/Masjid/data=!4m7!3m6!1s0x390d0530462f99ad:0xf47aa8290ce093fa!8m2!3d28.6842352!4d77.0742041!16s%2Fg%2F11smtj7p27!19sChIJrZkvRjAFDTkR-pPgDCmoevQ?authuser=0&hl=en&rclk=1,"28.6842352,77.0742041"
Masjid,Mosque,"J2WM+MXF Masjid, Sunni Masjid Rd, Deep Enclave, Hastsal, Delhi, 110059","Deep Enclave, Hastsal","J2WM+MXF, Sunni Masjid Rd",Delhi,110059,Delhi,IN,https://www.google.com/maps/place/Masjid/data=!4m7!3m6!1s0x390d05267bb46283:0xaef6f06f366d7113!8m2!3d28.6466834!4d77.0349292!16s%2Fg%2F11vl8tpxw1!19sChIJg2K0eyYFDTkRE3FtNm_w9q4?authuser=0&hl=en&rclk=1,"28.646683399999997,77.0349292"
Mehendi masjid,Mosque,"Mehendi masjid, 3331, Lal Kuan Bazar, Chandni Chowk, New Delhi, Delhi, 110006","Lal Kuan Bazar, Chandni Chowk",3331,"New Delhi, Delhi",110006,Delhi,IN,https://www.google.com/maps/place/Mehendi+masjid/data=!4m7!3m6!1s0x390cfd11d6254933:0x7c1821bcb713efad!8m2!3d28.6516061!4d77.2214466!16s%2Fg%2F11rn0l2gk4!19sChIJM0kl1hH9DDkRre8Tt7whGHw?authuser=0&hl=en&rclk=1,"28.6516061,77.2214466"
MADINA MASJID,Mosque,"MADINA MASJID, India Yamaha Motor, UPSIDC Site A, Surajpur, Greater Noida, Uttar Pradesh 201306","UPSIDC Site A, Surajpur",India Yamaha Motor,Greater Noida,201306,Uttar Pradesh,IN,https://www.google.com/maps/place/MADINA+MASJID/data=!4m7!3m6!1s0x390ceb969fb26b17:0xfc39d8ed2cd3f5e2!8m2!3d28.520453!4d77.4723483!16s%2Fg%2F11smlksdlg!19sChIJF2uyn5brDDkR4vXTLO3YOfw?authuser=0&hl=en&rclk=1,"28.520453,77.4723483"
Masjid,Mosque,"M794+RG5 Masjid, Block A, Shastri Park, Shahdara, Delhi, 110053","Block A, Shastri Park, Shahdara",M794+RG5,Delhi,,Delhi,IN,https://www.google.com/maps/place/Masjid/data=!4m7!3m6!1s0x390cfd74b6378221:0x2da5c9212f831088!8m2!3d28.6695164!4d77.2563643!16s%2Fg%2F11tb42z9g0!19sChIJIYI3tnT9DDkRiBCDLyHJpS0?authuser=0&hl=en&rclk=1,"28.6695164,77.2563643"
Madina masjid,Mosque,"Ward number 3, Madina masjid, Chandni Chowk, sarul, Delhi, 110006",Chandni Chowk,Ward number 3,"sarul, Delhi",110006,Delhi,IN,https://www.google.com/maps/place/Madina+masjid/data=!4m7!3m6!1s0x390cfd765db7001b:0xc7c08a181a8d81db!8m2!3d28.6610779!4d77.2345881!16s%2Fg%2F11ry5dxrrg!19sChIJGwC3XXb9DDkR24GNGhiKwMc?authuser=0&hl=en&rclk=1,"28.6610779,77.2345881"
Masjid,Mosque,"Masjid, 20, Masjid Rd, Pervesh Nagar, Mubarakpur Dabas, New Delhi, Delhi, 110081","Pervesh Nagar, Mubarakpur Dabas","20, Masjid Rd","New Delhi, Delhi",110081,Delhi,IN,https://www.google.com/maps/place/Masjid/data=!4m7!3m6!1s0x390d075632dea237:0xe707b406c4cff64!8m2!3d28.7098866!4d77.0310854!16s%2Fg%2F11kq2cq2_1!19sChIJN6LeMlYHDTkRZP9MbEB7cA4?authuser=0&hl=en&rclk=1,"28.709886599999997,77.0310854"
Maqqi masjid,Mosque,"Maqqi masjid, khushal park, Chand Market, Main Road, Loni, Ghaziabad, Uttar Pradesh 201102",Loni,"khushal park, Chand Market, Main Road",Ghaziabad,201102,Uttar Pradesh,IN,https://www.google.com/maps/place/Maqqi+masjid/data=!4m7!3m6!1s0x390cff5e0ec94889:0x5f11a2cfa7f2d1f6!8m2!3d28.7591698!4d77.2711527!16s%2Fg%2F11q57z_dlr!19sChIJiUjJDl7_DDkR9tHyp8-iEV8?authuser=0&hl=en&rclk=1,"28.7591698,77.2711527"
Fatima Ganral Store,General store,"Fatima Ganral Store, D 37/27, Masjid Rd, Market, Jasola, New Delhi, Delhi 110044","Market, Jasola","D 37/27, Masjid Rd",New Delhi,110044,Delhi,IN,https://www.google.com/maps/place/Fatima+Ganral+Store/data=!4m7!3m6!1s0x390ce51263d12e6f:0x5875571f778ec16d!8m2!3d28.5480869!4d77.2916035!16s%2Fg%2F11sjfwbtmy!19sChIJby7RYxLlDDkRbcGOdx9XdVg?authuser=0&hl=en&rclk=1,"28.548086899999998,77.2916035"
Masjid,Mosque,"98PM+Q26 Masjid, Ishaqpur, Uttar Pradesh 243727",,98PM+Q26,Ishaqpur,243727,Uttar Pradesh,IN,https://www.google.com/maps/place/Masjid/data=!4m7!3m6!1s0x390b39492871701d:0x54138cc39c7d8ded!8m2!3d28.3869054!4d78.3325281!16s%2Fg%2F11khz6l8_x!19sChIJHXBxKEk5CzkR7Y19nMOME1Q?authuser=0&hl=en&rclk=1,"28.3869054,78.33252809999999"
Mohhmmadiya masjid (2010),Mosque,"HJ5Q+J82 Mohhmmadiya masjid (2010), Saidpur Kalan, Saidpura Kalan, Uttar Pradesh",,"HJ5Q+J82, Saidpur Kalan",Saidpura Kalan,,Uttar Pradesh,IN,https://www.google.com/maps/place/Mohhmmadiya+masjid+%282010%29/data=!4m7!3m6!1s0x390c1fdfed21664b:0x35663d8a5c3f05bf!8m2!3d29.559024!4d77.6382532!16s%2Fg%2F11sxvwk4_d!19sChIJS2Yh7d8fDDkRvwU_XIo9ZjU?authuser=0&hl=en&rclk=1,"29.559023999999997,77.6382532"
Old Jama Masjid (Manauna) |jm` msjd|,Mosque,"74GJ+XHF Old Jama Masjid (Manauna) |jm` msjd|, Manauna, Uttar Pradesh 243301",,74GJ+XHF,Manauna,,Uttar Pradesh,IN,https://www.google.com/maps/place/Old+Jama+Masjid+%28Manauna%29+%7C%D8%AC%D9%85%D8%B9+%D9%85%D8%B3%D8%AC%D8%AF%7C%E2%80%AD/data=!4m7!3m6!1s0x390ab302a226f4f7:0x918fc468fc5020f6!8m2!3d28.277442!4d79.1314296!16s%2Fg%2F11s752mcsp!19sChIJ9_QmogKzCjkR9iBQ_GjEj5E?authuser=0&hl=en&rclk=1,"28.277441999999997,79.13142959999999"
Jumma Masjid North Street (Women's Masjith)Mandapam,Mosque,"75M3+89P Jumma Masjid North Street (Women's Masjith)Mandapam, Maraikayar Street, Mandapam, Tamil Nadu 623518",,"75M3+89P, Maraikayar Street",Mandapam,623518,Tamil Nadu,IN,https://www.google.com/maps/place/Jumma+Masjid+North+Street+%28Women%27s+Masjith%29Mandapam/data=!4m7!3m6!1s0x3b01efad22dc91a5:0x83795d226a23bc2a!8m2!3d9.2833448!4d79.1534594!16s%2Fg%2F11ts099f4f!19sChIJpZHcIq3vATsRKrwjaiJdeYM?authuser=0&hl=en&rclk=1,"9.2833448,79.1534594"
MASJID - AE - NOOR,Mosque,"74HG+HX8 MASJID - AE - NOOR, Mandapam, Tamil Nadu 623518",,74HG+HX8,Mandapam,623518,Tamil Nadu,IN,https://www.google.com/maps/place/MASJID+-+AE+-+NOOR/data=!4m7!3m6!1s0x3b01ef1a36af7003:0xe000ff9b795ea4e0!8m2!3d9.2790019!4d79.1274156!16s%2Fg%2F11rm_345lj!19sChIJA3CvNhrvATsR4KReeZv_AOA?authuser=0&hl=en&rclk=1,"9.279001899999999,79.12741559999999"
SB Memorial Masjid,Mosque,"74H9+HW8 SB Memorial Masjid, Mandapam, Tamil Nadu 623518",,74H9+HW8,Mandapam,623518,Tamil Nadu,IN,https://www.google.com/maps/place/SB+Memorial+Masjid/data=!4m7!3m6!1s0x3b01ef7188de0b07:0xba1ede588a30399f!8m2!3d9.2788941!4d79.119357!16s%2Fg%2F11v62hfx5w!19sChIJBwveiHHvATsRnzkwiljeHro?authuser=0&hl=en&rclk=1,"9.278894099999999,79.119357"
SB baysul masjid,Mosque,"74H9+GP4 SB baysul masjid, Mandapam, Tamil Nadu 623518",,74H9+GP4,Mandapam,623518,Tamil Nadu,IN,https://www.google.com/maps/place/SB+baysul+masjid/data=!4m7!3m6!1s0x3b01efc816ba02e3:0x1a57d85685713781!8m2!3d9.2787643!4d79.11926!16s%2Fg%2F11v450yv0y!19sChIJ4wK6FsjvATsRgTdxhVbYVxo?authuser=0&hl=en&rclk=1,"9.278764299999999,79.11926"
Masjid Taqwa Ahle Hadees,Mosque,"Masjid Taqwa Ahle Hadees, 159, Agaram, Pettai Main Rd, Chitherikarai, Mandapam Village, Viluppuram, Tamil Nadu 605604","Chitherikarai, Mandapam Village","159, Agaram, Pettai Main Rd",Viluppuram,605604,Tamil Nadu,IN,https://www.google.com/maps/place/Masjid+Taqwa+Ahle+Hadees/data=!4m7!3m6!1s0x3a5357ac46d29c2f:0x13b4e46b716ce135!8m2!3d11.9533837!4d79.4955911!16s%2Fg%2F11jz6g301m!19sChIJL5zSRqxXUzoRNeFscWvktBM?authuser=0&hl=en&rclk=1,"11.9533837,79.4955911"
Madina Masjid Madarasa Mahal,Religious destination,"VWQ7+634 Madina Masjid Madarasa Mahal, Mettu St, Sankarapuram, Tamil Nadu 606401",,"VWQ7+634, Mettu St",Sankarapuram,606401,Tamil Nadu,IN,https://www.google.com/maps/place/Madina+Masjid+Madarasa+Mahal/data=!4m7!3m6!1s0x3bac9dc15ca3b067:0xdbfe824f1374a490!8m2!3d11.8880191!4d78.9127041!16s%2Fg%2F11ng760_xf!19sChIJZ7CjXMGdrDsRkKR0E0-C_ts?authuser=0&hl=en&rclk=1,"11.8880191,78.9127041"
iit perunaall maitaannnm,Mosque,"HRVP+M3J iit perunaall maitaannnm, Sankari - Edappadi - Mecheri Rd, Edappadi, Tamil Nadu 637101",,"HRVP+M3J, Sankari - Edappadi - Mecheri Rd",Edappadi,637101,Tamil Nadu,IN,https://www.google.com/maps/place/%E0%AE%88%E0%AE%A4%E0%AF%8D+%E0%AE%AA%E0%AF%86%E0%AE%B0%E0%AF%81%E0%AE%A8%E0%AE%BE%E0%AE%B3%E0%AF%8D+%E0%AE%AE%E0%AF%88%E0%AE%A4%E0%AE%BE%E0%AE%A9%E0%AE%AE%E0%AF%8D/data=!4m7!3m6!1s0x3ba95b0ed0f26e73:0xe626ba71b72beac4!8m2!3d11.5941493!4d77.8343238!16s%2Fg%2F11t63y91k1!19sChIJc27y0A5bqTsRxOort3G6JuY?authuser=0&hl=en&rclk=1,"11.5941493,77.83432379999999"
