name,main_category,address,address_ward,address_street,address_city,address_postal_code,address_state,address_country_code,link,coordinates
Tippu Masjid Devanahalli,Mosque,"6PV5+JCR Tippu Masjid Devanahalli, Karnataka 562110",,6PV5+JCR,,562110,Karnataka,IN,https://www.google.com/maps/place/Tippu+Masjid+Devanahalli/data=!4m7!3m6!1s0x3bae1d7d7cfee4b1:0x91faa08d8e8b1817!8m2!3d13.2441159!4d77.7085236!16s%2Fg%2F124yp8lmz!19sChIJseT-fH0drjsRFxiLjo2g-pE?authuser=0&hl=en&rclk=1,"13.244115899999999,77.70852359999999"
Jamia Masjid Devanahalli,Mosque,"Jamia Masjid Devanahalli, Devanahalli, Karnataka 562110",Devanahalli,,,562110,Karnataka,IN,https://www.google.com/maps/place/Jamia+Masjid+Devanahalli/data=!4m7!3m6!1s0x3bb1e282eba53d9d:0xa78dd30d063cd0b!8m2!3d13.245961!4d77.7092063!16s%2Fg%2F113gnnm03!19sChIJnT2l64LisTsRC81j0DDdeAo?authuser=0&hl=en&rclk=1,"13.245961,77.70920629999999"
Masjid-E-Aaminah Ahle Hadees Devanahalli,Mosque,"6PR6+RH8 Masjid-E-Aaminah Ahle Hadees Devanahalli, Unnamed Road, Devanahalli, Southegowdanahalli, Karnataka 562110",Devanahalli,"6PR6+RH8, Unnamed Road",Southegowdanahalli,562110,Karnataka,IN,https://www.google.com/maps/place/Masjid-E-Aaminah+Ahle+Hadees+Devanahalli/data=!4m7!3m6!1s0x3bae1d04c08adb53:0x3e547e11b7979c35!8m2!3d13.2420466!4d77.7114497!16s%2Fg%2F11f6yckxt9!19sChIJU9uKwAQdrjsRNZyXtxF-VD4?authuser=0&hl=en&rclk=1,"13.2420466,77.7114497"
Eidgah Mohallah Siqque Masjid,Mosque,"Eidgah Mohallah Siqque Masjid, Devanahalli, Southegowdanahalli, Karnataka 562110",Devanahalli,,Southegowdanahalli,562110,Karnataka,IN,https://www.google.com/maps/place/Eidgah+Mohallah+Siqque+Masjid/data=!4m7!3m6!1s0x3bae1d6255555555:0x16e26c87ad86f7cf!8m2!3d13.2417155!4d77.7137306!16s%2Fg%2F11f06jq3l3!19sChIJVVVVVWIdrjsRz_eGrYds4hY?authuser=0&hl=en&rclk=1,"13.2417155,77.71373059999999"
"Eid Gah ,Ahle Hadis , Devanahalli",Mosque,"6MXR+X8F Eid Gah ,Ahle Hadis , Devanahalli, ammani kere, near devanahalli, Hire Amanikere, Karnataka",,"6MXR+X8F, ammani kere, near devanahalli",Hire Amanikere,,Karnataka,IN,"https://www.google.com/maps/place/Eid+Gah+,Ahle+Hadis+,+Devanahalli/data=!4m7!3m6!1s0x3bb1e31784236021:0xe710fb0c97a8b29e!8m2!3d13.2499474!4d77.6907829!16s%2Fg%2F11hdjw492b!19sChIJIWAjhBfjsTsRnrKolwz7EOc?authuser=0&hl=en&rclk=1","13.2499474,77.6907829"
Eidgah Maidaan Masjid E TippuSultan,Priest,"6MQX+G23 Eidgah Maidaan Masjid E TippuSultan, Devanahalli, Karnataka 562110",Devanahalli,6MQX+G23,,,Karnataka,IN,https://www.google.com/maps/place/Eidgah+Maidaan+Masjid+E+TippuSultan/data=!4m7!3m6!1s0x3bae1dc3f8c064a9:0xc1da5d6c39be95fe!8m2!3d13.2387676!4d77.6975468!16s%2Fg%2F11flkc0jmr!19sChIJqWTA-MMdrjsR_pW-OWxd2sE?authuser=0&hl=en&rclk=1,"13.2387676,77.6975468"
MADRASA SABEEL ul falah mdrsh sbyl lflH,Mosque,"6PV5+JFQ MADRASA SABEEL ul falah mdrsh sbyl lflH, Devanahalli, Southegowdanahalli, Karnataka 562110",Devanahalli,6PV5+JFQ,Southegowdanahalli,562110,Karnataka,IN,https://www.google.com/maps/place/MADRASA+SABEEL+ul+falah+%D9%85%D8%AF%D8%B1%D8%B3%DB%81+%D8%B3%D8%A8%DB%8C%D9%84+%D8%A7%D9%84%D9%81%D9%84%D8%A7%D8%AD%E2%80%AD/data=!4m7!3m6!1s0x3bae1d6eb4ce251b:0xf63c2783379dfb97!8m2!3d13.2440998!4d77.7088!16s%2Fg%2F11jzh9dggd!19sChIJGyXOtG4drjsRl_udN4MnPPY?authuser=0&hl=en&rclk=1,"13.244099799999999,77.7088"
