name,main_category,address,address_ward,address_street,address_city,address_postal_code,address_state,address_country_code,link,coordinates
Ibrahim masjid,Mosque,"Ibrahim masjid, Mujahed Nagar, Nizamabad, Telangana 503001",Mujahed Nagar,Mujahed Nagar,Nizamabad,503001,Telangana,IN,https://www.google.com/maps/place/Ibrahim+masjid/data=!4m7!3m6!1s0x3bcddb1c9cab8d6b:0x4cd6c5d1eebac22d!8m2!3d18.6687702!4d78.0787829!16s%2Fg%2F11b808221d!19sChIJa42rnBzbzTsRLcK67tHF1kw?authuser=0&hl=en&rclk=1,"18.6687702,78.0787829"
Masjid-e-Bilal,Mosque,"Masjid-e-Bilal, Naseem Colony, Vinayak Nagar, Nizamabad, Telangana 503001",Vinayak Nagar,Naseem Colony,Nizamabad,503001,Telangana,IN,https://www.google.com/maps/place/Masjid-e-Bilal/data=!4m7!3m6!1s0x3bcddad51ad08a4f:0x19acc6ef354d528a!8m2!3d18.6628607!4d78.1087298!16s%2Fg%2F11c6dzygr6!19sChIJT4rQGtXazTsRilJNNe_GrBk?authuser=0&hl=en&rclk=1,"18.6628607,78.10872979999999"
Makkah Masjid mkhh msjd,Mosque,"M3CP+WG3 Makkah Masjid mkhh msjd, Ahmed Pura Colony, Mujahed Nagar, Nizamabad, Telangana 503001","Ahmed Pura Colony, Mujahed Nagar",M3CP+WG3,Nizamabad,503001,Telangana,IN,https://www.google.com/maps/place/Makkah+Masjid+%D9%85%DA%A9%DB%81+%D9%85%D8%B3%D8%AC%D8%AF%E2%80%AD/data=!4m7!3m6!1s0x3bcddb191cb9eaa5:0xb5390494c05a32fe!8m2!3d18.6722571!4d78.0863088!16s%2Fg%2F1td23x78!19sChIJpeq5HBnbzTsR_jJawJQEObU?authuser=0&hl=en&rclk=1,"18.6722571,78.0863088"
Masjid-E-Kachiyan masjidWi khachiyN,Mosque,"Masjid-E-Kachiyan masjidWi khachiyN, Gandhi Chowk, NH 63, NRI Colony, Arsapally, Nizamabad, Telangana 503001","NRI Colony, Arsapally","Gandhi Chowk, NH 63",Nizamabad,503001,Telangana,IN,https://www.google.com/maps/place/Masjid-E-Kachiyan+%D9%85%D9%8E%D8%B3%D9%92%D8%AC%D9%90%D8%AF%D9%91%D9%90+%DA%A9%D9%8E%DA%86%D9%90%DB%8C%D8%A7%DA%BA%E2%80%AD/data=!4m7!3m6!1s0x3bcddb248ee5f41d:0x9ab232367f14dbc4!8m2!3d18.6736552!4d78.0947363!16s%2Fg%2F1tf2qplx!19sChIJHfTljiTbzTsRxNsUfzYyspo?authuser=0&hl=en&rclk=1,"18.6736552,78.0947363"
Masjid-E-Malapally,Mosque,"Masjid-E-Malapally, Malapally St, beside New Minar Super Market, Mujahed Nagar, Nizamabad, Telangana 503001",Mujahed Nagar,"Malapally St, beside New Minar Super Market",Nizamabad,503001,Telangana,IN,https://www.google.com/maps/place/Masjid-E-Malapally/data=!4m7!3m6!1s0x3bcddb1a1c000001:0x2a23dbfff15ea39e!8m2!3d18.6717076!4d78.081221!16s%2Fg%2F11b6dg07fz!19sChIJAQAAHBrbzTsRnqNe8f_bIyo?authuser=0&hl=en&rclk=1,"18.671707599999998,78.081221"
Masjid e ibrahimia ek Minar masjidWi ibrahiymi ykhmiynr,Mosque,"M3CR+W6C Masjid e ibrahimia ek Minar masjidWi ibrahiymi ykhmiynr, Ahmed Pura, Quilla Rd, Barkatpura, Nizamabad, Telangana 503001","Mustaid Pura, Barkatpura","M3CR+W6C, Ahmed Pura, Quilla Rd",Nizamabad,503001,Telangana,IN,https://www.google.com/maps/place/Masjid+e+ibrahimia+ek+Minar+%D9%85%D9%8E%D8%B3%D9%92%D8%AC%D9%90%D8%AF%D9%91%D9%90+%D8%A7%D9%90%D8%A8%D9%92%D8%B1%D9%8E%D8%A7%DB%81%D9%90%DB%8C%D9%85%D9%90+%D8%A7%DB%8C%DA%A9%D9%85%D9%90%DB%8C%D9%92%D9%86%D8%A7%D8%B1%E2%80%AD/data=!4m7!3m6!1s0x3bcddb2253d78341:0xf09e19d2232da61b!8m2!3d18.6723101!4d78.0905115!16s%2Fg%2F1hhlq0_z8!19sChIJQYPXUyLbzTsRG6YtI9IZnvA?authuser=0&hl=en&rclk=1,"18.6723101,78.09051149999999"
Masjid -E-Khaleel,Mosque,"M3GM+7W6 Masjid -E-Khaleel, Bodhan - Nizamabad Rd, NRI Colony, Arsapally, Nizamabad, Telangana 503001","NRI Colony, Arsapally","M3GM+7W6, Bodhan - Nizamabad Rd",Nizamabad,503001,Telangana,IN,https://www.google.com/maps/place/Masjid+-E-Khaleel/data=!4m7!3m6!1s0x3bcddb177c275625:0x4eaceab29595a17!8m2!3d18.6756547!4d78.0847608!16s%2Fg%2F11c0xr0jzt!19sChIJJVYnfBfbzTsRF1pZKavO6gQ?authuser=0&hl=en&rclk=1,"18.6756547,78.0847608"
Rahmaniya Masjid raHmnyh masjid,Mosque,"M3CQ+RR3 Rahmaniya Masjid raHmnyh masjid, Ahmed Pura, Nizamabad, Telangana 503001","Ahmed Pura Colony, Mujahed Nagar","M3CQ+RR3, Ahmed Pura",Nizamabad,503001,Telangana,IN,https://www.google.com/maps/place/Rahmaniya+Masjid+%D8%B1%D9%8E%D8%AD%D9%85%D8%A7%D9%86%DB%8C%DB%81+%D9%85%D9%8E%D8%B3%D9%92%D8%AC%D9%90%D8%AF%D9%92%E2%80%AD/data=!4m7!3m6!1s0x3bcddb2215850f47:0x9acb181d221b4dfd!8m2!3d18.6720068!4d78.0895396!16s%2Fg%2F1td7g5p7!19sChIJRw-FFSLbzTsR_U0bIh0Yy5o?authuser=0&hl=en&rclk=1,"18.6720068,78.0895396"
Masjid-E-Station Bazaar masjid sttyshn bzr,Mosque,"M4G3+X98 Masjid-E-Station Bazaar masjid sttyshn bzr, Railway Station Road, Yellamma Gutta, Kumar Gali, Nizamabad, Telangana 503003","Yellamma Gutta, Kumar Gali","M4G3+X98, Railway Station Road",Nizamabad,503003,Telangana,IN,https://www.google.com/maps/place/Masjid-E-Station+Bazaar+%D9%85%D9%8E%D8%B3%D9%92%D8%AC%D9%90%D8%AF+%D8%A7%D8%B3%D9%B9%DB%8C%D8%B4%D9%86+%D8%A8%D8%A7%D8%B2%D8%A7%D8%B1%E2%80%AD/data=!4m7!3m6!1s0x3bcddb31c311b885:0xd243c94a4c1d2a55!8m2!3d18.6774106!4d78.1034612!16s%2Fg%2F11g6hz8dr3!19sChIJhbgRwzHbzTsRVSodTErJQ9I?authuser=0&hl=en&rclk=1,"18.677410599999998,78.1034612"
Mohammadia Masjid,Mosque,"Mohammadia Masjid, Backside Of Crescent, High School Boys) E/M Muhammadia colony, Mujahed Nagar, Nizamabad, Telangana 503001",Mujahed Nagar,"Backside Of Crescent, High School Boys) E/M Muhammadia colony",Nizamabad,503001,Telangana,IN,https://www.google.com/maps/place/Mohammadia+Masjid/data=!4m7!3m6!1s0x3bcddb1f4e268153:0x783f3951321c2632!8m2!3d18.6691819!4d78.0872789!16s%2Fg%2F11cn5pkfxt!19sChIJU4EmTh_bzTsRMiYcMlE5P3g?authuser=0&hl=en&rclk=1,"18.669181899999998,78.0872789"
Madina Masjid,Mosque,"Madina Masjid, x road, near to phulong, Phulong, Nizamabad, Telangana 503001",Phulong,"x road, near to phulong",Nizamabad,503001,Telangana,IN,https://www.google.com/maps/place/Madina+Masjid/data=!4m7!3m6!1s0x3bcddb28f6a763a3:0xb0bef05a6971b2a9!8m2!3d18.66805!4d78.1012011!16s%2Fg%2F11b8jcsbwk!19sChIJo2On9ijbzTsRqbJxaVrwvrA?authuser=0&hl=en&rclk=1,"18.66805,78.1012011"
Friends Mobiles,Mobile phone repair shop,"Friends Mobiles, near Gousiya Masjid, Auto Nagar, Arsapally, Nizamabad, Telangana 503001","Auto Nagar, Arsapally",near Gousiya Masjid,Nizamabad,503001,Telangana,IN,https://www.google.com/maps/place/Friends+Mobiles/data=!4m7!3m6!1s0x3bcddb0945bd5c93:0xf663fe31899e444d!8m2!3d18.6795018!4d78.0703785!16s%2Fg%2F11c2j0l6kr!19sChIJk1y9RQnbzTsRTUSeiTH-Y_Y?authuser=0&hl=en&rclk=1,"18.6795018,78.07037849999999"
Chistiya Masjid,Mosque,"M39M+JCP Chistiya Masjid, Quilla Rd, Hashmi Colony, Mujahed Nagar, Nizamabad, Telangana 503001","Hashmi Colony, Mujahed Nagar","M39M+JCP, Quilla Rd",Nizamabad,503001,Telangana,IN,https://www.google.com/maps/place/Chistiya+Masjid/data=!4m7!3m6!1s0x3bcddb1ec829660d:0x92abfcde25a1c885!8m2!3d18.6690843!4d78.0835666!16s%2Fg%2F11bw7dgn45!19sChIJDWYpyB7bzTsRhcihJd78q5I?authuser=0&hl=en&rclk=1,"18.669084299999998,78.0835666"
Raza Baig Masjid msjd rD byg,Mosque,"M3FV+25R Raza Baig Masjid msjd rD byg, Bodhan - Nizamabad Rd, Barkatpura, Nizamabad, Telangana 503001",Barkatpura,"M3FV+25R, Bodhan - Nizamabad Rd",Nizamabad,503001,Telangana,IN,https://www.google.com/maps/place/Raza+Baig+Masjid+%D9%85%D8%B3%D8%AC%D8%AF+%D8%B1%D8%B6%D8%A7+%D8%A8%DB%8C%DA%AF%E2%80%AD/data=!4m7!3m6!1s0x3bcddb239c9c637f:0xb16c666479bcefa!8m2!3d18.6726053!4d78.0928829!16s%2Fg%2F11bx2l7n01!19sChIJf2OcnCPbzTsR-s6bR2bGFgs?authuser=0&hl=en&rclk=1,"18.6726053,78.09288289999999"
Masjid -e - Azizia,Mosque,"M3GF+C39 Masjid -e - Azizia, Off Bodhan Road, Auto Nagar, Opp Arsapally, Nizamabad, Telangana 503001",Arsapally,"M3GF+C39, Off Bodhan Road, Auto Nagar, Opp Arsapally",Nizamabad,503001,Telangana,IN,https://www.google.com/maps/place/Masjid+-e+-+Azizia/data=!4m7!3m6!1s0x3bcddb0f6cbce095:0x2fdabef1555f9e34!8m2!3d18.6760422!4d78.0727471!16s%2Fg%2F11bwgwdp_9!19sChIJleC8bA_bzTsRNJ5fVfG-2i8?authuser=0&hl=en&rclk=1,"18.676042199999998,78.0727471"
Jama Masjid,Mosque,"M39R+5G9 Jama Masjid, 11 TRT Gajulpet, Barkatpura, Nizamabad, Telangana 503001","11 TRT Gajulpet, Barkatpura",M39R+5G9,Nizamabad,503001,Telangana,IN,https://www.google.com/maps/place/Jama+Masjid/data=!4m7!3m6!1s0x3bcddb210f03527f:0x70af95b07141d5a5!8m2!3d18.6679036!4d78.091356!16s%2Fg%2F11gjv7fv97!19sChIJf1IDDyHbzTsRpdVBcbCVr3A?authuser=0&hl=en&rclk=1,"18.6679036,78.09135599999999"
Umar Masjid,Mosque,"M4H5+3W3 Umar Masjid, Yellammagutta Rd, Line, Yellammagutta, Nizamabad, Telangana 503001","Line, Yellammagutta","M4H5+3W3, Yellammagutta Rd",Nizamabad,503001,Telangana,IN,https://www.google.com/maps/place/Umar+Masjid/data=!4m7!3m6!1s0x3bcddb32a4ca5b6f:0x9573b152a42d2cdc!8m2!3d18.6776364!4d78.1097855!16s%2Fg%2F11b6_vlv8f!19sChIJb1vKpDLbzTsR3CwtpFKxc5U?authuser=0&hl=en&rclk=1,"18.6776364,78.1097855"
Arafat Masjid,Mosque,"M3FP+HW9 Arafat Masjid, Ahmed Pura Colony, Mujahed Nagar, Nizamabad, Telangana 503001","Ahmed Pura Colony, Mujahed Nagar",M3FP+HW9,Nizamabad,503001,Telangana,IN,https://www.google.com/maps/place/Arafat+Masjid/data=!4m7!3m6!1s0x3bcddb18f43457ad:0xe283639c8e61ddc5!8m2!3d18.6739088!4d78.0873603!16s%2Fg%2F1vcjkq4q!19sChIJrVc09BjbzTsRxd1hjpxjg-I?authuser=0&hl=en&rclk=1,"18.6739088,78.0873603"
Bilal Masjid,Mosque,"M39J+W4G Bilal Masjid, Shanti Nagar Colony, Rakasipet, Bodhan, Nizamabad, Telangana 503001","Shanti Nagar Colony, Rakasipet",M39J+W4G,"Bodhan, Nizamabad",503001,Telangana,IN,https://www.google.com/maps/place/Bilal+Masjid/data=!4m7!3m6!1s0x3bcddb1b8ef09ff7:0xef6db3a685102dc0!8m2!3d18.6698088!4d78.0803204!16s%2Fg%2F11cjkq31td!19sChIJ95_wjhvbzTsRwC0Qhaazbe8?authuser=0&hl=en&rclk=1,"18.6698088,78.08032039999999"
Masjid -E- Jafar Hussain,Mosque,"Masjid -E- Jafar Hussain, 503001, NRI Colony, Arsapally, Nizamabad, Telangana 503001","NRI Colony, Arsapally",503001,Nizamabad,503001,Telangana,IN,https://www.google.com/maps/place/Masjid+-E-+Jafar+Hussain/data=!4m7!3m6!1s0x3bcddb11e885205d:0xa9263d1a739db7c8!8m2!3d18.6795213!4d78.0773248!16s%2Fg%2F11c20bpm3_!19sChIJXSCF6BHbzTsRyLedcxo9Jqk?authuser=0&hl=en&rclk=1,"18.679521299999998,78.0773248"
Masjid -E- Khaif msjd khyf,Mosque,"M3JH+C8X Masjid -E- Khaif msjd khyf, NRI Colony, Arsapally, Nizamabad, Telangana 503001","NRI Colony, Arsapally",M3JH+C8X,Nizamabad,503001,Telangana,IN,https://www.google.com/maps/place/Masjid+-E-+Khaif+%D9%85%D8%B3%D8%AC%D8%AF+%D8%AE%DB%8C%D9%81%E2%80%AD/data=!4m7!3m6!1s0x3bcddb1221523ddd:0xa8f9cc86d57725a9!8m2!3d18.6811121!4d78.0783682!16s%2Fg%2F11g8tynt6x!19sChIJ3T1SIRLbzTsRqSV31YbM-ag?authuser=0&hl=en&rclk=1,"18.6811121,78.0783682"
Masjid-e-Tauheed,Mosque,"M492+QHM Masjid-e-Tauheed, Phulong, Nizamabad, Telangana 503001",Phulong,M492+QHM,Nizamabad,503001,Telangana,IN,https://www.google.com/maps/place/Masjid-e-Tauheed/data=!4m7!3m6!1s0x3bcddb28c38f025b:0x31dfdbbbd2541874!8m2!3d18.6694715!4d78.101419!16s%2Fg%2F11bx454vs9!19sChIJWwKPwyjbzTsRdBhU0rvb3zE?authuser=0&hl=en&rclk=1,"18.6694715,78.10141899999999"
Masjid-e-Farhad Unissa,Mosque,"Masjid-e-Farhad Unissa, 503001, NRI Colony, Arsapally, Nizamabad, Telangana 503001","Habeeb Nagar, NRI Colony, Arsapally",503001,Nizamabad,503001,Telangana,IN,https://www.google.com/maps/place/Masjid-e-Farhad+Unissa/data=!4m7!3m6!1s0x3bcddb17a5dfdbdf:0xe1fbaca60e063226!8m2!3d18.6775002!4d78.0855246!16s%2Fg%2F11c5_5pb64!19sChIJ39vfpRfbzTsRJjIGDqas--E?authuser=0&hl=en&rclk=1,"18.6775002,78.0855246"
Quba Masjid masjidWi quba,Mosque,"M38M+58M Quba Masjid masjidWi quba, Mujahed Nagar, Nizamabad, Telangana 503001",Mujahed Nagar,M38M+58M,Nizamabad,503001,Telangana,IN,https://www.google.com/maps/place/Quba+Masjid+%D9%85%D9%8E%D8%B3%D9%92%D8%AC%D9%90%D8%AF%D9%91%D9%90+%D9%82%D9%8F%D8%A8%D9%8E%D8%A7%D8%A1%E2%80%AD/data=!4m7!3m6!1s0x3bcddb1e6e7da7a7:0xd7cc7c6a1b479582!8m2!3d18.6654602!4d78.0833086!16s%2Fg%2F1vvdsn_t!19sChIJp6d9bh7bzTsRgpVHG2p8zNc?authuser=0&hl=en&rclk=1,"18.6654602,78.0833086"
Masjid-e-Quadriya,Mosque,"M3CR+254 Masjid-e-Quadriya, 11 TRT Gajulpet, Barkatpura, Nizamabad, Telangana 503001","11 TRT Gajulpet, Barkatpura",M3CR+254,Nizamabad,503001,Telangana,IN,https://www.google.com/maps/place/Masjid-e-Quadriya/data=!4m7!3m6!1s0x3bcddb22299acb19:0x8a6174ec56ba9bc4!8m2!3d18.6700185!4d78.0904636!16s%2Fg%2F11b6htvp_9!19sChIJGcuaKSLbzTsRxJu6Vux0YYo?authuser=0&hl=en&rclk=1,"18.670018499999998,78.09046359999999"
Masjid -E- Saberah Zareena,Mosque,"M3JM+M3R Masjid -E- Saberah Zareena, Ambedkar Colony, Nizamabad, Telangana 503001",Ambedkar Colony,M3JM+M3R,Nizamabad,503001,Telangana,IN,https://www.google.com/maps/place/Masjid+-E-+Saberah+Zareena/data=!4m7!3m6!1s0x3bcddb1405d14b75:0x2488d19c728adca4!8m2!3d18.6817406!4d78.0826305!16s%2Fg%2F11g6mx6y9q!19sChIJdUvRBRTbzTsRpNyKcpzRiCQ?authuser=0&hl=en&rclk=1,"18.681740599999998,78.0826305"
Masjid-e-Nimra Salafiya,Mosque,"Masjid-e-Nimra Salafiya, Ahmed Pura Colony, Mujahed Nagar, Nizamabad, Telangana 503001","Ahmed Pura Colony, Mujahed Nagar",,Nizamabad,503001,Telangana,IN,https://www.google.com/maps/place/Masjid-e-Nimra+Salafiya/data=!4m7!3m6!1s0x3bcddb229665fa57:0x198cc15d352e1853!8m2!3d18.6725599!4d78.08699!16s%2Fg%2F1tc_2k5k!19sChIJV_plliLbzTsRUxguNV3BjBk?authuser=0&hl=en&rclk=1,"18.6725599,78.08699"
MASJID-E-YASEEN,Mosque,"MASJID-E-YASEEN, Khoja Colony, NRI Colony, Arsapally, Nizamabad, Telangana 503001","Khoja Colony, NRI Colony, Arsapally",,Nizamabad,503001,Telangana,IN,https://www.google.com/maps/place/MASJID-E-YASEEN/data=!4m7!3m6!1s0x3bcddb3d676fdc5b:0x609a564f3a8b808d!8m2!3d18.6770333!4d78.085339!16s%2Fg%2F11f3wkk09m!19sChIJW9xvZz3bzTsRjYCLOk9WmmA?authuser=0&hl=en&rclk=1,"18.677033299999998,78.08533899999999"
Masjid-e-Naaz,Mosque,"M3H6+6G3 Masjid-e-Naaz, driver colony, Arsapally, Nizamabad, Telangana 503001","driver colony, Arsapally",M3H6+6G3,Nizamabad,503001,Telangana,IN,https://www.google.com/maps/place/Masjid-e-Naaz/data=!4m7!3m6!1s0x3bcddba6e97bee19:0x4d11e3282fde3333!8m2!3d18.678022!4d78.0612956!16s%2Fg%2F11fxb6qtn2!19sChIJGe576abbzTsRMzPeLyjjEU0?authuser=0&hl=en&rclk=1,"18.678022,78.0612956"
"Masjid E Kabir, Habeeb Nagar.",Mosque,"Masjid E Kabir, Habeeb Nagar., 503001, NRI Colony, Arsapally, Nizamabad, Telangana 503001","Habeeb Nagar, NRI Colony, Arsapally",503001,Nizamabad,503001,Telangana,IN,"https://www.google.com/maps/place/Masjid+E+Kabir,+Habeeb+Nagar./data=!4m7!3m6!1s0x3bcddb16bfe17c3b:0xf1b4fdbb6e9c3844!8m2!3d18.6794858!4d78.084513!16s%2Fg%2F11c1tl1_5b!19sChIJO3zhvxbbzTsRRDicbrv9tPE?authuser=0&hl=en&rclk=1","18.6794858,78.084513"
Masjid-e noor jahan wajid,Mosque,"M3MF+7MF Masjid-e noor jahan wajid, Arsapally, Nizamabad, Telangana 503001",Arsapally,M3MF+7MF,Nizamabad,503001,Telangana,IN,https://www.google.com/maps/place/Masjid-e+noor+jahan+wajid/data=!4m7!3m6!1s0x3bcddb0daea61efb:0xc7be4fe61d77e6cb!8m2!3d18.6831928!4d78.0741846!16s%2Fg%2F11b6lg1tjc!19sChIJ-x6mrg3bzTsRy-Z3HeZPvsc?authuser=0&hl=en&rclk=1,"18.6831928,78.0741846"
Masjid Hashmi,Mosque,"Masjid Hashmi, shifa medical, Quilla Rd, Ahmed Pura Colony, Mujahed Nagar, Nizamabad, Telangana 503001","Ahmed Pura Colony, Mujahed Nagar","shifa medical, Quilla Rd",Nizamabad,503001,Telangana,IN,https://www.google.com/maps/place/Masjid+Hashmi/data=!4m7!3m6!1s0x3bcddb2237d143d1:0xab7b6368939ccf9!8m2!3d18.6715199!4d78.0904301!16s%2Fg%2F11cm0wflvh!19sChIJ0UPRNyLbzTsR-cw5iTa2two?authuser=0&hl=en&rclk=1,"18.6715199,78.09043009999999"
Masjid-e-Umar Farooque,Mosque,"Masjid-e-Umar Farooque, NGO Colony, Nizamabad, Telangana 503002",NGO Colony,,Nizamabad,503002,Telangana,IN,https://www.google.com/maps/place/Masjid-e-Umar+Farooque/data=!4m7!3m6!1s0x3bcddb4af70da7cd:0xa40039c2f0a7a1b!8m2!3d18.6906259!4d78.108191!16s%2Fg%2F11fx7nlmxf!19sChIJzacN90rbzTsRG3oKL5wDQAo?authuser=0&hl=en&rclk=1,"18.6906259,78.10819099999999"
Masjid -E- Khatija,Mosque,"M3GQ+62G Masjid -E- Khatija, NRI Colony, Arsapally, Nizamabad, Telangana 503001","NRI Colony, Arsapally",M3GQ+62G,Nizamabad,503001,Telangana,IN,https://www.google.com/maps/place/Masjid+-E-+Khatija/data=!4m7!3m6!1s0x3bcddb17f8a30715:0x130a33146e63e5c6!8m2!3d18.6755681!4d78.0875802!16s%2Fg%2F11ycxs_mv!19sChIJFQej-BfbzTsRxuVjbhQzChM?authuser=0&hl=en&rclk=1,"18.6755681,78.08758019999999"
Masjid-E-Fruit Market,Mosque,"M3HJ+79C Masjid-E-Fruit Market, Habeeb Nagar, NRI Colony, Arsapally, Nizamabad, Telangana 503001","Habeeb Nagar, NRI Colony, Arsapally",M3HJ+79C,Nizamabad,503001,Telangana,IN,https://www.google.com/maps/place/Masjid-E-Fruit+Market/data=!4m7!3m6!1s0x3bcddb1120fb8aef:0x7703194112aa19a8!8m2!3d18.6781992!4d78.0808887!16s%2Fg%2F11c75xxcwx!19sChIJ74r7IBHbzTsRqBmqEkEZA3c?authuser=0&hl=en&rclk=1,"18.678199199999998,78.0808887"
Masjid-e-Shaik Mira,Mosque,"Masjid-e-Shaik Mira, 7-73/2, Arya Nagar Colony, Borgaon, FCI Colony, Nizamabad, Telangana 503230","Arya Nagar Colony, Borgaon, FCI Colony",7-73/2,Nizamabad,503230,Telangana,IN,https://www.google.com/maps/place/Masjid-e-Shaik+Mira/data=!4m7!3m6!1s0x3bcdc52dd4b8d763:0x1bf031243efd2092!8m2!3d18.6568492!4d78.1162534!16s%2Fg%2F11bywkpmd0!19sChIJY9e41C3FzTsRkiD9PiQx8Bs?authuser=0&hl=en&rclk=1,"18.6568492,78.11625339999999"
Masjid-E-Aqsa,Mosque,"M3FJ+P6C Masjid-E-Aqsa, Malapally, Mujahed Nagar, Nizamabad, Telangana 503001","Malapally, Mujahed Nagar",M3FJ+P6C,Nizamabad,503001,Telangana,IN,https://www.google.com/maps/place/Masjid-E-Aqsa/data=!4m7!3m6!1s0x3bcddbe3d3f00c6b:0xda149cf5de3c95b!8m2!3d18.6743227!4d78.0805025!16s%2Fg%2F11g2wh45lv!19sChIJawzw0-PbzTsRW8njXc9JoQ0?authuser=0&hl=en&rclk=1,"18.674322699999998,78.0805025"
Masjid E Abdul Rahman Maher,Mosque,"Masjid E Abdul Rahman Maher, 503001, NRI Colony, Arsapally, Nizamabad, Telangana 503001","Habeeb Nagar, NRI Colony, Arsapally",503001,Nizamabad,503001,Telangana,IN,https://www.google.com/maps/place/Masjid+E+Abdul+Rahman+Maher/data=!4m7!3m6!1s0x3bcddb16e52a1985:0x3bc23e90c2a042ec!8m2!3d18.6788528!4d78.084382!16s%2Fg%2F11c1tltw5m!19sChIJhRkq5RbbzTsR7EKgwpA-wjs?authuser=0&hl=en&rclk=1,"18.678852799999998,78.08438199999999"
Ghani Masjid,Mosque,"M39M+3FX Ghani Masjid, Hashmi Colony, Mujahed Nagar, Nizamabad, Telangana 503001","Hashmi Colony, Mujahed Nagar",M39M+3FX,Nizamabad,503001,Telangana,IN,https://www.google.com/maps/place/Ghani+Masjid/data=!4m7!3m6!1s0x3bcddb1eeb3485fb:0xf5d301f66b13bfe0!8m2!3d18.6677306!4d78.0837442!16s%2Fg%2F11cn3sxppg!19sChIJ-4U06x7bzTsR4L8Ta_YB0_U?authuser=0&hl=en&rclk=1,"18.6677306,78.0837442"
Masjid E Kanteshwar,Mosque,"M4M7+XXX Masjid E Kanteshwar, Kanteshwar, Nizamabad, Telangana 503002",Kanteshwar,M4M7+XXX,Nizamabad,503002,Telangana,IN,https://www.google.com/maps/place/Masjid+E+Kanteshwar/data=!4m7!3m6!1s0x3bcdc4cbba38d541:0x22f7373f4fb99f66!8m2!3d18.6849904!4d78.1149867!16s%2Fg%2F1tcwk098!19sChIJQdU4usvEzTsRZp-5Tz839yI?authuser=0&hl=en&rclk=1,"18.6849904,78.1149867"
Masjid-E-Faheem,Mosque,"M3CM+4HX Masjid-E-Faheem, near Mohammadia Colony, Malapally, Mujahed Nagar, Nizamabad, Telangana 503001","Malapally, Mujahed Nagar","M3CM+4HX, near Mohammadia Colony",Nizamabad,503001,Telangana,IN,https://www.google.com/maps/place/Masjid-E-Faheem/data=!4m7!3m6!1s0x3bcddb19392381f1:0xf88f4422fde9e912!8m2!3d18.670359!4d78.0839904!16s%2Fg%2F11c605r0qt!19sChIJ8YEjORnbzTsREunp_SJEj_g?authuser=0&hl=en&rclk=1,"18.670358999999998,78.08399039999999"
Masjid E Omar,Mosque,"M3GC+VVX Masjid E Omar, Arsapally, Nizamabad, Telangana 503001",Arsapally,M3GC+VVX,Nizamabad,503001,Telangana,IN,https://www.google.com/maps/place/Masjid+E+Omar/data=!4m7!3m6!1s0x3bcddb0f21c1500f:0x2eec02e9ce84073b!8m2!3d18.6772384!4d78.0722258!16s%2Fg%2F11xlbb641!19sChIJD1DBIQ_bzTsROweEzukC7C4?authuser=0&hl=en&rclk=1,"18.6772384,78.0722258"
Masjid E Qureshi,Mosque,"M4W5+CPJ Masjid E Qureshi, Gautamnagar, Nizamabad, Telangana 503002",Gautamnagar,M4W5+CPJ,Nizamabad,503002,Telangana,IN,https://www.google.com/maps/place/Masjid+E+Qureshi/data=!4m7!3m6!1s0x3bcddb4cea58ab1f:0x8df2220878c2e365!8m2!3d18.6960824!4d78.1092551!16s%2Fg%2F11c54cllwp!19sChIJH6tY6kzbzTsRZePCeAgi8o0?authuser=0&hl=en&rclk=1,"18.696082399999998,78.1092551"
Jama Masjid Salafiya Ahle Hadees,Mosque,"M3FQ+JJG Jama Masjid Salafiya Ahle Hadees, Mujahed Nagar, Nizamabad, Telangana 503001",Mujahed Nagar,M3FQ+JJG,Nizamabad,,Telangana,IN,https://www.google.com/maps/place/Jama+Masjid+Salafiya+Ahle+Hadees/data=!4m7!3m6!1s0x3bcddb2295c2238b:0x3f9d268775e2837f!8m2!3d18.6740734!4d78.0890857!16s%2Fg%2F11gjxchpj9!19sChIJiyPClSLbzTsRf4PidYcmnT8?authuser=0&hl=en&rclk=1,"18.674073399999997,78.0890857"
Qilla Masjid,Mosque,"M37J+MJ3 Qilla Masjid, Mujahed Nagar, Nizamabad, Telangana 503001",Mujahed Nagar,M37J+MJ3,Nizamabad,503001,Telangana,IN,https://www.google.com/maps/place/Qilla+Masjid/data=!4m7!3m6!1s0x3bcddb1df1eecec5:0x1fc573234eb0903c!8m2!3d18.6641296!4d78.0815462!16s%2Fg%2F1v27syz1!19sChIJxc7u8R3bzTsRPJCwTiNzxR8?authuser=0&hl=en&rclk=1,"18.6641296,78.08154619999999"
Masjid E Khursheed,Mosque,"Masjid E Khursheed, Sana Colony, near Bypass, Nizam Colony, Ambedkar Colony, Nizamabad, Telangana 503001","Nizam Colony, Ambedkar Colony","Sana Colony, near Bypass",Nizamabad,503001,Telangana,IN,https://www.google.com/maps/place/Masjid+E+Khursheed/data=!4m7!3m6!1s0x3bcddb1456e96419:0xcb186f099aeacc0d!8m2!3d18.6838493!4d78.0847086!16s%2Fg%2F11gjs8r1d0!19sChIJGWTpVhTbzTsRDczqmglvGMs?authuser=0&hl=en&rclk=1,"18.6838493,78.0847086"
Masjid e Yaqoob,Mosque,"M3JC+JQ2 Masjid e Yaqoob, Arsapally, Nizamabad, Telangana 503001",Arsapally,M3JC+JQ2,Nizamabad,503001,Telangana,IN,https://www.google.com/maps/place/Masjid+e+Yaqoob/data=!4m7!3m6!1s0x3bcddb0c1154110f:0xe09328da6a1e5ee7!8m2!3d18.6815197!4d78.0718971!16s%2Fg%2F11bxfdtw9x!19sChIJDxFUEQzbzTsR514eatook-A?authuser=0&hl=en&rclk=1,"18.6815197,78.0718971"
"Masjid E Amatullah Afzal , msjd y mtulh fDl",Mosque,"Masjid E Amatullah Afzal , msjd y mtulh fDl, Habeeb Nagar, NRI Colony, Arsapally, Nizamabad, Telangana 503001","Habeeb Nagar, NRI Colony, Arsapally",,Nizamabad,503001,Telangana,IN,https://www.google.com/maps/place/Masjid+E+Amatullah+Afzal+%D8%8C+%D9%85%D8%B3%D8%AC%D8%AF+%D8%A7%DB%8C+%D8%A7%D9%85%D8%AA%D9%8F%D9%84%DB%81+%D8%A7%D9%81%D8%B6%D9%84%E2%80%AD/data=!4m7!3m6!1s0x3bcddb1630d22c11:0xe2aef58589c6037c!8m2!3d18.6785959!4d78.086682!16s%2Fg%2F11c2md8c6q!19sChIJESzSMBbbzTsRfAPGiYX1ruI?authuser=0&hl=en&rclk=1,"18.678595899999998,78.086682"
Masjid-E-Umer Bin Khattab,Mosque,"M39P+H49 Masjid-E-Umer Bin Khattab, opp. Uzma Garden Function Hall, Hashmi Colony, Mujahed Nagar, Nizamabad, Telangana 503001","Hashmi Colony, Mujahed Nagar","M39P+H49, opp. Uzma Garden Function Hall",Nizamabad,503001,Telangana,IN,https://www.google.com/maps/place/Masjid-E-Umer+Bin+Khattab/data=!4m7!3m6!1s0x3bcddb1f28f3038b:0x605fb81d7c7cfbdc!8m2!3d18.6689238!4d78.0853549!16s%2Fg%2F11fyxb5wl9!19sChIJiwPzKB_bzTsR3Pt8fB24X2A?authuser=0&hl=en&rclk=1,"18.668923799999998,78.0853549"
Masjid-E-AQSA,Mosque,"Masjid-E-AQSA, Ganesh Colony, FCI Colony, Nizamabad, Telangana 503230","Ganesh Colony, FCI Colony",,Nizamabad,503230,Telangana,IN,https://www.google.com/maps/place/Masjid-E-AQSA/data=!4m7!3m6!1s0x3bcdc52ae94dda5d:0xc3d78604021c69b6!8m2!3d18.6635656!4d78.1125897!16s%2Fg%2F11clsg77gm!19sChIJXdpN6SrFzTsRtmkcAgSG18M?authuser=0&hl=en&rclk=1,"18.6635656,78.1125897"
Choti Kachiyan Masjid,Mosque,"Choti Kachiyan Masjid, 503001, NRI Colony, Arsapally, Nizamabad, Telangana 503001","Habeeb Nagar, NRI Colony, Arsapally",503001,Nizamabad,503001,Telangana,IN,https://www.google.com/maps/place/Choti+Kachiyan+Masjid/data=!4m7!3m6!1s0x3bcddb171aa0d94d:0x3da083cd79b1ee88!8m2!3d18.6775297!4d78.0843766!16s%2Fg%2F11cs37wkb5!19sChIJTdmgGhfbzTsRiO6xec2DoD0?authuser=0&hl=en&rclk=1,"18.6775297,78.0843766"
Waheedia Masjid,Mosque,"M3FF+M66 Waheedia Masjid, Arsapally, Nizamabad, Telangana 503001",Arsapally,M3FF+M66,Nizamabad,503001,Telangana,IN,https://www.google.com/maps/place/Waheedia+Masjid/data=!4m7!3m6!1s0x3bcddb0586e227bf:0xe54892ea8e3a918c!8m2!3d18.6741643!4d78.0730003!16s%2Fg%2F11dxjx3wrj!19sChIJvyfihgXbzTsRjJE6juqSSOU?authuser=0&hl=en&rclk=1,"18.674164299999997,78.07300029999999"
masjid e osmaniya,Mosque,"M3G9+Q87 masjid e osmaniya, Auto Nagar, District Jail, Sarangapur, Nizamabad, Telangana 503001","Auto Nagar, District Jail, Sarangapur",M3G9+Q87,Nizamabad,503001,Telangana,IN,https://www.google.com/maps/place/masjid+e+osmaniya/data=!4m7!3m6!1s0x3bcddb08fec6c057:0xa26a8e56780520cf!8m2!3d18.676918!4d78.0682971!16s%2Fg%2F11ddwy2qm3!19sChIJV8DG_gjbzTsRzyAFeFaOaqI?authuser=0&hl=en&rclk=1,"18.676918,78.0682971"
Anees Masjid,Mosque,"M39J+3XM Anees Masjid, Mujahed Nagar, Nizamabad, Telangana 503001",Mujahed Nagar,M39J+3XM,Nizamabad,503001,Telangana,IN,https://www.google.com/maps/place/Anees+Masjid/data=!4m7!3m6!1s0x3bcddb1e9fb5187f:0xbd9713c327ccc497!8m2!3d18.667722!4d78.0824066!16s%2Fg%2F11c1frdv4x!19sChIJfxi1nx7bzTsRl8TMJ8MTl70?authuser=0&hl=en&rclk=1,"18.667721999999998,78.0824066"
Masjid E Nusrat Bin Yaseen,Mosque,"Masjid E Nusrat Bin Yaseen, Unnamed Road, 503001, NRI Colony, Arsapally, Nizamabad, Telangana 503001","Habeeb Nagar, NRI Colony, Arsapally","Unnamed Road, 503001",Nizamabad,503001,Telangana,IN,https://www.google.com/maps/place/Masjid+E+Nusrat+Bin+Yaseen/data=!4m7!3m6!1s0x3bcddb165a116ba7:0xad2a53b375fdc147!8m2!3d18.6791191!4d78.0855793!16s%2Fg%2F11cs37shjn!19sChIJp2sRWhbbzTsRR8H9dbNTKq0?authuser=0&hl=en&rclk=1,"18.679119099999998,78.08557929999999"
Masjid-E-Alimurtuza,Mosque,"M4J6+FH7 Masjid-E-Alimurtuza, Shastri Nagar, Kanteshwar, Nizamabad, Telangana 503002","Shastri Nagar, Kanteshwar",M4J6+FH7,Nizamabad,503002,Telangana,IN,https://www.google.com/maps/place/Masjid-E-Alimurtuza/data=!4m7!3m6!1s0x3bcdc4ccc8eafbd3:0xf95db756edd5fa8f!8m2!3d18.681153!4d78.1114143!16s%2Fg%2F11b6drcsy6!19sChIJ0_vqyMzEzTsRj_rV7Va3Xfk?authuser=0&hl=en&rclk=1,"18.681153,78.11141429999999"
Masjid-e-Upper Tekdi,Mosque,"Masjid-e-Upper Tekdi, TEKDI, UPPER, Nizamabad, Telangana 503001",Shivaji Nagar,"TEKDI, UPPER",Nizamabad,503001,Telangana,IN,https://www.google.com/maps/place/Masjid-e-Upper+Tekdi/data=!4m7!3m6!1s0x3bcddb2676b46d9b:0x1e6a1ae54446b4d4!8m2!3d18.6700816!4d78.0977426!16s%2Fg%2F124yhg2gk!19sChIJm220dibbzTsR1LRGROUaah4?authuser=0&hl=en&rclk=1,"18.6700816,78.09774259999999"
Saleheen Masjid,Mosque,"Saleheen Masjid, Unnamed Road, 503001, Arsapally, Nizamabad, Telangana 503001",Arsapally,"Unnamed Road, 503001",Nizamabad,503001,Telangana,IN,https://www.google.com/maps/place/Saleheen+Masjid/data=!4m7!3m6!1s0x3bcddb0f5281ccd7:0xa074b4f784e52bc7!8m2!3d18.6752289!4d78.0708761!16s%2Fg%2F11gb3n18h5!19sChIJ18yBUg_bzTsRxyvlhPe0dKA?authuser=0&hl=en&rclk=1,"18.6752289,78.07087609999999"
