name,main_category,address,address_ward,address_street,address_city,address_postal_code,address_state,address_country_code,link,coordinates
Masjid-E-Sufiya,Mosque,"Masjid-E-Sufiya, Sufiya Masjid, Qadar Pura, Naseer Nagar, Siddipet, Telangana 502103",Naseer Nagar,"Sufiya Masjid, Qadar Pura",Siddipet,502103,Telangana,IN,https://www.google.com/maps/place/Masjid-E-Sufiya/data=!4m7!3m6!1s0x3bcced544c42fea9:0x57f330c4e7a5b5ba!8m2!3d18.1059597!4d78.8413357!16s%2Fg%2F1t_wmtgc!19sChIJqf5CTFTtzDsRurWl58Qw81c?authuser=0&hl=en&rclk=1,"18.1059597,78.8413357"
Makkah Masjid,Mosque,"4R4X+WM7 Makkah Masjid, Charwadan Lane No. 2, beside Tanzeem-ul-Masajid, Azam Pura, Siddipet, Telangana 502103",Azam Pura,"4R4X+WM7, Charwadan Lane No. 2, beside Tanzeem-ul-Masajid",Siddipet,502103,Telangana,IN,https://www.google.com/maps/place/Makkah+Masjid/data=!4m7!3m6!1s0x3bcced520c1590b9:0x9c6bfebb2f8dc0e!8m2!3d18.1072882!4d78.8491687!16s%2Fg%2F1hf33ctxs!19sChIJuZAVDFLtzDsRDtz4suu_xgk?authuser=0&hl=en&rclk=1,"18.1072882,78.84916869999999"
Masjid-un--Naseer,Mosque,"Masjid-un--Naseer, kamareddy road, Masjid un Naseer, Naseer Nager, Naseer Nagar, Siddipet, Telangana 502103",Naseer Nagar,"kamareddy road, Masjid un Naseer, Naseer Nager",Siddipet,502103,Telangana,IN,https://www.google.com/maps/place/Masjid-un--Naseer/data=!4m7!3m6!1s0x3bcced5624861a05:0xe3ebe2d39871b7c7!8m2!3d18.1097228!4d78.8388395!16s%2Fg%2F11r8tr32r!19sChIJBRqGJFbtzDsRx7dxmNPi6-M?authuser=0&hl=en&rclk=1,"18.1097228,78.83883949999999"
Masjid e raza,Mosque,"4R5V+HQG Masjid e raza, Nasarpura, Siddipet, Telangana 502103",Nasarpura,4R5V+HQG,Siddipet,502103,Telangana,IN,https://www.google.com/maps/place/Masjid+e+raza/data=!4m7!3m6!1s0x3bcced515497985f:0x8bc5690f29494e2c!8m2!3d18.1089309!4d78.8444577!16s%2Fg%2F11c6cg8k72!19sChIJX5iXVFHtzDsRLE5JKQ9pxYs?authuser=0&hl=en&rclk=1,"18.1089309,78.84445769999999"
"Masjid-E-Tawheed, Ahle Hadees, Siddipet, Telangana State",Mosque,"20, Masjid-E-Tawheed, Ahle Hadees, Siddipet, Telangana State, 9-4-20, Sharwadan Rd, Azam Pura, Siddipet, Telangana 502103",Azam Pura,"20, 9-4-20, Sharwadan Rd",Siddipet,502103,Telangana,IN,"https://www.google.com/maps/place/Masjid-E-Tawheed,+Ahle+Hadees,+Siddipet,+Telangana+State/data=!4m7!3m6!1s0x3bcced51f48095d9:0x2a357028ca5d0ec6!8m2!3d18.1087534!4d78.8483462!16s%2Fg%2F11ckvl9dxw!19sChIJ2ZWA9FHtzDsRxg5dyihwNSo?authuser=0&hl=en&rclk=1","18.108753399999998,78.8483462"
Masjid E Ayesha Siddiqua(RA),Mosque,"Street No.2, Masjid E Ayesha Siddiqua(RA), Salmanpura, Siddipet, Telangana 502103",Salmanpura,Street No.2,Siddipet,502103,Telangana,IN,https://www.google.com/maps/place/Masjid+E+Ayesha+Siddiqua%28RA%29/data=!4m7!3m6!1s0x3bcced579fec30b3:0x31b9eddd4a140cac!8m2!3d18.1127732!4d78.8407027!16s%2Fg%2F11fz0vg2lj!19sChIJszDsn1ftzDsRrAwUSt3tuTE?authuser=0&hl=en&rclk=1,"18.1127732,78.8407027"
"Madina Masjid, Siddipet",Mosque,"4V53+G3Q Madina Masjid, Siddipet, Paripally Street, Parupalliveedhi Parupalliveedhi Siddipet, Narsapur, Telangana 502103",Parupalliveedhi,"4V53+G3Q, Paripally Street, Parupalliveedhi Parupalliveedhi Siddipet","Narsapur, Siddipet",502103,Telangana,IN,"https://www.google.com/maps/place/Madina+Masjid,+Siddipet/data=!4m7!3m6!1s0x3bcced4e827a12cd:0x8e2b2cb5dcc58829!8m2!3d18.1088467!4d78.852734!16s%2Fg%2F12hmj4_xg!19sChIJzRJ6gk7tzDsRKYjF3LUsK44?authuser=0&hl=en&rclk=1","18.1088467,78.852734"
"Masjid-E-Hajera, Murshid Gadda.",Mosque,"Masjid-E-Hajera, Murshid Gadda., colony block 2, Murshid Gadda Rd, Kadharpura, Mohinpura, Siddipet, Telangana 502103","Kadharpura, Mohinpura","colony block 2, Murshid Gadda Rd",Siddipet,502103,Telangana,IN,"https://www.google.com/maps/place/Masjid-E-Hajera,+Murshid+Gadda./data=!4m7!3m6!1s0x3bcced55118d9eaf:0xc85b56e1d84bed4a!8m2!3d18.1041995!4d78.8400954!16s%2Fg%2F1vf99tp_!19sChIJr56NEVXtzDsRSu1L2OFWW8g?authuser=0&hl=en&rclk=1","18.1041995,78.8400954"
Kalla Kunta Masjid,Mosque,"4R8F+W7P Kalla Kunta Masjid, Kalakunta Colony, Siddipet, Telangana 502103",Kalakunta Colony,4R8F+W7P,Siddipet,502103,Telangana,IN,https://www.google.com/maps/place/Kalla+Kunta+Masjid/data=!4m7!3m6!1s0x3bccf2bb96551d33:0x214a93a673fe4d87!8m2!3d18.1173384!4d78.8232136!16s%2Fg%2F1hd_5ndc8!19sChIJMx1VlrvyzDsRh03-c6aTSiE?authuser=0&hl=en&rclk=1,"18.117338399999998,78.8232136"
Rabiya Basri Masjid,Mosque,"4V22+R5M Rabiya Basri Masjid, Azam Pura, Siddipet, Telangana 502103",Azam Pura,4V22+R5M,Siddipet,502103,Telangana,IN,https://www.google.com/maps/place/Rabiya+Basri+Masjid/data=!4m7!3m6!1s0x3bcc92b2b05f8bab:0x2d6ac2737d296629!8m2!3d18.1020768!4d78.8504276!16s%2Fg%2F1hhjj80xn!19sChIJq4tfsLKSzDsRKWYpfXPCai0?authuser=0&hl=en&rclk=1,"18.1020768,78.8504276"
Masjid-E-Shekhaan,Mosque,"4V25+PF6 Masjid-E-Shekhaan, Srinivas Nagar, Siddipet, Telangana 502103",Srinivas Nagar,4V25+PF6,Siddipet,502103,Telangana,IN,https://www.google.com/maps/place/Masjid-E-Shekhaan/data=!4m7!3m6!1s0x3bcc92b522be2a8f:0xda4d0cdbd0fef162!8m2!3d18.1017801!4d78.8586517!16s%2Fg%2F11c7_m8dqt!19sChIJjyq-IrWSzDsRYvH-0NsMTdo?authuser=0&hl=en&rclk=1,"18.1017801,78.8586517"
Masjid-E-Umar,Mosque,"4V24+F25 Masjid-E-Umar, Srinivas Nagar, Siddipet, Telangana 502103",Srinivas Nagar,4V24+F25,Siddipet,502103,Telangana,IN,https://www.google.com/maps/place/Masjid-E-Umar/data=!4m7!3m6!1s0x3bcc92b3618791f9:0xb11a7cd3bda823ed!8m2!3d18.1011306!4d78.8551111!16s%2Fg%2F11c7tw1w4b!19sChIJ-ZGHYbOSzDsR7SOovdN8GrE?authuser=0&hl=en&rclk=1,"18.101130599999998,78.8551111"
Masjid-E-Firdaouse,Mosque,"4V23+P4F Masjid-E-Firdaouse, Srinivas Nagar, Siddipet, Telangana 502103",Srinivas Nagar,4V23+P4F,Siddipet,502103,Telangana,IN,https://www.google.com/maps/place/Masjid-E-Firdaouse/data=!4m7!3m6!1s0x3bcc92b32421dcab:0x2471e813c3527eab!8m2!3d18.1018171!4d78.852789!16s%2Fg%2F11dypnsf26!19sChIJq9whJLOSzDsRq35SwxPocSQ?authuser=0&hl=en&rclk=1,"18.101817099999998,78.852789"
Masjid E Mahboob unisa ( JIH ) and Sio Office Siddipet Unit,Mosque,"Masjid E Mahboob unisa ( JIH ) and Sio Office Siddipet Unit, charwadan siddipet, 33, Sharwadan Rd, Azam Pura, Siddipet, Telangana 502103",Azam Pura,"charwadan siddipet, 33, Sharwadan Rd",Siddipet,502103,Telangana,IN,https://www.google.com/maps/place/Masjid+E+Mahboob+unisa+%28+JIH+%29+and+Sio+Office+Siddipet+Unit/data=!4m7!3m6!1s0x3bcced520d2005e3:0xf0ecb8657913ed3d!8m2!3d18.1082846!4d78.8487254!16s%2Fg%2F11c6cyy8m_!19sChIJ4wUgDVLtzDsRPe0TeWW47PA?authuser=0&hl=en&rclk=1,"18.108284599999998,78.84872539999999"
Masjid - E - Raheemmiya,Mosque,"4V24+H8J Masjid - E - Raheemmiya, Sajidpura shareef galli, Srinivas Nagar, Siddipet, Telangana 502103",Srinivas Nagar,"4V24+H8J, Sajidpura shareef galli",Siddipet,502103,Telangana,IN,https://www.google.com/maps/place/Masjid+-+E+-+Raheemmiya/data=!4m7!3m6!1s0x3bcc92b4988549a1:0xb1902ca30fdc2c8b!8m2!3d18.1014715!4d78.8557642!16s%2Fg%2F11gbl42b4t!19sChIJoUmFmLSSzDsRiyzcD6MskLE?authuser=0&hl=en&rclk=1,"18.1014715,78.8557642"
Masjid-E-Noor,Mosque,"4R4G+PJF Masjid-E-Noor, Indira Nagar, Siddipet, Telangana 502114",Indira Nagar,4R4G+PJF,Siddipet,502114,Telangana,IN,https://www.google.com/maps/place/Masjid-E-Noor/data=!4m7!3m6!1s0x3bccf2b203e52533:0x9c428784c830a07c!8m2!3d18.1068177!4d78.8265486!16s%2Fg%2F11c17cmnn7!19sChIJMyXlA7LyzDsRfKAwyISHQpw?authuser=0&hl=en&rclk=1,"18.1068177,78.8265486"
Masjid-E-Zohra,Mosque,"4R6H+2J4 Masjid-E-Zohra, Prashanth Nagar, Siddipet, Telangana 502103",Prashanth Nagar,4R6H+2J4,Siddipet,502103,Telangana,IN,https://www.google.com/maps/place/Masjid-E-Zohra/data=!4m7!3m6!1s0x3bccf2ae4d782e19:0xe4f347bef8e1b70e!8m2!3d18.1100248!4d78.8290926!16s%2Fg%2F11c283vvyd!19sChIJGS54Ta7yzDsRDrfh-L5H8-Q?authuser=0&hl=en&rclk=1,"18.110024799999998,78.8290926"
Masjid_E-Bilaal,Mosque,"4R4V+MM6 Masjid_E-Bilaal, Azam Pura, Siddipet, Telangana 502103",Azam Pura,4R4V+MM6,Siddipet,502103,Telangana,IN,https://www.google.com/maps/place/Masjid_E-Bilaal/data=!4m7!3m6!1s0x3bcced538b304dcb:0x24ef0d110ee7b060!8m2!3d18.1066641!4d78.8441556!16s%2Fg%2F11fxcdb2p_!19sChIJy00wi1PtzDsRYLDnDhEN7yQ?authuser=0&hl=en&rclk=1,"18.1066641,78.8441556"
Masjid e RASHEED,Mosque,"3VV6+96G Masjid e RASHEED, Kushal Nagar, Siddipet, Telangana 502103",Kushal Nagar,3VV6+96G,Siddipet,502103,Telangana,IN,https://www.google.com/maps/place/Masjid+e+RASHEED/data=!4m7!3m6!1s0x3bcc930778163877:0x75e64e0f019d19fd!8m2!3d18.0934267!4d78.860578!16s%2Fg%2F11h0zgf_nm!19sChIJdzgWeAeTzDsR_RmdAQ9O5nU?authuser=0&hl=en&rclk=1,"18.0934267,78.86057799999999"
Masjid E Ghaffaria,Mosque,"Masjid E Ghaffaria, 502103, Islampura, Mohinpura, Siddipet, Telangana 502103","Islampura, Mohinpura",502103,Siddipet,502103,Telangana,IN,https://www.google.com/maps/place/Masjid+E+Ghaffaria/data=!4m7!3m6!1s0x3bcc92aa0b2f1177:0x95ee00d1a53e2421!8m2!3d18.0975636!4d78.838471!16s%2Fg%2F11c5zlx5f9!19sChIJdxEvC6qSzDsRISQ-pdEA7pU?authuser=0&hl=en&rclk=1,"18.0975636,78.838471"
Masjid E Ilahi,Mosque,"4R3Q+M8F Masjid E Ilahi, Murshid gadda, Kadharpura, Mohinpura, Siddipet, Telangana 502103","Kadharpura, Mohinpura",4R3Q+M8F Murshid gadda,Siddipet,502103,Telangana,IN,https://www.google.com/maps/place/Masjid+E+Ilahi/data=!4m7!3m6!1s0x3bcced556290abc9:0x209b3993cab0c0d2!8m2!3d18.1039889!4d78.8383858!16s%2Fg%2F11c5zykgrs!19sChIJyauQYlXtzDsR0sCwypM5myA?authuser=0&hl=en&rclk=1,"18.1039889,78.8383858"
Masjid & Madarsa Raof Qamar Ahlehadees,Mosque,"4R8H+WH8 Masjid & Madarsa Raof Qamar Ahlehadees, Raghavendran Nagar Colony, Siddipet, Telangana 502103",Raghavendran Nagar Colony,4R8H+WH8,Siddipet,502103,Telangana,IN,https://www.google.com/maps/place/Masjid+%26+Madarsa+Raof+Qamar+Ahlehadees/data=!4m7!3m6!1s0x3bccf3f6f4b0dd05:0xdb6b3014f4d40d5b!8m2!3d18.1172824!4d78.828939!16s%2Fg%2F11fs5zlr_v!19sChIJBd2w9PbzzDsRWw3U9BQwa9s?authuser=0&hl=en&rclk=1,"18.1172824,78.82893899999999"
Masjid E Ibrahim,Mosque,"4VC4+GWH Masjid E Ibrahim, Indiramma Colony, Siddipet, Narsapur, Telangana 502276",Indiramma Colony,4VC4+GWH,"Siddipet, Narsapur",502276,Telangana,IN,https://www.google.com/maps/place/Masjid+E+Ibrahim/data=!4m7!3m6!1s0x3bcced413aaaaaab:0xcbf9fb3155e94a80!8m2!3d18.1213232!4d78.8573722!16s%2Fg%2F11g8w900fd!19sChIJq6qqOkHtzDsRgErpVTH7-cs?authuser=0&hl=en&rclk=1,"18.1213232,78.8573722"
Musallam Masjid,Mosque,"4R2V+PG6 Musallam Masjid, Bharath Nagar, Mohinpura, Siddipet, Telangana 502103","Bharath Nagar, Mohinpura",4R2V+PG6,Siddipet,502103,Telangana,IN,https://www.google.com/maps/place/Musallam+Masjid/data=!4m7!3m6!1s0x3bcc92ab56f62e8d:0x599e90f3b84a088e!8m2!3d18.1017903!4d78.8437512!16s%2Fg%2F11bxc5ncs4!19sChIJjS72VquSzDsRjghKuPOQnlk?authuser=0&hl=en&rclk=1,"18.101790299999998,78.8437512"
Masjid E Hafeez Tahera,Mosque,"3RXR+7XG Masjid E Hafeez Tahera, Siddipet, Telangana 502103",,3RXR+7XG,Siddipet,,Telangana,IN,https://www.google.com/maps/place/Masjid+E+Hafeez+Tahera/data=!4m7!3m6!1s0x3bcc92abbe082aa7:0x640a0be0bf057aa3!8m2!3d18.0981993!4d78.8424561!16s%2Fg%2F11f3xg41k1!19sChIJpyoIvquSzDsRo3oFv-ALCmQ?authuser=0&hl=en&rclk=1,"18.098199299999997,78.84245609999999"
MASJID_E_MEHRAJ,Mosque,"4R8F+W7G MASJID_E_MEHRAJ, Kalakunta Colony, Siddipet, Telangana 502103",Kalakunta Colony,4R8F+W7G,Siddipet,502103,Telangana,IN,https://www.google.com/maps/place/MASJID_E_MEHRAJ/data=!4m7!3m6!1s0x3bccf34e56146a17:0xf51572212c7d9a1c!8m2!3d18.1173241!4d78.8232119!16s%2Fg%2F11nn1b7xn4!19sChIJF2oUVk7zzDsRHJp9LCFyFfU?authuser=0&hl=en&rclk=1,"18.117324099999998,78.82321189999999"
Masjid-e-Yaseen,Mosque,"Masjid-e-Yaseen, 3, Yellareddy Nagar, Ganesh Nagar, Siddipet, Telangana 502103","Yellareddy Nagar, Ganesh Nagar",3,Siddipet,502103,Telangana,IN,https://www.google.com/maps/place/Masjid-e-Yaseen/data=!4m7!3m6!1s0x3bccf35f9043c8e5:0x3b1cc0b929351972!8m2!3d18.113714!4d78.8343072!16s%2Fg%2F11twq17nvm!19sChIJ5chDkF_zzDsRchk1KbnAHDs?authuser=0&hl=en&rclk=1,"18.113713999999998,78.8343072"
Masjid e Mohammadeeya,Mosque,"Masjid e Mohammadeeya, Masjid -e-Mohammadia, NGOs colony, Siddipet, Telangana 502103",NGOs colony,Masjid -e-Mohammadia,Siddipet,502103,Telangana,IN,https://www.google.com/maps/place/Masjid+e+Mohammadeeya/data=!4m7!3m6!1s0x3bccf3a432988c11:0xe89c73983b645a68!8m2!3d18.1025122!4d78.829829!16s%2Fg%2F11qqp3z6cx!19sChIJEYyYMqTzzDsRaFpkO5hznOg?authuser=0&hl=en&rclk=1,"18.1025122,78.82982899999999"
masjid e mahboob unnisa,Mosque,"masjid e mahboob unnisa, charwadan Opposite:, Government Girls High school and Jr College, near Vidyanikethan High School, Azam Pura, Siddipet, Telangana 502103",Azam Pura,"charwadan Opposite:, Government Girls High school and Jr College, near Vidyanikethan High School",Siddipet,502103,Telangana,IN,https://www.google.com/maps/place/masjid+e+mahboob+unnisa/data=!4m7!3m6!1s0x3bcceda03f27bc1b:0xaaef2113b810d0b!8m2!3d18.1072369!4d78.8471118!16s%2Fg%2F11frqnt23j!19sChIJG7wnP6DtzDsRCw2BOxHyrgo?authuser=0&hl=en&rclk=1,"18.1072369,78.8471118"
Jama masjid,Mosque,"Jama masjid, 4-2-52, near Lal Kaman, beside Jama Masjid, Patel Pura, Parupalliveedhi, Siddipet, Telangana 502103","Patel Pura, Parupalliveedhi","4-2-52, near Lal Kaman, beside Jama Masjid",Siddipet,502103,Telangana,IN,https://www.google.com/maps/place/Jama+masjid/data=!4m7!3m6!1s0x3bcced92e5df84bf:0x604663a5efd505e5!8m2!3d18.1057643!4d78.8525487!16s%2Fg%2F11shpdwzkg!19sChIJv4Tf5ZLtzDsR5QXV76VjRmA?authuser=0&hl=en&rclk=1,"18.1057643,78.8525487"
