name,main_category,address,address_ward,address_street,address_city,address_postal_code,address_state,address_country_code,link,coordinates
Makhtab islamiya jama masjid pipraich gorakhpur,Mosque,"RGGF+JRP Makhtab islamiya jama masjid pipraich gorakhpur, Taj Pipra, Uttar Pradesh 273152",,RGGF+JRP,Taj Pipra,273152,Uttar Pradesh,IN,https://www.google.com/maps/place/Makhtab+islamiya+jama+masjid+pipraich+gorakhpur/data=!4m7!3m6!1s0x399159e63ec993ff:0x1f2ad92f1120daed!8m2!3d26.8265855!4d83.5245909!16s%2Fg%2F11g8746gyh!19sChIJ_5PJPuZZkTkR7dogES_ZKh8?authuser=0&hl=en&rclk=1,"26.8265855,83.52459089999999"
Nuri Masjid,Mosque,"Nuri Masjid, Ward no. 10, Kali Mandir Nagar, Sidhawal, Pipraich, Uttar Pradesh 273152",,"Ward no. 10, Kali Mandir Nagar, Sidhawal","Pipraich, Sonraiech Urf Bragaon",273152,Uttar Pradesh,IN,https://www.google.com/maps/place/Nuri+Masjid/data=!4m7!3m6!1s0x39915762d070fa85:0xa4255e1b4b708665!8m2!3d26.8402028!4d83.5382762!16s%2Fg%2F11fy_qljy7!19sChIJhfpw0GJXkTkRZYZwSxteJaQ?authuser=0&hl=en&rclk=1,"26.8402028,83.5382762"
Masjid Miya Mill,Mosque,"Masjid Miya Mill, 136 nagar panchayat, Miya Mil Rd, Pipraich, Uttar Pradesh 273152",,"136 nagar panchayat, Miya Mil Rd",Pipraich,273152,Uttar Pradesh,IN,https://www.google.com/maps/place/Masjid+Miya+Mill/data=!4m7!3m6!1s0x39915909d16adf37:0xba730ae3ffb9b060!8m2!3d26.8256288!4d83.5374569!16s%2Fg%2F11rstgj5g0!19sChIJN99q0QlZkTkRYLC5_-MKc7o?authuser=0&hl=en&rclk=1,"26.8256288,83.5374569"
Al farooq masjid,Mosque,"RGFG+V69 Al farooq masjid, Patara, Pipraich, Taj Pipra, Uttar Pradesh 273152",Patara,RGFG+V69,"Pipraich, Taj Pipra",273152,Uttar Pradesh,IN,https://www.google.com/maps/place/Al+farooq+masjid/data=!4m7!3m6!1s0x39915930fe7f8a67:0x7c6382a8f4e31b4c!8m2!3d26.8243302!4d83.5252799!16s%2Fg%2F11qbhwwkrt!19sChIJZ4p__jBZkTkRTBvj9KiCY3w?authuser=0&hl=en&rclk=1,"26.8243302,83.5252799"
jama masjid,Mosque,"RGHH+PPQ jama masjid, mereri gadgwan, Pipraich, Uttar Pradesh 273152",mereri gadgwan,RGHH+PPQ,Pipraich,,Uttar Pradesh,IN,https://www.google.com/maps/place/jama+masjid/data=!4m7!3m6!1s0x399159dd99f742d1:0x1b7b193a82e8aa2f!8m2!3d26.8293499!4d83.5293575!16s%2Fg%2F11hc_7w92j!19sChIJ0UL3md1ZkTkRL6rogjoZexs?authuser=0&hl=en&rclk=1,"26.8293499,83.5293575"
