name,main_category,address,address_ward,address_street,address_city,address_postal_code,address_state,address_country_code,link,coordinates
Masjid Faizane Ghausia and Madarsa,Mosque,"Masjid Faizane Ghausia and Madarsa, D-100, Maulana Azad Rd, Shaheen Bagh, Jamia Nagar, Okhla, New Delhi, Delhi 110025","Shaheen Bagh, Jamia Nagar, Okhla","D-100, Maulana Azad Rd",New Delhi,110025,Delhi,IN,https://www.google.com/maps/place/Masjid+Faizane+Ghausia+and+Madarsa/data=!4m7!3m6!1s0x390ce41ba6415db1:0xa9911783ddc9514d!8m2!3d28.5472543!4d77.3012896!16s%2Fg%2F11b6pk_b3y!19sChIJsV1BphvkDDkRTVHJ3YMXkak?authuser=0&hl=en&rclk=1,"28.5472543,77.30128959999999"
Jama Masjid,Mosque,"Jama Masjid, Masjid, Deoria Vaikunthpur Road, Deoria Meer, Zamania, Uttar Pradesh 274001",,"Masjid, Deoria Vaikunthpur Road","Deoria Meer, Zamania",274001,Uttar Pradesh,IN,https://www.google.com/maps/place/Jama+Masjid/data=!4m7!3m6!1s0x398e072cb73c7eaf:0xbbf93399a3d7b20d!8m2!3d25.4264016!4d83.5560466!16s%2Fg%2F11c1p65kjt!19sChIJr348tywHjjkRDbLXo5kz-bs?authuser=0&hl=en&rclk=1,"25.4264016,83.5560466"
Hussaini Masjid,Mosque,"CHJ6+V36 Hussaini Masjid, Zamania, Uttar Pradesh 232329",,CHJ6+V36,Zamania,,Uttar Pradesh,IN,https://www.google.com/maps/place/Hussaini+Masjid/data=!4m7!3m6!1s0x398e0194cfbf1fbf:0x593fc8fe2376dc80!8m2!3d25.4321742!4d83.5601533!16s%2Fg%2F11ghx50qdw!19sChIJvx-_z5QBjjkRgNx2I_7IP1k?authuser=0&hl=en&rclk=1,"25.4321742,83.5601533"
Shahi Jama Masjid Zamania Kasba,Mosque,"CH93+MJ9 Shahi Jama Masjid Zamania Kasba, Zamania, Dharammarpur Uparwar, Uttar Pradesh 232329",,CH93+MJ9,"Zamania, Dharammarpur Uparwar",232329,Uttar Pradesh,IN,https://www.google.com/maps/place/Shahi+Jama+Masjid+Zamania+Kasba/data=!4m7!3m6!1s0x398e07da75086c7f:0x16ba48dff4f6bca!8m2!3d25.4191529!4d83.5541107!16s%2Fg%2F11mbprtgtx!19sChIJf2wIddoHjjkRymtP_42kawE?authuser=0&hl=en&rclk=1,"25.4191529,83.5541107"
Madina Masjid,Mosque,"Madina Masjid, D-48, Block D, Ghazipur Dairy Farm, Ghazipur, New Delhi, Delhi, 110091","Block D, Ghazipur Dairy Farm, Ghazipur",D-48,"New Delhi, Delhi",110091,Delhi,IN,https://www.google.com/maps/place/Madina+Masjid/data=!4m7!3m6!1s0x390ce548fc888fc1:0x578c85ac4eac7ff4!8m2!3d28.6275238!4d77.3254562!16s%2Fg%2F11s5jw5pb4!19sChIJwY-I_EjlDDkR9H-sTqyFjFc?authuser=0&hl=en&rclk=1,"28.6275238,77.32545619999999"
Ayat Kirana Store,Mosque,"Ayat Kirana Store, Budhdhipur Durahia Road, near Bangle wali masjid, Zamania, Uttar Pradesh 232329",,"Budhdhipur Durahia Road, near Bangle wali masjid",Zamania,232329,Uttar Pradesh,IN,https://www.google.com/maps/place/Ayat+Kirana+Store/data=!4m7!3m6!1s0x398e07f1a474d607:0xa200c53145a0787d!8m2!3d25.4245486!4d83.5576421!16s%2Fg%2F11nyqkfjg1!19sChIJB9Z0pPEHjjkRfXigRTHFAKI?authuser=0&hl=en&rclk=1,"25.424548599999998,83.5576421"
Jaama Masjid,Mosque,"9GFV+R7H Jaama Masjid, Ilaychipur Rd, Zamania Station, Uttar Pradesh 232331",,"9GFV+R7H, Ilaychipur Rd",Zamania Station,232331,Uttar Pradesh,IN,https://www.google.com/maps/place/Jaama+Masjid/data=!4m7!3m6!1s0x398e07fdc56afa63:0x97179a8dde8081d0!8m2!3d25.3745596!4d83.5432326!16s%2Fg%2F11srjk25pw!19sChIJY_pqxf0HjjkR0IGA3o2aF5c?authuser=0&hl=en&rclk=1,"25.374559599999998,83.5432326"
Masjid Sardar Khan Sadar Bazar,Mosque,"CHC4+J8P Masjid Sardar Khan Sadar Bazar, Zamania, Uttar Pradesh 232329",,CHC4+J8P,Zamania,,Uttar Pradesh,IN,https://www.google.com/maps/place/Masjid+Sardar+Khan+Sadar+Bazar/data=!4m7!3m6!1s0x398e07ad53205fcf:0x1e10cc230685bc08!8m2!3d25.4215798!4d83.5558428!16s%2Fg%2F11h2k2g68v!19sChIJz18gU60HjjkRCLyFBiPMEB4?authuser=0&hl=en&rclk=1,"25.4215798,83.5558428"
Masjid Sardar Khan,Mosque,"CH94+W39 Masjid Sardar Khan, Zamania, Uttar Pradesh 232329",,CH94+W39,Zamania,,Uttar Pradesh,IN,https://www.google.com/maps/place/Masjid+Sardar+Khan/data=!4m7!3m6!1s0x398e07b95952694b:0xa6e026cad47ba5ee!8m2!3d25.419778!4d83.5552321!16s%2Fg%2F11gywcjmnk!19sChIJS2lSWbkHjjkR7qV71Mom4KY?authuser=0&hl=en&rclk=1,"25.419777999999997,83.5552321"
Masjid e Ahle Sunnat,Mosque,"9GFV+R8Q Masjid e Ahle Sunnat, Zamania Station, Uttar Pradesh 232331",,9GFV+R8Q,Zamania Station,,Uttar Pradesh,IN,https://www.google.com/maps/place/Masjid+e+Ahle+Sunnat/data=!4m7!3m6!1s0x398e07a8b24e829f:0xbe64d91c30952fc2!8m2!3d25.3745822!4d83.5433575!16s%2Fg%2F11srkz2c2k!19sChIJn4JOsqgHjjkRwi-VMBzZZL4?authuser=0&hl=en&rclk=1,"25.3745822,83.5433575"
Masjid-e-Bilal..Naibazar,Mosque,"8GPP+54J Masjid-e-Bilal..Naibazar, Khargasipur, Zamania, Khargasi Pur, Uttar Pradesh 232331",,"8GPP+54J, Khargasipur","Zamania, Khargasi Pur",232331,Uttar Pradesh,IN,https://www.google.com/maps/place/Masjid-e-Bilal..Naibazar/data=!4m7!3m6!1s0x398e074cf02767fd:0x1e29745d2ecc7a65!8m2!3d25.3363467!4d83.5349067!16s%2Fg%2F11sxwwx0fw!19sChIJ_Wcn8EwHjjkRZXrMLl10KR4?authuser=0&hl=en&rclk=1,"25.3363467,83.5349067"
Chhotu Khan Masjid,Museum,"Chhotu Khan Masjid, pathan toli, Road, Zamania, Uttar Pradesh 232329",,"pathan toli, Road",Zamania,232329,Uttar Pradesh,IN,https://www.google.com/maps/place/Chhotu+Khan+Masjid/data=!4m7!3m6!1s0x398e074f4c585f67:0xedaccd8f8459ec80!8m2!3d25.4242382!4d83.5567238!16s%2Fg%2F11gvy0yg44!19sChIJZ19YTE8HjjkRgOxZhI_NrO0?authuser=0&hl=en&rclk=1,"25.424238199999998,83.5567238"
Masjid Qaziji zamania,Mosque,"CHF4+M2Q Masjid Qaziji zamania, Zamania Market Rd, Zamania, Uttar Pradesh 232329",,"CHF4+M2Q, Zamania Market Rd",Zamania,232329,Uttar Pradesh,IN,https://www.google.com/maps/place/Masjid+Qaziji+zamania/data=!4m7!3m6!1s0x398e074fae0c696b:0x8dd7d5d7ac772ed3!8m2!3d25.4242096!4d83.5551246!16s%2Fg%2F11r7s1b5jm!19sChIJa2kMrk8HjjkR0y53rNfV140?authuser=0&hl=en&rclk=1,"25.424209599999998,83.5551246"
Noori masjid Ahlesunnat wal jama-at,Mosque,"Noori masjid Ahlesunnat wal jama-at, Lodipur, zamania kasba ward no-12, Zamania, Uttar Pradesh 232329",,"Lodipur, zamania kasba ward no-12","Zamania, Dharammarpur Uparwar",232329,Uttar Pradesh,IN,https://www.google.com/maps/place/Noori+masjid+Ahlesunnat+wal+jama-at/data=!4m7!3m6!1s0x398e07d8d716b49d:0x73f485e17415ffa0!8m2!3d25.4160788!4d83.5542392!16s%2Fg%2F11rd2sgz2d!19sChIJnbQW19gHjjkRoP8VdOGF9HM?authuser=0&hl=en&rclk=1,"25.416078799999998,83.5542392"
Jamah Masjid Badi,Mosque,"G8J7+7F5 Jamah Masjid Badi, JJ Colony, Madanpur Khadar, New Delhi, Delhi 110076","JJ Colony, Madanpur Khadar",G8J7+7F5,New Delhi,110076,Delhi,IN,https://www.google.com/maps/place/Jamah+Masjid+Badi/data=!4m7!3m6!1s0x390ce7b78eb036b1:0x8f6236080c1ca163!8m2!3d28.5306406!4d77.3137464!16s%2Fg%2F11kk081p_j!19sChIJsTawjrfnDDkRY6EcDAg2Yo8?authuser=0&hl=en&rclk=1,"28.530640599999998,77.3137464"
Masjid Banda Ali Khan,Mosque,"CHF5+M32 Masjid Banda Ali Khan, U. P, Mohalla- Pathantoli, Qasba- Zamania, Distt, Zamania, Uttar Pradesh",,"CHF5+M32, U. P, Mohalla- Pathantoli, Qasba- Zamania, Distt",Zamania,,Uttar Pradesh,IN,https://www.google.com/maps/place/Masjid+Banda+Ali+Khan/data=!4m7!3m6!1s0x398e072daaaaaaab:0x6ad2db03fcaddda4!8m2!3d25.4241289!4d83.5576441!16s%2Fg%2F11gfjsbkw9!19sChIJq6qqqi0HjjkRpN2t_APb0mo?authuser=0&hl=en&rclk=1,"25.4241289,83.55764409999999"
Jama masjid,Mosque,"Jama masjid, Dhanauta, Dhanautha, Zamania, Bahadurpur Ta. Chau. Ajma, Uttar Pradesh 232329",Dhanautha,Dhanauta,"Zamania, Bahadurpur Ta. Chau. Ajma",,Uttar Pradesh,IN,https://www.google.com/maps/place/Jama+masjid/data=!4m7!3m6!1s0x398dfd2cc3a9e6cb:0xc552d1768567cd91!8m2!3d25.421597!4d83.5992602!16s%2Fg%2F11t6lkgnd9!19sChIJy-apwyz9jTkRkc1nhXbRUsU?authuser=0&hl=en&rclk=1,"25.421597,83.59926019999999"
OFFICE Shahi Jama masjid,Association or organization,"CH93+MJ9 OFFICE Shahi Jama masjid, Zamania, Dharammarpur Uparwar, Uttar Pradesh 232329",,CH93+MJ9,"Zamania, Dharammarpur Uparwar",232329,Uttar Pradesh,IN,https://www.google.com/maps/place/OFFICE+Shahi+Jama+masjid/data=!4m7!3m6!1s0x398e07e9e5857a5d:0x4901e1be8c48fd5d!8m2!3d25.4190627!4d83.5542554!16s%2Fg%2F11ryt2msnt!19sChIJXXqF5ekHjjkRXf1IjL7hAUk?authuser=0&hl=en&rclk=1,"25.419062699999998,83.5542554"
