name,main_category,address,address_ward,address_street,address_city,address_postal_code,address_state,address_country_code,link,coordinates
Masjid E Kuba,Mosque,"FFXM+Q87 Masjid E Kuba, Vaikunth Society, Halol, Gujarat 389350",Vaikunth Society,FFXM+Q87,Halol,389350,Gujarat,IN,https://www.google.com/maps/place/Masjid+E+Kuba/data=!4m7!3m6!1s0x39607febf8e13f9f:0xfacc9a1e5e224c2c!8m2!3d22.4994143!4d73.4832891!16s%2Fg%2F11f1jwtn25!19sChIJnz_h-Ot_YDkRLEwiXh6azPo?authuser=0&hl=en&rclk=1,"22.499414299999998,73.4832891"
Noorani Masjid,Mosque,"Noorani Masjid, mohammedi street, Varia Colony, Halol, Gujarat 389360",Varia Colony,mohammedi street,Halol,389360,Gujarat,IN,https://www.google.com/maps/place/Noorani+Masjid/data=!4m7!3m6!1s0x39607fef77264873:0xff19e9a72f3642d7!8m2!3d22.5029443!4d73.4802673!16s%2Fg%2F1hm5gqwqm!19sChIJc0gmd-9_YDkR10I2L6fpGf8?authuser=0&hl=en&rclk=1,"22.5029443,73.4802673"
Sunni Jama Masjid,Mosque,"GF2G+M94 Sunni Jama Masjid, Adarsh Society, Halol, Gujarat 389350",Adarsh Society,GF2G+M94,Halol,389350,Gujarat,IN,https://www.google.com/maps/place/Sunni+Jama+Masjid/data=!4m7!3m6!1s0x39607ff03db7ca7f:0xabb593154d068774!8m2!3d22.5016442!4d73.4759389!16s%2Fg%2F1hm3g22hz!19sChIJf8q3PfB_YDkRdIcGTRWTtas?authuser=0&hl=en&rclk=1,"22.501644199999998,73.4759389"
Mohammadi Masjid,Mosque,"FFXF+WQJ Mohammadi Masjid, Limdi Mohalla, Halol, Gujarat 389350",Vaikunth Society,"FFXF+WQJ, Limdi Mohalla",Halol,389350,Gujarat,IN,https://www.google.com/maps/place/Mohammadi+Masjid/data=!4m7!3m6!1s0x39607ff1ac06d27f:0x120af7691b5e8b6b!8m2!3d22.4998436!4d73.4743825!16s%2Fg%2F11b8069scs!19sChIJf9IGrPF_YDkRa4teG2n3ChI?authuser=0&hl=en&rclk=1,"22.4998436,73.47438249999999"
Badshahi Masjid_Sunni (Maslak e Aala Hazrat),Mosque,"GF2J+36F Badshahi Masjid_Sunni (Maslak e Aala Hazrat), Vaikunth Society, Halol, Gujarat 389350",Vaikunth Society,GF2J+36F,Halol,389350,Gujarat,IN,https://www.google.com/maps/place/Badshahi+Masjid_Sunni+%28Maslak+e+Aala+Hazrat%29/data=!4m7!3m6!1s0x39607feefaec5797:0xfb4ac8f0d62d17d4!8m2!3d22.500197!4d73.4805332!16s%2Fg%2F11dztjyrgr!19sChIJl1fs-u5_YDkR1Bct1vDISvs?authuser=0&hl=en&rclk=1,"22.500197,73.4805332"
Babakhan Ki Dargah,Mosque,"FFXF+8H7 Babakhan Ki Dargah, Vaikunth Society, Halol, Gujarat 389350",Vaikunth Society,FFXF+8H7,Halol,389350,Gujarat,IN,https://www.google.com/maps/place/Babakhan+Ki+Dargah/data=!4m7!3m6!1s0x39607ff17612b305:0x2d38a7c23cb2ec9c!8m2!3d22.4982763!4d73.4739085!16s%2Fg%2F11g8nh5hh7!19sChIJBbMSdvF_YDkRnOyyPMKnOC0?authuser=0&hl=en&rclk=1,"22.4982763,73.4739085"
101Falahibadatgah v madrasah ahle sunnat vl jamaat,Mosque,"101Falahibadatgah v madrasah ahle sunnat vl jamaat, 101, Karim Colony, Vaikunth Society, Halol, Gujarat 389350","Karim Colony, Vaikunth Society",101,Halol,389350,Gujarat,IN,https://www.google.com/maps/place/101Falahibadatgah+v+madrasah+ahle+sunnat+vl+jamaat/data=!4m7!3m6!1s0x39607f144087df01:0xaa6fed7f8118e47c!8m2!3d22.4963243!4d73.4789947!16s%2Fg%2F11f7851k_v!19sChIJAd-HQBR_YDkRfOQYgX_tb6o?authuser=0&hl=en&rclk=1,"22.496324299999998,73.4789947"
Masjid E Madni,Mosque,"GF2P+M2M Masjid E Madni, Pavagadh Bypass Rd, navrung colony, Halol, Gujarat 389360",navrung colony,"GF2P+M2M, Pavagadh Bypass Rd",Halol,389360,Gujarat,IN,https://www.google.com/maps/place/Masjid+E+Madni/data=!4m7!3m6!1s0x39607f6a510b9285:0x1e32b6e3ee075c75!8m2!3d22.5017122!4d73.4850433!16s%2Fg%2F11gnq9rkyd!19sChIJhZILUWp_YDkRdVwH7uO2Mh4?authuser=0&hl=en&rclk=1,"22.5017122,73.4850433"
Azimi Masjid Sunni -(Maslak-e-Aala-Hazrat),Mosque,"GF3J+796 Azimi Masjid Sunni -(Maslak-e-Aala-Hazrat), Mohammadi street, Halol-Pavagadh Rd, Halol, Gujarat",Varia Colony,"GF3J+796, Mohammadi street, Halol-Pavagadh Rd",Halol,,Gujarat,IN,https://www.google.com/maps/place/Azimi+Masjid+Sunni+-%28Maslak-e-Aala-Hazrat%29/data=!4m7!3m6!1s0x39607fb5cc3d4a85:0x2eaebfc28aeb4889!8m2!3d22.5031714!4d73.4808877!16s%2Fg%2F11fd7glk0t!19sChIJhUo9zLV_YDkRiUjrisK_ri4?authuser=0&hl=en&rclk=1,"22.5031714,73.4808877"
Ebadat Ghahe Chistiya,Mosque,"GF2J+929 Ebadat Ghahe Chistiya, Halol-Pavagadh Rd, Vaikunth Society, Halol, Gujarat 389350",Vaikunth Society,"GF2J+929, Halol-Pavagadh Rd",Halol,389350,Gujarat,IN,https://www.google.com/maps/place/Ebadat+Ghahe+Chistiya/data=!4m7!3m6!1s0x39607fef01b1a371:0x14ec186042349102!8m2!3d22.5009068!4d73.4801051!16s%2Fg%2F11c6y9b3jg!19sChIJcaOxAe9_YDkRApE0QmAY7BQ?authuser=0&hl=en&rclk=1,"22.5009068,73.4801051"
Maslak e Aala Hazrat (Kalandari masjid),Mosque,"GF4H+2R7 Maslak e Aala Hazrat (Kalandari masjid), Arad Rd, Ghodapir, Halol, Gujarat 389360",Ghodapir,"GF4H+2R7, Arad Rd",Halol,389360,Gujarat,IN,https://www.google.com/maps/place/%F0%9F%95%8CMaslak+e+Aala+Hazrat+%28Kalandari+masjid%29/data=!4m7!3m6!1s0x39607f173b15a6fb:0xeee3742322541c0!8m2!3d22.5050307!4d73.4795453!16s%2Fg%2F11j6gjcx9g!19sChIJ-6YVOxd_YDkRwEElMkI37g4?authuser=0&hl=en&rclk=1,"22.5050307,73.4795453"
Sahi jami Masjid,Mosque,"GF2G+J9P Sahi jami Masjid, Adarsh Society, Halol, Gujarat 389350",Adarsh Society,GF2G+J9P,Halol,389350,Gujarat,IN,https://www.google.com/maps/place/Sahi+jami+Masjid/data=!4m7!3m6!1s0x39607f248493a7a9:0x9e772df49f01f764!8m2!3d22.5015789!4d73.4759406!16s%2Fg%2F11fk8dk8qz!19sChIJqaeThCR_YDkRZPcBn_Qtd54?authuser=0&hl=en&rclk=1,"22.5015789,73.4759406"
Eidgah Halol,Mosque,"GF3F+XMJ Eidgah Halol, Halol-Pavagadh Rd, Vitthalpura, Varia Colony, Halol, Gujarat 389360","Vitthalpura, Varia Colony","GF3F+XMJ, Halol-Pavagadh Rd",Halol,389360,Gujarat,IN,https://www.google.com/maps/place/Eidgah+Halol/data=!4m7!3m6!1s0x39607f281e17c365:0xedb0fa5b32e862c9!8m2!3d22.5049601!4d73.4741314!16s%2Fg%2F11srw2b3__!19sChIJZcMXHih_YDkRyWLoMlv6sO0?authuser=0&hl=en&rclk=1,"22.504960099999998,73.47413139999999"
"IBADAT GAAH, HALOL",Mosque,"IBADAT GAAH, HALOL, BARODA, ROAD, near RAMRAHIM GARRAGE, Halol, Gujarat 389350",Vaikunth Society,"BARODA, ROAD, near RAMRAHIM GARRAGE",Halol,389350,Gujarat,IN,"https://www.google.com/maps/place/IBADAT+GAAH,+HALOL/data=!4m7!3m6!1s0x39607f8955506ff5:0x9de2c7fff0b49266!8m2!3d22.4965324!4d73.4721251!16s%2Fg%2F11j3s7__dy!19sChIJ9W9QVYl_YDkRZpK08P_H4p0?authuser=0&hl=en&rclk=1","22.4965324,73.4721251"
hazrat Saiyed Pir Rajusah Bava,Mosque,"FFWF+6X8 hazrat Saiyed Pir Rajusah Bava, Unnamed Road, Vaikunth Society, Halol, Gujarat 389350",Vaikunth Society,"FFWF+6X8, Unnamed Road",Halol,389350,Gujarat,IN,https://www.google.com/maps/place/hazrat+Saiyed+Pir+Rajusah+Bava/data=!4m7!3m6!1s0x39607f31d2e49079:0x52a1d9bde8e3773b!8m2!3d22.4955271!4d73.4749394!16s%2Fg%2F11h1_037wh!19sChIJeZDk0jF_YDkRO3fj6L3ZoVI?authuser=0&hl=en&rclk=1,"22.4955271,73.4749394"
Haji Masjid Halol,Mosque,"Haji Masjid Halol, 101 Falahibadatgah v madarsah, Karim Colony, Vaikunth Society, Halol, Gujarat 389350","Karim Colony, Vaikunth Society",101 Falahibadatgah v madarsah,Halol,389350,Gujarat,IN,https://www.google.com/maps/place/Haji+Masjid+Halol/data=!4m7!3m6!1s0x39607f14d8e58491:0x8544d0fcaaf42278!8m2!3d22.4962427!4d73.4786358!16s%2Fg%2F11s45pnwk2!19sChIJkYTl2BR_YDkReCL0qvzQRIU?authuser=0&hl=en&rclk=1,"22.4962427,73.47863579999999"
Qalandari masjid sunni masjid,Mosque,"GF4H+3QJ Qalandari masjid sunni masjid, talav ni pase, Arad Rd, Varia Colony, Halol, Gujarat 389360",Varia Colony,"GF4H+3QJ, talav ni pase, Arad Rd",Halol,389360,Gujarat,IN,https://www.google.com/maps/place/Qalandari+masjid+sunni+masjid/data=!4m7!3m6!1s0x39607fce967c8b97:0x5a1a3f8dc7fc4477!8m2!3d22.505211!4d73.4793781!16s%2Fg%2F11t63cqycg!19sChIJl4t8ls5_YDkRd0T8x40_Glo?authuser=0&hl=en&rclk=1,"22.505211,73.47937809999999"
