name,main_category,address,address_ward,address_street,address_city,address_postal_code,address_state,address_country_code,link,coordinates
Qanati Masjid (Karbala Shahe Mardan),Mosque,"H6M8+XJF Qanati Masjid (Karbala Shahe Mardan), Karbala Rd, Civil Colony, Jor Bagh, New Delhi, Delhi 110003","Civil Colony, Jor Bagh","H6M8+XJF, Karbala Rd",New Delhi,110003,Delhi,IN,https://www.google.com/maps/place/Qanati+Masjid+%28Karbala+Shahe+Mardan%29/data=!4m7!3m6!1s0x390ce385a5fc02c5:0x944515df4c4604fe!8m2!3d28.5849126!4d77.2165992!16s%2Fg%2F11trq8x4n5!19sChIJxQL8pYXjDDkR_gRGTN8VRZQ?authuser=0&hl=en&rclk=1,"28.5849126,77.21659919999999"
KS TRUST MASJID GANDHI NAGAR,Mosque,"5Q95+J87 KS TRUST MASJID GANDHI NAGAR, Batlagundu, Pattiveeranpatti, Tamil Nadu 624202",,5Q95+J87,"Batlagundu, Pattiveeranpatti",624202,Tamil Nadu,IN,https://www.google.com/maps/place/KS+TRUST+MASJID+GANDHI+NAGAR/data=!4m7!3m6!1s0x3b074fc54e492521:0xc74c843fc50830d0!8m2!3d10.1690315!4d77.7583084!16s%2Fg%2F11h7jcs7vp!19sChIJISVJTsVPBzsR0DAIxT-ETMc?authuser=0&hl=en&rclk=1,"10.1690315,77.75830839999999"
Haji Asan Rowther masjid,Mosque,"Haji Asan Rowther masjid, 5QG6+G29 Pattiveeranpatti, Tamil Nadu Pattiveeranpatti, Batlagundu Bypass Rd, Batlagundu, Tamil Nadu 624202",,"5QG6+G29 Pattiveeranpatti, Tamil Nadu Pattiveeranpatti, Batlagundu Bypass Rd","Batlagundu, Pattiveeranpatti",624202,Tamil Nadu,IN,https://www.google.com/maps/place/Haji+Asan+Rowther+masjid/data=!4m7!3m6!1s0x3b074f05d92ae747:0x87558fe73d62eefe!8m2!3d10.1759226!4d77.7600754!16s%2Fg%2F11t4bsvfh9!19sChIJR-cq2QVPBzsR_u5iPeePVYc?authuser=0&hl=en&rclk=1,"10.1759226,77.76007539999999"
iitukaa pllllivaacl,Mosque,"5Q73+H7 iitukaa pllllivaacl, Batlagundu, Tamil Nadu 624202",,5Q73+H7,Batlagundu,,Tamil Nadu,IN,https://www.google.com/maps/place/%E0%AE%88%E0%AE%A4%E0%AF%81%E0%AE%95%E0%AE%BE+%E0%AE%AA%E0%AE%B3%E0%AF%8D%E0%AE%B3%E0%AE%BF%E0%AE%B5%E0%AE%BE%E0%AE%9A%E0%AE%B2%E0%AF%8D/data=!4m7!3m6!1s0x3b074f3de63c3709:0x58b02b1fb81d0905!8m2!3d10.1639784!4d77.7531769!16s%2Fg%2F11p678zscs!19sChIJCTc85j1PBzsRBQkduB8rsFg?authuser=0&hl=en&rclk=1,"10.1639784,77.7531769"
Masjid-E-Usman,Mosque,"Masjid-E-Usman, Masjid e Usman, Barkat Nagar, Parli Vaijnath, Maharashtra 431515",Barkat Nagar,Masjid e Usman,Parli Vaijnath,431515,Maharashtra,IN,https://www.google.com/maps/place/Masjid-E-Usman/data=!4m7!3m6!1s0x3bcff74265d8c699:0xd0d2a370951ed931!8m2!3d18.8563933!4d76.5380489!16s%2Fg%2F11h54x7_yy!19sChIJmcbYZUL3zzsRMdkelXCj0tA?authuser=0&hl=en&rclk=1,"18.8563933,76.53804889999999"
Habibiya Masjid,Mosque,"RGVG+3XC Habibiya Masjid, Siddheshwar Nagar, Habib Pura, Parli Vaijnath, Maharashtra 431515","Siddheshwar Nagar, Habib Pura",RGVG+3XC,Parli Vaijnath,431515,Maharashtra,IN,https://www.google.com/maps/place/Habibiya+Masjid/data=!4m7!3m6!1s0x3bcff73ca0ef3fd5:0x6ed0decae72f2a61!8m2!3d18.8426938!4d76.5273778!16s%2Fg%2F11hm_bbh06!19sChIJ1T_voDz3zzsRYSov58re0G4?authuser=0&hl=en&rclk=1,"18.8426938,76.5273778"
Irshad Masjid,Mosque,"VG3Q+XPP Irshad Masjid, Pandan Rd, Barkat Nagar, Parli Vaijnath, Maharashtra 431515",Barkat Nagar,"VG3Q+XPP, Pandan Rd",Parli Vaijnath,431515,Maharashtra,IN,https://www.google.com/maps/place/Irshad+Masjid/data=!4m7!3m6!1s0x3bcff7226e698b15:0xbe05b38551a63f87!8m2!3d18.8549611!4d76.5393384!16s%2Fg%2F11h3j7l6gy!19sChIJFYtpbiL3zzsRhz-mUYWzBb4?authuser=0&hl=en&rclk=1,"18.8549611,76.53933839999999"
Malik Pura Masjid,Mosque,"RGVC+4RC Malik Pura Masjid, Unnamed Road, Malik Pura, Parli Vaijnath, Maharashtra 431515",Malik Pura,"RGVC+4RC, Unnamed Road",Parli Vaijnath,431515,Maharashtra,IN,https://www.google.com/maps/place/Malik+Pura+Masjid/data=!4m7!3m6!1s0x3bcff7958ec1ed67:0xbf938dd097e230bd!8m2!3d18.8428132!4d76.5220119!16s%2Fg%2F11gj4l5l5p!19sChIJZ-3BjpX3zzsRvTDil9CNk78?authuser=0&hl=en&rclk=1,"18.8428132,76.5220119"
Kabarsthan Parli,Mosque,"RGVJ+6MX Kabarsthan Parli, Peth Mohallah, Parli Vaijnath, Maharashtra 431515",Peth Mohallah,RGVJ+6MX,Parli Vaijnath,431515,Maharashtra,IN,https://www.google.com/maps/place/Kabarsthan+Parli/data=!4m7!3m6!1s0x3bcff72e2c6ade3b:0x2a1b86e3127ca808!8m2!3d18.8431034!4d76.5317417!16s%2Fg%2F11gjjf5xy7!19sChIJO95qLC73zzsRCKh8EuOGGyo?authuser=0&hl=en&rclk=1,"18.8431034,76.5317417"
Madina masjid,Mosque,"VGC2+P75 Madina masjid, Tokwadi, Parli Vaijnath, Maharashtra 431530",Tokwadi,VGC2+P75,Parli Vaijnath,,Maharashtra,IN,https://www.google.com/maps/place/Madina+masjid/data=!4m7!3m6!1s0x3bcff7b4bb1ccc0d:0xb1482bd4aa22bd08!8m2!3d18.8717557!4d76.5007211!16s%2Fg%2F11ssd1g35m!19sChIJDcwcu7T3zzsRCL0iqtQrSLE?authuser=0&hl=en&rclk=1,"18.871755699999998,76.50072109999999"
SADAR BAZAR MASJID,Education center,"RGWQ+GQF SADAR BAZAR MASJID, Ganeshpar Rd, Ganeshpar, Barkat Nagar, Parli Vaijnath, Maharashtra 431515","Ganeshpar, Barkat Nagar","RGWQ+GQF, Ganeshpar Rd",Parli Vaijnath,431515,Maharashtra,IN,https://www.google.com/maps/place/SADAR+BAZAR+MASJID/data=!4m7!3m6!1s0x3bcff780060ae213:0x58acf0f1b4eed288!8m2!3d18.8463238!4d76.539414!16s%2Fg%2F11jyj8xs7z!19sChIJE-IKBoD3zzsRiNLutPHwrFg?authuser=0&hl=en&rclk=1,"18.8463238,76.539414"
Meraj Masjid,Mosque,"VGC2+Q6W Meraj Masjid, Parli Vaijanath-Beed Hwy, Tokwadi, Bramhawadi, Maharashtra 431530",Tokwadi,"VGC2+Q6W, Parli Vaijanath-Beed Hwy",Bramhawadi,431530,Maharashtra,IN,https://www.google.com/maps/place/Meraj+Masjid/data=!4m7!3m6!1s0x3bcff78b393d535d:0x2d7db68151b52fcb!8m2!3d18.8719812!4d76.5005658!16s%2Fg%2F11h8brrr7k!19sChIJXVM9OYv3zzsRyy-1UYG2fS0?authuser=0&hl=en&rclk=1,"18.8719812,76.50056579999999"
HUSAINI MASJID MOHALLA KHALWA JHANJRA BALRAMPUR,Mosque,"C5FW+998 HUSAINI MASJID MOHALLA KHALWA JHANJRA BALRAMPUR, Balrampur, Uttar Pradesh 271201",,C5FW+998,Balrampur,271201,Uttar Pradesh,IN,https://www.google.com/maps/place/HUSAINI+MASJID+MOHALLA+KHALWA+JHANJRA+BALRAMPUR/data=!4m7!3m6!1s0x3999dfb94c095f0f:0xc7b356d488f3536a!8m2!3d27.4228095!4d82.1963435!16s%2Fg%2F11stvhhwp7!19sChIJD18JTLnfmTkRalPziNRWs8c?authuser=0&hl=en&rclk=1,"27.4228095,82.1963435"
shaikh wali masjid,Mosque,"C5HP+24V shaikh wali masjid, Balrampur, Uttar Pradesh 271201",,C5HP+24V,Balrampur,271201,Uttar Pradesh,IN,https://www.google.com/maps/place/shaikh+wali+masjid/data=!4m7!3m6!1s0x3999d91a3299665f:0x6c47262e97a0212c!8m2!3d27.4276171!4d82.1852979!16s%2Fg%2F11qgjrwzz5!19sChIJX2aZMhrZmTkRLCGgly4mR2w?authuser=0&hl=en&rclk=1,"27.4276171,82.1852979"
Shere-e-Raza Masjid Hashimpara,Mosque,"C5JJ+76R Shere-e-Raza Masjid Hashimpara, Hashimpra, chitarapara, Balrampur",,"C5JJ+76R, Hashimpra, chitarapara",Balrampur,,Uttar Pradesh,IN,https://www.google.com/maps/place/Shere-e-Raza+Masjid+Hashimpara/data=!4m7!3m6!1s0x3999d9e34aed2c55:0xa93fa6c3a9f66e4e!8m2!3d27.4307473!4d82.1805203!16s%2Fg%2F11q56qd2r1!19sChIJVSztSuPZmTkRTm72qcOmP6k?authuser=0&hl=en&rclk=1,"27.4307473,82.1805203"
Azadnagar Balrampur Maszid,Mosque,"C5HM+FFX Azadnagar Balrampur Maszid, Balrampur, Uttar Pradesh 271201",,C5HM+FFX,Balrampur,271201,Uttar Pradesh,IN,https://www.google.com/maps/place/Azadnagar+Balrampur+Maszid/data=!4m7!3m6!1s0x3999d97c299dc921:0xc507eb39d5eb8481!8m2!3d27.4287595!4d82.1835214!16s%2Fg%2F11kjf643sr!19sChIJIcmdKXzZmTkRgYTr1TnrB8U?authuser=0&hl=en&rclk=1,"27.428759499999998,82.18352139999999"
Lalmati Eid-gah Sarig,Mosque,"8M24+47P Lalmati Eid-gah Sarig, Lalmati Grazing, Assam 783382",,8M24+47P,Lalmati Grazing,783382,Assam,IN,https://www.google.com/maps/place/Lalmati+Eid-gah+Sarig/data=!4m7!3m6!1s0x3759ad8222b465d9:0xd6a7868327a1f28!8m2!3d26.3003405!4d90.6556891!16s%2Fg%2F11qq0bz671!19sChIJ2WW0IoKtWTcRKB96Mmh4ag0?authuser=0&hl=en&rclk=1,"26.300340499999997,90.65568909999999"
Abhayapuri Namghar (Satra),Place of worship,"8MP5+WPQ Abhayapuri Namghar (Satra), Sahitya Sabha Rd, Bidyaparya, Abhayapuri, Assam 783384",Bidyaparya,"8MP5+WPQ, Sahitya Sabha Rd",Abhayapuri,783384,Assam,IN,https://www.google.com/maps/place/Abhayapuri+Namghar+%28Satra%29/data=!4m7!3m6!1s0x3759abf4f7072219:0xcdd6ae2a00d3669!8m2!3d26.3365087!4d90.659925!16s%2Fg%2F11rzdh9fw0!19sChIJGSIH9_SrWTcRaTYNoOJq3Qw?authuser=0&hl=en&rclk=1,"26.3365087,90.659925"
Joki Mohala masjid,Mosque,"7559+WV3 Joki Mohala masjid, Jagatsinghpur, Odisha 754103",,7559+WV3,Jagatsinghpur,754103,Odisha,IN,https://www.google.com/maps/place/Joki+Mohala+masjid/data=!4m7!3m6!1s0x3a19837afbfdf3b1:0xe9700d41fb170241!8m2!3d20.2597664!4d86.1696707!16s%2Fg%2F11l_dxyr_f!19sChIJsfP9-3qDGToRQQIX-0ENcOk?authuser=0&hl=en&rclk=1,"20.2597664,86.1696707"
Madina masjid dash garden,Masonic center,"Madina masjid dash garden, House no 8 block B gali no 13 baprola vihar dash garden najfgard, New Delhi, 110043","Karkar Duma, Karkardooma, Anand Vihar",House no 8 block B gali no 13 baprola vihar dash garden najfgard,"New Delhi, Delhi",110043,Delhi,IN,https://www.google.com/maps/place/Madina+masjid+dash+garden/data=!4m7!3m6!1s0x390cfb0c7e807c27:0x4838edc55745cf26!8m2!3d28.650232!4d77.3027064!16s%2Fg%2F11j0ww7jpn!19sChIJJ3yAfgz7DDkRJs9FV8XtOEg?authuser=0&hl=en&rclk=1,"28.650232,77.30270639999999"
Masjid Goolar Wali,Mosque,"Shop No.63, Masjid Goolar Wali, Farash Khana, Naya Bans, Hauz Qazi, Chandni Chowk, New Delhi, Delhi, 110006","Naya Bans, Hauz Qazi, Chandni Chowk","Shop No.63, Farash Khana","New Delhi, Delhi",110006,Delhi,IN,https://www.google.com/maps/place/Masjid+Goolar+Wali/data=!4m7!3m6!1s0x390cfd3072dbdc31:0xaa5d72e21d4c1f18!8m2!3d28.6547373!4d77.2213612!16s%2Fg%2F11fjy3sfwm!19sChIJMdzbcjD9DDkRGB9MHeJyXao?authuser=0&hl=en&rclk=1,"28.654737299999997,77.22136119999999"
Maryam,Mosque,"M6VC+566 Maryam, Banarsi Das Estate, Timarpur, Delhi, 110054","Banarsi Das Estate, Timarpur",M6VC+566,Delhi,,Delhi,IN,https://www.google.com/maps/place/Maryam/data=!4m7!3m6!1s0x390cfd5e6c8c4b0f:0xb5cc70b4a010f216!8m2!3d28.6929061!4d77.2205015!16s%2Fg%2F11pqgr0q7h!19sChIJD0uMbF79DDkRFvIQoLRwzLU?authuser=0&hl=en&rclk=1,"28.6929061,77.2205015"
Benjamin Yunas,Parsi temple,"Benjamin Yunas, 2234, c/54 Near play ground Ludhiyana, 141008, Issa Nagri, Mohar Singh Nagar, Ludhiana, Punjab","Meena Bazaar, Issa Nagri, Mohar Singh Nagar","2234, c/54 Near play ground Ludhiyana, 141008","Ludhiana, Delhi",,Punjab,IN,https://www.google.com/maps/place/Benjamin+Yunas/data=!4m7!3m6!1s0x390cfd1eeac0b4d7:0xf31b265254e53829!8m2!3d28.6523291!4d77.2363779!16s%2Fg%2F11dd_qsxyv!19sChIJ17TA6h79DDkRKTjlVFImG_M?authuser=0&hl=en&rclk=1,"28.6523291,77.2363779"
Murshid e azam Masjid Anand nagar bharatpur,Mosque,"6FCC+53Q Murshid e azam Masjid Anand nagar bharatpur, Subhash Nagar, Bharatpur, Rajasthan 321001",Subhash Nagar,6FCC+53Q,Bharatpur,321001,Rajasthan,IN,https://www.google.com/maps/place/Murshid+e+azam+Masjid+Anand+nagar+bharatpur/data=!4m7!3m6!1s0x3973a35cbe3866c1:0x3dda9ee8802bcb7f!8m2!3d27.2205795!4d77.4702319!16s%2Fg%2F11srl4l0vy!19sChIJwWY4vlyjczkRf8srgOie2j0?authuser=0&hl=en&rclk=1,"27.2205795,77.4702319"
Public Food Centre,Food bank,"Public Food Centre, SKV, Block A, Anand Nagar, Inderlok, Delhi, 110035","Block A, Anand Nagar, Inderlok",SKV,Delhi,110035,Delhi,IN,https://www.google.com/maps/place/Public+Food+Centre/data=!4m7!3m6!1s0x390d025cfe2e11c1:0xb116e546e96b2555!8m2!3d28.6733177!4d77.168586!16s%2Fg%2F11hfbxw3l1!19sChIJwREu_lwCDTkRVSVr6UblFrE?authuser=0&hl=en&rclk=1,"28.6733177,77.16858599999999"
Masjid-e-Adam,Mosque,"HXC3+RW Masjid-e-Adam, Nanikhodiyar, Anand, Gujarat 388001",Nanikhodiyar,HXC3+RW,Anand,388001,Gujarat,IN,https://www.google.com/maps/place/Masjid-e-Adam/data=!4m7!3m6!1s0x395e4f1018f8fd69:0x906f37f1e7213b52!8m2!3d22.5720935!4d72.9547158!16s%2Fg%2F11smc0w3gs!19sChIJaf34GBBPXjkRUjsh5_E3b5A?authuser=0&hl=en&rclk=1,"22.572093499999998,72.9547158"
Kuen Wali Masjid,Mosque,"Q2GC+3WC Kuen Wali Masjid, Anand Nagar, Sabit gunj, Etawah, Uttar Pradesh 206001","Anand Nagar, Sabit gunj",Q2GC+3WC,Etawah,206001,Uttar Pradesh,IN,https://www.google.com/maps/place/Kuen+Wali+Masjid/data=!4m7!3m6!1s0x3975e1ccf08ef4fb:0x8735d388af90f73c!8m2!3d26.7751922!4d79.0222769!16s%2Fg%2F11flzqc_m2!19sChIJ-_SO8MzhdTkRPPeQr4jTNYc?authuser=0&hl=en&rclk=1,"26.7751922,79.0222769"
Mazar Sayed Maqbool Ali Rizvi Husain Malakpur Behat Saharanpur,Mosque,"5JWQ+6WF Mazar Sayed Maqbool Ali Rizvi Husain Malakpur Behat Saharanpur, Unnamed Road, Behat, Uttar Pradesh 247121",,"5JWQ+6WF, Unnamed Road",Behat,247121,Uttar Pradesh,IN,https://www.google.com/maps/place/Mazar+Sayed+Maqbool+Ali+Rizvi+Husain+Malakpur+Behat+Saharanpur/data=!4m7!3m6!1s0x390edd6f48c23035:0x21622153df727610!8m2!3d30.1955604!4d77.6397978!16s%2Fg%2F11fwdp6rqt!19sChIJNTDCSG_dDjkREHZy31MhYiE?authuser=0&hl=en&rclk=1,"30.195560399999998,77.6397978"
Behat,Store,"Behat, Shahi jama masjid, Behat, Uttar Pradesh 247121",,Shahi jama masjid,Behat,,Uttar Pradesh,IN,https://www.google.com/maps/place/Behat/data=!4m7!3m6!1s0x390eddb68d15ac7b:0x58e9f28b918b16f1!8m2!3d30.1713186!4d77.6130711!16s%2Fg%2F11t7j_1kck!19sChIJe6wVjbbdDjkR8RaLkYvy6Vg?authuser=0&hl=en&rclk=1,"30.1713186,77.6130711"
Hazrat saheb wali masjid-e-ibrahim,Mosque,"7M74+3XJ Hazrat saheb wali masjid-e-ibrahim, Madina Nagar 1, Sanjog Nagar, Bhuj, Gujarat 370001","Madina Nagar 1, Sanjog Nagar",7M74+3XJ,Bhuj,370001,Gujarat,IN,https://www.google.com/maps/place/Hazrat+saheb+wali+masjid-e-ibrahim/data=!4m7!3m6!1s0x39511d88b5f0790b:0x6bad7b964c731bc6!8m2!3d23.2627025!4d69.6574033!16s%2Fg%2F11rxrxx2vr!19sChIJC3nwtYgdUTkRxhtzTJZ7rWs?authuser=0&hl=en&rclk=1,"23.2627025,69.6574033"
Masjid hafshah,Mosque,"6J5P+JFW Masjid hafshah, Mirjapar Part, Gujarat 370040",,6J5P+JFW,Mirjapar Part,,Gujarat,IN,https://www.google.com/maps/place/Masjid+hafshah/data=!4m7!3m6!1s0x39511ffa1d2e0d69:0x776d1753871a66f!8m2!3d23.2091007!4d69.6362162!16s%2Fg%2F11nnp0g0f0!19sChIJaQ0uHfofUTkRb6ZxOHXRdgc?authuser=0&hl=en&rclk=1,"23.2091007,69.63621619999999"
Masjid Khawja Osman Haruni (Bhujiyay Masjid),Mosque,"Masjid Khawja Osman Haruni (Bhujiyay Masjid), 2614/1, Rajendra Nagar, Siddhapur, Bhuj, Gujarat 370020","Rajendra Nagar, Siddhapur",2614/1,Bhuj,370020,Gujarat,IN,https://www.google.com/maps/place/Masjid+Khawja+Osman+Haruni+%28Bhujiyay+Masjid%29/data=!4m7!3m6!1s0x3950e1c97b73653b:0xe189a7284b42a07d!8m2!3d23.2490624!4d69.6789488!16s%2Fg%2F11sgn6gcww!19sChIJO2Vze8nhUDkRfaBCSyinieE?authuser=0&hl=en&rclk=1,"23.2490624,69.6789488"
Rehmat masjid,Mosque,"Rehmat masjid, 99F/1, Muslim Colony, Madhapara, Bhuj, Gujarat 370605","Muslim Colony, Madhapara",99F/1,Bhuj,370605,Gujarat,IN,https://www.google.com/maps/place/Rehmat+masjid/data=!4m7!3m6!1s0x3950e3bf3c575835:0xed2d6b2c2fb28f1f!8m2!3d23.2586224!4d69.6784127!16s%2Fg%2F11tsg8tr0m!19sChIJNVhXPL_jUDkRH4-yLyxrLe0?authuser=0&hl=en&rclk=1,"23.2586224,69.6784127"
Pttavali Masjid,Mosque,"7M3C+XJX Pttavali Masjid, Kansara Bazar Rd, Old Dhatia Falia, Bhuj, Gujarat 370001",Old Dhatia Falia,"7M3C+XJX, Kansara Bazar Rd",Bhuj,370001,Gujarat,IN,https://www.google.com/maps/place/Pttavali+Masjid/data=!4m7!3m6!1s0x3950e200496ba50b:0x2f973873d3391f3f!8m2!3d23.2549935!4d69.6715959!16s%2Fg%2F11ggb9vwcc!19sChIJC6VrSQDiUDkRPx8503M4ly8?authuser=0&hl=en&rclk=1,"23.254993499999998,69.6715959"
Chand Masjid,Mosque,"7M4H+PXG Chand Masjid, Yusufsha Bhavansha Margh, Madhapara, Bhuj, Gujarat 370001",Madhapara,"7M4H+PXG, Yusufsha Bhavansha Margh",Bhuj,370001,Gujarat,IN,https://www.google.com/maps/place/Chand+Masjid/data=!4m7!3m6!1s0x3950e3f06ee48003:0xcc7205f5cec8c5a0!8m2!3d23.2568169!4d69.6799572!16s%2Fg%2F11j8k_1hyn!19sChIJA4DkbvDjUDkRoMXIzvUFcsw?authuser=0&hl=en&rclk=1,"23.2568169,69.67995719999999"
Masjid e vadi e Rahemat,Mosque,"6JG7+74F Masjid e vadi e Rahemat, vistar, Vadi, Sukhpar, Bhuj, Gujarat 370040",Sukhpar,"6JG7+74F vistar, Vadi",Bhuj,370040,Gujarat,IN,https://www.google.com/maps/place/Masjid+e+vadi+e+Rahemat/data=!4m7!3m6!1s0x39511f7c88ea7b29:0xeae25d18dfaee324!8m2!3d23.2254088!4d69.6127854!16s%2Fg%2F11jzvdsr0c!19sChIJKXvqiHwfUTkRJOOu3xhd4uo?authuser=0&hl=en&rclk=1,"23.2254088,69.61278539999999"
Masjid-e-Aqsa(oganwali masjid),Mosque,"7M3J+X77 Masjid-e-Aqsa(oganwali masjid), Oganwadi, Sural Bhit Rd, Bhuj, Gujarat",Madhapara,"7M3J+X77, Oganwadi, Sural Bhit Rd",Bhuj,,Gujarat,IN,https://www.google.com/maps/place/Masjid-e-Aqsa%28oganwali+masjid%29/data=!4m7!3m6!1s0x3950e37097c1f84b:0xf7024082b4a68cc!8m2!3d23.2549146!4d69.6806624!16s%2Fg%2F11t0vy4gb7!19sChIJS_jBl3DjUDkRzGhKKwgkcA8?authuser=0&hl=en&rclk=1,"23.2549146,69.6806624"
Masji a salfiya,Mosque,"7M5J+588 Masji a salfiya, Madhapara, Bhuj, Gujarat 370001",Madhapara,7M5J+588,Bhuj,370001,Gujarat,IN,https://www.google.com/maps/place/Masji+a+salfiya/data=!4m7!3m6!1s0x3950e3c4e9fb95fd:0xb0eb287347b6bd34!8m2!3d23.2579096!4d69.6808368!16s%2Fg%2F11h1mj56d9!19sChIJ_ZX76cTjUDkRNL22R3Mo67A?authuser=0&hl=en&rclk=1,"23.257909599999998,69.6808368"
JANNAT MASJID BHUJ,Store,"JANNAT MASJID BHUJ, Uplipad, Mahadev Gate Rd, Ghanshyam Nagar, Bhuj, Gujarat 370001",Ghanshyam Nagar,"Uplipad, Mahadev Gate Rd",Bhuj,370001,Gujarat,IN,https://www.google.com/maps/place/JANNAT+MASJID+BHUJ/data=!4m7!3m6!1s0x39511de31de88bcf:0x216dec4e132753e!8m2!3d23.2544094!4d69.6678153!16s%2Fg%2F11tnnqwhyx!19sChIJz4voHeMdUTkRPnUy4cTeFgI?authuser=0&hl=en&rclk=1,"23.2544094,69.6678153"
Abdullasha kadri sirachi ni dargha,Mosque,"7M78+MRP Abdullasha kadri sirachi ni dargha, Shivnagar, Bhuj, Gujarat 370001",Shivnagar,7M78+MRP,Bhuj,370001,Gujarat,IN,https://www.google.com/maps/place/Abdullasha+kadri+sirachi+ni+dargha/data=!4m7!3m6!1s0x39511d98b1d6efd5:0x20bc8588c0b7903a!8m2!3d23.2642216!4d69.667069!16s%2Fg%2F11p9n8vxl3!19sChIJ1e_WsZgdUTkROpC3wIiFvCA?authuser=0&hl=en&rclk=1,"23.2642216,69.667069"
Masjid Al Ahad Jumma Mosque,Mosque,"X83F+HRX Masjid Al Ahad Jumma Mosque, Tenkasi, Tamil Nadu 627814",,X83F+HRX,Tenkasi,,Tamil Nadu,IN,https://www.google.com/maps/place/Masjid+Al+Ahad+Jumma+Mosque/data=!4m7!3m6!1s0x3b042964bbec6141:0x74223acb8bf8dd17!8m2!3d8.953988!4d77.3246171!16s%2Fg%2F11q_f4cz6w!19sChIJQWHsu2QpBDsRF934i8s6InQ?authuser=0&hl=en&rclk=1,"8.953987999999999,77.3246171"
Maraikkayar Palli Vasal Jummah Masjid,Mosque,"X856+JC6 Maraikkayar Palli Vasal Jummah Masjid, Tenkasi, Tamil Nadu 627811",,X856+JC6,Tenkasi,627811,Tamil Nadu,IN,https://www.google.com/maps/place/Maraikkayar+Palli+Vasal+Jummah+Masjid/data=!4m7!3m6!1s0x3b0429dd38215555:0x5dba09b227381269!8m2!3d8.9590311!4d77.3110157!16s%2Fg%2F11kj3f592c!19sChIJVVUhON0pBDsRaRI4J7IJul0?authuser=0&hl=en&rclk=1,"8.959031099999999,77.3110157"
Puthupalli Masjid,Mosque,"X857+H5V Puthupalli Masjid, Tenkasi, Tamil Nadu 627811",,X857+H5V,Tenkasi,,Tamil Nadu,IN,https://www.google.com/maps/place/Puthupalli+Masjid/data=!4m7!3m6!1s0x3b04294bf615ed2b:0x9879015aaf984a2f!8m2!3d8.9589947!4d77.3129248!16s%2Fg%2F11fhqnyxb1!19sChIJK-0V9kspBDsRL0qYr1oBeZg?authuser=0&hl=en&rclk=1,"8.9589947,77.31292479999999"
veemptti jimmaa pllllivaacl,Mosque,"X849+FJF veemptti jimmaa pllllivaacl, Pulichikulam, Tenkasi, Tamil Nadu 627814",,X849+FJF,"Pulichikulam, Tenkasi",627814,Tamil Nadu,IN,https://www.google.com/maps/place/%E0%AE%B5%E0%AF%87%E0%AE%AE%E0%AF%8D%E0%AE%AA%E0%AE%9F%E0%AE%BF+%E0%AE%9C%E0%AE%BF%E0%AE%AE%E0%AF%8D%E0%AE%AE%E0%AE%BE+%E0%AE%AA%E0%AE%B3%E0%AF%8D%E0%AE%B3%E0%AE%BF%E0%AE%B5%E0%AE%BE%E0%AE%9A%E0%AE%B2%E0%AF%8D/data=!4m7!3m6!1s0x3b0429f563c5d457:0x3a008b7178b03d60!8m2!3d8.9560494!4d77.3192085!16s%2Fg%2F11tx6ps8ql!19sChIJV9TFY_UpBDsRYD2weHGLADo?authuser=0&hl=en&rclk=1,"8.9560494,77.3192085"
Bazaar mosque,Mosque,"Bazaar mosque, M-22/372, Tenkasi Housing Board, Tenkasi, Tamil Nadu 627811",Tenkasi Housing Board,M-22/372,Tenkasi,627811,Tamil Nadu,IN,https://www.google.com/maps/place/Bazaar+mosque/data=!4m7!3m6!1s0x3b0683ab10c32cd7:0xa378b16291ae7fab!8m2!3d8.9721758!4d77.3013406!16s%2Fg%2F11tfkjz3cn!19sChIJ1yzDEKuDBjsRq3-ukWKxeKM?authuser=0&hl=en&rclk=1,"8.9721758,77.3013406"
"Shia Khoja Masjid, Mandvi, Gujrat",Mosque,"R8MX+F9F Shia Khoja Masjid, Mandvi, Gujrat, Shyamji Krishna Varma Rd, Swamiji Sheri, Mandvi, Gujarat 370465",Swamiji Sheri,"R8MX+F9F, Shyamji Krishna Varma Rd",Mandvi,370465,Gujarat,IN,"https://www.google.com/maps/place/Shia+Khoja+Masjid,+Mandvi,+Gujrat/data=!4m7!3m6!1s0x395135016e7f4227:0xdbb5ca6a602efc33!8m2!3d22.8336891!4d69.3484199!16s%2Fg%2F11n00bn8wd!19sChIJJ0J_bgE1UTkRM_wuYGrKtds?authuser=0&hl=en&rclk=1","22.833689099999997,69.3484199"
"Noor Masjid, Amil Saheb, Navapura Mandvi",Mosque,"Noor Masjid, Amil Saheb, Navapura Mandvi, Swamiji Sheri, Mandvi, Gujarat 370465",Swamiji Sheri,,Mandvi,370465,Gujarat,IN,"https://www.google.com/maps/place/Noor+Masjid,+Amil+Saheb,+Navapura+Mandvi/data=!4m7!3m6!1s0x3951357458f63c65:0x2c4e85fe8259a79f!8m2!3d22.8354909!4d69.3504687!16s%2Fg%2F11sg_2vbx5!19sChIJZTz2WHQ1UTkRn6dZgv6FTiw?authuser=0&hl=en&rclk=1","22.8354909,69.3504687"
Jilani Masjid,Mosque,"R8HW+QH2 Jilani Masjid, Beach Road, Megmangal Nagar, Mandvi, Gujarat 370465",Megmangal Nagar,"R8HW+QH2, Beach Road",Mandvi,370465,Gujarat,IN,https://www.google.com/maps/place/Jilani+Masjid/data=!4m7!3m6!1s0x395135cbea109cf3:0x5e5aaabebaec9ea6!8m2!3d22.8293858!4d69.3463887!16s%2Fg%2F11f6nkt1j_!19sChIJ85wQ6ss1UTkRpp7sur6qWl4?authuser=0&hl=en&rclk=1,"22.8293858,69.34638869999999"
Khatriwali Masjid,Mosque,"R8RW+6RJ Khatriwali Masjid, Umiya Nagar, Mandvi, Gujarat 370465",Umiya Nagar,R8RW+6RJ,Mandvi,370465,Gujarat,IN,https://www.google.com/maps/place/Khatriwali+Masjid/data=!4m7!3m6!1s0x3951356c4b7da79f:0xc80b76985f1585ac!8m2!3d22.8405879!4d69.3470061!16s%2Fg%2F11k6js28j2!19sChIJn6d9S2w1UTkRrIUVX5h2C8g?authuser=0&hl=en&rclk=1,"22.8405879,69.3470061"
Kalimi Masjid,Mosque,"R9R2+4RC Kalimi Masjid, Vohra Hajira, Mandvi, Gujarat 370465",Vohra Hajira,R9R2+4RC,Mandvi,370465,Gujarat,IN,https://www.google.com/maps/place/Kalimi+Masjid/data=!4m7!3m6!1s0x3951354dc82a2b9d:0x202602aad92676a8!8m2!3d22.8403244!4d69.3525354!16s%2Fg%2F11t9t7lfx1!19sChIJnSsqyE01UTkRqHYm2aoCJiA?authuser=0&hl=en&rclk=1,"22.8403244,69.3525354"
Tamachi masjid,Mosque,"R9P2+54 Tamachi masjid, Swamiji Sheri, Mandvi Rural, Mandvi, Gujarat 370465",Swamiji Sheri,R9P2+54,"Mandvi Rural, Mandvi",,Gujarat,IN,https://www.google.com/maps/place/Tamachi+masjid/data=!4m7!3m6!1s0x39513572ad8e36ff:0x4481e13cb85ea6fb!8m2!3d22.8354686!4d69.350287!16s%2Fg%2F11tn48rzt7!19sChIJ_zaOrXI1UTkR-6ZeuDzhgUQ?authuser=0&hl=en&rclk=1,"22.8354686,69.350287"
Bukhari dargha,Mosque,"R9F4+H9R Bukhari dargha, Unnamed Road, Mota Salaya, Mandvi Rural, Mandvi, Gujarat 370455",Mota Salaya,"R9F4+H9R, Unnamed Road","Mandvi Rural, Mandvi",370455,Gujarat,IN,https://www.google.com/maps/place/Bukhari+dargha/data=!4m7!3m6!1s0x3951355b1dc47561:0x200712835d79d89d!8m2!3d22.8239791!4d69.3558906!16s%2Fg%2F11pfqy8rkp!19sChIJYXXEHVs1UTkRndh5XYMSByA?authuser=0&hl=en&rclk=1,"22.8239791,69.3558906"
Aqsa masjid,Mosque,"Aqsa masjid, Bawagor No Tekro, Mandvi, Gujarat 394160",,Bawagor No Tekro,Mandvi,394160,Gujarat,IN,https://www.google.com/maps/place/Aqsa+masjid/data=!4m7!3m6!1s0x3be071a43f96f25f:0x666d1fbfc9ea3bb7!8m2!3d21.2518848!4d73.3040515!16s%2Fg%2F11j88ssy78!19sChIJX_KWP6Rx4DsRtzvqyb8fbWY?authuser=0&hl=en&rclk=1,"21.2518848,73.3040515"
"Naamner Masjid, naamner msjid",Mosque,"Ward no. 27, Naamner Masjid, naamner msjid, Station Rd, udai mode, Saloda Industrial Area, Gangapur, Rajasthan 322201","udai mode, Saloda Industrial Area","Ward no. 27, Station Rd",Gangapur,322201,Rajasthan,IN,"https://www.google.com/maps/place/Naamner+Masjid,+%E0%A4%A8%E0%A4%BE%E0%A4%AE%E0%A4%A8%E0%A5%87%E0%A4%B0+%E0%A4%AE%E0%A4%B8%E0%A5%8D%E0%A4%9C%E0%A4%BF%E0%A4%A6/data=!4m7!3m6!1s0x3971f5cd1ed08b1f:0x1ba44dcabde446e7!8m2!3d26.4833211!4d76.7340094!16s%2Fg%2F11t2sxk97t!19sChIJH4vQHs31cTkR50bkvcpNpBs?authuser=0&hl=en&rclk=1","26.483321099999998,76.73400939999999"
Jakariya masjid,Mosque,"FPJ9+JGF Jakariya masjid, Sheetla Mata Rd, Mirzapur, Gangapur, Rajasthan 322201",Mirzapur,"FPJ9+JGF, Sheetla Mata Rd",Gangapur,,Rajasthan,IN,https://www.google.com/maps/place/Jakariya+masjid/data=!4m7!3m6!1s0x3971f710e9a2431b:0xdbf0672cc5b7d686!8m2!3d26.4815607!4d76.7187925!16s%2Fg%2F11rq8wh384!19sChIJG0Oi6RD3cTkRhta3xSxn8Ns?authuser=0&hl=en&rclk=1,"26.4815607,76.71879249999999"
Mohammadi Masjid Aliganj,Mosque,"Mohammadi Masjid Aliganj, Sheetla Mata Rd, Gangapur, Brahmabad Rural, Rajasthan 322201",,Sheetla Mata Rd,"Gangapur, Brahmabad Rural",322201,Rajasthan,IN,https://www.google.com/maps/place/Mohammadi+Masjid+Aliganj/data=!4m7!3m6!1s0x3971f717677ebe9f:0xa0f1c88939d93d42!8m2!3d26.4918475!4d76.7108696!16s%2Fg%2F11rfnzqg0d!19sChIJn75-Zxf3cTkRQj3ZOYnI8aA?authuser=0&hl=en&rclk=1,"26.4918475,76.7108696"
Aamna masjid,Mosque,"GP3P+X98 Aamna masjid, Adarsh Nagar, Udai Kalan rural, Rajasthan 322201",Adarsh Nagar,GP3P+X98,Udai Kalan rural,322201,Rajasthan,IN,https://www.google.com/maps/place/Aamna+masjid/data=!4m7!3m6!1s0x3971f5ff5a4c52ff:0x39923bcb4cc79744!8m2!3d26.5050469!4d76.7359512!16s%2Fg%2F11twh5c6yr!19sChIJ_1JMWv_1cTkRRJfHTMs7kjk?authuser=0&hl=en&rclk=1,"26.5050469,76.7359512"
Masque of teli,Mosque,"FPFF+36F Masque of teli, Mahavir Nagar, Gangapur, Rajasthan 322202",Mahavir Nagar,FPFF+36F,Gangapur,322202,Rajasthan,IN,https://www.google.com/maps/place/Masque+of+teli/data=!4m7!3m6!1s0x3971f7c52a7ed969:0x60d7bbf6199f2a60!8m2!3d26.4726863!4d76.7230521!16s%2Fg%2F11sk4qxb16!19sChIJadl-KsX3cTkRYCqfGfa712A?authuser=0&hl=en&rclk=1,"26.4726863,76.72305209999999"
USMAN GANI MASAJID,Mosque,"USMAN GANI MASAJID, Aashu pathan B2, Mirzapur, Gangapur, Rajasthan 322201",Mirzapur,Aashu pathan B2,Gangapur,322201,Rajasthan,IN,https://www.google.com/maps/place/USMAN+GANI+MASAJID/data=!4m7!3m6!1s0x3971f750418f8465:0x2b2b820bf3c1f08!8m2!3d26.4816216!4d76.7226555!16s%2Fg%2F11sgmzb3j9!19sChIJZYSPQVD3cTkRCB88vyC4sgI?authuser=0&hl=en&rclk=1,"26.4816216,76.7226555"
Madarsa Qasmiya kasimul uloom,Mosque,"FPPG+3FG Madarsa Qasmiya kasimul uloom, Unnamed Road, Jiyapur, Gangapur, Rajasthan 322201",Jiyapur,"FPPG+3FG, Unnamed Road",Gangapur,322201,Rajasthan,IN,https://www.google.com/maps/place/Madarsa+Qasmiya+kasimul+uloom/data=!4m7!3m6!1s0x3971f77834e564e9:0x59eb61ee2a8710da!8m2!3d26.4851892!4d76.7262062!16s%2Fg%2F11ncjdvxp4!19sChIJ6WTlNHj3cTkR2hCHKu5h61k?authuser=0&hl=en&rclk=1,"26.485189199999997,76.7262062"
