name,main_category,address,address_ward,address_street,address_city,address_postal_code,address_state,address_country_code,link,coordinates
Charminar,Monument,"Charminar, Charminar Rd, Char Kaman, Ghansi Bazaar, Hyderabad, Telangana 500002","Char Kaman, Ghansi Bazaar",Charminar Rd,Hyderabad,500002,Telangana,IN,https://www.google.com/maps/place/Charminar/data=!4m7!3m6!1s0x3bcb978a6e1a939b:0xcb5a69e4aaf113fb!8m2!3d17.3615636!4d78.4746645!16zL20vMDNuZmxw!19sChIJm5MaboqXyzsR-xPxquRpWss?authuser=0&hl=en&rclk=1,"17.3615636,78.4746645"
Sheikh Zayed Grand Mosque,Mosque,Sheikh Zayed Grand Mosque - Al Rawdah - Abu Dhabi - United Arab Emirates,Al Rawdah,,,,Abu Dhabi,AE,https://www.google.com/maps/place/Sheikh+Zayed+Grand+Mosque/data=!4m7!3m6!1s0x3e5e4273e8dafe49:0x248fbbcbefe2afc7!8m2!3d24.4128334!4d54.4749754!16s%2Fm%2F025_jz8!19sChIJSf7a6HNCXj4Rx6_i78u7jyQ?authuser=0&hl=en&rclk=1,"24.4128334,54.4749754"
Jama Masjid,Mosque,"Jama Masjid, Old Delhi, Delhi, 110006","Jama Masjid, Old Delhi",,Delhi,110006,Delhi,IN,https://www.google.com/maps/place/Jama+Masjid/data=!4m7!3m6!1s0x390cfd18df89b215:0xdd57369e29bf9d96!8m2!3d28.6506792!4d77.2334421!16zL20vMDR5emo1!19sChIJFbKJ3xj9DDkRlp2_KZ42V90?authuser=0&hl=en&rclk=1,"28.6506792,77.23344209999999"
Jama Masjid,Mosque,"Jama Masjid, Old Delhi, Delhi, 110006","Jama Masjid, Old Delhi",,Delhi,110006,Delhi,IN,https://www.google.com/maps/place/Jama+Masjid/data=!4m7!3m6!1s0x390cfd18df89b215:0xdd57369e29bf9d96!8m2!3d28.6506792!4d77.2334421!16zL20vMDR5emo1!19sChIJFbKJ3xj9DDkRlp2_KZ42V90?authuser=0&hl=en&rclk=1,"28.6506792,77.23344209999999"
Jama Masjid,Mosque,"Jama Masjid, Old Delhi, Delhi, 110006","Jama Masjid, Old Delhi",,Delhi,110006,Delhi,IN,https://www.google.com/maps/place/Jama+Masjid/data=!4m7!3m6!1s0x390cfd18df89b215:0xdd57369e29bf9d96!8m2!3d28.6506792!4d77.2334421!16zL20vMDR5emo1!19sChIJFbKJ3xj9DDkRlp2_KZ42V90?authuser=0&hl=en&rclk=1,"28.6506792,77.23344209999999"
Jama Masjid,Mosque,"Jama Masjid, Old Delhi, Delhi, 110006","Jama Masjid, Old Delhi",,Delhi,110006,Delhi,IN,https://www.google.com/maps/place/Jama+Masjid/data=!4m7!3m6!1s0x390cfd18df89b215:0xdd57369e29bf9d96!8m2!3d28.6506792!4d77.2334421!16zL20vMDR5emo1!19sChIJFbKJ3xj9DDkRlp2_KZ42V90?authuser=0&hl=en&rclk=1,"28.6506792,77.23344209999999"
Jama Masjid,Mosque,"Jama Masjid, Old Delhi, Delhi, 110006","Jama Masjid, Old Delhi",,Delhi,110006,Delhi,IN,https://www.google.com/maps/place/Jama+Masjid/data=!4m7!3m6!1s0x390cfd18df89b215:0xdd57369e29bf9d96!8m2!3d28.6506792!4d77.2334421!16zL20vMDR5emo1!19sChIJFbKJ3xj9DDkRlp2_KZ42V90?authuser=0&hl=en&rclk=1,"28.6506792,77.23344209999999"
Jama Masjid,Mosque,"Jama Masjid, Old Delhi, Delhi, 110006","Jama Masjid, Old Delhi",,Delhi,110006,Delhi,IN,https://www.google.com/maps/place/Jama+Masjid/data=!4m7!3m6!1s0x390cfd18df89b215:0xdd57369e29bf9d96!8m2!3d28.6506792!4d77.2334421!16zL20vMDR5emo1!19sChIJFbKJ3xj9DDkRlp2_KZ42V90?authuser=0&hl=en&rclk=1,"28.6506792,77.23344209999999"
Jama Masjid,Mosque,"Jama Masjid, Old Delhi, Delhi, 110006","Jama Masjid, Old Delhi",,Delhi,110006,Delhi,IN,https://www.google.com/maps/place/Jama+Masjid/data=!4m7!3m6!1s0x390cfd18df89b215:0xdd57369e29bf9d96!8m2!3d28.6506792!4d77.2334421!16zL20vMDR5emo1!19sChIJFbKJ3xj9DDkRlp2_KZ42V90?authuser=0&hl=en&rclk=1,"28.6506792,77.23344209999999"
Jama Masjid,Mosque,"Jama Masjid, Old Delhi, Delhi, 110006","Jama Masjid, Old Delhi",,Delhi,110006,Delhi,IN,"https://www.google.com/maps/place/Jama+Masjid/@28.6506792,77.2334421,17z/data=!3m1!4b1!4m6!3m5!1s0x390cfd18df89b215:0xdd57369e29bf9d96!8m2!3d28.6506792!4d77.2334421!16zL20vMDR5emo1?authuser=0&entry=ttu","28.6506792,77.23344209999999"
Jama Masjid,Mosque,"Jama Masjid, Old Delhi, Delhi, 110006","Jama Masjid, Old Delhi",,Delhi,110006,Delhi,IN,https://www.google.com/maps/place/Jama+Masjid/data=!4m7!3m6!1s0x390cfd18df89b215:0xdd57369e29bf9d96!8m2!3d28.6506792!4d77.2334421!16zL20vMDR5emo1!19sChIJFbKJ3xj9DDkRlp2_KZ42V90?authuser=0&hl=en&rclk=1,"28.6506792,77.23344209999999"
Jama Masjid,Mosque,"Jama Masjid, Old Delhi, Delhi, 110006","Jama Masjid, Old Delhi",,Delhi,110006,Delhi,IN,https://www.google.com/maps/place/Jama+Masjid/data=!4m7!3m6!1s0x390cfd18df89b215:0xdd57369e29bf9d96!8m2!3d28.6506792!4d77.2334421!16zL20vMDR5emo1!19sChIJFbKJ3xj9DDkRlp2_KZ42V90?authuser=0&hl=en&rclk=1,"28.6506792,77.23344209999999"
Jama Masjid,Mosque,"Jama Masjid, Old Delhi, Delhi, 110006","Jama Masjid, Old Delhi",,Delhi,110006,Delhi,IN,"https://www.google.com/maps/place/Jama+Masjid/@28.6506792,77.2334421,17z/data=!3m1!4b1!4m6!3m5!1s0x390cfd18df89b215:0xdd57369e29bf9d96!8m2!3d28.6506792!4d77.2334421!16zL20vMDR5emo1?authuser=0&entry=ttu","28.6506792,77.23344209999999"
Akshardham,Hindu temple,"Akshardham, Noida Mor, Pandav Nagar, New Delhi, Delhi, 110092","Noida Mor, Pandav Nagar",,"New Delhi, Delhi",110092,Delhi,IN,https://www.google.com/maps/place/Akshardham/data=!4m7!3m6!1s0x390ce35b9975b1fb:0x69a09f265ef3b22a!8m2!3d28.6126735!4d77.2772619!16zL20vMDkxbmYx!19sChIJ-7F1mVvjDDkRKrLzXiafoGk?authuser=0&hl=en&rclk=1,"28.6126735,77.2772619"
Haji Ali Dargah,Shrine,"Haji Ali Dargah, Dargah Rd, near Lala Lajpatrai Marg, Haji Ali, Mumbai, Maharashtra 400026",Haji Ali,"Dargah Rd, near Lala Lajpatrai Marg",Mumbai,400026,Maharashtra,IN,https://www.google.com/maps/place/Haji+Ali+Dargah/data=!4m7!3m6!1s0x3be7ce7e930d42e3:0xd5e05dc7ab078d05!8m2!3d18.9828273!4d72.8088966!16zL20vMDQyeTF3!19sChIJ40INk37O5zsRBY0Hq8dd4NU?authuser=0&hl=en&rclk=1,"18.9828273,72.8088966"
Anand Vihar Terminal,Train station,"Anand Vihar Terminal, Footover Bridge, Plot Alpha, Isbt Anand Vihar, Anand Vihar, Delhi, 110092","Plot Alpha, Isbt Anand Vihar, Anand Vihar",Footover Bridge,Delhi,110092,Delhi,IN,https://www.google.com/maps/place/Anand+Vihar+Terminal/data=!4m7!3m6!1s0x390cfb3eaa16bd93:0x554673eb4066c794!8m2!3d28.6488339!4d77.3153465!16s%2Fm%2F0c3zht6!19sChIJk70Wqj77DDkRlMdmQOtzRlU?authuser=0&hl=en&rclk=1,"28.6488339,77.31534649999999"
Mecca Masjid,Mosque,"9F6F+5CG Mecca Masjid, Charminar Rd, Charminar, Ghansi Bazaar, Hyderabad, Telangana 500002","Charminar, Ghansi Bazaar","9F6F+5CG, Charminar Rd",Hyderabad,500002,Telangana,IN,https://www.google.com/maps/place/Mecca+Masjid/data=!4m7!3m6!1s0x3bcb978a5f093531:0x78e0f7790007eee2!8m2!3d17.3604416!4d78.4735712!16zL20vMDhscm5j!19sChIJMTUJX4qXyzsR4u4HAHn34Hg?authuser=0&hl=en&rclk=1,"17.360441599999998,78.4735712"
Al Farooq Omar Bin Al Khattab Mosque,Mosque,Al Farooq Omar Bin Al Khattab Mosque - 119 6D St - Al Safa - Al Safa 1 - Dubai - United Arab Emirates,Al Safa - Al Safa 1,119 6D St,,,Dubai,AE,https://www.google.com/maps/place/Al+Farooq+Omar+Bin+Al+Khattab+Mosque/data=!4m7!3m6!1s0x3e5f69f116b57dd9:0x7c2a85286ee7cab6!8m2!3d25.1715754!4d55.2329235!16s%2Fm%2F0115mydc!19sChIJ2X21FvFpXz4RtsrnbiiFKnw?authuser=0&hl=en&rclk=1,"25.1715754,55.2329235"
Fatehpuri Masjid,Mosque,"Fatehpuri Masjid, 39, Chandni Chowk Rd, Fatehpuri, Chandni Chowk, New Delhi, Delhi, 110006","Fatehpuri, Chandni Chowk","39, Chandni Chowk Rd","New Delhi, Delhi",110006,Delhi,IN,https://www.google.com/maps/place/Fatehpuri+Masjid/data=!4m7!3m6!1s0x390cfd12236c41c7:0x5f3e70ba058095f!8m2!3d28.6566489!4d77.2227706!16s%2Fm%2F0532f6p!19sChIJx0FsIxL9DDkRXwlYoAvn8wU?authuser=0&hl=en&rclk=1,"28.6566489,77.22277059999999"
Fatehpuri Masjid,Mosque,"Fatehpuri Masjid, 39, Chandni Chowk Rd, Fatehpuri, Chandni Chowk, New Delhi, Delhi, 110006","Fatehpuri, Chandni Chowk","39, Chandni Chowk Rd","New Delhi, Delhi",110006,Delhi,IN,https://www.google.com/maps/place/Fatehpuri+Masjid/data=!4m7!3m6!1s0x390cfd12236c41c7:0x5f3e70ba058095f!8m2!3d28.6566489!4d77.2227706!16s%2Fm%2F0532f6p!19sChIJx0FsIxL9DDkRXwlYoAvn8wU?authuser=0&hl=en&rclk=1,"28.6566489,77.22277059999999"
Al Rahim Masjid,Mosque,349J+GVF Al Rahim Masjid - Al Seba St - Dubai Marina - Dubai - United Arab Emirates,Dubai Marina,349J+GVF - Al Seba St,,,Dubai,AE,https://www.google.com/maps/place/Al+Rahim+Masjid/data=!4m7!3m6!1s0x3e5f1353d8564d2d:0x34dc89b3d3eb9603!8m2!3d25.0688019!4d55.132179!16s%2Fm%2F0127x554!19sChIJLU1W2FMTXz4RA5br07OJ3DQ?authuser=0&hl=en&rclk=1,"25.0688019,55.132179"
Grand Bur Dubai Masjid,Mosque,"Grand Bur Dubai Masjid, Opposite Dubai Museum, Near Rulers Court Office - 67 Ali Bin Abi Taleb St - Al Fahidi - Dubai - United Arab Emirates",Al Fahidi,"Opposite Dubai Museum, Near Rulers Court Office - 67 Ali Bin Abi Taleb St",,,Dubai,AE,https://www.google.com/maps/place/Grand+Bur+Dubai+Masjid/data=!4m7!3m6!1s0x3e5f433f5921f237:0x6b68650c184f1625!8m2!3d25.2642259!4d55.2967248!16zL20vMDYxNTJy!19sChIJN_IhWT9DXz4RJRZPGAxlaGs?authuser=0&hl=en&rclk=1,"25.2642259,55.2967248"
Shahi Atala Masjid,Mosque,"Shahi Atala Masjid, SS Rd, Rizwikhan, Jaunpur, Uttar Pradesh 222001",Rizwikhan,SS Rd,Jaunpur,222001,Uttar Pradesh,IN,https://www.google.com/maps/place/Shahi+Atala+Masjid/data=!4m7!3m6!1s0x39903bd2be2fb93d:0xc3ec3622a3168aea!8m2!3d25.7527555!4d82.6905751!16s%2Fm%2F06_wgsb!19sChIJPbkvvtI7kDkR6ooWoyI27MM?authuser=0&hl=en&rclk=1,"25.7527555,82.69057509999999"
Ismail Habib Sunni Masjid sm`yl Hbyb sunWy msjd,Mosque,"Ismail Habib Sunni Masjid sm`yl Hbyb sunWy msjd, Kambekar St, Pydhonie, Mandvi, Mumbai, Maharashtra 400003","Pydhonie, Mandvi",Kambekar St,Mumbai,400003,Maharashtra,IN,https://www.google.com/maps/place/Ismail+Habib+Sunni+Masjid+%D8%A7%D8%B3%D9%85%D8%A7%D8%B9%DB%8C%D9%84+%D8%AD%D8%A8%DB%8C%D8%A8+%D8%B3%D9%8F%D9%86%D9%91%DB%8C+%D9%85%D8%B3%D8%AC%D8%AF%E2%80%AD/data=!4m7!3m6!1s0x3be7ce3caa612795:0xa0c457cfe4dc30c5!8m2!3d18.954708!4d72.8338938!16s%2Fg%2F1wk7pbbm!19sChIJlSdhqjzO5zsRxTDc5M9XxKA?authuser=0&hl=en&rclk=1,"18.954708,72.8338938"
Jama Masjid,Mosque,"Jama Masjid, ketra,Highway 51, Imambara Rd, Daulatganj, Lucknow, Uttar Pradesh 226003","Tahseen Ganj, Daulatganj","ketra,Highway 51, Imambara Rd",Lucknow,226003,Uttar Pradesh,IN,https://www.google.com/maps/place/Jama+Masjid/data=!4m7!3m6!1s0x399bfdfdced545e1:0x7c37141f81dbd6ab!8m2!3d26.8728697!4d80.9010082!16s%2Fg%2F11g8vvd7_h!19sChIJ4UXVzv39mzkRq9bbgR8UN3w?authuser=0&hl=en&rclk=1,"26.8728697,80.90100819999999"
Jama Masjid Shamsi jm` msjd shmsy,Mosque,"24QC+FMQ Jama Masjid Shamsi jm` msjd shmsy, Molvi Tola, Budaun, Uttar Pradesh 243601",Molvi Tola,24QC+FMQ,Budaun,243601,Uttar Pradesh,IN,https://www.google.com/maps/place/Jama+Masjid+Shamsi+%D8%AC%D8%A7%D9%85%D8%B9+%D9%85%D8%B3%D8%AC%D8%AF+%D8%B4%D9%85%D8%B3%DB%8C%E2%80%AD/data=!4m7!3m6!1s0x397545ef82cf8fa3:0x850fadc4472fa2e7!8m2!3d28.0386803!4d79.1219285!16s%2Fg%2F11bwjc_06v!19sChIJo4_Pgu9FdTkR56IvR8StD4U?authuser=0&hl=en&rclk=1,"28.0386803,79.1219285"
Jama Masjid Shamsi jm` msjd shmsy,Mosque,"24QC+FMQ Jama Masjid Shamsi jm` msjd shmsy, Molvi Tola, Budaun, Uttar Pradesh 243601",Molvi Tola,24QC+FMQ,Budaun,243601,Uttar Pradesh,IN,https://www.google.com/maps/place/Jama+Masjid+Shamsi+%D8%AC%D8%A7%D9%85%D8%B9+%D9%85%D8%B3%D8%AC%D8%AF+%D8%B4%D9%85%D8%B3%DB%8C%E2%80%AD/data=!4m7!3m6!1s0x397545ef82cf8fa3:0x850fadc4472fa2e7!8m2!3d28.0386803!4d79.1219285!16s%2Fg%2F11bwjc_06v!19sChIJo4_Pgu9FdTkR56IvR8StD4U?authuser=0&hl=en&rclk=1,"28.0386803,79.1219285"
Masjid Annur Islamic Center,Mosque,"Masjid Annur Islamic Center, 6990 65th St, Sacramento, CA 95823, United States",,6990 65th St,Sacramento,95823,California,US,"https://www.google.com/maps/place/Masjid+Annur+Islamic+Center/@38.4997056,-121.4394913,17z/data=!3m1!4b1!4m6!3m5!1s0x809ac564f3a72971:0xbbdea02a9df96322!8m2!3d38.4997056!4d-121.4394913!16s%2Fm%2F0cc8xb6?authuser=0&entry=ttu","38.4997056,-121.4394913"
Faizane Madina Dawate Islami,Mosque,"7M45+H3R Faizane Madina Dawate Islami, Kodki Rd, Dhara Nagar, Ravalvadi, Bhuj, Gujarat 370001","Dhara Nagar, Ravalvadi","7M45+H3R, Kodki Rd",Bhuj,370001,Gujarat,IN,https://www.google.com/maps/place/Faizane+Madina+Dawate+Islami/data=!4m7!3m6!1s0x39511dfcb1dfe557:0x1e8701e5c6d6085e!8m2!3d23.2564805!4d69.6576495!16s%2Fg%2F11cs18g46y!19sChIJV-XfsfwdUTkRXgjWxuUBhx4?authuser=0&hl=en&rclk=1,"23.2564805,69.65764949999999"
Natunnagar Jaame Masjid,Mosque,"Natunnagar Jaame Masjid, Natun Nagar Ln, Sarkarpool, Natun Nagar, Benepukur, Maheshtala, West Bengal 700088","Sarkarpool, Natun Nagar, Benepukur",Natun Nagar Ln,Maheshtala,700088,West Bengal,IN,https://www.google.com/maps/place/Natunnagar+Jaame+Masjid/data=!4m7!3m6!1s0x3a027987894b3b19:0xce5dda96002bd8d8!8m2!3d22.5158626!4d88.2931633!16s%2Fg%2F11c4sbxnnp!19sChIJGTtLiYd5AjoR2NgrAJbaXc4?authuser=0&hl=en&rclk=1,"22.5158626,88.29316329999999"
Jama Masjid Thakurganj,Mosque,"Jama Masjid Thakurganj, Main Road, Thakurganj, Bihar 855116",,Main Road,Thakurganj,855116,Bihar,IN,https://www.google.com/maps/place/Jama+Masjid+Thakurganj/data=!4m7!3m6!1s0x39e5aa8ae660f98f:0xef341f963f1a8de5!8m2!3d26.4290962!4d88.1310939!16s%2Fg%2F11cjj9bxb7!19sChIJj_lg5oqq5TkR5Y0aP5YfNO8?authuser=0&hl=en&rclk=1,"26.4290962,88.1310939"
Tntj thanjai managara kilai marcus & maryam (alai) women islamic college,Mosque,"Q4QW+F2Q Tntj thanjai managara kilai marcus & maryam (alai) women islamic college, S.N.M Rahman Nagar, Maharnonbu Chavadi, Thanjavur, Tamil Nadu 613001","S.N.M Rahman Nagar, Maharnonbu Chavadi",Q4QW+F2Q,Thanjavur,613001,Tamil Nadu,IN,https://www.google.com/maps/place/Tntj+thanjai+managara+kilai+marcus+%26+maryam+%28alai%29+women+islamic+college/data=!4m7!3m6!1s0x3baab8827a80cd2d:0x3fccb9bab6249e1d!8m2!3d10.7887147!4d79.1451135!16s%2Fg%2F11c1t5rr_7!19sChIJLc2AeoK4qjsRHZ4ktrq5zD8?authuser=0&hl=en&rclk=1,"10.7887147,79.1451135"
Shahi Masjid Pandara road,Mosque,"Shahi Masjid Pandara road, Pandara Rd, Khan Market, India Gate, New Delhi, Delhi 110003","Khan Market, India Gate",Pandara Rd,New Delhi,110003,Delhi,IN,https://www.google.com/maps/place/Shahi+Masjid+Pandara+road/data=!4m7!3m6!1s0x390ce3f402cc5d9f:0xde27f09c19401e3b!8m2!3d28.6025278!4d77.2307879!16s%2Fg%2F11t_rmp36f!19sChIJn13MAvTjDDkROx5AGZzwJ94?authuser=0&hl=en&rclk=1,"28.602527799999997,77.2307879"
Pachur Mondal Para Ahle- Hadees Jame Masjid,Mosque,"G7QC+33F Pachur Mondal Para Ahle- Hadees Jame Masjid, Panchur Mondal Para, Panchur Mauza, Metiabruz, Maheshtala, West Bengal 700018","Thanderpara Basti, Metiabruz","G7QC+33F, Panchur Mondal Para, Panchur Mauza",Maheshtala,700018,West Bengal,IN,https://www.google.com/maps/place/Pachur+Mondal+Para+Ahle-+Hadees+Jame+Masjid/data=!4m7!3m6!1s0x3a02796b5e7137a7:0xff3fe27524830c63!8m2!3d22.5376896!4d88.2701831!16s%2Fg%2F11b_22x8bg!19sChIJpzdxXmt5AjoRYwyDJHXiP_8?authuser=0&hl=en&rclk=1,"22.5376896,88.2701831"
Masjid e Faizan e Jamal e Mustafa,Mosque,"W95C+3FM Masjid e Faizan e Jamal e Mustafa, Viraval Village, Veraval, Gujarat 362265",Viraval Village,W95C+3FM,Veraval,362265,Gujarat,IN,https://www.google.com/maps/place/Masjid+e+Faizan+e+Jamal+e+Mustafa/data=!4m7!3m6!1s0x3bfd324350478ecf:0xcbf6a803caf99135!8m2!3d20.9077053!4d70.3711666!16s%2Fg%2F11hc_prlnt!19sChIJz45HUEMy_TsRNZH5ygOo9ss?authuser=0&hl=en&rclk=1,"20.9077053,70.3711666"
Tauhid Masjid,Mosque,"Tauhid Masjid, Pathan, Nani Poshad Gali Rd, Bhuj, Gujarat 370001","Camp Area, Jestha Nagar","Pathan, Nani Poshad Gali Rd",Bhuj,370001,Gujarat,IN,https://www.google.com/maps/place/Tauhid+Masjid/data=!4m7!3m6!1s0x3950e1fba5a1b503:0xfb0cf6f8e9f88fb3!8m2!3d23.2460575!4d69.6772095!16s%2Fg%2F11b8_qyk9f!19sChIJA7WhpfvhUDkRs4_46fj2DPs?authuser=0&hl=en&rclk=1,"23.2460575,69.6772095"
Purani Masjid,Mosque,"Purani Masjid, Veer Vinay Charaha, Alijanpurva, Balrampur, Uttar Pradesh 271201",Alijanpurva,Veer Vinay Charaha,Balrampur,271201,Uttar Pradesh,IN,https://www.google.com/maps/place/Purani+Masjid/data=!4m7!3m6!1s0x3999d9021541766f:0xcb4004a3ce040231!8m2!3d27.4303592!4d82.1811616!16s%2Fg%2F11fzfblg9_!19sChIJb3ZBFQLZmTkRMQIEzqMEQMs?authuser=0&hl=en&rclk=1,"27.430359199999998,82.1811616"
Purani Masjid,Mosque,"Purani Masjid, Veer Vinay Charaha, Alijanpurva, Balrampur, Uttar Pradesh 271201",Alijanpurva,Veer Vinay Charaha,Balrampur,271201,Uttar Pradesh,IN,https://www.google.com/maps/place/Purani+Masjid/data=!4m7!3m6!1s0x3999d9021541766f:0xcb4004a3ce040231!8m2!3d27.4303592!4d82.1811616!16s%2Fg%2F11fzfblg9_!19sChIJb3ZBFQLZmTkRMQIEzqMEQMs?authuser=0&hl=en&rclk=1,"27.430359199999998,82.1811616"
Masjid-e-darul islam Ahle Hadees,Mosque,"Masjid-e-darul islam Ahle Hadees, 42/43 DWARKADHEESH NAGAR ,KORIT ROAD, Korit Rd, Swami Samartha Nagar, Nandurbar, Maharashtra 425412",Swami Samartha Nagar,"42/43 DWARKADHEESH NAGAR ,KORIT ROAD, Korit Rd",Nandurbar,425412,Maharashtra,IN,https://www.google.com/maps/place/Masjid-e-darul+islam+Ahle+Hadees/data=!4m7!3m6!1s0x3bdf098e66d75ba9:0xb9df4de5a30f6a4d!8m2!3d21.3787825!4d74.2485425!16s%2Fg%2F11bwy_7v__!19sChIJqVvXZo4J3zsRTWoPo-VN37k?authuser=0&hl=en&rclk=1,"21.3787825,74.2485425"
"Ghausia Masjid, Jasola",Mosque,"Ghausia Masjid, Jasola, 171, Jasola, Jasola Vihar, New Delhi, Delhi 110025","Jasola, Jasola Vihar",171,New Delhi,110025,Delhi,IN,"https://www.google.com/maps/place/Ghausia+Masjid,+Jasola/data=!4m7!3m6!1s0x390ce5c200a37205:0xfebb591e8a3c8619!8m2!3d28.5488829!4d77.2921906!16s%2Fg%2F11nl7bc3f7!19sChIJBXKjAMLlDDkRGYY8ih5Zu_4?authuser=0&hl=en&rclk=1","28.5488829,77.2921906"
Masjid E Iqra,Mosque,"Masjid E Iqra, near muskaan nagar, Mustafa Nagar, Ravalvadi, Bhuj, Gujarat 370001","Mustafa Nagar, Ravalvadi",near muskaan nagar,Bhuj,370001,Gujarat,IN,https://www.google.com/maps/place/Masjid+E+Iqra/data=!4m7!3m6!1s0x39511dfd94add0bd:0x71d9b94609c91144!8m2!3d23.2616624!4d69.6601073!16s%2Fg%2F11g8cpflty!19sChIJvdCtlP0dUTkRRBHJCUa52XE?authuser=0&hl=en&rclk=1,"23.2616624,69.66010729999999"
Masjid E Umar,Mosque,"Masjid E Umar, Chuli ki Bageechi Rd, Mahukalan, Gangapur, Rajasthan 322201",Mahukalan,Chuli ki Bageechi Rd,Gangapur,322201,Rajasthan,IN,https://www.google.com/maps/place/Masjid+E+Umar/data=!4m7!3m6!1s0x3971f6ac56d4550d:0xbf58ffb200ed12e1!8m2!3d26.4600719!4d76.7248563!16s%2Fg%2F1hm20qcd1!19sChIJDVXUVqz2cTkR4RLtALL_WL8?authuser=0&hl=en&rclk=1,"26.4600719,76.7248563"
"Faizan-E-madina Adoni, dawateislami",Mosque,"J7MQ+XCW Faizan-E-madina Adoni, dawateislami, Shair Khan Colony, Adoni, Andhra Pradesh 518301",Shair Khan Colony,J7MQ+XCW,Adoni,518301,Andhra Pradesh,IN,"https://www.google.com/maps/place/Faizan-E-madina+Adoni,+dawateislami/data=!4m7!3m6!1s0x3bb64f95310da953:0x6dbec7cb985bd5ea!8m2!3d15.6349778!4d77.2885773!16s%2Fg%2F11gnpkbm_1!19sChIJU6kNMZVPtjsR6tVbmMvHvm0?authuser=0&hl=en&rclk=1","15.6349778,77.2885773"
Dargah Sharif Hazrat Syed Mohammed Diwan Sha Qadri R.A,Mosque,"F43W+49P Dargah Sharif Hazrat Syed Mohammed Diwan Sha Qadri R.A, old main bazzer, Betamcherla, Andhra Pradesh 518599",,"F43W+49P, old main bazzer",Betamcherla,,Andhra Pradesh,IN,https://www.google.com/maps/place/Dargah+Sharif+Hazrat+Syed+Mohammed+Diwan+Sha+Qadri+R.A/data=!4m7!3m6!1s0x3bb433f3c5b84137:0x9c6b60b411e1ab03!8m2!3d15.4528286!4d78.1459526!16s%2Fg%2F11h2hftljg!19sChIJN0G4xfMztDsRA6vhEbRga5w?authuser=0&hl=en&rclk=1,"15.4528286,78.1459526"
MADRASA ARABIA DARUL QURAN AND JAMIA MOSQUE,Mosque,"8MJ9+52J MADRASA ARABIA DARUL QURAN AND JAMIA MOSQUE, VILLAGE AND P.O EAST DWIPOR PAR ,P.S TUFANGANJ DISTRICT WEST BENGAL, Tufanganj, West Bengal 736131",Suknirpar Dham,"8MJ9+52J, VILLAGE AND P.O EAST DWIPOR PAR ,P.S TUFANGANJ DISTRICT WEST BENGAL","Tufanganj, Andaran Phulbari",736131,West Bengal,IN,https://www.google.com/maps/place/MADRASA+ARABIA+DARUL+QURAN+AND+JAMIA+MOSQUE/data=!4m7!3m6!1s0x39e2f4815555553b:0x140649ad9afd2396!8m2!3d26.330464!4d89.667514!16s%2Fg%2F11b8_s89wj!19sChIJO1VVVYH04jkRliP9mq1JBhQ?authuser=0&hl=en&rclk=1,"26.330464,89.667514"
MASJID E FATIMA,Mosque,"MASJID E FATIMA, 586101, Ward Number 28, green park naubag, Vijayapura, Karnataka 586101",Saquaf Roza,"586101, Ward Number 28, green park naubag",Vijayapura,586101,Karnataka,IN,https://www.google.com/maps/place/MASJID+E+FATIMA/data=!4m7!3m6!1s0x3bc655fc5bf70f9f:0x8298d03e34e3a832!8m2!3d16.8210781!4d75.7120351!16s%2Fg%2F11h21zdhb8!19sChIJnw_3W_xVxjsRMqjjND7QmII?authuser=0&hl=en&rclk=1,"16.821078099999998,75.7120351"
Ajmeri Gate Extn. Post Office,Post office,"J6VH+CFQ Ajmeri Gate Extn. Post Office, Asaf Ali Rd, behind LIC Building, Kalyanpura, Ajmeri Gate, New Delhi, Delhi, 110002","Kalyanpura, Ajmeri Gate","J6VH+CFQ, Asaf Ali Rd, behind LIC Building","New Delhi, Delhi",110002,Delhi,IN,https://www.google.com/maps/place/Ajmeri+Gate+Extn.+Post+Office/data=!4m7!3m6!1s0x390cfd3ccddaf199:0x862d5a12d033d8e2!8m2!3d28.6435983!4d77.2287194!16s%2Fg%2F12mkz5_5r!19sChIJmfHazTz9DDkR4tgz0BJaLYY?authuser=0&hl=en&rclk=1,"28.643598299999997,77.2287194"
Madrasa e Gausia,Place of worship,"Madrasa e Gausia, 110091, Patparganj, New Delhi, Delhi","Patparganj, Mayur Vihar",110091,"New Delhi, Delhi",,Delhi,IN,https://www.google.com/maps/place/Madrasa+e+Gausia/data=!4m7!3m6!1s0x390ce4a3f0f0ea87:0x85582ea65df38387!8m2!3d28.6128493!4d77.2930797!16s%2Fg%2F11f120vryt!19sChIJh-rw8KPkDDkRh4PzXaYuWIU?authuser=0&hl=en&rclk=1,"28.612849299999997,77.29307969999999"
MUHAMMADIYA MASJID (Ahle Hadees),Mosque,"MUHAMMADIYA MASJID (Ahle Hadees), 586101, Ward Number 28, Saquaf Roza, Vijayapura, Karnataka 586101","Ward Number 28, Saquaf Roza",586101,Vijayapura,586101,Karnataka,IN,https://www.google.com/maps/place/MUHAMMADIYA+MASJID+%28Ahle+Hadees%29/data=!4m7!3m6!1s0x3bc65582174626ab:0xe03bd76635353efd!8m2!3d16.8226649!4d75.7150118!16s%2Fg%2F11h21zf5qh!19sChIJqyZGF4JVxjsR_T41NWbXO-A?authuser=0&hl=en&rclk=1,"16.8226649,75.7150118"
Tomb & Mosque of Pir Turkman,Mosque,"24Q2+XC8 Tomb & Mosque of Pir Turkman, Mohalla Chaudhrian, Narnaul, Haryana 123001",Mohalla Chaudhrian,24Q2+XC8,Narnaul,123001,Haryana,IN,https://www.google.com/maps/place/Tomb+%26+Mosque+of+Pir+Turkman/data=!4m7!3m6!1s0x3912b5a05684ed13:0xbfd4bf44af2d6fac!8m2!3d28.0399101!4d76.101074!16s%2Fg%2F11jg059wj9!19sChIJE-2EVqC1EjkRrG8tr0S_1L8?authuser=0&hl=en&rclk=1,"28.0399101,76.101074"
Masjid Abu bakar R.z Ahle Hadees,Mosque,"Masjid Abu bakar R.z Ahle Hadees, G.336 Juma bazar Road, Shaheed Nagar, Ghaziabad, Uttar Pradesh 201005",Shaheed Nagar,G.336 Juma bazar Road,Ghaziabad,201005,Uttar Pradesh,IN,https://www.google.com/maps/place/Masjid+Abu+bakar+R.z+Ahle+Hadees/data=!4m7!3m6!1s0x390cfb8374f606bb:0x8cdb3f4f490e4a2e!8m2!3d28.6806126!4d77.3359288!16s%2Fg%2F11h1pdqs72!19sChIJuwb2dIP7DDkRLkoOSU8_24w?authuser=0&hl=en&rclk=1,"28.6806126,77.33592879999999"
Masjid ikhlas,Mosque,"Masjid ikhlas, Madarsa Salfiya, Dussehra Maidan Rd, Ward Number 28, Bharat Mill Colony, Gangapur, Rajasthan 322201","Ward Number 28, Bharat Mill Colony","Madarsa Salfiya, Dussehra Maidan Rd",Gangapur,322201,Rajasthan,IN,https://www.google.com/maps/place/Masjid+ikhlas/data=!4m7!3m6!1s0x3971f7d1455bf22f:0x8a45d986d5be1a29!8m2!3d26.4783906!4d76.7243844!16s%2Fg%2F11hmgr196c!19sChIJL_JbRdH3cTkRKRq-1YbZRYo?authuser=0&hl=en&rclk=1,"26.478390599999997,76.72438439999999"
Tawar wali glii Alvi Home,Mosque,"7PHG+8CV Tawar wali glii Alvi Home, Shivpuri, Khatauli, Uttar Pradesh 251201",Shivpuri,7PHG+8CV,Khatauli,251201,Uttar Pradesh,IN,https://www.google.com/maps/place/Tawar+wali+%E0%A4%97%E0%A4%B2%E0%A5%80+Alvi+Home/data=!4m7!3m6!1s0x390c132b5a329021:0x1a329879d3c11b89!8m2!3d29.2782672!4d77.7261532!16s%2Fg%2F11rvlql_dy!19sChIJIZAyWisTDDkRiRvB03mYMho?authuser=0&hl=en&rclk=1,"29.2782672,77.7261532"
Ahmadiya Masjid Nagla Ghanu,Mosque,"G37C+Q4Q Ahmadiya Masjid Nagla Ghanu, Kukrayan Ratanpur, Uttar Pradesh 207249",,G37C+Q4Q,Kukrayan Ratanpur,207249,Uttar Pradesh,IN,https://www.google.com/maps/place/Ahmadiya+Masjid+Nagla+Ghanu/data=!4m7!3m6!1s0x397575f7d44bf2d1:0x18181616346b029c!8m2!3d27.5144566!4d79.0703533!16s%2Fg%2F11fn049_4t!19sChIJ0fJL1Pd1dTkRnAJrNBYWGBg?authuser=0&hl=en&rclk=1,"27.5144566,79.0703533"
Appayan Sweets,Sweet shop,"228, Appayan Sweets, Ground Floor, opposite Kabristan Masjid, Anand Vihar, Patparganj, New Delhi, Ghaziabad, Delhi 110091","Anand Vihar, Patparganj","228, Ground Floor, opposite Kabristan Masjid","New Delhi, Ghaziabad",110091,Delhi,IN,https://www.google.com/maps/place/Appayan+Sweets/data=!4m7!3m6!1s0x390cfb1cf88bc0d5:0x4874c967cf267718!8m2!3d28.6422112!4d77.3198673!16s%2Fg%2F11v0rh_rst!19sChIJ1cCL-Bz7DDkRGHcmz2fJdEg?authuser=0&hl=en&rclk=1,"28.6422112,77.3198673"
Baghdadi Masjid,Mosque,"Baghdadi Masjid, Wager Pachado, Mota Salaya, Mandvi, Gujarat 370465",Mota Salaya,Wager Pachado,Mandvi,370465,Gujarat,IN,https://www.google.com/maps/place/Baghdadi+Masjid/data=!4m7!3m6!1s0x3951359091b038a7:0xc44096dbaf55c9ac!8m2!3d22.8239851!4d69.3574307!16s%2Fg%2F11n5j4b_jn!19sChIJpziwkZA1UTkRrMlVr9uWQMQ?authuser=0&hl=en&rclk=1,"22.823985099999998,69.3574307"
khatkiwad MASJID Gandevi (Masjid e ayesha),Mosque,"khatkiwad MASJID Gandevi (Masjid e ayesha), Khatkaiwad naka, Torangam Rd, Gandevi, Gujarat 396360",,"Khatkaiwad naka, Torangam Rd",Gandevi,396360,Gujarat,IN,https://www.google.com/maps/place/khatkiwad+MASJID+Gandevi+%28Masjid+e+ayesha%29/data=!4m7!3m6!1s0x3be0f3c8589c61c7:0x6694e04794c20828!8m2!3d20.8136848!4d72.9949436!16s%2Fg%2F11fssxfzbv!19sChIJx2GcWMjz4DsRKAjClEfglGY?authuser=0&hl=en&rclk=1,"20.8136848,72.9949436"
MASJID A NOOR,Mosque,"62QG+HW3 MASJID A NOOR, Ullapalem Rd, Pakir Palem, Singarayakonda, Andhra Pradesh 523101",Pakir Palem,"62QG+HW3, Ullapalem Rd",Singarayakonda,523101,Andhra Pradesh,IN,https://www.google.com/maps/place/MASJID+A+NOOR/data=!4m7!3m6!1s0x3a4b0bec54c75319:0x786b0105345259fa!8m2!3d15.2388856!4d80.0273028!16s%2Fg%2F11g0mkh90x!19sChIJGVPHVOwLSzoR-llSNAUBa3g?authuser=0&hl=en&rclk=1,"15.2388856,80.0273028"
masjid alzzid salempur,Sauna,"masjid alzzid salempur, salempur, Gangapur, Rajasthan 322202",Karamchari Colony,salempur,Gangapur,322202,Rajasthan,IN,https://www.google.com/maps/place/masjid+alzzid+salempur/data=!4m7!3m6!1s0x3971f7125042ff6b:0x75ea6c89c10f915f!8m2!3d26.4846537!4d76.7278803!16s%2Fg%2F11pclhf6tz!19sChIJa_9CUBL3cTkRX5EPwYls6nU?authuser=0&hl=en&rclk=1,"26.4846537,76.7278803"
Fatima masjid nakur saharanpur,Mosque,"Fatima masjid nakur saharanpur, Fatima masjid, Nakur, Uttar Pradesh 247342",,Fatima masjid,Nakur,247342,Uttar Pradesh,IN,https://www.google.com/maps/place/Fatima+masjid+nakur+saharanpur/data=!4m7!3m6!1s0x390ef356357f6441:0x67a347c1efafd37b!8m2!3d29.917607!4d77.3098486!16s%2Fg%2F11tn6l039c!19sChIJQWR_NVbzDjkRe9Ov78FHo2c?authuser=0&hl=en&rclk=1,"29.917607,77.3098486"
