name,main_category,address,address_ward,address_street,address_city,address_postal_code,address_state,address_country_code,link,coordinates
Jama Masjid,Mosque,"Jama Masjid, Old Delhi, Delhi, 110006","Jama Masjid, Old Delhi",,Delhi,110006,Delhi,IN,https://www.google.com/maps/place/Jama+Masjid/data=!4m7!3m6!1s0x390cfd18df89b215:0xdd57369e29bf9d96!8m2!3d28.6506792!4d77.2334421!16zL20vMDR5emo1!19sChIJFbKJ3xj9DDkRlp2_KZ42V90?authuser=0&hl=en&rclk=1,"28.6506792,77.23344209999999"
Jama Masjid,Mosque,"Jama Masjid, Old Delhi, Delhi, 110006","Jama Masjid, Old Delhi",,Delhi,110006,Delhi,IN,https://www.google.com/maps/place/Jama+Masjid/data=!4m7!3m6!1s0x390cfd18df89b215:0xdd57369e29bf9d96!8m2!3d28.6506792!4d77.2334421!16zL20vMDR5emo1!19sChIJFbKJ3xj9DDkRlp2_KZ42V90?authuser=0&hl=en&rclk=1,"28.6506792,77.23344209999999"
Jama Masjid,Mosque,"Jama Masjid, Old Delhi, Delhi, 110006","Jama Masjid, Old Delhi",,Delhi,110006,Delhi,IN,https://www.google.com/maps/place/Jama+Masjid/data=!4m7!3m6!1s0x390cfd18df89b215:0xdd57369e29bf9d96!8m2!3d28.6506792!4d77.2334421!16zL20vMDR5emo1!19sChIJFbKJ3xj9DDkRlp2_KZ42V90?authuser=0&hl=en&rclk=1,"28.6506792,77.23344209999999"
Jama Masjid,Mosque,"Jama Masjid, Old Delhi, Delhi, 110006","Jama Masjid, Old Delhi",,Delhi,110006,Delhi,IN,https://www.google.com/maps/place/Jama+Masjid/data=!4m7!3m6!1s0x390cfd18df89b215:0xdd57369e29bf9d96!8m2!3d28.6506792!4d77.2334421!16zL20vMDR5emo1!19sChIJFbKJ3xj9DDkRlp2_KZ42V90?authuser=0&hl=en&rclk=1,"28.6506792,77.23344209999999"
Ullal Juma Masjid (402) & Sayed Muhammad Shareeful Madani Dargah (Ullal Darga),Mosque,"RRCR+GJQ Ullal Juma Masjid (402) & Sayed Muhammad Shareeful Madani Dargah (Ullal Darga), Ullal Darga Road, Dakshina Kannada, Mangalore, Ullal, Karnataka 575020",,"RRCR+GJQ, Ullal Darga Road, Dakshina Kannada, Mangalore",Ullal,575020,Karnataka,IN,https://www.google.com/maps/place/Ullal+Juma+Masjid+%28402%29+%26+Sayed+Muhammad+Shareeful+Madani+Dargah+%28Ullal+Darga%29/data=!4m7!3m6!1s0x3ba35b88165b85f5:0x596add01818f2839!8m2!3d12.8197766!4d74.8473309!16s%2Fg%2F1tdxcqc7!19sChIJ9YVbFohbozsROSiPgQHdalk?authuser=0&hl=en&rclk=1,"12.819776599999999,74.8473309"
Jamia Millia Islamia Central Mosque - jm` msjdi jm`h mlyh slmyh,Mosque,"Jamia Millia Islamia Central Mosque - jm` msjdi jm`h mlyh slmyh, Maulana Mohammad Ali Jauhar Marg, Jamia Millia Islamia, Jamia Nagar, Okhla, New Delhi, Delhi 110025","Jamia Millia Islamia, Jamia Nagar, Okhla",Maulana Mohammad Ali Jauhar Marg,New Delhi,110025,Delhi,IN,https://www.google.com/maps/place/Jamia+Millia+Islamia+Central+Mosque+-+%D8%AC%D8%A7%D9%85%D8%B9+%D9%85%D8%B3%D8%AC%D8%AF%D9%90+%D8%AC%D8%A7%D9%85%D8%B9%DB%81+%D9%85%D9%84%DB%8C%DB%81+%D8%A7%D8%B3%D9%84%D8%A7%D9%85%DB%8C%DB%81%E2%80%AD/data=!4m7!3m6!1s0x390ce38b112f4ff9:0xb882674201afdc30!8m2!3d28.5625429!4d77.2826111!16s%2Fg%2F1hhjtj1db!19sChIJ-U8vEYvjDDkRMNyvAUJngrg?authuser=0&hl=en&rclk=1,"28.5625429,77.2826111"
Haveli Dharampura,Hotel,"Haveli Dharampura, Haveli Dharampura, 2293, Gali Gulian, Chandni Chowk, New Delhi, Delhi 110006","Kucha Alam, Chandni Chowk","Haveli Dharampura, 2293, Gali Gulian, Chandni Chowk","New Delhi, Delhi",110006,Delhi,IN,https://www.google.com/maps/place/Haveli+Dharampura/data=!4m10!3m9!1s0x390cfd197dd6fb4b:0x749b9a5abf91404b!5m2!4m1!1i2!8m2!3d28.6533046!4d77.2322728!16s%2Fg%2F11g0289gzb!19sChIJS_vWfRn9DDkRS0CRv1qam3Q?authuser=0&hl=en&rclk=1,"28.6533046,77.23227279999999"
Markaz Masjid Calicut,Mosque,"Markaz Masjid Calicut, Markaz Masjid Complex, A31, Jaffer Khan Colony Rd, Opposite New Bus Stand, Arayidathupalam, Kozhikode, Kerala 673004","Opposite New Bus Stand, Arayidathupalam","Markaz Masjid Complex, A31, Jaffer Khan Colony Rd",Kozhikode,673004,Kerala,IN,https://www.google.com/maps/place/Markaz+Masjid+Calicut/data=!4m7!3m6!1s0x3ba65948edf933b7:0x15872d873b72d302!8m2!3d11.260157!4d75.7873302!16s%2Fg%2F11cjkhwkkz!19sChIJtzP57UhZpjsRAtNyO4cthxU?authuser=0&hl=en&rclk=1,"11.260157,75.7873302"
Jama Masjid,Mosque,"Jama Masjid, ketra,Highway 51, Imambara Rd, Daulatganj, Lucknow, Uttar Pradesh 226003","Tahseen Ganj, Daulatganj","ketra,Highway 51, Imambara Rd",Lucknow,226003,Uttar Pradesh,IN,https://www.google.com/maps/place/Jama+Masjid/data=!4m7!3m6!1s0x399bfdfdced545e1:0x7c37141f81dbd6ab!8m2!3d26.8728697!4d80.9010082!16s%2Fg%2F11g8vvd7_h!19sChIJ4UXVzv39mzkRq9bbgR8UN3w?authuser=0&hl=en&rclk=1,"26.8728697,80.90100819999999"
Ishaat e Islam Masjid - sh`t  slm msjd,Mosque,"Ishaat e Islam Masjid - sh`t  slm msjd, Ishat E Islam, Hari Kothi Rd, Abul Fazal Enclave Part 1, Abul Fazal Enclave, Jamia Nagar, Okhla, New Delhi, Delhi 110025","Abul Fazal Enclave Part 1, Abul Fazal Enclave, Jamia Nagar, Okhla","Ishat E Islam, Hari Kothi Rd",New Delhi,110025,Delhi,IN,https://www.google.com/maps/place/Ishaat+e+Islam+Masjid+-+%D8%A7%D8%B4%D8%A7%D8%B9%D8%AA+%D8%A1+%D8%A7%D8%B3%D9%84%D8%A7%D9%85+%D9%85%D8%B3%D8%AC%D8%AF%E2%80%AD/data=!4m7!3m6!1s0x390ce40c2ff9b231:0x608aa5b5af203426!8m2!3d28.5567717!4d77.2942062!16s%2Fg%2F1tvt8qxd!19sChIJMbL5LwzkDDkRJjQgr7WlimA?authuser=0&hl=en&rclk=1,"28.5567717,77.29420619999999"
Jama Masjid (Okhla),Mosque,"Jama Masjid (Okhla), 21/4,Okhla Bazar, Okhla Main Market Rd, Jamia Nagar, Okhla Village, Okhla, New Delhi, Delhi 110025","Jamia Nagar, Okhla Village, Okhla","21/4,Okhla Bazar, Okhla Main Market Rd",New Delhi,110025,Delhi,IN,https://www.google.com/maps/place/Jama+Masjid+%28Okhla%29/data=!4m7!3m6!1s0x390ce474e657e7f9:0x9680577c25554efa!8m2!3d28.5631627!4d77.2900565!16s%2Fg%2F1tk6ywjp!19sChIJ-edX5nTkDDkR-k5VJXxXgJY?authuser=0&hl=en&rclk=1,"28.5631627,77.29005649999999"
Kevada Mosque,Mosque,"FGQM+PCF Kevada Mosque, Champaner, Gujarat 389360",,FGQM+PCF,Champaner,389360,Gujarat,IN,https://www.google.com/maps/place/Kevada+Mosque/data=!4m7!3m6!1s0x39607e4259ecf00b:0x1212f88fd43f0d5a!8m2!3d22.4893145!4d73.5335403!16s%2Fm%2F0n47wzv!19sChIJC_DsWUJ-YDkRWg0_1I_4EhI?authuser=0&hl=en&rclk=1,"22.4893145,73.5335403"
Mubarak Mosque,Mosque,"R99G+8R2 Mubarak Mosque, Main Bazaar Gali, Ahmadiyya Mohalla, Hindu Mohalla, Qadian, Punjab 143516","Ahmadiyya Mohalla, Hindu Mohalla","R99G+8R2, Main Bazaar Gali",Qadian,143516,Punjab,IN,https://www.google.com/maps/place/Mubarak+Mosque/data=!4m7!3m6!1s0x391bbf0631c602c9:0x71e4eea5ad03db95!8m2!3d31.8182666!4d75.3770272!16s%2Fm%2F04f3rvd!19sChIJyQLGMQa_GzkRldsDraXu5HE?authuser=0&hl=en&rclk=1,"31.818266599999998,75.3770272"
"Nayapara Masjid msjd, Goalpara Nayapara",Mosque,"5JHF+6V7 Nayapara Masjid msjd, Goalpara Nayapara, Agia Rd, Goalpara, Assam 783101",,"5JHF+6V7, Agia Rd",Goalpara,783101,Assam,IN,"https://www.google.com/maps/place/Nayapara+Masjid+%D9%85%D8%B3%D8%AC%D8%AF,+Goalpara+Nayapara%E2%80%AD/data=!4m7!3m6!1s0x3759b31e9af54555:0x85acf8c7bcd42c5e!8m2!3d26.178028!4d90.6246729!16s%2Fg%2F1hc3kg8cs!19sChIJVUX1mh6zWTcRXizUvMf4rIU?authuser=0&hl=en&rclk=1","26.178027999999998,90.6246729"
Alangad Juma Masjid,Mosque,"Alangad Juma Masjid, Masjid Rd, Kottapuram, Kerala 683511",,Masjid Rd,Kottapuram,683511,Kerala,IN,https://www.google.com/maps/place/Alangad+Juma+Masjid/data=!4m7!3m6!1s0x3b080fbde05381e5:0x899f65f587f4ea7a!8m2!3d10.1252581!4d76.3003277!16s%2Fg%2F1wfvl2qg!19sChIJ5YFT4L0PCDsReur0h_Vln4k?authuser=0&hl=en&rclk=1,"10.1252581,76.3003277"
Masjid Nabi (msjd nby) Johri farm,Mosque,"Masjid Nabi (msjd nby) Johri farm, C7, 1st Lane Johri Farm, Noor Nagar Extension, Noor Nagar, Okhla, New Delhi, Delhi 110025","Noor Nagar Extension, Noor Nagar, Okhla","C7, 1st Lane Johri Farm",New Delhi,110025,Delhi,IN,https://www.google.com/maps/place/Masjid+Nabi+%28%D9%85%D8%B3%D8%AC%D8%AF+%D9%86%D8%A8%DB%8C%29+Johri+farm%E2%80%AD/data=!4m7!3m6!1s0x390ce5082fe1ad5f:0x5775343e83da2a45!8m2!3d28.555116!4d77.2871876!16s%2Fg%2F11mvgvl28g!19sChIJX63hLwjlDDkRRSragz40dVc?authuser=0&hl=en&rclk=1,"28.555115999999998,77.2871876"
Jamia Boys Hostel Masjid jmyh bwys hwsttl msjd,Mosque,"Jamia Boys Hostel Masjid jmyh bwys hwsttl msjd, Gate no. 4, Hall of boys residence, Jamia Millia Islamia, Jamia Nagar, Okhla, New Delhi, Delhi 110025","Jamia Millia Islamia, Jamia Nagar, Okhla","Gate no. 4, Hall of boys residence",New Delhi,110025,Delhi,IN,https://www.google.com/maps/place/Jamia+Boys+Hostel+Masjid+%D8%AC%D8%A7%D9%85%DB%8C%DB%81+%D8%A8%D9%88%D8%A7%DB%8C%D8%B3+%DB%81%D9%88%D8%B3%D9%B9%D9%84+%D9%85%D8%B3%D8%AC%D8%AF%E2%80%AD/data=!4m7!3m6!1s0x390ce38bf66899d1:0x57e8df6a5a7d6b2!8m2!3d28.5651793!4d77.2806872!16s%2Fg%2F11c5rpv6_6!19sChIJ0Zlo9ovjDDkRstanpfaNfgU?authuser=0&hl=en&rclk=1,"28.565179299999997,77.2806872"
Al Jamiul Azhar Jum'ah Masjid,Mosque,"Al Jamiul Azhar Jum'ah Masjid, KTM Street, Customs Rd, Odakkarai, Kayalpattinam, Tamil Nadu 628204",Odakkarai,"KTM Street, Customs Rd",Kayalpattinam,628204,Tamil Nadu,IN,https://www.google.com/maps/place/Al+Jamiul+Azhar+Jum%27ah+Masjid/data=!4m7!3m6!1s0x3b0391f62c912291:0x18bc1aa952d623d6!8m2!3d8.563398!4d78.1252193!16s%2Fg%2F11dz49pvz7!19sChIJkSKRLPaRAzsR1iPWUqkavBg?authuser=0&hl=en&rclk=1,"8.563398,78.1252193"
Madrasa E Arabia Roohul Islam Bagepalli (H Nazeer Ahmed Baqavi Founder),Mosque,"Madrasa E Arabia Roohul Islam Bagepalli (H Nazeer Ahmed Baqavi Founder), Bagepalli, NH 44, Gantamvarapalli ., Karnataka 561207",,"Bagepalli, NH 44",Gantamvarapalli .,561207,Karnataka,IN,https://www.google.com/maps/place/Madrasa+E+Arabia+Roohul+Islam+Bagepalli+%28H+Nazeer+Ahmed+Baqavi+Founder%29/data=!4m7!3m6!1s0x3bb18f9091e38d6d:0xb33ce12497879f1e!8m2!3d13.7779506!4d77.7785261!16s%2Fg%2F12615lgbr!19sChIJbY3jkZCPsTsRHp-HlyThPLM?authuser=0&hl=en&rclk=1,"13.777950599999999,77.7785261"
ABUBAKAR MASJID,Mosque,"V8PX+9H2 ABUBAKAR MASJID, Bari Colony, Kiradpura, Aurangabad, Maharashtra 431003","Bari Colony, Kiradpura",V8PX+9H2,Aurangabad,431003,Maharashtra,IN,https://www.google.com/maps/place/ABUBAKAR+MASJID/data=!4m7!3m6!1s0x3bdba2a243d0a92f:0x298ae9ab0d4c2537!8m2!3d19.8858929!4d75.3488946!16s%2Fg%2F1pv2l7p_x!19sChIJL6nQQ6Ki2zsRNyVMDavpiik?authuser=0&hl=en&rclk=1,"19.885892899999998,75.3488946"
Dhekiajuri Jama Masjid,Mosque,"Dhekiajuri Jama Masjid, Dhekiajuri Jama Masjid Dhekiajuri Masjid Patty, Assam 786125",,Dhekiajuri Jama Masjid Dhekiajuri Masjid Patty,"Ajaanpeer Colony, Bahbari Gaon",786125,Assam,IN,https://www.google.com/maps/place/Dhekiajuri+Jama+Masjid/data=!4m7!3m6!1s0x373f6a5140474bed:0x97442af7322f088b!8m2!3d27.4843898!4d95.3458051!16s%2Fg%2F11b7lf309p!19sChIJ7UtHQFFqPzcRiwgvMvcqRJc?authuser=0&hl=en&rclk=1,"27.4843898,95.34580509999999"
TNTJ Ramapuram,Mosque,"TNTJ Ramapuram, 5-12 Third Floor, 1st Cross St, Sriram Nagar, Ramapuram, Chennai, Tamil Nadu 600089","Sriram Nagar, Ramapuram","5-12 Third Floor, 1st Cross St",Chennai,600089,Tamil Nadu,IN,https://www.google.com/maps/place/TNTJ+Ramapuram/data=!4m7!3m6!1s0x3a5260d6adfa7053:0xd70b563dca02898f!8m2!3d13.0278138!4d80.1812537!16s%2Fg%2F11cn92xwtg!19sChIJU3D6rdZgUjoRj4kCyj1WC9c?authuser=0&hl=en&rclk=1,"13.027813799999999,80.1812537"
Meraj Masjid,Mosque,"Meraj Masjid, juna Munda, Old Mondha Rd, nizam ganj colony, Sanjay Nagar, Mondha, Aurangabad, Maharashtra 431001","Sanjay Nagar, Mondha","juna Munda, Old Mondha Rd, nizam ganj colony",Aurangabad,431001,Maharashtra,IN,https://www.google.com/maps/place/Meraj+Masjid/data=!4m7!3m6!1s0x3bdb987551a63aeb:0xe41f9e16f8863903!8m2!3d19.8830248!4d75.3406465!16s%2Fg%2F1tcy2rrl!19sChIJ6zqmUXWY2zsRAzmG-BaeH-Q?authuser=0&hl=en&rclk=1,"19.883024799999998,75.34064649999999"
Darul-Anwaar Mosque,Mosque,"R97P+X25 Darul-Anwaar Mosque, Civil Line, Qadian, Punjab 143516",Civil Line,R97P+X25,Qadian,143516,Punjab,IN,https://www.google.com/maps/place/Darul-Anwaar+Mosque/data=!4m7!3m6!1s0x391bbf02527d8a03:0xa7621d86a3621ece!8m2!3d31.8148987!4d75.3851162!16s%2Fg%2F11_v54djz!19sChIJA4p9UgK_GzkRzh5io4YdYqc?authuser=0&hl=en&rclk=1,"31.814898699999997,75.3851162"
KMT Hospital Masjid,Mosque,"H44C+HVV KMT Hospital Masjid, Chinna Nesavu Street, Kayalpattinam, Tamil Nadu 628202","Wavoo Nagar, Odakkarai","H44C+HVV, Chinna Nesavu Street",Kayalpattinam,628202,Tamil Nadu,IN,https://www.google.com/maps/place/KMT+Hospital+Masjid/data=!4m7!3m6!1s0x3b0391fa7616b5f7:0x17309ac3de0e590c!8m2!3d8.5564757!4d78.1221734!16s%2Fg%2F1thxjhdy!19sChIJ97UWdvqRAzsRDFkO3sOaMBc?authuser=0&hl=en&rclk=1,"8.5564757,78.1221734"
Choori Salafi Masjid,Mosque,"Choori Salafi Masjid, P.O R.D Nagar, Choori, Kasaragod, Kerala 671124",Choori,P.O R.D Nagar,"Kasaragod, Kudlu",671124,Kerala,IN,https://www.google.com/maps/place/Choori+Salafi+Masjid/data=!4m7!3m6!1s0x3ba482f569184d93:0xbe902523f3019cff!8m2!3d12.5174961!4d74.9929416!16s%2Fg%2F11bt_j510s!19sChIJk00YafWCpDsR_5wB8yMlkL4?authuser=0&hl=en&rclk=1,"12.517496099999999,74.9929416"
Masjid Mujeeb Bagh,Mosque,"H74R+R4J Masjid Mujeeb Bagh, Mujeeb Bagh, Jamia Nagar, Okhla, New Delhi, Delhi 110025","Mujeeb Bagh, Jamia Nagar, Okhla",H74R+R4J,New Delhi,110025,Delhi,IN,https://www.google.com/maps/place/Masjid+Mujeeb+Bagh/data=!4m7!3m6!1s0x390ce40bc79e1ce9:0x18ab01f5fdcf10b3!8m2!3d28.5570856!4d77.2902574!16s%2Fg%2F11hbvrlrnj!19sChIJ6RyexwvkDDkRsxDP_fUBqxg?authuser=0&hl=en&rclk=1,"28.557085599999997,77.2902574"
Bada Imambada,Mosque,"7FPG+599 Bada Imambada, Budhana, Uttar Pradesh 251309",,7FPG+599,Budhana,251309,Uttar Pradesh,IN,https://www.google.com/maps/place/Bada+Imambada/data=!4m7!3m6!1s0x390c3eabd87ea483:0x28d32e550ffe4191!8m2!3d29.2854024!4d77.4759751!16s%2Fg%2F1pp2vdfnz!19sChIJg6R-2Ks-DDkRkUH-D1Uu0yg?authuser=0&hl=en&rclk=1,"29.2854024,77.4759751"
Nasirabad Ahmadiyya,Mosque,"R98H+82H Nasirabad Ahmadiyya, Ahmadiyya Mohalla, Civil Line, Qadian, Punjab 143516","Ahmadiyya Mohalla, Civil Line",R98H+82H,Qadian,143516,Punjab,IN,https://www.google.com/maps/place/Nasirabad+Ahmadiyya/data=!4m7!3m6!1s0x391bbf05e0a4d155:0xb12de913b0520b24!8m2!3d31.8158111!4d75.3776083!16s%2Fg%2F11b66bsbj8!19sChIJVdGk4AW_GzkRJAtSsBPpLbE?authuser=0&hl=en&rclk=1,"31.815811099999998,75.37760829999999"
Jama Masjid Jamia,Mosque,"H77M+9CQ Jama Masjid Jamia, Jamia Jama Masjid Rd, Jamia Nagar, Okhla, New Delhi, Delhi 110025","Jamia Nagar, Okhla","H77M+9CQ, Jamia Jama Masjid Rd",New Delhi,110025,Delhi,IN,https://www.google.com/maps/place/Jama+Masjid+Jamia/data=!4m7!3m6!1s0x390ce329e5e9fe39:0xfdadee6422dd6abd!8m2!3d28.5634592!4d77.2836065!16s%2Fg%2F11fnyd14qm!19sChIJOf7p5SnjDDkRvWrdImTurf0?authuser=0&hl=en&rclk=1,"28.563459199999997,77.28360649999999"
Masroor Mosque,Mosque,"R9JH+4G8 Masroor Mosque, Kothi Darussalam, Thikriwal Rd, Sant Nagar, Qadian, Punjab 143516",Sant Nagar,"R9JH+4G8, Kothi Darussalam, Thikriwal Rd",Qadian,143516,Punjab,IN,https://www.google.com/maps/place/Masroor+Mosque/data=!4m7!3m6!1s0x391bbfafaa39858f:0xeb0d63f903348113!8m2!3d31.8302915!4d75.3788155!16s%2Fg%2F11bxf3jfwx!19sChIJj4U5qq-_GzkRE4E0A_ljDes?authuser=0&hl=en&rclk=1,"31.830291499999998,75.3788155"
Madina Masjid Ahle sunnat,Mosque,"Madina Masjid Ahle sunnat, masjid ahle sunnat Bakra mandi, Madina, Jodhpur, Rajasthan 342001",Sodagaran Mohalla,"masjid ahle sunnat Bakra mandi, Madina",Jodhpur,342001,Rajasthan,IN,https://www.google.com/maps/place/Madina+Masjid+Ahle+sunnat/data=!4m7!3m6!1s0x39418dc9524b43d7:0xa52dfa193a25aaa9!8m2!3d26.292261!4d73.0113924!16s%2Fg%2F11fy7f6397!19sChIJ10NLUsmNQTkRqaolOhn6LaU?authuser=0&hl=en&rclk=1,"26.292261,73.01139239999999"
Madani Masjid,Mosque,"8J72+G9M Madani Masjid, Chunabelari, Paradeep, Odisha 754141",,8J72+G9M,"Chunabelari, Paradeep",754141,Odisha,IN,https://www.google.com/maps/place/Madani+Masjid/data=!4m7!3m6!1s0x3a1bb5389c8067f1:0x3ff6bb17266c383a!8m2!3d20.3138371!4d86.6009192!16s%2Fg%2F11g020mrwk!19sChIJ8WeAnDi1GzoROjhsJhe79j8?authuser=0&hl=en&rclk=1,"20.3138371,86.60091919999999"
Masjid - Thowheed Palli TNTJ,Mosque,"H45F+FJ8 Masjid - Thowheed Palli TNTJ, Wavoo Nagar, Odakkarai, Kayalpattinam, Tamil Nadu 628204","Wavoo Nagar, Odakkarai",H45F+FJ8,Kayalpattinam,628204,Tamil Nadu,IN,https://www.google.com/maps/place/Masjid+-+Thowheed+Palli+TNTJ/data=!4m7!3m6!1s0x3b0391f731459d75:0x6b2475af35b3ffa6!8m2!3d8.5586696!4d78.1240636!16s%2Fg%2F11cs0zgj64!19sChIJdZ1FMfeRAzsRpv-zNa91JGs?authuser=0&hl=en&rclk=1,"8.5586696,78.1240636"
Noor Mosque,Mosque,"Noor Mosque, Sikh National College, Sant Nagar, Qadian, Punjab 143516",Sant Nagar,Sikh National College,Qadian,143516,Punjab,IN,https://www.google.com/maps/place/Noor+Mosque/data=!4m7!3m6!1s0x391bbfaf377a7ef3:0xd5b90165c4ac2452!8m2!3d31.8278636!4d75.3777605!16s%2Fg%2F1hhh137kx!19sChIJ8356N6-_GzkRUiSsxGUBudU?authuser=0&hl=en&rclk=1,"31.827863599999997,75.3777605"
Fazal Mosque,Mosque,"R99G+4CQ Fazal Mosque, Ahmadiyya Mohalla, Hindu Mohalla, Qadian, Punjab 143516","Ahmadiyya Mohalla, Hindu Mohalla",R99G+4CQ,Qadian,143516,Punjab,IN,https://www.google.com/maps/place/Fazal+Mosque/data=!4m7!3m6!1s0x391bbf089da25b39:0x7d2892c97b2ddeab!8m2!3d31.8178483!4d75.3761164!16s%2Fg%2F11b66h279v!19sChIJOVuinQi_GzkRq94te8mSKH0?authuser=0&hl=en&rclk=1,"31.817848299999998,75.3761164"
Ahle'Sunnat Ayesha Masjid,Mosque,"7C7P+R58 Ahle'Sunnat Ayesha Masjid, Ayesha Nagar, Manmad, Maharashtra 423104","Bhabad Vasti, Hanuman Nagar","7C7P+R58, Ayesha Nagar",Manmad,423104,Maharashtra,IN,https://www.google.com/maps/place/Ahle%27Sunnat+Ayesha+Masjid/data=!4m7!3m6!1s0x3bdc25b949b8a78d:0x554bda3fbd0f9306!8m2!3d20.2645287!4d74.4354603!16s%2Fg%2F11fzf09s6w!19sChIJjae4Sbkl3DsRBpMPvT_aS1U?authuser=0&hl=en&rclk=1,"20.2645287,74.4354603"
Khwaja Gharib Nawaz Mustari Masjid,Mosque,"FX9R+HCV Khwaja Gharib Nawaz Mustari Masjid, Forest Colony, Sakhipara, Sambalpur, Odisha 768001","Forest Colony, Sakhipara",FX9R+HCV,Sambalpur,768001,Odisha,IN,https://www.google.com/maps/place/Khwaja+Gharib+Nawaz+Mustari+Masjid/data=!4m7!3m6!1s0x3a2117b1e0083709:0xfd8dbd14cc1edef4!8m2!3d21.4689875!4d83.9910514!16s%2Fg%2F11q1c00tmf!19sChIJCTcI4LEXIToR9N4ezBS9jf0?authuser=0&hl=en&rclk=1,"21.4689875,83.99105139999999"
Madina Masjid,Mosque,"Madina Masjid, 207, Ramsahay Marg, Prakash Nagar Colony, Nagda, Madhya Pradesh 456335",Prakash Nagar Colony,"207, Ramsahay Marg",Nagda,456335,Madhya Pradesh,IN,https://www.google.com/maps/place/Madina+Masjid/data=!4m7!3m6!1s0x396475f6e51bc8a5:0x307f27e5dc8e4c48!8m2!3d23.4552474!4d75.4193711!16s%2Fg%2F11bwp230bh!19sChIJpcgb5fZ1ZDkRSEyO3OUnfzA?authuser=0&hl=en&rclk=1,"23.455247399999998,75.41937109999999"
Chennimalai Masjid @ Ahle Dhakni Sunnath Jamath Masjid,Religious organization,,,,,,,,https://www.google.com/maps/place/Chennimalai+Masjid+@+Ahle+Dhakni+Sunnath+Jamath+Masjid/data=!4m7!3m6!1s0x3ba974868ee9a3b3:0x8f252003d2203fac!8m2!3d11.4358644!4d77.3817205!16s%2Fg%2F11bvvzw5l4!19sChIJs6PpjoZ0qTsRrD8g0gMgJY8?authuser=0&hl=en&rclk=1,"11.4358644,77.3817205"
Masjid Darut Tauheed,Mosque,"Ward No.26, Masjid Darut Tauheed, Tauheed Nagar, Near, Kamla Rai College Rd, Gopalganj, Bihar 841428",Arar,"Ward No.26, Tauheed Nagar, Near, Kamla Rai College Rd",Gopalganj,841428,Bihar,IN,https://www.google.com/maps/place/Masjid+Darut+Tauheed/data=!4m7!3m6!1s0x39931ad7ad0b0ab9:0xa4ea691822d2f90f!8m2!3d26.4558123!4d84.4461287!16s%2Fg%2F11gbkxlvfz!19sChIJuQoLrdcakzkRD_nSIhhp6qQ?authuser=0&hl=en&rclk=1,"26.455812299999998,84.4461287"
Darul Barkat Mosque,Mosque,"R9FM+P68 Darul Barkat Mosque, Partap Nagar, Qadian, Punjab 143516",Partap Nagar,R9FM+P68,Qadian,143516,Punjab,IN,https://www.google.com/maps/place/Darul+Barkat+Mosque/data=!4m7!3m6!1s0x391bbfaa3a22c3e5:0x3183376096142e3f!8m2!3d31.8242781!4d75.3830758!16s%2Fg%2F11b66gys48!19sChIJ5cMiOqq_GzkRPy4UlmA3gzE?authuser=0&hl=en&rclk=1,"31.824278099999997,75.3830758"
Chook Wali Masjid Sanwler,Mosque,"P44Q+FWQ Chook Wali Masjid Sanwler, Sanwler, Rajasthan 321204",,P44Q+FWQ,Sanwler,321204,Rajasthan,IN,https://www.google.com/maps/place/Chook+Wali+Masjid+Sanwler/data=!4m7!3m6!1s0x3972df377bbfa5c3:0x942e800b2adb29ef!8m2!3d27.7062209!4d77.1398565!16s%2Fg%2F11hdlsdnyh!19sChIJw6W_ezffcjkR7ynbKguALpQ?authuser=0&hl=en&rclk=1,"27.706220899999998,77.1398565"
Masjid Mubarak Ahmadiyya muslim jamaath,Mosque,"Masjid Mubarak Ahmadiyya muslim jamaath, Kochalumood Jn. Puthiyakavu Kattil Kadavu Road Adinadu South Kattil kadavu, Po, Karunagappalli, Kerala 690542",,"Kochalumood Jn. Puthiyakavu Kattil Kadavu Road Adinadu South Kattil kadavu, Po","Karunagappalli, Adinad",690542,Kerala,IN,https://www.google.com/maps/place/Masjid+Mubarak+Ahmadiyya+muslim+jamaath/data=!4m7!3m6!1s0x3b060308d6f4e587:0x63970677b5e68dd9!8m2!3d9.0753074!4d76.516838!16s%2Fg%2F11cssq6_lx!19sChIJh-X01ggDBjsR2Y3mtXcGl2M?authuser=0&hl=en&rclk=1,"9.0753074,76.51683799999999"
Sukulwa kala Masjid,Mosque,"Sukulwa kala Masjid, Sukulwa kala, Gopalganj, Sukulwa Kalan, Bihar 841428",,Sukulwa kala,"Gopalganj, Sukulwa Kalan",841428,Bihar,IN,https://www.google.com/maps/place/Sukulwa+kala+Masjid/data=!4m7!3m6!1s0x399305a1e470e9d1:0x8ed0e691a52a1cef!8m2!3d26.4743565!4d84.3918224!16s%2Fg%2F11f08wy8hp!19sChIJ0elw5KEFkzkR7xwqpZHm0I4?authuser=0&hl=en&rclk=1,"26.4743565,84.3918224"
Madina Masjid dausa shahrukh khan,Mosque,"Madina Masjid dausa shahrukh khan, Khatikan Mohalla, Dausa, Rajasthan 303303",Khatikan Mohalla,,Dausa,303303,Rajasthan,IN,https://www.google.com/maps/place/Madina+Masjid+dausa+shahrukh+khan/data=!4m7!3m6!1s0x396d8cc7068eede1:0x3099116cd20b08e7!8m2!3d26.8955403!4d76.3381865!16s%2Fg%2F11dfhr7t_d!19sChIJ4e2OBseMbTkR5wgL0mwRmTA?authuser=0&hl=en&rclk=1,"26.8955403,76.33818649999999"
MAKKA MASJID,Mosque,"MAKKA MASJID, Atarsua, Pakri Bangali, Bihar 841227",,,"Atarsua, Pakri Bangali",841227,Bihar,IN,https://www.google.com/maps/place/MAKKA+MASJID/data=!4m7!3m6!1s0x3992fd0f599467f3:0x803fff8bf411a289!8m2!3d26.2241259!4d84.3819539!16s%2Fg%2F11gycdt8wl!19sChIJ82eUWQ_9kjkRiaIR9Iv_P4A?authuser=0&hl=en&rclk=1,"26.224125899999997,84.3819539"
"Khidma Juma Masjid,Unity Centre Kakkad",Mosque,"Khidma Juma Masjid,Unity Centre Kakkad, opposite Kannur Municipal Corporation Zonal Office, Puzhathi, Kerala 670005",,opposite Kannur Municipal Corporation Zonal Office,Puzhathi,670005,Kerala,IN,"https://www.google.com/maps/place/Khidma+Juma+Masjid,Unity+Centre+Kakkad/data=!4m7!3m6!1s0x3ba43ddffcb9d63f:0xb29cb347a6acee22!8m2!3d11.8967953!4d75.3847225!16s%2Fg%2F11sqqb8s0k!19sChIJP9a5_N89pDsRIu6spkeznLI?authuser=0&hl=en&rclk=1","11.896795299999999,75.3847225"
msjd `thmnyh Masjid Usmania,Mosque,"msjd `thmnyh Masjid Usmania, Masjid Usmania Wali Gali, Budhana, Budhana Bagar, Uttar Pradesh 251309",,Masjid Usmania Wali Gali,"Budhana, Budhana Bagar",251309,Uttar Pradesh,IN,https://www.google.com/maps/place/%D9%85%D8%B3%D8%AC%D8%AF+%D8%B9%D8%AB%D9%85%D8%A7%D9%86%DB%8C%DB%81+Masjid+Usmania%E2%80%AD/data=!4m7!3m6!1s0x390c3bcc926ae8cf:0x5f563867f86e408c!8m2!3d29.2904976!4d77.4652375!16s%2Fg%2F11nmpk94zp!19sChIJz-hqksw7DDkRjEBu-Gc4Vl8?authuser=0&hl=en&rclk=1,"29.2904976,77.4652375"
Mariyam Masjid,Mosque,"Mariyam Masjid, Ardash society, Mahatma Gandhi Rd, Bardoli, Gujarat 394601",Swaraj Ashram,"Ardash society, Mahatma Gandhi Rd",Bardoli,394601,Gujarat,IN,https://www.google.com/maps/place/Mariyam+Masjid/data=!4m7!3m6!1s0x3be067977b264529:0xc01eac6cc0fce0c8!8m2!3d21.1210883!4d73.1078974!16s%2Fg%2F11j3735pbf!19sChIJKUUme5dn4DsRyOD8wGysHsA?authuser=0&hl=en&rclk=1,"21.1210883,73.1078974"
jm` msjd hl snt w jm`t,Mosque,"57QG+79F jm` msjd hl snt w jm`t, Jeweelery Lane, Baniya Para, Durg, Chhattisgarh 491001",Baniya Para,"57QG+79F, Jeweelery Lane",Durg,491001,Chhattisgarh,IN,https://www.google.com/maps/place/%D8%AC%D8%A7%D9%85%D8%B9+%D9%85%D8%B3%D8%AC%D8%AF+%D8%A7%DA%BE%D9%84+%D8%B3%D9%86%D8%AA+%D9%88+%D8%AC%D9%85%D8%A7%D8%B9%D8%AA%E2%80%AD/data=!4m7!3m6!1s0x3a293c47b9ef8155:0xed74399496b8818f!8m2!3d21.1881938!4d81.2759274!16s%2Fg%2F1tj9rrzr!19sChIJVYHvuUc8KToRj4G4lpQ5dO0?authuser=0&hl=en&rclk=1,"21.1881938,81.2759274"
mdynh msjd ny' tHSyl khy pychhy bddhnh,Mosque,"mdynh msjd ny' tHSyl khy pychhy bddhnh, Gali Number 5, Budhana, Budhana Bagar, Uttar Pradesh 251309",,Gali Number 5,"Budhana, Budhana Bagar",251309,Uttar Pradesh,IN,https://www.google.com/maps/place/%D9%85%D8%AF%DB%8C%D9%86%DB%81+%D9%85%D8%B3%D8%AC%D8%AF+%D9%86%D8%A6+%D8%AA%D8%AD%D8%B5%DB%8C%D9%84+%DA%A9%DB%92+%D9%BE%DB%8C%DA%86%DA%BE%DB%92+%D8%A8%DA%88%DA%BE%D8%A7%D9%86%DB%81%E2%80%AD/data=!4m7!3m6!1s0x390c3bcd1449033b:0x7824a462b04268ed!8m2!3d29.2902606!4d77.4648995!16s%2Fg%2F11rb47rwmh!19sChIJOwNJFM07DDkR7WhCsGKkJHg?authuser=0&hl=en&rclk=1,"29.2902606,77.4648995"
Azeem Dawakhana Budhana aziim dvaakhaanaa buddhaanaa,Hospital,"Azeem Dawakhana Budhana aziim dvaakhaanaa buddhaanaa, Purani tehsil ke samne Qile wali masjid, Budhana, Uttar Pradesh 251309",,Purani tehsil ke samne Qile wali masjid,Budhana,251309,Uttar Pradesh,IN,https://www.google.com/maps/place/Azeem+Dawakhana+Budhana+%E0%A4%85%E0%A5%9B%E0%A5%80%E0%A4%AE+%E0%A4%A6%E0%A4%B5%E0%A4%BE%E0%A4%96%E0%A4%BE%E0%A4%A8%E0%A4%BE+%E0%A4%AC%E0%A5%81%E0%A4%A2%E0%A4%BE%E0%A4%A8%E0%A4%BE/data=!4m7!3m6!1s0x390c3fa2e1a790b3:0xc0ae31091653cf13!8m2!3d29.2869468!4d77.4773279!16s%2Fg%2F11g0l9f822!19sChIJs5Cn4aI_DDkRE89TFgkxrsA?authuser=0&hl=en&rclk=1,"29.2869468,77.47732789999999"
JAMA MASJID,Mosque,"583H+W7Q JAMA MASJID, Unnamed Road, Harinagar, Ramnagar, Bihar 845103",Harinagar,"583H+W7Q, Unnamed Road",Ramnagar,845103,Bihar,IN,https://www.google.com/maps/place/JAMA+MASJID/data=!4m7!3m6!1s0x3994879799911bb3:0xecf6571e38c03988!8m2!3d27.1548474!4d84.3282417!16s%2Fg%2F11fn6cwmd4!19sChIJsxuRmZeHlDkRiDnAOB5X9uw?authuser=0&hl=en&rclk=1,"27.154847399999998,84.32824169999999"
Bilal Masjid New Tehsil Budhana bll msjd,Mosque,"Bilal Masjid New Tehsil Budhana bll msjd, Gali Number 5, Budhana, Budhana Bagar, Uttar Pradesh 251309",,Gali Number 5,"Budhana, Budhana Bagar",251309,Uttar Pradesh,IN,https://www.google.com/maps/place/Bilal+Masjid+New+Tehsil+Budhana+%D8%A8%D9%84%D8%A7%D9%84+%D9%85%D8%B3%D8%AC%D8%AF%E2%80%AD/data=!4m7!3m6!1s0x390c3b4a4b153077:0xe7fc04838adf634e!8m2!3d29.2904065!4d77.463423!16s%2Fg%2F11q1vcn6rh!19sChIJdzAVS0o7DDkRTmPfioME_Oc?authuser=0&hl=en&rclk=1,"29.2904065,77.46342299999999"
Malik Deenar Juma Masjid,Mosque,"FXMQ+WHH Malik Deenar Juma Masjid, Malik Deenar Nagar, Thalangara, Kasaragod, Kerala 671122","Malik Deenar Nagar, Thalangara",FXMQ+WHH,Kasaragod,671122,Kerala,IN,https://www.google.com/maps/place/Malik+Deenar+Juma+Masjid/data=!4m7!3m6!1s0x3ba48217b08d6309:0x38a345b56c593e24!8m2!3d12.4848027!4d74.9889767!16zL20vMDl5ejVu!19sChIJCWONsBeCpDsRJD5ZbLVFozg?authuser=0&hl=en&rclk=1,"12.4848027,74.9889767"
