name,main_category,address,address_ward,address_street,address_city,address_postal_code,address_state,address_country_code,link,coordinates
Masjid e Nasim,Mosque,"Masjid e Nasim, Taj pan Ankur Society 4 Jangleswer Rajkot Rajkot gujarat, Gujarat 360002",Jangleshwar,Taj pan Ankur Society 4 Jangleswer Rajkot Rajkot gujarat,Rajkot,360002,Gujarat,IN,https://www.google.com/maps/place/Masjid+e+Nasim/data=!4m7!3m6!1s0x3959b58f35246d25:0x9a0e78538ef22af5!8m2!3d22.2723058!4d70.8181235!16s%2Fg%2F11f5hm06yp!19sChIJJW0kNY-1WTkR9SryjlN4Dpo?authuser=0&hl=en&rclk=1,"22.272305799999998,70.8181235"
Noor Masjid,Mosque,"7RX4+QHP Noor Masjid, Kansara Bazar, Bangdi Bazar, Lohana Para, Rajkot, Gujarat 360001","Kansara Bazar, Bangdi Bazar, Lohana Para",7RX4+QHP,Rajkot,360001,Gujarat,IN,https://www.google.com/maps/place/Noor+Masjid/data=!4m7!3m6!1s0x3959ca01612c74b5:0xba15da73fa39e69a!8m2!3d22.2994741!4d70.8064672!16s%2Fg%2F1hm1qbbgp!19sChIJtXQsYQHKWTkRmuY5-nPaFbo?authuser=0&hl=en&rclk=1,"22.299474099999998,70.8064672"
Qutbi Masjid,Mosque,"8R26+JJ6 Qutbi Masjid, Girnar Street, Ranchod Nagar Society, Arya Nagar, Rajkot, Gujarat 360003","Ranchod Nagar Society, Arya Nagar","8R26+JJ6, Girnar Street",Rajkot,360003,Gujarat,IN,https://www.google.com/maps/place/Qutbi+Masjid/data=!4m7!3m6!1s0x3959ca007dc97e09:0x41ef2ffca408dccc!8m2!3d22.3015324!4d70.8115149!16s%2Fg%2F1hm1_nh9g!19sChIJCX7JfQDKWTkRzNwIpPwv70E?authuser=0&hl=en&rclk=1,"22.3015324,70.81151489999999"
Haidri Masjid Hydriy msjd,Mosque,"7Q3V+36H Haidri Masjid Hydriy msjd, Ambedkar Nagar, Samrat Industrial Area, Rajkot, Gujarat 360004","Ambedkar Nagar, Samrat Industrial Area",7Q3V+36H,Rajkot,360004,Gujarat,IN,https://www.google.com/maps/place/Haidri+Masjid+%D8%AD%DB%8C%D8%AF%D8%B1%D9%90%DB%8C+%D9%85%D8%B3%D8%AC%D8%AF%E2%80%AD/data=!4m7!3m6!1s0x3959ca8bcf5a3487:0x8048abf26de79922!8m2!3d22.252688!4d70.7930989!16s%2Fg%2F11c55f8403!19sChIJhzRaz4vKWTkRIpnnbfKrSIA?authuser=0&hl=en&rclk=1,"22.252688,70.79309889999999"
Raza Masjid,Mosque,"8Q2H+4XW Raza Masjid, Street Number 1, Raja Nagar, Rajkot, Gujarat 360007",Raja Nagar,"8Q2H+4XW, Street Number 1",Rajkot,360007,Gujarat,IN,https://www.google.com/maps/place/Raza+Masjid/data=!4m7!3m6!1s0x3959ca277d1c4f43:0xa825a1970e476e41!8m2!3d22.3003669!4d70.7799533!16s%2Fg%2F1pty2pp6h!19sChIJQ08cfSfKWTkRQW5HDpehJag?authuser=0&hl=en&rclk=1,"22.3003669,70.7799533"
Sadar Jumma Masjid,Mosque,"7QXW+44X Sadar Jumma Masjid, Dhobiwad, Sadar Bazar, Sadar, Rajkot, Gujarat 360001","Dhobiwad, Sadar Bazar, Sadar",7QXW+44X,Rajkot,360001,Gujarat,IN,https://www.google.com/maps/place/Sadar+Jumma+Masjid/data=!4m7!3m6!1s0x3959ca1c15c0c83d:0x3850d80def903abd!8m2!3d22.2978727!4d70.7953583!16s%2Fg%2F11cs5s49t4!19sChIJPcjAFRzKWTkRvTqQ7w3YUDg?authuser=0&hl=en&rclk=1,"22.2978727,70.7953583"
Siddiki Masjid,Mosque,"7RVH+5HR Siddiki Masjid, Siddique Chowk, Dudhsagar Marg, Rajkot, Gujarat 360003",Shakti Industrial Zone,"7RVH+5HR, Siddique Chowk, Dudhsagar Marg",Rajkot,360003,Gujarat,IN,https://www.google.com/maps/place/Siddiki+Masjid/data=!4m7!3m6!1s0x3959b5ef3baebeef:0xf8646f3da0c70bf2!8m2!3d22.2929866!4d70.8288762!16s%2Fg%2F11b7hhmt7k!19sChIJ776uO--1WTkR8gvHoD1vZPg?authuser=0&hl=en&rclk=1,"22.2929866,70.8288762"
GOUSHIYA MASJID,Mosque,"7RF9+RPG GOUSHIYA MASJID, Jangleshwar, Rajkot, Gujarat 360002",Jangleshwar,7RF9+RPG,Rajkot,360002,Gujarat,IN,https://www.google.com/maps/place/GOUSHIYA+MASJID/data=!4m7!3m6!1s0x3959b58ec2eb4279:0x87762d108cda8ff8!8m2!3d22.2745743!4d70.8193128!16s%2Fg%2F11c55c5yys!19sChIJeULrwo61WTkR-I_ajBAtdoc?authuser=0&hl=en&rclk=1,"22.274574299999998,70.81931279999999"
Sanjari Masjid snjriy msjd,Mosque,"8Q6V+8J6 Sanjari Masjid snjriy msjd, Jamnagar - Rajkot Hwy, Police Head Quarter, Rajkot, Gujarat 360001",Police Head Quarter,"8Q6V+8J6, Jamnagar - Rajkot Hwy",Rajkot,360001,Gujarat,IN,https://www.google.com/maps/place/Sanjari+Masjid+%D8%B3%D9%86%D8%AC%D8%B1%D9%90%DB%8C+%D9%85%D8%B3%D8%AC%D8%AF%E2%80%AD/data=!4m7!3m6!1s0x3959c9f22ae9acb9:0xc865d3cde8033b66!8m2!3d22.3107881!4d70.7940289!16s%2Fg%2F1hm4p8c92!19sChIJuazpKvLJWTkRZjsD6M3TZcg?authuser=0&hl=en&rclk=1,"22.3107881,70.7940289"
Zakariya Masjid,Mosque,"Zakariya Masjid, 360001, Kashivishwanath Plot, Sadar, Rajkot, Gujarat 360001","Kashivishwanath Plot, Sadar",360001,Rajkot,360001,Gujarat,IN,https://www.google.com/maps/place/Zakariya+Masjid/data=!4m7!3m6!1s0x3959ca1cf87d3e45:0x900e86e786851033!8m2!3d22.2990853!4d70.7968953!16s%2Fg%2F11c59st3sy!19sChIJRT59-BzKWTkRMxCFhueGDpA?authuser=0&hl=en&rclk=1,"22.299085299999998,70.7968953"
Masjid E Aayesha,Mosque,"7RJP+8WJ Masjid E Aayesha, Aji Dem Chowkdi, Rajkot, Gujarat 360003","Bharat Nagar, GIDC","7RJP+8WJ, Aji Dem Chowkdi",Rajkot,360003,Gujarat,IN,https://www.google.com/maps/place/Masjid+E+Aayesha/data=!4m7!3m6!1s0x13ff471f491199b1:0x179184ed2bb0fee0!8m2!3d22.2808271!4d70.8372742!16s%2Fg%2F11b7dx1hgf!19sChIJsZkRSR9H_xMR4P6wK-2EkRc?authuser=0&hl=en&rclk=1,"22.2808271,70.8372742"
Madina Masjid,Mosque,"7QJQ+RWX Madina Masjid, Laxminagar Street Number 2, Laxmi Nagar, Chandreshnagar, Rajkot, Gujarat 360005","Laxmi Nagar, Chandreshnagar","7QJQ+RWX, Laxminagar Street Number 2",Rajkot,360005,Gujarat,IN,https://www.google.com/maps/place/Madina+Masjid/data=!4m7!3m6!1s0x3959ca15a2550c37:0xbd6eac209e4fd711!8m2!3d22.2821112!4d70.7898729!16s%2Fg%2F11c1ty7x5x!19sChIJNwxVohXKWTkREddPniCsbr0?authuser=0&hl=en&rclk=1,"22.2821112,70.78987289999999"
Karim Pura Masjid,Mosque,"7RW5+9XP Karim Pura Masjid, Ramnathpara Rd, Ramnath Pura, Rajkot, Gujarat 360001",Ramnath Pura,"7RW5+9XP, Ramnathpara Rd",Rajkot,360001,Gujarat,IN,https://www.google.com/maps/place/Karim+Pura+Masjid/data=!4m7!3m6!1s0x13ff46f9bba337d7:0xe518e832280af05f!8m2!3d22.2959609!4d70.8099622!16s%2Fg%2F11b7c8mjln!19sChIJ1zeju_lG_xMRX_AKKDLoGOU?authuser=0&hl=en&rclk=1,"22.2959609,70.8099622"
Jama Masjid,Mosque,"7RX5+4WX Jama Masjid, Jumma Masjid Chowk, Near Soni Bazar, Boghani St, Rajkot, Gujarat 360002","Soni Bazar, Java Nagar, Old walled City","7RX5+4WX, Jumma Masjid Chowk, Near Soni Bazar, Boghani St",Rajkot,360002,Gujarat,IN,https://www.google.com/maps/place/Jama+Masjid/data=!4m7!3m6!1s0x3959ca0731bed43d:0x6afc27771ce6e74f!8m2!3d22.2978579!4d70.809871!16s%2Fg%2F11b75kyhgq!19sChIJPdS-MQfKWTkRT-fmHHcn_Go?authuser=0&hl=en&rclk=1,"22.2978579,70.809871"
"Noorani Masjid (Hasan Shah Pir, Bismillah Bapu)",Mosque,"7RH9+633 Noorani Masjid (Hasan Shah Pir, Bismillah Bapu), Mehul Nagar, Jangleshwar, Rajkot, Gujarat 360002","Mehul Nagar, Jangleshwar",7RH9+633,Rajkot,360002,Gujarat,IN,"https://www.google.com/maps/place/Noorani+Masjid+%28Hasan+Shah+Pir,+Bismillah+Bapu%29/data=!4m7!3m6!1s0x3959b58b8b19fdb5:0x9ed181f7d605eb9e!8m2!3d22.2780225!4d70.8176586!16s%2Fg%2F11c5rtvyxb!19sChIJtf0Zi4u1WTkRnusF1veB0Z4?authuser=0&hl=en&rclk=1","22.2780225,70.8176586"
Masjid E Makhdum E Asharaf,Mosque,"6QFW+P83 Masjid E Makhdum E Asharaf, Vavdi, Rajkot, Gujarat 360004",Vavdi,6QFW+P83,Rajkot,360004,Gujarat,IN,https://www.google.com/maps/place/Masjid+E+Makhdum+E+Asharaf/data=!4m7!3m6!1s0x3959caba47b17d63:0xbaa819fdc7a6e14!8m2!3d22.2242711!4d70.7958056!16s%2Fg%2F11c6qq8s_w!19sChIJY32xR7rKWTkRFG563J-Bqgs?authuser=0&hl=en&rclk=1,"22.2242711,70.7958056"
Hawwa Masjid,Mosque,"7QXJ+RG6 Hawwa Masjid, Nehru Nagar Street 1, Nehru Nagar, Rajkot, Gujarat 360007",Nehru Nagar,"7QXJ+RG6, Nehru Nagar Street 1",Rajkot,360007,Gujarat,IN,https://www.google.com/maps/place/Hawwa+Masjid/data=!4m7!3m6!1s0x3959ca27443b2223:0x6052bdbf2e476670!8m2!3d22.2995264!4d70.7812747!16s%2Fg%2F11c1_vzs32!19sChIJIyI7RCfKWTkRcGZHLr-9UmA?authuser=0&hl=en&rclk=1,"22.299526399999998,70.7812747"
Mohammadi (Markaz) Masjid,Mosque,"8Q2J+3QR Mohammadi (Markaz) Masjid, Nehru Nagar, Rajkot, Gujarat 360007",Nehru Nagar,8Q2J+3QR,Rajkot,360007,Gujarat,IN,https://www.google.com/maps/place/Mohammadi+%28Markaz%29+Masjid/data=!4m7!3m6!1s0x3959ca2753fd9655:0x21eabe7ae8908499!8m2!3d22.3002377!4d70.781897!16s%2Fg%2F11c0q0bqjp!19sChIJVZb9UyfKWTkRmYSQ6Hq-6iE?authuser=0&hl=en&rclk=1,"22.3002377,70.781897"
Alkaba Masjid,Mosque,"7RR6+VV4 Alkaba Masjid, Ramnath Pura, Rajkot, Gujarat 360001",Ramnath Pura,7RR6+VV4,Rajkot,360001,Gujarat,IN,https://www.google.com/maps/place/Alkaba+Masjid/data=!4m7!3m6!1s0x3959b5f7e32e485f:0x159e2f1cec5eaf17!8m2!3d22.2921453!4d70.8122075!16s%2Fg%2F11y3xyfmp!19sChIJX0gu4_e1WTkRF69e7BwvnhU?authuser=0&hl=en&rclk=1,"22.292145299999998,70.8122075"
Gulzar-E-Mustafa Masjid,Mosque,"Gulzar-E-Mustafa Masjid, 5, Bhavnagar Rd, Shivaji Nagar, Shakti Industrial Zone, Rajkot, Gujarat 360003","Shivaji Nagar, Shakti Industrial Zone","5, Bhavnagar Rd",Rajkot,360003,Gujarat,IN,https://www.google.com/maps/place/Gulzar-E-Mustafa+Masjid/data=!4m7!3m6!1s0x3959b5ec3a00e68f:0xf70a1251ed182428!8m2!3d22.2880745!4d70.8276045!16s%2Fg%2F11b_2tgnkj!19sChIJj-YAOuy1WTkRKCQY7VESCvc?authuser=0&hl=en&rclk=1,"22.2880745,70.82760449999999"
Mohammadi Masjid,Mosque,"Mohammadi Masjid, police station, Babubhai Shah Rd, near Pradhuman nager, Kashivishwanath Plot, Sadar, Rajkot, Gujarat 360001","Kashivishwanath Plot, Sadar","police station, Babubhai Shah Rd, near Pradhuman nager",Rajkot,360001,Gujarat,IN,https://www.google.com/maps/place/Mohammadi+Masjid/data=!4m7!3m6!1s0x3959ca1cf69b7747:0x318e5d3091848ad9!8m2!3d22.3017673!4d70.7965723!16s%2Fg%2F1hjgmxmyd!19sChIJR3eb9hzKWTkR2YqEkTBdjjE?authuser=0&hl=en&rclk=1,"22.301767299999998,70.7965723"
Usmaniya Masjid,Mosque,"8QCH+HQW Usmaniya Masjid, Sanjay Nagar, Bajrang Wadi, Rajkot, Gujarat 360006","Sanjay Nagar, Bajrang Wadi",8QCH+HQW,Rajkot,360006,Gujarat,IN,https://www.google.com/maps/place/Usmaniya+Masjid/data=!4m7!3m6!1s0x3959c9964b723529:0x4af8f505c045bb88!8m2!3d22.3214873!4d70.7794411!16s%2Fg%2F11cs6bl4d5!19sChIJKTVyS5bJWTkRiLtFwAX1-Eo?authuser=0&hl=en&rclk=1,"22.321487299999998,70.7794411"
Masjid e Ahmed msjd,Mosque,"6Q9X+GP7 Masjid e Ahmed msjd, Rasul Para, Solvent, Kothariya, Gujarat",,"6Q9X+GP7, Rasul Para, Solvent","Kothariya, Rajkot",,Gujarat,IN,https://www.google.com/maps/place/Masjid+e+Ahmed+%D9%85%D8%B3%D8%AC%D8%AF%E2%80%AD/data=!4m7!3m6!1s0x3959cab1c4bb6597:0x842359b37d290146!8m2!3d22.2187914!4d70.7992924!16s%2Fg%2F11df6y270d!19sChIJl2W7xLHKWTkRRgEpfbNZI4Q?authuser=0&hl=en&rclk=1,"22.2187914,70.7992924"
Masjid E Nagani,Mosque,"8P2X+66H Masjid E Nagani, Raiya Road, Krishna Kunj, Raiya, Rajkot, Gujarat 360005","Krishna Kunj, Raiya","8P2X+66H, Raiya Road",Rajkot,360005,Gujarat,IN,https://www.google.com/maps/place/Masjid+E+Nagani/data=!4m7!3m6!1s0x3959c963e795e2cf:0xb537e29092d895ca!8m2!3d22.3005705!4d70.7481018!16s%2Fg%2F11gdgwym7v!19sChIJz-KV52PJWTkRypXYkpDiN7U?authuser=0&hl=en&rclk=1,"22.3005705,70.7481018"
(Sunni Masjid) Jumma Masjid Shapar (Veraval),Mosque,"5Q39+RR9 (Sunni Masjid) Jumma Masjid Shapar (Veraval), Shapar, Gujarat 360024",,5Q39+RR9,Shapar,360024,Gujarat,IN,https://www.google.com/maps/place/%28Sunni+Masjid%29+Jumma+Masjid+Shapar+%28Veraval%29/data=!4m7!3m6!1s0x395835ac3d2a29f5:0x973a9db8afe0e283!8m2!3d22.1545366!4d70.7696041!16s%2Fg%2F11csb2njww!19sChIJ9SkqPaw1WDkRg-Lgr7idOpc?authuser=0&hl=en&rclk=1,"22.1545366,70.7696041"
Shaher Eidgah Masjid (City EidGah Masjid),Mosque,"Shaher Eidgah Masjid (City EidGah Masjid), Ariwala Complex, Kanak Rd, near GEB Office, Karanpara, Rajkot, Gujarat 360001",Karanpara,"Ariwala Complex, Kanak Rd, near GEB Office",Rajkot,360001,Gujarat,IN,https://www.google.com/maps/place/Shaher+Eidgah+Masjid+%28City+EidGah+Masjid%29/data=!4m7!3m6!1s0x3959ca050e9704db:0x74235ff35b03b1ad!8m2!3d22.293562!4d70.8029064!16s%2Fg%2F11cs5xp2jr!19sChIJ2wSXDgXKWTkRrbEDW_NfI3Q?authuser=0&hl=en&rclk=1,"22.293561999999998,70.8029064"
Raiya Ismaili Khoja Jamatkhana,Place of worship,"Raiya Ismaili Khoja Jamatkhana, Street Number 4, Nehru Nagar, Shubash Nagar, Rajkot, Gujarat 360007",Shubash Nagar,"Street Number 4, Nehru Nagar",Rajkot,360007,Gujarat,IN,https://www.google.com/maps/place/Raiya+Ismaili+Khoja+Jamatkhana/data=!4m7!3m6!1s0x3959c989f1c18863:0x38e3c42bfe6501a4!8m2!3d22.3012499!4d70.7816576!16s%2Fg%2F11ckkx9nkr!19sChIJY4jB8YnJWTkRpAFl_ivE4zg?authuser=0&hl=en&rclk=1,"22.3012499,70.7816576"
MASJID E REHMAN,Mosque,"8Q8F+H2Q MASJID E REHMAN, Mochi Nagar, Press Colony, Puneet Nagar, Bajrang Wadi, Rajkot, Gujarat 360006","Mochi Nagar, Press Colony, Puneet Nagar, Bajrang Wadi",8Q8F+H2Q,Rajkot,360006,Gujarat,IN,https://www.google.com/maps/place/MASJID+E+REHMAN/data=!4m7!3m6!1s0x3959c95e916da125:0xa80bda3468d098ab!8m2!3d22.316453!4d70.7726217!16s%2Fg%2F11fd7gfy2r!19sChIJJaFtkV7JWTkRq5jQaDTaC6g?authuser=0&hl=en&rclk=1,"22.316453,70.7726217"
Faruki Masjid,Mosque,"7RVF+MQ Faruki Masjid, Shakti Industrial Zone, Rajkot, Gujarat 360003",Shakti Industrial Zone,7RVF+MQ,Rajkot,,Gujarat,IN,https://www.google.com/maps/place/Faruki+Masjid/data=!4m7!3m6!1s0x3959b5566efa621f:0xfbe11f03b7f6987!8m2!3d22.2941687!4d70.8244408!16s%2Fg%2F11rf032mdf!19sChIJH2L6bla1WTkRh2l_O_ARvg8?authuser=0&hl=en&rclk=1,"22.2941687,70.82444079999999"
Shahiyad Masjid,Mosque,"5Q7W+687 Shahiyad Masjid, Vikas Stove Rd, Shapar, Veraval, Gujarat 360024",,"5Q7W+687, Vikas Stove Rd","Shapar, Veraval",360024,Gujarat,IN,https://www.google.com/maps/place/Shahiyad+Masjid/data=!4m7!3m6!1s0x3958359db85075cb:0xc8d6999835fb273c!8m2!3d22.1630388!4d70.7957831!16s%2Fg%2F124ss_njv!19sChIJy3VQuJ01WDkRPCf7NZiZ1sg?authuser=0&hl=en&rclk=1,"22.1630388,70.7957831"
Noor E Muhammadi Masjid,Mosque,"7RQ7+RW3 Noor E Muhammadi Masjid, Ghanchi wad, nr. Pooriben Hall, Ghanchiwad, Rajkot, Gujarat 360001",Ghanchiwad,"7RQ7+RW3, Ghanchi wad, nr. Pooriben Hall",Rajkot,,Gujarat,IN,https://www.google.com/maps/place/Noor+E+Muhammadi+Masjid/data=!4m7!3m6!1s0x3959b5f6584cc533:0x97acfe62aa84485e!8m2!3d22.2895106!4d70.8147859!16s%2Fg%2F11bz_0fzsf!19sChIJM8VMWPa1WTkRXkiEqmL-rJc?authuser=0&hl=en&rclk=1,"22.2895106,70.81478589999999"
Fatima Masjid,Mosque,"8RC5+6JM Fatima Masjid, Jay Prakash Nagar, Bhagwatipara, Rajkot, Gujarat 360003","Jay Prakash Nagar, Bhagwatipara",8RC5+6JM,Rajkot,360003,Gujarat,IN,https://www.google.com/maps/place/Fatima+Masjid/data=!4m7!3m6!1s0x3959c9e22cd5a825:0xffa6c5084c376fd!8m2!3d22.3205773!4d70.8090339!16s%2Fg%2F11c6_kg41_!19sChIJJajVLOLJWTkR_XbDhFBs-g8?authuser=0&hl=en&rclk=1,"22.3205773,70.8090339"
Nagina Masjid msjd,Mosque,"8R24+94P Nagina Masjid msjd, Satta Bazar, Kesri Wadi, Lohana Para, Rajkot, Gujarat 360001","Satta Bazar, Kesri Wadi, Lohana Para",8R24+94P,Rajkot,360001,Gujarat,IN,https://www.google.com/maps/place/Nagina+Masjid+%D9%85%D8%B3%D8%AC%D8%AF%E2%80%AD/data=!4m7!3m6!1s0x13ff46585884916f:0x9bef1209526e13b6!8m2!3d22.3009655!4d70.8053239!16s%2Fg%2F11b7fxjtp7!19sChIJb5GEWFhG_xMRthNuUgkS75s?authuser=0&hl=en&rclk=1,"22.3009655,70.80532389999999"
Hussainia Masjid,Mosque,"8R74+4Q4 Hussainia Masjid, Aashabapir Dargah Road,, Bhagavatipura Main Rd, Jay Prakash Nagar, Bhagwatipara, Rajkot, Gujarat 360003","Jay Prakash Nagar, Bhagwatipara","8R74+4Q4, Aashabapir Dargah Road,, Bhagavatipura Main Rd",Rajkot,360003,Gujarat,IN,https://www.google.com/maps/place/Hussainia+Masjid/data=!4m7!3m6!1s0x3959c9fc8eb9071b:0xc95875534f3b66f1!8m2!3d22.3127724!4d70.8069501!16s%2Fg%2F11cmsz5x1j!19sChIJGwe5jvzJWTkR8WY7T1N1WMk?authuser=0&hl=en&rclk=1,"22.3127724,70.8069501"
Navab Masjid {Sunni Barelvi},Mosque,"8R23+9QR Navab Masjid {Sunni Barelvi}, Dana Pith, Rajkot, Gujarat 360001","Danapith, Kesri Wadi, Lohana Para","8R23+9QR, Dana Pith",Rajkot,360001,Gujarat,IN,https://www.google.com/maps/place/Navab+Masjid+%7BSunni+Barelvi%7D/data=!4m7!3m6!1s0x13ff465858803381:0x176d0c84422420db!8m2!3d22.300988!4d70.8043929!16s%2Fg%2F11b7fq2ksf!19sChIJgTOAWFhG_xMR2yAkQoQMbRc?authuser=0&hl=en&rclk=1,"22.300988,70.8043929"
MASJID E RAHMAT,Mosque,"5QCW+Q53 MASJID E RAHMAT, Shapar, Gujarat 360024",,5QCW+Q53,Shapar,360024,Gujarat,IN,https://www.google.com/maps/place/MASJID+E+RAHMAT/data=!4m7!3m6!1s0x3958353aa24c2057:0xfef9b747b8ee60d4!8m2!3d22.1718798!4d70.7954126!16s%2Fg%2F11h1dcsdyn!19sChIJVyBMojo1WDkR1GDuuEe3-f4?authuser=0&hl=en&rclk=1,"22.1718798,70.79541259999999"
Masjid-e-Sherbanu,Mosque,"7RRM+XJ3 Masjid-e-Sherbanu, Shakti Industrial Zone, Rajkot, Gujarat 360003",Shakti Industrial Zone,7RRM+XJ3,Rajkot,360003,Gujarat,IN,https://www.google.com/maps/place/Masjid-e-Sherbanu/data=!4m7!3m6!1s0x3959b5b1330dde5f:0x8fa8564b92af3e84!8m2!3d22.2923941!4d70.8340512!16s%2Fg%2F11fkf61573!19sChIJX94NM7G1WTkRhD6vkktWqI8?authuser=0&hl=en&rclk=1,"22.2923941,70.83405119999999"
Jilani Masjid msjd,Mosque,"8RC2+QRP Jilani Masjid msjd, Popat Para, Rajkot, Gujarat 360001",Popat Para,8RC2+QRP,Rajkot,360001,Gujarat,IN,https://www.google.com/maps/place/Jilani+Masjid+%D9%85%D8%B3%D8%AC%D8%AF%E2%80%AD/data=!4m7!3m6!1s0x3959c9e643967327:0x1e98afa89a2aaab5!8m2!3d22.3219581!4d70.8020793!16s%2Fg%2F11gb3q_3q_!19sChIJJ3OWQ-bJWTkRtaoqmqivmB4?authuser=0&hl=en&rclk=1,"22.3219581,70.8020793"
Gulzar-E-Madina Masjid,Mosque,"8Q6W+XRJ Gulzar-E-Madina Masjid, Shastri Nagar, Rajkot, Gujarat 360001",Shastri Nagar,8Q6W+XRJ,Rajkot,360001,Gujarat,IN,https://www.google.com/maps/place/Gulzar-E-Madina+Masjid/data=!4m7!3m6!1s0x3959c9f1b560c7cf:0x61f9e45dccdc6a7f!8m2!3d22.3124671!4d70.7970303!16s%2Fg%2F11c5bhhsjj!19sChIJz8dgtfHJWTkRf2rczF3k-WE?authuser=0&hl=en&rclk=1,"22.3124671,70.7970303"
Burhani Masjid,Mosque,"7RX5+R4F Burhani Masjid, Soni Bazar, Kansara Bazar, Lohana Para, Rajkot, Gujarat 360001","Soni Bazar, Kansara Bazar, Lohana Para",7RX5+R4F,Rajkot,360001,Gujarat,IN,https://www.google.com/maps/place/Burhani+Masjid/data=!4m7!3m6!1s0x3959ca011592973d:0x51d06a675bd99e19!8m2!3d22.2995518!4d70.8078074!16s%2Fg%2F1hc0srvff!19sChIJPZeSFQHKWTkRGZ7ZW2dq0FE?authuser=0&hl=en&rclk=1,"22.2995518,70.8078074"
Sunni Ghanchi Masjid,Mosque,"7RX5+3GV Sunni Ghanchi Masjid, opp. Suvarnachand Complex, Soni Bazar, Java Nagar, Old walled City, Rajkot, Gujarat 360001","Soni Bazar, Java Nagar, Old walled City","7RX5+3GV, opp. Suvarnachand Complex",Rajkot,360001,Gujarat,IN,https://www.google.com/maps/place/Sunni+Ghanchi+Masjid/data=!4m7!3m6!1s0x3959ca06d6f30fbb:0x5ce7d0c7be8a01ab!8m2!3d22.2977437!4d70.8088056!16s%2Fg%2F11b75hpmdd!19sChIJuw_z1gbKWTkRqwGKvsfQ51w?authuser=0&hl=en&rclk=1,"22.297743699999998,70.8088056"
Masjid E Mehboob,Mosque,"Masjid E Mehboob, 14, Popatpara Main Rd, popatpara, Popat Para, Rajkot, Gujarat 360001","popatpara, Popat Para","14, Popatpara Main Rd",Rajkot,360001,Gujarat,IN,https://www.google.com/maps/place/Masjid+E+Mehboob/data=!4m7!3m6!1s0x3959c91fab88d88d:0x74d64fb38f28b4e7!8m2!3d22.321213!4d70.7969083!16s%2Fg%2F11pwfdnzsb!19sChIJjdiIqx_JWTkR57Qoj7NP1nQ?authuser=0&hl=en&rclk=1,"22.321213,70.7969083"
Masjide Noori,Mosque,"Masjide Noori, Nurani Para Main Rd, Rajkot, Kotharia, Gujarat 360022",,Nurani Para Main Rd,"Rajkot, Kotharia",360022,Gujarat,IN,https://www.google.com/maps/place/Masjide+Noori/data=!4m7!3m6!1s0x3959caafabcc3593:0x923ee5ea35ec0aa!8m2!3d22.2206581!4d70.8028862!16s%2Fg%2F11dfjy7_ch!19sChIJkzXMq6_KWTkRqsBeo17uIwk?authuser=0&hl=en&rclk=1,"22.220658099999998,70.8028862"
Risala Masjid,Mosque,"8Q4W+2PG Risala Masjid, Sadar, Rajkot, Gujarat 360001",Sadar,8Q4W+2PG,Rajkot,360001,Gujarat,IN,https://www.google.com/maps/place/Risala+Masjid/data=!4m7!3m6!1s0x3959c9f6543c5aef:0x5e83190ea9e0d483!8m2!3d22.3050569!4d70.7968184!16s%2Fg%2F11c46583mz!19sChIJ71o8VPbJWTkRg9TgqQ4Zg14?authuser=0&hl=en&rclk=1,"22.3050569,70.79681839999999"
MAHIN MASJID,Mosque,"6RPC+48G MAHIN MASJID, Kothariya, Gujarat 360022",,6RPC+48G,Kothariya,360022,Gujarat,IN,https://www.google.com/maps/place/MAHIN+MASJID/data=!4m7!3m6!1s0x3959b55d75390f31:0x99f088e505b3bb85!8m2!3d22.2353191!4d70.8208376!16s%2Fg%2F11c1r29v07!19sChIJMQ85dV21WTkRhbuzBeWI8Jk?authuser=0&hl=en&rclk=1,"22.235319099999998,70.82083759999999"
Najmi Masjid,Mosque,"7RX5+Q34 Najmi Masjid, Soni Bazar, Kansara Bazar, Vorawad, Rajkot, Gujarat 360001","Soni Bazar, Kansara Bazar, Vorawad",7RX5+Q34,Rajkot,360001,Gujarat,IN,https://www.google.com/maps/place/Najmi+Masjid/data=!4m7!3m6!1s0x3959ca016a0d1029:0xe0a907b499fbb3bb!8m2!3d22.299381!4d70.807694!16s%2Fg%2F1hjgslbmj!19sChIJKRANagHKWTkRu7P7mbQHqeA?authuser=0&hl=en&rclk=1,"22.299381,70.807694"
Matwa Masjid msjd,Mosque,"7RX6+674 Matwa Masjid msjd, Khatriwad, Old walled City, Rajkot, Gujarat 360001","Khatriwad, Old walled City",7RX6+674,Rajkot,360001,Gujarat,IN,https://www.google.com/maps/place/Matwa+Masjid+%D9%85%D8%B3%D8%AC%D8%AF%E2%80%AD/data=!4m7!3m6!1s0x3959ca07497483d5:0x3b030846e77d2122!8m2!3d22.2980114!4d70.8107133!16s%2Fg%2F11cs3y1yg2!19sChIJ1YN0SQfKWTkRIiF950YIAzs?authuser=0&hl=en&rclk=1,"22.2980114,70.8107133"
Masjid E Hassnain,Mosque,"8R67+482 Masjid E Hassnain, Unnamed Road, Ranchhod Nagar, Rajkot, Gujarat 360003",Ranchhod Nagar,"8R67+482, Unnamed Road",Rajkot,360003,Gujarat,IN,https://www.google.com/maps/place/Masjid+E+Hassnain/data=!4m7!3m6!1s0x3959b7448e108373:0xd94b21de0d2b97c1!8m2!3d22.3102513!4d70.8132783!16s%2Fg%2F11h7cnx6kr!19sChIJc4MQjkS3WTkRwZcrDd4hS9k?authuser=0&hl=en&rclk=1,"22.310251299999997,70.8132783"
KSIA Masjid (Shia),Mosque,"KSIA Masjid (Shia), 127, Jamnagar Rd, Parsana Nagar, Shastri Nagar, Rajkot, Gujarat 360005","Parsana Nagar, Shastri Nagar","127, Jamnagar Rd",Rajkot,360005,Gujarat,IN,https://www.google.com/maps/place/KSIA+Masjid+%28Shia%29/data=!4m7!3m6!1s0x3959c9f2080f27fd:0x678b4ff288edfe0e!8m2!3d22.3134197!4d70.7933879!16s%2Fg%2F11g8xgcmlq!19sChIJ_ScPCPLJWTkRDv7tiPJPi2c?authuser=0&hl=en&rclk=1,"22.3134197,70.7933879"
Masjid-e-Taslim,Mosque,"Masjid-e-Taslim, 25 Square Meter, Ghanteshwer, Rajkot, Gujarat 360006","Sainik Society, Ghanteshwer",25 Square Meter,Rajkot,360006,Gujarat,IN,https://www.google.com/maps/place/Masjid-e-Taslim/data=!4m7!3m6!1s0x3959c957b9703399:0x421f8ec1357e24cf!8m2!3d22.3393941!4d70.7538233!16s%2Fg%2F11gms_c211!19sChIJmTNwuVfJWTkRzyR-NcGOH0I?authuser=0&hl=en&rclk=1,"22.3393941,70.7538233"
Rajkot Daudi Bohara Jamat Anjumane Hatimi Committe,Mosque,"7RX4+VHF Rajkot Daudi Bohara Jamat Anjumane Hatimi Committe, Kansara Bazar, Bangdi Bazar, Lohana Para, Rajkot, Gujarat 360001","Kansara Bazar, Bangdi Bazar, Lohana Para",7RX4+VHF,Rajkot,360001,Gujarat,IN,https://www.google.com/maps/place/Rajkot+Daudi+Bohara+Jamat+Anjumane+Hatimi+Committe/data=!4m7!3m6!1s0x3959ca1278f4820b:0x3bdb737607ec257b!8m2!3d22.299693!4d70.806412!16s%2Fg%2F1tdqfw7l!19sChIJC4L0eBLKWTkReyXsB3Zz2zs?authuser=0&hl=en&rclk=1,"22.299692999999998,70.806412"
Dawoodi Bohra Masjid,Mosque,"9W6W+2W2 Dawoodi Bohra Masjid, Kuvadva, Gujarat 360023",,9W6W+2W2,Kuvadva,360023,Gujarat,IN,https://www.google.com/maps/place/Dawoodi+Bohra+Masjid/data=!4m7!3m6!1s0x3959b10412d3adb1:0x63a0277034527425!8m2!3d22.3600042!4d70.9472604!16s%2Fg%2F11cm0br2jf!19sChIJsa3TEgSxWTkRJXRSNHAnoGM?authuser=0&hl=en&rclk=1,"22.3600042,70.94726039999999"
Hadala Masjid,Mosque,"CQR6+9CR Hadala Masjid, Hadala - Kothariya, Hadala, Gujarat 360003",,"CQR6+9CR, Hadala - Kothariya",Hadala,360003,Gujarat,IN,https://www.google.com/maps/place/Hadala+Masjid/data=!4m7!3m6!1s0x3959c7e70fca5547:0x78ad6310b2e83f6c!8m2!3d22.4409804!4d70.7610042!16s%2Fg%2F11fl_w2mld!19sChIJR1XKD-fHWTkRbD_oshBjrXg?authuser=0&hl=en&rclk=1,"22.440980399999997,70.7610042"
Madrasa Raza e Mustafa And (Ibadat-Gah) mdresaa rjhaa-e-mustphaa (iibaadt-gaah),Mosque,"8Q39+X5P Madrasa Raza e Mustafa And (Ibadat-Gah) mdresaa rjhaa-e-mustphaa (iibaadt-gaah), Unnamed Road, Girirajnagar, Rajkot, Gujarat 360005",Girirajnagar,"8Q39+X5P, Unnamed Road",Rajkot,360005,Gujarat,IN,https://www.google.com/maps/place/Madrasa+Raza+e+Mustafa+And+%28Ibadat-Gah%29+%E0%AA%AE%E0%AA%A6%E0%AB%8D%E0%AA%B0%E0%AB%87%E0%AA%B8%E0%AA%BE+%E0%AA%B0%E0%AA%9D%E0%AA%BE-%E0%AA%8F-%E0%AA%AE%E0%AB%81%E0%AA%B8%E0%AB%8D%E0%AA%A4%E0%AA%AB%E0%AA%BE+%28%E0%AA%88%E0%AA%AC%E0%AA%BE%E0%AA%A6%E0%AA%A4-%E0%AA%97%E0%AA%BE%E0%AA%B9%29/data=!4m7!3m6!1s0x3959c94046701e3f:0x82d844d7604f966!8m2!3d22.3049663!4d70.7679398!16s%2Fg%2F11nmldmgn0!19sChIJPx5wRkDJWTkRZvkEdk2ELQg?authuser=0&hl=en&rclk=1,"22.3049663,70.7679398"
JESANI HALL,Place of worship,"7RF9+433 JESANI HALL, Maheshwari Nagar, Jangleshwar, Rajkot, Gujarat 360002","Maheshwari Nagar, Jangleshwar",7RF9+433,Rajkot,360002,Gujarat,IN,https://www.google.com/maps/place/JESANI+HALL/data=!4m7!3m6!1s0x3959b5f2958b5e9b:0xaf708fe217c7c23d!8m2!3d22.2727568!4d70.8176612!16s%2Fg%2F11rc7n1hd3!19sChIJm16LlfK1WTkRPcLHF-KPcK8?authuser=0&hl=en&rclk=1,"22.2727568,70.8176612"
Khanqahe Qadiriya Chistiya Nizamiya Sabiriya,Place of worship,"1, Khanqahe Qadiriya Chistiya Nizamiya Sabiriya, near Akila Press, Bheelwas, Sadar Bazar, Sadar, Rajkot, Gujarat 360003","Bheelwas, Sadar Bazar, Sadar","1, near Akila Press",Rajkot,360003,Gujarat,IN,https://www.google.com/maps/place/Khanqahe+Qadiriya+Chistiya+Nizamiya+Sabiriya/data=!4m7!3m6!1s0x3959cb2a4bc333b9:0x608d5a333d92137e!8m2!3d22.2973286!4d70.795075!16s%2Fg%2F11snbsfnmz!19sChIJuTPDSyrLWTkRfhOSPTNajWA?authuser=0&hl=en&rclk=1,"22.2973286,70.795075"
Masjid E Ali Asgar,Mosque,"8VJH+V72 Masjid E Ali Asgar, Unnamed Road, Maliyasan, Gujarat 360003",,"8VJH+V72, Unnamed Road",Maliyasan,360003,Gujarat,IN,https://www.google.com/maps/place/Masjid+E+Ali+Asgar/data=!4m7!3m6!1s0x3959b7fbd516248f:0x23a94902127cacdd!8m2!3d22.3321307!4d70.8781366!16s%2Fg%2F11n_y4flt9!19sChIJjyQW1fu3WTkR3ax8EgJJqSM?authuser=0&hl=en&rclk=1,"22.3321307,70.87813659999999"
Dawoodi Bohra Noor Majid Trust,Association or organization,"Dawoodi Bohra Noor Majid Trust, Masjidwali Sheri, Navanaka Rd, Rajkot, Gujarat 360001",Sadar,"Masjidwali Sheri, Navanaka Rd",Rajkot,360001,Gujarat,IN,https://www.google.com/maps/place/Dawoodi+Bohra+Noor+Majid+Trust/data=!4m7!3m6!1s0x3959ca1278f4820b:0x34251608eef02353!8m2!3d22.3038945!4d70.8021599!16s%2Fg%2F1tg_dfrm!19sChIJC4L0eBLKWTkRUyPw7ggWJTQ?authuser=0&hl=en&rclk=1,"22.3038945,70.80215989999999"
Masjid e Fatima,Mosque,"Masjid e Fatima, 48, Gayatri Nagar, Gopal Nagar, Bhakti Nagar, Rajkot, Gujarat 360002","Gayatri Nagar, Gopal Nagar, Bhakti Nagar",48,Rajkot,360002,Gujarat,IN,https://www.google.com/maps/place/Masjid+e+Fatima/data=!4m7!3m6!1s0x3959cb9ca5ebc6c7:0x1f1b1fdad59501b!8m2!3d22.2714644!4d70.8016126!16s%2Fg%2F11twq_vgw5!19sChIJx8brpZzLWTkRG1BZrf2x8QE?authuser=0&hl=en&rclk=1,"22.2714644,70.8016126"
