name,main_category,address,address_ward,address_street,address_city,address_postal_code,address_state,address_country_code,link,coordinates
Naal Bando Wali Masjid nl bndwN wly msjd,Mosque,"9C7Q+7M8 Naal Bando Wali Masjid nl bndwN wly msjd, Old City, Qureshi Nagar, Bareilly, Uttar Pradesh 243005","Old City, Qureshi Nagar",9C7Q+7M8,Bareilly,,Uttar Pradesh,IN,https://www.google.com/maps/place/Naal+Bando+Wali+Masjid+%D9%86%D8%A7%D9%84+%D8%A8%D9%86%D8%AF%D9%88%DA%BA+%D9%88%D8%A7%D9%84%DB%8C+%D9%85%D8%B3%D8%AC%D8%AF%E2%80%AD/data=!4m7!3m6!1s0x39a006ce590b968b:0xe024102443ce3773!8m2!3d28.363158!4d79.4391969!16s%2Fg%2F11cp7dvmyq!19sChIJi5YLWc4GoDkRczfOQyQQJOA?authuser=0&hl=en&rclk=1,"28.363158,79.4391969"
Gadi Masjid,Mosque,"9CC4+FWV Gadi Masjid, Gulab Nagar, Bareilly, Uttar Pradesh 243003",Gulab Nagar,9CC4+FWV,Bareilly,243003,Uttar Pradesh,IN,https://www.google.com/maps/place/Gadi+Masjid/data=!4m7!3m6!1s0x39a0073ebf5e45b3:0x18f67d39d587271e!8m2!3d28.3712449!4d79.4072887!16s%2Fg%2F1pyqg6t3q!19sChIJs0Vevz4HoDkRHieH1Tl99hg?authuser=0&hl=en&rclk=1,"28.371244899999997,79.4072887"
Chaand Masjid chnd msjd,Mosque,"9C82+65R Chaand Masjid chnd msjd, Zakhira, Bareilly, Uttar Pradesh 243003",Zakhira,9C82+65R,Bareilly,243003,Uttar Pradesh,IN,https://www.google.com/maps/place/Chaand+Masjid+%DA%86%D8%A7%D9%86%D8%AF+%D9%85%D8%B3%D8%AC%D8%AF%E2%80%AD/data=!4m7!3m6!1s0x39a00747b4281f39:0x486bca23ca6f823!8m2!3d28.3656!4d79.4004!16s%2Fg%2F1pyqhn7fj!19sChIJOR8otEcHoDkRI_imPKK8hgQ?authuser=0&hl=en&rclk=1,"28.365599999999997,79.40039999999999"
Mustafa Masjid mSfy msjd,Mosque,"997V+G43 Mustafa Masjid mSfy msjd, Prem Nagar, Bareilly, Uttar Pradesh 243502",Prem Nagar,997V+G43,Bareilly,243502,Uttar Pradesh,IN,https://www.google.com/maps/place/Mustafa+Masjid+%D9%85%D8%B5%D9%81%DB%92%D9%B0+%D9%85%D8%B3%D8%AC%D8%AF%E2%80%AD/data=!4m7!3m6!1s0x39a007455e98b941:0xce7d46bfb5ed4899!8m2!3d28.363758!4d79.392805!16s%2Fg%2F1pyqpctyp!19sChIJQbmYXkUHoDkRmUjttb9Gfc4?authuser=0&hl=en&rclk=1,"28.363757999999997,79.392805"
Chirag Ali Shah Masjid,Mosque,"9C7M+QF4 Chirag Ali Shah Masjid, Mokat, Old City, Qureshi Nagar, Bareilly, Haziyapur, Uttar Pradesh 243005","Old City, Qureshi Nagar",9C7M+QF4 Mokat,"Bareilly, Haziyapur",,Uttar Pradesh,IN,https://www.google.com/maps/place/Chirag+Ali+Shah+Masjid/data=!4m7!3m6!1s0x39a006d0f78ebb27:0xcd5ebec31c726bfa!8m2!3d28.364398!4d79.433706!16s%2Fg%2F11c482x4hc!19sChIJJ7uO99AGoDkR-mtyHMO-Xs0?authuser=0&hl=en&rclk=1,"28.364397999999998,79.433706"
Bilal Masjid bll msjd,Mosque,"Bilal Masjid bll msjd, Jogi Navada, Bareilly, Uttar Pradesh 243005",Jogi Navada,,Bareilly,243005,Uttar Pradesh,IN,https://www.google.com/maps/place/Bilal+Masjid+%D8%A8%D9%84%D8%A7%D9%84+%D9%85%D8%B3%D8%AC%D8%AF%E2%80%AD/data=!4m7!3m6!1s0x39a006c6d9f4a7db:0x3c01f22fdcc39d62!8m2!3d28.3722998!4d79.4446582!16s%2Fg%2F11gb40hhm0!19sChIJ26f02cYGoDkRYp3D3C_yATw?authuser=0&hl=en&rclk=1,"28.3722998,79.44465819999999"
Masjid Hari Minar,Mosque,"998X+CG6 Masjid Hari Minar, Katghar, Bareilly, Uttar Pradesh 243502",Katghar,998X+CG6,Bareilly,243502,Uttar Pradesh,IN,https://www.google.com/maps/place/Masjid+Hari+Minar/data=!4m7!3m6!1s0x39a007465d35ab97:0x72ccaad71d5dfa17!8m2!3d28.36604!4d79.398764!16s%2Fg%2F1pyqgcg4w!19sChIJl6s1XUYHoDkRF_pdHdeqzHI?authuser=0&hl=en&rclk=1,"28.366039999999998,79.398764"
2 MINARA MASJID dw mynrh msjd,Mosque,"9C8X+QPH 2 MINARA MASJID dw mynrh msjd, Ezaz Nagar, Mustafa Munzil Ajaz Nagar, Bareilly, Uttar Pradesh 243005","Ezaz Nagar, Mustafa Munzil Ajaz Nagar",9C8X+QPH,Bareilly,243005,Uttar Pradesh,IN,https://www.google.com/maps/place/2+MINARA+MASJID+%D8%AF%D9%88+%D9%85%DB%8C%D9%86%D8%A7%D8%B1%DB%81+%D9%85%D8%B3%D8%AC%D8%AF%E2%80%AD/data=!4m7!3m6!1s0x39a0073787dc8929:0x4865acec90b824c5!8m2!3d28.3669306!4d79.4493706!16s%2Fg%2F11f9z64hr_!19sChIJKYnchzcHoDkRxSS4kOysZUg?authuser=0&hl=en&rclk=1,"28.3669306,79.4493706"
Gosia Masjid,Mosque,"CF54+MRC Gosia Masjid, N H 74, Peer Bahora, Sun City Vistaar, Bareilly, Uttar Pradesh 243122","Peer Bahora, Sun City Vistaar","CF54+MRC, N H 74",Bareilly,243122,Uttar Pradesh,IN,https://www.google.com/maps/place/Gosia+Masjid/data=!4m7!3m6!1s0x39a006649ca3383d:0x2792d39a6c033d71!8m2!3d28.4091815!4d79.4570096!16s%2Fg%2F1pyqsj062!19sChIJPTijnGQGoDkRcT0DbJrTkic?authuser=0&hl=en&rclk=1,"28.4091815,79.45700959999999"
Noori Masjid nwrysjd,Mosque,"Noori Masjid nwrysjd, Pilibhit Bypass Rd, Gardan City, Bareilly, Uttar Pradesh 243005",Gardan City,Pilibhit Bypass Rd,Bareilly,243005,Uttar Pradesh,IN,https://www.google.com/maps/place/Noori+Masjid+%D9%86%D9%88%D8%B1%DB%8C%D8%B3%D8%AC%D8%AF%E2%80%AD/data=!4m7!3m6!1s0x39a006b3f318346b:0x4b32367933e0462f!8m2!3d28.361!4d79.4539999!16s%2Fg%2F1pyqfqj2g!19sChIJazQY87MGoDkRL0bgM3k2Mks?authuser=0&hl=en&rclk=1,"28.360999999999997,79.4539999"
Jama Masjid jm` msjd,Mosque,"C93X+5QP Jama Masjid jm` msjd, Govindpur, Bareilly, Uttar Pradesh 243502",Govindpur,C93X+5QP,Bareilly,243502,Uttar Pradesh,IN,https://www.google.com/maps/place/Jama+Masjid+%D8%AC%D8%A7%D9%85%D8%B9+%D9%85%D8%B3%D8%AC%D8%AF%E2%80%AD/data=!4m7!3m6!1s0x39a0079edd753e2d:0xe3f0f998debcc2c6!8m2!3d28.4029564!4d79.3994675!16s%2Fg%2F11c30vzwhk!19sChIJLT513Z4HoDkRxsK83pj58OM?authuser=0&hl=en&rclk=1,"28.402956399999997,79.3994675"
Mosque,Mosque,"9CHG+QFR Mosque, Janakpuri, Bareilly, Uttar Pradesh 243003",Janakpuri,9CHG+QFR,Bareilly,243003,Uttar Pradesh,IN,https://www.google.com/maps/place/Mosque/data=!4m7!3m6!1s0x39a006e03adee9f1:0x21c9688d1cc3c22b!8m2!3d28.3794979!4d79.4261527!16s%2Fg%2F1w0p40v4!19sChIJ8eneOuAGoDkRK8LDHI1oySE?authuser=0&hl=en&rclk=1,"28.379497899999997,79.4261527"
Noorani Masjid,Mosque,"9FX2+922 Noorani Masjid, Bihar Mannagla Khand, Bareilly",North City Extension,"9FX2+922, Bihar Mannagla Khand",Bareilly,,Uttar Pradesh,IN,https://www.google.com/maps/place/Noorani+Masjid/data=!4m7!3m6!1s0x39a0068b0ded8acf:0x221c90a29ddaf667!8m2!3d28.3983964!4d79.4500285!16s%2Fg%2F11f558486t!19sChIJz4rtDYsGoDkRZ_banaKQHCI?authuser=0&hl=en&rclk=1,"28.3983964,79.4500285"
Masjid Hanfiya Gausiya ( Jama Masjid ),Mosque,"Masjid Hanfiya Gausiya ( Jama Masjid ), 20, Bareilly - Badaun Rd Mahaveer City Colony, Bareilly - Badaun Rd, Mahaveer City Colony, BDA Colony, Bareilly, Kargaina, Uttar Pradesh 243001","Mahaveer City Colony, BDA Colony","20, Bareilly - Badaun Rd Mahaveer City Colony, Bareilly - Badaun Rd","Bareilly, Kargaina",243001,Uttar Pradesh,IN,https://www.google.com/maps/place/Masjid+Hanfiya+Gausiya+%28+Jama+Masjid+%29/data=!4m7!3m6!1s0x39a000973c88cac3:0x4f92640d1628f2a6!8m2!3d28.3240576!4d79.393591!16s%2Fg%2F11g6qg9_t6!19sChIJw8qIPJcAoDkRpvIoFg1kkk8?authuser=0&hl=en&rclk=1,"28.3240576,79.393591"
Quadri Masjid qdry msjd,Mosque,"CC27+JGV Quadri Masjid qdry msjd, PARTAPUR CHAUDHRY, Bareilly, Uttar Pradesh 243122",Ram Nagar Colony,"CC27+JGV, PARTAPUR CHAUDHRY",Bareilly,243122,Uttar Pradesh,IN,https://www.google.com/maps/place/Quadri+Masjid+%D9%82%D8%A7%D8%AF%D8%B1%DB%8C+%D9%85%D8%B3%D8%AC%D8%AF%E2%80%AD/data=!4m7!3m6!1s0x39a007a7d95b87dd:0x2dbb7653feb96da3!8m2!3d28.4016216!4d79.4138101!16s%2Fg%2F1pyqlpv3s!19sChIJ3Ydb2acHoDkRo225_lN2uy0?authuser=0&hl=en&rclk=1,"28.4016216,79.41381009999999"
Masjid Abu Bakr msjd bw bkhr,Mosque,"9C6M+MVX Masjid Abu Bakr msjd bw bkhr, Qureshi Nagar, Bareilly, Haziyapur, Uttar Pradesh 243005",Qureshi Nagar,9C6M+MVX,"Bareilly, Haziyapur",243005,Uttar Pradesh,IN,https://www.google.com/maps/place/Masjid+Abu+Bakr+%D9%85%D8%B3%D8%AC%D8%AF+%D8%A7%D8%A8%D9%88+%D8%A8%DA%A9%D8%B1%E2%80%AD/data=!4m7!3m6!1s0x39a006d191aa7fa5:0xc5327bd1199ac85a!8m2!3d28.3617337!4d79.434733!16s%2Fg%2F11g86mrs0_!19sChIJpX-qkdEGoDkRWsiaGdF7MsU?authuser=0&hl=en&rclk=1,"28.3617337,79.434733"
Masjid Haji Kale Khan msjd Hjy khlykhn,Mosque,"9C5P+F95 Masjid Haji Kale Khan msjd Hjy khlykhn, Sindhu Nagar, Bareilly, Uttar Pradesh 243005",Sindhu Nagar,9C5P+F95,Bareilly,243005,Uttar Pradesh,IN,https://www.google.com/maps/place/Masjid+Haji+Kale+Khan+%D9%85%D8%B3%D8%AC%D8%AF+%D8%AD%D8%A7%D8%AC%DB%8C+%DA%A9%D8%A7%D9%84%DB%92%D8%AE%D8%A7%D9%86%E2%80%AD/data=!4m7!3m6!1s0x39a006d27afdaaad:0xe55ef46b79b16577!8m2!3d28.3586357!4d79.4359992!16s%2Fg%2F11cp5rcfr7!19sChIJrar9etIGoDkRd2WxeWv0XuU?authuser=0&hl=en&rclk=1,"28.358635699999997,79.4359992"
Noorani Masjid nwrny msjd,Mosque,"9C8J+8XX Noorani Masjid nwrny msjd, kankar Tala, Old City, Bareilly, Uttar Pradesh 243005",Old City,"9C8J+8XX, kankar Tala","Bareilly, Haziyapur",243005,Uttar Pradesh,IN,https://www.google.com/maps/place/Noorani+Masjid+%D9%86%D9%88%D8%B1%D8%A7%D9%86%DB%8C+%D9%85%D8%B3%D8%AC%D8%AF%E2%80%AD/data=!4m7!3m6!1s0x39a006d0989a62cb:0x8da86a9b6dd89d7e!8m2!3d28.3658748!4d79.4324737!16s%2Fg%2F11c483fpjq!19sChIJy2KamNAGoDkRfp3YbZtqqI0?authuser=0&hl=en&rclk=1,"28.3658748,79.4324737"
Masjid Umar msjd `mr,Mosque,"9C7C+FWV Masjid Umar msjd `mr, Kuppe Waalaan,, Alamgiri Ganj, Bareilly, Uttar Pradesh 243005",Alamgiri Ganj,"9C7C+FWV, Kuppe Waalaan,",Bareilly,243005,Uttar Pradesh,IN,https://www.google.com/maps/place/Masjid+Umar+%D9%85%D8%B3%D8%AC%D8%AF+%D8%B9%D9%85%D8%B1%E2%80%AD/data=!4m7!3m6!1s0x39a00728f6c16b51:0x3617894150dde403!8m2!3d28.3637344!4d79.4222846!16s%2Fg%2F11bw65tfr7!19sChIJUWvB9igHoDkRA-TdUEGJFzY?authuser=0&hl=en&rclk=1,"28.3637344,79.4222846"
Jama Masjid Saniya Rani Mewa Juwar C.b.Ganj Bareilly,Mosque,"Jama Masjid Saniya Rani Mewa Juwar C.b.Ganj Bareilly, Unnamed Road, 243502, Bareilly, Uttar Pradesh",,"Unnamed Road, 243502",Bareilly,,Uttar Pradesh,IN,https://www.google.com/maps/place/Jama+Masjid+Saniya+Rani+Mewa+Juwar+C.b.Ganj+Bareilly/data=!4m7!3m6!1s0x39a00789533e2857:0x3a9d27274905620b!8m2!3d28.4142771!4d79.3858705!16s%2Fg%2F11f3btvh06!19sChIJVyg-U4kHoDkRC2IFSScnnTo?authuser=0&hl=en&rclk=1,"28.4142771,79.3858705"
Bari Masjid,Mosque,"9CH2+P74 Bari Masjid, Gangawar Colony, Izatnagar, Bareilly, Uttar Pradesh 243502","Gangawar Colony, Izatnagar",9CH2+P74,Bareilly,243502,Uttar Pradesh,IN,https://www.google.com/maps/place/Bari+Masjid/data=!4m7!3m6!1s0x39a0076b0fbeeb65:0x2de619a61db651a6!8m2!3d28.3792591!4d79.400695!16s%2Fg%2F1pyqsg34v!19sChIJZeu-D2sHoDkRplG2HaYZ5i0?authuser=0&hl=en&rclk=1,"28.3792591,79.400695"
Muhammedi Masjid mHmdy msjd,Mosque,"Muhammedi Masjid mHmdy msjd, basnt vehar colony Rehpura Choudhary, Izatnagar, Bareilly, Uttar Pradesh 243122","Basant Vihar Colony, Izatnagar",basnt vehar colony Rehpura Choudhary,Bareilly,243122,Uttar Pradesh,IN,https://www.google.com/maps/place/Muhammedi+Masjid+%D9%85%D8%AD%D9%85%D8%AF%DB%8C+%D9%85%D8%B3%D8%AC%D8%AF%E2%80%AD/data=!4m7!3m6!1s0x39a0070857155a5b:0x2d2d3261e81b409f!8m2!3d28.3968819!4d79.4117118!16s%2Fg%2F11f4prjf4n!19sChIJW1oVVwgHoDkRn0Ab6GEyLS0?authuser=0&hl=en&rclk=1,"28.3968819,79.41171179999999"
Madrase Wali Masjid mdrsy wly msjd,Mosque,"9CFV+4RP Madrase Wali Masjid mdrsy wly msjd, Old City, Jogi Navada, Bareilly, Uttar Pradesh 243006","Old City, Jogi Navada",9CFV+4RP,Bareilly,243006,Uttar Pradesh,IN,https://www.google.com/maps/place/Madrase+Wali+Masjid+%D9%85%D8%AF%D8%B1%D8%B3%DB%92+%D9%88%D8%A7%D9%84%DB%8C+%D9%85%D8%B3%D8%AC%D8%AF%E2%80%AD/data=!4m7!3m6!1s0x39a006c6d3de3635:0x94ea61693db2b04e!8m2!3d28.3728287!4d79.4445809!16s%2Fg%2F11d_8g51n2!19sChIJNTbe08YGoDkRTrCyPWlh6pQ?authuser=0&hl=en&rclk=1,"28.3728287,79.44458089999999"
Raza Masjid,Mosque,"99HP+8XX Raza Masjid, Raza Nagar, Bareilly, Uttar Pradesh 243502",Raza Nagar,99HP+8XX,Bareilly,243502,Uttar Pradesh,IN,https://www.google.com/maps/place/Raza+Masjid/data=!4m7!3m6!1s0x39a00766ef790bf1:0x6f0a0fbb8f0a0ad7!8m2!3d28.3783558!4d79.3874727!16s%2Fg%2F1pyqw8hgp!19sChIJ8Qt572YHoDkR1woKj7sPCm8?authuser=0&hl=en&rclk=1,"28.378355799999998,79.38747269999999"
Sayyado wali noor masjid,Mosque,"9C4M+QQF Sayyado wali noor masjid, Sindhu Nagar, Bareilly, Uttar Pradesh 243005",Sindhu Nagar,9C4M+QQF,Bareilly,243005,Uttar Pradesh,IN,https://www.google.com/maps/place/Sayyado+wali+noor+masjid/data=!4m7!3m6!1s0x39a006d2e5bfb2d5:0x6014efde99ddd434!8m2!3d28.3569497!4d79.4344267!16s%2Fg%2F11hb79r3b9!19sChIJ1bK_5dIGoDkRNNTdmd7vFGA?authuser=0&hl=en&rclk=1,"28.356949699999998,79.4344267"
Hari Masjid Basti Wali hry msjd bsty wly,Mosque,"997V+WQF Hari Masjid Basti Wali hry msjd bsty wly, Baqarganj, Bareilly, Uttar Pradesh 243502",Baqarganj,997V+WQF,Bareilly,243502,Uttar Pradesh,IN,https://www.google.com/maps/place/Hari+Masjid+Basti+Wali+%DB%81%D8%B1%DB%8C+%D9%85%D8%B3%D8%AC%D8%AF+%D8%A8%D8%B3%D8%AA%DB%8C+%D9%88%D8%A7%D9%84%DB%8C%E2%80%AD/data=!4m7!3m6!1s0x39a007459fd6101d:0x25ad5a9dd2e546b3!8m2!3d28.3648149!4d79.3944335!16s%2Fg%2F11c6cch2fg!19sChIJHRDWn0UHoDkRs0bl0p1arSU?authuser=0&hl=en&rclk=1,"28.3648149,79.39443349999999"
Budh Wali Masjid bdh wly msjd,Mosque,"Budh Wali Masjid bdh wly msjd, Old City, Qureshi Nagar, Bareilly, Uttar Pradesh 243005","Old City, Qureshi Nagar",,Bareilly,243005,Uttar Pradesh,IN,https://www.google.com/maps/place/Budh+Wali+Masjid+%D8%A8%D8%AF%DA%BE+%D9%88%D8%A7%D9%84%DB%8C+%D9%85%D8%B3%D8%AC%D8%AF%E2%80%AD/data=!4m7!3m6!1s0x39a006ce69d12065:0x6841d85c51fdfef1!8m2!3d28.3625489!4d79.4385344!16s%2Fg%2F11cp7fgdp7!19sChIJZSDRac4GoDkR8f79UVzYQWg?authuser=0&hl=en&rclk=1,"28.3625489,79.4385344"
Masjid Ek Minar msjd ykh mynr,Mosque,"9CC7+QFW Masjid Ek Minar msjd ykh mynr, Gulab Nagar, Bareilly, Uttar Pradesh 243003",Gulab Nagar,9CC7+QFW,Bareilly,243003,Uttar Pradesh,IN,https://www.google.com/maps/place/Masjid+Ek+Minar+%D9%85%D8%B3%D8%AC%D8%AF+%D8%A7%DB%8C%DA%A9+%D9%85%DB%8C%D9%86%D8%A7%D8%B1%E2%80%AD/data=!4m7!3m6!1s0x39a0073cb68bcf15:0x50c76380070dcdc7!8m2!3d28.372!4d79.4137!16s%2Fg%2F1pyqj3p0j!19sChIJFc-LtjwHoDkRx80NB4Bjx1A?authuser=0&hl=en&rclk=1,"28.372,79.41369999999999"
JAMA MASJID Cantt jm` msjd khyntt,Mosque,"JAMA MASJID Cantt jm` msjd khyntt, 243001, Sadar Bazar, Sadar Colony, Bareilly, Uttar Pradesh 243001","Sadar Bazar, Sadar Colony",243001,Bareilly,243001,Uttar Pradesh,IN,https://www.google.com/maps/place/JAMA+MASJID+Cantt+%D8%AC%D8%A7%D9%85%D8%B9+%D9%85%D8%B3%D8%AC%D8%AF+%DA%A9%DB%8C%D9%86%D9%B9%E2%80%AD/data=!4m7!3m6!1s0x39a0010576e86d0d:0xdbd87401717e4b42!8m2!3d28.3178639!4d79.4357061!16s%2Fg%2F11cp7r40_7!19sChIJDW3odgUBoDkRQkt-cQF02Ns?authuser=0&hl=en&rclk=1,"28.3178639,79.43570609999999"
Noori Masjid nwry msjd,Mosque,"996R+RR4 Noori Masjid nwry msjd, Bakarganj, Prem Nagar, Uttar Pradesh 243003",Prem Nagar,"996R+RR4, Bakarganj",Bareilly,243003,Uttar Pradesh,IN,https://www.google.com/maps/place/Noori+Masjid+%D9%86%D9%88%D8%B1%DB%8C+%D9%85%D8%B3%D8%AC%D8%AF%E2%80%AD/data=!4m7!3m6!1s0x39a0074fe71eafe7:0x913ee3b8ae0ac55f!8m2!3d28.3620005!4d79.3920642!16s%2Fg%2F11bv2b5nb_!19sChIJ568e508HoDkRX8UKrrjjPpE?authuser=0&hl=en&rclk=1,"28.362000499999997,79.3920642"
Noori Raza Masjid nwry rD msjd,Mosque,"Noori Raza Masjid nwry rD msjd, Maheshpur atariya, C.B.Ganj, Bareilly, Uttar Pradesh 243502",C.B.Ganj,Maheshpur atariya,Bareilly,243502,Uttar Pradesh,IN,https://www.google.com/maps/place/Noori+Raza+Masjid+%D9%86%D9%88%D8%B1%DB%8C+%D8%B1%D8%B6%D8%A7+%D9%85%D8%B3%D8%AC%D8%AF%E2%80%AD/data=!4m7!3m6!1s0x390aa9d67cee19b7:0xe01332a1404cbddf!8m2!3d28.3904441!4d79.3777667!16s%2Fg%2F11hbpx2xrh!19sChIJtxnufNapCjkR371MQKEyE-A?authuser=0&hl=en&rclk=1,"28.3904441,79.3777667"
Masjid,Mosque,"9C9J+7CJ Masjid, City Heart Colony, Bareilly, Haziyapur, Uttar Pradesh 243005",City Heart Colony,9C9J+7CJ,"Bareilly, Haziyapur",243005,Uttar Pradesh,IN,https://www.google.com/maps/place/Masjid/data=!4m7!3m6!1s0x39a006d989df8a3f:0x10435ce539a959b4!8m2!3d28.3682104!4d79.431003!16s%2Fg%2F11hb8nbtq6!19sChIJP4rfidkGoDkRtFmpOeVcQxA?authuser=0&hl=en&rclk=1,"28.3682104,79.43100299999999"
Noori Masjid,Mosque,"CF29+X4H Noori Masjid, Unnamed Road, Dhaurera Mafi, Bareilly, Uttar Pradesh 243006",Dhaurera Mafi,"CF29+X4H, Unnamed Road",Bareilly,243006,Uttar Pradesh,IN,https://www.google.com/maps/place/Noori+Masjid/data=!4m7!3m6!1s0x39a00796157c5057:0xde8b3d61c3be0c75!8m2!3d28.402447!4d79.4678741!16s%2Fg%2F11f6q3_tls!19sChIJV1B8FZYHoDkRdQy-w2E9i94?authuser=0&hl=en&rclk=1,"28.402447,79.4678741"
Maqbare Wali Masjid mqbry wly msjd,Mosque,"997V+QC9 Maqbare Wali Masjid mqbry wly msjd, Baqarganj, Bareilly, Uttar Pradesh 243502",Baqarganj,997V+QC9,Bareilly,243502,Uttar Pradesh,IN,https://www.google.com/maps/place/Maqbare+Wali+Masjid+%D9%85%D9%82%D8%A8%D8%B1%DB%92+%D9%88%D8%A7%D9%84%DB%8C+%D9%85%D8%B3%D8%AC%D8%AF%E2%80%AD/data=!4m7!3m6!1s0x39a007456eb93a43:0xeb37f47aaf68412d!8m2!3d28.3644005!4d79.3936219!16s%2Fg%2F11g6925212!19sChIJQzq5bkUHoDkRLUFor3r0N-s?authuser=0&hl=en&rclk=1,"28.3644005,79.3936219"
masjid,Mosque,"9F58+8CH masjid, Harunagla, Bareilly, Uttar Pradesh 243006",Harunagla,9F58+8CH,Bareilly,243006,Uttar Pradesh,IN,https://www.google.com/maps/place/masjid/data=!4m7!3m6!1s0x39a006ab47f49d21:0x8349a3bd1e49b547!8m2!3d28.3583213!4d79.4661244!16s%2Fg%2F11dxq43xw2!19sChIJIZ30R6sGoDkRR7VJHr2jSYM?authuser=0&hl=en&rclk=1,"28.3583213,79.4661244"
Mustafa Masjid,Mosque,"Mustafa Masjid, 20, Bareilly - Badaun Rd Mahaveer City Colony, Bareilly - Badaun Rd, Mahaveer City Colony, BDA Colony, Bareilly, Kargaina, Uttar Pradesh 243001","Mahaveer City Colony, BDA Colony","20, Bareilly - Badaun Rd Mahaveer City Colony, Bareilly - Badaun Rd","Bareilly, Kargaina",243001,Uttar Pradesh,IN,https://www.google.com/maps/place/Mustafa+Masjid/data=!4m7!3m6!1s0x39a000973062479f:0x3959262d71ad44e!8m2!3d28.3236159!4d79.3935374!16s%2Fg%2F11d_8gm8jb!19sChIJn0diMJcAoDkRTtQa12KSlQM?authuser=0&hl=en&rclk=1,"28.3236159,79.3935374"
Neem Wali Masjid nym wly msjd,Mosque,"9C54+H2F Neem Wali Masjid nym wly msjd, Malookpur, Bareilly, Uttar Pradesh 243003",Malookpur,9C54+H2F,Bareilly,243003,Uttar Pradesh,IN,https://www.google.com/maps/place/Neem+Wali+Masjid+%D9%86%DB%8C%D9%85+%D9%88%D8%A7%D9%84%DB%8C+%D9%85%D8%B3%D8%AC%D8%AF%E2%80%AD/data=!4m7!3m6!1s0x39a0070c19a1704b:0x4a5a5415cc615ec5!8m2!3d28.3589283!4d79.4050558!16s%2Fg%2F11g_qn04v5!19sChIJS3ChGQwHoDkRxV5hzBVUWko?authuser=0&hl=en&rclk=1,"28.3589283,79.4050558"
Razvi Masjid,Mosque,"Razvi Masjid, 374, Chak Mehmood, Old City, Bidhouliya, Bareilly, Uttar Pradesh 243005","Chak Mehmood, Old City, Bidhouliya",374,Bareilly,243005,Uttar Pradesh,IN,https://www.google.com/maps/place/Razvi+Masjid/data=!4m7!3m6!1s0x39a006c89b39a747:0xdfbafb323c4cea70!8m2!3d28.3668129!4d79.4442996!16s%2Fg%2F11g8xgr109!19sChIJR6c5m8gGoDkRcOpMPDL7ut8?authuser=0&hl=en&rclk=1,"28.3668129,79.4442996"
Gausiya Masjid,Mosque,"Gausiya Masjid, 4th, Rampur Rd, Bareilly, Uttar Pradesh 243001, Rampur Rd, Ward Number 73, Bareilly, Uttar Pradesh 243001",Ward Number 73,"4th, Rampur Rd, Bareilly, Uttar Pradesh 243001, Rampur Rd",Bareilly,243001,Uttar Pradesh,IN,https://www.google.com/maps/place/Gausiya+Masjid/data=!4m7!3m6!1s0x39a0077c3988f413:0xb09540b1c88e560b!8m2!3d28.390414!4d79.3840126!16s%2Fg%2F11fx94vd89!19sChIJE_SIOXwHoDkRC1aOyLFAlbA?authuser=0&hl=en&rclk=1,"28.390414,79.38401259999999"
Gular Wali Masjid gwlrr wly msjd,Mosque,"9C84+RVP Gular Wali Masjid gwlrr wly msjd, sahukara, Bareilly, Uttar Pradesh 243003",sahukara,9C84+RVP,Bareilly,243003,Uttar Pradesh,IN,https://www.google.com/maps/place/Gular+Wali+Masjid+%DA%AF%D9%88%D9%84%DA%91+%D9%88%D8%A7%D9%84%DB%8C+%D9%85%D8%B3%D8%AC%D8%AF%E2%80%AD/data=!4m7!3m6!1s0x39a007399f17aabd:0x18c6ff4c27e12f96!8m2!3d28.3670961!4d79.4072069!16s%2Fg%2F1q66_kz1l!19sChIJvaoXnzkHoDkRli_hJ0z_xhg?authuser=0&hl=en&rclk=1,"28.367096099999998,79.40720689999999"
Ala Hazrat Masjid,Mosque,"8F9Q+QJ2 Ala Hazrat Masjid, Bareilly, Uttar Pradesh 243123",,8F9Q+QJ2,Bareilly,243123,Uttar Pradesh,IN,https://www.google.com/maps/place/Ala+Hazrat+Masjid/data=!4m7!3m6!1s0x39a003c9642c1073:0x4a01104ef0505a06!8m2!3d28.3193828!4d79.489021!16s%2Fg%2F11f0_dbt6l!19sChIJcxAsZMkDoDkRBlpQ8E4QAUo?authuser=0&hl=en&rclk=1,"28.3193828,79.489021"
Memran Masjid (Badi Masjid),Mosque,"9C9R+479 Memran Masjid (Badi Masjid), Chak Mehmood, Old City, Mustafa Munzil Ajaz Nagar, Bareilly, Uttar Pradesh 243005","Chak Mehmood, Old City, Mustafa Munzil Ajaz Nagar",9C9R+479,Bareilly,243005,Uttar Pradesh,IN,https://www.google.com/maps/place/Memran+Masjid+%28Badi+Masjid%29/data=!4m7!3m6!1s0x39a00760921245ad:0xb08b2dce06dd9d84!8m2!3d28.3677883!4d79.4407275!16s%2Fg%2F11gzmrj6vr!19sChIJrUUSkmAHoDkRhJ3dBs4ti7A?authuser=0&hl=en&rclk=1,"28.367788299999997,79.4407275"
Saqlaini masjid,Mosque,"Saqlaini masjid, Maheshpur atariya, Bareilly, Uttar Pradesh 243502",,Maheshpur atariya,Bareilly,,Uttar Pradesh,IN,https://www.google.com/maps/place/Saqlaini+masjid/data=!4m7!3m6!1s0x390aa9868e00cfe9:0x566d41cc90f2c0ef!8m2!3d28.387038!4d79.3800711!16s%2Fg%2F11hyzdjjc_!19sChIJ6c8AjoapCjkR78DykMxBbVY?authuser=0&hl=en&rclk=1,"28.387038,79.3800711"
Qadri Masjid,Mosque,"9C9W+4CX Qadri Masjid, Mustafa Munzil Ajaz Nagar, Bareilly, Uttar Pradesh 243005",Mustafa Munzil Ajaz Nagar,9C9W+4CX,Bareilly,243005,Uttar Pradesh,IN,https://www.google.com/maps/place/Qadri+Masjid/data=!4m7!3m6!1s0x39a006c7dc01c2dd:0xdfc4900a2669a0e0!8m2!3d28.3678727!4d79.4461086!16s%2Fg%2F11ggk5x8hb!19sChIJ3cIB3McGoDkR4KBpJgqQxN8?authuser=0&hl=en&rclk=1,"28.3678727,79.4461086"
Shia Masjid Sahaswani Tola Old City Bareilly,Mosque,"9C6R+CJR Shia Masjid Sahaswani Tola Old City Bareilly, mera ki paith, Old City, Qureshi Nagar, Bareilly, Uttar Pradesh 243005","Old City, Qureshi Nagar",9C6R+CJR mera ki paith,Bareilly,243005,Uttar Pradesh,IN,https://www.google.com/maps/place/Shia+Masjid+Sahaswani+Tola+Old+City+Bareilly/data=!4m7!3m6!1s0x39a006cc1cc81e75:0xac7273f0245dec37!8m2!3d28.3611014!4d79.4415146!16s%2Fg%2F11g9l4q5dn!19sChIJdR7IHMwGoDkRN-xdJPBzcqw?authuser=0&hl=en&rclk=1,"28.3611014,79.44151459999999"
Noori Masjid,Mosque,"CFCC+G9W Noori Masjid, Mudiya Ahmed Nagar, Bareilly, Uttar Pradesh 243006",Mudiya Ahmed Nagar,CFCC+G9W,Bareilly,243006,Uttar Pradesh,IN,https://www.google.com/maps/place/Noori+Masjid/data=!4m7!3m6!1s0x39a005d8ace11f29:0xa11c00fb706ed4df!8m2!3d28.4213736!4d79.4709477!16s%2Fg%2F1pyqmy9vn!19sChIJKR_hrNgFoDkR39RucPsAHKE?authuser=0&hl=en&rclk=1,"28.4213736,79.4709477"
Ek Raat Ki Masjid,Mosque,"Ek Raat Ki Masjid, 146/18, Alamgiri Ganj, Bareilly, Uttar Pradesh 243001",Alamgiri Ganj,146/18,Bareilly,243001,Uttar Pradesh,IN,https://www.google.com/maps/place/Ek+Raat+Ki+Masjid/data=!4m7!3m6!1s0x39a0075495bec3f5:0xd18d4f251bb69075!8m2!3d28.3660792!4d79.4212003!16s%2Fg%2F11s4b0y96c!19sChIJ9cO-lVQHoDkRdZC2GyVPjdE?authuser=0&hl=en&rclk=1,"28.366079199999998,79.4212003"
Banni Masjid msjd bny,Mosque,"9C46+WM7 Banni Masjid msjd bny, Unnamed Road, Bhoor, Bareilly, Uttar Pradesh 243003",Bhoor,"9C46+WM7, Unnamed Road",Bareilly,243003,Uttar Pradesh,IN,https://www.google.com/maps/place/Banni+Masjid+%D9%85%D8%B3%D8%AC%D8%AF+%D8%A8%D9%86%DB%8C%E2%80%AD/data=!4m7!3m6!1s0x39a0073249506493:0xb94d188ecfc178a!8m2!3d28.3572802!4d79.4116847!16s%2Fg%2F11f0_frhlr!19sChIJk2RQSTIHoDkRihf87IjRlAs?authuser=0&hl=en&rclk=1,"28.357280199999998,79.4116847"
Badshah Masjid,Mosque,"9C87+FMF Badshah Masjid, Alamgiri Ganj, Bareilly, Uttar Pradesh 243003",Alamgiri Ganj,9C87+FMF,Bareilly,243003,Uttar Pradesh,IN,https://www.google.com/maps/place/Badshah+Masjid/data=!4m7!3m6!1s0x39a007254b3960b1:0xca4f2240d5d4d233!8m2!3d28.3661991!4d79.4141791!16s%2Fg%2F11fzhsn7x5!19sChIJsWA5SyUHoDkRM9LU1UAiT8o?authuser=0&hl=en&rclk=1,"28.3661991,79.4141791"
Azhari Masjid zhr msjd,Mosque,"9C6R+R3R Azhari Masjid zhr msjd, Qureshi Nagar, Bareilly, Uttar Pradesh 243005",Qureshi Nagar,9C6R+R3R,Bareilly,243005,Uttar Pradesh,IN,https://www.google.com/maps/place/Azhari+Masjid+%D8%A7%D8%B2%DB%81%D8%B1+%D9%85%D8%B3%D8%AC%D8%AF%E2%80%AD/data=!4m7!3m6!1s0x39a0076e68ac5ef1:0x6c9e073459734e7b!8m2!3d28.3621058!4d79.4401488!16s%2Fg%2F11ghqc6xyn!19sChIJ8V6saG4HoDkRe05zWTQHnmw?authuser=0&hl=en&rclk=1,"28.3621058,79.4401488"
Raza Masjid,Mosque,"9CCR+XQC Raza Masjid, Jogi Nawada Near Gujran Shah wali Mazar, old City Bareilly shareef, 243006",Gopal Nagar,"9CCR+XQC, Jogi Nawada Near Gujran Shah wali Mazar, old City Bareilly shareef",Bareilly,243006,Uttar Pradesh,IN,https://www.google.com/maps/place/Raza+Masjid/data=!4m7!3m6!1s0x39a007f2e8688bc5:0xfb7710735cd3a04c!8m2!3d28.3724266!4d79.4419022!16s%2Fg%2F11gxmbq6pl!19sChIJxYto6PIHoDkRTKDTXHMQd_s?authuser=0&hl=en&rclk=1,"28.372426599999997,79.4419022"
Masjid Bareilly cantt,Mosque,"8CP7+5H5 Masjid Bareilly cantt, St Chowdary Rd, Civil Lines, Bareilly, Uttar Pradesh 243001",Civil Lines,"8CP7+5H5, St Chowdary Rd",Bareilly,243001,Uttar Pradesh,IN,https://www.google.com/maps/place/Masjid+Bareilly+cantt/data=!4m7!3m6!1s0x39a001b1c067ff5f:0xc3a5d071690fb6e8!8m2!3d28.3353988!4d79.4139791!16s%2Fg%2F11hzstnpn9!19sChIJX_9nwLEBoDkR6LYPaXHQpcM?authuser=0&hl=en&rclk=1,"28.3353988,79.41397909999999"
Mohammede masjid,Mosque,"9F72+F33 Mohammede masjid, Chakki Wali Gali, Mustafa Munzil Ajaz Nagar, Bareilly, Uttar Pradesh 243005",Mustafa Munzil Ajaz Nagar,"9F72+F33, Chakki Wali Gali",Bareilly,243005,Uttar Pradesh,IN,https://www.google.com/maps/place/Mohammede+masjid/data=!4m7!3m6!1s0x39a007168957cc13:0xbc86c59ff94315ec!8m2!3d28.3636445!4d79.4501625!16s%2Fg%2F11j0hn09ql!19sChIJE8xXiRYHoDkR7BVD-Z_Fhrw?authuser=0&hl=en&rclk=1,"28.3636445,79.45016249999999"
"Sabri Masjid, Gautia, Aijaz Nagar, Bareilly",Mosque,"9C9X+8CF Sabri Masjid, Gautia, Aijaz Nagar, Bareilly, Mustafa Munzil Ajaz Nagar, Bareilly, Uttar Pradesh 243005",Mustafa Munzil Ajaz Nagar,9C9X+8CF,Bareilly,243005,Uttar Pradesh,IN,"https://www.google.com/maps/place/Sabri+Masjid,+Gautia,+Aijaz+Nagar,+Bareilly/data=!4m7!3m6!1s0x39a007167a951537:0x7dc56e33b4ebb34c!8m2!3d28.3683178!4d79.448535!16s%2Fg%2F11ftwmm7pg!19sChIJNxWVehYHoDkRTLPrtDNuxX0?authuser=0&hl=en&rclk=1","28.3683178,79.44853499999999"
Masjid,Mosque,"22, Masjid, Bi Bazar Cantt, Civil Lines, Bareilly, Uttar Pradesh 243001",Civil Lines,"22, Bi Bazar Cantt",Bareilly,243001,Uttar Pradesh,IN,https://www.google.com/maps/place/Masjid/data=!4m7!3m6!1s0x39a0010f8d179e65:0x654fe56cb492f2f3!8m2!3d28.3293821!4d79.4296019!16s%2Fg%2F11v0by9k1g!19sChIJZZ4XjQ8BoDkR8_KStGzlT2U?authuser=0&hl=en&rclk=1,"28.3293821,79.4296019"
