name,main_category,address,address_ward,address_street,address_city,address_postal_code,address_state,address_country_code,link,coordinates
HAZRAT UMAR JAMA masjid,Mosque,"M546+FJ9 HAZRAT UMAR JAMA masjid, Baloda Bazar, Chhattisgarh 493332",,M546+FJ9,Baloda Bazar,493332,Chhattisgarh,IN,https://www.google.com/maps/place/HAZRAT+UMAR+JAMA+masjid/data=!4m7!3m6!1s0x3a28808e376cfa8b:0xb6c1b59ae9d68f74!8m2!3d21.6561715!4d82.1616105!16s%2Fg%2F11ddwzbrw0!19sChIJi_psN46AKDoRdI_W6Zq1wbY?authuser=0&hl=en&rclk=1,"21.6561715,82.1616105"
Minaar-e-Haidari,Mosque,"M546+FJ8 Minaar-e-Haidari, Baloda Bazar, Chhattisgarh 493332",,M546+FJ8,Baloda Bazar,493332,Chhattisgarh,IN,https://www.google.com/maps/place/Minaar-e-Haidari/data=!4m7!3m6!1s0x3a28808e37427629:0xfed5e74d0db39130!8m2!3d21.6561637!4d82.1615898!16s%2Fg%2F11c37n7qww!19sChIJKXZCN46AKDoRMJGzDU3n1f4?authuser=0&hl=en&rclk=1,"21.6561637,82.1615898"
Masjide Ameen E Shariat,Mosque,"M535+W5F Masjide Ameen E Shariat, Masjid Road, Baloda Bazar, Chhattisgarh 493332",,"M535+W5F, Masjid Road",Baloda Bazar,493332,Chhattisgarh,IN,https://www.google.com/maps/place/Masjide+Ameen+E+Shariat/data=!4m7!3m6!1s0x3a2881331a26c6ad:0x3df9cdaa83c574c7!8m2!3d21.6548064!4d82.1579069!16s%2Fg%2F11h27mzpvy!19sChIJrcYmGjOBKDoRx3TFg6rN-T0?authuser=0&hl=en&rclk=1,"21.6548064,82.1579069"
Vikas jewellers masjid complex Sadar road Baloda Bazar (CG),Jeweler,"Vikas jewellers masjid complex Sadar road Baloda Bazar (CG), Masjid complex, Sadar Rd, Baloda Bazar, Chhattisgarh 493332",,"Masjid complex, Sadar Rd",Baloda Bazar,493332,Chhattisgarh,IN,https://www.google.com/maps/place/Vikas+jewellers+masjid+complex+Sadar+road+Baloda+Bazar+%28CG%29/data=!4m7!3m6!1s0x3a2881d2e0622e59:0x622651aaeb42487c!8m2!3d21.6550816!4d82.1620313!16s%2Fg%2F11fr_vyzhd!19sChIJWS5i4NKBKDoRfEhC66pRJmI?authuser=0&hl=en&rclk=1,"21.6550816,82.1620313"
Eidgah Sharif,Mosque,"M535+M2X Eidgah Sharif, Kokadi, Baloda Bazar, Chhattisgarh 493332",,M535+M2X,"Kokadi, Baloda Bazar",493332,Chhattisgarh,IN,https://www.google.com/maps/place/Eidgah+Sharif/data=!4m7!3m6!1s0x3a2881f019191c03:0xce4c3c1eb3d36b47!8m2!3d21.6542479!4d82.157595!16s%2Fg%2F11t6476nxl!19sChIJAxwZGfCBKDoRR2vTsx48TM4?authuser=0&hl=en&rclk=1,"21.654247899999998,82.157595"
Paras ka khet,Mosque,"J4CH+FHJ Paras ka khet, Baloda Bazar, Chhattisgarh 493332",,J4CH+FHJ,Baloda Bazar,493332,Chhattisgarh,IN,https://www.google.com/maps/place/Paras+ka+khet/data=!4m7!3m6!1s0x3a2881165dace4ed:0xb3d0344c3a1b47f3!8m2!3d21.6212123!4d82.1288863!16s%2Fg%2F11y1_48rrb!19sChIJ7eSsXRaBKDoR80cbOkw00LM?authuser=0&hl=en&rclk=1,"21.6212123,82.12888629999999"
