name,main_category,address,address_ward,address_street,address_city,address_postal_code,address_state,address_country_code,link,coordinates
"SUNNI JAMIA MASJID SOHANDA ,JATWAL ,SAMBA",Mosque,"G5VF+XPM SUNNI JAMIA MASJID SOHANDA ,JATWAL ,SAMBA, SOHANDA JATWAL, Samba, Jammu and Kashmir 184141",,"G5VF+XPM, SOHANDA JATWAL","Samba, Chanori",184141,Jammu and Kashmir,IN,"https://www.google.com/maps/place/SUNNI+JAMIA+MASJID+SOHANDA+,JATWAL+,SAMBA/data=!4m7!3m6!1s0x391c171449ec943b:0xcff90f1582505101!8m2!3d32.5449717!4d75.1742929!16s%2Fg%2F11sr0fvr42!19sChIJO5TsSRQXHDkRAVFQghUP-c8?authuser=0&hl=en&rclk=1","32.5449717,75.1742929"
Jama masjid phalla badhori samba,Mosque,"Jama masjid phalla badhori samba, Jama masjid, Phalla, Badhori, Bari Brahmana, Samba, 181143","Badhori, Bari Brahmana","Jama masjid, Phalla",Samba,181143,,IN,https://www.google.com/maps/place/Jama+masjid+phalla+badhori+samba/data=!4m7!3m6!1s0x391c2702cb5dfc0f:0x5ae75f637753c11a!8m2!3d32.6243164!4d74.991037!16s%2Fg%2F11r_tz4k6r!19sChIJD_xdywInHDkRGsFTd2Nf51o?authuser=0&hl=en&rclk=1,"32.6243164,74.99103699999999"
Jama Masjid Nandani Samba,Mosque,"Jama Masjid Nandani Samba, Jama Masjid Nandani, near DC office, Darui, Jammu and Kashmir 184120",,"Jama Masjid Nandani, near DC office",Darui,,Jammu and Kashmir,IN,https://www.google.com/maps/place/Jama+Masjid+Nandani+Samba/data=!4m7!3m6!1s0x391c23276268b38b:0xb418c4541c3b5acb!8m2!3d32.5651098!4d75.0870164!16s%2Fg%2F11st_v60bh!19sChIJi7NoYicjHDkRy1o7HFTEGLQ?authuser=0&hl=en&rclk=1,"32.5651098,75.0870164"
Jamia masjid kotha plahmorh Samba,Mosque,"G5X8+8F Jamia masjid kotha plahmorh Samba, Nantar, 184141",,G5X8+8F,Nantar,,,IN,https://www.google.com/maps/place/Jamia+masjid+kotha+plahmorh+Samba/data=!4m7!3m6!1s0x391c174ed6e4482d:0xbac5264ef7e5489f!8m2!3d32.5483416!4d75.1662365!16s%2Fg%2F11tb_t3b09!19sChIJLUjk1k4XHDkRn0jl904mxbo?authuser=0&hl=en&rclk=1,"32.5483416,75.1662365"
Masjid e Allah hu Akbar Boli Samba,Mosque,"G3HH+4PM Masjid e Allah hu Akbar Boli Samba, Manohar gopala (boli, Samba, Jammu and Kashmir 184121",,"G3HH+4PM, Manohar gopala (boli","Samba, Chak Manga Rakwal",184121,Jammu and Kashmir,IN,https://www.google.com/maps/place/Masjid+e+Allah+hu+Akbar+Boli+Samba/data=!4m7!3m6!1s0x391c19fbda64fb6d:0x618288ab6b1a1c6b!8m2!3d32.5278352!4d75.0793076!16s%2Fg%2F11t6fyvbfh!19sChIJbftk2vsZHDkRaxwaa6uIgmE?authuser=0&hl=en&rclk=1,"32.5278352,75.07930759999999"
