name,main_category,address,address_ward,address_street,address_city,address_postal_code,address_state,address_country_code,link,coordinates
Madina Masjid Khunti,Mosque,"Madina Masjid Khunti, Jannat Road Nagar, Jannat Rd, Nagar, Khunti, Jharkhand 835210",Nagar,"Jannat Road Nagar, Jannat Rd",Khunti,835210,Jharkhand,IN,https://www.google.com/maps/place/Madina+Masjid+Khunti/data=!4m7!3m6!1s0x39f517d67ac20cfd:0xec4ff5dd7c5e81f!8m2!3d23.0803183!4d85.2742929!16s%2Fg%2F11c2njsh0q!19sChIJ_QzCetYX9TkRH-jF113_xA4?authuser=0&hl=en&rclk=1,"23.0803183,85.27429289999999"
Zohra Mosque,Mosque,"37FG+HR8 Zohra Mosque, Pasha Colony, Khunti, Jharkhand 835210",Pasha Colony,37FG+HR8,Khunti,835210,Jharkhand,IN,https://www.google.com/maps/place/Zohra+Mosque/data=!4m7!3m6!1s0x39f517d4a944c691:0xb4fa803391e401ed!8m2!3d23.0739175!4d85.2770708!16s%2Fg%2F11g6qzgmmh!19sChIJkcZEqdQX9TkR7QHkkTOA-rQ?authuser=0&hl=en&rclk=1,"23.0739175,85.27707079999999"
Jama Masjid Khunti,Mosque,"37GG+QCF Jama Masjid Khunti, masjid gali, Khunti, Jharkhand",Jannat Ganar,"37GG+QCF, masjid gali",Khunti,,Jharkhand,IN,https://www.google.com/maps/place/Jama+Masjid+Khunti/data=!4m7!3m6!1s0x39f517d45e4ab2f9:0xedb39e40719efdfd!8m2!3d23.0769339!4d85.2760435!16s%2Fg%2F11cs265hs8!19sChIJ-bJKXtQX9TkR_f2ecUCes-0?authuser=0&hl=en&rclk=1,"23.0769339,85.2760435"
Masjid-e-Qauser,Mosque,"37HG+M2J Masjid-e-Qauser, Jannat Ganar, Khunti, Jharkhand 835210",Jannat Ganar,37HG+M2J,Khunti,835210,Jharkhand,IN,https://www.google.com/maps/place/Masjid-e-Qauser/data=!4m7!3m6!1s0x39f5179cb40c33b5:0x5bcf5535fc0e502!8m2!3d23.0792209!4d85.2750304!16s%2Fg%2F11rj4w1sb9!19sChIJtTMMtJwX9TkRAuXAX1P1vAU?authuser=0&hl=en&rclk=1,"23.0792209,85.27503039999999"
Maktab mazharul madina shakh madrasa madinaturrasool jannat nagar khunti,Mosque,"37FH+M2J Maktab mazharul madina shakh madrasa madinaturrasool jannat nagar khunti, Azad Rd, Pasha Colony, Khunti, Jharkhand 835210",Pasha Colony,"37FH+M2J, Azad Rd",Khunti,835210,Jharkhand,IN,https://www.google.com/maps/place/Maktab+mazharul+madina+shakh+madrasa+madinaturrasool+jannat+nagar+khunti/data=!4m7!3m6!1s0x39f5175e245c3b2d:0xc2d9329d5715caf7!8m2!3d23.0742106!4d85.2775124!16s%2Fg%2F11rtmdtjb9!19sChIJLTtcJF4X9TkR98oVV50y2cI?authuser=0&hl=en&rclk=1,"23.0742106,85.27751239999999"
