name,main_category,address,address_ward,address_street,address_city,address_postal_code,address_state,address_country_code,link,coordinates
Srivari Mettu - Srinivasa Mangapuram,Hindu temple,"M86P+QWC Srivari Mettu - Srinivasa Mangapuram, Srinivasa Mangapuram Tirumala Rd, Tirupati, Andhra Pradesh 517504",,"M86P+QWC, Srinivasa Mangapuram Tirumala Rd",Tirupati,517504,Andhra Pradesh,IN,https://www.google.com/maps/place/Srivari+Mettu+-+Srinivasa+Mangapuram/data=!4m7!3m6!1s0x3bb2b5751669ab0b:0x65a0b5da561108f5!8m2!3d13.6619346!4d79.3372637!16s%2Fg%2F11c6w18cs5!19sChIJC6tpFnW1sjsR9QgRVtq1oGU?authuser=0&hl=en&rclk=1,"13.661934599999999,79.3372637"
Shri Varaha Swamy Temple,Hindu temple,"M8MX+X39 Shri Varaha Swamy Temple, Balaji Nagar, Tirumala, Tirupati, Andhra Pradesh 517504","Balaji Nagar, Tirumala",M8MX+X39,Tirupati,517504,Andhra Pradesh,IN,https://www.google.com/maps/place/Shri+Varaha+Swamy+Temple/data=!4m7!3m6!1s0x3bb2b56400000001:0x98fb44a3f9cbe8f8!8m2!3d13.6849119!4d79.3477234!16s%2Fg%2F11hb697_6m!19sChIJAQAAAGS1sjsR-OjL-aNE-5g?authuser=0&hl=en&rclk=1,"13.6849119,79.34772339999999"
Tirumala Annaprasadam,Food court,"M8PX+8PQ Tirumala Annaprasadam, Tirumala, Tirupati, Andhra Pradesh 517504",Tirumala,M8PX+8PQ,Tirupati,517504,Andhra Pradesh,IN,https://www.google.com/maps/place/Tirumala+Annaprasadam/data=!4m7!3m6!1s0x3bb2b57ea072dbed:0x2452be0097212ea2!8m2!3d13.6858491!4d79.349352!16s%2Fg%2F11j1mg_3r3!19sChIJ7dtyoH61sjsRoi4hlwC-UiQ?authuser=0&hl=en&rclk=1,"13.685849099999999,79.349352"
Swami Pushkarini,Hindu temple,"M8MX+Q52 Swami Pushkarini, Pushkarini St, Tirumala, Tirupathi, Tirupati, Andhra Pradesh 517504",Tirumala,"M8MX+Q52, Pushkarini St","Tirupathi, Tirupati",517504,Andhra Pradesh,IN,https://www.google.com/maps/place/Swami+Pushkarini/data=!4m7!3m6!1s0x3bb2ca9d5d48e667:0x279880e4eda37467!8m2!3d13.6843976!4d79.3478989!16s%2Fg%2F1trqfnjy!19sChIJZ-ZIXZ3KsjsRZ3Sj7eSAmCc?authuser=0&hl=en&rclk=1,"13.684397599999999,79.34789889999999"
TTD,Hindu temple,"M9M2+2H3 TTD, Balaji Nagar, Tirumala, Tirupati, Andhra Pradesh 517504","Balaji Nagar, Tirumala",M9M2+2H3,Tirupati,517504,Andhra Pradesh,IN,https://www.google.com/maps/place/TTD/data=!4m7!3m6!1s0x3bb2b5906e21bb37:0xc3d26111b5a3e30a!8m2!3d13.6825212!4d79.3514103!16s%2Fg%2F11j0yhnb7z!19sChIJN7shbpC1sjsRCuOjtRFh0sM?authuser=0&hl=en&rclk=1,"13.6825212,79.3514103"
Masjid E Rehmania,Mosque,"Masjid E Rehmania, 14-1-105, Nehru St, Mallaiah Gunta Katta, Tata Nagar, Tirupati, Andhra Pradesh 517501","Mallaiah Gunta Katta, Tata Nagar","14-1-105, Nehru St",Tirupati,517501,Andhra Pradesh,IN,https://www.google.com/maps/place/Masjid+E+Rehmania/data=!4m7!3m6!1s0x3a4d4b063b75dd5b:0xcc3692f4c8574873!8m2!3d13.6306161!4d79.4214456!16s%2Fg%2F1tmphyf2!19sChIJW911OwZLTToRc0hXyPSSNsw?authuser=0&hl=en&rclk=1,"13.6306161,79.4214456"
Masjid-E-Muhammadia,Mosque,"FH29+9C2 Masjid-E-Muhammadia, Tirumala Nagar, Moula Ali, Secunderabad, Telangana 500040","Tirumala Nagar, Moula Ali",FH29+9C2,Secunderabad,500040,Telangana,IN,https://www.google.com/maps/place/Masjid-E-Muhammadia/data=!4m7!3m6!1s0x3bcb9c0a2e1331fb:0xd89afba78e141d45!8m2!3d17.4508937!4d78.568511!16s%2Fg%2F1hhwy23ht!19sChIJ-zETLgqcyzsRRR0Ujqf7mtg?authuser=0&hl=en&rclk=1,"17.450893699999998,78.568511"
Masjid E Khadeem,Mosque,"293, Masjid E Khadeem, P P, Chavadi St, Balaji Colony, Tirupati, Andhra Pradesh 517501",Balaji Colony,"293, P P, Chavadi St",Tirupati,517501,Andhra Pradesh,IN,https://www.google.com/maps/place/Masjid+E+Khadeem/data=!4m7!3m6!1s0x3a4d4b1ac54c1fc1:0xa0ce83f31698385d!8m2!3d13.6314434!4d79.4135852!16s%2Fg%2F1pyqfy3ky!19sChIJwR9MxRpLTToRXTiYFvODzqA?authuser=0&hl=en&rclk=1,"13.6314434,79.4135852"
MASJID-E-QUBA,Mosque,"JC9Q+F8R MASJID-E-QUBA, Korramenugunta, Tirupati, Andhra Pradesh 517501",Korramenugunta,JC9Q+F8R,Tirupati,517501,Andhra Pradesh,IN,https://www.google.com/maps/place/MASJID-E-QUBA/data=!4m7!3m6!1s0x3a4d4b97de861729:0xa65410b3bfe34079!8m2!3d13.6187451!4d79.4382505!16s%2Fg%2F11f03zx2pn!19sChIJKReG3pdLTToReUDjv7MQVKY?authuser=0&hl=en&rclk=1,"13.6187451,79.4382505"
Masjid E Firdos Ahle Hadees,Mosque,"Masjid E Firdos Ahle Hadees, 13-5-531/f4a, 3rd Rd, Mallaiah Gunta Katta, Tata Nagar, Tirupati, Andhra Pradesh 517501","Mallaiah Gunta Katta, Tata Nagar","13-5-531/f4a, 3rd Rd",Tirupati,517501,Andhra Pradesh,IN,https://www.google.com/maps/place/Masjid+E+Firdos+Ahle+Hadees/data=!4m7!3m6!1s0x3a4d4b07834149dd:0x114cd4f0566ccea8!8m2!3d13.6324095!4d79.4246983!16s%2Fg%2F11c3x9nrgr!19sChIJ3UlBgwdLTToRqM5sVvDUTBE?authuser=0&hl=en&rclk=1,"13.6324095,79.4246983"
"MAKKA MASJID, KUKKALA DODDI",Mosque,"QCP9+CGF MAKKA MASJID, KUKKALA DODDI, Andhra Pradesh 516001",,QCP9+CGF,,516001,Andhra Pradesh,IN,"https://www.google.com/maps/place/MAKKA+MASJID,+KUKKALA+DODDI/data=!4m7!3m6!1s0x3a4d337bcf61c4c9:0x448ccb611bf57886!8m2!3d13.7860651!4d79.4187971!16s%2Fg%2F11bwc9nmy6!19sChIJycRhz3szTToRhnj1G2HLjEQ?authuser=0&hl=en&rclk=1","13.7860651,79.41879709999999"
Hazrat Syed Hussain Shah Vali Darga Shareef,Place of worship,"JCPC+V3X Hazrat Syed Hussain Shah Vali Darga Shareef, VV Mahal Rd, Bhavani Nagar, Tirupati, Andhra Pradesh 517501",Bhavani Nagar,"JCPC+V3X, VV Mahal Rd",Tirupati,517501,Andhra Pradesh,IN,https://www.google.com/maps/place/Hazrat+Syed+Hussain+Shah+Vali+Darga+Shareef/data=!4m7!3m6!1s0x3a4d4b0164268607:0xcd49424f4df8ea7f!8m2!3d13.637225!4d79.420221!16s%2Fg%2F1pyqnkz9v!19sChIJB4YmZAFLTToRf-r4TU9CSc0?authuser=0&hl=en&rclk=1,"13.637224999999999,79.420221"
Masjid E Kareem,Mosque,"JCRH+C82 Masjid E Kareem, Korlagunta, Tirupati, Andhra Pradesh 517501",Korlagunta,JCRH+C82,Tirupati,517501,Andhra Pradesh,IN,https://www.google.com/maps/place/Masjid+E+Kareem/data=!4m7!3m6!1s0x3a4d4bab29c9d6ad:0xec2a5c37d50a5d77!8m2!3d13.6410163!4d79.4282681!16s%2Fg%2F11g8k09wdx!19sChIJrdbJKatLTToRd10K1TdcKuw?authuser=0&hl=en&rclk=1,"13.641016299999999,79.4282681"
Ahle Sunnath Wal Jamath Masjid-E-Taufeeque,Mosque,"JCGP+H56 Ahle Sunnath Wal Jamath Masjid-E-Taufeeque, Korramenugunta, Tirupati, Andhra Pradesh 517501",Korramenugunta,JCGP+H56,Tirupati,517501,Andhra Pradesh,IN,https://www.google.com/maps/place/Ahle+Sunnath+Wal+Jamath+Masjid-E-Taufeeque/data=!4m7!3m6!1s0x3a4d4ba4c03ef125:0xd12d1e24c3a37eab!8m2!3d13.6264148!4d79.4353835!16s%2Fg%2F1pyqfl9mz!19sChIJJfE-wKRLTToRq36jwyQeLdE?authuser=0&hl=en&rclk=1,"13.6264148,79.4353835"
Masjid E Mubarak Musalla Tirupati,Mosque,"JCG8+FP8 Masjid E Mubarak Musalla Tirupati, Royal Nagar, Tirupati, Andhra Pradesh 517501",Royal Nagar,JCG8+FP8,Tirupati,517501,Andhra Pradesh,IN,https://www.google.com/maps/place/Masjid+E+Mubarak+Musalla+Tirupati/data=!4m7!3m6!1s0x3a4d4b0ef883aa97:0x7316a5e9a9d7d06!8m2!3d13.6261531!4d79.416823!16s%2Fg%2F11c70btx5v!19sChIJl6qD-A5LTToRBn2dml5qMQc?authuser=0&hl=en&rclk=1,"13.6261531,79.416823"
Thirumala Muslim Mosque,Mosque,"FXWP+J2J Thirumala Muslim Mosque, AKG Rd, MSP Nagar, Kesari Nagar, Poojapura, Thiruvananthapuram, Kerala 695012","MSP Nagar, Kesari Nagar, Poojapura","FXWP+J2J, AKG Rd",Thiruvananthapuram,695012,Kerala,IN,https://www.google.com/maps/place/Thirumala+Muslim+Mosque/data=!4m7!3m6!1s0x3b05ba42fad94c81:0x5d3e171d96a8fc3e!8m2!3d8.4965875!4d76.985026!16s%2Fg%2F1ptyf13k2!19sChIJgUzZ-kK6BTsRPvyolh0XPl0?authuser=0&hl=en&rclk=1,"8.4965875,76.98502599999999"
VIP Break Darshan,Hindu temple,"M8JW+4CC VIP Break Darshan, Tirumala, Tirupati, Andhra Pradesh 517504",Tirumala,M8JW+4CC,Tirupati,517504,Andhra Pradesh,IN,https://www.google.com/maps/place/VIP+Break+Darshan/data=!4m7!3m6!1s0x3bb2b5fbce785359:0xd591e23e30b95d57!8m2!3d13.680553!4d79.345914!16s%2Fg%2F11tcvqm6yy!19sChIJWVN4zvu1sjsRV125MD7ikdU?authuser=0&hl=en&rclk=1,"13.680553,79.345914"
Masjid E Dasyanagunta Tirupati,Mosque,"JCMF+XQW Masjid E Dasyanagunta Tirupati, Kotramangalam, Tirupati, Andhra Pradesh 517501",Kotramangalam,JCMF+XQW,Tirupati,517501,Andhra Pradesh,IN,https://www.google.com/maps/place/Masjid+E+Dasyanagunta+Tirupati/data=!4m7!3m6!1s0x3a4d4b0739b7ec05:0x898710d421263f35!8m2!3d13.6349952!4d79.4244539!16s%2Fg%2F11g6rlk4cr!19sChIJBey3OQdLTToRNT8mIdQQh4k?authuser=0&hl=en&rclk=1,"13.634995199999999,79.4244539"
Macca Masjid,Mosque,"JFMW+82V Macca Masjid, Renigunta, Tirupati, Andhra Pradesh 517520",,JFMW+82V,"Renigunta, Tirupati",,Andhra Pradesh,IN,https://www.google.com/maps/place/Macca+Masjid/data=!4m7!3m6!1s0x3a4d495686d7c3fd:0x9521e092b31c4568!8m2!3d13.6333723!4d79.4950587!16s%2Fg%2F11g1j5nf9s!19sChIJ_cPXhlZJTToRaEUcs5LgIZU?authuser=0&hl=en&rclk=1,"13.6333723,79.4950587"
Masjid E Hamza,Mosque,"JCJ7+P74 Masjid E Hamza, Kola Rd, Balaji Colony, Tirupati, Andhra Pradesh 517501",Balaji Colony,"JCJ7+P74, Kola Rd",Tirupati,517501,Andhra Pradesh,IN,https://www.google.com/maps/place/Masjid+E+Hamza/data=!4m7!3m6!1s0x3a4d4b1adbaf2899:0xfb36a9e439929a77!8m2!3d13.631755!4d79.413208!16s%2Fg%2F1pyqq3dg7!19sChIJmSiv2xpLTToRd5qSOeSpNvs?authuser=0&hl=en&rclk=1,"13.631755,79.413208"
Jamia Masjid,Mosque,"H8M6+4P9 Jamia Masjid, Chandragiri, Andhra Pradesh 517101",,H8M6+4P9,Chandragiri,517101,Andhra Pradesh,IN,https://www.google.com/maps/place/Jamia+Masjid/data=!4m7!3m6!1s0x3bb2b3f324ffdb4d:0x7cb960606114ea50!8m2!3d13.5827894!4d79.3118506!16s%2Fg%2F11c5_7mt_9!19sChIJTdv_JPOzsjsRUOoUYWBguXw?authuser=0&hl=en&rclk=1,"13.5827894,79.3118506"
Masjid Al Rahmah,Mosque,"2F5X+WCX Masjid Al Rahmah, Tirumala Pichigundlapalle, Andhra Pradesh 517424",,2F5X+WCX,Tirumala Pichigundlapalle,517424,Andhra Pradesh,IN,https://www.google.com/maps/place/Masjid+Al+Rahmah/data=!4m7!3m6!1s0x3bad9a2010062725:0x60037c28158bb60e!8m2!3d13.0098693!4d78.4986094!16s%2Fg%2F11f2xn5h57!19sChIJJScGECCarTsRDraLFSh8A2A?authuser=0&hl=en&rclk=1,"13.0098693,78.49860939999999"
Madina Masjid,Mosque,"MF46+MF5 Madina Masjid, Unnamed Road, Sapthagiri Colony, Mangalam, Tirupati, Andhra Pradesh 517507","Sapthagiri Colony, Mangalam","MF46+MF5, Unnamed Road",Tirupati,517507,Andhra Pradesh,IN,https://www.google.com/maps/place/Madina+Masjid/data=!4m7!3m6!1s0x3a4d4b9901629411:0x5e8ae7e5877f13e2!8m2!3d13.6566375!4d79.4612344!16s%2Fg%2F11h7cvfnm6!19sChIJEZRiAZlLTToR4hN_h-Xnil4?authuser=0&hl=en&rclk=1,"13.656637499999999,79.4612344"
masjid A fathima,Mosque,"HFXX+77X masjid A fathima, Kollabylu Rural, Andhra Pradesh 517325",,HFXX+77X,Kollabylu Rural,,Andhra Pradesh,IN,https://www.google.com/maps/place/masjid+A+fathima/data=!4m7!3m6!1s0x3bb2670ca672fac3:0x3fe259262d7aeb6b!8m2!3d13.5982408!4d78.4982257!16s%2Fg%2F11fll1l4hv!19sChIJw_pypgxnsjsRa-t6LSZZ4j8?authuser=0&hl=en&rclk=1,"13.5982408,78.49822569999999"
Masjid E Sumaiya,Mosque,"R7F6+PGM Masjid E Sumaiya, Bhimadole - Dwaraka Tirumala Rd, Bhimadole, Polasanapalli, Andhra Pradesh 534425",,"R7F6+PGM, Bhimadole - Dwaraka Tirumala Rd","Bhimadole, Polasanapalli",534425,Andhra Pradesh,IN,https://www.google.com/maps/place/Masjid+E+Sumaiya/data=!4m7!3m6!1s0x3a36440316e2def9:0xb95e475958e69f03!8m2!3d16.8243267!4d81.2613007!16s%2Fg%2F11g6mh9zm_!19sChIJ-d7iFgNENjoRA5_mWFlHXrk?authuser=0&hl=en&rclk=1,"16.8243267,81.26130069999999"
Kareem Mosque,Mosque,"JCQH+JM9 Kareem Mosque, Sanjay Gandhi Colony, Akkarampalle, Tirupati, Andhra Pradesh 517501","Sanjay Gandhi Colony, Akkarampalle",JCQH+JM9,Tirupati,517501,Andhra Pradesh,IN,https://www.google.com/maps/place/Kareem+Mosque/data=!4m7!3m6!1s0x3a4d4bab0c000001:0xd07cbe187f07bf61!8m2!3d13.6390407!4d79.4292399!16s%2Fg%2F11b8v9rqyf!19sChIJAQAADKtLTToRYb8Hfxi-fNA?authuser=0&hl=en&rclk=1,"13.639040699999999,79.4292399"
Mosque,Mosque,"R62V+Q6J Mosque, Pathuru, Andhra Pradesh 534427",,R62V+Q6J,Pathuru,,Andhra Pradesh,IN,https://www.google.com/maps/place/Mosque/data=!4m7!3m6!1s0x3a36419ee349b74d:0x2c6212cf19d6d9dd!8m2!3d16.801956!4d81.2430123!16s%2Fg%2F11fhr06hpz!19sChIJTbdJ455BNjoR3dnWGc8SYiw?authuser=0&hl=en&rclk=1,"16.801956,81.24301229999999"
Madina Masjid,Mosque,"2F9V+2WC Madina Masjid, Nernipalli village ,v. Kota m, Nernipalli, Andhra Pradesh",,"2F9V+2WC, Nernipalli village ,v. Kota m","Nernipalli, Tirumala Pichigundlapalle",,Andhra Pradesh,IN,https://www.google.com/maps/place/Madina+Masjid/data=!4m7!3m6!1s0x3bad9bee2830f8ab:0x257b892b5d2635a!8m2!3d13.0175663!4d78.4947778!16s%2Fg%2F11ghq3f089!19sChIJq_gwKO6brTsRWmPStZK4VwI?authuser=0&hl=en&rclk=1,"13.017566299999999,78.4947778"
Bismillah Masjid,Mosque,"63CQ+F4H Bismillah Masjid, Thenabanda, Thenabanda Dargah, Chittoor, Andhra Pradesh 517004","Thenabanda, Thenabanda Dargah",63CQ+F4H,Chittoor,517004,Andhra Pradesh,IN,https://www.google.com/maps/place/Bismillah+Masjid/data=!4m7!3m6!1s0x3bad5ea1e8cea87f:0x81f8c9f687a82406!8m2!3d13.2211985!4d79.0878683!16s%2Fg%2F11c327_3qb!19sChIJf6jO6KFerTsRBiSoh_bJ-IE?authuser=0&hl=en&rclk=1,"13.2211985,79.0878683"
Masjid Tirmalam Palem,Mosque,"V7XF+VJR Masjid Tirmalam Palem, Tirumalam Palem, Andhra Pradesh 534426",,V7XF+VJR,Tirumalam Palem,534426,Andhra Pradesh,IN,https://www.google.com/maps/place/Masjid+Tirmalam+Palem/data=!4m7!3m6!1s0x3a3645a56da10555:0x9e634e07411817f6!8m2!3d16.8997453!4d81.2740256!16s%2Fg%2F11f8hxkjk7!19sChIJVQWhbaVFNjoR9hcYQQdOY54?authuser=0&hl=en&rclk=1,"16.8997453,81.2740256"
Nernipalli Eidgah,Mosque,"2F8V+GHJ Nernipalli Eidgah, Nernipalli, Tirumala Pichigundlapalle, Andhra Pradesh 517424",,2F8V+GHJ,"Nernipalli, Tirumala Pichigundlapalle",,Andhra Pradesh,IN,https://www.google.com/maps/place/Nernipalli+Eidgah/data=!4m7!3m6!1s0x3bad9b983fed1781:0xbf1fa5691d9b01bf!8m2!3d13.0163391!4d78.493896!16s%2Fg%2F11q3sgt03p!19sChIJgRftP5ibrTsRvwGbHWmlH78?authuser=0&hl=en&rclk=1,"13.0163391,78.49389599999999"
Eidgah Mamandur,Mosque,"PFX6+526 Eidgah Mamandur, Mamandur, Andhra Pradesh 517619",,PFX6+526,Mamandur,,Andhra Pradesh,IN,https://www.google.com/maps/place/Eidgah+Mamandur/data=!4m7!3m6!1s0x3a4d350d33068f9d:0x122fcf156587fa8e!8m2!3d13.7479216!4d79.4600121!16s%2Fg%2F11gk7fkyh8!19sChIJnY8GMw01TToRjvqHZRXPLxI?authuser=0&hl=en&rclk=1,"13.7479216,79.4600121"
Hazrat rahamtullah sha Qhadri(RA) DARGAH SHRINE,Shrine,"JCG2+6R8 Hazrat rahamtullah sha Qhadri(RA) DARGAH SHRINE, Sri Venkateswara University Rd, Prakasam Nagar Colony, Sri Padmavati Mahila Visvavidyalayam, Tirupati, Andhra Pradesh 517502","Prakasam Nagar Colony, Sri Padmavati Mahila Visvavidyalayam","JCG2+6R8, Sri Venkateswara University Rd",Tirupati,517502,Andhra Pradesh,IN,https://www.google.com/maps/place/Hazrat+rahamtullah+sha+Qhadri%28RA%29+DARGAH+SHRINE/data=!4m7!3m6!1s0x3a4d4b25ba5efc5d:0x45eef2b58c75b96c!8m2!3d13.6255435!4d79.4020893!16s%2Fg%2F11t5k97jdf!19sChIJXfxeuiVLTToRbLl1jLXy7kU?authuser=0&hl=en&rclk=1,"13.6255435,79.4020893"
Jamia Masjid,Mosque,"2F8W+R2M Jamia Masjid, Nernipalli, Tirumala Pichigundlapalle, Andhra Pradesh 517424",,2F8W+R2M,"Nernipalli, Tirumala Pichigundlapalle",,Andhra Pradesh,IN,https://www.google.com/maps/place/Jamia+Masjid/data=!4m7!3m6!1s0x3bad9b5dcd0bdf4f:0xdb0fc24ecf90b90d!8m2!3d13.0170891!4d78.4950389!16s%2Fg%2F11swqqf_tc!19sChIJT98LzV2brTsRDbmQz07CD9s?authuser=0&hl=en&rclk=1,"13.0170891,78.4950389"
Madeena Masjid,Mosque,"9CJG+PP2 Madeena Masjid, Tirumala Reddy Palli, Andhra Pradesh 517417",,9CJG+PP2,Tirumala Reddy Palli,,Andhra Pradesh,IN,https://www.google.com/maps/place/Madeena+Masjid/data=!4m7!3m6!1s0x3bb2719a5e3b0989:0x8d6173d13d9ca3e8!8m2!3d13.3817612!4d78.426761!16s%2Fg%2F11rz2rh8l4!19sChIJiQk7XppxsjsR6KOcPdFzYY0?authuser=0&hl=en&rclk=1,"13.3817612,78.426761"
Tirumala,,"Tirumala, Tirupati, Andhra Pradesh",Tirumala,,Tirupati,,Andhra Pradesh,IN,https://www.google.com/maps/place/Tirumala/data=!4m7!3m6!1s0x3bb2b562cc4e1291:0x85a1996b4b87bcf6!8m2!3d13.6807357!4d79.3508975!16s%2Fm%2F0c417rs!19sChIJkRJOzGK1sjsR9ryHS2uZoYU?authuser=0&hl=en&rclk=1,"13.6807357,79.3508975"
