name,main_category,address,address_ward,address_street,address_city,address_postal_code,address_state,address_country_code,link,coordinates
MADRASA ARABIA DARUL QURAN AND JAMIA MOSQUE,Mosque,"8MJ9+52J MADRASA ARABIA DARUL QURAN AND JAMIA MOSQUE, VILLAGE AND P.O EAST DWIPOR PAR ,P.S TUFANGANJ DISTRICT WEST BENGAL, Tufanganj, West Bengal 736131",Suknirpar Dham,"8MJ9+52J, VILLAGE AND P.O EAST DWIPOR PAR ,P.S TUFANGANJ DISTRICT WEST BENGAL","Tufanganj, Andaran Phulbari",736131,West Bengal,IN,https://www.google.com/maps/place/MADRASA+ARABIA+DARUL+QURAN+AND+JAMIA+MOSQUE/data=!4m7!3m6!1s0x39e2f4815555553b:0x140649ad9afd2396!8m2!3d26.330464!4d89.667514!16s%2Fg%2F11b8_s89wj!19sChIJO1VVVYH04jkRliP9mq1JBhQ?authuser=0&hl=en&rclk=1,"26.330464,89.667514"
TUFANGUNJ Town Committee mosque,Mosque,"8M98+5FJ TUFANGUNJ Town Committee mosque, Tufanganj, West Bengal 736159",,8M98+5FJ,Tufanganj,736159,West Bengal,IN,https://www.google.com/maps/place/TUFANGUNJ+Town+Committee+mosque/data=!4m7!3m6!1s0x39e2f379377088d5:0x24e71de750770cdf!8m2!3d26.3179643!4d89.6661514!16s%2Fg%2F11c55ctc8z!19sChIJ1YhwN3nz4jkR3wx3UOcd5yQ?authuser=0&hl=en&rclk=1,"26.3179643,89.66615139999999"
Chilakhana Jame Masjid,Mosque,"8H3V+2HM Chilakhana Jame Masjid, Tufanganj, Chilakhana, West Bengal",,"8H3V+2HM, Tufanganj",Chilakhana,,West Bengal,IN,https://www.google.com/maps/place/Chilakhana+Jame+Masjid/data=!4m7!3m6!1s0x39e2f1df77f555cd:0x14200a5d2811887c!8m2!3d26.3025807!4d89.5939135!16s%2Fg%2F11gjt4bx_k!19sChIJzVX1d9_x4jkRfIgRKF0KIBQ?authuser=0&hl=en&rclk=1,"26.3025807,89.5939135"
Madina Masjid (mdinaa msjid/mdynh msjd),Mosque,"word No 5, Madina Masjid (mdinaa msjid/mdynh msjd), Mela ground, Tufanganj, West Bengal 736159",,"word No 5, Mela ground",Tufanganj,736159,West Bengal,IN,https://www.google.com/maps/place/Madina+Masjid+%28%E0%A6%AE%E0%A6%A6%E0%A6%BF%E0%A6%A8%E0%A6%BE+%E0%A6%AE%E0%A6%B8%E0%A6%9C%E0%A6%BF%E0%A6%A6%2F%D9%85%D8%AF%DB%8C%D9%86%DB%81+%D9%85%D8%B3%D8%AC%D8%AF%29%E2%80%AD/data=!4m7!3m6!1s0x39e2f5ce6d73997f:0x8760cb037fd2a0f!8m2!3d26.3133528!4d89.670787!16s%2Fg%2F11tmkpz7q_!19sChIJf5lzbc714jkRDyr9N7AMdgg?authuser=0&hl=en&rclk=1,"26.3133528,89.67078699999999"
"Jamtala, Jame Masjid",Mosque,"9M7H+PR3 Jamtala, Jame Masjid, Tufanganj, Salbari, West Bengal 736159",,9M7H+PR3,"Tufanganj, Salbari",,West Bengal,IN,"https://www.google.com/maps/place/Jamtala,+Jame+Masjid/data=!4m7!3m6!1s0x39e2f53f6cf93ca1:0xa3153b9fdd4ee5a3!8m2!3d26.3642562!4d89.6795416!16s%2Fg%2F11j0c39svw!19sChIJoTz5bD_14jkRo-VO3Z87FaM?authuser=0&hl=en&rclk=1","26.3642562,89.6795416"
Kalibari mosque,Mosque,"8MVC+G7P Kalibari mosque, Kalibari, Uttar Chhat Jaygir Chilakhana, Tufanganj, West Bengal 733143",Kalibari,8MVC+G7P,"Uttar Chhat Jaygir Chilakhana, Tufanganj",733143,West Bengal,IN,https://www.google.com/maps/place/Kalibari+mosque/data=!4m7!3m6!1s0x39e2f5c59ad93bfd:0xa58634e1f240e9e!8m2!3d26.3438492!4d89.6707102!16s%2Fg%2F11lh5qhk1m!19sChIJ_TvZmsX14jkRng4kH05jWAo?authuser=0&hl=en&rclk=1,"26.343849199999998,89.6707102"
kbsthaan,Mosque,"kbsthaan, ward no-6, tufanganj, Cooch Behar, West Bengal 736159",,"ward no-6, tufanganj",Cooch Behar,736159,West Bengal,IN,https://www.google.com/maps/place/%E0%A6%95%E0%A6%AC%E0%A6%B8%E0%A7%8D%E0%A6%A5%E0%A6%BE%E0%A6%A8/data=!4m7!3m6!1s0x39e2f304cf5a0783:0x459abbb247d1fe07!8m2!3d26.3073407!4d89.674986!16s%2Fg%2F11k3vrgzdz!19sChIJgwdazwTz4jkRB_7RR7K7mkU?authuser=0&hl=en&rclk=1,"26.307340699999997,89.67498599999999"
Station para masjid,Mosque,"8M38+WW2 Station para masjid, Station Road, Tufanganj, Kamat Phulbari P, West Bengal 736159",,"8M38+WW2, Station Road","Tufanganj, Kamat Phulbari P",736159,West Bengal,IN,https://www.google.com/maps/place/Station+para+masjid/data=!4m7!3m6!1s0x39e2f3b4e969cebb:0xd9fa2b893cb4d050!8m2!3d26.3047536!4d89.6672004!16s%2Fg%2F11ssfh7qg4!19sChIJu85p6bTz4jkRUNC0PIkr-tk?authuser=0&hl=en&rclk=1,"26.304753599999998,89.6672004"
Khuti Bari jame masjid,Mosque,"8MRJ+VCH Khuti Bari jame masjid, Basraja Pratham Khanda, West Bengal 736159",,8MRJ+VCH,Basraja Pratham Khanda,736159,West Bengal,IN,https://www.google.com/maps/place/Khuti+Bari+jame+masjid/data=!4m7!3m6!1s0x39e2f5e5aa0c4761:0x9d260b758ed0dc89!8m2!3d26.3421919!4d89.6811109!16s%2Fg%2F11rxtd2rbb!19sChIJYUcMquX14jkRidzQjnULJp0?authuser=0&hl=en&rclk=1,"26.3421919,89.6811109"
