name,main_category,address,address_ward,address_street,address_city,address_postal_code,address_state,address_country_code,link,coordinates
Jama masjid,Mosque,"WPHG+63M Jama masjid, Tilak Rd, Vaijapur, Maharashtra 423701",Vaijapur,"WPHG+63M, Tilak Rd",Vaijapur,423701,Maharashtra,IN,https://www.google.com/maps/place/Jama+masjid/data=!4m7!3m6!1s0x3bdc6f991fa08bd1:0xb59d1bd4a1cd8d33!8m2!3d19.9280255!4d74.725225!16s%2Fg%2F11vbqsldk7!19sChIJ0YugH5lv3DsRM43NodQbnbU?authuser=0&hl=en&rclk=1,"19.9280255,74.725225"
jama masjid,Mosque,"2Q9W+HW5 jama masjid, Khandala - Parsoda Rd, Vaijapur, Khandala, Maharashtra 431116",,"2Q9W+HW5, Khandala - Parsoda Rd","Vaijapur, Khandala",431116,Maharashtra,IN,https://www.google.com/maps/place/jama+masjid/data=!4m7!3m6!1s0x3bdc72969a065ef9:0x6eb684454891b57b!8m2!3d20.0188825!4d74.7973556!16s%2Fg%2F11f1ln9ph7!19sChIJ-V4GmpZy3DsRe7WRSEWEtm4?authuser=0&hl=en&rclk=1,"20.0188825,74.7973556"
Mohammadi masjid kadri nagar Vaijapur,Mosque,"WPPH+3HR Mohammadi masjid kadri nagar Vaijapur, Kalyen Nagar, Vaijapur, Maharashtra 423701",Kalyen Nagar,WPPH+3HR,Vaijapur,423701,Maharashtra,IN,https://www.google.com/maps/place/Mohammadi+masjid+kadri+nagar+Vaijapur/data=!4m7!3m6!1s0x3bdc6e88a40a6447:0x37cfe8e19d31d679!8m2!3d19.9352428!4d74.7289025!16s%2Fg%2F11gccfh8m0!19sChIJR2QKpIhu3DsRedYxneHozzc?authuser=0&hl=en&rclk=1,"19.935242799999997,74.72890249999999"
waalidain Masjid,Mosque,"WP8V+249 waalidain Masjid, Vaijapur - Gangapur Rd, Sainath Nagar, Vaijapur, Maharashtra 423701",Sainath Nagar,"WP8V+249, Vaijapur - Gangapur Rd",Vaijapur,423701,Maharashtra,IN,https://www.google.com/maps/place/waalidain+Masjid/data=!4m7!3m6!1s0x3bdc6e5aef6f655f:0x1d37693271face3c!8m2!3d19.9150319!4d74.7428544!16s%2Fg%2F11c5ssns4b!19sChIJX2Vv71pu3DsRPM76cTJpNx0?authuser=0&hl=en&rclk=1,"19.9150319,74.7428544"
Ahle'Sunnat Masjid Aala'Hazrat Imam Ahmed Raza,Mosque,"WPGH+9FW Ahle'Sunnat Masjid Aala'Hazrat Imam Ahmed Raza, Khan Galli, Vaijapur, Maharashtra 423701",Vaijapur,"WPGH+9FW, Khan Galli",Vaijapur,423701,Maharashtra,IN,https://www.google.com/maps/place/Ahle%27Sunnat+Masjid+Aala%27Hazrat+Imam+Ahmed+Raza/data=!4m7!3m6!1s0x3bdc6e8b64801d31:0xc774e7100c22bb6b!8m2!3d19.9259955!4d74.7287018!16s%2Fg%2F1hm258w50!19sChIJMR2AZItu3DsRa7siDBDndMc?authuser=0&hl=en&rclk=1,"19.9259955,74.7287018"
"Badi Masjid, Shahbajpura",Mosque,"Badi Masjid, Shahbajpura, 5312, Babulgaon Rd Niwara Nagri, Babulgaon Rd, Niwara Nagri, Vaijapur, Maharashtra 423701",Niwara Nagri,"5312, Babulgaon Rd Niwara Nagri, Babulgaon Rd",Vaijapur,423701,Maharashtra,IN,"https://www.google.com/maps/place/Badi+Masjid,+Shahbajpura/data=!4m7!3m6!1s0x3bdc6ef35ed3473d:0x2d2d3f10085f4a11!8m2!3d19.9228516!4d74.7276434!16s%2Fg%2F11dxkx2dft!19sChIJPUfTXvNu3DsREUpfCBA_LS0?authuser=0&hl=en&rclk=1","19.922851599999998,74.72764339999999"
Masjid Badar msjid bdr,Mosque,"Masjid Badar msjid bdr, Shivrai Road, Millat Nagar, Vaijapur, Maharashtra 423701",Millat Nagar,Shivrai Road,Vaijapur,423701,Maharashtra,IN,https://www.google.com/maps/place/Masjid+Badar+%E0%A4%AE%E0%A4%B8%E0%A5%8D%E0%A4%9C%E0%A4%BF%E0%A4%A6+%E0%A4%AC%E0%A4%A6%E0%A4%B0/data=!4m7!3m6!1s0x3bdc6e6065741e17:0x62f05a13aa2bbbd6!8m2!3d19.9255544!4d74.735972!16s%2Fg%2F11clvl8f32!19sChIJFx50ZWBu3DsR1rsrqhNa8GI?authuser=0&hl=en&rclk=1,"19.9255544,74.73597199999999"
Masjid Dargah Darwaza,Mosque,"WPJG+8H2 Masjid Dargah Darwaza, Vaijapur, Maharashtra 423701",Vaijapur,WPJG+8H2,Vaijapur,423701,Maharashtra,IN,https://www.google.com/maps/place/Masjid+Dargah+Darwaza/data=!4m7!3m6!1s0x3bdc6e8ebe00b703:0x485402bb1085a92e!8m2!3d19.9307615!4d74.726406!16s%2Fg%2F11c3tjv844!19sChIJA7cAvo5u3DsRLqmFELsCVEg?authuser=0&hl=en&rclk=1,"19.9307615,74.726406"
Masjid e Halke-Dawanaik,Mosque,"WPGH+VF5 Masjid e Halke-Dawanaik, khan galli, Vaijapur, Maharashtra 423701",Vaijapur,"WPGH+VF5, khan galli",Vaijapur,423701,Maharashtra,IN,https://www.google.com/maps/place/Masjid+e+Halke-Dawanaik/data=!4m7!3m6!1s0x3bdc6e8b9ce328e1:0x50a8f3f8015b51ab!8m2!3d19.9271299!4d74.7287209!16s%2Fg%2F11c3sr5f2f!19sChIJ4SjjnItu3DsRq1FbAfjzqFA?authuser=0&hl=en&rclk=1,"19.9271299,74.7287209"
Gazi Masjid,Mosque,"WPGF+WMH Gazi Masjid, Vaijapur, Maharashtra 423701",Vaijapur,WPGF+WMH,Vaijapur,423701,Maharashtra,IN,https://www.google.com/maps/place/Gazi+Masjid/data=!4m7!3m6!1s0x3bdc6e8db0065537:0x894e02429a432910!8m2!3d19.927325!4d74.7242332!16s%2Fg%2F1261jr6dd!19sChIJN1UGsI1u3DsREClDmkICTok?authuser=0&hl=en&rclk=1,"19.927325,74.7242332"
Mustafa park masjid,Mosque,"WPCG+M92 Mustafa park masjid, Mustafa park, Ladgaon Rd, Mustafa park, Vaijapur, Maharashtra 423701",Mustafa park,"WPCG+M92, Mustafa park, Ladgaon Rd",Vaijapur,423701,Maharashtra,IN,https://www.google.com/maps/place/Mustafa+park+masjid/data=!4m7!3m6!1s0x3bdc6f46956eee25:0x3abcd925d444d47f!8m2!3d19.9216434!4d74.7259006!16s%2Fg%2F11qnvm96ng!19sChIJJe5ulUZv3DsRf9RE1CXZvDo?authuser=0&hl=en&rclk=1,"19.9216434,74.7259006"
"Nuagazi baba , Hazrat Syed Shah rukh noddin Shahid Rahmatullah alayh Vaijapur district Aurangabad urf Nowgazi Baba Dargah",Mosque,"Nuagazi baba , Hazrat Syed Shah rukh noddin Shahid Rahmatullah alayh Vaijapur district Aurangabad urf Nowgazi Baba Dargah, Shahid Rahmatullah alayh, Hazrat Syed Shah rukh noddin, Vaijapur, Maharashtra 423701",Kalyen Nagar,"Shahid Rahmatullah alayh, Hazrat Syed Shah rukh noddin",Vaijapur,423701,Maharashtra,IN,"https://www.google.com/maps/place/Nuagazi+baba+,+Hazrat+Syed+Shah+rukh+noddin+Shahid+Rahmatullah+alayh+Vaijapur+district+Aurangabad+urf+Nowgazi+Baba+Dargah/data=!4m7!3m6!1s0x3bdc6fa156188fab:0xb4b0437f4dcff0ff!8m2!3d19.9342171!4d74.7270057!16s%2Fg%2F11mvnfk1bg!19sChIJq48YVqFv3DsR__DPTX9DsLQ?authuser=0&hl=en&rclk=1","19.934217099999998,74.72700569999999"
Amjadiya Masjid,Mosque,"WP5C+VJ2 Amjadiya Masjid, Nagpur - Aurangabad - Mumbai Hwy, Vaijapur, Maharashtra 423701",,"WP5C+VJ2, Nagpur - Aurangabad - Mumbai Hwy",Vaijapur,423701,Maharashtra,IN,https://www.google.com/maps/place/Amjadiya+Masjid/data=!4m7!3m6!1s0x3bdc6ee528e1d237:0xc7f45372af1ae9eb!8m2!3d19.9096271!4d74.7215218!16s%2Fg%2F11b6srrs0h!19sChIJN9LhKOVu3DsR6-kar3JT9Mc?authuser=0&hl=en&rclk=1,"19.909627099999998,74.72152179999999"
Masjid E Umar Farooque R.a,Mosque,"WPGH+M5F Masjid E Umar Farooque R.a, Vaijapur, Maharashtra 423701",Vaijapur,WPGH+M5F,Vaijapur,423701,Maharashtra,IN,https://www.google.com/maps/place/Masjid+E+Umar+Farooque+R.a/data=!4m7!3m6!1s0x3bdc6e8b7e337045:0x872679974f7441d3!8m2!3d19.926676!4d74.7279196!16s%2Fg%2F11bw7h2h9q!19sChIJRXAzfotu3DsR00F0T5d5Joc?authuser=0&hl=en&rclk=1,"19.926676,74.72791959999999"
NAGiNA MASJID,Mosque,"WPHH+7HG NAGiNA MASJID, MG Road, Vaijapur, Maharashtra 411001",Vaijapur,"WPHH+7HG, MG Road",Vaijapur,411001,Maharashtra,IN,https://www.google.com/maps/place/NAGiNA+MASJID/data=!4m7!3m6!1s0x3bdc6f1b640169b3:0x35111d8cf4eecf1e!8m2!3d19.9281797!4d74.7289652!16s%2Fg%2F11gxmvt983!19sChIJs2kBZBtv3DsRHs_u9IwdETU?authuser=0&hl=en&rclk=1,"19.928179699999998,74.72896519999999"
Masjid-E-Gafoor,Mosque,"WPJG+385 Masjid-E-Gafoor, Unnamed Road, Vaijapur, Maharashtra 423701",Vaijapur,"WPJG+385, Unnamed Road",Vaijapur,423701,Maharashtra,IN,https://www.google.com/maps/place/Masjid-E-Gafoor/data=!4m7!3m6!1s0x3bdc6f43a2ca5f13:0xcc5b8fcaa7e4a675!8m2!3d19.9301405!4d74.7258571!16s%2Fg%2F11h4qmmcps!19sChIJE1_KokNv3DsRdabkp8qPW8w?authuser=0&hl=en&rclk=1,"19.9301405,74.7258571"
Shahenshah E Vaijapur,Mosque,"Shahenshah E Vaijapur, Kalyen Nagar, Vaijapur, Maharashtra 423701",Kalyen Nagar,,Vaijapur,423701,Maharashtra,IN,https://www.google.com/maps/place/Shahenshah+E+Vaijapur/data=!4m7!3m6!1s0x3bdc6ff842989fdf:0xd0d61f4392a8a5a3!8m2!3d19.9338853!4d74.7272078!16s%2Fg%2F11s30zd_hx!19sChIJ35-YQvhv3DsRo6WokkMf1tA?authuser=0&hl=en&rclk=1,"19.9338853,74.7272078"
Walden Tamboli Musjid,Mosque,"WP8V+47X Walden Tamboli Musjid, Vaijapur, Maharashtra 423701",,WP8V+47X,Vaijapur,423701,Maharashtra,IN,https://www.google.com/maps/place/Walden+Tamboli+Musjid/data=!4m7!3m6!1s0x3bdc6f75e0b4fde9:0x2bf27a5351d57894!8m2!3d19.9153569!4d74.74322!16s%2Fg%2F11pv63ds32!19sChIJ6f204HVv3DsRlHjVUVN68is?authuser=0&hl=en&rclk=1,"19.9153569,74.74322"
Masjid,Mosque,"WP8H+F6X Masjid, Ladgaon Rd, Vaijapur, Maharashtra 423701",,"WP8H+F6X, Ladgaon Rd",Vaijapur,423701,Maharashtra,IN,https://www.google.com/maps/place/Masjid/data=!4m7!3m6!1s0x3bdc6f487efc7265:0x2fbebaefb0054ab4!8m2!3d19.9162257!4d74.7281169!16s%2Fg%2F11sclb92m9!19sChIJZXL8fkhv3DsRtEoFsO-6vi8?authuser=0&hl=en&rclk=1,"19.9162257,74.7281169"
MASJID-E-AL SAHABAH,Mosque,"WPF6+HGM MASJID-E-AL SAHABAH, Khandoba Nagar, Belgaon Road, Vaijapur, Maharashtra 423701",NMC Colony,"WPF6+HGM, Khandoba Nagar, Belgaon Road",Vaijapur,423701,Maharashtra,IN,https://www.google.com/maps/place/MASJID-E-AL+SAHABAH/data=!4m7!3m6!1s0x3bdc6f4b559c1d59:0xecfcda54b2808f67!8m2!3d19.9239627!4d74.7113077!16s%2Fg%2F11fn0jff8s!19sChIJWR2cVUtv3DsRZ4-AslTa_Ow?authuser=0&hl=en&rclk=1,"19.9239627,74.71130769999999"
Masjid AlHamad Mustafa Park,Mosque,"WPFG+25R Masjid AlHamad Mustafa Park, Babulgaon Rd, Sankar Nagar, Shri Swami Samarth Nagar, Vaijapur, Maharashtra 423701","Sankar Nagar, Shri Swami Samarth Nagar","WPFG+25R, Babulgaon Rd",Vaijapur,423701,Maharashtra,IN,https://www.google.com/maps/place/Masjid+AlHamad+Mustafa+Park/data=!4m7!3m6!1s0x3bdc6f6c69940cb9:0xea4c1eae9eb14305!8m2!3d19.9226187!4d74.7253343!16s%2Fg%2F11tp866knw!19sChIJuQyUaWxv3DsRBUOxnq4eTOo?authuser=0&hl=en&rclk=1,"19.922618699999997,74.7253343"
Fatema majid,Mosque,"Shop1opp, Fatema majid, New, Baji Mandi, Vaijapur, Maharashtra 423701",Vaijapur,"Shop1opp, New, Baji Mandi",Vaijapur,423701,Maharashtra,IN,https://www.google.com/maps/place/Fatema+majid/data=!4m7!3m6!1s0x3bdc6f96f7cb91f5:0xf0582d2bdbfcb4be!8m2!3d19.9281663!4d74.7234886!16s%2Fg%2F11vbs0zxll!19sChIJ9ZHL95Zv3DsRvrT82ystWPA?authuser=0&hl=en&rclk=1,"19.928166299999997,74.7234886"
Masjid Siddiq e Akbar,Mosque,"WP8J+W62 Masjid Siddiq e Akbar, Shri Swami Samarth Nagar, Vaijapur, Maharashtra 423701",Shri Swami Samarth Nagar,WP8J+W62,Vaijapur,423701,Maharashtra,IN,https://www.google.com/maps/place/Masjid+Siddiq+e+Akbar/data=!4m7!3m6!1s0x3bdc6f74272f7955:0x5355f53256cd7fc3!8m2!3d19.9172562!4d74.7305197!16s%2Fg%2F11kqwvybnt!19sChIJVXkvJ3Rv3DsRw3_NVjL1VVM?authuser=0&hl=en&rclk=1,"19.9172562,74.7305197"
Qadri Masjid Chowk,Mosque,"Qadri Masjid Chowk, Kadri Nagar, Kalyen Nagar, Vaijapur, Maharashtra 423701",Kalyen Nagar,Kadri Nagar,Vaijapur,423701,Maharashtra,IN,https://www.google.com/maps/place/Qadri+Masjid+Chowk/data=!4m7!3m6!1s0x3bdc6f60cb89b077:0x3388ad92603b5412!8m2!3d19.9352428!4d74.7289025!16s%2Fg%2F11trq77pp9!19sChIJd7CJy2Bv3DsRElQ7YJKtiDM?authuser=0&hl=en&rclk=1,"19.935242799999997,74.72890249999999"
Eidgah,Mosque,"WPHC+9RG Eidgah, NMC Colony, Vaijapur, Maharashtra 423701",NMC Colony,WPHC+9RG,Vaijapur,423701,Maharashtra,IN,https://www.google.com/maps/place/Eidgah/data=!4m7!3m6!1s0x3bdc6e8df7bfffff:0x1fc0c9e3f4e3652d!8m2!3d19.9284402!4d74.7220932!16s%2Fg%2F11sscs2__r!19sChIJ__-_941u3DsRLWXj9OPJwB8?authuser=0&hl=en&rclk=1,"19.9284402,74.7220932"
