name,main_category,address,address_ward,address_street,address_city,address_postal_code,address_state,address_country_code,link,coordinates
Masjidhun Noor,Mosque,"Masjidhun Noor, 32-A, 6th St, Mosque Colony, Maduvinkarai, Guindy, Chennai, Ramapuram, Tamil Nadu 600032","Mosque Colony, Maduvinkarai, Guindy","32-A, 6th St","Chennai, Ramapuram",600032,Tamil Nadu,IN,https://www.google.com/maps/place/Masjidhun+Noor/data=!4m7!3m6!1s0x3a52675d44f4a057:0xd440b41a3e614d21!8m2!3d12.9991618!4d80.2089082!16s%2Fg%2F124yg_kd3!19sChIJV6D0RF1nUjoRIU1hPhq0QNQ?authuser=0&hl=en&rclk=1,"12.9991618,80.2089082"
Masjid an Nabawi Ganapathipuram,Mosque,"W4C7+5GV Masjid an Nabawi Ganapathipuram, Paralinellaiappar St, Ganapathipuram, East Tambaram, Tambaram, Chennai, Tamil Nadu 600059","Ganapathipuram, East Tambaram, Tambaram","W4C7+5GV, Paralinellaiappar St",Chennai,600059,Tamil Nadu,IN,https://www.google.com/maps/place/Masjid+an+Nabawi+Ganapathipuram/data=!4m7!3m6!1s0x3a525f696d8bd285:0x745447436dcdeb86!8m2!3d12.9204787!4d80.1137978!16s%2Fg%2F1q64phlby!19sChIJhdKLbWlfUjoRhuvNbUNHVHQ?authuser=0&hl=en&rclk=1,"12.920478699999999,80.1137978"
Adam Nagar Masjid (AL Ahmad Jumma Masjid),Mosque,"2489+H97 Adam Nagar Masjid (AL Ahmad Jumma Masjid), Adam Nagar, Arunachalam Nagar Main Rd, Kovur, Chinnapani Cheri, Mangadu, Chennai, Tamil Nadu 600122","Kovur, Chinnapani Cheri, Mangadu","2489+H97 Adam Nagar, Arunachalam Nagar Main Rd",Chennai,600122,Tamil Nadu,IN,https://www.google.com/maps/place/Adam+Nagar+Masjid+%28AL+Ahmad+Jumma+Masjid%29/data=!4m7!3m6!1s0x3a526039aaeb1f5b:0xbdd111a0cdd55f3e!8m2!3d13.016724!4d80.1176564!16s%2Fg%2F11cs125f7g!19sChIJWx_rqjlgUjoRPl_VzaAR0b0?authuser=0&hl=en&rclk=1,"13.016724,80.1176564"
Masjid Al Noor,Mosque,"Masjid Al Noor, 4,, Sangam Street, Ayirankatha Amman Nagar, Oragadam, Chennai, Tamil Nadu 600053","Ayirankatha Amman Nagar, Oragadam","4,, Sangam Street",Chennai,600053,Tamil Nadu,IN,https://www.google.com/maps/place/Masjid+Al+Noor/data=!4m7!3m6!1s0x3a52631af4d03501:0x3f5bc9839d330557!8m2!3d13.1373068!4d80.1525294!16s%2Fg%2F11csqn_7r5!19sChIJATXQ9BpjUjoRVwUznYPJWz8?authuser=0&hl=en&rclk=1,"13.1373068,80.15252939999999"
Masjid-un-Nabawi,Mosque,"Masjid-un-Nabawi, 15, SH 49, Panaiyur, Chennai, Tamil Nadu 600119",Panaiyur,"15, SH 49",Chennai,600119,Tamil Nadu,IN,https://www.google.com/maps/place/Masjid-un-Nabawi/data=!4m7!3m6!1s0x3a525b65818752b9:0xf81e0308a2d84296!8m2!3d12.888048!4d80.2462242!16s%2Fg%2F11c48pgjhf!19sChIJuVKHgWVbUjoRlkLYoggDHvg?authuser=0&hl=en&rclk=1,"12.888048,80.2462242"
"Masjid Un Noor ,Sivananda Nagar ,Ambattur",Religious institution,"4542+HC6 Masjid Un Noor ,Sivananda Nagar ,Ambattur, Sivananda Nagar, Ambattur, Chennai, Tamil Nadu 600053","Sivananda Nagar, Ambattur",4542+HC6,Chennai,600053,Tamil Nadu,IN,"https://www.google.com/maps/place/Masjid+Un+Noor+,Sivananda+Nagar+,Ambattur/data=!4m7!3m6!1s0x3a5263b12bc43e35:0xe0ed07247fb62e2!8m2!3d13.1064063!4d80.1510018!16s%2Fg%2F11dx92bvml!19sChIJNT7EK7FjUjoR4mL7R3LQDg4?authuser=0&hl=en&rclk=1","13.1064063,80.1510018"
