name,main_category,address,address_ward,address_street,address_city,address_postal_code,address_state,address_country_code,link,coordinates
Amroli Masjid,Mosque,"6VM2+H56 Amroli Masjid, Main Road, Angreji Faliyu, Amroli, Surat, Gujarat 394107","Angreji Faliyu, Amroli","6VM2+H56, Main Road",Surat,394107,Gujarat,IN,https://www.google.com/maps/place/Amroli+Masjid/data=!4m7!3m6!1s0x3be04f277adadc99:0xf404ba170c0982c1!8m2!3d21.2339039!4d72.850376!16s%2Fg%2F1q62fnnrr!19sChIJmdzaeidP4DsRwYIJDBe6BPQ?authuser=0&hl=en&rclk=1,"21.233903899999998,72.850376"
Madina Masjid,Mosque,"Madina Masjid, 141, opp. Buliding, SMC Twp, Kosad Tenaments, Surat, Gujarat 394107","SMC Township, Kosad Tenaments","141, opp. Buliding",Surat,394107,Gujarat,IN,https://www.google.com/maps/place/Madina+Masjid/data=!4m7!3m6!1s0x3be049bb50779e4f:0x1752741df6293102!8m2!3d21.2540999!4d72.8540238!16s%2Fg%2F11gj73qh6b!19sChIJT553ULtJ4DsRAjEp9h10Uhc?authuser=0&hl=en&rclk=1,"21.2540999,72.8540238"
Makka Masjid H1 Awas,Mosque,"Makka Masjid H1 Awas, H1 kosad awas, SMC Twp, Kosad Tenaments, Surat, Gujarat 394107","SMC Township, Kosad Tenaments",H1 kosad awas,Surat,394107,Gujarat,IN,https://www.google.com/maps/place/Makka+Masjid+H1+Awas/data=!4m7!3m6!1s0x3be048d62e88953f:0xcd2430a19abdc691!8m2!3d21.25648!4d72.8520849!16s%2Fg%2F11f4059w4g!19sChIJP5WILtZI4DsRkca9mqEwJM0?authuser=0&hl=en&rclk=1,"21.25648,72.8520849"
Mohammadi Masjid (Sunni),Mosque,"No, Mohammadi Masjid (Sunni), 141, opp. Buliding, SMC Twp, Kosad Tenaments, Surat, Gujarat 394107","SMC Township, Kosad Tenaments","No, 141, opp. Buliding",Surat,394107,Gujarat,IN,https://www.google.com/maps/place/Mohammadi+Masjid+%28Sunni%29/data=!4m7!3m6!1s0x3be0494b24d1a0e1:0x38634b1eddcb278f!8m2!3d21.2541578!4d72.8541153!16s%2Fg%2F11h_wjqf1b!19sChIJ4aDRJEtJ4DsRjyfL3R5LYzg?authuser=0&hl=en&rclk=1,"21.254157799999998,72.8541153"
Husaini Masjid,Mosque,"Building No.405, Husaini Masjid, H/5 Kosad Avash, Amroli, Surat, Gujarat 394107","SMC Township, Amroli","Building No.405, H/5 Kosad Avash",Surat,394107,Gujarat,IN,https://www.google.com/maps/place/Husaini+Masjid/data=!4m7!3m6!1s0x3be04f51ba478a87:0xeabf87157247f2de!8m2!3d21.2445947!4d72.8525669!16s%2Fg%2F11sm__fywy!19sChIJh4pHulFP4DsR3vJHchWHv-o?authuser=0&hl=en&rclk=1,"21.2445947,72.8525669"
Masjid E Gaushiya H3 Building No 237 Kosad Avas,Mosque,"Gaushiya, Building No, Masjid E Gaushiya H3 Building No 237 Kosad Avas, 237 Awas, Masjid E, Kosad Tenaments, Surat, Gujarat 394107","Kosad Navi Vasahat, Kosad Tenaments","Gaushiya, Building No, 237 Awas, Masjid E",Surat,394107,Gujarat,IN,https://www.google.com/maps/place/Masjid+E+Gaushiya+H3+Building+No+237+Kosad+Avas/data=!4m7!3m6!1s0x3be049e03b7aaab5:0x3b2e6ce0ed5040ba!8m2!3d21.2513417!4d72.853425!16s%2Fg%2F11p5clnsmb!19sChIJtap6O-BJ4DsRukBQ7eBsLjs?authuser=0&hl=en&rclk=1,"21.251341699999998,72.853425"
