name,main_category,address,address_ward,address_street,address_city,address_postal_code,address_state,address_country_code,link,coordinates
TAHA MASJID,Mosque,"TAHA MASJID, 6-74, Gopalapatnam Main Road, Gopalapatnam, Simhachalam, Visakhapatnam, Andhra Pradesh 530027","Gopalapatnam, Simhachalam","6-74, Gopalapatnam Main Road",Visakhapatnam,530027,Andhra Pradesh,IN,https://www.google.com/maps/place/TAHA+MASJID/data=!4m7!3m6!1s0x3a3967da6c881b69:0x2695d2f2786af137!8m2!3d17.7488808!4d83.2194356!16s%2Fg%2F11dztsxrqh!19sChIJaRuIbNpnOToRN_FqePLSlSY?authuser=0&hl=en&rclk=1,"17.7488808,83.2194356"
Masjid E Touheed Ahle Hadees,Mosque,"Masjid E Touheed Ahle Hadees, 531173, B Zone, Sujatha Nagar, Pendurthi, Visakhapatnam, Andhra Pradesh 531173","B Zone, Sujatha Nagar, Pendurthi",531173,Visakhapatnam,531173,Andhra Pradesh,IN,https://www.google.com/maps/place/Masjid+E+Touheed+Ahle+Hadees/data=!4m7!3m6!1s0x3a39671db667a253:0xc7446b2f455c1526!8m2!3d17.8043865!4d83.2099906!16s%2Fg%2F11gcqwqqr3!19sChIJU6Jnth1nOToRJhVcRS9rRMc?authuser=0&hl=en&rclk=1,"17.8043865,83.2099906"
MASJID RAZA-EE-MUSTAFA,Mosque,"R6F3+FM2 MASJID RAZA-EE-MUSTAFA, Sai Nagar, Aditya Nagar, Pendurthi, Visakhapatnam, Andhra Pradesh 531173","Sai Nagar, Aditya Nagar, Pendurthi",R6F3+FM2,Visakhapatnam,531173,Andhra Pradesh,IN,https://www.google.com/maps/place/MASJID+RAZA-EE-MUSTAFA/data=!4m7!3m6!1s0x3a3966d763e1a079:0x47efdf3be14430a6!8m2!3d17.8236315!4d83.204146!16s%2Fg%2F1pwfyj_41!19sChIJeaDhY9dmOToRpjBE4Tvf70c?authuser=0&hl=en&rclk=1,"17.823631499999998,83.204146"
Masjid e Quba,Mosque,"Q6H7+533 Masjid e Quba, Vepagunta - Sabbavaram Rd, Seshadri Nagar Colony, Chintalagraharam, Cheemala Palli, Visakhapatnam, Andhra Pradesh 530047","Seshadri Nagar Colony, Chintalagraharam, Cheemala Palli","Q6H7+533, Vepagunta - Sabbavaram Rd",Visakhapatnam,530047,Andhra Pradesh,IN,https://www.google.com/maps/place/Masjid+e+Quba/data=!4m7!3m6!1s0x3a39676c93258bd9:0xbb5cf9df3789314c!8m2!3d17.777898!4d83.2126798!16s%2Fg%2F11ghtn8w21!19sChIJ2Yslk2xnOToRTDGJN9_5XLs?authuser=0&hl=en&rclk=1,"17.777898,83.21267979999999"
Masjid,Mosque,"Q665+RJ5 Masjid, R R Venkatapuram, Nandhamuri nagar, Visakhapatnam, Andhra Pradesh 530029","R R Venkatapuram, Nandhamuri nagar",Q665+RJ5,Visakhapatnam,530029,Andhra Pradesh,IN,https://www.google.com/maps/place/Masjid/data=!4m7!3m6!1s0x3a396778ad6ad499:0xd161fd7810aefee!8m2!3d17.7620244!4d83.2091004!16s%2Fg%2F11ll1zvnnr!19sChIJmdRqrXhnOToR7u8KgdcfFg0?authuser=0&hl=en&rclk=1,"17.762024399999998,83.2091004"
AL AMEEN MASJID &MADRASA,Mosque,"AL AMEEN MASJID &MADRASA, PLOT NO 1,SUJATHA NAGAR,BANROTTI VILLAGE,EYCHOOR JUNCTION ROAD, KANDIGAI, 631604","Sujatha Nagar, Pendurthi","PLOT NO 1,SUJATHA NAGAR,BANROTTI VILLAGE,EYCHOOR JUNCTION ROAD, KANDIGAI","Visakhapatnam, Valimeraka",631604,Andhra Pradesh,IN,https://www.google.com/maps/place/AL+AMEEN+MASJID+%26MADRASA/data=!4m7!3m6!1s0x3a396713526a9e57:0xf2e7dce72a4c6957!8m2!3d17.7990565!4d83.2036741!16s%2Fg%2F11p6wn4x6_!19sChIJV55qUhNnOToRV2lMKufc5_I?authuser=0&hl=en&rclk=1,"17.7990565,83.2036741"
