name,main_category,address,address_ward,address_street,address_city,address_postal_code,address_state,address_country_code,link,coordinates
Hazrat Haji Pir Dargah Sharif,Mosque,"HF89+RGC Hazrat Haji Pir Dargah Sharif, GJ SH 31, GIDC 2, Junagadh, Gujarat 362037",GIDC 2,"HF89+RGC, GJ SH 31",Junagadh,362037,Gujarat,IN,https://www.google.com/maps/place/Hazrat+Haji+Pir+Dargah+Sharif/data=!4m7!3m6!1s0x39580250439b6067:0x1aa92dbdaceba4aa!8m2!3d21.5670642!4d70.4687764!16s%2Fg%2F1pyqhbk_b!19sChIJZ2CbQ1ACWDkRqqTrrL0tqRo?authuser=0&hl=en&rclk=1,"21.5670642,70.4687764"
Jum'ah Mosque,Mosque,"GFG6+Q2J Jum'ah Mosque, M G Road (SH-30), Mullawada, Junagadh, Gujarat 362001",Mullawada,"GFG6+Q2J, M G Road (SH-30)",Junagadh,362001,Gujarat,IN,https://www.google.com/maps/place/Jum%27ah+Mosque/data=!4m7!3m6!1s0x3958018bcc559c0f:0x61acd931a536433e!8m2!3d21.5269645!4d70.4600175!16s%2Fg%2F1pyqw20xd!19sChIJD5xVzIsBWDkRPkM2pTHZrGE?authuser=0&hl=en&rclk=1,"21.5269645,70.46001749999999"
Hazrat Vali E Sorath R.A Dargah Sharif,Mosque,"GFJ7+67X Hazrat Vali E Sorath R.A Dargah Sharif, Mullawada, Junagadh, Gujarat 362001",Mullawada,GFJ7+67X,Junagadh,362001,Gujarat,IN,https://www.google.com/maps/place/Hazrat+Vali+E+Sorath+R.A+Dargah+Sharif/data=!4m7!3m6!1s0x39580227624b25c3:0x86916a093427e8f3!8m2!3d21.5306069!4d70.4632228!16s%2Fg%2F11g8xgng_l!19sChIJwyVLYicCWDkR8-gnNAlqkYY?authuser=0&hl=en&rclk=1,"21.5306069,70.4632228"
Nahid ul Hasan Masjid,Mosque,"Nahid ul Hasan Masjid, Husaini Chowk, Matri Road, Sukhnath Chowk Road, Junagadh, 08, Matri Rd, Junagadh, Gujarat 362001",Mullawada,"Husaini Chowk, Matri Road, Sukhnath Chowk Road, Junagadh, 08, Matri Rd",Junagadh,362001,Gujarat,IN,https://www.google.com/maps/place/Nahid+ul+Hasan+Masjid/data=!4m7!3m6!1s0x39580188a338044d:0xd3a4f35cbf6618e0!8m2!3d21.5260395!4d70.4662979!16s%2Fg%2F1hhx2zt48!19sChIJTQQ4o4gBWDkR4Bhmv1zzpNM?authuser=0&hl=en&rclk=1,"21.5260395,70.4662979"
Jamil Shah Datar Dargah,Mosque,"GF79+598 Jamil Shah Datar Dargah, Shreenath Nagar, Junagadh, Gujarat 362001",Shreenath Nagar,GF79+598,Junagadh,362001,Gujarat,IN,https://www.google.com/maps/place/Jamil+Shah+Datar+Dargah/data=!4m7!3m6!1s0x39580199ed4889cb:0xb541a818c666897c!8m2!3d21.5129226!4d70.4684379!16s%2Fg%2F11dfwz5455!19sChIJy4lI7ZkBWDkRfIlmxhioQbU?authuser=0&hl=en&rclk=1,"21.5129226,70.4684379"
Laraib Ahmed Masjid,Mosque,"GFG6+9R5 Laraib Ahmed Masjid, MG Rd, Mullawada, Junagadh, Gujarat 362001",Mullawada,"GFG6+9R5, MG Rd",Junagadh,362001,Gujarat,IN,https://www.google.com/maps/place/Laraib+Ahmed+Masjid/data=!4m7!3m6!1s0x3958018969ef9ab5:0xc04c571be3461429!8m2!3d21.5258912!4d70.4621105!16s%2Fg%2F1hc2sks6f!19sChIJtZrvaYkBWDkRKRRG4xtXTMA?authuser=0&hl=en&rclk=1,"21.5258912,70.4621105"
Sulemani Masjid,Mosque,"GFF5+7XM Sulemani Masjid, Mullawada, Junagadh, Gujarat 362001",Mullawada,GFF5+7XM,Junagadh,362001,Gujarat,IN,https://www.google.com/maps/place/Sulemani+Masjid/data=!4m7!3m6!1s0x3958018c13d4dc75:0x49e179cbf24b04d4!8m2!3d21.5232078!4d70.4599135!16s%2Fg%2F11f38xl289!19sChIJddzUE4wBWDkR1ARL8st54Uk?authuser=0&hl=en&rclk=1,"21.523207799999998,70.4599135"
Garib-Nawaz Masjid,Mosque,"GFR5+5CC Garib-Nawaz Masjid, Khwaja Nagar, Joshipura, Junagadh, Gujarat 362001","Khwaja Nagar, Joshipura",GFR5+5CC,Junagadh,362001,Gujarat,IN,https://www.google.com/maps/place/Garib-Nawaz+Masjid/data=!4m7!3m6!1s0x3958022328b33aef:0xe6c91ae42ceef9b!8m2!3d21.5404391!4d70.4585164!16s%2Fg%2F11dflgjyln!19sChIJ7zqzKCMCWDkRm-_OQq6RbA4?authuser=0&hl=en&rclk=1,"21.5404391,70.4585164"
Masjid E Taibah msjdi TyWbh,Mosque,"GFR4+55W Masjid E Taibah msjdi TyWbh, Khwaja Nagar, Joshipura, Junagadh, Gujarat 362002","Khwaja Nagar, Joshipura",GFR4+55W,Junagadh,362002,Gujarat,IN,https://www.google.com/maps/place/Masjid+E+Taibah+%D9%85%D8%B3%D8%AC%D8%AF%D9%90+%D8%B7%DB%8C%D9%91%D8%A8%DB%81%E2%80%AD/data=!4m7!3m6!1s0x39580222ab80dad3:0x30e3bbd9ae970f9c!8m2!3d21.5404996!4d70.4554554!16s%2Fg%2F11g8ybqtf2!19sChIJ09qAqyICWDkRnA-Xrtm74zA?authuser=0&hl=en&rclk=1,"21.5404996,70.45545539999999"
Ancient Masjid of Junagadh,Mosque,"GFP7+3QC Ancient Masjid of Junagadh, GJ SH 31, Khwaja Nagar, Mullawada, Khamdhrol, Junagadh, Gujarat 362002","Khwaja Nagar, Mullawada","GFP7+3QC, GJ SH 31","Khamdhrol, Junagadh",362002,Gujarat,IN,https://www.google.com/maps/place/Ancient+Masjid+of+Junagadh/data=!4m7!3m6!1s0x39580226a04523f1:0x48357210b1baea79!8m2!3d21.535196!4d70.4643754!16s%2Fg%2F11cnb5sz_5!19sChIJ8SNFoCYCWDkReeq6sRByNUg?authuser=0&hl=en&rclk=1,"21.535196,70.4643754"
Chand Fariha Masjid chnd fryHh msjd,Mosque,"GFF7+687 Chand Fariha Masjid chnd fryHh msjd, Mullawada, Junagadh, Gujarat 362001",Mullawada,GFF7+687,Junagadh,362001,Gujarat,IN,https://www.google.com/maps/place/Chand+Fariha+Masjid+%DA%86%D8%A7%D9%86%D8%AF+%D9%81%D8%B1%DB%8C%D8%AD%DB%81+%D9%85%D8%B3%D8%AC%D8%AF%E2%80%AD/data=!4m7!3m6!1s0x3958018ee7f76039:0xe122f2b5b9346778!8m2!3d21.5230333!4d70.4633052!16s%2Fg%2F11g5z_gmmh!19sChIJOWD3544BWDkReGc0ubXyIuE?authuser=0&hl=en&rclk=1,"21.523033299999998,70.4633052"
Jama Mosque,Mosque,"GFFC+X36 Jama Mosque, Mullawada, Junagadh, Gujarat 362001",Mullawada,GFFC+X36,Junagadh,362001,Gujarat,IN,https://www.google.com/maps/place/Jama+Mosque/data=!4m7!3m6!1s0x395801842c8ea189:0x3379e37dcaebf9ba!8m2!3d21.5249185!4d70.4701257!16s%2Fg%2F11hgz49y3b!19sChIJiaGOLIQBWDkRuvnryn3jeTM?authuser=0&hl=en&rclk=1,"21.5249185,70.4701257"
Rasool Masjid msjdi rswl ,Mosque,"GF37+QQ6 Rasool Masjid msjdi rswl , Vruj Vihar, Junagadh, Gujarat 362001",Vruj Vihar,GF37+QQ6,Junagadh,362001,Gujarat,IN,https://www.google.com/maps/place/Rasool+Masjid+%D9%85%D8%B3%D8%AC%D8%AF%D9%90+%D8%B1%D8%B3%D9%88%D9%84+%EF%B7%BA%E2%80%AD/data=!4m7!3m6!1s0x395801bcfe79589b:0xddb6151c3d2593ab!8m2!3d21.5044224!4d70.4643924!16s%2Fg%2F11fxxtzvyl!19sChIJm1h5_rwBWDkRq5MlPRwVtt0?authuser=0&hl=en&rclk=1,"21.5044224,70.4643924"
Dargah Hazrat Meeya Mahemudsha Vali E Sorath R.A.,Mosque,"GFJ7+663 Dargah Hazrat Meeya Mahemudsha Vali E Sorath R.A., Mullawada, Junagadh, Gujarat 362001",Mullawada,GFJ7+663,Junagadh,362001,Gujarat,IN,https://www.google.com/maps/place/Dargah+Hazrat+Meeya+Mahemudsha+Vali+E+Sorath+R.A./data=!4m7!3m6!1s0x395802277bf50385:0xf52c953d3da6af2e!8m2!3d21.5305178!4d70.4630347!16s%2Fg%2F11c317_gl_!19sChIJhQP1eycCWDkRLq-mPT2VLPU?authuser=0&hl=en&rclk=1,"21.5305178,70.4630347"
Saiyadvada Masjid syiWd wrrh msjd,Mosque,"GFC8+3RQ Saiyadvada Masjid syiWd wrrh msjd, Mullawada, Junagadh, Gujarat 362001",Mullawada,GFC8+3RQ,Junagadh,362001,Gujarat,IN,https://www.google.com/maps/place/Saiyadvada+Masjid+%D8%B3%DB%8C%D9%90%D9%91%D8%AF+%D9%88%DA%91%DA%BE%D8%A7+%D9%85%D8%B3%D8%AC%D8%AF%E2%80%AD/data=!4m7!3m6!1s0x3958018558efcd8b:0xb2f7fb58789e78b1!8m2!3d21.520206!4d70.467122!16s%2Fg%2F11c5rpcc0f!19sChIJi83vWIUBWDkRsXieeFj797I?authuser=0&hl=en&rclk=1,"21.520205999999998,70.467122"
Jama Masjid,Mosque,"HFC5+J4W Jama Masjid, Unnamed Road, Saragvada, Junagadh, Gujarat 362037",Saragvada,"HFC5+J4W, Unnamed Road",Junagadh,362037,Gujarat,IN,https://www.google.com/maps/place/Jama+Masjid/data=!4m7!3m6!1s0x395803a0f0822161:0x9fb82dc08e3438d0!8m2!3d21.5716209!4d70.4578191!16s%2Fg%2F11h3qq52sx!19sChIJYSGC8KADWDkR0Dg0jsAtuJ8?authuser=0&hl=en&rclk=1,"21.5716209,70.4578191"
Dargah Sarif Timbavadi,Mosque,"Dargah Sarif Timbavadi, 362015, Timbavadi, Junagadh, Gujarat","Timbavadi, pramukh nagar",362015,Junagadh,,Gujarat,IN,https://www.google.com/maps/place/Dargah+Sarif+Timbavadi/data=!4m7!3m6!1s0x395801e10720f061:0x23b44137ccb7fce8!8m2!3d21.5072537!4d70.4344186!16s%2Fg%2F11cs9ws50n!19sChIJYfAgB-EBWDkR6Py3zDdBtCM?authuser=0&hl=en&rclk=1,"21.5072537,70.4344186"
Sakkar Baug Masjid,Mosque,"GFR7+RQC Sakkar Baug Masjid, GJ SH 31, Dolatpara, Junagadh, Gujarat 362004",Dolatpara,"GFR7+RQC, GJ SH 31",Junagadh,362004,Gujarat,IN,https://www.google.com/maps/place/Sakkar+Baug+Masjid/data=!4m7!3m6!1s0x3958023ad12b0b57:0x505b8851a5de01dd!8m2!3d21.5420598!4d70.4643842!16s%2Fg%2F1pyql3k8s!19sChIJVwsr0ToCWDkR3QHepVGIW1A?authuser=0&hl=en&rclk=1,"21.5420598,70.4643842"
aastaan-e-pNjetn piir,Mosque,"GFGW+RR7 aastaan-e-pNjetn piir, Junagadh, Gujarat 362004",,GFGW+RR7,Junagadh,362004,Gujarat,IN,https://www.google.com/maps/place/%E0%AA%86%E0%AA%B8%E0%AB%8D%E0%AA%A4%E0%AA%BE%E0%AA%A8-%E0%AA%8F-%E0%AA%AA%E0%AA%82%E0%AA%9C%E0%AB%87%E0%AA%A4%E0%AA%A8+%E0%AA%AA%E0%AB%80%E0%AA%B0/data=!4m7!3m6!1s0x395801669f3da5c3:0x31a6cd495036c6cf!8m2!3d21.5270472!4d70.4970313!16s%2Fg%2F11d_tkrh93!19sChIJw6U9n2YBWDkRz8Y2UEnNpjE?authuser=0&hl=en&rclk=1,"21.5270472,70.4970313"
Hure Ilahi Masjid,Mosque,"GFH9+9R5 Hure Ilahi Masjid, Mullawada, Junagadh, Gujarat 362001",Mullawada,GFH9+9R5,Junagadh,362001,Gujarat,IN,https://www.google.com/maps/place/Hure+Ilahi+Masjid/data=!4m7!3m6!1s0x39580187ab8b2683:0xafa8808e2b70736f!8m2!3d21.5283983!4d70.4696094!16s%2Fg%2F11f2xymb43!19sChIJgyaLq4cBWDkRb3NwK46AqK8?authuser=0&hl=en&rclk=1,"21.5283983,70.4696094"
Datar Masjid dtr msjd,Mosque,"GF69+VXG Datar Masjid dtr msjd, Hazrat Jamiyalsha Dargah Premises, Datar, Shree Suryakant Aacharya Marg, Junagadh, Gujarat 362001",Shreenath Nagar,"GF69+VXG, Hazrat Jamiyalsha Dargah Premises, Datar, Shree Suryakant Aacharya Marg",Junagadh,362001,Gujarat,IN,https://www.google.com/maps/place/Datar+Masjid+%D8%AF%D8%AA%D8%A7%D8%B1+%D9%85%D8%B3%D8%AC%D8%AF%E2%80%AD/data=!4m7!3m6!1s0x39580199a0a1cf39:0x59d382b155123108!8m2!3d21.5121983!4d70.4699541!16s%2Fg%2F11c73k0mqt!19sChIJOc-hoJkBWDkRCDESVbGC01k?authuser=0&hl=en&rclk=1,"21.512198299999998,70.4699541"
Masjid E Badar msjdi bdr,Mosque,"HF4C+89G Masjid E Badar msjdi bdr, Dolatpara, Junagadh, Gujarat 362037",Dolatpara,HF4C+89G,Junagadh,362037,Gujarat,IN,https://www.google.com/maps/place/Masjid+E+Badar+%D9%85%D8%B3%D8%AC%D8%AF%D9%90+%D8%A8%D8%AF%D8%B1%E2%80%AD/data=!4m7!3m6!1s0x39580310953e5d71:0xbcb4bc6cebfe87e4!8m2!3d21.5558186!4d70.4709676!16s%2Fg%2F11g0kgyl6h!19sChIJcV0-lRADWDkR5If-62y8tLw?authuser=0&hl=en&rclk=1,"21.5558186,70.4709676"
Lal Bakhte Masjid ll bkhti msjd,Mosque,"Lal Bakhte Masjid ll bkhti msjd, Mullawada, Junagadh, Gujarat 362001",Mullawada,,Junagadh,,Gujarat,IN,https://www.google.com/maps/place/Lal+Bakhte+Masjid+%D9%84%D8%A7%D9%84+%D8%A8%D8%AE%D8%AA%D9%90+%D9%85%D8%B3%D8%AC%D8%AF%E2%80%AD/data=!4m7!3m6!1s0x3958018bc3c19cc3:0xe5fc0baff57f0088!8m2!3d21.5258!4d70.4599999!16s%2Fg%2F1pyqg1qsn!19sChIJw5zBw4sBWDkRiAB_9a8L_OU?authuser=0&hl=en&rclk=1,"21.5258,70.4599999"
"(WAHHABI) MADRESSA JAMIAH TALIMULQURAN , HASNAIN PRIMARY SCHOOL",Mosque,"F8JV+5RH (WAHHABI) MADRESSA JAMIAH TALIMULQURAN , HASNAIN PRIMARY SCHOOL, Junagadh, Gujarat 362610",,F8JV+5RH,Junagadh,,Gujarat,IN,"https://www.google.com/maps/place/%28WAHHABI%29+MADRESSA+JAMIAH+TALIMULQURAN+,+HASNAIN+PRIMARY+SCHOOL/data=!4m7!3m6!1s0x3957ffc1da8529cf:0x4be19d02a3c4bf26!8m2!3d21.4804416!4d70.3445953!16s%2Fg%2F11gxvvcjv7!19sChIJzymF2sH_VzkRJr_EowKd4Us?authuser=0&hl=en&rclk=1","21.4804416,70.3445953"
Eid Gah Masjid Vanthli,Mosque,"F8HF+JF2 Eid Gah Masjid Vanthli, Junagadh, Gujarat 362610",,F8HF+JF2,Junagadh,,Gujarat,IN,https://www.google.com/maps/place/Eid+Gah+Masjid+Vanthli/data=!4m7!3m6!1s0x3957fc3aa9d7bc2d:0x6440106126f24f88!8m2!3d21.4790109!4d70.3236473!16s%2Fg%2F11ggszmh11!19sChIJLbzXqTr8VzkRiE_yJmEQQGQ?authuser=0&hl=en&rclk=1,"21.4790109,70.32364729999999"
Nawab DILAWAR MASJID nwb dlwr msjd,Mosque,"GF66+597 Nawab DILAWAR MASJID nwb dlwr msjd, manoranjan Circuit House Ground, opp Dilawar building, Junagadh, Gujarat 362001",Kadiyavad,"GF66+597, manoranjan Circuit House Ground, opp Dilawar building",Junagadh,362001,Gujarat,IN,https://www.google.com/maps/place/Nawab+DILAWAR+MASJID+%D9%86%D9%88%D8%A7%D8%A8+%D8%AF%D9%84%D8%A7%D9%88%D8%B1+%D9%85%D8%B3%D8%AC%D8%AF%E2%80%AD/data=!4m7!3m6!1s0x3958019429bb99d9:0xa5748a6427613d69!8m2!3d21.5104216!4d70.4609177!16s%2Fg%2F11dftrlnnj!19sChIJ2Zm7KZQBWDkRaT1hJ2SKdKU?authuser=0&hl=en&rclk=1,"21.510421599999997,70.4609177"
Jalees ul Hasan Masjid,Mosque,"GFF6+XJW Jalees ul Hasan Masjid, Mullawada, Junagadh, Gujarat 362001",Mullawada,GFF6+XJW,Junagadh,362001,Gujarat,IN,https://www.google.com/maps/place/Jalees+ul+Hasan+Masjid/data=!4m7!3m6!1s0x395801895a52f89d:0x96711e59154cb3db!8m2!3d21.524993!4d70.4615776!16s%2Fg%2F11g4g1mv1k!19sChIJnfhSWokBWDkR27NMFVkecZY?authuser=0&hl=en&rclk=1,"21.524993,70.4615776"
Masjid e Badr Unnisa,Mosque,"FFW8+WW9 Masjid e Badr Unnisa, Dhara Nagar, Junagadh, Gujarat 362001",Dhara Nagar,FFW8+WW9,Junagadh,362001,Gujarat,IN,https://www.google.com/maps/place/Masjid+e+Badr+Unnisa/data=!4m7!3m6!1s0x395801a54dd95d3d:0xf0394904f88a179b!8m2!3d21.497279!4d70.4673443!16s%2Fg%2F11g9r1w0sb!19sChIJPV3ZTaUBWDkRmxeK-ARJOfA?authuser=0&hl=en&rclk=1,"21.497279,70.4673443"
Faruki Masjid frwqy msjd,Mosque,"GFP5+2WP Faruki Masjid frwqy msjd, Majevadi Darvaja Rd, Joshipura, Junagadh, Gujarat 362001",Joshipura,"GFP5+2WP, Majevadi Darvaja Rd",Junagadh,362001,Gujarat,IN,https://www.google.com/maps/place/Faruki+Masjid+%D9%81%D8%A7%D8%B1%D9%88%D9%82%DB%8C+%D9%85%D8%B3%D8%AC%D8%AF%E2%80%AD/data=!4m7!3m6!1s0x395802215c3d3c87:0x2e5214916d9baf54!8m2!3d21.5350865!4d70.4598265!16s%2Fg%2F11c6lsxgjk!19sChIJhzw9XCECWDkRVK-bbZEUUi4?authuser=0&hl=en&rclk=1,"21.5350865,70.45982649999999"
Hajrat Ali Shah Bapu Ni Masjid,Mosque,"GFP6+925 Hajrat Ali Shah Bapu Ni Masjid, GJ SH 31, Khwaja Nagar, Joshipura, Junagadh, Gujarat 362002","Khwaja Nagar, Joshipura","GFP6+925, GJ SH 31",Junagadh,362002,Gujarat,IN,https://www.google.com/maps/place/Hajrat+Ali+Shah+Bapu+Ni+Masjid/data=!4m7!3m6!1s0x39580223e380f499:0x14f3c9973729a188!8m2!3d21.5359!4d70.4601!16s%2Fg%2F1pyqmy9tm!19sChIJmfSA4yMCWDkRiKEpN5fJ8xQ?authuser=0&hl=en&rclk=1,"21.535899999999998,70.4601"
Chitta khana masjid,Mosque,"GFC6+W2P Chitta khana masjid, Chitta Khana Chowk, Mullawada, Junagadh, Gujarat 362001",Mullawada,"GFC6+W2P, Chitta Khana Chowk",Junagadh,362001,Gujarat,IN,https://www.google.com/maps/place/Chitta+khana+masjid/data=!4m7!3m6!1s0x395801961cc23ecd:0xa79a3f5f0693162d!8m2!3d21.5223454!4d70.4600741!16s%2Fg%2F11flmx65l1!19sChIJzT7CHJYBWDkRLRaTBl8_mqc?authuser=0&hl=en&rclk=1,"21.5223454,70.4600741"
Makrani Masjid,Mosque,"Makrani Masjid, 3, Nagar Rd, Shreenath Nagar, Junagadh, Gujarat 362001",Shreenath Nagar,"3, Nagar Rd",Junagadh,362001,Gujarat,IN,https://www.google.com/maps/place/Makrani+Masjid/data=!4m7!3m6!1s0x395801910404b51d:0x5f93f46ded8ba612!8m2!3d21.5156!4d70.4636!16s%2Fg%2F1pyqj1nsz!19sChIJHbUEBJEBWDkREqaL7W30k18?authuser=0&hl=en&rclk=1,"21.5156,70.4636"
MADINA MASJID -GODHAVAV,Mosque,"GF99+FH5 MADINA MASJID -GODHAVAV, Godhavav ki pati, Junagadh, Gujarat 362001",Shreenath Nagar,"GF99+FH5, Godhavav ki pati",Junagadh,362001,Gujarat,IN,https://www.google.com/maps/place/MADINA+MASJID+-GODHAVAV/data=!4m7!3m6!1s0x3958019ac5b1975f:0x6759299fb92f0c7!8m2!3d21.5186255!4d70.4689943!16s%2Fg%2F11c382169b!19sChIJX5exxZoBWDkRx_CS-5mSdQY?authuser=0&hl=en&rclk=1,"21.5186255,70.46899429999999"
Mosque msjd,Mosque,"GFC3+8J3 Mosque msjd, Rani Sati Colony, Joshipura, Junagadh, Gujarat 362001","Rani Sati Colony, Joshipura",GFC3+8J3,Junagadh,362001,Gujarat,IN,https://www.google.com/maps/place/Mosque+%D9%85%D8%B3%D8%AC%D8%AF%E2%80%AD/data=!4m7!3m6!1s0x395801f326bcc541:0x56f36a9a3f0cb6ac!8m2!3d21.5207581!4d70.4540543!16s%2Fg%2F11f39_chp0!19sChIJQcW8JvMBWDkRrLYMP5pq81Y?authuser=0&hl=en&rclk=1,"21.5207581,70.4540543"
Bilal uz Zaman Masjid,Mosque,"GFF8+J95 Bilal uz Zaman Masjid, Bhatiya Dharamshala Rd, New Ghanchi Wada, Mullawada, Junagadh, Gujarat 362001","New Ghanchi Wada, Mullawada","GFF8+J95, Bhatiya Dharamshala Rd",Junagadh,362001,Gujarat,IN,https://www.google.com/maps/place/Bilal+uz+Zaman+Masjid/data=!4m7!3m6!1s0x3958018f45f04021:0x9bceaecc9419c42c!8m2!3d21.5240226!4d70.4659845!16s%2Fg%2F11bzypggh_!19sChIJIUDwRY8BWDkRLMQZlMyuzps?authuser=0&hl=en&rclk=1,"21.5240226,70.46598449999999"
MASJID E AL GAFAAR. (msjiid e al gphaar),Mosque,"HF24+FQW MASJID E AL GAFAAR. (msjiid e al gphaar), Yamuna Nagar B/h Kembrij School, Khamdhrol Rd, Junagadh, Gujarat 362002",Dolatpara,"HF24+FQW, Yamuna Nagar B/h Kembrij School, Khamdhrol Rd",Junagadh,362002,Gujarat,IN,https://www.google.com/maps/place/MASJID+E+AL+GAFAAR.+%28%E0%AA%AE%E0%AA%B8%E0%AB%8D%E0%AA%9C%E0%AB%80%E0%AA%A6+%E0%AA%8F+%E0%AA%85%E0%AA%B2+%E0%AA%97%E0%AA%AB%E0%AA%BE%E0%AA%B0%29/data=!4m7!3m6!1s0x395803b331808551:0xb460e20561a589bd!8m2!3d21.5512456!4d70.456943!16s%2Fg%2F11h3qrw7bh!19sChIJUYWAMbMDWDkRvYmlYQXiYLQ?authuser=0&hl=en&rclk=1,"21.551245599999998,70.456943"
Nagina Masjid,Mosque,"Nagina Masjid, sej no Otto, Hatkeshwar Ln, nr. satkar transport, Mullawada, Junagadh, Gujarat 362001",Mullawada,"sej no Otto, Hatkeshwar Ln, nr. satkar transport",Junagadh,362001,Gujarat,IN,https://www.google.com/maps/place/Nagina+Masjid/data=!4m7!3m6!1s0x3958018ffe8a5ce7:0x20acb59b4e947c95!8m2!3d21.5194066!4d70.4666935!16s%2Fg%2F1pyqs3_2t!19sChIJ51yK_o8BWDkRlXyUTpu1rCA?authuser=0&hl=en&rclk=1,"21.5194066,70.46669349999999"
Masjid Raees Raja,Apartments,"GFG7+CMP Masjid Raees Raja, Imam Ahemad Rd, New Ghanchi Wada, Mullawada, Junagadh, Gujarat 362001","New Ghanchi Wada, Mullawada","GFG7+CMP, Imam Ahemad Rd",Junagadh,362001,Gujarat,IN,https://www.google.com/maps/place/Masjid+Raees+Raja/data=!4m7!3m6!1s0x39580188e0130b03:0x9fc049b749ff346a!8m2!3d21.5260981!4d70.4641925!16s%2Fg%2F1pyqhvsw5!19sChIJAwsT4IgBWDkRajT_SbdJwJ8?authuser=0&hl=en&rclk=1,"21.5260981,70.4641925"
Hajrat Gebanshah Pir Masjid,Mosque,"GFC9+98C Hajrat Gebanshah Pir Masjid, Mullawada, Junagadh, Gujarat 362001",Mullawada,GFC9+98C,Junagadh,362001,Gujarat,IN,https://www.google.com/maps/place/Hajrat+Gebanshah+Pir+Masjid/data=!4m7!3m6!1s0x395801856aff6c93:0xd3ef285ea6b6e400!8m2!3d21.5209464!4d70.4682684!16s%2Fg%2F1pyqv8vtz!19sChIJk2z_aoUBWDkRAOS2pl4o79M?authuser=0&hl=en&rclk=1,"21.5209464,70.4682684"
Masjid E Zulekha msjdi zlykh,Mosque,"GC8R+MWR Masjid E Zulekha msjdi zlykh, Unnamed Road, Shashikunj, Junagadh, Gujarat 362015",Shashikunj,"GC8R+MWR, Unnamed Road",Junagadh,362015,Gujarat,IN,https://www.google.com/maps/place/Masjid+E+Zulekha+%D9%85%D8%B3%D8%AC%D8%AF%D9%90+%D8%B2%D9%84%DB%8C%D8%AE%D8%A7%E2%80%AD/data=!4m7!3m6!1s0x395801a677802a95:0x6aedc9be63c8fc78!8m2!3d21.5167283!4d70.4422763!16s%2Fg%2F11n5zjkt_k!19sChIJlSqAd6YBWDkRePzIY77J7Wo?authuser=0&hl=en&rclk=1,"21.5167283,70.4422763"
Khankah e razviyyah (HAZRAT GULZAR BAPU),Mosque,"GFG7+FH5 Khankah e razviyyah (HAZRAT GULZAR BAPU), Imam ahmed raza road, Zalorapa Rd, Gujarat 362001",Mullawada,"GFG7+FH5, Imam ahmed raza road, Zalorapa Rd",Junagadh,362001,Gujarat,IN,https://www.google.com/maps/place/Khankah+e+razviyyah+%28HAZRAT+GULZAR+BAPU%29/data=!4m7!3m6!1s0x395801f50aec1d33:0x5c734cb82bde5062!8m2!3d21.5261421!4d70.4639791!16s%2Fg%2F11g10l1jw1!19sChIJMx3sCvUBWDkRYlDeK7hMc1w?authuser=0&hl=en&rclk=1,"21.526142099999998,70.4639791"
ibaadt gaah GIDC IBADATGAH (SARAGWADA PATIYA),Mosque,"HF78+XM9 ibaadt gaah GIDC IBADATGAH (SARAGWADA PATIYA), saragwada road, GIDC 2, Junagadh, Gujarat 362037",GIDC 2,"HF78+XM9, saragwada road",Junagadh,362037,Gujarat,IN,https://www.google.com/maps/place/%E0%A4%87%E0%A4%AC%E0%A4%BE%E0%A4%A6%E0%A4%A4+%E0%A4%97%E0%A4%BE%E0%A4%B9+GIDC+IBADATGAH+%28SARAGWADA+PATIYA%29/data=!4m7!3m6!1s0x3958025aab34c7ef:0xbaab177ba2c81d5f!8m2!3d21.5649118!4d70.4667314!16s%2Fg%2F11g8cr5ppd!19sChIJ78c0q1oCWDkRXx3IonsXq7o?authuser=0&hl=en&rclk=1,"21.564911799999997,70.4667314"
Dhal Masjid (Markaz Masjid),Mosque,"GFC6+WRC Dhal Masjid (Markaz Masjid), Dhal Rd, Mullawada, Junagadh, Gujarat 362001",Mullawada,"GFC6+WRC, Dhal Rd",Junagadh,362001,Gujarat,IN,https://www.google.com/maps/place/Dhal+Masjid+%28Markaz+Masjid%29/data=!4m7!3m6!1s0x395801363e20ba73:0x7005ee52bfa35764!8m2!3d21.5223233!4d70.4620061!16s%2Fg%2F11j25nvzp9!19sChIJc7ogPjYBWDkRZFejv1LuBXA?authuser=0&hl=en&rclk=1,"21.5223233,70.4620061"
HAJIYANI JUBEDA MASJID,Mosque,"GC8W+V8J HAJIYANI JUBEDA MASJID, behind New Collector Office Road, Welcome Park 1, Ghanchipat, Junagadh, Gujarat 362001","Welcome Park 1, Ghanchipat","GC8W+V8J, behind New Collector Office Road",Junagadh,362001,Gujarat,IN,https://www.google.com/maps/place/HAJIYANI+JUBEDA+MASJID/data=!4m7!3m6!1s0x3958016a8fddad0d:0xe1c15f667ae03f25!8m2!3d21.517212!4d70.445753!16s%2Fg%2F11tsgb240n!19sChIJDa3dj2oBWDkRJT_gemZfweE?authuser=0&hl=en&rclk=1,"21.517212,70.445753"
Ahle Hadees Masjid Junagadh,Mosque,"Ahle Hadees Masjid Junagadh, sarvan faliya, Mullawada, Junagadh, Gujarat 362001",Mullawada,sarvan faliya,Junagadh,,Gujarat,IN,https://www.google.com/maps/place/Ahle+Hadees+Masjid+Junagadh/data=!4m7!3m6!1s0x3958034d4dc8f819:0x736b53583942b916!8m2!3d21.5251511!4d70.4607935!16s%2Fg%2F11h7g3d_pt!19sChIJGfjITU0DWDkRFrlCOVhTa3M?authuser=0&hl=en&rclk=1,"21.5251511,70.4607935"
Masjid e Hazrat Alvi,Mosque,"GFG7+V8W Masjid e Hazrat Alvi, Mullawada, Junagadh, Gujarat 362001",Mullawada,GFG7+V8W,Junagadh,362001,Gujarat,IN,https://www.google.com/maps/place/Masjid+e+Hazrat+Alvi/data=!4m7!3m6!1s0x395801077cdbd789:0xb498a9bd9edfa432!8m2!3d21.5272309!4d70.4633223!16s%2Fg%2F11f66f9gyk!19sChIJidfbfAcBWDkRMqTfnr2pmLQ?authuser=0&hl=en&rclk=1,"21.5272309,70.4633223"
Fatima Masjid fTmh msjd,Mosque,"Fatima Masjid fTmh msjd, H5111 Zanzarda, Junagadh, Gujarat 362002","Memon Colony, Shashikunj",H5111 Zanzarda,Junagadh,362002,Gujarat,IN,https://www.google.com/maps/place/Fatima+Masjid+%D9%81%D8%A7%D8%B7%D9%85%DB%81+%D9%85%D8%B3%D8%AC%D8%AF%E2%80%AD/data=!4m7!3m6!1s0x395801eeb7c49799:0x4aa546acb9ad6116!8m2!3d21.5187946!4d70.4435039!16s%2Fg%2F11t5kd_ftc!19sChIJmZfEt-4BWDkRFmGtuaxGpUo?authuser=0&hl=en&rclk=1,"21.5187946,70.4435039"
Masjid~e~Zulekha,Mosque,"HCGM+HHF Masjid~e~Zulekha, Galiyavada, Gujarat 362037",,HCGM+HHF,Galiyavada,362037,Gujarat,IN,https://www.google.com/maps/place/Masjid~e~Zulekha/data=!4m7!3m6!1s0x39580281a17f52e3:0x11bdc5b30d38efbf!8m2!3d21.5764491!4d70.4339159!16s%2Fg%2F11f15lk3ns!19sChIJ41J_oYECWDkRv-84DbPFvRE?authuser=0&hl=en&rclk=1,"21.576449099999998,70.4339159"
Najubibi Mosque & Makbara,Monument maker,"GFJ9+94X Najubibi Mosque & Makbara, bara saiyad, caves, near khapra kodia, Junagadh, Gujarat",Mullawada,"GFJ9+94X, bara saiyad, caves, near khapra kodia",Junagadh,,Gujarat,IN,https://www.google.com/maps/place/Najubibi+Mosque+%26+Makbara/data=!4m7!3m6!1s0x3958015d0582837f:0xb70ad82e98bf54ad!8m2!3d21.5309882!4d70.4678559!16s%2Fg%2F11ff5gst_l!19sChIJf4OCBV0BWDkRrVS_mC7YCrc?authuser=0&hl=en&rclk=1,"21.5309882,70.4678559"
Gebansah Masjid,Mosque,"Gebansah Masjid, 161, Filter Plant Rd, Mullawada, Junagadh, Gujarat 362001",Mullawada,"161, Filter Plant Rd",Junagadh,362001,Gujarat,IN,https://www.google.com/maps/place/Gebansah+Masjid/data=!4m7!3m6!1s0x39580188707ad8cf:0xdf23be63b1be70f!8m2!3d21.5286209!4d70.4660807!16s%2Fg%2F1pyql7c4x!19sChIJz9h6cIgBWDkRD-cbO-Y78g0?authuser=0&hl=en&rclk=1,"21.5286209,70.46608069999999"
Madina Masjid Sabri So.,Physical fitness program,"GFQ4+52J Madina Masjid Sabri So., Harshad Nagar, Khwaja Nagar, Joshipura, Khamdhrol, Junagadh, Gujarat 362002","Harshad Nagar, Khwaja Nagar, Joshipura",GFQ4+52J,"Khamdhrol, Junagadh",362002,Gujarat,IN,https://www.google.com/maps/place/Madina+Masjid+Sabri+So./data=!4m7!3m6!1s0x395802187f9cea69:0xf4b450b2fbfe8de4!8m2!3d21.5379555!4d70.4550159!16s%2Fg%2F11cn3nst_f!19sChIJaeqcfxgCWDkR5I3--7JQtPQ?authuser=0&hl=en&rclk=1,"21.5379555,70.45501589999999"
Masjid-e-sattar,Mosque,"GFG7+82X Masjid-e-sattar, Bhoywada, Junagadh, Gujarat",Mullawada,"GFG7+82X, Bhoywada",Junagadh,,Gujarat,IN,https://www.google.com/maps/place/Masjid-e-sattar/data=!4m7!3m6!1s0x3958010369875ae3:0xd0bd54d79c48adb6!8m2!3d21.5258642!4d70.462595!16s%2Fg%2F11hycz0b27!19sChIJ41qHaQMBWDkRtq1InNdUvdA?authuser=0&hl=en&rclk=1,"21.525864199999997,70.462595"
Masjid-e-Yusuf msjdi ywswf,Mosque,"Masjid-e-Yusuf msjdi ywswf, Ajmeri Park socitey, Chobari Rd, near memon Colony, behind collectorate office, Memon Colony, Shashikunj, Junagadh, Gujarat 362001","Memon Colony, Shashikunj","Ajmeri Park socitey, Chobari Rd, near memon Colony, behind collectorate office",Junagadh,362001,Gujarat,IN,https://www.google.com/maps/place/Masjid-e-Yusuf+%D9%85%D8%B3%D8%AC%D8%AF%D9%90+%DB%8C%D9%88%D8%B3%D9%88%D9%81%E2%80%AD/data=!4m7!3m6!1s0x3958018a66d6a19d:0x41c3183c304a8fc1!8m2!3d21.5192744!4d70.4444992!16s%2Fg%2F11j4183wq1!19sChIJnaHWZooBWDkRwY9KMDwYw0E?authuser=0&hl=en&rclk=1,"21.5192744,70.4444992"
Chobari Juma Masjid,Mosque,"GC79+7RW Chobari Juma Masjid, Chobari Rd, Chobari, Junagadh, Gujarat 362015",Chobari,"GC79+7RW, Chobari Rd",Junagadh,362015,Gujarat,IN,https://www.google.com/maps/place/Chobari+Juma+Masjid/data=!4m7!3m6!1s0x3957ff3f7f350fe5:0x3c571a96fef82fed!8m2!3d21.5132274!4d70.4195872!16s%2Fg%2F11q2r_09lf!19sChIJ5Q81fz__VzkR7S_4_pYaVzw?authuser=0&hl=en&rclk=1,"21.513227399999998,70.4195872"
Gebanshah pir gybnshh pyr,Mosque,"GFJ8+257 Gebanshah pir gybnshh pyr, Mullawada, Junagadh, Gujarat 362001",Mullawada,GFJ8+257,Junagadh,362001,Gujarat,IN,https://www.google.com/maps/place/Gebanshah+pir+%DA%AF%DB%8C%D8%A8%D9%86%D8%B4%DB%81+%D9%BE%DB%8C%D8%B1%E2%80%AD/data=!4m7!3m6!1s0x39580181f76d20e5:0x6957c316430e39bb!8m2!3d21.5300451!4d70.4654308!16s%2Fg%2F11pf825pb5!19sChIJ5SBt94EBWDkRuzkOQxbDV2k?authuser=0&hl=en&rclk=1,"21.5300451,70.4654308"
naganisha bapu ki dargah,Mosque,"GFF5+4MF naganisha bapu ki dargah, Vanthali Darwaza, Gandhi Chowk, Joshipura, Junagadh, Gujarat 362001",Joshipura,"GFF5+4MF, Vanthali Darwaza, Gandhi Chowk",Junagadh,362001,Gujarat,IN,https://www.google.com/maps/place/naganisha+bapu+ki+dargah/data=!4m7!3m6!1s0x395801319f91c10b:0x75dc66928cb2d05d!8m2!3d21.5228116!4d70.4591713!16s%2Fg%2F11fw_h3dyf!19sChIJC8GRnzEBWDkRXdCyjJJm3HU?authuser=0&hl=en&rclk=1,"21.5228116,70.4591713"
NagaarShah Pir Dargah,Mosque,"NagaarShah Pir Dargah, Near by 66, Sharamjivi society, Dolatpara, Junagadh, Gujarat 362002",Dolatpara,"Near by 66, Sharamjivi society",Junagadh,362002,Gujarat,IN,https://www.google.com/maps/place/NagaarShah+Pir+Dargah/data=!4m7!3m6!1s0x395803b4cafc1ef7:0x7b88798259a504e2!8m2!3d21.5525924!4d70.4597087!16s%2Fg%2F11gt_vymxq!19sChIJ9x78yrQDWDkR4gSlWYJ5iHs?authuser=0&hl=en&rclk=1,"21.552592399999998,70.4597087"
