name,main_category,address,address_ward,address_street,address_city,address_postal_code,address_state,address_country_code,link,coordinates
Masjid-e-Rahmaniya,Mosque,"MHQ7+W3M Masjid-e-Rahmaniya, Nana mohallah, Mochiwad, Vejalpur",,"MHQ7+W3M, Nana mohallah, Mochiwad",Vejalpur,,Gujarat,IN,https://www.google.com/maps/place/Masjid-e-Rahmaniya/data=!4m7!3m6!1s0x3960855f3cd2076d:0xf7f70baf51ca8e0d!8m2!3d22.6898334!4d73.5626805!16s%2Fg%2F11rnqhdf3c!19sChIJbQfSPF-FYDkRDY7KUa8L9_c?authuser=0&hl=en&rclk=1,"22.689833399999998,73.5626805"
Masjid e Noor,Mosque,"Masjid e Noor, Ice Factory Rd, opp. Al Hamd House , near Fazle Rabbi Society, Unit Hills Society, Rehnuma Society, Juhapura, Ahmedabad, Gujarat 380055","Unit Hills Society, Rehnuma Society, Juhapura","Masjid e Noor, Ice Factory Rd, opp. Al Hamd House , near Fazle Rabbi Society",Ahmedabad,380055,Gujarat,IN,https://www.google.com/maps/place/Masjid+e+Noor/data=!4m7!3m6!1s0x395e8552324a6611:0x881f7ed8bc5d2b2f!8m2!3d22.9902225!4d72.5328526!16s%2Fg%2F11mqk412kj!19sChIJEWZKMlKFXjkRLytdvNh-H4g?authuser=0&hl=en&rclk=1,"22.990222499999998,72.5328526"
Hazrat Bilal ra Masjid,Mosque,"Hazrat Bilal ra Masjid, C-6, Juhapura, Ahmedabad, Gujarat 380055",Juhapura,C-6,Ahmedabad,380055,Gujarat,IN,https://www.google.com/maps/place/Hazrat+Bilal+ra+Masjid/data=!4m7!3m6!1s0x395e85e6740ee117:0xfa9448c959817862!8m2!3d22.9955116!4d72.5281595!16s%2Fg%2F11trtc6qtx!19sChIJF-EOdOaFXjkRYniBWclIlPo?authuser=0&hl=en&rclk=1,"22.9955116,72.5281595"
Abdul Masjid,Mosque,"XGRJ+JR5 Abdul Masjid, Sunrise Park Society, Rehnuma Society, Royal Nawab Society, Juhapura, Ahmedabad, Gujarat 380055","Sunrise Park Society, Rehnuma Society, Royal Nawab Society, Juhapura",XGRJ+JR5,Ahmedabad,380055,Gujarat,IN,https://www.google.com/maps/place/Abdul+Masjid/data=!4m7!3m6!1s0x395e853780d70d85:0x7d58902cc530ef94!8m2!3d22.9915243!4d72.5321241!16s%2Fg%2F11b5phy9rc!19sChIJhQ3XgDeFXjkRlO8wxSyQWH0?authuser=0&hl=en&rclk=1,"22.9915243,72.53212409999999"
Aqsa Masjid,Mosque,"XGG7+P3J Aqsa Masjid, Arshad Park, Juhapura, Ahmedabad, Chaloda, Gujarat 380055","Arshad Park, Juhapura",XGG7+P3J,"Ahmedabad, Chaloda",380055,Gujarat,IN,https://www.google.com/maps/place/Aqsa+Masjid/data=!4m7!3m6!1s0x395e9b255d17e303:0x375509b1794dccf6!8m2!3d22.9768303!4d72.5126407!16s%2Fg%2F11np8vgzpg!19sChIJA-MXXSWbXjkR9sxNebEJVTc?authuser=0&hl=en&rclk=1,"22.9768303,72.51264069999999"
Jama Musjid,Mosque,"552, Jama Musjid, khawajanagar, 100 ft ring road behind canal, 1, Sarkhej ITI Rd, Navi Fatehvadi Village, Juhapura, Ahmedabad, Gujarat 380055","Navi Fatehvadi Village, Juhapura","552, khawajanagar, 100 ft ring road behind canal, 1, Sarkhej ITI Rd","Ahmedabad, Sarkhej-Okaf",380055,Gujarat,IN,https://www.google.com/maps/place/Jama+Musjid/data=!4m7!3m6!1s0x395e9b791125c919:0x2b4a03d1e76dbd9f!8m2!3d22.9729078!4d72.5138231!16s%2Fg%2F11j8kf7by_!19sChIJGcklEXmbXjkRn71t59EDSis?authuser=0&hl=en&rclk=1,"22.972907799999998,72.5138231"
Gulliwala Madrasa And Masjid,Mosque,"XGWJ+54W Gulliwala Madrasa And Masjid, 1st St, Sham-e-Burhan Society, Sanklit Nagar, Juhapura, Ahmedabad, Gujarat 382210","Sham-e-Burhan Society, Sanklit Nagar, Juhapura","XGWJ+54W, 1st St",Ahmedabad,382210,Gujarat,IN,https://www.google.com/maps/place/Gulliwala+Madrasa+And+Masjid/data=!4m7!3m6!1s0x395e9ac79151f59b:0xeae11f069ff13d5f!8m2!3d22.9954856!4d72.5303374!16s%2Fg%2F11j8k956hj!19sChIJm_VRkceaXjkRXz3xnwYf4eo?authuser=0&hl=en&rclk=1,"22.9954856,72.5303374"
Madrasa,Mosque,"XGW9+7W8 Madrasa, Jivraj Vejalpur Rd, Teacher's Society, Quresh Nagar Society, Juhapura, Ahmedabad, Gujarat 380055","Teacher's Society, Quresh Nagar Society, Juhapura","XGW9+7W8, Jivraj Vejalpur Rd",Ahmedabad,,Gujarat,IN,https://www.google.com/maps/place/Madrasa/data=!4m7!3m6!1s0x395e9bc599deb9ad:0xca6d5017293eed02!8m2!3d22.9956702!4d72.5198417!16s%2Fg%2F11q5844b0h!19sChIJrbnemcWbXjkRAu0-KRdQbco?authuser=0&hl=en&rclk=1,"22.9956702,72.5198417"
Mehrufazal masjid,Mosque,"Mehrufazal masjid, 34, faiz e mohammadi park, opp. prachina, socity, Juhapura, Ahmedabad, Gujarat 380055","socity, Juhapura","34, faiz e mohammadi park, opp. prachina",Ahmedabad,380055,Gujarat,IN,https://www.google.com/maps/place/Mehrufazal+masjid/data=!4m7!3m6!1s0x395e85927b38b6bd:0xeb2ac92a07db465a!8m2!3d22.9863128!4d72.52686!16s%2Fg%2F11r7xpcmqg!19sChIJvbY4e5KFXjkRWkbbByrJKus?authuser=0&hl=en&rclk=1,"22.9863128,72.52686"
Masjid-E-yusuf,Mosque,"XGH8+6F5 Masjid-E-yusuf, Arshad Park, Juhapura, Chaloda, Gujarat 380055","Arshad Park, Juhapura",XGH8+6F5,Chaloda,380055,Gujarat,IN,https://www.google.com/maps/place/Masjid-E-yusuf/data=!4m7!3m6!1s0x395e9bcaab8594a7:0xf482928dcefbde25!8m2!3d22.9780152!4d72.5162285!16s%2Fg%2F11pf1_ks6f!19sChIJp5SFq8qbXjkRJd77zo2SgvQ?authuser=0&hl=en&rclk=1,"22.978015199999998,72.5162285"
Kuba Masjid,Mosque,"XGH8+JVV Kuba Masjid, Arshad Park, Juhapura, Ahmedabad, Chaloda, Gujarat 380055","Arshad Park, Juhapura",XGH8+JVV,"Ahmedabad, Chaloda",380055,Gujarat,IN,https://www.google.com/maps/place/Kuba+Masjid/data=!4m7!3m6!1s0x395e9b35ef6914fb:0xa297375a71005712!8m2!3d22.9791043!4d72.517186!16s%2Fg%2F11t9lmtbh1!19sChIJ-xRp7zWbXjkRElcAcVo3l6I?authuser=0&hl=en&rclk=1,"22.9791043,72.517186"
Fatima Residency,Mosque,"Fatima Residency, 100 foot ring road, Kenal Road, Arshad Park, Juhapura, Ahmedabad, Gujarat 380055","Arshad Park, Juhapura","100 foot ring road, Kenal Road",Ahmedabad,,Gujarat,IN,https://www.google.com/maps/place/Fatima+Residency/data=!4m7!3m6!1s0x395e9beedd0c5e15:0xc7ea6ca27ebd2271!8m2!3d22.9799347!4d72.5185627!16s%2Fg%2F11jz1vslgr!19sChIJFV4M3e6bXjkRcSK9fqJs6sc?authuser=0&hl=en&rclk=1,"22.979934699999998,72.51856269999999"
