name,main_category,address,address_ward,address_street,address_city,address_postal_code,address_state,address_country_code,link,coordinates
Masjid-E-Gul-E-Ziyad,Mosque,"Masjid-E-Gul-E-Ziyad, Bage firdosh Society part -2, Nr., Iqra hospital,Sarkhej - Juhapura road, Ahmedabad, Gujarat 380055","Haji Bawa park Society, Quresh Nagar Society, Juhapura","Bage firdosh Society part -2, Nr., Iqra hospital,Sarkhej - Juhapura road",Ahmedabad,380055,Gujarat,IN,https://www.google.com/maps/place/Masjid-E-Gul-E-Ziyad/data=!4m7!3m6!1s0x395e9acb7591808b:0x267bad6554fb7f18!8m2!3d22.9918789!4d72.5175529!16s%2Fg%2F11bw835ldw!19sChIJi4CRdcuaXjkRGH_7VGWteyY?authuser=0&hl=en&rclk=1,"22.9918789,72.5175529"
Fatima Masjid,Mosque,"Fatima Masjid, Unnamed Road, Saleem Nagar, Juhapura, Ahmedabad, Gujarat 380051","Saleem Nagar, Juhapura",Unnamed Road,Ahmedabad,380051,Gujarat,IN,https://www.google.com/maps/place/Fatima+Masjid/data=!4m7!3m6!1s0x395e858558dcb845:0xa9d0e9a91b8ebc2b!8m2!3d23.0006561!4d72.5255446!16s%2Fg%2F11fnp9rr4q!19sChIJRbjcWIWFXjkRK7yOG6np0Kk?authuser=0&hl=en&rclk=1,"23.0006561,72.5255446"
Masjid-E-Barkat-E-Raza,Mosque,"XGVM+33V Masjid-E-Barkat-E-Raza, Narol - Sarkhej Rd, Unit Hills Society, Rehnuma Society, Juhapura, Ahmedabad, Gujarat 380055","Unit Hills Society, Rehnuma Society, Juhapura","XGVM+33V, Narol - Sarkhej Rd",Ahmedabad,380055,Gujarat,IN,https://www.google.com/maps/place/Masjid-E-Barkat-E-Raza/data=!4m7!3m6!1s0x395e8539da28b081:0xacd512a26d0b46d0!8m2!3d22.992741!4d72.5326817!16s%2Fg%2F1thkvnv4!19sChIJgbAo2jmFXjkR0EYLbaIS1aw?authuser=0&hl=en&rclk=1,"22.992741,72.5326817"
Masjid-e-Tuba,Mosque,"QJ82+F2X Masjid-e-Tuba, Vejalpur Rd, near capsule company, Tathoora, Chikhodra, Godhra, Gujarat 389340",Tathoora,"QJ82+F2X, Vejalpur Rd, near capsule company","Chikhodra, Godhra",389340,Gujarat,IN,https://www.google.com/maps/place/Masjid-e-Tuba/data=!4m7!3m6!1s0x39609ba9ecc09b47:0x3b3e480171a6c809!8m2!3d22.7662408!4d73.6001169!16s%2Fg%2F11g691m6fl!19sChIJR5vA7KmbYDkRCcimcQFIPjs?authuser=0&hl=en&rclk=1,"22.7662408,73.6001169"
Masjid E Gausiya,Mosque,"Masjid E Gausiya, 24/B, P&T Colony, Danilimda, Ahmedabad, Gujarat 380043","P&T Colony, Danilimda",24/B,Ahmedabad,380043,Gujarat,IN,https://www.google.com/maps/place/Masjid+E+Gausiya/data=!4m7!3m6!1s0x395e85bf25c9c16d:0x326cc222c1b03ada!8m2!3d23.0002617!4d72.5889934!16s%2Fg%2F11dxbr9b6r!19sChIJbcHJJb-FXjkR2jqwwSLCbDI?authuser=0&hl=en&rclk=1,"23.0002617,72.58899339999999"
Masjide Abdul-Aziz Apnanagar,Mosque,"Masjide Abdul-Aziz Apnanagar, 85, APN Nagar, Saleem Nagar, Juhapura, Ahmedabad, Gujarat 380051","APN Nagar, Saleem Nagar, Juhapura",85,Ahmedabad,380051,Gujarat,IN,https://www.google.com/maps/place/Masjide+Abdul-Aziz+Apnanagar/data=!4m7!3m6!1s0x395e8531c01a7eb9:0xb2bfd06d640e6278!8m2!3d22.9986045!4d72.5279224!16s%2Fg%2F11g6qt7s98!19sChIJuX4awDGFXjkReGIOZG3Qv7I?authuser=0&hl=en&rclk=1,"22.9986045,72.5279224"
Al - Wahid Masjid al vaahiid msjid,Mosque,"Al - Wahid Masjid al vaahiid msjid, 27, Unit Hills Society, Rehnuma Society, Royal Nawab Society, Juhapura, Ahmedabad, Gujarat 380055","Unit Hills Society, Rehnuma Society, Royal Nawab Society, Juhapura",27,Ahmedabad,380055,Gujarat,IN,https://www.google.com/maps/place/Al+-+Wahid+Masjid+%E0%AA%85%E0%AA%B2+%E0%AA%B5%E0%AA%BE%E0%AA%B9%E0%AB%80%E0%AA%A6+%E0%AA%AE%E0%AA%B8%E0%AB%8D%E0%AA%9C%E0%AA%BF%E0%AA%A6/data=!4m7!3m6!1s0x395e8537873d36f1:0x2ad39158a9551817!8m2!3d22.9913867!4d72.5321772!16s%2Fg%2F11c61985j9!19sChIJ8TY9hzeFXjkRFxhVqViR0yo?authuser=0&hl=en&rclk=1,"22.9913867,72.53217719999999"
MASJID-E-UVESHQARNI,Mosque,"MASJID-E-UVESHQARNI, 123, Makka Nagar, Juhapura, Ahmedabad, Gujarat 380055","Makka Nagar, Juhapura",123,Ahmedabad,380055,Gujarat,IN,https://www.google.com/maps/place/MASJID-E-UVESHQARNI/data=!4m7!3m6!1s0x395e85ef36c86bcf:0x9c6991bac0bf17ab!8m2!3d22.9988586!4d72.5212866!16s%2Fg%2F11f7qz2yjp!19sChIJz2vINu-FXjkRqxe_wLqRaZw?authuser=0&hl=en&rclk=1,"22.9988586,72.5212866"
Gulab Park Masjid. gulaab paark msjid,Mosque,"Gulab Park Masjid. gulaab paark msjid, 2,gulab park society near Al madina masjid juhapura Ahmedabad Gulab park society, Sarani Rd, APN Nagar, Saleem Nagar, Juhapura, Ahmedabad, Gujarat 380051","APN Nagar, Saleem Nagar, Juhapura","2,gulab park society near Al madina masjid juhapura Ahmedabad Gulab park society, Sarani Rd",Ahmedabad,380051,Gujarat,IN,https://www.google.com/maps/place/Gulab+Park+Masjid.+%E0%AA%97%E0%AB%81%E0%AA%B2%E0%AA%BE%E0%AA%AC+%E0%AA%AA%E0%AA%BE%E0%AA%B0%E0%AB%8D%E0%AA%95+%E0%AA%AE%E0%AA%B8%E0%AB%8D%E0%AA%9C%E0%AA%BF%E0%AA%A6/data=!4m7!3m6!1s0x395e85321f0238ad:0xe58ac6efa2a4c2e1!8m2!3d22.9985184!4d72.5268576!16s%2Fg%2F11cspj98jj!19sChIJrTgCHzKFXjkR4cKkou_GiuU?authuser=0&hl=en&rclk=1,"22.9985184,72.5268576"
GaribNawaz Masjid griib nvaajh msjid,Mosque,"XGXP+885 GaribNawaz Masjid griib nvaajh msjid, APMC Market, Asharaf Nagar, B/H, Juhapura, Ahmedabad, Gujarat 380052","APMC Market, Asharaf Nagar, B/H, Juhapura",XGXP+885,Ahmedabad,380052,Gujarat,IN,https://www.google.com/maps/place/GaribNawaz+Masjid+%E0%AA%97%E0%AA%B0%E0%AB%80%E0%AA%AC+%E0%AA%A8%E0%AA%B5%E0%AA%BE%E0%AA%9D+%E0%AA%AE%E0%AA%B8%E0%AB%8D%E0%AA%9C%E0%AA%BF%E0%AA%A6/data=!4m7!3m6!1s0x395e853b06f51817:0x85e3413a8d234871!8m2!3d22.9982699!4d72.5358489!16s%2Fg%2F11gf967559!19sChIJFxj1BjuFXjkRcUgjjTpB44U?authuser=0&hl=en&rclk=1,"22.9982699,72.53584889999999"
Fatima Masjid,Mosque,"Fatima Masjid, Sur. No.-84 Paki,Shop No.-13 Ambar Tower Lane, Sarkhej Rd, opp. Savan Party Plot, Makarba, Ahmedabad, Gujarat 380055",Makarba,"Sur. No.-84 Paki,Shop No.-13 Ambar Tower Lane, Sarkhej Rd, opp. Savan Party Plot",Ahmedabad,380055,Gujarat,IN,https://www.google.com/maps/place/Fatima+Masjid/data=!4m7!3m6!1s0x395e9bbf285b5573:0x458b9368197419f!8m2!3d22.9891751!4d72.5097307!16s%2Fg%2F11fqsypzwv!19sChIJc1VbKL-bXjkRn0GXgTa5WAQ?authuser=0&hl=en&rclk=1,"22.9891751,72.50973069999999"
Msjid-e-yousufi,Mosque,"MHR7+R25 Msjid-e-yousufi, Vejalpur, Gujarat 389340",,MHR7+R25,Vejalpur,389340,Gujarat,IN,https://www.google.com/maps/place/Msjid-e-yousufi/data=!4m7!3m6!1s0x396084a6d6a2064f:0x20e6d3c8ab223e6a!8m2!3d22.6920233!4d73.5625954!16s%2Fg%2F11fx7p6w5r!19sChIJTwai1qaEYDkRaj4iq8jT5iA?authuser=0&hl=en&rclk=1,"22.6920233,73.56259539999999"
Madni Mosque,Mosque,"Madni Mosque, D14, Ainal Haque Society, Fatehwadi, Arshad Park, Juhapura, Ahmedabad, Gujarat 380055","Ainal Haque Society, Fatehwadi, Arshad Park, Juhapura",D14,Ahmedabad,380055,Gujarat,IN,https://www.google.com/maps/place/Madni+Mosque/data=!4m7!3m6!1s0x395e9b791d99406b:0xe54cead8e65cd324!8m2!3d22.9894932!4d72.5183332!16s%2Fg%2F11f66hw3g5!19sChIJa0CZHXmbXjkRJNNc5tjqTOU?authuser=0&hl=en&rclk=1,"22.9894932,72.5183332"
Masjid-E-Iqbal msjdi qbl - Ahmedabad,Mosque,"Masjid-E-Iqbal msjdi qbl - Ahmedabad, Iqbal Flats, Unit Hills Society, Rehnuma Society, Juhapura, Ahmedabad, Gujarat 380055","Unit Hills Society, Rehnuma Society, Juhapura",Iqbal Flats,Ahmedabad,380055,Gujarat,IN,https://www.google.com/maps/place/Masjid-E-Iqbal+%D9%85%D8%B3%D8%AC%D8%AF%D9%90+%D8%A7%D9%82%D8%A8%D8%A7%D9%84+-+Ahmedabad%E2%80%AD/data=!4m7!3m6!1s0x395e853713f1117b:0xb47b39d1b0bcb584!8m2!3d22.9926603!4d72.5300073!16s%2Fg%2F11c50qfdtb!19sChIJexHxEzeFXjkRhLW8sNE5e7Q?authuser=0&hl=en&rclk=1,"22.9926603,72.5300073"
Noor e Muhammadi Masjid,Mosque,"Noor e Muhammadi Masjid, 39/40, Haryali Society Rd, Unit Hills Society, Rehnuma Society, Royal Nawab Society, Juhapura, Ahmedabad, Gujarat 380055","Unit Hills Society, Rehnuma Society, Royal Nawab Society, Juhapura","39/40, Haryali Society Rd",Ahmedabad,380055,Gujarat,IN,https://www.google.com/maps/place/Noor+e+Muhammadi+Masjid/data=!4m7!3m6!1s0x395e8537a90aa02f:0xe62e8fcc21b54de8!8m2!3d22.9913843!4d72.5298237!16s%2Fg%2F11csbdqsrf!19sChIJL6AKqTeFXjkR6E21IcyPLuY?authuser=0&hl=en&rclk=1,"22.9913843,72.5298237"
Mosque,Mosque,"Mosque, 380052, Sanklit Nagar, Juhapura, Ahmedabad, Gujarat 380055","Sanklit Nagar, Juhapura",380052,Ahmedabad,380055,Gujarat,IN,https://www.google.com/maps/place/Mosque/data=!4m7!3m6!1s0x395e853046b081ef:0x1d8de12b7d3508b3!8m2!3d22.998631!4d72.5303369!16s%2Fg%2F11f126tgr6!19sChIJ74GwRjCFXjkRswg1fSvhjR0?authuser=0&hl=en&rclk=1,"22.998631,72.5303369"
Masjid-e-Rahmaniya,Mosque,"QJC3+V2R Masjid-e-Rahmaniya, muslim society A, Vejalpur Rd, Mohammadi Society, Godhra, Gujarat 389001",Mohammadi Society,"QJC3+V2R, muslim society A, Vejalpur Rd",Godhra,389001,Gujarat,IN,https://www.google.com/maps/place/Masjid-e-Rahmaniya/data=!4m7!3m6!1s0x39609bb2699cd6f7:0x223217f118461a32!8m2!3d22.7722335!4d73.6025221!16s%2Fg%2F11fx8cjlp6!19sChIJ99acabKbYDkRMhpGGPEXMiI?authuser=0&hl=en&rclk=1,"22.7722335,73.6025221"
"Dayanand Society , near dayare madina masjid",Mosque,"Dayanand Society , near dayare madina masjid, United Apartment Rd, Park Land Society, Royal Nawab Society, Juhapura, Ahmedabad, Gujarat 380055","Park Land Society, Royal Nawab Society, Juhapura",United Apartment Rd,Ahmedabad,380055,Gujarat,IN,"https://www.google.com/maps/place/Dayanand+Society+,+near+dayare+madina+masjid/data=!4m7!3m6!1s0x395e855bae36a749:0x319731c469784b98!8m2!3d22.9924023!4d72.5284379!16s%2Fg%2F11hz00xhc4!19sChIJSac2rluFXjkRmEt4acQxlzE?authuser=0&hl=en&rclk=1","22.9924023,72.5284379"
Masjid Ur Rehman msjid ur rhemaan,Mosque,"2G2G+VQ2 Masjid Ur Rehman msjid ur rhemaan, Vibhavari Society, Juhapura, Ahmedabad, Gujarat 380051","Vibhavari Society, Juhapura",2G2G+VQ2,Ahmedabad,380051,Gujarat,IN,https://www.google.com/maps/place/Masjid+Ur+Rehman+%E0%AA%AE%E0%AA%B8%E0%AB%8D%E0%AA%9C%E0%AA%BF%E0%AA%A6+%E0%AA%89%E0%AA%B0+%E0%AA%B0%E0%AA%B9%E0%AB%87%E0%AA%AE%E0%AA%BE%E0%AA%A8/data=!4m7!3m6!1s0x395e852e7a43faab:0xbd19993c645b5724!8m2!3d23.0021387!4d72.5268865!16s%2Fg%2F11f2wf0nly!19sChIJq_pDei6FXjkRJFdbZDyZGb0?authuser=0&hl=en&rclk=1,"23.0021387,72.5268865"
Unit Hills Sunni Masjid,Mosque,"Unit Hills Sunni Masjid, 15, Prerna Society, 380055, Rehnuma Society, Royal Nawab Society, Juhapura, Ahmedabad, Gujarat 380055","Unit Hills Society, Rehnuma Society, Royal Nawab Society, Juhapura","15, Prerna Society, 380055",Ahmedabad,380055,Gujarat,IN,https://www.google.com/maps/place/Unit+Hills+Sunni+Masjid/data=!4m7!3m6!1s0x395e8596f531aa51:0x8c28e98f9a26e397!8m2!3d22.9927858!4d72.532711!16s%2Fg%2F11ffm7p704!19sChIJUaox9ZaFXjkRl-Mmmo_pKIw?authuser=0&hl=en&rclk=1,"22.9927858,72.53271099999999"
Ayisha Masjid,Mosque,"Ayisha Masjid, Ahmed bag society, Opposite Mansuri hall, Vejalpur, Juhapura, Ahmedabad, Gujarat 380051","Unit Hills Society, Rehnuma Society, Juhapura","Ahmed bag society, Opposite Mansuri hall, Vejalpur",Ahmedabad,380051,Gujarat,IN,https://www.google.com/maps/place/Ayisha+Masjid/data=!4m7!3m6!1s0x395e853279e4d055:0xd278811d9f1b6763!8m2!3d22.9933385!4d72.5292133!16s%2Fg%2F1hc18yqqd!19sChIJVdDkeTKFXjkRY2cbnx2BeNI?authuser=0&hl=en&rclk=1,"22.9933385,72.5292133"
Masjide Salihin,Mosque,"Masjide Salihin, Yash Complex, Saleem Nagar, Juhapura, Ahmedabad, Gujarat 380051","Saleem Nagar, Juhapura",Yash Complex,Ahmedabad,380051,Gujarat,IN,https://www.google.com/maps/place/Masjide+Salihin/data=!4m7!3m6!1s0x395e85398a87a8f5:0x3489206701e8d7a3!8m2!3d23.0011139!4d72.5282942!16s%2Fg%2F11f6krtcxr!19sChIJ9aiHijmFXjkRo9foAWcgiTQ?authuser=0&hl=en&rclk=1,"23.0011139,72.52829419999999"
Jubeda Masjid jubedaa msjid,Mosque,"Jubeda Masjid jubedaa msjid, 11, Fatehwadi, Arshad Park, Juhapura, Ahmedabad, Gujarat 380055","Fatehwadi, Arshad Park, Juhapura",11,Ahmedabad,380055,Gujarat,IN,https://www.google.com/maps/place/Jubeda+Masjid+%E0%AA%9C%E0%AB%81%E0%AA%AC%E0%AB%87%E0%AA%A6%E0%AA%BE+%E0%AA%AE%E0%AA%B8%E0%AB%8D%E0%AA%9C%E0%AA%BF%E0%AA%A6/data=!4m7!3m6!1s0x395e9ab54a6402c3:0xdee10f39e67f8537!8m2!3d22.9862307!4d72.5202722!16s%2Fg%2F11d_8g207z!19sChIJwwJkSrWaXjkRN4V_5jkP4d4?authuser=0&hl=en&rclk=1,"22.9862307,72.5202722"
Mohammdi Masjid,Mosque,"Mohammdi Masjid, G Ward, Sanklit Nagar, Juhapura, Ahmedabad, Gujarat 380055","Sanklit Nagar, Juhapura",G Ward,Ahmedabad,380055,Gujarat,IN,https://www.google.com/maps/place/Mohammdi+Masjid/data=!4m7!3m6!1s0x395e8523a5917a6b:0x3d4e971d11da471b!8m2!3d22.9970603!4d72.5317594!16s%2Fg%2F11h1hwrywg!19sChIJa3qRpSOFXjkRG0faER2XTj0?authuser=0&hl=en&rclk=1,"22.997060299999998,72.5317594"
Masjid E Hajra,Mosque,"XGR4+MR6 Masjid E Hajra, Sarkhej Makarba Rd, Makarba, Ahmedabad, Gujarat 380051",Makarba,"XGR4+MR6, Sarkhej Makarba Rd",Ahmedabad,380051,Gujarat,IN,https://www.google.com/maps/place/Masjid+E+Hajra/data=!4m7!3m6!1s0x395e9ac674f95b7b:0x2fa5e9866f57a3cd!8m2!3d22.9916528!4d72.507008!16s%2Fg%2F11f320hc6w!19sChIJe1v5dMaaXjkRzaNXb4bppS8?authuser=0&hl=en&rclk=1,"22.9916528,72.507008"
Masjid-e-Ronke Islam (naanii msjiid),Mosque,"MHR7+8PJ Masjid-e-Ronke Islam (naanii msjiid), Vejalpur, Gujarat 389340",,MHR7+8PJ,Vejalpur,,Gujarat,IN,https://www.google.com/maps/place/Masjid-e-Ronke+Islam+%28%E0%AA%A8%E0%AA%BE%E0%AA%A8%E0%AB%80+%E0%AA%AE%E0%AA%B8%E0%AB%8D%E0%AA%9C%E0%AB%80%E0%AA%A6%29/data=!4m7!3m6!1s0x396085c507789cb7:0x67b6774036842c96!8m2!3d22.690842!4d73.5642714!16s%2Fg%2F11f731t4hr!19sChIJt5x4B8WFYDkRliyENkB3tmc?authuser=0&hl=en&rclk=1,"22.690842,73.5642714"
Masjid-E-Khaiber,Mosque,"Masjid-E-Khaiber, 18, Sarani Rd, APN Nagar, Saleem Nagar, Juhapura, Ahmedabad, Gujarat 380051","APN Nagar, Saleem Nagar, Juhapura","18, Sarani Rd",Ahmedabad,380051,Gujarat,IN,https://www.google.com/maps/place/Masjid-E-Khaiber/data=!4m7!3m6!1s0x395e85fea8579643:0x87861ac34bcf5765!8m2!3d22.9993627!4d72.5279606!16s%2Fg%2F11gxz_sh4h!19sChIJQ5ZXqP6FXjkRZVfPS8Mahoc?authuser=0&hl=en&rclk=1,"22.9993627,72.5279606"
salma masjid juhapura,Mosque,"XGXJ+3HH salma masjid juhapura, Unnamed Road, Sanklit Nagar, Juhapura, Ahmedabad, Gujarat 380055","Sanklit Nagar, Juhapura","XGXJ+3HH, Unnamed Road",Ahmedabad,380055,Gujarat,IN,https://www.google.com/maps/place/salma+masjid+juhapura/data=!4m7!3m6!1s0x395e851396800cdb:0xab0a079587ea258!8m2!3d22.9976882!4d72.531496!16s%2Fg%2F11fn2s2thw!19sChIJ2wyAlhOFXjkRWKJ-WHmgsAo?authuser=0&hl=en&rclk=1,"22.9976882,72.53149599999999"
Momin Masjid - Sarkhej. momiin msjid,Mosque,"Momin Masjid - Sarkhej. momiin msjid, 14, Makarba, Ahmedabad, Gujarat 380051",Makarba,14,Ahmedabad,380051,Gujarat,IN,https://www.google.com/maps/place/Momin+Masjid+-+Sarkhej.+%E0%AA%AE%E0%AB%8B%E0%AA%AE%E0%AB%80%E0%AA%A8+%E0%AA%AE%E0%AA%B8%E0%AB%8D%E0%AA%9C%E0%AA%BF%E0%AA%A6/data=!4m7!3m6!1s0x395e9ac118e787c5:0x53116e990178fa3e!8m2!3d22.9888202!4d72.501211!16s%2Fg%2F11b_2cm13h!19sChIJxYfnGMGaXjkRPvp4AZluEVM?authuser=0&hl=en&rclk=1,"22.9888202,72.501211"
Noor e rehman Masjid,Mosque,"66, Noor e rehman Masjid, Classic Villa Society, Jannat Ul Naim Society Rd, Aehsan Park, Juhapura, Ahmedabad, Gujarat 380055","Aehsan Park, Juhapura","66, Classic Villa Society, Jannat Ul Naim Society Rd",Ahmedabad,380055,Gujarat,IN,https://www.google.com/maps/place/Noor+e+rehman+Masjid/data=!4m7!3m6!1s0x395e8577c1479a19:0x5c6b2d2b081c3fe8!8m2!3d22.9905611!4d72.5225963!16s%2Fg%2F11p6826qyz!19sChIJGZpHwXeFXjkR6D8cCCsta1w?authuser=0&hl=en&rclk=1,"22.990561099999997,72.5225963"
"Nure mohamadi masjid , Ahle sunnat wal jmat DAWAT E ISLAMI",Mosque,"XGQ5+Q9P Nure mohamadi masjid , Ahle sunnat wal jmat DAWAT E ISLAMI, Makarba, Ahmedabad, Gujarat 380051",Makarba,XGQ5+Q9P,Ahmedabad,380051,Gujarat,IN,"https://www.google.com/maps/place/Nure+mohamadi+masjid+,+Ahle+sunnat+wal+jmat+DAWAT+E+ISLAMI/data=!4m7!3m6!1s0x395e9b06e3dcce6f:0x846542770537d02!8m2!3d22.9894555!4d72.5084681!16s%2Fg%2F11h0b7yxvj!19sChIJb87c4wabXjkRAn1TcCdURgg?authuser=0&hl=en&rclk=1","22.9894555,72.5084681"
MASJID E NOOR,Mosque,"XGXM+CF9 MASJID E NOOR, Masjid E Noor J Word Rd, Sanklit Nagar, Juhapura, Ahmedabad, Gujarat 380055","Sanklit Nagar, Juhapura","XGXM+CF9, Masjid E Noor J Word Rd",Ahmedabad,380055,Gujarat,IN,https://www.google.com/maps/place/MASJID+E+NOOR/data=!4m7!3m6!1s0x395e85430f762823:0xdde5821fdca117f2!8m2!3d22.9985328!4d72.5337238!16s%2Fg%2F11f7710t7_!19sChIJIyh2D0OFXjkR8heh3B-C5d0?authuser=0&hl=en&rclk=1,"22.9985328,72.53372379999999"
Masjid e AbdulWahid. msjid e abdulvaahiid,Mosque,"XGJ8+2P3 Masjid e AbdulWahid. msjid e abdulvaahiid, Unnamed Road, Arshad Park, Juhapura, Ahmedabad, Chaloda, Gujarat 380055","Arshad Park, Juhapura","XGJ8+2P3, Unnamed Road","Ahmedabad, Chaloda",380055,Gujarat,IN,https://www.google.com/maps/place/Masjid+e+AbdulWahid.+%E0%AA%AE%E0%AA%B8%E0%AB%8D%E0%AA%9C%E0%AA%BF%E0%AA%A6+%E0%AA%8F+%E0%AA%85%E0%AA%AC%E0%AB%8D%E0%AA%A6%E0%AB%81%E0%AA%B2%E0%AA%B5%E0%AA%BE%E0%AA%B9%E0%AB%80%E0%AA%A6/data=!4m7!3m6!1s0x395e9b92b8cc02ad:0xbb7ecf6c22849929!8m2!3d22.9800071!4d72.5167994!16s%2Fg%2F11gy254b5m!19sChIJrQLMuJKbXjkRKZmEImzPfrs?authuser=0&hl=en&rclk=1,"22.980007099999998,72.5167994"
Masjid-e-Noor,Mosque,"Masjid-e-Noor, Sohailpark, Fatehwadi, Arshad Park, Juhapura, Ahmedabad, Gujarat 380055","Sohailpark, Fatehwadi, Arshad Park, Juhapura",,Ahmedabad,380055,Gujarat,IN,https://www.google.com/maps/place/Masjid-e-Noor/data=!4m7!3m6!1s0x395e9b87607033d1:0xc8d5a13793249037!8m2!3d22.9891369!4d72.5167115!16s%2Fg%2F11g0jjp7m5!19sChIJ0TNwYIebXjkRN5Akkzeh1cg?authuser=0&hl=en&rclk=1,"22.9891369,72.5167115"
Yusuf Masjid,Mosque,"XGJ8+XWX Yusuf Masjid, Fatehwadi, Arshad Park, Juhapura, Ahmedabad, Gujarat 380055","Fatehwadi, Arshad Park, Juhapura",XGJ8+XWX,Ahmedabad,380055,Gujarat,IN,https://www.google.com/maps/place/Yusuf+Masjid/data=!4m7!3m6!1s0x395e9b0f35d469fd:0x764ca7f2794024c8!8m2!3d22.9824897!4d72.5173492!16s%2Fg%2F11q8573yz1!19sChIJ_WnUNQ-bXjkRyCRAefKnTHY?authuser=0&hl=en&rclk=1,"22.9824897,72.5173492"
Qazi Ali Masjid qDy `ly msjd,Mosque,"Qazi Ali Masjid qDy `ly msjd, 1260, Jadawala Rd, Panchpatti, Dariyapur, Ahmedabad, Gujarat 380001","Panchpatti, Dariyapur","1260, Jadawala Rd",Ahmedabad,380001,Gujarat,IN,https://www.google.com/maps/place/Qazi+Ali+Masjid+%D9%82%D8%A7%D8%B6%DB%8C+%D8%B9%D9%84%DB%8C+%D9%85%D8%B3%D8%AC%D8%AF%E2%80%AD/data=!4m7!3m6!1s0x395e84378209d55b:0xde265905e05f76bf!8m2!3d23.0301277!4d72.5944911!16s%2Fg%2F11g9g_j0hq!19sChIJW9UJgjeEXjkRv3Zf4AVZJt4?authuser=0&hl=en&rclk=1,"23.030127699999998,72.5944911"
Masjid E Tajusshariah,Mosque,"XGJ7+8GG Masjid E Tajusshariah, Fatehwadi, Arshad Park, Juhapura, Ahmedabad, Gujarat 380055","Fatehwadi, Arshad Park, Juhapura",XGJ7+8GG,Ahmedabad,380055,Gujarat,IN,https://www.google.com/maps/place/Masjid+E+Tajusshariah/data=!4m7!3m6!1s0x395e9b142b1f3a65:0x9069d56496a2e663!8m2!3d22.9808129!4d72.5138274!16s%2Fg%2F11srcw2ql5!19sChIJZTofKxSbXjkRY-ailmTVaZA?authuser=0&hl=en&rclk=1,"22.9808129,72.5138274"
Amena Masjid amynh msjd aamenaa msjid,Mosque,"XGV9+59F Amena Masjid amynh msjd aamenaa msjid, Quresh Nagar Society, Juhapura, Ahmedabad, Gujarat 380051","Quresh Nagar Society, Juhapura",XGV9+59F,Ahmedabad,380051,Gujarat,IN,https://www.google.com/maps/place/Amena+Masjid+%D8%A2%D9%85%DB%8C%D9%86%DB%81+%D9%85%D8%B3%D8%AC%D8%AF+%E0%AA%86%E0%AA%AE%E0%AB%87%E0%AA%A8%E0%AA%BE+%E0%AA%AE%E0%AA%B8%E0%AB%8D%E0%AA%9C%E0%AA%BF%E0%AA%A6%E2%80%AD/data=!4m7!3m6!1s0x395e9b9f258264d3:0xc0e1c886ca7d2617!8m2!3d22.9929374!4d72.5184287!16s%2Fg%2F11gtbs1gd8!19sChIJ02SCJZ-bXjkRFyZ9yobI4cA?authuser=0&hl=en&rclk=1,"22.9929374,72.5184287"
Masjid-E-Hawwa,Mosque,"XGJ8+H5W Masjid-E-Hawwa, Fatehwadi, Arshad Park, Juhapura, Ahmedabad, Gujarat 380055","Fatehwadi, Arshad Park, Juhapura",XGJ8+H5W,Ahmedabad,380055,Gujarat,IN,https://www.google.com/maps/place/Masjid-E-Hawwa/data=!4m7!3m6!1s0x395e9ba719df0f6d:0x8e73326e23dde93!8m2!3d22.9814765!4d72.5154421!16s%2Fg%2F11p0ghl01g!19sChIJbQ_fGaebXjkRk9494iYz5wg?authuser=0&hl=en&rclk=1,"22.9814765,72.5154421"
Siddique Masjid,Mosque,"2G2H+4M6 Siddique Masjid, Saleem Nagar, Juhapura, Ahmedabad, Gujarat 380051","Saleem Nagar, Juhapura",2G2H+4M6,Ahmedabad,380051,Gujarat,IN,https://www.google.com/maps/place/Siddique+Masjid/data=!4m7!3m6!1s0x395e8590d52cdf4f:0x9b656b0744038927!8m2!3d23.0002777!4d72.5291503!16s%2Fg%2F11hdr13xx4!19sChIJT98s1ZCFXjkRJ4kDRAdrZZs?authuser=0&hl=en&rclk=1,"23.000277699999998,72.5291503"
SUNNI MASJID,Mosque,"XGJ8+RPR SUNNI MASJID, Fatehwadi, Arshad Park, Juhapura, Ahmedabad, Gujarat 380055","Fatehwadi, Arshad Park, Juhapura",XGJ8+RPR,Ahmedabad,380055,Gujarat,IN,https://www.google.com/maps/place/SUNNI+MASJID/data=!4m7!3m6!1s0x395e9b996f524d8d:0xd157d4666b93e3b2!8m2!3d22.9821163!4d72.516751!16s%2Fg%2F11fm49grjd!19sChIJjU1Sb5mbXjkRsuOTa2bUV9E?authuser=0&hl=en&rclk=1,"22.982116299999998,72.516751"
JUNED MASJID,Mosque,"XGC6+PP8 JUNED MASJID, Chaloda, Sarkhej-Okaf, Gujarat 380055",,XGC6+PP8,"Chaloda, Sarkhej-Okaf",380055,Gujarat,IN,https://www.google.com/maps/place/JUNED+MASJID/data=!4m7!3m6!1s0x395e9bef0122bbf5:0x4125ee37f227fbbc!8m2!3d22.9717876!4d72.5118263!16s%2Fg%2F11pv3mk0nq!19sChIJ9bsiAe-bXjkRvPsn8jfuJUE?authuser=0&hl=en&rclk=1,"22.9717876,72.5118263"
Masjid E Ali,Mosque,"XHRV+V54 Masjid E Ali, Chandola, Shah-E-Alam Roja, Ahmedabad, Gujarat 380028","Chandola, Shah-E-Alam Roja",XHRV+V54,Ahmedabad,380028,Gujarat,IN,https://www.google.com/maps/place/Masjid+E+Ali/data=!4m7!3m6!1s0x395e8550666bc34f:0x4a9c35c1afbbc20b!8m2!3d22.9917104!4d72.5925611!16s%2Fg%2F11rmt2q16v!19sChIJT8NrZlCFXjkRC8K7r8E1nEo?authuser=0&hl=en&rclk=1,"22.9917104,72.5925611"
MASJID E MOOSA,Mosque,"XGMC+C57 MASJID E MOOSA, Fatehwadi, Arshad Park, Juhapura, Ahmedabad, Gujarat 380055","Fatehwadi, Arshad Park, Juhapura",XGMC+C57,Ahmedabad,380055,Gujarat,IN,https://www.google.com/maps/place/MASJID+E+MOOSA/data=!4m7!3m6!1s0x395e9b9bad45e2cb:0x24848ffe119caa57!8m2!3d22.9833433!4d72.5198777!16s%2Fg%2F11smjd_d4h!19sChIJy-JFrZubXjkRV6qcEf6PhCQ?authuser=0&hl=en&rclk=1,"22.983343299999998,72.5198777"
Noor-E-Mohammadi Masjid(Nalsarovar Colony),Mosque,"Noor-E-Mohammadi Masjid(Nalsarovar Colony), Nalsarovar Colony, Sarkhej Rd, opp. Faruke Azam School, Fatehwadi, Juhapura, Ahmedabad, Gujarat 380055","Navrang Society, Fatehwadi, Arshad Park, Juhapura","Nalsarovar Colony, Sarkhej Rd, opp. Faruke Azam School",Ahmedabad,380055,Gujarat,IN,https://www.google.com/maps/place/Noor-E-Mohammadi+Masjid%28Nalsarovar+Colony%29/data=!4m7!3m6!1s0x395e9b0cc9b69f47:0xa85b873f8d5866ca!8m2!3d22.9880323!4d72.5176054!16s%2Fg%2F11h5vtghls!19sChIJR5-2yQybXjkRymZYjT-HW6g?authuser=0&hl=en&rclk=1,"22.9880323,72.5176054"
Masjid E Abdurrahman,Mosque,"XGG7+8W9 Masjid E Abdurrahman, fateh wadi kenal,sarkhez, near humera park, Ahmedabad, Gujarat 380055","Arshad Park, Juhapura","XGG7+8W9, fateh wadi kenal,sarkhez, near humera park","Ahmedabad, Chaloda",380055,Gujarat,IN,https://www.google.com/maps/place/Masjid+E+Abdurrahman/data=!4m7!3m6!1s0x395e9ba5f1386837:0xa82ac6b02616ae86!8m2!3d22.9757776!4d72.5148441!16s%2Fg%2F11gh6j120f!19sChIJN2g48aWbXjkRhq4WJrDGKqg?authuser=0&hl=en&rclk=1,"22.9757776,72.51484409999999"
Nur-e-Islam Ibadatgah,Mosque,"MHV5+7RW Nur-e-Islam Ibadatgah, Vejalpur, Gujarat 389340",,MHV5+7RW,Vejalpur,,Gujarat,IN,https://www.google.com/maps/place/Nur-e-Islam+Ibadatgah/data=!4m7!3m6!1s0x396085913d025947:0xa5dbc3b1e1dc23c2!8m2!3d22.6932383!4d73.5595763!16s%2Fg%2F11fb2wgz9z!19sChIJR1kCPZGFYDkRwiPc4bHD26U?authuser=0&hl=en&rclk=1,"22.693238299999997,73.5595763"
Masjid-E-Aqsha,Mosque,"Masjid-E-Aqsha, Fazle Rabbi Society, Royal Nawab Society, Juhapura, Ahmedabad, Gujarat 380055","Fazle Rabbi Society, Royal Nawab Society, Juhapura",,Ahmedabad,,Gujarat,IN,https://www.google.com/maps/place/Masjid-E-Aqsha/data=!4m7!3m6!1s0x395e8547fe774cc7:0x6d0f8e65e2c0a287!8m2!3d22.9883779!4d72.5320376!16s%2Fg%2F11hzwdpfbx!19sChIJx0x3_keFXjkRh6LA4mWOD20?authuser=0&hl=en&rclk=1,"22.9883779,72.5320376"
Masjid E Tajdar E Khatme Nabuwat,Mosque,"XGC5+3X8 Masjid E Tajdar E Khatme Nabuwat, Sarkhej-Okaf, Gujarat 380055",,XGC5+3X8,Sarkhej-Okaf,,Gujarat,IN,https://www.google.com/maps/place/Masjid+E+Tajdar+E+Khatme+Nabuwat/data=!4m7!3m6!1s0x395e9b5c61fc13b5:0xe4a1e9318797667f!8m2!3d22.9701712!4d72.5099464!16s%2Fg%2F11spdg3y0y!19sChIJtRP8YVybXjkRf2aXhzHpoeQ?authuser=0&hl=en&rclk=1,"22.9701712,72.50994639999999"
Sharifa Masjid shriiphaa msjid,Mosque,"XGXF+9P8 Sharifa Masjid shriiphaa msjid, Keshar Baugh Society, Saleem Nagar, Juhapura, Ahmedabad, Gujarat 380051","Garib Nawaz Society, Saleem Nagar, Juhapura","XGXF+9P8, Keshar Baugh Society",Ahmedabad,380051,Gujarat,IN,https://www.google.com/maps/place/Sharifa+Masjid+%E0%AA%B6%E0%AA%B0%E0%AB%80%E0%AA%AB%E0%AA%BE+%E0%AA%AE%E0%AA%B8%E0%AB%8D%E0%AA%9C%E0%AA%BF%E0%AA%A6/data=!4m7!3m6!1s0x395e853268b67e01:0x19023e71a0f5faec!8m2!3d22.998411!4d72.5243197!16s%2Fg%2F11hd6q5v80!19sChIJAX62aDKFXjkR7Pr1oHE-Ahk?authuser=0&hl=en&rclk=1,"22.998410999999997,72.52431969999999"
Masjid e fajle rabani,Mosque,"Masjid e fajle rabani, 22, Minesh Nagar Society, Quresh Nagar Society, Juhapura, Ahmedabad, Gujarat 380055","Minesh Nagar Society, Quresh Nagar Society, Juhapura",22,Ahmedabad,380055,Gujarat,IN,https://www.google.com/maps/place/Masjid+e+fajle+rabani/data=!4m7!3m6!1s0x395e9beed15ccd1d:0xe09a6c38e0a56e9b!8m2!3d22.9942533!4d72.5201471!16s%2Fg%2F11kyltb28k!19sChIJHc1c0e6bXjkRm26l4DhsmuA?authuser=0&hl=en&rclk=1,"22.9942533,72.5201471"
Al Saiyed Masjid,Mosque,"XGWM+WFQ Al Saiyed Masjid, I-Word Rd, Sanklit Nagar, Juhapura, Ahmedabad, Gujarat 380055","Sanklit Nagar, Juhapura","XGWM+WFQ, I-Word Rd",Ahmedabad,380055,Gujarat,IN,https://www.google.com/maps/place/Al+Saiyed+Masjid/data=!4m7!3m6!1s0x395e85637510335b:0xe38276bc8b40b2e6!8m2!3d22.9973342!4d72.5337193!16s%2Fg%2F11rvh0k4c5!19sChIJWzMQdWOFXjkR5rJAi7x2guM?authuser=0&hl=en&rclk=1,"22.997334199999997,72.5337193"
Masjide rukaiyya,Mosque,"Masjide rukaiyya, Amber tower, Fatehwadi, Arshad Park, Juhapura, Ahmedabad, Gujarat 380055","Fatehwadi, Arshad Park, Juhapura",Amber tower,Ahmedabad,380055,Gujarat,IN,https://www.google.com/maps/place/Masjide+rukaiyya/data=!4m7!3m6!1s0x395e9bb18a840d15:0xe0b8f6b3cd082f92!8m2!3d22.9806279!4d72.5149933!16s%2Fg%2F11rvhv4nn1!19sChIJFQ2EirGbXjkRki8IzbP2uOA?authuser=0&hl=en&rclk=1,"22.980627899999998,72.5149933"
Madina masjid,Mosque,"XGR5+3GX Madina masjid, Makarba, Ahmedabad, Gujarat 380051",Makarba,XGR5+3GX,Ahmedabad,380051,Gujarat,IN,https://www.google.com/maps/place/Madina+masjid/data=!4m7!3m6!1s0x395e9b46f09d3f03:0xd8fa87614e35827f!8m2!3d22.9902303!4d72.5088633!16s%2Fg%2F11k4wks819!19sChIJAz-d8EabXjkRf4I1TmGH-tg?authuser=0&hl=en&rclk=1,"22.9902303,72.5088633"
