name,main_category,address,address_ward,address_street,address_city,address_postal_code,address_state,address_country_code,link,coordinates
Mandi masjid,Mosque,"Mandi masjid, 9/1, New Nagole Main Rd, Laxmi Nagar Colony, Kothapet, Hyderabad, Telangana 500035","Laxmi Nagar Colony, Kothapet","9/1, New Nagole Main Rd",Hyderabad,500035,Telangana,IN,https://www.google.com/maps/place/Mandi+masjid/data=!4m7!3m6!1s0x3bcb98e92d16d799:0x1cce1e3b105936a4!8m2!3d17.3692158!4d78.5377794!16s%2Fg%2F11dzt64ndk!19sChIJmdcWLemYyzsRpDZZEDsezhw?authuser=0&hl=en&rclk=1,"17.3692158,78.53777939999999"
Qutub Shahi Masjid And EID GAH,Mosque,"9H27+M7G Qutub Shahi Masjid And EID GAH, Erukula Nancharamma Nagar, Mansoorabad, Hyderabad, Telangana 500068",Erukula Nancharamma Nagar,9H27+M7G,"Mansoorabad, Hyderabad",500068,Telangana,IN,https://www.google.com/maps/place/Qutub+Shahi+Masjid+And+EID+GAH/data=!4m7!3m6!1s0x3bcb98b262b1f2e9:0x7592942cfe9c7a7a!8m2!3d17.3516778!4d78.5631965!16s%2Fg%2F11bzzp9270!19sChIJ6fKxYrKYyzsRenqc_iyUknU?authuser=0&hl=en&rclk=1,"17.3516778,78.56319649999999"
Jamia Masjid Mandi Mir Alam,Mosque,"9F8H+469 Jamia Masjid Mandi Mir Alam, Mir Alam Mandi Rd, Mir Alam Mandi, Pathar Gatti, Hyderabad, Telangana 500002","Mir Alam Mandi, Pathar Gatti","9F8H+469, Mir Alam Mandi Rd",Hyderabad,500002,Telangana,IN,https://www.google.com/maps/place/Jamia+Masjid+Mandi+Mir+Alam/data=!4m7!3m6!1s0x3bcb9826e21e12f3:0xd46f664e13072b01!8m2!3d17.3652774!4d78.4781034!16s%2Fg%2F1hd_l0hrv!19sChIJ8xIe4iaYyzsRASsHE05mb9Q?authuser=0&hl=en&rclk=1,"17.3652774,78.4781034"
Masjid-E-Kaale Mullah,Mosque,"9CFX+5GR Masjid-E-Kaale Mullah, Karwan Rd, Old Sabzi Mandi, Subji Mandi, Tuljaram Nagar, Hyderabad, Telangana 500006","Old Sabzi Mandi, Subji Mandi, Tuljaram Nagar","9CFX+5GR, Karwan Rd",Hyderabad,500006,Telangana,IN,https://www.google.com/maps/place/Masjid-E-Kaale+Mullah/data=!4m7!3m6!1s0x3bcb97a3da480be3:0x737926fa9055da26!8m2!3d17.3729923!4d78.4487747!16s%2Fg%2F1ptv_z_vg!19sChIJ4wtI2qOXyzsRJtpVkPomeXM?authuser=0&hl=en&rclk=1,"17.3729923,78.4487747"
Masjid - E - Siddamber,Mosque,"9F8H+655 Masjid - E - Siddamber, Mir Alam Mandi Rd, Jegjeevan Nagar, Mir Chowk, Pathar Gatti, Hyderabad, Telangana 500002","Jegjeevan Nagar, Mir Chowk, Pathar Gatti","9F8H+655, Mir Alam Mandi Rd",Hyderabad,500002,Telangana,IN,https://www.google.com/maps/place/Masjid+-+E+-+Siddamber/data=!4m7!3m6!1s0x3bcb98271d131d8f:0xd042cfebcacf544c!8m2!3d17.3655173!4d78.4779775!16s%2Fg%2F1yh4g8s45!19sChIJjx0THSeYyzsRTFTPyuvPQtA?authuser=0&hl=en&rclk=1,"17.3655173,78.4779775"
Masjid E SadarYaar Jung,Mosque,"9F7G+7X7 Masjid E SadarYaar Jung, Gulzar Houz Cir, near House Panjesha, Mir Alam Mandi, Pathar Gatti, Hyderabad, Telangana 500002","Mir Alam Mandi, Pathar Gatti","9F7G+7X7, Gulzar Houz Cir, near House Panjesha",Hyderabad,500002,Telangana,IN,https://www.google.com/maps/place/Masjid+E+SadarYaar+Jung/data=!4m7!3m6!1s0x3bcb9820d26a16ed:0xfd1539fd4a9a5c4f!8m2!3d17.3631597!4d78.4774088!16s%2Fg%2F11f01qp_qf!19sChIJ7RZq0iCYyzsRT1yaSv05Ff0?authuser=0&hl=en&rclk=1,"17.3631597,78.47740879999999"
Masjid e Arzi Baig,Mosque,"9F7J+F4V Masjid e Arzi Baig, Miralam Mandi Rd, Purani Haveli, Pathar Gatti, Hyderabad, Telangana 500002","Purani Haveli, Pathar Gatti","9F7J+F4V, Miralam Mandi Rd",Hyderabad,500002,Telangana,IN,https://www.google.com/maps/place/Masjid+e+Arzi+Baig/data=!4m7!3m6!1s0x3bcb99f94e359265:0x6a8fb6ba25066b30!8m2!3d17.3637283!4d78.4803068!16s%2Fg%2F11s8y1vql9!19sChIJZZI1TvmZyzsRMGsGJbq2j2o?authuser=0&hl=en&rclk=1,"17.3637283,78.4803068"
