name,main_category,address,address_ward,address_street,address_city,address_postal_code,address_state,address_country_code,link,coordinates
MUTHUJAHAN BAHADUR NAWAB JAMIA MASJID,Mosque,"MUTHUJAHAN BAHADUR NAWAB JAMIA MASJID, Old, mosque street, Cheyyar, Tamil Nadu 604607",,"Old, mosque street",Cheyyar,604607,Tamil Nadu,IN,https://www.google.com/maps/place/MUTHUJAHAN+BAHADUR+NAWAB+JAMIA+MASJID/data=!4m7!3m6!1s0x3a52d76fd52e2a53:0x318ab3d8883b0885!8m2!3d12.6581426!4d79.5436056!16s%2Fg%2F1td36ny_!19sChIJUyou1W_XUjoRhQg7iNizijE?authuser=0&hl=en&rclk=1,"12.6581426,79.54360559999999"
Masjid,Mosque,"MG7R+Q2M Masjid, Cheyyar, Tamil Nadu 604407",,MG7R+Q2M,Cheyyar,604407,Tamil Nadu,IN,https://www.google.com/maps/place/Masjid/data=!4m7!3m6!1s0x3a52d763bfe621eb:0x5fa5a1e6ec0d0b32!8m2!3d12.6644638!4d79.540032!16s%2Fg%2F11j8mwmn7p!19sChIJ6yHmv2PXUjoRMgsN7OahpV8?authuser=0&hl=en&rclk=1,"12.6644638,79.540032"
Dharga Cheyyar,Mosque,"MG4V+WG2 Dharga Cheyyar, Chinna St, Cheyyar, Tamil Nadu 604407",,"MG4V+WG2, Chinna St",Cheyyar,604407,Tamil Nadu,IN,https://www.google.com/maps/place/Dharga+Cheyyar/data=!4m7!3m6!1s0x3a52d76e093c4427:0x7492bf1323f4aa0a!8m2!3d12.6572642!4d79.5437622!16s%2Fg%2F11f2gs88b4!19sChIJJ0Q8CW7XUjoRCqr0IxO_knQ?authuser=0&hl=en&rclk=1,"12.6572642,79.5437622"
Masjid Rahamathiya Mosque,Mosque,"MG4X+HRW Masjid Rahamathiya Mosque, Cheyyar, Tamil Nadu 604407",,MG4X+HRW,Cheyyar,604407,Tamil Nadu,IN,https://www.google.com/maps/place/Masjid+Rahamathiya+Mosque/data=!4m7!3m6!1s0x3a52d77aacedeb2d:0x7d554565a0dd9ea9!8m2!3d12.6564805!4d79.5495765!16s%2Fg%2F11f15h5hfr!19sChIJLevtrHrXUjoRqZ7doGVFVX0?authuser=0&hl=en&rclk=1,"12.656480499999999,79.5495765"
Cheyyar Muslim Prayer Ground ( ceyyaarru annnaittu muslim tolllukai tittl),Mosque,"MG3X+RCV Cheyyar Muslim Prayer Ground ( ceyyaarru annnaittu muslim tolllukai tittl), Cheyyar, Tamil Nadu 604407",,MG3X+RCV,Cheyyar,604407,Tamil Nadu,IN,https://www.google.com/maps/place/Cheyyar+Muslim+Prayer+Ground+%28+%E0%AE%9A%E0%AF%86%E0%AE%AF%E0%AF%8D%E0%AE%AF%E0%AE%BE%E0%AE%B1%E0%AF%81+%E0%AE%85%E0%AE%A9%E0%AF%88%E0%AE%A4%E0%AF%8D%E0%AE%A4%E0%AF%81+%E0%AE%AE%E0%AF%81%E0%AE%B8%E0%AF%8D%E0%AE%B2%E0%AE%BF%E0%AE%AE%E0%AF%8D+%E0%AE%A4%E0%AF%8A%E0%AE%B4%E0%AF%81%E0%AE%95%E0%AF%88+%E0%AE%A4%E0%AE%BF%E0%AE%9F%E0%AE%B2%E0%AF%8D%29/data=!4m7!3m6!1s0x3a52d7ad61400f03:0x49c0ca75feabdf92!8m2!3d12.6546144!4d79.5485329!16s%2Fg%2F11h1lvjpdh!19sChIJAw9AYa3XUjoRkt-r_nXKwEk?authuser=0&hl=en&rclk=1,"12.6546144,79.5485329"
New Lababin Sunnath Jamath Masjid,Mosque,"MG6R+37Q New Lababin Sunnath Jamath Masjid, Gandhi Salai, Thiruvatoor, Cheyyar, Tamil Nadu 604407",Thiruvatoor,"MG6R+37Q, Gandhi Salai",Cheyyar,604407,Tamil Nadu,IN,https://www.google.com/maps/place/New+Lababin+Sunnath+Jamath+Masjid/data=!4m7!3m6!1s0x3a52d77469a0bb9b:0x5208938f6989b404!8m2!3d12.6602001!4d79.5407243!16s%2Fg%2F11b7yssjr_!19sChIJm7ugaXTXUjoRBLSJaY-TCFI?authuser=0&hl=en&rclk=1,"12.660200099999999,79.5407243"
Madrasa Suvoodia Arabic College & Masjid Ashraf Ali,Mosque,"MG6Q+PM3 Madrasa Suvoodia Arabic College & Masjid Ashraf Ali, Mohammed Pettai St, Alathur, Cheyyar, Tamil Nadu 604407",Alathur,"MG6Q+PM3, Mohammed Pettai St",Cheyyar,604407,Tamil Nadu,IN,https://www.google.com/maps/place/Madrasa+Suvoodia+Arabic+College+%26+Masjid+Ashraf+Ali/data=!4m7!3m6!1s0x3a52d75d5da71b6b:0x860a270dd3ca63cd!8m2!3d12.6617652!4d79.5391625!16s%2Fg%2F11gmj1pt01!19sChIJaxunXV3XUjoRzWPK0w0nCoY?authuser=0&hl=en&rclk=1,"12.6617652,79.5391625"
Mutur Jahan Nawab Jamiya Masjid,Mosque,"Mutur Jahan Nawab Jamiya Masjid, Varshini's Castle, Cheyyar, Tamil Nadu 604407",,Varshini's Castle,Cheyyar,604407,Tamil Nadu,IN,https://www.google.com/maps/place/Mutur+Jahan+Nawab+Jamiya+Masjid/data=!4m7!3m6!1s0x3a52d7aa49b9848d:0x6f3204f82ddd262f!8m2!3d12.6580836!4d79.544325!16s%2Fg%2F11h5nrn34d!19sChIJjYS5SarXUjoRLybdLfgEMm8?authuser=0&hl=en&rclk=1,"12.6580836,79.544325"
Al Ameen Market masjid,Mosque,"Al Ameen Market masjid, 152/2, Kamaraj Nagar, Cheyyar, Tamil Nadu 604407",Kamaraj Nagar,152/2,Cheyyar,604407,Tamil Nadu,IN,https://www.google.com/maps/place/Al+Ameen+Market+masjid/data=!4m7!3m6!1s0x3a52d7340b5a1757:0xb09429fc48a07910!8m2!3d12.6543539!4d79.5392696!16s%2Fg%2F11v4jzjcxg!19sChIJVxdaCzTXUjoREHmgSPwplLA?authuser=0&hl=en&rclk=1,"12.6543539,79.5392696"
