name,main_category,address,address_ward,address_street,address_city,address_postal_code,address_state,address_country_code,link,coordinates
Masjid Mujeeb Bagh,Mosque,"H74R+R4J Masjid Mujeeb Bagh, Mujeeb Bagh, Jamia Nagar, Okhla, New Delhi, Delhi 110025","Mujeeb Bagh, Jamia Nagar, Okhla",H74R+R4J,New Delhi,110025,Delhi,IN,https://www.google.com/maps/place/Masjid+Mujeeb+Bagh/data=!4m7!3m6!1s0x390ce40bc79e1ce9:0x18ab01f5fdcf10b3!8m2!3d28.5570856!4d77.2902574!16s%2Fg%2F11hbvrlrnj!19sChIJ6RyexwvkDDkRsxDP_fUBqxg?authuser=0&hl=en&rclk=1,"28.557085599999997,77.2902574"
Masjid Alishan `lyshn msjd,Mosque,"H74P+4C2 Masjid Alishan `lyshn msjd, Ajmal Bagh, Noor Nagar Extn I, Noor Nagar, Okhla, New Delhi, Delhi 110025","Ajmal Bagh, Noor Nagar Extn I, Noor Nagar, Okhla",H74P+4C2,New Delhi,110025,Delhi,IN,https://www.google.com/maps/place/Masjid+Alishan+%D8%B9%D8%A7%D9%84%DB%8C%D8%B4%D8%A7%D9%86+%D9%85%D8%B3%D8%AC%D8%AF%E2%80%AD/data=!4m7!3m6!1s0x390ce3f602454533:0xcfc3736868fe546a!8m2!3d28.5552743!4d77.2860168!16s%2Fg%2F1ptvvnp64!19sChIJM0VFAvbjDDkRalT-aGhzw88?authuser=0&hl=en&rclk=1,"28.555274299999997,77.2860168"
bengali masjid,Mosque,"H764+VVX bengali masjid, Captain Gaur Marg, B Block, Sri Niwaspuri, New Delhi, Delhi 110065","B Block, Sri Niwaspuri","H764+VVX, Captain Gaur Marg",New Delhi,110065,Delhi,IN,https://www.google.com/maps/place/bengali+masjid/data=!4m7!3m6!1s0x390ce3b939444715:0x2a65d4354b4231cf!8m2!3d28.5622322!4d77.257234!16s%2Fg%2F11f24v_2cr!19sChIJFUdEObnjDDkRzzFCSzXUZSo?authuser=0&hl=en&rclk=1,"28.5622322,77.257234"
Masjid-e-Anjum,Mosque,"Masjid-e-Anjum, Indira Gandhi Camp Part 2, New Friends Colony, New Delhi, Delhi 110065","Block A, Taimoor Nagar, New Friends Colony","Indira Gandhi Camp Part 2, New Friends Colony",New Delhi,110065,Delhi,IN,https://www.google.com/maps/place/Masjid-e-Anjum/data=!4m7!3m6!1s0x390ce39a2cbe5dad:0x263099a5cc320902!8m2!3d28.573773!4d77.2696933!16s%2Fg%2F11ckkxbn_t!19sChIJrV2-LJrjDDkRAgkyzKWZMCY?authuser=0&hl=en&rclk=1,"28.573773,77.2696933"
Madeena Masjid,Mosque,"Madeena Masjid, Street Number 8, Centre for Management Studies Road, Ghaffar Manzil Colony, Jamia Nagar, Okhla, New Delhi, Delhi 110025","Ghaffar Manzil Colony, Jamia Nagar, Okhla","Street Number 8, Centre for Management Studies Road",New Delhi,110025,Delhi,IN,https://www.google.com/maps/place/Madeena+Masjid/data=!4m7!3m6!1s0x390ce3f43c3f5911:0x8d4cf8bf1ef7fd09!8m2!3d28.5559668!4d77.2825118!16s%2Fg%2F12hlhdp1b!19sChIJEVk_PPTjDDkRCf33Hr_4TI0?authuser=0&hl=en&rclk=1,"28.5559668,77.2825118"
Masjid,Mosque,"H769+P87 Masjid, Block A, Friends Colony East, New Friends Colony, New Delhi, Delhi 110025","Block A, Friends Colony East, New Friends Colony",H769+P87,New Delhi,110025,Delhi,IN,https://www.google.com/maps/place/Masjid/data=!4m7!3m6!1s0x390ce3a3874c1a6d:0x3777b5148e43553a!8m2!3d28.5617917!4d77.2683072!16s%2Fg%2F11grc87l61!19sChIJbRpMh6PjDDkROlVDjhS1dzc?authuser=0&hl=en&rclk=1,"28.561791699999997,77.2683072"
Masjid,Mosque,"H77Q+868 Masjid, Okhla Village, Okhla, New Delhi, Delhi 110025","Okhla Village, Okhla",H77Q+868,New Delhi,110025,Delhi,IN,https://www.google.com/maps/place/Masjid/data=!4m7!3m6!1s0x390ce47512f7aa2b:0x544337a9b9e5d7a2!8m2!3d28.5632814!4d77.2880932!16s%2Fg%2F11gbtpj5td!19sChIJK6r3EnXkDDkRotfluak3Q1Q?authuser=0&hl=en&rclk=1,"28.563281399999997,77.28809319999999"
