name,main_category,address,address_ward,address_street,address_city,address_postal_code,address_state,address_country_code,link,coordinates
Noori Masjid,Mosque,"G542+HH7 Noori Masjid, Noori Nagar, Puranpur, Uttar Pradesh 262122",Noori Nagar,G542+HH7,Puranpur,262122,Uttar Pradesh,IN,https://www.google.com/maps/place/Noori+Masjid/data=!4m7!3m6!1s0x39a1cde44f35278f:0xf8cb3466cfe9e161!8m2!3d28.5064133!4d80.1514317!16s%2Fg%2F11f5v8fblb!19sChIJjyc1T-TNoTkRYeHpz2Y0y_g?authuser=0&hl=en&rclk=1,"28.5064133,80.1514317"
Noori Masjid Dhaka J. Puranpur,Mosque,"Noori Masjid Dhaka J. Puranpur, noori masjid dhaka, Puranpur Khas Rural, Uttar Pradesh 262122",,noori masjid dhaka,Puranpur Khas Rural,262122,Uttar Pradesh,IN,https://www.google.com/maps/place/Noori+Masjid+Dhaka+J.+Puranpur/data=!4m7!3m6!1s0x39a1cd8972d5a533:0x9bacef3ab6671593!8m2!3d28.5054276!4d80.1581507!16s%2Fg%2F11gf1xwkrk!19sChIJM6XVconNoTkRkxVntjrvrJs?authuser=0&hl=en&rclk=1,"28.505427599999997,80.1581507"
Sunni Masjid,Religious destination,"H9C8+JVC Sunni Masjid, Arjunpur Rd, Puranpur, Prem Nagar, Uttar Pradesh 271208",,"H9C8+JVC, Arjunpur Rd","Puranpur, Prem Nagar",271208,Uttar Pradesh,IN,https://www.google.com/maps/place/Sunni+Masjid/data=!4m7!3m6!1s0x39977a8b2a800d25:0x208a20eab9512f15!8m2!3d27.5715531!4d82.3671382!16s%2Fg%2F11f2wcr3g6!19sChIJJQ2AKot6lzkRFS9RueogiiA?authuser=0&hl=en&rclk=1,"27.5715531,82.3671382"
Masjid Puranpur,Mosque,"VX4V+5Q3 Masjid Puranpur, Puranpur Pathkhan, Uttar Pradesh 230001",,VX4V+5Q3,Puranpur Pathkhan,,Uttar Pradesh,IN,https://www.google.com/maps/place/Masjid+Puranpur/data=!4m7!3m6!1s0x399a971dfc8e9bcf:0x8454c3ed8925141f!8m2!3d25.8553789!4d81.9944171!16s%2Fg%2F11rhwg4tgm!19sChIJz5uO_B2XmjkRHxQlie3DVIQ?authuser=0&hl=en&rclk=1,"25.855378899999998,81.99441709999999"
Mecca Masjid near altamas Khan puranpur Patkhan Pratapgarh,Mosque,"VX5P+8J Mecca Masjid near altamas Khan puranpur Patkhan Pratapgarh, Puranpur Pathkhan, Uttar Pradesh 230001",,VX5P+8J,Puranpur Pathkhan,230001,Uttar Pradesh,IN,https://www.google.com/maps/place/Mecca+Masjid+near+altamas+Khan+puranpur+Patkhan+Pratapgarh/data=!4m7!3m6!1s0x399a97d8e0a404ab:0xc4117df7316ea853!8m2!3d25.8584334!4d81.9867172!16s%2Fg%2F11kqy3k_sw!19sChIJqwSk4NiXmjkRU6huMfd9EcQ?authuser=0&hl=en&rclk=1,"25.8584334,81.9867172"
