name,main_category,address,address_ward,address_street,address_city,address_postal_code,address_state,address_country_code,link,coordinates
Jama Masjid Airoli,Mosque,"5X3V+CQW Jama Masjid Airoli, Sector 17, Airoli, Navi Mumbai, Maharashtra 400708","Sector 17, Airoli",5X3V+CQW,Navi Mumbai,400708,Maharashtra,IN,https://www.google.com/maps/place/Jama+Masjid+Airoli/data=!4m7!3m6!1s0x3be7bf52a0c5f735:0xf543e7910cec3b0a!8m2!3d19.1536111!4d72.9944444!16s%2Fg%2F1ygb7n9dm!19sChIJNffFoFK_5zsRCjvsDJHnQ_U?authuser=0&hl=en&rclk=1,"19.1536111,72.99444439999999"
Madarsa Wa Masjid Madinatul Uloom,Mosque,"Madarsa Wa Masjid Madinatul Uloom, No.2093, chinchpada, behind bus stop, Airoli Naka, Airoli, Navi Mumbai, Maharashtra 400708","Airoli Naka, Airoli","No.2093, chinchpada, behind bus stop",Navi Mumbai,400708,Maharashtra,IN,https://www.google.com/maps/place/Madarsa+Wa+Masjid+Madinatul+Uloom/data=!4m7!3m6!1s0x3be7bf4a05b71f3b:0x92e74feba2e03ede!8m2!3d19.1661157!4d73.000233!16s%2Fg%2F12ltw3m8c!19sChIJOx-3BUq_5zsR3j7goutP55I?authuser=0&hl=en&rclk=1,"19.1661157,73.000233"
Sunni Taiba Masjid,Mosque,"5XFX+2FF Sunni Taiba Masjid, Thane - Belapur Rd, Digha Gaon, Sanjay Gandhi Nagar, Dighe, Navi Mumbai, Maharashtra 400708","Digha Gaon, Sanjay Gandhi Nagar, Dighe","5XFX+2FF, Thane - Belapur Rd",Navi Mumbai,400708,Maharashtra,IN,https://www.google.com/maps/place/Sunni+Taiba+Masjid/data=!4m7!3m6!1s0x3be7bf33e6fb0c63:0xd0952e73be97a7fe!8m2!3d19.1725519!4d72.9986824!16s%2Fg%2F1hm52_j3n!19sChIJYwz75jO_5zsR_qeXvnMuldA?authuser=0&hl=en&rclk=1,"19.1725519,72.99868239999999"
Airoli Masjid-E-Aqsa Trust,Mosque,"Airoli Masjid-E-Aqsa Trust, Plot No. 21, Sector 17, Airoli, Navi Mumbai, Maharashtra 400708","Sector 17, Airoli",Plot No. 21,Navi Mumbai,400708,Maharashtra,IN,https://www.google.com/maps/place/Airoli+Masjid-E-Aqsa+Trust/data=!4m7!3m6!1s0x3be7bf52a0ecb619:0x297ad24cb183730!8m2!3d19.1535011!4d72.9941548!16s%2Fg%2F1ptwxcv82!19sChIJGbbsoFK_5zsRMDcYyyStlwI?authuser=0&hl=en&rclk=1,"19.1535011,72.99415479999999"
Lakda Bakhar Masjid/Madrasa,Mosque,"Lakda Bakhar Masjid/Madrasa, 2055, Paushibai R Madhvi Marg, Sector 1, Airoli, Navi Mumbai, Maharashtra 400708","Sector 1, Airoli","2055, Paushibai R Madhvi Marg",Navi Mumbai,400708,Maharashtra,IN,https://www.google.com/maps/place/Lakda+Bakhar+Masjid%2FMadrasa/data=!4m7!3m6!1s0x3be7bf4a069b2ae7:0x348800a839363aac!8m2!3d19.1651667!4d72.9987302!16s%2Fg%2F11c1ph62nj!19sChIJ5yqbBkq_5zsRrDo2OagAiDQ?authuser=0&hl=en&rclk=1,"19.1651667,72.9987302"
Masjid Ahle Hadees Rabale (near it box gali),Mosque,"42W3+W3C Masjid Ahle Hadees Rabale (near it box gali), Parulekar Wadi, Airoli, Navi Mumbai, Maharashtra 400701",Airoli,"42W3+W3C, Parulekar Wadi",Navi Mumbai,400701,Maharashtra,IN,https://www.google.com/maps/place/Masjid+Ahle+Hadees+Rabale+%28near+it+box+gali%29/data=!4m7!3m6!1s0x3be7bfe8346edbf7:0x4ad9c21d681413f!8m2!3d19.1473176!4d73.0026372!16s%2Fg%2F11j23skj9d!19sChIJ99tuNOi_5zsRP0GB1iGcrQQ?authuser=0&hl=en&rclk=1,"19.147317599999997,73.0026372"
Airoli Deeniyat Maktab Classes,Mosque,"Airoli Deeniyat Maktab Classes, AL-4/4, Sector 17, Airoli, Navi Mumbai, Maharashtra 400708","Sector 17, Airoli",AL-4/4,Navi Mumbai,400708,Maharashtra,IN,https://www.google.com/maps/place/Airoli+Deeniyat+Maktab+Classes/data=!4m7!3m6!1s0x3be7bf52a0adeeff:0xcee1f08ca99e22f1!8m2!3d19.1536266!4d72.9944234!16s%2Fg%2F11c60mdfgv!19sChIJ_-6toFK_5zsR8SKeqYzw4c4?authuser=0&hl=en&rclk=1,"19.1536266,72.9944234"
Sadikali shaikh,Mosque,"5282+GJQW Sadikali shaikh, Unnamed Road, Airoli Naka, Airoli, Navi Mumbai, Maharashtra 400708","Airoli Naka, Airoli","5282+GJQW, Unnamed Road",Navi Mumbai,400708,Maharashtra,IN,https://www.google.com/maps/place/Sadikali+shaikh/data=!4m7!3m6!1s0x3be7bf4e47891f51:0xb140b310e602ebe4!8m2!3d19.1662465!4d73.0016303!16s%2Fg%2F11nz3rgkm4!19sChIJUR-JR06_5zsR5OsC5hCzQLE?authuser=0&hl=en&rclk=1,"19.1662465,73.0016303"
