name,main_category,address,address_ward,address_street,address_city,address_postal_code,address_state,address_country_code,link,coordinates
Jama Masjid,Mosque,"Jama Masjid, Old Delhi, Delhi, 110006","Jama Masjid, Old Delhi",,Delhi,110006,Delhi,IN,https://www.google.com/maps/place/Jama+Masjid/data=!4m7!3m6!1s0x390cfd18df89b215:0xdd57369e29bf9d96!8m2!3d28.6506792!4d77.2334421!16zL20vMDR5emo1!19sChIJFbKJ3xj9DDkRlp2_KZ42V90?authuser=0&hl=en&rclk=1,"28.6506792,77.23344209999999"
Zeenat-ul Masjid,Mosque,"J6WV+HXF Zeenat-ul Masjid, Daryaganj, New Delhi, Delhi, 110002",Daryaganj,J6WV+HXF,"New Delhi, Delhi",110002,Delhi,IN,https://www.google.com/maps/place/Zeenat-ul+Masjid/data=!4m7!3m6!1s0x390cfcde5e11d987:0xdf29372369063d5f!8m2!3d28.6464447!4d77.2449347!16s%2Fg%2F1vrq80b4!19sChIJh9kRXt78DDkRXz0GaSM3Kd8?authuser=0&hl=en&rclk=1,"28.6464447,77.2449347"
Ameena Masjid,Mosque,"P6GF+QVV Ameena Masjid, Street Number 9, Wazirabad, New Delhi, Delhi, 110084",Wazirabad,"P6GF+QVV, Street Number 9","New Delhi, Delhi",110084,Delhi,IN,https://www.google.com/maps/place/Ameena+Masjid/data=!4m7!3m6!1s0x390cfe71e0a0fe59:0xe969b1d6808dedb8!8m2!3d28.726981!4d77.2246807!16s%2Fg%2F12hk7n_mh!19sChIJWf6g4HH-DDkRuO2NgNaxaek?authuser=0&hl=en&rclk=1,"28.726981,77.2246807"
Eros Masjid,Mosque,"First Floor, Eros Masjid, Eros International Tower, Block G 6, Nehru Place, New Delhi, Delhi 110048","Block G 6, Nehru Place","First Floor, Eros International Tower",New Delhi,110048,Delhi,IN,https://www.google.com/maps/place/Eros+Masjid/data=!4m7!3m6!1s0x390ce3cf8773d169:0x178e9df5127cab65!8m2!3d28.548713!4d77.251941!16s%2Fg%2F11dxkfsf0q!19sChIJadFzh8_jDDkRZat8EvWdjhc?authuser=0&hl=en&rclk=1,"28.548713,77.251941"
Pankhe Wali Masjid,Mosque,"G56H+VFR Pankhe Wali Masjid, Ghosiya Colony, Aam Bagh, Ladha Sarai Village, Mehrauli, New Delhi, Delhi 110030","Ghosiya Colony, Aam Bagh, Ladha Sarai Village, Mehrauli",G56H+VFR,New Delhi,110030,Delhi,IN,https://www.google.com/maps/place/Pankhe+Wali+Masjid/data=!4m7!3m6!1s0x390d1e1142575655:0x837a6fa4c0a978b4!8m2!3d28.5122378!4d77.1786342!16s%2Fg%2F1tjbqk4t!19sChIJVVZXQhEeDTkRtHipwKRveoM?authuser=0&hl=en&rclk=1,"28.512237799999998,77.17863419999999"
"BADI MASJID, RAKAB GANJ",Mosque,"BADI MASJID, RAKAB GANJ, Partap Gali, NEAR, Asaf Ali Rd, Rakab Ganj, New Delhi, Delhi","Bazar Chitli Qabar, Rakab Ganj, Katra Chobey Lal, Chandni Chowk","Partap Gali, NEAR, Asaf Ali Rd","New Delhi, Delhi",,Delhi,IN,"https://www.google.com/maps/place/BADI+MASJID,+RAKAB+GANJ/data=!4m7!3m6!1s0x390cfd26ab7e79ed:0x8000b54be94e3210!8m2!3d28.6420932!4d77.2351127!16s%2Fg%2F11f3rgtgrc!19sChIJ7Xl-qyb9DDkREDJO6Uu1AIA?authuser=0&hl=en&rclk=1","28.642093199999998,77.2351127"
Masjid Hanfia,Mosque,"M62C+CGX Masjid Hanfia, Shah Ganj, Chandni Chowk, New Delhi, Delhi 110006","Shah Ganj, Chandni Chowk","M62C+CGX, Shah Ganj, Chandni Chowk","New Delhi, Delhi",110006,Delhi,IN,https://www.google.com/maps/place/Masjid+Hanfia/data=!4m7!3m6!1s0x390cfd1469a3305f:0x213f98caa9a89533!8m2!3d28.6511199!4d77.22137!16s%2Fg%2F11gf8gfs_2!19sChIJXzCjaRT9DDkRM5WoqcqYPyE?authuser=0&hl=en&rclk=1,"28.651119899999998,77.22137"
Qadri Masjid,Mosque,"Qadri Masjid, S5, Rajguru Marg, Bazar Sangatrashan, Chuna Mandi, Paharganj, New Delhi, Delhi 110055","Bazar Sangatrashan, Chuna Mandi, Paharganj","S5, Rajguru Marg",New Delhi,110055,Delhi,IN,https://www.google.com/maps/place/Qadri+Masjid/data=!4m7!3m6!1s0x390cfd420fb3ca0d:0x28d6c96c8abe5bf9!8m2!3d28.6450949!4d77.2107914!16s%2Fg%2F11j00853cl!19sChIJDcqzD0L9DDkR-Vu-imzJ1ig?authuser=0&hl=en&rclk=1,"28.6450949,77.21079139999999"
