name,main_category,address,address_ward,address_street,address_city,address_postal_code,address_state,address_country_code,link,coordinates
Makkah Masjid,Mosque,"C9JR+96H Makkah Masjid, Mayapuri, Lal Bangla, Jajmau, Kda, Kanpur, Uttar Pradesh 208010","Mayapuri, Lal Bangla, Jajmau",C9JR+96H,"Kda, Kanpur",208010,Uttar Pradesh,IN,https://www.google.com/maps/place/Makkah+Masjid/data=!4m7!3m6!1s0x399c40e0d7abd1bb:0x6ab0423f14a60777!8m2!3d26.43094!4d80.3906121!16s%2Fg%2F1ts3d0db!19sChIJu9Gr1-BAnDkRdwemFD9CsGo?authuser=0&hl=en&rclk=1,"26.43094,80.3906121"
Hari Masjid,Place of worship,"C7PV+4FG Hari Masjid, 3 Hari Masjid, Barra 6, Barra World Bank, Barra, Kanpur, Uttar Pradesh 208027","Barra 6, Barra World Bank, Barra","C7PV+4FG, 3 Hari Masjid",Kanpur,208027,Uttar Pradesh,IN,https://www.google.com/maps/place/Hari+Masjid/data=!4m7!3m6!1s0x399c47c426404227:0x32fef1e953eb7d4!8m2!3d26.435172!4d80.2917663!16s%2Fg%2F1q69lcz39!19sChIJJ0JAJsRHnDkR1Lc-lR7vLwM?authuser=0&hl=en&rclk=1,"26.435171999999998,80.29176629999999"
Jama Masjid - jm`h msjd,Mosque,"F7GG+84M Jama Masjid - jm`h msjd, Maswanpur Rd, Dwivedi Nagar, Sayyed Nagar, Rawatpur Gaon, Kanpur, Uttar Pradesh 208019","Dwivedi Nagar, Sayyed Nagar, Rawatpur Gaon","F7GG+84M, Maswanpur Rd",Kanpur,208019,Uttar Pradesh,IN,https://www.google.com/maps/place/Jama+Masjid+-+%D8%AC%D9%85%D8%B9%DB%81+%D9%85%D8%B3%D8%AC%D8%AF%E2%80%AD/data=!4m7!3m6!1s0x399c37f8221dd18d:0xd4545a0950dbdcad!8m2!3d26.4758449!4d80.2752872!16s%2Fg%2F1q6j42xrq!19sChIJjdEdIvg3nDkRrdzbUAlaVNQ?authuser=0&hl=en&rclk=1,"26.4758449,80.2752872"
Shafia Baad Masjid - shfy b`d msjd,Mosque,"F88M+XQ9 Shafia Baad Masjid - shfy b`d msjd, Chaman Ganj, Colonelganj, Kanpur, Uttar Pradesh 208001","Chaman Ganj, Colonelganj",F88M+XQ9,Kanpur,208001,Uttar Pradesh,IN,https://www.google.com/maps/place/Shafia+Baad+Masjid+-+%D8%B4%D9%81%D9%8A%D8%A7+%D8%A8%D8%B9%D8%AF+%D9%85%D8%B3%D8%AC%D8%AF%E2%80%AD/data=!4m7!3m6!1s0x399c389d7a873e35:0x538586b1695403d!8m2!3d26.4674145!4d80.3344828!16s%2Fg%2F1260ss95q!19sChIJNT6Hep04nDkRPUCVFmtYOAU?authuser=0&hl=en&rclk=1,"26.4674145,80.33448279999999"
Ek Minari Masjid Sunni Barelvi Masjid,Mosque,"Ek Minari Masjid Sunni Barelvi Masjid, 117/188, P Block, Navin Nagar, Kakadeo, Kanpur, Uttar Pradesh 208025","P Block, Navin Nagar, Kakadeo",117/188,Kanpur,208025,Uttar Pradesh,IN,https://www.google.com/maps/place/Ek+Minari+Masjid+Sunni+Barelvi+Masjid/data=!4m7!3m6!1s0x399c381a5a5ae45d:0x24108bfce4e27261!8m2!3d26.4803492!4d80.285911!16s%2Fg%2F11dymfywpj!19sChIJXeRaWho4nDkRYXLi5PyLECQ?authuser=0&hl=en&rclk=1,"26.4803492,80.285911"
Bagiya Masjid,Mosque,"Bagiya Masjid, 90/99, Ahmad Bilal Yousaf Ave, Pech Bagh, Iftikharabad, Mulganj, Kanpur, Uttar Pradesh 208001","Pech Bagh, Iftikharabad, Mulganj","90/99, Ahmad Bilal Yousaf Ave",Kanpur,208001,Uttar Pradesh,IN,https://www.google.com/maps/place/Bagiya+Masjid/data=!4m7!3m6!1s0x399c47609621e99d:0x9aa9eb8c45538eb2!8m2!3d26.4650205!4d80.3424573!16s%2Fg%2F11bzywprc7!19sChIJnekhlmBHnDkRso5TRYzrqZo?authuser=0&hl=en&rclk=1,"26.465020499999998,80.34245729999999"
Gaushiya Masjid,Mosque,"F7JH+MW7 Gaushiya Masjid, Roshan Nagar, Rajivpuram, Rawatpur Gaon, Kanpur, Uttar Pradesh 208024","Roshan Nagar, Rajivpuram, Rawatpur Gaon",F7JH+MW7,Kanpur,208024,Uttar Pradesh,IN,https://www.google.com/maps/place/Gaushiya+Masjid/data=!4m7!3m6!1s0x399c381c49555555:0x92ae05480fc850e1!8m2!3d26.481654!4d80.2798107!16s%2Fg%2F11bv1bz9pk!19sChIJVVVVSRw4nDkR4VDID0gFrpI?authuser=0&hl=en&rclk=1,"26.481654,80.2798107"
Jama Masjid Nawabganj,Mosque,"F8W7+F3J Jama Masjid Nawabganj, Nawabganj, Kanpur, Uttar Pradesh 208002",Nawabganj,F8W7+F3J,Kanpur,208002,Uttar Pradesh,IN,https://www.google.com/maps/place/Jama+Masjid+Nawabganj/data=!4m7!3m6!1s0x399c385c82753579:0xe69f3efbf97ca61!8m2!3d26.4962138!4d80.312649!16s%2Fg%2F1hhjsm1sk!19sChIJeTV1glw4nDkRYcqXv-_zaQ4?authuser=0&hl=en&rclk=1,"26.4962138,80.312649"
Garib Nawaz Masjid - msjd gryn nwz,Mosque,"F7HV+365 Garib Nawaz Masjid - msjd gryn nwz, Kakadav Road, Ambedkar Nagar, Navin Nagar, Kakadeo, Kanpur, Uttar Pradesh 208025","Ambedkar Nagar, Navin Nagar, Kakadeo","F7HV+365, Kakadav Road",Kanpur,208025,Uttar Pradesh,IN,https://www.google.com/maps/place/Garib+Nawaz+Masjid+-+%D9%85%D8%B3%D8%AC%D8%AF+%DA%AF%D8%B1%DB%8C%D9%86+%D9%86%D9%88%D8%A7%D8%B2%E2%80%AD/data=!4m7!3m6!1s0x399c3811e2825f29:0xacc5f690edd81c2d!8m2!3d26.4776276!4d80.2931077!16s%2Fg%2F11gh35f0fh!19sChIJKV-C4hE4nDkRLRzY7ZD2xaw?authuser=0&hl=en&rclk=1,"26.477627599999998,80.2931077"
Masjid Old Kanpur - msjd wldd khnpwr,Mosque,"Masjid Old Kanpur - msjd wldd khnpwr, 5/409, Purana Kanpur, Kanpur, Uttar Pradesh 208002",Purana Kanpur,5/409,Kanpur,208002,Uttar Pradesh,IN,https://www.google.com/maps/place/Masjid+Old+Kanpur+-+%D9%85%D8%B3%D8%AC%D8%AF+%D8%A7%D9%88%D9%84%DA%88+%DA%A9%D8%A7%D9%86%D9%BE%D9%88%D8%B1%E2%80%AD/data=!4m7!3m6!1s0x399c3859111aaa45:0xc5c2cd0fa1a0c3e6!8m2!3d26.4986072!4d80.3175912!16s%2Fg%2F11ddxxj4x9!19sChIJRaoaEVk4nDkR5sOgoQ_NwsU?authuser=0&hl=en&rclk=1,"26.4986072,80.3175912"
Shahi masjid,Mosque,"Shahi masjid, 116/421, Post office Rd, Rawatpur Gaon, Kanpur, Uttar Pradesh 208019",Rawatpur Gaon,"116/421, Post office Rd",Kanpur,208019,Uttar Pradesh,IN,https://www.google.com/maps/place/Shahi+masjid/data=!4m7!3m6!1s0x399c39488f5e7419:0x5cadbde04949aca1!8m2!3d26.4745265!4d80.2783649!16s%2Fg%2F11h7fmbm5x!19sChIJGXRej0g5nDkRoaxJSeC9rVw?authuser=0&hl=en&rclk=1,"26.4745265,80.2783649"
Masjid Tahsildar,Mosque,"Masjid Tahsildar, 80/89, Latouche Rd, Mulganj, Kanpur, Uttar Pradesh 208001",Mulganj,"80/89, Latouche Rd",Kanpur,208001,Uttar Pradesh,IN,https://www.google.com/maps/place/Masjid+Tahsildar/data=!4m7!3m6!1s0x399c475e09777575:0xc9f3a921d44c055d!8m2!3d26.4628607!4d80.3431624!16s%2Fg%2F11cs9vwl9r!19sChIJdXV3CV5HnDkRXQVM1CGp88k?authuser=0&hl=en&rclk=1,"26.4628607,80.3431624"
Choti Masjid,Mosque,"Choti Masjid, 12/160, Victoria Ave, Gwai, Gwaltoli, Khalasi Line, Permat, Kanpur, Uttar Pradesh 208001","Gwai, Gwaltoli, Khalasi Line, Permat","12/160, Victoria Ave",Kanpur,208001,Uttar Pradesh,IN,https://www.google.com/maps/place/Choti+Masjid/data=!4m7!3m6!1s0x399c3891f940e493:0x817542ed35db794b!8m2!3d26.4856774!4d80.3328725!16s%2Fg%2F11f08v5dwx!19sChIJk-RA-ZE4nDkRS3nbNe1CdYE?authuser=0&hl=en&rclk=1,"26.4856774,80.3328725"
NOORI MASJID,Mosque,"F7C5+RWG NOORI MASJID, Syed Mohammed Raza Rd, Colonelganj, Kanpur, Uttar Pradesh 208009",Colonelganj,"F7C5+RWG, Syed Mohammed Raza Rd",Kanpur,208009,Uttar Pradesh,IN,https://www.google.com/maps/place/NOORI+MASJID/data=!4m7!3m6!1s0x399c37e6804f1e55:0x99dc22cf42ccc469!8m2!3d26.4720664!4d80.2598187!16s%2Fg%2F11g9gpbn7z!19sChIJVR5PgOY3nDkRacTMQs8i3Jk?authuser=0&hl=en&rclk=1,"26.4720664,80.2598187"
Madina masjid,Mosque,"F68M+M99 Madina masjid, Panki Katra Hanuman Mandir Rd, Panki, Kanpur, Uttar Pradesh 208020",Panki,"F68M+M99, Panki Katra Hanuman Mandir Rd",Kanpur,208020,Uttar Pradesh,IN,https://www.google.com/maps/place/Madina+masjid/data=!4m7!3m6!1s0x399c37b39fa7ced9:0xdb0bf1ad9e85525b!8m2!3d26.466662!4d80.2334694!16s%2Fg%2F11j4xsq0yj!19sChIJ2c6nn7M3nDkRW1KFnq3xC9s?authuser=0&hl=en&rclk=1,"26.466662,80.23346939999999"
Masjid Vijay Nagar,Mosque,"Masjid Vijay Nagar, Vijay Nagar, Shastri Nagar, Kanpur, Uttar Pradesh 208005","Vijay Nagar, Shastri Nagar",,Kanpur,208005,Uttar Pradesh,IN,https://www.google.com/maps/place/Masjid+Vijay+Nagar/data=!4m7!3m6!1s0x399c470e8a0540e9:0x97e4e6c1c36ffc9d!8m2!3d26.4650625!4d80.2913125!16s%2Fg%2F11v0bzwdph!19sChIJ6UAFig5HnDkRnfxvw8Hm5Jc?authuser=0&hl=en&rclk=1,"26.4650625,80.29131249999999"
Bilal Masjid,Mosque,"Bilal Masjid, 275, P Block, Tulsi Nagar, Navin Nagar, Kakadeo, Kanpur, Uttar Pradesh 208025","P Block, Tulsi Nagar, Navin Nagar, Kakadeo",275,Kanpur,208025,Uttar Pradesh,IN,https://www.google.com/maps/place/Bilal+Masjid/data=!4m7!3m6!1s0x399c39fcb3954c55:0x277357e6d8fc4e8a!8m2!3d26.4793793!4d80.2887692!16s%2Fg%2F11v3w6wz5j!19sChIJVUyVs_w5nDkRik782OZXcyc?authuser=0&hl=en&rclk=1,"26.479379299999998,80.28876919999999"
Shia jama masjid patkapur,Mosque,"Shia jama masjid patkapur, Kursawan, Downtown, Kanpur, Uttar Pradesh 208001","Kursawan, Downtown",,Kanpur,208001,Uttar Pradesh,IN,https://www.google.com/maps/place/Shia+jama+masjid+patkapur/data=!4m7!3m6!1s0x399c4704a3b7a2fb:0x3a8a0b375e8f433e!8m2!3d26.4688535!4d80.3576047!16s%2Fg%2F11q8t7sy5k!19sChIJ-6K3owRHnDkRPkOPXjcLijo?authuser=0&hl=en&rclk=1,"26.468853499999998,80.3576047"
Masjid,Mosque,"F75R+8QJ Masjid, Fazalganj, Shastri Nagar, Kanpur, Uttar Pradesh 208022","Fazalganj, Shastri Nagar",F75R+8QJ,Kanpur,,Uttar Pradesh,IN,https://www.google.com/maps/place/Masjid/data=!4m7!3m6!1s0x399c47ed6bea6c1f:0x583fbd045c825a36!8m2!3d26.4583346!4d80.291904!16s%2Fg%2F11v0nqz7dd!19sChIJH2zqa-1HnDkRNlqCXAS9P1g?authuser=0&hl=en&rclk=1,"26.458334599999997,80.291904"
Madinah Masjid,Mosque,"C9MR+CV9 Madinah Masjid, Westgate, J K Puri, Kanpur, Uttar Pradesh 208010","Westgate, J K Puri",C9MR+CV9,Kanpur,208010,Uttar Pradesh,IN,https://www.google.com/maps/place/Madinah+Masjid/data=!4m7!3m6!1s0x399c41d0504756dd:0xb247a4cc041f386f!8m2!3d26.4335302!4d80.3922643!16s%2Fg%2F11l6tgzgg9!19sChIJ3VZHUNBBnDkRbzgfBMykR7I?authuser=0&hl=en&rclk=1,"26.4335302,80.3922643"
