name,main_category,address,address_ward,address_street,address_city,address_postal_code,address_state,address_country_code,link,coordinates
"Masjid,Bagh Nawab Kallan - msjd bG nwb khlN",Mosque,"Masjid,Bagh Nawab Kallan - msjd bG nwb khlN, Government hostel, 243, Mirza Ismail Rd, Chauraha, Jaipur, Rajasthan 302001",Chauraha,"Government hostel, 243, Mirza Ismail Rd",Jaipur,302001,Rajasthan,IN,"https://www.google.com/maps/place/Masjid,Bagh+Nawab+Kallan+-+%D9%85%D8%B3%D8%AC%D8%AF+%D8%A8%D8%A7%D8%BA+%D9%86%D9%88%D8%A7%D8%A8+%DA%A9%D9%84%D8%A7%DA%BA%E2%80%AD/data=!4m7!3m6!1s0x396db40764264b0b:0x12e81378d2bfaed0!8m2!3d26.9170283!4d75.8051891!16s%2Fg%2F11f400d20t!19sChIJC0smZAe0bTkR0K6_0ngT6BI?authuser=0&hl=en&rclk=1","26.9170283,75.80518909999999"
Masjid Zaibunnisa,Mosque,"WRHV+G4P Masjid Zaibunnisa, Mohalla Dakotan, Bas Badanpura, Jaipur, Rajasthan 302002",Bas Badanpura,"WRHV+G4P, Mohalla Dakotan",Jaipur,302002,Rajasthan,IN,https://www.google.com/maps/place/Masjid+Zaibunnisa/data=!4m7!3m6!1s0x396db12de439cc7f:0x715080800de0b5c1!8m2!3d26.9288396!4d75.8428142!16s%2Fg%2F11cs0ff1j5!19sChIJf8w55C2xbTkRwbXgDYCAUHE?authuser=0&hl=en&rclk=1,"26.9288396,75.84281419999999"
Shia Jama Masjid Ahle Sadar,Mosque,"Shia Jama Masjid Ahle Sadar, New, Amer Rd, near Doodh Mandi, Subhash Chowk, Pink City, Jaipur, Rajasthan 302002","Subhash Chowk, Pink City","New, Amer Rd, near Doodh Mandi",Jaipur,302002,Rajasthan,IN,https://www.google.com/maps/place/Shia+Jama+Masjid+Ahle+Sadar/data=!4m7!3m6!1s0x396db1366cdae4c5:0xefb5ba8e7ad3700f!8m2!3d26.9307109!4d75.8328481!16s%2Fg%2F11bzt6jbwd!19sChIJxeTabDaxbTkRD3DTeo66te8?authuser=0&hl=en&rclk=1,"26.930710899999998,75.83284809999999"
Jama Masjid - jm` msjd,Mosque,"WRCG+MFF Jama Masjid - jm` msjd, Johari Bazar Rd, Tripolia Bazar, Biseswarji, Jaipur, Rajasthan 302002","Tripolia Bazar, Biseswarji","WRCG+MFF, Johari Bazar Rd",Jaipur,302002,Rajasthan,IN,https://www.google.com/maps/place/Jama+Masjid+-+%D8%AC%D8%A7%D9%85%D8%B9+%D9%85%D8%B3%D8%AC%D8%AF%E2%80%AD/data=!4m7!3m6!1s0x396db6b4cc63986d:0xedf7fe99b654d904!8m2!3d26.9216973!4d75.8261814!16s%2Fg%2F1pp2vf4xl!19sChIJbZhjzLS2bTkRBNlUtpn-9-0?authuser=0&hl=en&rclk=1,"26.921697299999998,75.8261814"
Noorani Masjid,Mosque,"Noorani Masjid, Bharu Marg, Nandpuri Colony, Jagatpura, Jaipur, Rajasthan 302017","Nandpuri Colony, Jagatpura",Bharu Marg,Jaipur,302017,Rajasthan,IN,https://www.google.com/maps/place/Noorani+Masjid/data=!4m7!3m6!1s0x396db60fcd428c23:0x7538f8b802fbdd02!8m2!3d26.8432633!4d75.8177598!16s%2Fg%2F1pp2vcvf2!19sChIJI4xCzQ-2bTkRAt37Arj4OHU?authuser=0&hl=en&rclk=1,"26.8432633,75.81775979999999"
Mansarover Mosque,Mosque,"VQ95+G7R Mansarover Mosque, Mansarovar Sector 3, Mansarovar, Jaipur, Rajasthan 302020","Mansarovar Sector 3, Mansarovar",VQ95+G7R,Jaipur,302020,Rajasthan,IN,https://www.google.com/maps/place/Mansarover+Mosque/data=!4m7!3m6!1s0x396db50029a16e17:0x6af535c1c6efa50!8m2!3d26.868867!4d75.7581384!16s%2Fg%2F11g_1plt1!19sChIJF26hKQC1bTkRUPpuHFxTrwY?authuser=0&hl=en&rclk=1,"26.868866999999998,75.75813839999999"
Noorani Masjid,Mosque,"Noorani Masjid, 60 fit road sanjay nager b, Kalwar Rd, Jaipur, Rajasthan","Laxmi Nagar III, Jagannath Puri, Suraj Nagar, Jhotwara","60 fit road sanjay nager b, Kalwar Rd",Jaipur,,Rajasthan,IN,https://www.google.com/maps/place/Noorani+Masjid/data=!4m7!3m6!1s0x396db310ab658f6f:0x2f3327adb4d808de!8m2!3d26.9476434!4d75.7429547!16s%2Fg%2F1hc6311c7!19sChIJb49lqxCzbTkR3gjYtK0nMy8?authuser=0&hl=en&rclk=1,"26.9476434,75.7429547"
Qidwai Nagar Mosque,Mosque,"Qidwai Nagar Mosque, 53, JP Phatak Under Pass Rd, Chitragupta Nagar-II, Kidwai Nagar, Tonk Phatak, Jaipur, Rajasthan 302015","Chitragupta Nagar-II, Kidwai Nagar, Tonk Phatak","53, JP Phatak Under Pass Rd",Jaipur,302015,Rajasthan,IN,https://www.google.com/maps/place/Qidwai+Nagar+Mosque/data=!4m7!3m6!1s0x396db43ae54360eb:0x9ed402ce8cc2f55c!8m2!3d26.8861982!4d75.7932163!16s%2Fg%2F1tf00wq1!19sChIJ62BD5Tq0bTkRXPXCjM4C1J4?authuser=0&hl=en&rclk=1,"26.8861982,75.7932163"
Kagzi Jama Masjid,Mosque,"Kagzi Jama Masjid, 4, Kagzi Colony, Sanganer, Jaipur, Rajasthan 302029","Kagzi Colony, Sanganer",4,Jaipur,302029,Rajasthan,IN,https://www.google.com/maps/place/Kagzi+Jama+Masjid/data=!4m7!3m6!1s0x396dca12e2e8ea5d:0x2422b680e5cab91c!8m2!3d26.8112278!4d75.7856571!16s%2Fg%2F11btxcst45!19sChIJXero4hLKbTkRHLnK5YC2IiQ?authuser=0&hl=en&rclk=1,"26.811227799999998,75.7856571"
Spoton logistics Pvt Ltd,Mosque,"Spoton logistics Pvt Ltd, Jalupura Main Rd, Jalupura, Jaipur, Rajasthan 302001",Jalupura,Jalupura Main Rd,Jaipur,302001,Rajasthan,IN,https://www.google.com/maps/place/Spoton+logistics+Pvt+Ltd/data=!4m7!3m6!1s0x396db155815a9661:0x4179b11599c07f43!8m2!3d26.9229037!4d75.807309!16s%2Fg%2F1ydpv9xlb!19sChIJYZZagVWxbTkRQ3_AmRWxeUE?authuser=0&hl=en&rclk=1,"26.9229037,75.807309"
Madina Masjid,Mosque,"Madina Masjid, Madina masid, 231, madina nagar, Jhotwara, Jaipur, Rajasthan 302012","Maelinu Nagar, Jagannath Puri, madina nagar, Jhotwara","Madina masid, 231",Jaipur,302012,Rajasthan,IN,https://www.google.com/maps/place/Madina+Masjid/data=!4m7!3m6!1s0x396db30fe927c5b9:0x9e147c4a6f428cbf!8m2!3d26.9475695!4d75.7496942!16s%2Fg%2F1hc3jvrjz!19sChIJucUn6Q-zbTkRv4xCb0p8FJ4?authuser=0&hl=en&rclk=1,"26.9475695,75.7496942"
Raiyan Masjid - ry'yN msjd,Mosque,"WQ4V+7R2 Raiyan Masjid - ry'yN msjd, C Scheme, Ashok Nagar, Jaipur, Rajasthan 302001","C Scheme, Ashok Nagar",WQ4V+7R2,Jaipur,302001,Rajasthan,IN,https://www.google.com/maps/place/Raiyan+Masjid+-+%D8%B1%D8%A7%D8%A6%DB%8C%D8%A7%DA%BA+%D9%85%D8%B3%D8%AC%D8%AF%E2%80%AD/data=!4m7!3m6!1s0x396db4106cc9e5a3:0x6c37f783453cf596!8m2!3d26.9056401!4d75.7945128!16s%2Fg%2F1hjhdqwj4!19sChIJo-XJbBC0bTkRlvU8RYP3N2w?authuser=0&hl=en&rclk=1,"26.9056401,75.79451279999999"
Sushilpura Mosque,Mosque,"VQX7+HQC Sushilpura Mosque, Sodala, Jaipur, Rajasthan 302006",Sushilpura,"VQX7+HQC, Sodala",Jaipur,302006,Rajasthan,IN,https://www.google.com/maps/place/Sushilpura+Mosque/data=!4m7!3m6!1s0x396db463c4cbfb93:0xf93e675f85d4f4cd!8m2!3d26.8989352!4d75.7643948!16s%2Fg%2F1tc_2hg_!19sChIJk_vLxGO0bTkRzfTUhV9nPvk?authuser=0&hl=en&rclk=1,"26.8989352,75.76439479999999"
Masjid e Aqsa,Mosque,"Masjid e Aqsa, 35/327, Sector 35, Sanganer, Bambala, Jaipur, Rajasthan 302022","Sector 35, Sanganer, Bambala",35/327,Jaipur,302022,Rajasthan,IN,https://www.google.com/maps/place/Masjid+e+Aqsa/data=!4m7!3m6!1s0x396dca23b6e8e3c9:0x317431c40fa68fca!8m2!3d26.8003894!4d75.7996164!16s%2Fg%2F11cn0q3zm7!19sChIJyePotiPKbTkRyo-mD8QxdDE?authuser=0&hl=en&rclk=1,"26.8003894,75.79961639999999"
Behlol Khan Masjid - bHlwl khn msjd,Mosque,"WR8M+G92 Behlol Khan Masjid - bHlwl khn msjd, Ghat Gate, Ghat Gate Bazar, Pink City, Jaipur, Rajasthan 302003","Ghat Gate, Ghat Gate Bazar, Pink City",WR8M+G92,Jaipur,302003,Rajasthan,IN,https://www.google.com/maps/place/Behlol+Khan+Masjid+-+%D8%A8%D8%AD%D9%84%D9%88%D9%84+%D8%AE%D8%A7%D9%86+%D9%85%D8%B3%D8%AC%D8%AF%E2%80%AD/data=!4m7!3m6!1s0x396db6c97a1773a3:0x9c8cb22f7fa7078a!8m2!3d26.9162621!4d75.8333965!16s%2Fg%2F1tfpsp63!19sChIJo3MXesm2bTkRigenfy-yjJw?authuser=0&hl=en&rclk=1,"26.916262099999997,75.83339649999999"
Masjid Garib Nawaj,Mosque,"Masjid Garib Nawaj, Nandpuri Colony, Jagatpura, Jaipur, Rajasthan 302017","Nandpuri Colony, Jagatpura",,Jaipur,302017,Rajasthan,IN,https://www.google.com/maps/place/Masjid+Garib+Nawaj/data=!4m7!3m6!1s0x396db790ed9e7083:0x2cdb563c12a2b73d!8m2!3d26.8347155!4d75.8239631!16s%2Fg%2F11kjjhk9ct!19sChIJg3Ce7ZC3bTkRPbeiEjxW2yw?authuser=0&hl=en&rclk=1,"26.834715499999998,75.8239631"
Masjid Bais Godam - msjdi by'ys gwdm,Mosque,"Masjid Bais Godam - msjdi by'ys gwdm, 89, Rd Number 4, Hawa Sadak, Geejgarh Vihar Colony, Bais Godam, Jaipur, Rajasthan 302007","Hawa Sadak, Geejgarh Vihar Colony, Bais Godam","89, Rd Number 4",Jaipur,302007,Rajasthan,IN,https://www.google.com/maps/place/Masjid+Bais+Godam+-+%D9%85%D8%B3%D8%AC%D8%AF%D9%90+%D8%A8%D8%A7%D8%A6%DB%8C%D8%B3+%DA%AF%D9%88%D8%AF%D8%A7%D9%85%E2%80%AD/data=!4m7!3m6!1s0x396db414f05832e3:0xdfc5771a773e79f!8m2!3d26.8984375!4d75.7859805!16s%2Fg%2F11c2pjd8mb!19sChIJ4zJY8BS0bTkRn-dzp3FX_A0?authuser=0&hl=en&rclk=1,"26.8984375,75.7859805"
Kho Nagoriyan Jama Masjid - khw ngwryN jm` msjd,Mosque,"VV84+7RX Kho Nagoriyan Jama Masjid - khw ngwryN jm` msjd, Ghat Ki Guni, Jaipur, Rajasthan 302017",Ghat Ki Guni,VV84+7RX,Jaipur,302017,Rajasthan,IN,https://www.google.com/maps/place/Kho+Nagoriyan+Jama+Masjid+-+%D8%AE%D9%88+%D9%86%DA%AF%D9%88%D8%B1%DB%8C%D8%A7%DA%BA+%D8%AC%D8%A7%D9%85%D8%B9+%D9%85%D8%B3%D8%AC%D8%AF%E2%80%AD/data=!4m7!3m6!1s0x396db7b245e7d46d:0x74edb63ab1a5788e!8m2!3d26.8657254!4d75.8571199!16s%2Fg%2F11csc69hc5!19sChIJbdTnRbK3bTkRjnilsTq27XQ?authuser=0&hl=en&rclk=1,"26.8657254,75.8571199"
Madina Masjid - mdynh msjd,Mosque,"RRMF+R7R Madina Masjid - mdynh msjd, Nandpuri Colony, Jagatpura, Jaipur, Rajasthan 302017","Nandpuri Colony, Jagatpura",RRMF+R7R,Jaipur,302017,Rajasthan,IN,https://www.google.com/maps/place/Madina+Masjid+-+%D9%85%D8%AF%DB%8C%D9%86%DB%81+%D9%85%D8%B3%D8%AC%D8%AF%E2%80%AD/data=!4m7!3m6!1s0x396db61c0c57758d:0x336874baf282673c!8m2!3d26.8346106!4d75.8231253!16s%2Fg%2F11cr_rl23q!19sChIJjXVXDBy2bTkRPGeC8rp0aDM?authuser=0&hl=en&rclk=1,"26.834610599999998,75.8231253"
Masjid Khwaja Garib Nawaz,Mosque,"Masjid Khwaja Garib Nawaz, 176, Hanuman Path, Shiva Colony, Govindpuri, Jaipur, Rajasthan 302019","Hanuman Path, Shiva Colony, Govindpuri",176,Jaipur,302019,Rajasthan,IN,https://www.google.com/maps/place/Masjid+Khwaja+Garib+Nawaz/data=!4m7!3m6!1s0x396db56277ab9f09:0x20ba9526f6136780!8m2!3d26.8829376!4d75.7679742!16s%2Fg%2F11kzvv1bcq!19sChIJCZ-rd2K1bTkRgGcT9iaVuiA?authuser=0&hl=en&rclk=1,"26.882937599999998,75.7679742"
Noorani Masjid - nwrny msjd,Mosque,"WRC5+P3H Noorani Masjid - nwrny msjd, Jalupura Main Rd, Jalupura, Jaipur, Rajasthan 302001",Jalupura,"WRC5+P3H, Jalupura Main Rd",Jaipur,302001,Rajasthan,IN,https://www.google.com/maps/place/Noorani+Masjid+-+%D9%86%D9%88%D8%B1%D8%A7%D9%86%DB%8C+%D9%85%D8%B3%D8%AC%D8%AF%E2%80%AD/data=!4m7!3m6!1s0x396db1555b62f647:0x849e15aa48c64634!8m2!3d26.9211521!4d75.8075488!16s%2Fg%2F1yfdpblrn!19sChIJR_ZiW1WxbTkRNEbGSKoVnoQ?authuser=0&hl=en&rclk=1,"26.9211521,75.80754879999999"
Masjid Meer Ji - msjd myr jy,Mosque,"Masjid Meer Ji - msjd myr jy, 3, Mir Ji Ka Bagh, Sansar Chandra Rd, Jaipur, Rajasthan 302001",Pink City,"3, Mir Ji Ka Bagh, Sansar Chandra Rd",Jaipur,302001,Rajasthan,IN,https://www.google.com/maps/place/Masjid+Meer+Ji+-+%D9%85%D8%B3%D8%AC%D8%AF+%D9%85%DB%8C%D8%B1+%D8%AC%DB%8C%E2%80%AD/data=!4m7!3m6!1s0x396db3ff6701b675:0x80728955af885e66!8m2!3d26.9200339!4d75.8027248!16s%2Fg%2F11f2p1l_jn!19sChIJdbYBZ_-zbTkRZl6Ir1WJcoA?authuser=0&hl=en&rclk=1,"26.9200339,75.8027248"
Makka Masjid - mkhWh msjd,Mosque,"WQX3+H5J Makka Masjid - mkhWh msjd, Factory Area Rd, Bismillah Colony, Makka Colony, Shivaji Nagar, Jhotwara, Jaipur, Rajasthan 302012","Bismillah Colony, Makka Colony, Shivaji Nagar, Jhotwara","WQX3+H5J, Factory Area Rd",Jaipur,302012,Rajasthan,IN,https://www.google.com/maps/place/Makka+Masjid+-+%D9%85%DA%A9%D9%91%DB%81+%D9%85%D8%B3%D8%AC%D8%AF%E2%80%AD/data=!4m7!3m6!1s0x396db30f61d9383d:0x8736f657f4ec7dac!8m2!3d26.9489606!4d75.7528917!16s%2Fg%2F11cs3z209c!19sChIJPTjZYQ-zbTkRrH3s9Ff2Noc?authuser=0&hl=en&rclk=1,"26.9489606,75.75289169999999"
"Jama Masjid, Amer (Akbari Masjid)",Mosque,"XVQ4+HFP Jama Masjid, Amer (Akbari Masjid), Akbari masjid ke samane, Amer, Jaipur, Rajasthan 302028",Amer,"XVQ4+HFP, Akbari masjid ke samane",Jaipur,302028,Rajasthan,IN,"https://www.google.com/maps/place/Jama+Masjid,+Amer+%28Akbari+Masjid%29/data=!4m7!3m6!1s0x396db04b784725cb:0x835653dc15f0ad72!8m2!3d26.9889651!4d75.8562061!16s%2Fg%2F1q5bl9p2t!19sChIJyyVHeEuwbTkRcq3wFdxTVoM?authuser=0&hl=en&rclk=1","26.988965099999998,75.8562061"
Firdous Masjid - frdws msjd,Mosque,"WRX3+8XG Firdous Masjid - frdws msjd, Sanjay Nagar, Shri Lal Bhadur Shastri Bhatta Basti, Shastri Nagar, Jaipur, Rajasthan 302016","Sanjay Nagar, Shri Lal Bhadur Shastri Bhatta Basti, Shastri Nagar",WRX3+8XG,Jaipur,302016,Rajasthan,IN,https://www.google.com/maps/place/Firdous+Masjid+-+%D9%81%D8%B1%D8%AF%D9%88%D8%B3+%D9%85%D8%B3%D8%AC%D8%AF%E2%80%AD/data=!4m7!3m6!1s0x396db3df33b1cbe1:0x6d6b9734f042d944!8m2!3d26.948315!4d75.804943!16s%2Fg%2F1ptwfls9p!19sChIJ4cuxM9-zbTkRRNlC8DSXa20?authuser=0&hl=en&rclk=1,"26.948314999999997,75.804943"
Masjid Jakariya - msjd zkhry,Mosque,"XQ3M+8CH Masjid Jakariya - msjd zkhry, Krishna Colony, Naya Khera, Vidyadhar Nagar, Jaipur, Rajasthan 302023","Krishna Colony, Naya Khera, Vidyadhar Nagar",XQ3M+8CH,Jaipur,302023,Rajasthan,IN,https://www.google.com/maps/place/Masjid+Jakariya+-+%D9%85%D8%B3%D8%AC%D8%AF+%D8%B2%DA%A9%D8%B1%DB%8C%D8%A7%E2%80%AD/data=!4m7!3m6!1s0x396db3b7e1c35d63:0x4853af2f05793055!8m2!3d26.9533149!4d75.7836079!16s%2Fg%2F1pt_f2nzj!19sChIJY13D4bezbTkRVTB5BS-vU0g?authuser=0&hl=en&rclk=1,"26.9533149,75.78360789999999"
Airport Masjid,Mosque,"RQ9W+MRG Airport Masjid, Sanganer Thana,, Jagatpura, Jaipur, Rajasthan 302011","Azad Colony, Jagatpura","RQ9W+MRG, Sanganer Thana,",Jaipur,302011,Rajasthan,IN,https://www.google.com/maps/place/Airport+Masjid/data=!4m7!3m6!1s0x396dca05bbfe0469:0x72ea77adbc77ff5!8m2!3d26.8191895!4d75.7970801!16s%2Fg%2F1pp2tvplw!19sChIJaQT-uwXKbTkR9X_H23qnLgc?authuser=0&hl=en&rclk=1,"26.8191895,75.7970801"
Bhankrota Masjid,Mosque,"Bhankrota Masjid, Bhakrota, Jaipur, Rajasthan 302026",Bhakrota,,Jaipur,302026,Rajasthan,IN,https://www.google.com/maps/place/Bhankrota+Masjid/data=!4m7!3m6!1s0x396c4b24d824c413:0x79a46b001c484825!8m2!3d26.8735612!4d75.6992239!16s%2Fg%2F11c6mcsvpn!19sChIJE8Qk2CRLbDkRJUhIHABrpHk?authuser=0&hl=en&rclk=1,"26.873561199999997,75.69922389999999"
Shahi Masjid,Mosque,"WRM3+RC5 Shahi Masjid, kabristan nahri naka, Hazi Colony, Subhash Nagar, Jaipur, Rajasthan 302032","Hazi Colony, Subhash Nagar","WRM3+RC5, kabristan nahri naka",Jaipur,302032,Rajasthan,IN,https://www.google.com/maps/place/Shahi+Masjid/data=!4m7!3m6!1s0x396db3e3b0c59145:0x1cb581661b07b89c!8m2!3d26.9345009!4d75.8036164!16s%2Fg%2F11b6t3lsm2!19sChIJRZHFsOOzbTkRnLgHG2aBtRw?authuser=0&hl=en&rclk=1,"26.9345009,75.8036164"
Noor Haq Masjid,Mosque,"Noor Haq Masjid, 17, New Sanjay Nagar, Shri Lal Bhadur Shastri Bhatta Basti, Shastri Nagar, Jaipur, Rajasthan 302016","New Sanjay Nagar, Shri Lal Bhadur Shastri Bhatta Basti, Shastri Nagar",17,Jaipur,302016,Rajasthan,IN,https://www.google.com/maps/place/Noor+Haq+Masjid/data=!4m7!3m6!1s0x396db3d8fe57eb99:0x4d059acc381db337!8m2!3d26.951127!4d75.804179!16s%2Fg%2F1jmcj87t0!19sChIJmetX_tizbTkRN7MdOMyaBU0?authuser=0&hl=en&rclk=1,"26.951127,75.80417899999999"
Masjid Mominan,Mosque,"Masjid Mominan, 3461, Amratpuri, Transport Nagar, Jaipur, Rajasthan 302007","Amratpuri, Transport Nagar",3461,Jaipur,302007,Rajasthan,IN,https://www.google.com/maps/place/Masjid+Mominan/data=!4m7!3m6!1s0x396db6c92a18c945:0xde56f85a9f0a182f!8m2!3d26.9143008!4d75.8356257!16s%2Fg%2F11cn0vmqwq!19sChIJRckYKsm2bTkRLxgKn1r4Vt4?authuser=0&hl=en&rclk=1,"26.9143008,75.8356257"
Masjid E Zakir - msjdi dhkhr,Mosque,"WRMV+WFJ Masjid E Zakir - msjdi dhkhr, Masjid E Zakir Naangi Ka Choraha Bas Badanpura Jaipur, Badanpura Rd, Bilo Chan Mohalla, Bas Badanpura, Jaipur, Rajasthan 302002","Bilo Chan Mohalla, Bas Badanpura","WRMV+WFJ, Masjid E Zakir Naangi Ka Choraha Bas Badanpura Jaipur, Badanpura Rd",Jaipur,302002,Rajasthan,IN,https://www.google.com/maps/place/Masjid+E+Zakir+-+%D9%85%D8%B3%D8%AC%D8%AF%D9%90+%D8%B0%D8%A7%DA%A9%D8%B1%E2%80%AD/data=!4m7!3m6!1s0x396db12f8eb32c31:0x4935aa5ff693764c!8m2!3d26.9348447!4d75.8436495!16s%2Fg%2F11g6lw_7pq!19sChIJMSyzji-xbTkRTHaT9l-qNUk?authuser=0&hl=en&rclk=1,"26.9348447,75.8436495"
Rehmania Masjid,Mosque,"Rehmania Masjid, Shree Ram, Sector 35, Sanganer, Pratap Nagar, Jaipur, Rajasthan 302022","Sector 35, Sanganer, Pratap Nagar",Shree Ram,Jaipur,302022,Rajasthan,IN,https://www.google.com/maps/place/Rehmania+Masjid/data=!4m7!3m6!1s0x396dca26b8f5043d:0xfdee41809b215c76!8m2!3d26.7975257!4d75.8024487!16s%2Fg%2F11h9__7r4f!19sChIJPQT1uCbKbTkRdlwhm4BB7v0?authuser=0&hl=en&rclk=1,"26.797525699999998,75.8024487"
Auliya Masjid - wly msjd,Mosque,"Auliya Masjid - wly msjd, 2, Nh-12, Jawahar Nagar, Bajaj Nagar, Jaipur, Rajasthan 302015","Jawahar Nagar, Bajaj Nagar","2, Nh-12",Jaipur,302015,Rajasthan,IN,https://www.google.com/maps/place/Auliya+Masjid+-+%D8%A7%D9%88%D9%84%DB%8C%D8%A7%D8%A1+%D9%85%D8%B3%D8%AC%D8%AF%E2%80%AD/data=!4m7!3m6!1s0x396db42d1c8c4bd3:0xb9a418ba59d7ece!8m2!3d26.8749217!4d75.7979014!16s%2Fg%2F11c3853whh!19sChIJ00uMHC20bTkRzn6dpYtBmgs?authuser=0&hl=en&rclk=1,"26.874921699999998,75.7979014"
Jali Wali Masjid - jly wly msjd,Mosque,"WRF5+5FX Jali Wali Masjid - jly wly msjd, Topkhane Ka Rasta, Chandpole Bazar, Chandpole, Pink City, Jaipur, Rajasthan 302001","Chandpole Bazar, Chandpole, Pink City","WRF5+5FX, Topkhane Ka Rasta",Jaipur,302001,Rajasthan,IN,https://www.google.com/maps/place/Jali+Wali+Masjid+-+%D8%AC%D8%A7%D9%84%DB%8C+%D9%88%D8%A7%D9%84%DB%8C+%D9%85%D8%B3%D8%AC%D8%AF%E2%80%AD/data=!4m7!3m6!1s0x396db155a751dcb1:0x7c95c2778f3e8fb7!8m2!3d26.9229949!4d75.8087241!16s%2Fg%2F1tdzdd6c!19sChIJsdxRp1WxbTkRt48-j3fClXw?authuser=0&hl=en&rclk=1,"26.9229949,75.80872409999999"
Masjid Muhammadi,Mosque,"Masjid Muhammadi, Pinkcity, near Radha Mandir, Char Darwaja, Kanwar Nagar, Jaipur, Rajasthan 302003","Char Darwaja, Kanwar Nagar","Pinkcity, near Radha Mandir",Jaipur,302003,Rajasthan,IN,https://www.google.com/maps/place/Masjid+Muhammadi/data=!4m7!3m6!1s0x396db1313fde1803:0x1f7e022117150396!8m2!3d26.9299285!4d75.8371763!16s%2Fg%2F1tgh1crv!19sChIJAxjePzGxbTkRlgMVFyECfh8?authuser=0&hl=en&rclk=1,"26.9299285,75.8371763"
Muhammadi Masjid,Mosque,"WQW3+F3W Muhammadi Masjid, Shivaji Nagar, Jhotwara, Jaipur, Rajasthan 302012","Shivaji Nagar, Jhotwara",WQW3+F3W,Jaipur,302012,Rajasthan,IN,https://www.google.com/maps/place/Muhammadi+Masjid/data=!4m7!3m6!1s0x396db30f1dc970ed:0x1f1731820e9451c6!8m2!3d26.9462309!4d75.7526975!16s%2Fg%2F11c6f69ss1!19sChIJ7XDJHQ-zbTkRxlGUDoIxFx8?authuser=0&hl=en&rclk=1,"26.9462309,75.7526975"
Masjid Noor-E-Ilahi,Mosque,"WR3J+3HJ Masjid Noor-E-Ilahi, Saket Colony, Adarsh Nagar, Jaipur, Rajasthan 302004","Saket Colony, Adarsh Nagar",WR3J+3HJ,Jaipur,302004,Rajasthan,IN,https://www.google.com/maps/place/Masjid+Noor-E-Ilahi/data=!4m7!3m6!1s0x396db6c08c42b3a7:0x3fac40518a370dfd!8m2!3d26.9027209!4d75.8313788!16s%2Fg%2F11f1pmgj5z!19sChIJp7NCjMC2bTkR_Q03ilFArD8?authuser=0&hl=en&rclk=1,"26.9027209,75.8313788"
Gosiya Masjid,Mosque,"Gosiya Masjid, NH248, delhi by pass road eidgah Jaipur, Panch Rang Patti, Bas Badanpura, Jaipur, Rajasthan 302002","Panch Rang Patti, Bas Badanpura","NH248, delhi by pass road eidgah Jaipur",Jaipur,302002,Rajasthan,IN,https://www.google.com/maps/place/Gosiya+Masjid/data=!4m7!3m6!1s0x396db12e8a0b6a6d:0xfec57f21e2fd97ba!8m2!3d26.9307146!4d75.8446983!16s%2Fg%2F11dxs9pvy7!19sChIJbWoLii6xbTkRupf94iF_xf4?authuser=0&hl=en&rclk=1,"26.930714599999998,75.84469829999999"
Masjid Noor,Mosque,"WQ5F+J6G Masjid Noor, Adil Khan Rd, Jamuna Nagar, Sodala, Jaipur, Rajasthan 302006","Jamuna Nagar, Sodala","WQ5F+J6G, Adil Khan Rd",Jaipur,302006,Rajasthan,IN,https://www.google.com/maps/place/Masjid+Noor/data=!4m7!3m6!1s0x396db470be84be63:0xe755e8e189f7d666!8m2!3d26.9090703!4d75.7730891!16s%2Fg%2F1tqtw8tx!19sChIJY76EvnC0bTkRZtb3ieHoVec?authuser=0&hl=en&rclk=1,"26.9090703,75.77308909999999"
"Auliya Mosque, Madarsa zeenatul uloom",Mosque,"WQ8C+3F5 Auliya Mosque, Madarsa zeenatul uloom, Narayanpuri Colony, Raval Gi Ka Banda, Hasanpura, Jaipur, Rajasthan 302006","Narayanpuri Colony, Raval Gi Ka Banda, Hasanpura",WQ8C+3F5,Jaipur,302006,Rajasthan,IN,"https://www.google.com/maps/place/Auliya+Mosque,+Madarsa+zeenatul+uloom/data=!4m7!3m6!1s0x396db478174154dd:0xe3870c49b171ef81!8m2!3d26.9151388!4d75.7712372!16s%2Fg%2F11hd1rv98p!19sChIJ3VRBF3i0bTkRge9xsUkMh-M?authuser=0&hl=en&rclk=1","26.915138799999998,75.7712372"
Masjid Hamza,Mosque,"WR4H+JWF Masjid Hamza, Fateh Tibba, Adarsh Nagar, Jaipur, Rajasthan 302004","Fateh Tibba, Adarsh Nagar",WR4H+JWF,Jaipur,302004,Rajasthan,IN,https://www.google.com/maps/place/Masjid+Hamza/data=!4m7!3m6!1s0x396db6b8a7177c41:0x8d36975e6f9554e7!8m2!3d26.906562!4d75.8298028!16s%2Fg%2F1q67srcwd!19sChIJQXwXp7i2bTkR51SVb16XNo0?authuser=0&hl=en&rclk=1,"26.906561999999997,75.8298028"
Badi Masjid (Big Mosque),Mosque,"WQ9J+7QR Badi Masjid (Big Mosque), Kamala Nehru Nagar, Hasanpura, Jaipur, Rajasthan 302006","Kamala Nehru Nagar, Hasanpura",WQ9J+7QR,Jaipur,302006,Rajasthan,IN,https://www.google.com/maps/place/Badi+Masjid+%28Big+Mosque%29/data=!4m7!3m6!1s0x396db38f29a0927d:0x28b28bcbc9707312!8m2!3d26.9182467!4d75.7818782!16s%2Fg%2F11f3cdmd92!19sChIJfZKgKY-zbTkREnNwycuLsig?authuser=0&hl=en&rclk=1,"26.918246699999997,75.7818782"
Takiya Yaqeen Shah Mosque,Mosque,"WR7R+C26 Takiya Yaqeen Shah Mosque, Topkhana Hazuri, Jaipur, Rajasthan 302003",Topkhana Hazuri,WR7R+C26,Jaipur,302003,Rajasthan,IN,https://www.google.com/maps/place/Takiya+Yaqeen+Shah+Mosque/data=!4m7!3m6!1s0x396db6cfbeb96f7f:0x8b7e16d317e029c6!8m2!3d26.9135256!4d75.8400302!16s%2Fg%2F11f3854f97!19sChIJf2-5vs-2bTkRxingF9MWfos?authuser=0&hl=en&rclk=1,"26.9135256,75.8400302"
Loharon Ki Masjid,Mosque,"RQ9P+99R Loharon Ki Masjid, RJ SH 12, Dada Gurudev Nagar, Sanganer, Jaipur, Rajasthan 302029","Dada Gurudev Nagar, Sanganer","RQ9P+99R, RJ SH 12",Jaipur,302029,Rajasthan,IN,https://www.google.com/maps/place/Loharon+Ki+Masjid/data=!4m7!3m6!1s0x396dca0c8d62fafd:0xe30c3570445cbde7!8m2!3d26.8184784!4d75.785892!16s%2Fg%2F1yg6nq16q!19sChIJ_fpijQzKbTkR571cRHA1DOM?authuser=0&hl=en&rclk=1,"26.8184784,75.78589199999999"
Golam dazan masjid - gw'lm dz msjd,Mosque,"Golam dazan masjid - gw'lm dz msjd, 3566, Topkhana Hazuri, Jaipur, Rajasthan 302007",Topkhana Hazuri,3566,Jaipur,302007,Rajasthan,IN,https://www.google.com/maps/place/Golam+dazan+masjid+-+%DA%AF%D8%A4%D9%84%D8%A7%D9%85+%D8%AF%D8%B2+%D9%85%D8%B3%D8%AC%D8%AF%E2%80%AD/data=!4m7!3m6!1s0x396db6ce2b7447d3:0x28b6417b4eb88b17!8m2!3d26.9149803!4d75.8414863!16s%2Fg%2F11c6cy916m!19sChIJ00d0K862bTkRF4u4TntBtig?authuser=0&hl=en&rclk=1,"26.9149803,75.8414863"
Mosque Sultan Fatakwali,Mosque,"Mosque Sultan Fatakwali, Pulia Mosque, near railway 3rd Gate, Hasanpura flyover, Jaipur, Rajasthan 302006",Gopalbari,"Pulia Mosque, near railway 3rd Gate, Hasanpura flyover",Jaipur,302006,Rajasthan,IN,https://www.google.com/maps/place/Mosque+Sultan+Fatakwali/data=!4m7!3m6!1s0x396db3f601a924bf:0xe8aeb030a6ebf3b3!8m2!3d26.9183355!4d75.7896848!16s%2Fg%2F11gfm884rq!19sChIJvySpAfazbTkRs_PrpjCwrug?authuser=0&hl=en&rclk=1,"26.918335499999998,75.7896848"
Noorani masjid - nwrny msjd,Mosque,"WR6R+J8V Noorani masjid - nwrny msjd, Amrit Puri Ghat Gate, Amratpuri, Transport Nagar, Jaipur, Rajasthan 302003","Amrit Puri Ghat Gate, Amratpuri, Transport Nagar",WR6R+J8V,Jaipur,302003,Rajasthan,IN,https://www.google.com/maps/place/Noorani+masjid+-+%D9%86%D9%88%D8%B1%D8%A7%D9%86%DB%8C+%D9%85%D8%B3%D8%AC%D8%AF%E2%80%AD/data=!4m7!3m6!1s0x396db6c55c17e7b5:0x2c094cee980422f2!8m2!3d26.9116233!4d75.8407882!16s%2Fg%2F1thzm92x!19sChIJtecXXMW2bTkR8iIEmO5MCSw?authuser=0&hl=en&rclk=1,"26.9116233,75.84078819999999"
Masjid Garib Navaj,Mosque,"Masjid Garib Navaj, 39, Lalarpura, Jaipur, Rajasthan 302034",Lalarpura,39,Jaipur,302034,Rajasthan,IN,https://www.google.com/maps/place/Masjid+Garib+Navaj/data=!4m7!3m6!1s0x396db4ad59db68df:0x6ace24867e1b377e!8m2!3d26.899205!4d75.714654!16s%2Fg%2F11c6_qgvhj!19sChIJ32jbWa20bTkRfjcbfoYkzmo?authuser=0&hl=en&rclk=1,"26.899205,75.714654"
NadaFan Mosque,Mosque,"NadaFan Mosque, 3806, Topkhana Hazuri, Jaipur, Rajasthan 302003",Topkhana Hazuri,3806,Jaipur,302003,Rajasthan,IN,https://www.google.com/maps/place/NadaFan+Mosque/data=!4m7!3m6!1s0x396db6cc32f07e01:0x6f4f3f9678aa0cba!8m2!3d26.9182688!4d75.8387223!16s%2Fg%2F11cjhk9g38!19sChIJAX7wMsy2bTkRugyqeJY_T28?authuser=0&hl=en&rclk=1,"26.9182688,75.8387223"
Mohammadi Masjid,Mosque,"WRVX+W9G Mohammadi Masjid, Beniwal Kanta St, near Fasi Garden, Hussain Colony, Shankar Nagar, Jaipur, Rajasthan 302002","Hussain Colony, Shankar Nagar","WRVX+W9G, Beniwal Kanta St, near Fasi Garden",Jaipur,302002,Rajasthan,IN,https://www.google.com/maps/place/Mohammadi+Masjid/data=!4m7!3m6!1s0x396db1219b760f51:0x1831493d93d15d37!8m2!3d26.9448132!4d75.8484507!16s%2Fg%2F11btm9xlx3!19sChIJUQ92myGxbTkRN13Rkz1JMRg?authuser=0&hl=en&rclk=1,"26.9448132,75.8484507"
Noorani masjid nuuraanii msjid,Mosque,"Noorani masjid nuuraanii msjid, 2109, Station Rd, Subhash Nagar, Jaipur, Rajasthan 302016",Subhash Nagar,"2109, Station Rd",Jaipur,302016,Rajasthan,IN,https://www.google.com/maps/place/Noorani+masjid+%E0%A4%A8%E0%A5%82%E0%A4%B0%E0%A4%BE%E0%A4%A8%E0%A5%80+%E0%A4%AE%E0%A4%B8%E0%A5%8D%E0%A4%9C%E0%A4%BF%E0%A4%A6/data=!4m7!3m6!1s0x396db359df204907:0x923dd575a30b2f0b!8m2!3d26.9319366!4d75.8059809!16s%2Fg%2F11fpklggy8!19sChIJB0kg31mzbTkRCy8Lo3XVPZI?authuser=0&hl=en&rclk=1,"26.9319366,75.8059809"
Barkati Masjid Vyas Colony,Mosque,"Barkati Masjid Vyas Colony, C-57, C-57, Sati Colony, Nahari Ka Naka, Jaipur, Rajasthan 302016","Vayas Colony, Nahari Ka Naka","C-57, C-57, Sati Colony",Jaipur,302016,Rajasthan,IN,https://www.google.com/maps/place/Barkati+Masjid+Vyas+Colony/data=!4m7!3m6!1s0x396db3e1fcb6ffff:0x5d1facb7018110fe!8m2!3d26.9378787!4d75.8066244!16s%2Fg%2F11c38jvw3v!19sChIJ__-2_OGzbTkR_hCBAbesH10?authuser=0&hl=en&rclk=1,"26.9378787,75.80662439999999"
Masjid moti doongri,Mosque,"VRX9+6G7 Masjid moti doongri, Moti Doongri Rd, Tilak Nagar, Jaipur, Rajasthan 302004",Tilak Nagar,"VRX9+6G7, Moti Doongri Rd",Jaipur,302004,Rajasthan,IN,https://www.google.com/maps/place/Masjid+moti+doongri/data=!4m7!3m6!1s0x396db697fc899bbd:0x81d472122c9fb491!8m2!3d26.8980373!4d75.818797!16s%2Fg%2F1260t_nyt!19sChIJvZuJ_Je2bTkRkbSfLBJy1IE?authuser=0&hl=en&rclk=1,"26.8980373,75.818797"
