name,main_category,address,address_ward,address_street,address_city,address_postal_code,address_state,address_country_code,link,coordinates
Masjid E Chini Ki Burj - msjdi chyny khy mrD,Mosque,"Masjid E Chini Ki Burj - msjdi chyny khy mrD, 742, Gangori Bazaar, J.D.A. Market, Kanwar Nagar, Jaipur, Rajasthan 302002","Gangori Bazaar, J.D.A. Market, Kanwar Nagar",742,Jaipur,302002,Rajasthan,IN,https://www.google.com/maps/place/Masjid+E+Chini+Ki+Burj+-+%D9%85%D8%B3%D8%AC%D8%AF%D9%90+%DA%86%DB%8C%D9%86%DB%8C+%DA%A9%DB%8C+%D9%85%D8%B1%D8%B6%E2%80%AD/data=!4m7!3m6!1s0x396db18f9e2666c1:0xcb052065ce011fb1!8m2!3d26.9274533!4d75.8207026!16s%2Fg%2F11ghnv1cqp!19sChIJwWYmno-xbTkRsR8BzmUgBcs?authuser=0&hl=en&rclk=1,"26.9274533,75.82070259999999"
Masjid E Haizam Faroshan - msjdi hyzm frwshN,Mosque,"Masjid E Haizam Faroshan - msjdi hyzm frwshN, 8, Mirza Ismail Rd, Panch Batti, Jayanti Market, Ashok Nagar, Jaipur, Rajasthan 302001","Panch Batti, Jayanti Market, Ashok Nagar","8, Mirza Ismail Rd",Jaipur,302001,Rajasthan,IN,https://www.google.com/maps/place/Masjid+E+Haizam+Faroshan+-+%D9%85%D8%B3%D8%AC%D8%AF%D9%90+%DB%81%DB%8C%D8%B2%D9%85+%D9%81%D8%B1%D9%88%D8%B4%D8%A7%DA%BA%E2%80%AD/data=!4m7!3m6!1s0x396db6adb7b0aa81:0xe7e0c3ca4e505f8!8m2!3d26.9165573!4d75.8166209!16s%2Fg%2F1tnpcv5v!19sChIJgaqwt622bTkR-AXlpDwMfg4?authuser=0&hl=en&rclk=1,"26.916557299999997,75.81662089999999"
Aqsa masjid,Mosque,"WRX2+6H6 Aqsa masjid, New Jaalupura Rd, Ram Nagar, Shastri Nagar, Jaipur, Rajasthan 302016","Ram Nagar, Shastri Nagar","WRX2+6H6, New Jaalupura Rd",Jaipur,302016,Rajasthan,IN,https://www.google.com/maps/place/Aqsa+masjid/data=!4m7!3m6!1s0x396db3ed3af9e5af:0x66ad8bc0a065822a!8m2!3d26.94806!4d75.801547!16s%2Fg%2F11c6sb7vzd!19sChIJr-X5Ou2zbTkRKoJloMCLrWY?authuser=0&hl=en&rclk=1,"26.948059999999998,75.801547"
Gulab Masjid,Mosque,"Gulab Masjid, 4293, Handi Pura, Badi Chaupar, Jaipur, Rajasthan 302002","Handi Pura, Badi Chaupar",4293,Jaipur,302002,Rajasthan,IN,https://www.google.com/maps/place/Gulab+Masjid/data=!4m7!3m6!1s0x396db134b1ea609d:0xe95d1420d1ff26bd!8m2!3d26.9232597!4d75.8351596!16s%2Fg%2F11dxd4xzjl!19sChIJnWDqsTSxbTkRvSb_0SAUXek?authuser=0&hl=en&rclk=1,"26.9232597,75.8351596"
Masjid Al Zaheen,Mosque,"WR8R+XHP Masjid Al Zaheen, Surajpol Bazar Rd, Topkhana Hazuri, Pink City, Jaipur, Rajasthan 302003","Topkhana Hazuri, Pink City","WR8R+XHP, Surajpol Bazar Rd",Jaipur,302003,Rajasthan,IN,https://www.google.com/maps/place/Masjid+Al+Zaheen/data=!4m7!3m6!1s0x396db6cdf7c3dc95:0xee4f8a8ec724ef79!8m2!3d26.9174619!4d75.8414484!16s%2Fg%2F1tm67b7y!19sChIJldzD9822bTkRee8kx46KT-4?authuser=0&hl=en&rclk=1,"26.9174619,75.84144839999999"
Masjid,Mosque,"WQJM+VQ2 Masjid, Military Containment, Jhotwara, Jaipur, Rajasthan 302032","Military Containment, Jhotwara",WQJM+VQ2,Jaipur,302032,Rajasthan,IN,https://www.google.com/maps/place/Masjid/data=!4m7!3m6!1s0x396db3b4e34ca7a3:0x445299e3397b22a7!8m2!3d26.9321303!4d75.7844005!16s%2Fg%2F11fftq6ygx!19sChIJo6dM47SzbTkRpyJ7OeOZUkQ?authuser=0&hl=en&rclk=1,"26.932130299999997,75.78440049999999"
Ayesha Masjid,Mosque,"WRM4+PR4 Ayesha Masjid, Madina Masjid Rd, Shastri Nagar, Nahari Ka Naka, Jaipur, Rajasthan 302007","Shastri Nagar, Nahari Ka Naka","WRM4+PR4, Madina Masjid Rd",Jaipur,,Rajasthan,IN,https://www.google.com/maps/place/Ayesha+Masjid/data=!4m7!3m6!1s0x396db158724739c7:0xad529323ad075d8e!8m2!3d26.9342588!4d75.8070672!16s%2Fg%2F11f3xmc499!19sChIJxzlHclixbTkRjl0HrSOTUq0?authuser=0&hl=en&rclk=1,"26.9342588,75.80706719999999"
Ajmeri Masjid,Mosque,"WQ7G+MHQ Ajmeri Masjid, NBC Rd, Rajiv Nagar, Shanti Nagar, Civil Lines, Jaipur, Rajasthan 302006","Rajiv Nagar, Shanti Nagar, Civil Lines","WQ7G+MHQ, NBC Rd",Jaipur,302006,Rajasthan,IN,https://www.google.com/maps/place/Ajmeri+Masjid/data=!4m7!3m6!1s0x396db47660c1b77f:0xdbbe55f6827862cc!8m2!3d26.9142177!4d75.7764886!16s%2Fg%2F11c2nk4q6x!19sChIJf7fBYHa0bTkRzGJ4gvZVvts?authuser=0&hl=en&rclk=1,"26.9142177,75.7764886"
Masjid Ahle Sunnat Burj wali c-scheme,Mosque,"WQ3R+QGC Masjid Ahle Sunnat Burj wali c-scheme, Shivaji Nagar, Jaipur, Rajasthan 302007",Shivaji Nagar,WQ3R+QGC,Jaipur,302007,Rajasthan,IN,https://www.google.com/maps/place/Masjid+Ahle+Sunnat+Burj+wali+c-scheme/data=!4m7!3m6!1s0x396db411a38697a7:0xb82d9841a996ca41!8m2!3d26.9044406!4d75.7912686!16s%2Fg%2F11fx8hbjn5!19sChIJp5eGoxG0bTkRQcqWqUGYLbg?authuser=0&hl=en&rclk=1,"26.904440599999997,75.7912686"
Naggamiyan ki Masjid,Mosque,"Naggamiyan ki Masjid, 1465, Ghat Gate Bazar, Ramganj Bazar, Jaipur, Rajasthan 302007","Ghat Gate Bazar, Ramganj Bazar",1465,Jaipur,302007,Rajasthan,IN,https://www.google.com/maps/place/Naggamiyan+ki+Masjid/data=!4m7!3m6!1s0x396db6ca54113c91:0xf51491e9b80bed1e!8m2!3d26.9194418!4d75.8326787!16s%2Fg%2F11c1wsxq80!19sChIJkTwRVMq2bTkRHu0LuOmRFPU?authuser=0&hl=en&rclk=1,"26.919441799999998,75.8326787"
Kausar-e-Deen Mosque,Mosque,"WQ9R+FW7 Kausar-e-Deen Mosque, Hasanpura Rd, Gopalbari, Jaipur, Rajasthan 302001",Gopalbari,"WQ9R+FW7, Hasanpura Rd",Jaipur,302001,Rajasthan,IN,https://www.google.com/maps/place/Kausar-e-Deen+Mosque/data=!4m7!3m6!1s0x396db3f62afc4ebb:0xe62464f7cc8ac142!8m2!3d26.9186716!4d75.7923067!16s%2Fg%2F11b8_gjhl7!19sChIJu078KvazbTkRQsGKzPdkJOY?authuser=0&hl=en&rclk=1,"26.9186716,75.7923067"
Masjid Firdos,Mosque,"WRJQ+PWR Masjid Firdos, Sayyed Colony, Khandelwal Colony, Bas Badanpura, Jaipur, Rajasthan 302002","Sayyed Colony, Khandelwal Colony, Bas Badanpura",WRJQ+PWR,Jaipur,302002,Rajasthan,IN,https://www.google.com/maps/place/Masjid+Firdos/data=!4m7!3m6!1s0x396db131b2d99f21:0xdb09663cc20c412c!8m2!3d26.9318732!4d75.83976!16s%2Fg%2F11g027czv_!19sChIJIZ_ZsjGxbTkRLEEMwjxmCds?authuser=0&hl=en&rclk=1,"26.9318732,75.83976"
Moti Masjid,Mosque,"59, Moti Masjid, 59, Kho Nagoriyan, Ghati Karolan, Jaipur, Rajasthan 303012","Kho Nagoriyan, Ghati Karolan","59, 59",Jaipur,303012,Rajasthan,IN,https://www.google.com/maps/place/Moti+Masjid/data=!4m7!3m6!1s0x396db7ba7a97d799:0x7e2adbd08d60d9c7!8m2!3d26.8650183!4d75.8655248!16s%2Fg%2F11b7gp802y!19sChIJmdeXerq3bTkRx9lgjdDbKn4?authuser=0&hl=en&rclk=1,"26.8650183,75.8655248"
Noorani Masjid,Mosque,"Noorani Masjid, 00/225 J.P, colony Jal Mahal, Idgah Kachi Basti, Jaipur, Rajasthan 302002","Idgah Kachi Basti, Parasrampuri","00/225 J.P, colony Jal Mahal",Jaipur,302002,Rajasthan,IN,https://www.google.com/maps/place/Noorani+Masjid/data=!4m7!3m6!1s0x396db1104941e12b:0x685d016371046349!8m2!3d26.9554387!4d75.8402862!16s%2Fg%2F11c1xnrj7k!19sChIJK-FBSRCxbTkRSWMEcWMBXWg?authuser=0&hl=en&rclk=1,"26.9554387,75.8402862"
Mumtaz Bagh Masjid,Mosque,"WR84+GGM Mumtaz Bagh Masjid, Subhash Marg, Panch Batti, C Scheme, Ashok Nagar, Jaipur, Rajasthan 302001","Panch Batti, C Scheme, Ashok Nagar","WR84+GGM, Subhash Marg",Jaipur,302001,Rajasthan,IN,https://www.google.com/maps/place/Mumtaz+Bagh+Masjid/data=!4m7!3m6!1s0x396db401d06e31f9:0x69bd498b383cb7aa!8m2!3d26.9163367!4d75.8062952!16s%2Fg%2F1pp2vfs69!19sChIJ-TFu0AG0bTkRqrc8OItJvWk?authuser=0&hl=en&rclk=1,"26.9163367,75.8062952"
MASJID BISATIYAN,Mosque,"MASJID BISATIYAN, 641, MOHALLA BISATIYAN, Ramganj Bazar, Jaipur, Rajasthan 302003",Ramganj Bazar,"641, MOHALLA BISATIYAN",Jaipur,302003,Rajasthan,IN,https://www.google.com/maps/place/MASJID+BISATIYAN/data=!4m7!3m6!1s0x396db6ca9f5b051b:0xd67dd850113b778f!8m2!3d26.9208534!4d75.8305495!16s%2Fg%2F11bzzw8fhm!19sChIJGwVbn8q2bTkRj3c7EVDYfdY?authuser=0&hl=en&rclk=1,"26.9208534,75.8305495"
Masjid Bhojpura Basti,Mosque,"72, Masjid Bhojpura Basti, 70,71, Sahakar Marg, Jyothi Nagar, Lalkothi, Jaipur, Rajasthan 302007","Jyothi Nagar, Lalkothi","72, 70,71, Sahakar Marg",Jaipur,302007,Rajasthan,IN,https://www.google.com/maps/place/Masjid+Bhojpura+Basti/data=!4m7!3m6!1s0x396db417ca7426a5:0xc0f6eb18f569f0dc!8m2!3d26.8975313!4d75.7929661!16s%2Fg%2F11gcjhtdbv!19sChIJpSZ0yhe0bTkR3PBp9Rjr9sA?authuser=0&hl=en&rclk=1,"26.897531299999997,75.7929661"
Mosque,Mosque,"VQGX+36X Mosque, Jawahar Nagar, Bajaj Nagar, Jaipur, Rajasthan 302015","Jawahar Nagar, Bajaj Nagar",VQGX+36X,Jaipur,302015,Rajasthan,IN,https://www.google.com/maps/place/Mosque/data=!4m7!3m6!1s0x396db42d02e41243:0x71840e72ccff5039!8m2!3d26.8752354!4d75.7980943!16s%2Fg%2F11f_b_3fg5!19sChIJQxLkAi20bTkROVD_zHIOhHE?authuser=0&hl=en&rclk=1,"26.875235399999998,75.7980943"
Masjid,Mosque,"WQ7F+959 Masjid, Barkat Nagar Rd, Shiv Colony, Hatwara, Lakshmi Nagar, Jaipur, Rajasthan 302006","Shiv Colony, Hatwara, Lakshmi Nagar","WQ7F+959, Barkat Nagar Rd",Jaipur,302006,Rajasthan,IN,https://www.google.com/maps/place/Masjid/data=!4m7!3m6!1s0x396db477766ae5e5:0xc5190029a5f95283!8m2!3d26.9134107!4d75.7729964!16s%2Fg%2F11gfddmhyw!19sChIJ5eVqdne0bTkRg1L5pSkAGcU?authuser=0&hl=en&rclk=1,"26.9134107,75.7729964"
Choti Masjid,Mosque,"Choti Masjid, 245, Jalupura, Jaipur, Rajasthan 302001",Jalupura,245,Jaipur,302001,Rajasthan,IN,https://www.google.com/maps/place/Choti+Masjid/data=!4m7!3m6!1s0x396db155804c856b:0xa49bd5c74e2a65de!8m2!3d26.9229296!4d75.8069677!16s%2Fg%2F11c6ts6_p3!19sChIJa4VMgFWxbTkR3mUqTsfVm6Q?authuser=0&hl=en&rclk=1,"26.9229296,75.8069677"
Masjid Tonk Risala,Mosque,"Masjid Tonk Risala, 13-b, Motilal Atal Rd, Sindhi Camp, Jaipur, Rajasthan 302001",Sindhi Camp,"13-b, Motilal Atal Rd",Jaipur,302001,Rajasthan,IN,https://www.google.com/maps/place/Masjid+Tonk+Risala/data=!4m7!3m6!1s0x396db3f887018333:0x5c9e20251bdb879a!8m2!3d26.9195985!4d75.7983094!16s%2Fg%2F11c73n_jmf!19sChIJM4MBh_izbTkRmofbGyUgnlw?authuser=0&hl=en&rclk=1,"26.9195985,75.7983094"
Noorani Masjid,Mosque,"Noorani Masjid, 101, Tiwari Ji Ka Bagh, Fateh Tibba, Adarsh Nagar, Jaipur, Rajasthan 302007","Tiwari Ji Ka Bagh, Fateh Tibba, Adarsh Nagar",101,Jaipur,302007,Rajasthan,IN,https://www.google.com/maps/place/Noorani+Masjid/data=!4m7!3m6!1s0x396db6b922c8c98d:0x266015828c7a47f2!8m2!3d26.9060398!4d75.8265845!16s%2Fg%2F11c5xsk3hm!19sChIJjcnIIrm2bTkR8kd6jIIVYCY?authuser=0&hl=en&rclk=1,"26.9060398,75.8265845"
Shia Mosque,Mosque,"Shia Mosque, 271, Amer Rd, Char Darwaja, Chokdi Gangapol, Jaipur, Rajasthan 302002","Char Darwaja, Chokdi Gangapol","271, Amer Rd",Jaipur,302002,Rajasthan,IN,https://www.google.com/maps/place/Shia+Mosque/data=!4m7!3m6!1s0x396db13651746399:0x456d8b0dd9a106a0!8m2!3d26.9307541!4d75.8325334!16s%2Fg%2F11c2m_6hly!19sChIJmWN0UTaxbTkRoAah2Q2LbUU?authuser=0&hl=en&rclk=1,"26.930754099999998,75.8325334"
dagraha wali masjid,Mosque,"WRCJ+6JJ dagraha wali masjid, Ramganj Bazar, Jaipur, Rajasthan 302003",Ramganj Bazar,WRCJ+6JJ,Jaipur,302003,Rajasthan,IN,https://www.google.com/maps/place/dagraha+wali+masjid/data=!4m7!3m6!1s0x396db6ca934216d5:0xf9f468f1cab7dc4a!8m2!3d26.9205791!4d75.8315199!16s%2Fg%2F11bzztp54b!19sChIJ1RZCk8q2bTkRSty3yvFo9Pk?authuser=0&hl=en&rclk=1,"26.920579099999998,75.8315199"
Manpur Sadwa Badi Masjid,Mosque,"XV59+P6R Manpur Sadwa Badi Masjid, Sumel, Jaipur, Rajasthan 302027",Sumel,XV59+P6R,Jaipur,302027,Rajasthan,IN,https://www.google.com/maps/place/Manpur+Sadwa+Badi+Masjid/data=!4m7!3m6!1s0x396db142d7343301:0x3733a3881652b304!8m2!3d26.9593614!4d75.8680138!16s%2Fg%2F11rp6cl42h!19sChIJATM010KxbTkRBLNSFoijMzc?authuser=0&hl=en&rclk=1,"26.9593614,75.8680138"
Masjid E Mariyam,Mosque,"Masjid E Mariyam, 108, Jalupura, Jaipur, Rajasthan 302032",Jalupura,108,Jaipur,302032,Rajasthan,IN,https://www.google.com/maps/place/Masjid+E+Mariyam/data=!4m7!3m6!1s0x396db3ff9692ed51:0x87ec630aaf90c5e2!8m2!3d26.920948!4d75.80508!16s%2Fg%2F11f2_t41wm!19sChIJUe2Slv-zbTkR4sWQrwpj7Ic?authuser=0&hl=en&rclk=1,"26.920948,75.80507999999999"
Masjid Gudajgaran Jaipur,Mosque,"WRHH+F79 Masjid Gudajgaran Jaipur, Hawa Mahal Rd, Kamal Gatta Colony, Kanwar Nagar, Jaipur, Rajasthan 302002","Kamal Gatta Colony, Kanwar Nagar","WRHH+F79, Hawa Mahal Rd",Jaipur,302002,Rajasthan,IN,https://www.google.com/maps/place/Masjid+Gudajgaran+Jaipur/data=!4m7!3m6!1s0x396db1498e1d80b3:0x1407b2b67692b1b7!8m2!3d26.9286552!4d75.828245!16s%2Fg%2F1pp2x5wj2!19sChIJs4AdjkmxbTkRt7GSdrayBxQ?authuser=0&hl=en&rclk=1,"26.928655199999998,75.828245"
Nairiyo Ki Masjid,Mosque,"WRC6+84J Nairiyo Ki Masjid, Kalyan Ji Ka Rasta, Chandpole Bazar, Jalupura, Jaipur, Rajasthan 302001","Chandpole Bazar, Jalupura","WRC6+84J, Kalyan Ji Ka Rasta",Jaipur,302001,Rajasthan,IN,https://www.google.com/maps/place/Nairiyo+Ki+Masjid/data=!4m7!3m6!1s0x396db154d0f0b15b:0xcf3ebcf729ffcb49!8m2!3d26.920847!4d75.8102806!16s%2Fg%2F1pp2xb7rr!19sChIJW7Hw0FSxbTkRScv_Kfe8Ps8?authuser=0&hl=en&rclk=1,"26.920847,75.8102806"
Aaisha Masjid,Mosque,"WR5H+C77 Aaisha Masjid, Unnamed Road, Fateh Tibba, Adarsh Nagar, Jaipur, Rajasthan 302004","Fateh Tibba, Adarsh Nagar","WR5H+C77, Unnamed Road",Jaipur,302004,Rajasthan,IN,https://www.google.com/maps/place/Aaisha+Masjid/data=!4m7!3m6!1s0x396db75536b4eb25:0x74bda4457f9f1cb3!8m2!3d26.9085474!4d75.8281726!16s%2Fg%2F11hyfwd4rs!19sChIJJeu0NlW3bTkRsxyff0WkvXQ?authuser=0&hl=en&rclk=1,"26.9085474,75.8281726"
Badi masjid Mosque - brry msjd,Mosque,"2147, Badi masjid Mosque - brry msjd, 2147, Gangori Bazaar, Gangori Bazar, Purani Basti, Jaipur, Rajasthan 302001","Gangori Bazaar, Gangori Bazar, Purani Basti","2147, 2147",Jaipur,302001,Rajasthan,IN,https://www.google.com/maps/place/Badi+masjid+Mosque+-+%D8%A8%DA%91%DB%8C+%D9%85%D8%B3%D8%AC%D8%AF%E2%80%AD/data=!4m7!3m6!1s0x396db14e1fcb85df:0x38d293ec3ef5a6f8!8m2!3d26.926266!4d75.8198835!16s%2Fg%2F11ckqqrkh2!19sChIJ34XLH06xbTkR-Kb1PuyT0jg?authuser=0&hl=en&rclk=1,"26.926266,75.8198835"
Panchayti Masjid Neelgaran,Mosque,"Panchayti Masjid Neelgaran, 2089, Ladli Ji Ka Khurra, Badi Chaupar, Jaipur, Rajasthan 302002","Ladli Ji Ka Khurra, Badi Chaupar",2089,Jaipur,302002,Rajasthan,IN,https://www.google.com/maps/place/Panchayti+Masjid+Neelgaran/data=!4m7!3m6!1s0x396db1356128a0b9:0x950f69e515c81b4a!8m2!3d26.9239762!4d75.8304718!16s%2Fg%2F11bztfrt0g!19sChIJuaAoYTWxbTkRShvIFeVpD5U?authuser=0&hl=en&rclk=1,"26.9239762,75.8304718"
Kayam Khaniyo Ki Masjid - qy'm khhnywN khy msjd,Mosque,"WQCH+F4W Kayam Khaniyo Ki Masjid - qy'm khhnywN khy msjd, 284, Hasanpura A, Hasanpura, Jaipur, Rajasthan 302006","Hasanpura A, Hasanpura","WQCH+F4W, 284",Jaipur,302006,Rajasthan,IN,https://www.google.com/maps/place/Kayam+Khaniyo+Ki+Masjid+-+%D9%82%D8%A7%D8%A6%D9%85+%DA%A9%DB%81%D8%A7%D9%86%DB%8C%D9%88%DA%BA+%DA%A9%DB%8C+%D9%85%D8%B3%D8%AC%D8%AF%E2%80%AD/data=!4m7!3m6!1s0x396db38960829e03:0x935fe2208e945c14!8m2!3d26.9212625!4d75.7776259!16s%2Fg%2F11gbktrmss!19sChIJA56CYImzbTkRFFyUjiDiX5M?authuser=0&hl=en&rclk=1,"26.921262499999997,75.77762589999999"
"Badi Masjid, Madarsa Jamia Al_Uloom",Mosque,"Badi Masjid, Madarsa Jamia Al_Uloom, 237, near Spoton logistics Pvt Ltd, Jalupura, Jaipur, Rajasthan 302001",Jalupura,"237, near Spoton logistics Pvt Ltd",Jaipur,302001,Rajasthan,IN,"https://www.google.com/maps/place/Badi+Masjid,+Madarsa+Jamia+Al_Uloom/data=!4m7!3m6!1s0x396db15578a134f1:0x47e508c6a958fc11!8m2!3d26.9228354!4d75.8073772!16s%2Fg%2F11g8bbw5z6!19sChIJ8TSheFWxbTkREfxYqcYI5Uc?authuser=0&hl=en&rclk=1","26.9228354,75.80737719999999"
AYESHA MASJID.,Mosque,"AYESHA MASJID., 126, Anaj Mandi Rd, Anaj Mandi, Transport Nagar, Jaipur, Rajasthan 302007","Anaj Mandi, Transport Nagar","126, Anaj Mandi Rd",Jaipur,302007,Rajasthan,IN,https://www.google.com/maps/place/AYESHA+MASJID./data=!4m7!3m6!1s0x396db6d08c7f0c23:0x3e9e07619bee0a03!8m2!3d26.9135432!4d75.8450503!16s%2Fg%2F11c709_ggj!19sChIJIwx_jNC2bTkRAwrum2EHnj4?authuser=0&hl=en&rclk=1,"26.9135432,75.8450503"
Lal Masjid,Mosque,"H no, Lal Masjid, lal masjid, Bilo Chan Mohalla, billochian mohalla, Jaipur, Rajasthan 302002","Bilo Chan Mohalla, billochian mohalla","H no, lal masjid",Jaipur,302002,Rajasthan,IN,https://www.google.com/maps/place/Lal+Masjid/data=!4m7!3m6!1s0x396db1a2680c6d13:0xb9ac4b54752aa20c!8m2!3d26.9352488!4d75.8447515!16s%2Fg%2F11rqzbqwrq!19sChIJE20MaKKxbTkRDKIqdVRLrLk?authuser=0&hl=en&rclk=1,"26.9352488,75.8447515"
Masjid Mominan,Mosque,"WR9V+92R Masjid Mominan, Adam Shah AlayhirRaHmah, near Dargah Hazrat, Ghat Gate, Surajpole Bazar, Pink City, Jaipur, Rajasthan 302003","Ghat Gate, Surajpole Bazar, Pink City","WR9V+92R, Adam Shah AlayhirRaHmah, near Dargah Hazrat",Jaipur,302003,Rajasthan,IN,https://www.google.com/maps/place/Masjid+Mominan/data=!4m7!3m6!1s0x396db6d21aaefae5:0xc181a8b64e37cfbe!8m2!3d26.9184929!4d75.8425244!16s%2Fg%2F11clyt02yq!19sChIJ5fquGtK2bTkRvs83TraogcE?authuser=0&hl=en&rclk=1,"26.9184929,75.8425244"
Jinsi Masjid - jnsy msjd,Mosque,"WR5F+M92 Jinsi Masjid - jnsy msjd, Moti Doongri Rd, Bardia Colony, Kailash Puri, Adarsh Nagar, Jaipur, Rajasthan 302004","Bardia Colony, Kailash Puri, Adarsh Nagar","WR5F+M92, Moti Doongri Rd",Jaipur,302004,Rajasthan,IN,https://www.google.com/maps/place/Jinsi+Masjid+-+%D8%AC%D9%86%D8%B3%DB%8C+%D9%85%D8%B3%D8%AC%D8%AF%E2%80%AD/data=!4m7!3m6!1s0x396db6ba1025118d:0x471dd40b9aead505!8m2!3d26.909145!4d75.8234008!16s%2Fg%2F11c5xtp7c9!19sChIJjRElELq2bTkRBdXqmgvUHUc?authuser=0&hl=en&rclk=1,"26.909145,75.8234008"
Central Park Mosque,Mosque,"WR36+567 Central Park Mosque, Rambagh, Jaipur, Rajasthan 302007",Rambagh,WR36+567,Jaipur,302007,Rajasthan,IN,https://www.google.com/maps/place/Central+Park+Mosque/data=!4m7!3m6!1s0x396db7214c85ba25:0xb06d21dba6a32c09!8m2!3d26.9034318!4d75.809565!16s%2Fg%2F11qbs8zf89!19sChIJJbqFTCG3bTkRCSyjptshbbA?authuser=0&hl=en&rclk=1,"26.9034318,75.80956499999999"
Masjid Jinnatan,Mosque,"Masjid Jinnatan, 180, Bardia Colony, Kailash Puri, Adarsh Nagar, Jaipur, Rajasthan 302007","Bardia Colony, Kailash Puri, Adarsh Nagar",180,Jaipur,302007,Rajasthan,IN,https://www.google.com/maps/place/Masjid+Jinnatan/data=!4m7!3m6!1s0x396db6b08308f20b:0x313160118830e599!8m2!3d26.9101826!4d75.822029!16s%2Fg%2F11c2n9xtnt!19sChIJC_IIg7C2bTkRmeUwiBFgMTE?authuser=0&hl=en&rclk=1,"26.9101826,75.822029"
"Madina Masjid, Dwarka Puri, Goner Road, Kho Nagoriyan, Jaipur",Mosque,"Madina Masjid, Dwarka Puri, Goner Road, Kho Nagoriyan, Jaipur, 52, Ghati Karolan, Jaipur, Rajasthan 303012",Ghati Karolan,52,Jaipur,303012,Rajasthan,IN,"https://www.google.com/maps/place/Madina+Masjid,+Dwarka+Puri,+Goner+Road,+Kho+Nagoriyan,+Jaipur/data=!4m7!3m6!1s0x396db798cda65957:0x9cf31f765f3d8f9c!8m2!3d26.875167!4d75.8786855!16s%2Fg%2F11ddx6ssdd!19sChIJV1mmzZi3bTkRnI89X3Yf85w?authuser=0&hl=en&rclk=1","26.875166999999998,75.8786855"
Sabuddin Kha Mosque (masjid) Kho Nagoriyan,Mosque,"Sabuddin Kha Mosque (masjid) Kho Nagoriyan, Badli ki dhani, Jagatpura Rd, Kho Nagoriyan, Ghati Karolan, Jaipur, Rajasthan 302031","Kho Nagoriyan, Ghati Karolan","Badli ki dhani, Jagatpura Rd",Jaipur,302031,Rajasthan,IN,https://www.google.com/maps/place/Sabuddin+Kha+Mosque+%28masjid%29+Kho+Nagoriyan/data=!4m7!3m6!1s0x396db775f432c237:0x596b8ca62c3df739!8m2!3d26.8673504!4d75.8719756!16s%2Fg%2F11f6ywlh_k!19sChIJN8Iy9HW3bTkROfc9LKaMa1k?authuser=0&hl=en&rclk=1,"26.8673504,75.8719756"
Pachrang Patti Masjid,Mosque,"Pachrang Patti Masjid, Mohalla, Panch Rang Patti, Bas Badanpura, Jaipur, Rajasthan 302002","Panch Rang Patti, Bas Badanpura",Mohalla,Jaipur,302002,Rajasthan,IN,https://www.google.com/maps/place/Pachrang+Patti+Masjid/data=!4m7!3m6!1s0x396db1d1a33ccf2b:0x697962578a3555a5!8m2!3d26.9305501!4d75.8421228!16s%2Fg%2F11gy9z65p_!19sChIJK888o9GxbTkRpVU1ildieWk?authuser=0&hl=en&rclk=1,"26.930550099999998,75.8421228"
Noorani Masjid,Mosque,"Noorani Masjid, Kama Nagar , Lalwas Ka Bandha Ramgarh Road, Alwar - Jaipur Rd, Kunda, Amer, Jaipur, Rajasthan 302027","Kunda, Amer","Kama Nagar , Lalwas Ka Bandha Ramgarh Road, Alwar - Jaipur Rd",Jaipur,302027,Rajasthan,IN,https://www.google.com/maps/place/Noorani+Masjid/data=!4m7!3m6!1s0x396db088c02a4fad:0x21cfeded0b4d0ce3!8m2!3d26.9699599!4d75.8866201!16s%2Fg%2F11b8_rj65r!19sChIJrU8qwIiwbTkR4wxNC-3tzyE?authuser=0&hl=en&rclk=1,"26.9699599,75.8866201"
Masjid (Mosque),Mosque,"Masjid (Mosque), 3455, Mohalla Handipura, Ramchandra Chaukari, Jaipur, Rajasthan 302002","Mohalla Handipura, Ramchandra Chaukari",3455,Jaipur,302002,Rajasthan,IN,https://www.google.com/maps/place/Masjid+%28Mosque%29/data=!4m7!3m6!1s0x396db1346936965b:0xeccaf0ce5815c837!8m2!3d26.9266391!4d75.8348485!16s%2Fg%2F11c6v5_s2z!19sChIJW5Y2aTSxbTkRN8gVWM7wyuw?authuser=0&hl=en&rclk=1,"26.9266391,75.83484849999999"
Masjid Aksa Pratap Nagar sec 35,Mosque,"Masjid Aksa Pratap Nagar sec 35, 35/327,328, Sector 35, Sanganer, Bambala, Jaipur, Rajasthan 302029","Sector 35, Sanganer, Bambala","35/327,328",Jaipur,302029,Rajasthan,IN,https://www.google.com/maps/place/Masjid+Aksa+Pratap+Nagar+sec+35/data=!4m7!3m6!1s0x396dcb870634a111:0x4731c455bccb211d!8m2!3d26.8005061!4d75.7994457!16s%2Fg%2F11n72x598_!19sChIJEaE0BofLbTkRHSHLvFXEMUc?authuser=0&hl=en&rclk=1,"26.8005061,75.79944569999999"
Miskinshah Masjid,Mosque,"WR6P+7Q8 Miskinshah Masjid, Ghat Gate, Agra Rd, Jaipur, Rajasthan 302003","Amratpuri, Transport Nagar","WR6P+7Q8, Ghat Gate, Agra Rd",Jaipur,302003,Rajasthan,IN,https://www.google.com/maps/place/Miskinshah+Masjid/data=!4m7!3m6!1s0x396db6c5eb06fbbd:0x662e8327e482dfbc!8m2!3d26.9106654!4d75.83695!16s%2Fg%2F1ydpv9lng!19sChIJvfsG68W2bTkRvN-C5CeDLmY?authuser=0&hl=en&rclk=1,"26.9106654,75.83695"
Masjid Vaishali Nagar Jaipur,Mosque,"Masjid Vaishali Nagar Jaipur, 39, Lalarpura, Jaipur, Rajasthan 302034",Lalarpura,39,Jaipur,302034,Rajasthan,IN,https://www.google.com/maps/place/Masjid+Vaishali+Nagar+Jaipur/data=!4m7!3m6!1s0x396db5916724a1cf:0x6cbb67b2bfe7e89c!8m2!3d26.8990101!4d75.7147728!16s%2Fg%2F11rptc7njy!19sChIJz6EkZ5G1bTkRnOjnv7Jnu2w?authuser=0&hl=en&rclk=1,"26.899010099999998,75.71477279999999"
Islamiya Masjid,Mosque,"RQ2X+6Q9 Islamiya Masjid, Sector 35, Sanganer, Pratap Nagar, Jaipur, Rajasthan 302022","Sector 35, Sanganer, Pratap Nagar",RQ2X+6Q9,Jaipur,302022,Rajasthan,IN,https://www.google.com/maps/place/Islamiya+Masjid/data=!4m7!3m6!1s0x396dcb1958c14b09:0xf3763a208cacc381!8m2!3d26.8005321!4d75.7994705!16s%2Fg%2F11pzy8zgc3!19sChIJCUvBWBnLbTkRgcOsjCA6dvM?authuser=0&hl=en&rclk=1,"26.800532099999998,75.7994705"
Moti Masjid,Mosque,"Moti Masjid, 19, Raval Gi Ka Banda, Hasanpura, Jaipur, Rajasthan 302006","Raval Gi Ka Banda, Hasanpura",19,Jaipur,302006,Rajasthan,IN,https://www.google.com/maps/place/Moti+Masjid/data=!4m7!3m6!1s0x396db388a8d3ed2f:0xe9051740e6b26d3a!8m2!3d26.9216!4d75.772379!16s%2Fg%2F11clysz344!19sChIJL-3TqIizbTkROm2y5kAXBek?authuser=0&hl=en&rclk=1,"26.921599999999998,75.772379"
Makka Masjid mkkaa msjid,Mosque,"WQ7F+95V Makka Masjid mkkaa msjid, Unnamed Road, Shiv Colony, Hatwara, Lakshmi Nagar, Jaipur, Rajasthan 302006","Shiv Colony, Hatwara, Lakshmi Nagar","WQ7F+95V, Unnamed Road",Jaipur,302006,Rajasthan,IN,https://www.google.com/maps/place/Makka+Masjid+%E0%A4%AE%E0%A4%95%E0%A5%8D%E0%A4%95%E0%A4%BE+%E0%A4%AE%E0%A4%B8%E0%A5%8D%E0%A4%9C%E0%A4%BF%E0%A4%A6/data=!4m7!3m6!1s0x396db5a70cee6fc3:0x5d34ea5773b59011!8m2!3d26.9134994!4d75.7729372!16s%2Fg%2F11h3ldnx6l!19sChIJw2_uDKe1bTkREZC1c1fqNF0?authuser=0&hl=en&rclk=1,"26.9134994,75.7729372"
Masoudi Masjid Sunni,Mosque,"Masoudi Masjid Sunni, 75A, Laxmi Nagar III, Jagannath Puri, Gopi Nagar, Jhotwara, Jaipur, Rajasthan 302012","Laxmi Nagar III, Jagannath Puri, Gopi Nagar, Jhotwara",75A,Jaipur,302012,Rajasthan,IN,https://www.google.com/maps/place/Masoudi+Masjid+Sunni/data=!4m7!3m6!1s0x396db31cefad85e9:0x7ebf9e2028cb00dc!8m2!3d26.949211!4d75.744202!16s%2Fg%2F11t28bxxsc!19sChIJ6YWt7xyzbTkR3ADLKCCev34?authuser=0&hl=en&rclk=1,"26.949211,75.744202"
Eadgah masjid,Mosque,"Eadgah masjid, 27, Ganga Vihar Colony, Hanuman Nagar, Sanganer, Jaipur, Rajasthan 302029","Ganga Vihar Colony, Hanuman Nagar, Sanganer",27,Jaipur,302029,Rajasthan,IN,https://www.google.com/maps/place/Eadgah+masjid/data=!4m7!3m6!1s0x396dcbd1814dc0d3:0xaf4d5c8a42d321be!8m2!3d26.8095605!4d75.7803603!16s%2Fg%2F11pg9wjt86!19sChIJ08BNgdHLbTkRviHTQopcTa8?authuser=0&hl=en&rclk=1,"26.8095605,75.7803603"
Ahangran Masjid,Mosque,"WR9M+3GQ Ahangran Masjid, Ghat Gate Road, Ramganj bazar Jaipur, Ghat Darwaza Bazar Rd, Ghat Darwaza, Jaipur, Rajasthan 302003","Ghat Gate, Ghat Gate Bazar, Ghat Darwaza","WR9M+3GQ, Ghat Gate Road, Ramganj bazar Jaipur, Ghat Darwaza Bazar Rd",Jaipur,302003,Rajasthan,IN,https://www.google.com/maps/place/Ahangran+Masjid/data=!4m7!3m6!1s0x396db6cbc542199f:0x3e526b231108a18c!8m2!3d26.9177244!4d75.8338514!16s%2Fg%2F11b8_vc3kz!19sChIJnxlCxcu2bTkRjKEIESNrUj4?authuser=0&hl=en&rclk=1,"26.917724399999997,75.8338514"
Jama Masjid,Mosque,"Jama Masjid, main road, 335702, 10 Sarkari, Rajasthan","Panch Batti, C Scheme, Ashok Nagar","main road, 335702","10 Sarkari, Jaipur",,Rajasthan,IN,https://www.google.com/maps/place/Jama+Masjid/data=!4m7!3m6!1s0x396db403d0ffa843:0xf493591dacc9be38!8m2!3d26.9132858!4d75.8034465!16s%2Fg%2F11g8_2l40v!19sChIJQ6j_0AO0bTkROL7JrB1Zk_Q?authuser=0&hl=en&rclk=1,"26.913285799999997,75.80344649999999"
Masjid Hazrat Maulana Ziauddin Sahab,Mosque,"Masjid Hazrat Maulana Ziauddin Sahab, 4407, Mohalla Handipura, Ramchandra Chaukari, Jaipur, Rajasthan 302002","Mohalla Handipura, Ramchandra Chaukari",4407,Jaipur,302002,Rajasthan,IN,https://www.google.com/maps/place/Masjid+Hazrat+Maulana+Ziauddin+Sahab/data=!4m7!3m6!1s0x396db1f31e61f6fb:0x32a3cc11036bc943!8m2!3d26.926228!4d75.835247!16s%2Fg%2F11fpkkmd07!19sChIJ-_ZhHvOxbTkRQ8lrAxHMozI?authuser=0&hl=en&rclk=1,"26.926228,75.835247"
Jama Masjid,Mosque,"VMFX+9JP Jama Masjid, Bhakrota, Jaipur, Rajasthan 302026",Bhakrota,VMFX+9JP,Jaipur,302026,Rajasthan,IN,https://www.google.com/maps/place/Jama+Masjid/data=!4m7!3m6!1s0x396c4b8a3a3c5875:0xb109d77e57655ef1!8m2!3d26.8734666!4d75.6990926!16s%2Fg%2F11jsg8njsx!19sChIJdVg8OopLbDkR8V5lV37XCbE?authuser=0&hl=en&rclk=1,"26.8734666,75.6990926"
Masjid Kheradiyan,Mosque,"Masjid Kheradiyan, KGB Ka Rasta, 5TH CROSSING, Johari Bazar, Jaipur, Rajasthan 302007","5TH CROSSING, Johari Bazar",KGB Ka Rasta,Jaipur,,Rajasthan,IN,https://www.google.com/maps/place/Masjid+Kheradiyan/data=!4m7!3m6!1s0x396db723e58fc2cd:0xf799ef80634bdcf3!8m2!3d26.9164721!4d75.8310726!16s%2Fg%2F11tk03cgsw!19sChIJzcKP5SO3bTkR89xLY4Dvmfc?authuser=0&hl=en&rclk=1,"26.9164721,75.8310726"
