name,main_category,address,address_ward,address_street,address_city,address_postal_code,address_state,address_country_code,link,coordinates
Mosque msjid,Mosque,"WRFF+76G Mosque msjid, Tripolia Bazar, Biseswarji, Jaipur, Rajasthan 302007","Tripolia Bazar, Biseswarji","WRFF+76G, Tripolia Bazar",Jaipur,302007,Rajasthan,IN,https://www.google.com/maps/place/Mosque+%E0%A4%AE%E0%A4%B8%E0%A5%8D%E0%A4%9C%E0%A4%BF%E0%A4%A6/data=!4m7!3m6!1s0x396db11955d52fe9:0xde4cba211966ecc6!8m2!3d26.9231996!4d75.8230666!16s%2Fg%2F11lrrx0wpt!19sChIJ6S_VVRmxbTkRxuxmGSG6TN4?authuser=0&hl=en&rclk=1,"26.9231996,75.82306659999999"
Masjid MI Road,Mosque,"WR88+MP6 Masjid MI Road, Mirza Ismail Rd, Panch Batti, Jayanti Market, Ashok Nagar, Jaipur, Rajasthan 302007","Panch Batti, Jayanti Market, Ashok Nagar","WR88+MP6, Mirza Ismail Rd",Jaipur,,Rajasthan,IN,https://www.google.com/maps/place/Masjid+MI+Road/data=!4m7!3m6!1s0x396db726517920ad:0x1fe3bce221e5d1bf!8m2!3d26.9166647!4d75.8167697!16s%2Fg%2F11t16wlgy1!19sChIJrSB5USa3bTkRv9HlIeK84x8?authuser=0&hl=en&rclk=1,"26.9166647,75.8167697"
moazzama masjid Nahri Ka Naka,Mosque,"WRR6+2P9 moazzama masjid Nahri Ka Naka, Bade Park Ke aage, Bandha Basti, Nahari Ka Naka, Jaipur, Rajasthan 302007","Bandha Basti, Nahari Ka Naka",WRR6+2P9 Bade Park Ke aage,Jaipur,,Rajasthan,IN,https://www.google.com/maps/place/moazzama+masjid+Nahri+Ka+Naka/data=!4m7!3m6!1s0x396db129afd2d72b:0x14ccb0f81103fb40!8m2!3d26.9400482!4d75.8118721!16s%2Fg%2F11jynk2bjd!19sChIJK9fSrymxbTkRQPsDEfiwzBQ?authuser=0&hl=en&rclk=1,"26.9400482,75.8118721"
Masjid E Hassan,Mosque,"Masjid E Hassan, 200 ft, Kalwar Rd, 302012","Jagannath Puri, Udyog Nagar, Jhotwara","200 ft, Kalwar Rd",Jaipur,302012,Rajasthan,IN,https://www.google.com/maps/place/Masjid+E+Hassan/data=!4m7!3m6!1s0x396db3e92add3553:0xd4a976a542b825f4!8m2!3d26.9494785!4d75.7467017!16s%2Fg%2F11hgdpc5jz!19sChIJUzXdKumzbTkR9CW4QqV2qdQ?authuser=0&hl=en&rclk=1,"26.949478499999998,75.7467017"
Munavrah Masjid sheikh manzil,Mosque,"Munavrah Masjid sheikh manzil, Khalil ka chouraha, Nahari Ka Naka, Shastri Nagar, Jaipur, Rajasthan 302016",Shastri Nagar,"Khalil ka chouraha, Nahari Ka Naka",Jaipur,302016,Rajasthan,IN,https://www.google.com/maps/place/Munavrah+Masjid+sheikh+manzil/data=!4m7!3m6!1s0x396db19647f4573b:0x10f6caf8f2cca65d!8m2!3d26.9343131!4d75.8077566!16s%2Fg%2F11fjy3_mg2!19sChIJO1f0R5axbTkRXabM8vjK9hA?authuser=0&hl=en&rclk=1,"26.934313099999997,75.80775659999999"
Masjid,Mosque,"Masjid, 4, Ramesh Marg, C Scheme, Ashok Nagar, Jaipur, Rajasthan 302001","C Scheme, Ashok Nagar","4, Ramesh Marg",Jaipur,302001,Rajasthan,IN,https://www.google.com/maps/place/Masjid/data=!4m7!3m6!1s0x396db5bab0fc154f:0x14cffe626992fa1a!8m2!3d26.9058702!4d75.7945119!16s%2Fg%2F11kq9dgwtb!19sChIJTxX8sLq1bTkRGvqSaWL-zxQ?authuser=0&hl=en&rclk=1,"26.9058702,75.7945119"
Taj Masjid taaj msjid,Mosque,"Taj Masjid taaj msjid, 562, Hida Ki Mori, Hiranwal Mohalla, Topkhana Hazuri, Jaipur, Rajasthan 302004","Hida Ki Mori, Hiranwal Mohalla, Topkhana Hazuri",562,Jaipur,302004,Rajasthan,IN,https://www.google.com/maps/place/Taj+Masjid+%E0%A4%A4%E0%A4%BE%E0%A4%9C+%E0%A4%AE%E0%A4%B8%E0%A5%8D%E0%A4%9C%E0%A4%BF%E0%A4%A6/data=!4m7!3m6!1s0x396db7a163ad7b2f:0x8fabca9b5d772cc8!8m2!3d26.9184511!4d75.8361979!16s%2Fg%2F11sfrw_341!19sChIJL3utY6G3bTkRyCx3XZvKq48?authuser=0&hl=en&rclk=1,"26.9184511,75.8361979"
"Julahon ki masjid,, balji ki kothi ka rasta, ghat gate, jaipur",Mosque,"Julahon ki masjid,, balji ki kothi ka rasta, ghat gate, jaipur, Julahon ki masjid, Ghat Darwaza Bazar Rd, Balji Ki Kothi Ka Rasta, Ghat Gate, Amratpuri, Jaipur","Ghat Gate, Amratpuri, Transport Nagar","Julahon ki masjid, Ghat Darwaza Bazar Rd, Balji Ki Kothi Ka Rasta",Jaipur,,Rajasthan,IN,"https://www.google.com/maps/place/Julahon+ki+masjid,,+balji+ki+kothi+ka+rasta,+ghat+gate,+jaipur/data=!4m7!3m6!1s0x396db7abc6f434b5:0xda7838348411b3ae!8m2!3d26.9140534!4d75.8356404!16s%2Fg%2F11rv3w3n4t!19sChIJtTT0xqu3bTkRrrMRhDQ4eNo?authuser=0&hl=en&rclk=1","26.9140534,75.8356404"
MASJID ABU BAKR (R.A),Mosque,"MASJID ABU BAKR (R.A), 586, Ganpati Nagar, Jaipur, Rajasthan 302006",Ganpati Nagar,586,Jaipur,302006,Rajasthan,IN,https://www.google.com/maps/place/MASJID+ABU+BAKR+%28R.A%29/data=!4m7!3m6!1s0x396db5736963daff:0x57048ce8e51d3430!8m2!3d26.9137757!4d75.7836432!16s%2Fg%2F11rw_gpbtk!19sChIJ_9pjaXO1bTkRMDQd5eiMBFc?authuser=0&hl=en&rclk=1,"26.9137757,75.7836432"
