name,main_category,address,address_ward,address_street,address_city,address_postal_code,address_state,address_country_code,link,coordinates
Jama Masjid Mughalsarai,Mosque,"74J9+QCV Jama Masjid Mughalsarai, Mughalsarai, Uttar Pradesh 232101",,74J9+QCV,Mughalsarai,232101,Uttar Pradesh,IN,https://www.google.com/maps/place/Jama+Masjid+Mughalsarai/data=!4m7!3m6!1s0x398e3ae3c7940095:0x88c2452a672ea19e!8m2!3d25.281994!4d83.1185514!16s%2Fg%2F11cjp7tssx!19sChIJlQCUx-M6jjkRnqEuZypFwog?authuser=0&hl=en&rclk=1,"25.281993999999997,83.1185514"
Minara Masjid Qassab Mohal,Mosque,"74MF+XHP Minara Masjid Qassab Mohal, Mughalsarai, Mughalsarai Railway Settlement, Uttar Pradesh 232101",,74MF+XHP,"Mughalsarai, Mughalsarai Railway Settlement",232101,Uttar Pradesh,IN,https://www.google.com/maps/place/Minara+Masjid+Qassab+Mohal/data=!4m7!3m6!1s0x398e3b1e6757a37d:0x8024068aef6dce52!8m2!3d25.2849656!4d83.1239436!16s%2Fg%2F11r9srt13!19sChIJfaNXZx47jjkRUs5t74oGJIA?authuser=0&hl=en&rclk=1,"25.2849656,83.12394359999999"
Plant Depot masjid,Mosque,"74J2+77H Plant Depot masjid, Mughalsarai Railway Settlement, Uttar Pradesh 232101",,74J2+77H,Mughalsarai Railway Settlement,232101,Uttar Pradesh,IN,https://www.google.com/maps/place/Plant+Depot+masjid/data=!4m7!3m6!1s0x398e3aeccc7d2f95:0xd7541dc6b98e7312!8m2!3d25.2806807!4d83.1007264!16s%2Fg%2F11gf9qqt95!19sChIJlS99zOw6jjkREnOOucYdVNc?authuser=0&hl=en&rclk=1,"25.280680699999998,83.1007264"
Madina Masjid,Mosque,"74V8+FGJ Madina Masjid, Faiz Mohammad Rd, Mughalsarai, Mughalsarai Railway Settlement, Uttar Pradesh 232101",,"74V8+FGJ, Faiz Mohammad Rd","Mughalsarai, Mughalsarai Railway Settlement",232101,Uttar Pradesh,IN,https://www.google.com/maps/place/Madina+Masjid/data=!4m7!3m6!1s0x398e3adc18b84905:0x65dc6ad3f15d8104!8m2!3d25.2937055!4d83.1162648!16s%2Fg%2F11clsm_lgz!19sChIJBUm4GNw6jjkRBIFd8dNq3GU?authuser=0&hl=en&rclk=1,"25.293705499999998,83.1162648"
Saiyadna Umar Farooq R.A. Markazi Masjid and Madarsa,Mosque,"74MC+MVJ Saiyadna Umar Farooq R.A. Markazi Masjid and Madarsa, Kassab Mohal Rd, Mughalsarai, Mughalsarai Railway Settlement, Uttar Pradesh 232101",,"74MC+MVJ, Kassab Mohal Rd","Mughalsarai, Mughalsarai Railway Settlement",232101,Uttar Pradesh,IN,https://www.google.com/maps/place/Saiyadna+Umar+Farooq+R.A.+Markazi+Masjid+and+Madarsa/data=!4m7!3m6!1s0x398e3b1e021a14d1:0xea297bc52260e8e0!8m2!3d25.2842043!4d83.1221268!16s%2Fg%2F1hdz027sz!19sChIJ0RQaAh47jjkR4OhgIsV7Keo?authuser=0&hl=en&rclk=1,"25.2842043,83.12212679999999"
Jama Masjid islampur,Mosque,"74C7+PC9 Jama Masjid islampur, Mughalsarai, Uttar Pradesh 232101",,74C7+PC9,Mughalsarai,232101,Uttar Pradesh,IN,https://www.google.com/maps/place/Jama+Masjid+islampur/data=!4m7!3m6!1s0x398e3afa2ea8bfcd:0x16145d0915aa0080!8m2!3d25.2717846!4d83.1136107!16s%2Fg%2F11rvt1q92!19sChIJzb-oLvo6jjkRgACqFQldFBY?authuser=0&hl=en&rclk=1,"25.2717846,83.1136107"
Sani Masjid msjd,Mosque,"7496+HH5 Sani Masjid msjd, Parshurampur, Mughalsarai, Uttar Pradesh 232101",Parshurampur,7496+HH5,Mughalsarai,232101,Uttar Pradesh,IN,https://www.google.com/maps/place/Sani+Masjid+%D9%85%D8%B3%D8%AC%D8%AF%E2%80%AD/data=!4m7!3m6!1s0x398e3af9d71d09e3:0xbc0a00a0cacea791!8m2!3d25.2688889!4d83.11149!16s%2Fg%2F1hf2l4b2b!19sChIJ4wkd1_k6jjkRkafOyqAACrw?authuser=0&hl=en&rclk=1,"25.2688889,83.11148999999999"
Muslim Mahal,Mosque,"74QF+9GF Muslim Mahal, KashaiMahal Rd, Mughalsarai, Mughalsarai Railway Settlement, Uttar Pradesh 232101",,"74QF+9GF, KashaiMahal Rd","Mughalsarai, Mughalsarai Railway Settlement",232101,Uttar Pradesh,IN,https://www.google.com/maps/place/Muslim+Mahal/data=!4m7!3m6!1s0x398e3b1f91354ebb:0x5baeba844c0d267e!8m2!3d25.2884286!4d83.123786!16s%2Fg%2F11c52p3nwq!19sChIJu041kR87jjkRfiYNTIS6rls?authuser=0&hl=en&rclk=1,"25.2884286,83.123786"
Jama masjid pathra,Mosque,"74W7+7MG Jama masjid pathra, Mughalsarai, Mughalsarai Railway Settlement, Uttar Pradesh 232101",,74W7+7MG,"Mughalsarai, Mughalsarai Railway Settlement",232101,Uttar Pradesh,IN,https://www.google.com/maps/place/Jama+masjid+pathra/data=!4m7!3m6!1s0x398e3b2723010fd7:0xd2a616961efa360c!8m2!3d25.2956994!4d83.114201!16s%2Fg%2F11st_gt771!19sChIJ1w8BIyc7jjkRDDb6HpYWptI?authuser=0&hl=en&rclk=1,"25.2956994,83.114201"
Gausiya Masjid,Mosque,"74GQ+H2V Gausiya Masjid, Alinagar, Mughalsarai, Uttar Pradesh 232101",,74GQ+H2V,"Alinagar, Mughalsarai",232101,Uttar Pradesh,IN,https://www.google.com/maps/place/Gausiya+Masjid/data=!4m7!3m6!1s0x398e3b0c44ac15df:0x86160fcf7b4bd1ef!8m2!3d25.2764811!4d83.1375474!16s%2Fg%2F11f3n1m8cn!19sChIJ3xWsRAw7jjkR79FLe88PFoY?authuser=0&hl=en&rclk=1,"25.276481099999998,83.1375474"
Ghousia Masjid,Mosque,"74QF+8HF Ghousia Masjid, Hanuman Pur, Muslim Mahal, Mughalsarai Railway Settlement, Uttar Pradesh 232101","Hanuman Pur, Muslim Mahal",74QF+8HF,Mughalsarai Railway Settlement,,Uttar Pradesh,IN,https://www.google.com/maps/place/Ghousia+Masjid/data=!4m7!3m6!1s0x398e3b60e607fd55:0x77dc25a6a5cfa85!8m2!3d25.2883041!4d83.1239185!16s%2Fg%2F11gxr4btp_!19sChIJVf0H5mA7jjkRhfpcalrCfQc?authuser=0&hl=en&rclk=1,"25.288304099999998,83.1239185"
Jama Masjid Mughalchak Alinagar,Mosque,"74GM+CWV Jama Masjid Mughalchak Alinagar, Alinagar Rd, Awajapur, Mughalsarai, Uttar Pradesh 232101",Awajapur,"74GM+CWV, Alinagar Rd",Mughalsarai,232101,Uttar Pradesh,IN,https://www.google.com/maps/place/Jama+Masjid+Mughalchak+Alinagar/data=!4m7!3m6!1s0x398e3bf872a2569b:0x9111a4f9d14b8c28!8m2!3d25.2761237!4d83.1347828!16s%2Fg%2F11f7b_61q_!19sChIJm1aicvg7jjkRKIxL0fmkEZE?authuser=0&hl=en&rclk=1,"25.2761237,83.1347828"
Jama Masjid,Mosque,"74F8+RRR Jama Masjid, Loco Colony, Mughalsarai, Uttar Pradesh 232101",Loco Colony,74F8+RRR,Mughalsarai,232101,Uttar Pradesh,IN,https://www.google.com/maps/place/Jama+Masjid/data=!4m7!3m6!1s0x398e3afc80cb3335:0xe758890671a9df42!8m2!3d25.2746221!4d83.1170078!16s%2Fg%2F11c2ls8gx9!19sChIJNTPLgPw6jjkRQt-pcQaJWOc?authuser=0&hl=en&rclk=1,"25.2746221,83.1170078"
Masjid E Raza,Mosque,"7496+Q8Q Masjid E Raza, Parshurampur, Mughalsarai, Uttar Pradesh 232101",Parshurampur,7496+Q8Q,Mughalsarai,232101,Uttar Pradesh,IN,https://www.google.com/maps/place/Masjid+E+Raza/data=!4m7!3m6!1s0x398e3baf9be78759:0x68e497a52237353f!8m2!3d25.2694582!4d83.1108458!16s%2Fg%2F11h24shfg9!19sChIJWYfnm687jjkRPzU3IqWX5Gg?authuser=0&hl=en&rclk=1,"25.2694582,83.11084579999999"
GHARIB NAWAZ MOSQUE,Mosque,"74PC+FFG GHARIB NAWAZ MOSQUE, Shahkuti, Mughalsarai, Uttar Pradesh",,"74PC+FFG, Shahkuti","Mughalsarai, Mughalsarai Railway Settlement",,Uttar Pradesh,IN,https://www.google.com/maps/place/GHARIB+NAWAZ+MOSQUE/data=!4m7!3m6!1s0x398e3ae1cdc7d31b:0xaccf0276fe903184!8m2!3d25.2861836!4d83.1212131!16s%2Fg%2F11gc5vmtsz!19sChIJG9PHzeE6jjkRhDGQ_nYCz6w?authuser=0&hl=en&rclk=1,"25.286183599999998,83.12121309999999"
Masjid,Mosque,"74W2+372 Masjid, Mughalsarai Railway Settlement, Uttar Pradesh 232101",,74W2+372,Mughalsarai Railway Settlement,232101,Uttar Pradesh,IN,https://www.google.com/maps/place/Masjid/data=!4m7!3m6!1s0x398e3bcba636430d:0x8fccb4f9d3ee193f!8m2!3d25.295146!4d83.100636!16s%2Fg%2F11jhwmcyhc!19sChIJDUM2pss7jjkRPxnu0_m0zI8?authuser=0&hl=en&rclk=1,"25.295146,83.100636"
Masjid,Mosque,"74G4+HJG Masjid, Siktiya, Parshurampur, Mughalsarai, Pradesh 232101",Parshurampur,"74G4+HJG, Siktiya","Mughalsarai, Mughalsarai Railway Settlement",Pradesh 232101,Uttar Pradesh,IN,https://www.google.com/maps/place/Masjid/data=!4m7!3m6!1s0x398e3ba4761529ff:0x2e23639501254b32!8m2!3d25.2764327!4d83.1065908!16s%2Fg%2F11p0grfwq7!19sChIJ_ykVdqQ7jjkRMkslAZVjIy4?authuser=0&hl=en&rclk=1,"25.276432699999997,83.10659079999999"
Taju Sariya Masjid,Mosque,"74Q3+7RV Taju Sariya Masjid, Mughalsarai Railway Settlement, Uttar Pradesh 232101",,74Q3+7RV,Mughalsarai Railway Settlement,232101,Uttar Pradesh,IN,https://www.google.com/maps/place/Taju+Sariya+Masjid/data=!4m7!3m6!1s0x398e3b0b44099383:0x7ec11eee6f352181!8m2!3d25.288227!4d83.1045602!16s%2Fg%2F11kqc4v7q8!19sChIJg5MJRAs7jjkRgSE1b-4ewX4?authuser=0&hl=en&rclk=1,"25.288227,83.1045602"
YouTube Channel,Mosque,"YouTube Channel, Fazz mohamad parahup, Jaiswal School, parahupur, pathra road, Mughalsarai, Uttar Pradesh 232101",Patel Nagar,"Fazz mohamad parahup, Jaiswal School, parahupur, pathra road","Mughalsarai, Mughalsarai Railway Settlement",232101,Uttar Pradesh,IN,https://www.google.com/maps/place/YouTube+Channel/data=!4m7!3m6!1s0x398e3b5ed0c47841:0x7e880b35a76e3b62!8m2!3d25.290734!4d83.1187809!16s%2Fg%2F11q2tngpch!19sChIJQXjE0F47jjkRYjtupzULiH4?authuser=0&hl=en&rclk=1,"25.290734,83.11878089999999"
Masjid siktiya,Mosque,"74G4+HJG Masjid siktiya, Siktiya parsurampur Mughalsarai ChandauliUttar Pradesh, 232101",,"74G4+HJG, Siktiya parsurampur Mughalsarai ChandauliUttar Pradesh","Mughalsarai Railway Settlement, Mughalsarai",232101,Uttar Pradesh,IN,https://www.google.com/maps/place/Masjid+siktiya/data=!4m7!3m6!1s0x398e3b2da3043f65:0x6a9667f841903b96!8m2!3d25.2764362!4d83.1065914!16s%2Fg%2F11rxmd40fc!19sChIJZT8Eoy07jjkRljuQQfhnlmo?authuser=0&hl=en&rclk=1,"25.2764362,83.1065914"
