name,main_category,address,address_ward,address_street,address_city,address_postal_code,address_state,address_country_code,link,coordinates
Jama Masjid (Okhla),Mosque,"Jama Masjid (Okhla), 21/4,Okhla Bazar, Okhla Main Market Rd, Jamia Nagar, Okhla Village, Okhla, New Delhi, Delhi 110025","Jamia Nagar, Okhla Village, Okhla","21/4,Okhla Bazar, Okhla Main Market Rd",New Delhi,110025,Delhi,IN,https://www.google.com/maps/place/Jama+Masjid+%28Okhla%29/data=!4m7!3m6!1s0x390ce474e657e7f9:0x9680577c25554efa!8m2!3d28.5631627!4d77.2900565!16s%2Fg%2F1tk6ywjp!19sChIJ-edX5nTkDDkR-k5VJXxXgJY?authuser=0&hl=en&rclk=1,"28.5631627,77.29005649999999"
Masjid Mujeeb Bagh,Mosque,"H74R+R4J Masjid Mujeeb Bagh, Mujeeb Bagh, Jamia Nagar, Okhla, New Delhi, Delhi 110025","Mujeeb Bagh, Jamia Nagar, Okhla",H74R+R4J,New Delhi,110025,Delhi,IN,https://www.google.com/maps/place/Masjid+Mujeeb+Bagh/data=!4m7!3m6!1s0x390ce40bc79e1ce9:0x18ab01f5fdcf10b3!8m2!3d28.5570856!4d77.2902574!16s%2Fg%2F11hbvrlrnj!19sChIJ6RyexwvkDDkRsxDP_fUBqxg?authuser=0&hl=en&rclk=1,"28.557085599999997,77.2902574"
Jama Masjid Jamia,Mosque,"H77M+9CQ Jama Masjid Jamia, Jamia Jama Masjid Rd, Jamia Nagar, Okhla, New Delhi, Delhi 110025","Jamia Nagar, Okhla","H77M+9CQ, Jamia Jama Masjid Rd",New Delhi,110025,Delhi,IN,https://www.google.com/maps/place/Jama+Masjid+Jamia/data=!4m7!3m6!1s0x390ce329e5e9fe39:0xfdadee6422dd6abd!8m2!3d28.5634592!4d77.2836065!16s%2Fg%2F11fnyd14qm!19sChIJOf7p5SnjDDkRvWrdImTurf0?authuser=0&hl=en&rclk=1,"28.563459199999997,77.28360649999999"
"Ghausia Masjid, Jasola",Mosque,"Ghausia Masjid, Jasola, 171, Jasola, Jasola Vihar, New Delhi, Delhi 110025","Jasola, Jasola Vihar",171,New Delhi,110025,Delhi,IN,"https://www.google.com/maps/place/Ghausia+Masjid,+Jasola/data=!4m7!3m6!1s0x390ce5c200a37205:0xfebb591e8a3c8619!8m2!3d28.5488829!4d77.2921906!16s%2Fg%2F11nl7bc3f7!19sChIJBXKjAMLlDDkRGYY8ih5Zu_4?authuser=0&hl=en&rclk=1","28.5488829,77.2921906"
Tayyab Masjid,Mosque,"Tayyab Masjid, Rose Apartment c-310/311, abulfazal enclave , THOKAR no.08, Shaheen Bagh, Jamia Nagar, Jasola, New Delhi, Delhi 110025","Shaheen Bagh, Jamia Nagar, Jasola","Rose Apartment c-310/311, abulfazal enclave , THOKAR no.08",New Delhi,110025,Delhi,IN,https://www.google.com/maps/place/Tayyab+Masjid/data=!4m7!3m6!1s0x390ce41be7fa0e79:0xf5aab92c434b57cd!8m2!3d28.5468755!4d77.3030481!16s%2Fg%2F124yqskq9!19sChIJeQ765xvkDDkRzVdLQyy5qvU?authuser=0&hl=en&rclk=1,"28.5468755,77.3030481"
Mohammadi Masjid,Mosque,"G7XX+C4X Mohammadi Masjid, Shaheen Bagh, Block E, Jamia Nagar, Okhla, New Delhi, Delhi 110025","Shaheen Bagh, Block E, Jamia Nagar, Okhla",G7XX+C4X,New Delhi,110025,Delhi,IN,https://www.google.com/maps/place/Mohammadi+Masjid/data=!4m7!3m6!1s0x390ce41acd709b67:0x8df25e5235479b77!8m2!3d28.5486052!4d77.2978715!16s%2Fg%2F11cp1893xh!19sChIJZ5twzRrkDDkRd5tHNVJe8o0?authuser=0&hl=en&rclk=1,"28.548605199999997,77.2978715"
Jama Masjid (Shaheen Bagh),Mosque,"Jama Masjid (Shaheen Bagh), 12, Kalindi Kunj Rd, Block B, Jamia Nagar, Jasola, New Delhi, Delhi 110025","Block B, Jamia Nagar, Jasola","12, Kalindi Kunj Rd",New Delhi,110025,Delhi,IN,https://www.google.com/maps/place/Jama+Masjid+%28Shaheen+Bagh%29/data=!4m7!3m6!1s0x390ce41a3d9d581b:0xc7b0e62465b11de9!8m2!3d28.5496905!4d77.3028252!16s%2Fg%2F11g7p2t2hd!19sChIJG1idPRrkDDkR6R2xZSTmsMc?authuser=0&hl=en&rclk=1,"28.549690499999997,77.3028252"
Masjid Faizane Ghausia and Madarsa,Mosque,"Masjid Faizane Ghausia and Madarsa, D-100, Maulana Azad Rd, Shaheen Bagh, Jamia Nagar, Okhla, New Delhi, Delhi 110025","Shaheen Bagh, Jamia Nagar, Okhla","D-100, Maulana Azad Rd",New Delhi,110025,Delhi,IN,https://www.google.com/maps/place/Masjid+Faizane+Ghausia+and+Madarsa/data=!4m7!3m6!1s0x390ce41ba6415db1:0xa9911783ddc9514d!8m2!3d28.5472543!4d77.3012896!16s%2Fg%2F11b6pk_b3y!19sChIJsV1BphvkDDkRTVHJ3YMXkak?authuser=0&hl=en&rclk=1,"28.5472543,77.30128959999999"
Masjid Usman Bin Affan (Ahle Hadees),Mosque,"H79Q+632 Masjid Usman Bin Affan (Ahle Hadees), Sir Syed Rd, Batla House, Jamia Nagar, Okhla, New Delhi, Delhi 110025","Batla House, Jamia Nagar, Okhla","H79Q+632, Sir Syed Rd",New Delhi,110025,Delhi,IN,https://www.google.com/maps/place/Masjid+Usman+Bin+Affan+%28Ahle+Hadees%29/data=!4m7!3m6!1s0x390ce47613e5e5e7:0xe09f490ec8e1eae2!8m2!3d28.5680023!4d77.2876355!16s%2Fg%2F11g68z41w3!19sChIJ5-XlE3bkDDkR4urhyA5Jn-A?authuser=0&hl=en&rclk=1,"28.5680023,77.2876355"
Nisar Masjid,Mosque,"Nisar Masjid, Block F, Allama Shibli Nomani Road, Shaheen Bagh, Okhla, New Delhi, Delhi 110025","Shaheen Bagh, Okhla","Block F, Allama Shibli Nomani Road",New Delhi,110025,Delhi,IN,https://www.google.com/maps/place/Nisar+Masjid/data=!4m7!3m6!1s0x390ce41c8c57650b:0x3a50c11b9ffca255!8m2!3d28.5440829!4d77.300487!16s%2Fg%2F11b6wdw3zz!19sChIJC2VXjBzkDDkRVaL8nxvBUDo?authuser=0&hl=en&rclk=1,"28.5440829,77.30048699999999"
Madni Masjid under Delhi Wakaf,Mosque,"Madni Masjid under Delhi Wakaf, Aravali Apartments, near, Alaknanda, New Delhi, Delhi 110019",Alaknanda,"Aravali Apartments, near",New Delhi,110019,Delhi,IN,https://www.google.com/maps/place/Madni+Masjid+under+Delhi+Wakaf/data=!4m7!3m6!1s0x390ce16350f7e38f:0xa1c7701e04aad5f2!8m2!3d28.5296762!4d77.252511!16s%2Fg%2F1q67vgk8s!19sChIJj-P3UGPhDDkR8tWqBB5wx6E?authuser=0&hl=en&rclk=1,"28.529676199999997,77.252511"
Nurani Masjid msjd nwrny,Mosque,"Nurani Masjid msjd nwrny, 110062, Block G 12, Block G 1, Talimabad, Sangam Vihar, New Delhi, Delhi 110062","Block G 12, Block G 1, Talimabad, Sangam Vihar",110062,New Delhi,110062,Delhi,IN,https://www.google.com/maps/place/Nurani+Masjid+%D9%85%D8%B3%D8%AC%D8%AF+%D9%86%D9%88%D8%B1%D8%A7%D9%86%DB%8C%E2%80%AD/data=!4m7!3m6!1s0x390ce111696bf857:0xfeca9714a645d6b6!8m2!3d28.5055667!4d77.2560729!16s%2Fg%2F11c5_5fpyv!19sChIJV_hraRHhDDkRttZFphSXyv4?authuser=0&hl=en&rclk=1,"28.5055667,77.25607289999999"
Jam'a Masjid Muhammadi (Badi Masjid),Mosque,"Jam'a Masjid Muhammadi (Badi Masjid), Open 24*365, From 'Fajr' Prayer to 'Isha' Prayer), Phase 2, i, Nangloi, Delhi, 110041","Block A, JJ Colony No 2, Nangloi","Open 24*365, From 'Fajr' Prayer to 'Isha' Prayer), Phase 2, i",Delhi,110041,Delhi,IN,https://www.google.com/maps/place/Jam%27a+Masjid+Muhammadi+%28Badi+Masjid%29/data=!4m7!3m6!1s0x390d0431466b1907:0x27ba04939e7e31f6!8m2!3d28.6839018!4d77.0633588!16s%2Fg%2F11bx6v55xw!19sChIJBxlrRjEEDTkR9jF-npMEuic?authuser=0&hl=en&rclk=1,"28.683901799999997,77.0633588"
Masjid Alishan `lyshn msjd,Mosque,"H74P+4C2 Masjid Alishan `lyshn msjd, Ajmal Bagh, Noor Nagar Extn I, Noor Nagar, Okhla, New Delhi, Delhi 110025","Ajmal Bagh, Noor Nagar Extn I, Noor Nagar, Okhla",H74P+4C2,New Delhi,110025,Delhi,IN,https://www.google.com/maps/place/Masjid+Alishan+%D8%B9%D8%A7%D9%84%DB%8C%D8%B4%D8%A7%D9%86+%D9%85%D8%B3%D8%AC%D8%AF%E2%80%AD/data=!4m7!3m6!1s0x390ce3f602454533:0xcfc3736868fe546a!8m2!3d28.5552743!4d77.2860168!16s%2Fg%2F1ptvvnp64!19sChIJM0VFAvbjDDkRalT-aGhzw88?authuser=0&hl=en&rclk=1,"28.555274299999997,77.2860168"
Mohammadi Masjid,Mosque,"M7JC+4R2 Mohammadi Masjid, Chauhan Banger, Shahdara, Delhi, 110031","Chauhan Banger, Shahdara",M7JC+4R2,Delhi,110031,Delhi,IN,https://www.google.com/maps/place/Mohammadi+Masjid/data=!4m7!3m6!1s0x390cfc647f925475:0xea73bafddc2f968a!8m2!3d28.6802653!4d77.2720261!16s%2Fg%2F1tfldmh_!19sChIJdVSSf2T8DDkRipYv3P26c-o?authuser=0&hl=en&rclk=1,"28.6802653,77.27202609999999"
Jama masjid,Mosque,"Jama masjid, Metro station, Giri Nagar, Maa Anandmayee Marg, near Govindpuri, Kalkaji, New Delhi, Delhi 110019","Ami Chand Khand, Block AC, Giri Nagar, Kalkaji","Metro station, Giri Nagar, Maa Anandmayee Marg, near Govindpuri",New Delhi,110019,Delhi,IN,https://www.google.com/maps/place/Jama+masjid/data=!4m7!3m6!1s0x390ce3915ddf4023:0xc0785bd0f9e63fa0!8m2!3d28.5435534!4d77.2644385!16s%2Fg%2F11fj32cs9z!19sChIJI0DfXZHjDDkRoD_m-dBbeMA?authuser=0&hl=en&rclk=1,"28.5435534,77.2644385"
Jama Masjid (Batla House),Mosque,"H, Jama Masjid (Batla House), 334, 7, Street Number 6, Batla House, Okhla, New Delhi, Delhi 110025","Jamia, Batla House, Jamia Nagar, Okhla","H, 334, 7, Street Number 6",New Delhi,110025,Delhi,IN,https://www.google.com/maps/place/Jama+Masjid+%28Batla+House%29/data=!4m7!3m6!1s0x390ce3207d46fe8f:0xe6bf4d1a3f6d4108!8m2!3d28.5661636!4d77.2851632!16s%2Fg%2F11llyqcllh!19sChIJj_5GfSDjDDkRCEFtPxpNv-Y?authuser=0&hl=en&rclk=1,"28.5661636,77.2851632"
Ahle Sunnat wal jamaat RazaeMuhammadi Masjid,Mosque,"J6X8+JC2 Ahle Sunnat wal jamaat RazaeMuhammadi Masjid, Aram Nagar, Paharganj, New Delhi, Delhi 110055","Aram Nagar, Paharganj",J6X8+JC2,New Delhi,110055,Delhi,IN,https://www.google.com/maps/place/Ahle+Sunnat+wal+jamaat+RazaeMuhammadi+Masjid/data=!4m7!3m6!1s0x390cfd6b1c55570b:0xb6cbdaabca9cc6b2!8m2!3d28.6490022!4d77.2160178!16s%2Fg%2F11g6mj_5x9!19sChIJC1dVHGv9DDkRssacyqvay7Y?authuser=0&hl=en&rclk=1,"28.649002199999998,77.2160178"
Tayyiba Masjid,Mosque,"H79J+768 Tayyiba Masjid, Street Number 12, Jogabai Extension, Zakir Nagar, Okhla, New Delhi, Delhi 110025","Jogabai Extension, Zakir Nagar, Okhla","H79J+768, Street Number 12",New Delhi,110025,Delhi,IN,https://www.google.com/maps/place/Tayyiba+Masjid/data=!4m7!3m6!1s0x390ce38ec9213115:0xab7c6b478fb01bca!8m2!3d28.5681551!4d77.2805765!16s%2Fg%2F11f39nzy8x!19sChIJFTEhyY7jDDkRyhuwj0drfKs?authuser=0&hl=en&rclk=1,"28.5681551,77.2805765"
Jannatul Firdose Masjid msjd jn@lfrdws,Mosque,"G8J6+H6X Jannatul Firdose Masjid msjd jn@lfrdws, Madanpur Khadar Extension, Block A, Madanpur Khadar, New Delhi, Delhi 110076","Madanpur Khadar Extension, Block A, Madanpur Khadar",G8J6+H6X,New Delhi,110076,Delhi,IN,https://www.google.com/maps/place/Jannatul+Firdose+Masjid+%D9%85%D8%B3%D8%AC%D8%AF+%D8%AC%D9%86%D8%A9%D8%A7%D9%84%D9%81%D8%B1%D8%AF%D9%88%D8%B3%E2%80%AD/data=!4m7!3m6!1s0x390ce698614a56a5:0x1c3fad641cabab20!8m2!3d28.5314784!4d77.3106246!16s%2Fg%2F11dybr1nt3!19sChIJpVZKYZjmDDkRIKurHGStPxw?authuser=0&hl=en&rclk=1,"28.531478399999997,77.3106246"
Mehboo e Elahi Masjid msjd mHbwbi lhy,Mosque,"Mehboo e Elahi Masjid msjd mHbwbi lhy, 337A, Gali Number 12, Block G, Talimabad, Sangam Vihar, New Delhi, Delhi 110080","Block G, Talimabad, Sangam Vihar","337A, Gali Number 12",New Delhi,110080,Delhi,IN,https://www.google.com/maps/place/Mehboo+e+Elahi+Masjid+%D9%85%D8%B3%D8%AC%D8%AF+%D9%85%D8%AD%D8%A8%D9%88%D8%A8%D9%90+%D8%A7%D9%84%D9%B0%DB%81%DB%8C%E2%80%AD/data=!4m7!3m6!1s0x390ce1117bd6badd:0xebb2a755e5d86cc5!8m2!3d28.5059839!4d77.2552619!16s%2Fg%2F11hcx9jlc5!19sChIJ3brWexHhDDkRxWzY5VWnsus?authuser=0&hl=en&rclk=1,"28.5059839,77.2552619"
Nurani Masjid,Mosque,"G87P+9FG Nurani Masjid, Shamshul Marg, Jaitpur Extension Part II, Khadda Colony, Badarpur, New Delhi, Delhi 110044","Jaitpur Extension Part II, Khadda Colony, Badarpur","G87P+9FG, Shamshul Marg",New Delhi,110044,Delhi,IN,https://www.google.com/maps/place/Nurani+Masjid/data=!4m7!3m6!1s0x390ce65930824353:0xc2da84d501d29ac9!8m2!3d28.5134438!4d77.3362129!16s%2Fg%2F11bv1cg3ng!19sChIJU0OCMFnmDDkRyZrSAdWE2sI?authuser=0&hl=en&rclk=1,"28.513443799999997,77.33621289999999"
"Rabbani Masjid, J-1st-Block",Mosque,"Block J, Rabbani Masjid, J-1st-Block, 1, Gali Number 4, Block J 2, & 5, Sangam Vihar, New Delhi, Delhi 110080","Block J 2, & 5, Sangam Vihar","Block J, 1, Gali Number 4",New Delhi,110080,Delhi,IN,"https://www.google.com/maps/place/Rabbani+Masjid,+J-1st-Block/data=!4m7!3m6!1s0x390ce10729d85b21:0x1415c52c3b7ba793!8m2!3d28.4943857!4d77.2433794!16s%2Fg%2F11g8p033rb!19sChIJIVvYKQfhDDkRk6d7OyzFFRQ?authuser=0&hl=en&rclk=1","28.4943857,77.2433794"
Gamri Masjid,Mosque,"M7W5+28Q Gamri Masjid, Block C, Ghonda, Shahdara, Delhi, 110053","Block C, Ghonda, Shahdara",M7W5+28Q,Delhi,110053,Delhi,IN,https://www.google.com/maps/place/Gamri+Masjid/data=!4m7!3m6!1s0x390cfc40b0e90e23:0xdc05ec9941f77101!8m2!3d28.6950901!4d77.258353!16s%2Fg%2F11b8_w48n7!19sChIJIw7psED8DDkRAXH3QZnsBdw?authuser=0&hl=en&rclk=1,"28.695090099999998,77.258353"
Musallah an Nabi,Mosque,"G8W2+6VP Musallah an Nabi, Block C, Jasola, New Delhi, Delhi 110025","Block C, Jasola",G8W2+6VP,New Delhi,110025,Delhi,IN,https://www.google.com/maps/place/Musallah+an+Nabi/data=!4m7!3m6!1s0x390ce41b8bca8467:0xe8bb5830b58fafd0!8m2!3d28.5455873!4d77.3021979!16s%2Fg%2F11gblbll20!19sChIJZ4TKixvkDDkR0K-PtTBYu-g?authuser=0&hl=en&rclk=1,"28.545587299999998,77.3021979"
Mohammadi Masjid,Mosque,"Mohammadi Masjid, block - c , gali no. 12 , shiv vihar part 2, Ismailpur Rd, Ekta Vihar, Basantpur, Faridabad, Delhi 121003","Ekta Vihar, Basantpur","block - c , gali no. 12 , shiv vihar part 2, Ismailpur Rd","Faridabad, New Delhi",121003,Delhi,IN,https://www.google.com/maps/place/Mohammadi+Masjid/data=!4m7!3m6!1s0x390ce65691d77451:0x37e5a2edf0d4bd81!8m2!3d28.5035617!4d77.3360423!16s%2Fg%2F12hmr57km!19sChIJUXTXkVbmDDkRgb3U8O2i5Tc?authuser=0&hl=en&rclk=1,"28.5035617,77.3360423"
Madani Masjid,Mosque,"P886+FCR Madani Masjid, Radha Vihar, Village Mandoli, Delhi, 201102","Radha Vihar, Mandoli","P886+FCR, Radha Vihar, Village Mandoli",Delhi,201102,Uttar Pradesh,IN,https://www.google.com/maps/place/Madani+Masjid/data=!4m7!3m6!1s0x390cfbddbd142d67:0x91ffbc86707dab8!8m2!3d28.7162291!4d77.311013!16s%2Fg%2F11g8ky0m_1!19sChIJZy0Uvd37DDkRuNoHZ8j7Hwk?authuser=0&hl=en&rclk=1,"28.7162291,77.311013"
Masjid-e-Mustafa msjd  mSTf,Mosque,"Masjid-e-Mustafa msjd  mSTf, B-377, Hind Vihar, Sharda Vats Enclave, Prem Nagar III, Mundka, Delhi, 110081","Hind Vihar, Sharda Vats Enclave, Prem Nagar III, Mundka",B-377,Delhi,110081,Delhi,IN,https://www.google.com/maps/place/Masjid-e-Mustafa+%D9%85%D8%B3%D8%AC%D8%AF+%D8%A1+%D9%85%D8%B5%D8%B7%D9%81%D8%A7%E2%80%AD/data=!4m7!3m6!1s0x390d05d0425cb661:0x21b131c90f771975!8m2!3d28.6891672!4d77.0465112!16s%2Fg%2F11b_2n0bn_!19sChIJYbZcQtAFDTkRdRl3D8kxsSE?authuser=0&hl=en&rclk=1,"28.6891672,77.0465112"
munawwara mosque mszid,Mosque,"P2R7+29V munawwara mosque mszid, Udhan Pana, Delhi, 110081",Udhan Pana,P2R7+29V,Delhi,110081,Delhi,IN,https://www.google.com/maps/place/munawwara+mosque+%E0%A4%AE%E0%A4%B8%E0%A5%8D%E0%A5%9B%E0%A4%BF%E0%A4%A6/data=!4m7!3m6!1s0x390d062b20d9544b:0xad5b1d0f78254db2!8m2!3d28.7401215!4d77.0134225!16s%2Fg%2F11hbqv4v8t!19sChIJS1TZICsGDTkRsk0leA8dW60?authuser=0&hl=en&rclk=1,"28.740121499999997,77.01342249999999"
Madeena Masjid,Mosque,"Madeena Masjid, Street Number 8, Centre for Management Studies Road, Ghaffar Manzil Colony, Jamia Nagar, Okhla, New Delhi, Delhi 110025","Ghaffar Manzil Colony, Jamia Nagar, Okhla","Street Number 8, Centre for Management Studies Road",New Delhi,110025,Delhi,IN,https://www.google.com/maps/place/Madeena+Masjid/data=!4m7!3m6!1s0x390ce3f43c3f5911:0x8d4cf8bf1ef7fd09!8m2!3d28.5559668!4d77.2825118!16s%2Fg%2F12hlhdp1b!19sChIJEVk_PPTjDDkRCf33Hr_4TI0?authuser=0&hl=en&rclk=1,"28.5559668,77.2825118"
Masjid E Hassnain,Mosque,"X2VW+6P6 Masjid E Hassnain, Manvi, Karnataka 584123",,X2VW+6P6,Manvi,584123,Karnataka,IN,https://www.google.com/maps/place/Masjid+E+Hassnain/data=!4m7!3m6!1s0x3bb7d0573a2c1905:0x18e710c220b33618!8m2!3d15.9930384!4d77.0467591!16s%2Fg%2F11c0qgls3f!19sChIJBRksOlfQtzsRGDazIMIQ5xg?authuser=0&hl=en&rclk=1,"15.9930384,77.0467591"
Masjid Ghaffar (Ahl-e-Hadees),Mosque,"Masjid Ghaffar (Ahl-e-Hadees), P-102, Block P, Batla House, Okhla, New Delhi, Delhi 110025","Block P, Batla House, Okhla",P-102,New Delhi,110025,Delhi,IN,https://www.google.com/maps/place/Masjid+Ghaffar+%28Ahl-e-Hadees%29/data=!4m7!3m6!1s0x390ce5f38957cde3:0x573e5c67ce07d2a8!8m2!3d28.5708158!4d77.287928!16s%2Fg%2F11ql65ls0c!19sChIJ481XifPlDDkRqNIHzmdcPlc?authuser=0&hl=en&rclk=1,"28.5708158,77.287928"
Masjid e Mustafa,Mosque,"X3W3+5P9 Masjid e Mustafa, near camp, Mustafa Nagar, Manvi, Karnataka 584123",Mustafa Nagar,"X3W3+5P9, near camp",Manvi,584123,Karnataka,IN,https://www.google.com/maps/place/Masjid+e+Mustafa/data=!4m7!3m6!1s0x3bb7d054e2df0e9f:0x2e9b71af583ed01!8m2!3d15.9954099!4d77.0543576!16s%2Fg%2F11b73knrs4!19sChIJnw7f4lTQtzsRAe2D9Rq36QI?authuser=0&hl=en&rclk=1,"15.995409899999999,77.0543576"
Mehbube Ilahi Masjid msjd mHbwbi lhy,Mosque,"Mehbube Ilahi Masjid msjd mHbwbi lhy, 200, Gali Number 12, Block G, Talimabad, Sangam Vihar, New Delhi, Delhi 110044","Block G, Talimabad, Sangam Vihar","200, Gali Number 12",New Delhi,110044,Delhi,IN,https://www.google.com/maps/place/Mehbube+Ilahi+Masjid+%D9%85%D8%B3%D8%AC%D8%AF+%D9%85%D8%AD%D8%A8%D9%88%D8%A8%D9%90+%D8%A7%D9%84%D9%B0%DB%81%DB%8C%E2%80%AD/data=!4m7!3m6!1s0x390ce11192f7083f:0xae0dbbdbeca67b2c!8m2!3d28.5053455!4d77.2535063!16s%2Fg%2F11c618mbkp!19sChIJPwj3khHhDDkRLHum7Nu7Da4?authuser=0&hl=en&rclk=1,"28.505345499999997,77.2535063"
JAMA MASJID UMAR BIN KHATTAB,Mosque,"G8W3+XWV JAMA MASJID UMAR BIN KHATTAB, Kalindi Kunj Rd, Block H, Jamia Nagar, Okhla, New Delhi, Delhi 110025","Block H, Jamia Nagar, Okhla","G8W3+XWV, Kalindi Kunj Rd",New Delhi,110025,Delhi,IN,https://www.google.com/maps/place/JAMA+MASJID+UMAR+BIN+KHATTAB/data=!4m7!3m6!1s0x390ce51eb7ea0bfd:0xe968824c610cc265!8m2!3d28.5474867!4d77.3047909!16s%2Fg%2F11h7p6jtqd!19sChIJ_Qvqtx7lDDkRZcIMYUyCaOk?authuser=0&hl=en&rclk=1,"28.5474867,77.3047909"
Masjid E Bilal,Mosque,"X3W5+HQ9 Masjid E Bilal, Manvi, Karnataka 584123",,X3W5+HQ9,Manvi,584123,Karnataka,IN,https://www.google.com/maps/place/Masjid+E+Bilal/data=!4m7!3m6!1s0x3bb7d1aa57a5052d:0x220eb295d9f4537b!8m2!3d15.9964076!4d77.05949!16s%2Fg%2F11c5h3d17k!19sChIJLQWlV6rRtzsRe1P02ZWyDiI?authuser=0&hl=en&rclk=1,"15.9964076,77.05949"
Jamiya Masjid,Mosque,"X2QX+MF7 Jamiya Masjid, Khazipura, Manvi, Karnataka 584123",Khazipura,X2QX+MF7,Manvi,584123,Karnataka,IN,https://www.google.com/maps/place/Jamiya+Masjid/data=!4m7!3m6!1s0x3bb7d051a64fffff:0xfb9642fc4a130f70!8m2!3d15.9891694!4d77.0486657!16s%2Fg%2F11bw1wjp34!19sChIJ__9PplHQtzsRcA8TSvxClvs?authuser=0&hl=en&rclk=1,"15.9891694,77.0486657"
"Akbari Masjid, Manvi",Mosque,"X2XV+279 Akbari Masjid, Manvi, Manvi, Karnataka 584123",,X2XV+279,Manvi,584123,Karnataka,IN,"https://www.google.com/maps/place/Akbari+Masjid,+Manvi/data=!4m7!3m6!1s0x3bb7d05875a95de1:0xac31ce13afe8646c!8m2!3d15.9975367!4d77.0432278!16s%2Fg%2F11c1qb0qk4!19sChIJ4V2pdVjQtzsRbGTorxPOMaw?authuser=0&hl=en&rclk=1","15.9975367,77.0432278"
JAMA MASJID-jaamaa msjid,Mosque,"X35M+VWW JAMA MASJID-jaamaa msjid, Umri, Haryana 122108",,X35M+VWW,Umri,122108,Haryana,IN,https://www.google.com/maps/place/JAMA+MASJID-%E0%A4%9C%E0%A4%BE%E0%A4%AE%E0%A4%BE+%E0%A4%AE%E0%A4%B8%E0%A5%8D%E0%A4%9C%E0%A4%BF%E0%A4%A6/data=!4m7!3m6!1s0x3972d12b880a433b:0x3960a149517f8570!8m2!3d27.9597357!4d77.084836!16s%2Fg%2F11gjw0bqyn!19sChIJO0MKiCvRcjkRcIV_UUmhYDk?authuser=0&hl=en&rclk=1,"27.9597357,77.084836"
Masjid,Mosque,"H77Q+868 Masjid, Okhla Village, Okhla, New Delhi, Delhi 110025","Okhla Village, Okhla",H77Q+868,New Delhi,110025,Delhi,IN,https://www.google.com/maps/place/Masjid/data=!4m7!3m6!1s0x390ce47512f7aa2b:0x544337a9b9e5d7a2!8m2!3d28.5632814!4d77.2880932!16s%2Fg%2F11gbtpj5td!19sChIJK6r3EnXkDDkRotfluak3Q1Q?authuser=0&hl=en&rclk=1,"28.563281399999997,77.28809319999999"
jama masjid madarsa taleemul quran,Mosque,"jama masjid madarsa taleemul quran, C 10, Captain Gaur Marg, C Block, Kailash Hills, East of Kailash, New Delhi, Delhi 110065","C Block, Kailash Hills, East of Kailash","C 10, Captain Gaur Marg",New Delhi,110065,Delhi,IN,https://www.google.com/maps/place/jama+masjid+madarsa+taleemul+quran/data=!4m7!3m6!1s0x390ce3bedd0d5df7:0x3a3b95b54ca809a8!8m2!3d28.5619545!4d77.2590985!16s%2Fg%2F11g7zz4m0j!19sChIJ910N3b7jDDkRqAmoTLWVOzo?authuser=0&hl=en&rclk=1,"28.5619545,77.2590985"
Ijaba Masjid,Mosque,"Ijaba Masjid, 1489/16, Block D, Chand Vihar, New Mustafabad, Delhi, 110094","Block D, Chand Vihar, New Mustafabad",1489/16,Delhi,110094,Delhi,IN,https://www.google.com/maps/place/Ijaba+Masjid/data=!4m7!3m6!1s0x390cfd4112cff819:0x124578cf76e8540b!8m2!3d28.7086594!4d77.2713446!16s%2Fg%2F11j08711wr!19sChIJGfjPEkH9DDkRC1Tods94RRI?authuser=0&hl=en&rclk=1,"28.7086594,77.27134459999999"
Mumtaz Masjid,Mosque,"H79Q+MFC Mumtaz Masjid, Batla House, Jamia Nagar, Okhla, New Delhi, Delhi 110025","Batla House, Jamia Nagar, Okhla",H79Q+MFC,New Delhi,,Delhi,IN,https://www.google.com/maps/place/Mumtaz+Masjid/data=!4m7!3m6!1s0x390ce51ea4a1764d:0x7975b3d87786376a!8m2!3d28.5691957!4d77.2886424!16s%2Fg%2F11k3j1s_k9!19sChIJTXahpB7lDDkRajeGd9izdXk?authuser=0&hl=en&rclk=1,"28.569195699999998,77.2886424"
Jama Masjid Gausul Minaar,Mosque,"Jama Masjid Gausul Minaar, I/2 Block, Gali no. 4, Ratiya Marg, Sangam Vihar, New Delhi, Delhi 110080","Block J 2, Devli, Sangam Vihar","I/2 Block, Gali no. 4, Ratiya Marg",New Delhi,110080,Delhi,IN,https://www.google.com/maps/place/Jama+Masjid+Gausul+Minaar/data=!4m7!3m6!1s0x390ce19001b828d1:0xab9c6084fdea6fad!8m2!3d28.4930325!4d77.2453168!16s%2Fg%2F11nnpythp5!19sChIJ0Si4AZDhDDkRrW_q_YRgnKs?authuser=0&hl=en&rclk=1,"28.493032499999998,77.2453168"
Juma Masjid,Mosque,"GMJ3+348 Juma Masjid, Cholas Rd, Mohalla Abbas Nagar, Chholas, Uttar Pradesh 203207",Mohalla Abbas Nagar,"GMJ3+348, Cholas Rd",Chholas,203207,Uttar Pradesh,IN,https://www.google.com/maps/place/Juma+Masjid/data=!4m7!3m6!1s0x390c942a6e349581:0xfd6322c2aa576325!8m2!3d28.5301599!4d77.6528246!16s%2Fg%2F11c52lz9x6!19sChIJgZU0biqUDDkRJWNXqsIiY_0?authuser=0&hl=en&rclk=1,"28.530159899999997,77.6528246"
Masjid,Mosque,"P5W6+H22 Masjid, Block E, Bhalswa Dairy, Shradhanand Colony, Delhi, 110042","Block E, Bhalswa Dairy, Shradhanand Colony",P5W6+H22,Delhi,110042,Delhi,IN,https://www.google.com/maps/place/Masjid/data=!4m7!3m6!1s0x390d01b03be012cd:0x88a958d17e8b79aa!8m2!3d28.746384!4d77.160011!16s%2Fg%2F12jsc4f0x!19sChIJzRLgO7ABDTkRqnmLftFYqYg?authuser=0&hl=en&rclk=1,"28.746384,77.160011"
Sunni Jama Masjid,Mosque,"338M+VMF Sunni Jama Masjid, Gundbas, Haryana 122107",,338M+VMF,Gundbas,122107,Haryana,IN,https://www.google.com/maps/place/Sunni+Jama+Masjid/data=!4m7!3m6!1s0x390d2d6b83a1c535:0x1e2f6bbb827764b1!8m2!3d28.0671939!4d77.0841839!16s%2Fg%2F11gmyt_r28!19sChIJNcWhg2stDTkRsWR3grtrLx4?authuser=0&hl=en&rclk=1,"28.0671939,77.0841839"
Macca Masjid,Mosque,"225P+R72 Macca Masjid, Manvi, Karnataka 584123",,225P+R72,Manvi,584123,Karnataka,IN,https://www.google.com/maps/place/Macca+Masjid/data=!4m7!3m6!1s0x3bb7d1c0498615d7:0xf7828726b3bbca5c!8m2!3d16.0095!4d77.03563!16s%2Fg%2F11h7fz5bnw!19sChIJ1xWGScDRtzsRXMq7syaHgvc?authuser=0&hl=en&rclk=1,"16.0095,77.03563"
Munwara Masjid,Mosque,"Munwara Masjid, E-130, Gali No.6, Third Pusta Main Rd, Jagjeet Nagar, Delhi, 110053","Third Pushta, Nayagaon, Jagjeet Nagar, Shahdara","E-130, Gali No.6, Third Pusta Main Rd",Delhi,110053,Delhi,IN,https://www.google.com/maps/place/Munwara+Masjid/data=!4m7!3m6!1s0x390cfc44ec3cee7b:0x6817d8194e44c0a7!8m2!3d28.6861966!4d77.2559837!16s%2Fg%2F12hq6qdwg!19sChIJe-487ET8DDkRp8BEThnYF2g?authuser=0&hl=en&rclk=1,"28.6861966,77.2559837"
Mosque,Mosque,"M37C+GJH Mosque, Namdhari Colony, Nangloi, Delhi, 110041","Namdhari Colony, Nangloi",M37C+GJH,Delhi,110041,Delhi,IN,https://www.google.com/maps/place/Mosque/data=!4m7!3m6!1s0x390d045ba7f78363:0xde71ce55983884c9!8m2!3d28.6638203!4d77.0716037!16s%2Fg%2F11c30q6vd3!19sChIJY4P3p1sEDTkRyYQ4mFXOcd4?authuser=0&hl=en&rclk=1,"28.663820299999998,77.0716037"
Jama masjid pashchim tola majgawan,Mosque,"G7XW+HWR Jama masjid pashchim tola majgawan, Majgawan Rusabari road, Block A, Okhla, New Delhi, Delhi 854330","Block A, Okhla","G7XW+HWR, Majgawan Rusabari road",New Delhi,854330,Delhi,IN,https://www.google.com/maps/place/Jama+masjid+pashchim+tola+majgawan/data=!4m7!3m6!1s0x390ce5c344741e49:0x19361e47376049f7!8m2!3d28.5489767!4d77.2972779!16s%2Fg%2F11rbkss609!19sChIJSR50RMPlDDkR90lgN0ceNhk?authuser=0&hl=en&rclk=1,"28.548976699999997,77.2972779"
Masjid,Mosque,"Masjid, Generator section LNH, Maulana Azad Medical College Campus, LNJP Colony, New Delhi, Delhi, 110002","Maulana Azad Medical College Campus, LNJP Colony",Generator section LNH,"New Delhi, Delhi",110002,Delhi,IN,https://www.google.com/maps/place/Masjid/data=!4m7!3m6!1s0x390cfda80d3a142f:0x7e63ba6e21dc1e97!8m2!3d28.6378466!4d77.2379581!16s%2Fg%2F11ss881009!19sChIJLxQ6Daj9DDkRlx7cIW66Y34?authuser=0&hl=en&rclk=1,"28.6378466,77.2379581"
ckNddii vaalaa piir,Mosque,"M66M+8PW ckNddii vaalaa piir, Shahpur, Punjab 147301",,M66M+8PW,Shahpur,147301,Punjab,IN,https://www.google.com/maps/place/%E0%A8%9A%E0%A8%95%E0%A9%B0%E0%A8%A1%E0%A9%80+%E0%A8%B5%E0%A8%BE%E0%A8%B2%E0%A8%BE+%E0%A8%AA%E0%A9%80%E0%A8%B0/data=!4m7!3m6!1s0x391011e9544416d3:0xc2580b06535bc6cc!8m2!3d30.6608515!4d76.2343307!16s%2Fg%2F11j48837vs!19sChIJ0xZEVOkREDkRzMZbUwYLWMI?authuser=0&hl=en&rclk=1,"30.6608515,76.2343307"
Quba Masjid,Mosque,"X2WX+Q3H Quba Masjid, Islam Nagar, chirag Ali colony, Mehdi Nagar, Manvi, Karnataka 584123",Mehdi Nagar,"X2WX+Q3H, Islam Nagar, chirag Ali colony",Manvi,584123,Karnataka,IN,https://www.google.com/maps/place/Quba+Masjid/data=!4m7!3m6!1s0x3bb7d160a4666c55:0x78fddfc3d210780b!8m2!3d15.9965518!4d77.0474281!16s%2Fg%2F11fl45r66l!19sChIJVWxmpGDRtzsRC3gQ0sPf_Xg?authuser=0&hl=en&rclk=1,"15.996551799999999,77.04742809999999"
Mahond Masjid,Mosque,"VP6M+25G Mahond Masjid, Nagaliya, Rajasthan 301405",,VP6M+25G,Nagaliya,301405,Rajasthan,IN,https://www.google.com/maps/place/Mahond+Masjid/data=!4m7!3m6!1s0x3972b15c8545c399:0x5da255ab4632c6b7!8m2!3d27.8600744!4d76.7329383!16s%2Fg%2F11ny1yfpnb!19sChIJmcNFhVyxcjkRt8YyRqtVol0?authuser=0&hl=en&rclk=1,"27.8600744,76.7329383"
Jama masjid,Mosque,"Jama masjid, Jama Masjid, Abul Fazal Enclave Part 1, Part 1 Abul Fazal Enclave, Block I, Jamia Nagar, Chandni Chowk, New Delhi, Delhi 110025","Abul Fazal Enclave Part 1, Part 1 Abul Fazal Enclave, Block I, Jamia Nagar, Chandni Chowk",Jama Masjid,New Delhi,,Delhi,IN,https://www.google.com/maps/place/Jama+masjid/data=!4m7!3m6!1s0x390ce542b18bb9c1:0xcacf2517b90d6255!8m2!3d28.5545167!4d77.2972904!16s%2Fg%2F11kqc0mn0x!19sChIJwbmLsULlDDkRVWINuRclz8o?authuser=0&hl=en&rclk=1,"28.554516699999997,77.2972904"
Masjid,Mosque,"Masjid, 8/2, Budh Bazar, Block L 1, Devli, Sangam Vihar, New Delhi, Delhi 110062","Budh Bazar, Block L 1, Devli, Sangam Vihar",8/2,New Delhi,110062,Delhi,IN,https://www.google.com/maps/place/Masjid/data=!4m7!3m6!1s0x390ce1dde82b3bc3:0x4d3537cacd38aec4!8m2!3d28.4940769!4d77.2261653!16s%2Fg%2F11rk33_10p!19sChIJwzsr6N3hDDkRxK44zco3NU0?authuser=0&hl=en&rclk=1,"28.4940769,77.22616529999999"
