name,main_category,address,address_ward,address_street,address_city,address_postal_code,address_state,address_country_code,link,coordinates
Mohommdi masjid,Mosque,"gali no 17Dariy, Mohommdi masjid, Prem Vihar Nagali, A-31, Prem Vihar Colony, Ghasipura, Nangli Vihar, Delhi, 110043","Prem Vihar Colony, Ghasipura, Nangli Vihar","gali no 17Dariy, Prem Vihar Nagali, A-31",Delhi,110043,Delhi,IN,https://www.google.com/maps/place/Mohommdi+masjid/data=!4m7!3m6!1s0x390d05caf0ec8929:0x16273277b0fd0b7e!8m2!3d28.6253681!4d77.0186624!16s%2Fg%2F11q3n7zwcr!19sChIJKYns8MoFDTkRfgv9sHcyJxY?authuser=0&hl=en&rclk=1,"28.6253681,77.0186624"
Jama masjid,Mosque,"G7PG+8H3 Jama masjid, F Block, Pocket X, Okhla Phase II, Okhla Industrial Estate, New Delhi, Delhi 110020","F Block, Pocket X, Okhla Phase II, Okhla Industrial Estate",G7PG+8H3,New Delhi,,Delhi,IN,https://www.google.com/maps/place/Jama+masjid/data=!4m7!3m6!1s0x390ce10bb81649c7:0xebcbe96019fd666b!8m2!3d28.5357628!4d77.2764329!16s%2Fg%2F11v0nr84ms!19sChIJx0kWuAvhDDkRa2b9GWDpy-s?authuser=0&hl=en&rclk=1,"28.535762799999997,77.2764329"
JAMA MASJID jm` msjd,Mosque,"JAMA MASJID jm` msjd, JAMIA TUL ABRAR, AL ISLAMIA, Madanpur Khadar Phase 3, Madanpur Khadar, New Delhi, Delhi 110076","Madanpur Khadar Phase 3, Madanpur Khadar","JAMIA TUL ABRAR, AL ISLAMIA",New Delhi,110076,Delhi,IN,https://www.google.com/maps/place/JAMA+MASJID+%D8%AC%D8%A7%D9%85%D8%B9+%D9%85%D8%B3%D8%AC%D8%AF%E2%80%AD/data=!4m7!3m6!1s0x390ce7a4c5ffc659:0x83d8ecc557f86b97!8m2!3d28.5270399!4d77.3257331!16s%2Fg%2F11krrd17t2!19sChIJWcb_xaTnDDkRl2v4V8Xs2IM?authuser=0&hl=en&rclk=1,"28.5270399,77.3257331"
Maann Masjid,Mosque,"Maann Masjid, 351, Shahzada Bagh, Phase 1, Shivaji Nagar, Inderlok, Delhi, 110035","Shahzada Bagh, Phase 1, Shivaji Nagar, Inderlok",351,Delhi,110035,Delhi,IN,https://www.google.com/maps/place/Maann+Masjid/data=!4m7!3m6!1s0x390d03624b23ed19:0x5fd68d5b45b206f9!8m2!3d28.6706058!4d77.168636!16s%2Fg%2F11ssxng_ck!19sChIJGe0jS2IDDTkR-QayRVuN1l8?authuser=0&hl=en&rclk=1,"28.670605799999997,77.16863599999999"
Mosque Juma 1:30 PM,Mosque,"Mosque Juma 1:30 PM, hamdard dawakhana, 1559, Gali Qasim Jan, Bazar Sirkiwalan, Lal Kuan Bazar, Chandni Chowk, Old, Delhi, 110006","Bazar Sirkiwalan, Lal Kuan Bazar, Chandni Chowk","hamdard dawakhana, 1559, Gali Qasim Jan","Old, Delhi",110006,Delhi,IN,https://www.google.com/maps/place/Mosque+Juma+1:30+PM/data=!4m7!3m6!1s0x390cfd60299c2229:0x108754ccb5a64171!8m2!3d28.6529342!4d77.2234484!16s%2Fg%2F11mhpb1635!19sChIJKSKcKWD9DDkRcUGmtcxUhxA?authuser=0&hl=en&rclk=1,"28.652934199999997,77.2234484"
Macca Mosque,Mosque,"P77H+GF7 Macca Mosque, Indra Vihar II, Phase 2, Indra Vihar, New Mustafabad, Delhi, 110094","Indra Vihar II, Phase 2, Indra Vihar, New Mustafabad",P77H+GF7,Delhi,110094,Delhi,IN,https://www.google.com/maps/place/Macca+Mosque/data=!4m7!3m6!1s0x390cfd1cdd6e2db3:0x46a4e9bdb1f8bcf!8m2!3d28.7137923!4d77.2786826!16s%2Fg%2F11ss8d47ls!19sChIJsy1u3Rz9DDkRz4sf25tOagQ?authuser=0&hl=en&rclk=1,"28.713792299999998,77.2786826"
Jamete islami Markaz Masjid,Mosque,"H73W+G6F Jamete islami Markaz Masjid, Abul Fazal Enclave Part 2, Jamia Nagar, Okhla, New Delhi, Delhi 110025","Abul Fazal Enclave Part 2, Jamia Nagar, Okhla",H73W+G6F,New Delhi,110025,Delhi,IN,https://www.google.com/maps/place/Jamete+islami+Markaz+Masjid/data=!4m7!3m6!1s0x390ce584b6f10bd5:0xdadc52adbd2e5235!8m2!3d28.5538228!4d77.2955576!16s%2Fg%2F11t061tn1_!19sChIJ1QvxtoTlDDkRNVIuva1S3No?authuser=0&hl=en&rclk=1,"28.5538228,77.2955576"
Masjid,Mosque,"Masjid, L385, Block L, JJ Colony No 3, Nangloi, New Delhi, Delhi, 110041","Block L, JJ Colony No 3, Nangloi",L385,"New Delhi, Delhi",110041,Delhi,IN,https://www.google.com/maps/place/Masjid/data=!4m7!3m6!1s0x390d0530462f99ad:0xf47aa8290ce093fa!8m2!3d28.6842352!4d77.0742041!16s%2Fg%2F11smtj7p27!19sChIJrZkvRjAFDTkR-pPgDCmoevQ?authuser=0&hl=en&rclk=1,"28.6842352,77.0742041"
Masjid,Mosque,"Shop No: 5035, Masjid, Netaji Subhash Marg, Daryaganj, New Delhi, Delhi, 110002",Daryaganj,"Shop No: 5035, Netaji Subhash Marg","New Delhi, Delhi",110002,Delhi,IN,https://www.google.com/maps/place/Masjid/data=!4m7!3m6!1s0x390cfdf175041b95:0x8ef57a2bc9f92c1c!8m2!3d28.6480954!4d77.2403964!16s%2Fg%2F11s664lvxh!19sChIJlRsEdfH9DDkRHCz5ySt69Y4?authuser=0&hl=en&rclk=1,"28.6480954,77.2403964"
Manvi Food Point,Health food restaurant,"976J+PRW Manvi Food Point, Parvatiya Colony, Masjid Area, Faridabad, Haryana 121005","Parvatiya Colony, Masjid Area",976J+PRW,Faridabad,121005,Haryana,IN,https://www.google.com/maps/place/Manvi+Food+Point/data=!4m7!3m6!1s0x390cdfe7dae2ebf5:0xf44a0587083b7a2f!8m2!3d28.3618672!4d77.2820726!16s%2Fg%2F11ff220t0k!19sChIJ9evi2uffDDkRL3o7CIcFSvQ?authuser=0&hl=en&rclk=1,"28.3618672,77.28207259999999"
Jamma masjid,Mosque,"HQ59+3WX Jamma masjid, Jirawathi, Uttar Pradesh 203408",,HQ59+3WX,Jirawathi,203408,Uttar Pradesh,IN,https://www.google.com/maps/place/Jamma+masjid/data=!4m7!3m6!1s0x390c99526476ed3d:0x5de5662fa55d031c!8m2!3d28.5577562!4d77.7699092!16s%2Fg%2F11rxklwtgy!19sChIJPe12ZFKZDDkRHANdpS9m5V0?authuser=0&hl=en&rclk=1,"28.5577562,77.7699092"
Muhammadi Masjid,Mosque,"X83J+M54 Muhammadi Masjid, Doula, Uttar Pradesh 250601",,X83J+M54,Doula,,Uttar Pradesh,IN,https://www.google.com/maps/place/Muhammadi+Masjid/data=!4m7!3m6!1s0x390c5165cda04179:0x8a28a68c1e7c24dc!8m2!3d28.954127!4d77.3304419!16s%2Fg%2F11t_k7s1n1!19sChIJeUGgzWVRDDkR3CR8HoymKIo?authuser=0&hl=en&rclk=1,"28.954127,77.3304419"
